title,company,location,description,salary_min,salary_max,contract_type,created,redirect_url,category,specialty,source_country,query,query_type,remote_friendly,international
"Conducteur(rice) travaux réhabilitation sociale, expérimenté(e) - Habitat Social",Mobyclic,US,"Informations générales Entité de rattachement Avec 32 400 collaborateurs intervenant dans 60 pays, Bouygues Construction conçoit, réalise, et réhabilite les infrastructures et les bâtiments essentiels pour une société durable. Partout dans le monde, les équipes accompagnent le développement des infrastructures de productions d'énergies et de transports publics bas carbone et apportent leur expertise dans la conception, la construction et la réhabilitation des bâtiments et quartiers essentiels à…",62780,62780,,2025-04-19T01:41:26Z,https://www.adzuna.com/details/5152794999?utm_medium=api&utm_source=e1ad5111,Trade & Construction Jobs,ingénieur civil,us,ingénieur civil,standard,False,False
"Conducteur(rice) travaux réhabilitation sociale, expérimenté(e) - Habitat Social",Groupe Bouygues,US,"Informations générales Entité de rattachement Avec 32 400 collaborateurs intervenant dans 60 pays, Bouygues Construction conçoit, réalise, et réhabilite les infrastructures et les bâtiments essentiels pour une société durable. Partout dans le monde, les équipes accompagnent le développement des infrastructures de productions d'énergies et de transports publics bas carbone et apportent leur expertise dans la conception, la construction et la réhabilitation des bâtiments et quartiers essentiels à…",70073.97,70073.97,,2025-04-17T23:07:47Z,https://www.adzuna.com/details/5150964709?utm_medium=api&utm_source=e1ad5111,Trade & Construction Jobs,ingénieur civil,us,ingénieur civil,standard,False,False
"Responsable travaux confirmé(e), Patron(ne) de chantier Habitat/TCE H/F",Groupe Bouygues,US,"Informations générales Entité de rattachement Avec 32 400 collaborateurs intervenant dans 60 pays, Bouygues Construction conçoit, réalise, et réhabilite les infrastructures et les bâtiments essentiels pour une société durable. Partout dans le monde, les équipes accompagnent le développement des infrastructures de productions d'énergies et de transports publics bas carbone et apportent leur expertise dans la conception, la construction et la réhabilitation des bâtiments et quartiers essentiels à…",63984.9,63984.9,,2025-03-23T20:41:10Z,https://www.adzuna.com/details/5108213375?utm_medium=api&utm_source=e1ad5111,Trade & Construction Jobs,ingénieur civil,us,ingénieur civil,standard,False,False
"Responsable travaux confirmé(e), Patron(ne) de chantier Habitat/TCE H/F",Mobyclic,US,"Informations générales Entité de rattachement Avec 32 400 collaborateurs intervenant dans 60 pays, Bouygues Construction conçoit, réalise, et réhabilite les infrastructures et les bâtiments essentiels pour une société durable. Partout dans le monde, les équipes accompagnent le développement des infrastructures de productions d'énergies et de transports publics bas carbone et apportent leur expertise dans la conception, la construction et la réhabilitation des bâtiments et quartiers essentiels à…",57323.49,57323.49,,2025-03-23T19:34:56Z,https://www.adzuna.com/details/5108177144?utm_medium=api&utm_source=e1ad5111,Trade & Construction Jobs,ingénieur civil,us,ingénieur civil,standard,False,False
"Responsable travaux réhabilitation en sites occupés (93, 95) H/F",Groupe Bouygues,US,"Informations générales Entité de rattachement Avec 32 400 collaborateurs intervenant dans 60 pays, Bouygues Construction conçoit, réalise, et réhabilite les infrastructures et les bâtiments essentiels pour une société durable. Partout dans le monde, les équipes accompagnent le développement des infrastructures de productions d'énergies et de transports publics bas carbone et apportent leur expertise dans la conception, la construction et la réhabilitation des bâtiments et quartiers essentiels à…",65014.84,65014.84,,2025-03-23T22:23:54Z,https://www.adzuna.com/details/5108261451?utm_medium=api&utm_source=e1ad5111,Trade & Construction Jobs,ingénieur civil,us,ingénieur civil,standard,False,False
"Responsable travaux réhabilitation en sites occupés (93, 95) H/F",Mobyclic,US,"Informations générales Entité de rattachement Avec 32 400 collaborateurs intervenant dans 60 pays, Bouygues Construction conçoit, réalise, et réhabilite les infrastructures et les bâtiments essentiels pour une société durable. Partout dans le monde, les équipes accompagnent le développement des infrastructures de productions d'énergies et de transports publics bas carbone et apportent leur expertise dans la conception, la construction et la réhabilitation des bâtiments et quartiers essentiels à…",58265.59,58265.59,,2025-03-25T19:53:13Z,https://www.adzuna.com/details/5111398293?utm_medium=api&utm_source=e1ad5111,Trade & Construction Jobs,ingénieur civil,us,ingénieur civil,standard,False,False
Senior HVDC Application Engineer,GE Vernova,"Fox Valley Facility, DuPage County",Job Description Summary The Senior HVDC Application Engineer is an established leader in their respective engineering team. He or she drives business strategy through detailed technical and economic understanding of the marketplace and takes the initiative to drive business leaders to provide customers with the best solutions that positively impact business. The Senior HVDC Application Engineer Serve as the technological point person for the business for the entire Inquiry to Order (ITO) phase.…,69235.66,69235.66,,2025-03-11T09:39:11Z,https://www.adzuna.com/details/5087078039?utm_medium=api&utm_source=e1ad5111,Engineering Jobs,ingénieur civil,us,ingénieur civil,standard,False,False
Ingénieur Génie Civil H/F,Aldebaran Group,"Pyrénées-Atlantiques, Nouvelle-Aquitaine","Ingénieur Génie Civil - ref. JOB-1328 Récapitulatif Prêt à relever des défis passionnants dans le domaine de l'Energie ? Nous recherchons un ingénieur génie civil (et structure) pour intervenir sur des projets de processus de production de gaz ou fluides dans le domaine des énergies. Vous assurez la conception, la validation et le suivi des études de génie civil afin de garantir la conformité technique et réglementaire des infrastructures. Vos missions * Contribuer à la définition et à la réali…",60000,80000,,2025-04-29T05:50:35Z,https://www.adzuna.fr/land/ad/5167804375?se=mOwBtPAo8BGDGO_HSiZXLA&utm_medium=api&utm_source=e1ad5111&v=2AED17DEE10EFD85276E662D57B6E36AE5C01750,Unknown,ingénieur civil,fr,ingénieur civil,standard,False,False
Ingénieur Génie Civil H/F,Assystem,"Rhône, Auvergne-Rhône-Alpes","Votre future équipe Sous la responsabilité de Ha, Pilote Technique, vous rejoignez l'équipe Génie Civil qui relève le défi de notre époque : le projet EPR2 ! Vos missions Explorez l'ingénierie nucléaire d'EDF, menée par Edvance pour le projet EPR2 et portée par Assystem au sein de l'équipe Mécanique/GC. En tant qu'Ingénieur(e) Génie Civil, vous concevez, analysez et supervisez la construction de structures nécessaires aux installations nucléaires, garantissant leur sûreté et leur durabilité. Vo…",,,,2025-05-03T07:04:35Z,https://www.adzuna.fr/land/ad/5177914532?se=mOwBtPAo8BGDGO_HSiZXLA&utm_medium=api&utm_source=e1ad5111&v=927E994684FC4EAAF09647668152DB2074310913,Unknown,ingénieur civil,fr,ingénieur civil,standard,False,False
Ingénieur Génie Civil (H/F),PRIME ENGINEERING,"Provence-Alpes-Côte d'Azur, France","Prime Engineering est une société de conseil en management de projet et en ingénierie. Créée en 2013, nous intervenons dans les métiers de l’Energie, des Industries, des Infrastructures de transport et du Bâtiment. Fort de notre croissance nous souhaitons renforcer notre Prime Team, qui compte plus de 700 collaborateurs répartis sur nos 9 agences ! Labélisée « Great Place To Work » depuis 2016, Prime Engineering représente aujourd’hui l’un des acteurs majeurs du conseil opérationnel en ingénier…",,,,2025-04-11T05:27:21Z,https://www.adzuna.fr/land/ad/5139961357?se=mOwBtPAo8BGDGO_HSiZXLA&utm_medium=api&utm_source=e1ad5111&v=42F2D6760A4FE6A9954429625215D15E9DBD3F4E,Unknown,ingénieur civil,fr,ingénieur civil,standard,False,False
Ingénieur génie civil H/F,ALDEBARAN GROUP,"Billère, Pau","ALDEBARAN GROUP Aldebaran Group intervient dans l'Energie et les infrastructures, accompagnant ses clients en France et à l'étranger. L'entreprise aide les clients qui s'engagent à réduire leur impact carbone et environnemental dans les années à venir, en visant à atteindre le zéro net au plus tôt. De même, nous recrutons les meilleurs ingénieurs et managers qui aideront notre client à avancer dans cette direction le plus tôt possible. Cela ne nous limite pas à recruter des spécialistes de l'en…",80000,80000,permanent,2025-05-03T04:20:47Z,https://www.adzuna.fr/land/ad/5177699359?se=mOwBtPAo8BGDGO_HSiZXLA&utm_medium=api&utm_source=e1ad5111&v=33A56E49CAD6CAB8B13B4E029A8524CAFB313DAA,Unknown,ingénieur civil,fr,ingénieur civil,standard,False,False
Ingénieur Génie Civil - Géotechnique H/F,ACXES,"Saint-Cyr-sur-Loire, Tours","ACXES, filiale du groupe Ingérop présent dans l'assistance technique propose un poste de Ingénieur Génie civil / Géotechnique (F/H) pour intervenir dans nos activités nucléaires. Le poste est à pourvoir à Tours. Afin de renforcer nos équipes sur le projet nucléaire, nous ouvrons un poste de Ingénieur Génie civil / Géotechnique en octobre 2025. En appui à la surveillance des études, vous réaliserez les missions suivantes : - La réalisation des études de conception et d'exécution géotechniques su…",40000,46000,,2025-04-02T15:21:41Z,https://www.adzuna.fr/land/ad/5124159548?se=mOwBtPAo8BGDGO_HSiZXLA&utm_medium=api&utm_source=e1ad5111&v=AA8AD5259C03CF8C4585A7720496873A99618B6F,Emplois Informatique,ingénieur civil,fr,ingénieur civil,standard,False,False
Ingenieur Genie Civil Structure H/F,EFOR GROUP,"Rhône, Auvergne-Rhône-Alpes","Convaincus des apports technologiques et méthodologiques d'autres secteurs reconnus pour leur culture de l'innovation et de performance industrielle, nous continuons de soutenir et de renforcer notre activité « Global Industries » en intervenant auprès d'acteurs importants de l'industrie de produits et de procédés. Dans le cadre de notre développement d'activité, nous recherchons un(e) INGENIEUR(E) GENIE CIVIL STRUCTURE (H/F) Rattaché(e) aux opérations techniques, vous êtes en charge de la gest…",37000,45000,,2025-02-04T19:23:08Z,https://www.adzuna.fr/land/ad/5036934743?se=mOwBtPAo8BGDGO_HSiZXLA&utm_medium=api&utm_source=e1ad5111&v=0A4681B3279FA7F958E37669104E1A78234CE6D7,Emplois Informatique,ingénieur civil,fr,ingénieur civil,standard,False,True
Alternance - Ingénieur Génie Civil - Bim H/F,Edvance,"4ème-Arrondissement, Lyon","Le service Génie civil et Bâtiment (GCB) d'Edvance constitue le pôle de compétences techniques pour les domaines Génie civil et coordination technique des bâtiments. Il contribue à l'ensemble des projets du nucléaire neuf en France et à l'international. Ce que nous pouvons accomplir ensemble : Au sein du service GCB, vous serez intégré(e) dans le groupe en charge du déploiement de la stratégie du BIM pour les différents projets EPR vis-à-vis des activités des fournisseurs externes. Le contexte …",1400,1800,,2025-05-04T05:58:12Z,https://www.adzuna.fr/land/ad/5179740523?se=mOwBtPAo8BGDGO_HSiZXLA&utm_medium=api&utm_source=e1ad5111&v=3C01C24DE750562F2070D551962B61E63EBE9F66,Unknown,ingénieur civil,fr,ingénieur civil,standard,False,True
Ingénieur Génie Civil Supervision Construction H/F,Groupe Ortec,"Envermeu, Dieppe","Pour renforcer l'équipe déjà constituée sur notre site client (76), vous nous rejoignez en tant que Ingénieur GC en supervision de construction H/F en CDI. Pour cela, vos missions principales sont : - Préparer les travaux - Piloter et coordonner les plans de surveillance - Suivre et piloter les plans d'actions des entreprises de travaux selon le planning établi et en interface avec les services du client - Assurer la performance des travaux - Evaluer les titulaires - Suivre et participer à la g…",,,,2025-04-02T15:21:42Z,https://www.adzuna.fr/land/ad/5124159691?se=mOwBtPAo8BGDGO_HSiZXLA&utm_medium=api&utm_source=e1ad5111&v=14E25A940EFB2BB590516F9A1842E7CBF38F7E7C,Unknown,ingénieur civil,fr,ingénieur civil,standard,False,False
Ingénieur génie civil H/F,Aldebaran Group,"Pau-Est, Pau","ALDEBARAN GROUP Aldebaran Group intervient dans l'Energie et les infrastructures, accompagnant ses clients en France et à l'étranger. L'entreprise aide les clients qui s'engagent à réduire leur impact carbone et environnemental dans les années à venir, en visant à atteindre le zéro net au plus tôt. De même, nous recrutons les meilleurs ingénieurs et managers qui aideront notre client à avancer dans cette direction le plus tôt possible. Cela ne nous limite pas à recruter des spécialistes de l'en…",80000,80000,permanent,2025-05-01T04:08:24Z,https://www.adzuna.fr/land/ad/5171633162?se=mOwBtPAo8BGDGO_HSiZXLA&utm_medium=api&utm_source=e1ad5111&v=B4AEB3171FBD3312D834398CD8A1CA24E66ADBBA,Unknown,ingénieur civil,fr,ingénieur civil,standard,False,False
Ingénieur Génie Civil - Projets - Etudes - Travaux H/F,SITES,"Saint-Cyr-sur-Loire, Tours","Dans le cadre du développement de projets nucléaire de nouvelle génération (EPR2, SMR), nous renforçons nos équipes en ingénierie pour accompagner nos clients dans la construction de ces installations stratégiques. Nous recherchons des ingénieurs passionnés pour intervenir sur les phases d'études, de suivi et de pilotage des travaux de génie civil : terrassement, géotechnique, VRD, second oeuvre Votre mission : En immersion au sein des équipes techniques du client, vous serez un acteur clé de l…",35000,40000,,2025-04-26T06:04:01Z,https://www.adzuna.fr/land/ad/5163429503?se=mOwBtPAo8BGDGO_HSiZXLA&utm_medium=api&utm_source=e1ad5111&v=7BB31C3A42AF90934D25A2769DDF25C3B3841F8B,Emplois Informatique,ingénieur civil,fr,ingénieur civil,standard,False,False
Ingenieur Genie Civil H/F,asap.work,"Pierrelatte, Nyons","Nous recherchons un Ingénieur Génie Civil (H/F) sur Rouen. Tu interviendras sur divers types d'ouvrages, neufs ou à réhabiliter, au sein de notre pôle Génie Civil. Tes futures missions : - Élaborer et vérifier des documents techniques (études de faisabilité, avant-projets). - Procéder aux calculs de prédimensionnement manuels ou assistés par ordinateur. - Dimensionner et rédiger les notes de calculs pour des structures en béton armé ou charpente métallique. - Concevoir le génie civil des ouvrag…",40000,70000,,2025-05-04T06:14:04Z,https://www.adzuna.fr/land/ad/5179747841?se=mOwBtPAo8BGDGO_HSiZXLA&utm_medium=api&utm_source=e1ad5111&v=C18EE0DD5A55383797149C66B36CAA9E80C0206D,Emplois Autres/Général,ingénieur civil,fr,ingénieur civil,standard,False,False
Ingenieur genie civil (h/f) (CDI),SUEZ,France,"Poste : Type de contrat CDI VOTRE MISSION Dans le cadre de la conception / construction de stations de traitement d’eau (eaux résiduaires urbaines, eau potable, dessalement, etc.) et de sites de traitement des déchets (centres de tri, unités de valorisation énergétiques, etc.), la Direction Ingénierie E&C recherche un : INGENIEUR GENIE CIVIL (H/F) L'Ingénieur Génie Civil contribue à la maîtrise du risque de la conception/construction en Eau comme en Déchets pour E&C et à la création d’opportuni…",,,permanent,2025-03-05T09:26:06Z,https://www.adzuna.fr/land/ad/5076265685?se=mOwBtPAo8BGDGO_HSiZXLA&utm_medium=api&utm_source=e1ad5111&v=948E8CBAB9BD0670711B7CE53B14C6648CFB8CD9,Unknown,ingénieur civil,fr,ingénieur civil,standard,False,False
Ingénieur génie civil H/F (CDI),ALDEBARAN GROUP,"Billère, Pau","ALDEBARAN GROUP Aldebaran Group intervient dans l'Energie et les infrastructures, accompagnant ses clients en France et à l'étranger. L'entreprise aide les clients qui s'engagent à réduire leur impact carbone et environnemental dans les années à venir, en visant à atteindre le zéro net au plus tôt. De même, nous recrutons les meilleurs ingénieurs et managers qui aideront notre client à avancer dans cette direction le plus tôt possible. Cela ne nous limite pas à recruter des spécialistes de l'en…",80000,80000,permanent,2025-04-26T23:56:18Z,https://www.adzuna.fr/land/ad/5164917975?se=mOwBtPAo8BGDGO_HSiZXLA&utm_medium=api&utm_source=e1ad5111&v=CB2B2A0630E855C2BE29ECAE552EB9048FE2B80A,Unknown,ingénieur civil,fr,ingénieur civil,standard,False,False
Ingénieur Génie Civil h/f - projets photovoltaïques,ELATOS,France,"DESCRIPTION ADIWATT est une société industrielle internationale entièrement dédiée à l'énergie renouvelable photovoltaïque avec deux usines de production en France et en Espagne. Spécialiste dans la transformation de l'acier, ADIWATT conçoit, produit et commercialise les systèmes d'intégration des installations PV en Europe, Afrique et Moyen-Orient pour les plus grands acteurs mondiaux de la construction ou de l'énergie. Depuis sa création en 2009, ADIWATT a généré plus de 1, 5 GW de production…",,,permanent,2025-05-01T12:24:50Z,https://www.adzuna.fr/land/ad/5172697839?se=mOwBtPAo8BGDGO_HSiZXLA&utm_medium=api&utm_source=e1ad5111&v=14FA7F3F83213E26E7C797DB700E7CAFCE57C031,Unknown,ingénieur civil,fr,ingénieur civil,standard,False,True
Ingénieur/Ingénieure Génie Civil,PRIME ENGINEERING,"Provence-Alpes-Côte d'Azur, France","Créé en 2013, Prime Engineering intervient dans le domaine de l’ingénierie et du conseil en management de projet et compte désormais plus de 700 collaborateurs répartis sur nos 10 agences (Paris, Lyon, Nantes, Lille, Aix, Bordeaux, Grenoble, Tours, Varsovie, et Toulouse) . Labélisée « Great Place To Work » depuis 2016, Prime Engineering représente aujourd’hui l’un des acteurs majeurs du conseil opérationnel en Ingénierie en France. L’équipe Prime Engineering est composée à 80% d’ingénieurs . Ch…",,,,2025-03-28T03:32:20Z,https://www.adzuna.fr/land/ad/5114760969?se=mOwBtPAo8BGDGO_HSiZXLA&utm_medium=api&utm_source=e1ad5111&v=C3BC9014C52320065E0FEE44CA195ED1368B7AD4,Unknown,ingénieur civil,fr,ingénieur civil,standard,False,False
Ingénieur Génie Civil Normes et Certification H/F,Dyka,"Hesdin, Montreuil","Nous recherchons un(e) Ingénieur(e) Génie Civil, Normes et Certification pour notre site de Sainte Austreberthe (62140). Expert(e) en génie civil, vous êtes un véritable acteur dans le maintien et l'obtention de nos certifications liées aux produits tout en respectant les exigences législatives, notamment françaises. Vos principales responsabilités : - Conseiller les équipes internes sur les questions techniques et de durabilité et anticiper avec elles les évolutions normatives ou règlementaire…",,,,2025-04-25T05:27:16Z,https://www.adzuna.fr/land/ad/5161650125?se=mOwBtPAo8BGDGO_HSiZXLA&utm_medium=api&utm_source=e1ad5111&v=C0DDAEFD5DA4129BEB3E6B5F79E193B7D21AA605,Unknown,ingénieur civil,fr,ingénieur civil,standard,False,False
Ingénieur Génie Civil Nucléaire H/F,DAVRICOURT,"Grignan, Nyons","Dans le cadre de la réalisation d'un projet en assistance technique, nous recherchons un(e) Ingénieur génie civil (nucléaire) pour l'un de nos clients du secteur de l'énergie. Vous interviendrez sur le site client situé dans la région de la Drôme. Vous aurez pour mission principale d'assurer la surveillance de la conformité des Équipements Importants pour la Protection (EIP) aux Exigences de Définition (ED). À ce titre, vos missions quotidiennes seront les suivantes : - Assurer le suivi et le c…",,,,2025-04-29T06:20:58Z,https://www.adzuna.fr/land/ad/5167845081?se=mOwBtPAo8BGDGO_HSiZXLA&utm_medium=api&utm_source=e1ad5111&v=99A5D1DAF9DAC9CE6FFB36A13C4CC7AF3D25EA94,Emplois Informatique,ingénieur civil,fr,ingénieur civil,standard,False,False
Ingénieur Génie Civil - Ingénieur Génie Civil Hydraulique en Afrique H/F,Mercato de l'emploi.,"Paris, Ile-de-France","En tant qu'Ingénieur Génie Civil ou Génie Civil Hydraulique, vous jouerez un rôle clé dans la conception, la planification et la gestion de projets complexes, en garantissant leur qualité, leur respect des délais et des coûts. Vous serez impliqué(e) dans toutes les phases du projet, de l'avant-projet à la livraison des travaux, avec un accent particulier sur la durabilité, la sécurité et l'intégration des meilleures pratiques environnementales. Vos responsabilités principales : Études technique…",,,,2025-03-26T08:37:47Z,https://www.adzuna.fr/details/5111977758?utm_medium=api&utm_source=e1ad5111,Emplois Industrie et Construction,ingénieur civil,fr,ingénieur civil,standard,False,False
Ingénieur Génie civil,Aptitude Experts,"Côte-d'Or, Bourgogne-Franche-Comté","Notre partenaire cherche un profil en assistance à maîtrise d’œuvre études pour répondre au besoin de production d’études (EP /AVP / PRO / APO / DCE / VISA) réalisées dans le métier GC quais et bâtiments avec expérience en modélisation BIM dans le secteur ferroviaire. Dans ce cadre, votre mission consiste : En phase AVP PRO : Estimation de la quantité de matériaux des éléments du projet Rédaction et élaboration des documents techniques (CCTP, DPGF, bordereaux de prix ) Étude, estimation et chif…",,,,2024-05-31T22:20:02Z,https://www.adzuna.fr/details/4715330788?utm_medium=api&utm_source=e1ad5111,Unknown,ingénieur civil,fr,ingénieur civil,standard,False,False
Ingénieur Génie Civil et Charpente H/F,Leadsen rh,"Bédarrides, Avignon","Entreprise Vous recherchez un nouveau challenge au sein d'une grande industrie du Vaucluse ? Avec la gestion de grands projets ? Aurélien, chargé de recrutement chez Leadsen-RH, vous accompagne dans votre recherche d'emploi pour vous permettre d'intégrer l'entreprise qui vous correspondra le mieux. Nous vous proposons un poste de d'Ingénieur Charpente Métallique H/F dans une industrie clé du Vaucluse. Poste Sous la responsabilité du Responsable Travaux Neufs, vous aurez un rôle stratégique dans…",45000,65000,,2025-05-03T07:12:06Z,https://www.adzuna.fr/land/ad/5177921603?se=mOwBtPAo8BGDGO_HSiZXLA&utm_medium=api&utm_source=e1ad5111&v=4C35EC4320F32B79E7F392CC390AEA2EA205F003,Emplois Autres/Général,ingénieur civil,fr,ingénieur civil,standard,False,False
Ingénieur Géotechnique Génie Civil H/F,Astron,France,"TES MISSIONS : En tant qu'Ingénieur(e) Géotechnique Génie Civil chez Astron, tu seras un acteur clé dans le développement de notre activité. Voici ce qui t'attend : - Intervenir sur les phases allant de G0 à G5. - Contribuer à des études dans le cadre de projets en cours d'exécution ou en phase de préparation d'appels d'offres. - Participer à l'élaboration de plans et dimensionnement de fondations profondes, fondations spéciales, de murs de soutènement et calcul de stabilité. - Rédiger des note…",30000,55000,,2025-04-02T15:21:42Z,https://www.adzuna.fr/land/ad/5124159655?se=mOwBtPAo8BGDGO_HSiZXLA&utm_medium=api&utm_source=e1ad5111&v=36BDC17997C2DC6481F1AE920FF79FD8FCCC88D8,Unknown,ingénieur civil,fr,ingénieur civil,standard,False,False
Ingénieur Conception Génie Civil H/F,Astron,France,"TES MISSIONS : En tant qu'Ingénieur(e) Conception Génie Civil chez Astron, tu seras un acteur clé dans le développement de notre activité. Voici ce qui t'attend : - Concevoir et développer des études en génie civil conformes aux normes et aux exigences réglementaires en vigueur (Eurocodes), - Réaliser des études de faisabilité, de conception et de calcul, - Effectuer le reporting (planification charge, suivi budget étude) en lien avec les chefs de projet et le responsable d'activité, - Particip…",35000,55000,,2025-04-02T15:21:46Z,https://www.adzuna.fr/land/ad/5124160180?se=mOwBtPAo8BGDGO_HSiZXLA&utm_medium=api&utm_source=e1ad5111&v=825152FF9F18A55B8EFD06CFE7F24E967E3D454E,Unknown,ingénieur civil,fr,ingénieur civil,standard,False,False
Ingénieur Génie Civil Confirmé H/F,Egis Groupe,"Rhône, Auvergne-Rhône-Alpes","Véritable bureau d'ingénierie tout corps d'état, les équipes E&UI gèrent, conçoivent et réalisent les projets tels que des centrales de production de chaleur et de cogénération à énergies vertueuses (Biomasse, Biogaz, Combustibles de récupération) des Centrales de Production et de stockage de froid, des stations de traitement d'eaux industrielles, des unités de valorisation énergétiques, des systèmes de récupération d'Energie fatales mais aussi des unités de traitement de déchets et des install…",,,,2025-02-04T19:23:14Z,https://www.adzuna.fr/land/ad/5036936390?se=mOwBtPAo8BGDGO_HSiZXLA&utm_medium=api&utm_source=e1ad5111&v=81709B391C3BF4FED3863F9CFB383781850B4194,Emplois Informatique,ingénieur civil,fr,ingénieur civil,standard,False,False
Ingenieur Genie Civil Ouvrages d'Art H/F,asap.work,"Saint-Ouen, Saint-Denis","Nous recherchons un INGÉNIEUR GÉNIE CIVIL OUVRAGES D'ART (H/F) pour notre client situé à Saint-Ouen-sur-Seine (93). En tant qu'expert dans le domaine des ouvrages d'art, vous jouerez un rôle crucial dans la conception, le dimensionnement et le suivi de ponts, viaducs, passerelles, et d'autres structures similaires. Ce poste exige une excellent maîtrise technique ainsi qu'une capacité à travailler efficacement en équipe et de manière autonome. Vos futures missions : - Conception et dimensionneme…",40000,55000,,2025-05-04T06:14:01Z,https://www.adzuna.fr/land/ad/5179747728?se=mOwBtPAo8BGDGO_HSiZXLA&utm_medium=api&utm_source=e1ad5111&v=752244C55D029B5236FC4DE42827A8D8A0192493,Emplois Autres/Général,ingénieur civil,fr,ingénieur civil,standard,False,False
