title,company,location,description,salary_min,salary_max,contract_type,created,redirect_url,category,specialty
"Sr Manager, DX Product Experience Management",Mars IS UK,"Eton, Windsor","Job Description: We are looking for an experienced and forward-thinking Senior Manager, Product Experiences Management to lead the strategy, development, and optimization of our product content ecosystem—powered by platforms like Salsify—to drive consistent, engaging, and conversion-ready product experiences across all digital shelves. As part of the Digital Experiences team within Mars Global Services Digital Technologies Organization, this role plays a pivotal part in modernizing how our bran…",80923.92,80923.92,,2025-04-18T02:10:00Z,https://www.adzuna.co.uk/jobs/land/ad/5150846265?se=_tnH4TEe8BGla2k9OSZXLA&utm_medium=api&utm_source=e1ad5111&v=44D995959CB969303EFCC4D212B36BBCA55098AF,IT Jobs,management
"Sr Manager, DX Product Experience Management",Mars IS UK,"Holyport, Maidenhead","Job Description: We are looking for an experienced and forward-thinking Senior Manager, Product Experiences Management to lead the strategy, development, and optimization of our product content ecosystem—powered by platforms like Salsify—to drive consistent, engaging, and conversion-ready product experiences across all digital shelves. As part of the Digital Experiences team within Mars Global Services Digital Technologies Organization, this role plays a pivotal part in modernizing how our bran…",83107.2,83107.2,,2025-04-18T02:10:01Z,https://www.adzuna.co.uk/jobs/land/ad/5150846278?se=_tnH4TEe8BGla2k9OSZXLA&utm_medium=api&utm_source=e1ad5111&v=034E0800E2BD9F3982B19F4B41140C244502D2EA,IT Jobs,management
"Sr Manager, DX Product Experience Management",Mars IS UK,"Chalvey, Slough","Job Description: We are looking for an experienced and forward-thinking Senior Manager, Product Experiences Management to lead the strategy, development, and optimization of our product content ecosystem—powered by platforms like Salsify—to drive consistent, engaging, and conversion-ready product experiences across all digital shelves. As part of the Digital Experiences team within Mars Global Services Digital Technologies Organization, this role plays a pivotal part in modernizing how our bran…",85877.38,85877.38,,2025-04-18T02:10:02Z,https://www.adzuna.co.uk/jobs/land/ad/5150846287?se=_tnH4TEe8BGla2k9OSZXLA&utm_medium=api&utm_source=e1ad5111&v=DD256F8327467DCF03DCB622CFD1553DE3BC886E,IT Jobs,management
Deputy Manager,Partou,"Harrogate, North Yorkshire","Join Partou, where children are the leaders We’re looking for a Deputy Manager to join us at Partou and help support our Nursery Manager and Senior Deputy Manager in the smooth running of our setting. 40 hours per week and a competitive salary of £31,150. You will need to be level 3 early years qualified for this role and at least a year's experience in a nursery setting. Some of the benefits of working as part of the Partou Family: Genuine opportunities for career progression Access to profess…",31150,31150,permanent,2025-03-29T13:27:56Z,https://www.adzuna.co.uk/jobs/details/5117880664?utm_medium=api&utm_source=e1ad5111,Teaching Jobs,management
Project Manager,ARM,"Chesterton, Cambridge","Job Overview: The Central Engineering GPU Group produces graphics hardware and software products for mobile and embedded devices. Our Mali™ Graphics Processor is 1 shipping GPU globally We work on new technologies and products for existing and current markets and are looking for motivated and hardworking people to join the team. Working with the world’s best companies, making world-leading products based on our IP and alongside the best engineers in the world. We work in small teams, so your id…",51448.43,51448.43,,2025-04-14T03:12:03Z,https://www.adzuna.co.uk/jobs/land/ad/5143735138?se=_tnH4TEe8BGla2k9OSZXLA&utm_medium=api&utm_source=e1ad5111&v=B235D675A2B97FD401169DEC6534E561DC2F597E,Engineering Jobs,management
Intellectual Property Manager,NPL,"Teddington, South West London","NPL’s Intellectual Property underpins much of NPL’s work and supports the real-world impact created through adoption of NPL technologies. We have a proud record of commercialisation - our IP has supported the growth of UK companies as well as the commercialisation of innovative NPL solutions through routes such as spin-outs, licensing and NPL’s products and services. Recent examples include the development and launch of DAART, a digital metrology platform for radiotherapy audits, a new miniatur…",55285.67,55285.67,,2025-03-11T10:44:55Z,https://www.adzuna.co.uk/jobs/land/ad/5086765126?se=_tnH4TEe8BGla2k9OSZXLA&utm_medium=api&utm_source=e1ad5111&v=B22EDD268E4F4AC98BCA324BAF09E825B984F0E3,IT Jobs,management
Assistant Restaurant Manager,Franco Manca,"Cambridge, Cambridgeshire","About Us At Franco Manca, we’re not just making sourdough pizza – we’re creating a movement. Our passion for simple, authentic, and delicious food is at the heart of everything we do. From our hand-stretched sourdough bases to the finest seasonal ingredients, every pizza tells a story of quality, care, and tradition. With nearly twenty years of pizza-making under our belt, we’ve built a loyal following of pizza lovers across the UK. But we’re more than just pizza – we’re about people, community…",31852.82,31852.82,permanent,2025-04-11T17:28:28Z,https://www.adzuna.co.uk/jobs/land/ad/5140592203?se=_tnH4TEe8BGla2k9OSZXLA&utm_medium=api&utm_source=e1ad5111&v=64153EB96329BD072EC4CE9AA3080DD84D7362CC,Hospitality & Catering Jobs,management
Managed Services Program Manager,"Arrow Electronics, Inc.",UK,"Position: Managed Services Program Manager Job Description: Arrow Enterprise Computing Solutions (ECS) , a part of Arrow Electronics, brings innovative IT solutions to the market to solve complex business challenges. We deliver value-added distribution, business consulting and channel enablement services to leading technology manufacturers and their channel partners. We help businesses grow faster, operate efficiently and transform in a dynamic market. Learn more at www.arrow.com. Managed Servi…",69830.07,69830.07,,2025-03-25T19:51:53Z,https://www.adzuna.co.uk/jobs/land/ad/5111220235?se=_tnH4TEe8BGla2k9OSZXLA&utm_medium=api&utm_source=e1ad5111&v=BA494E66C8CD2D5B7AF7485E61606BD914C92487,IT Jobs,management
Property Manager,Residential Management Group,"Rudheath, Northwich","Residential Management Group (RMG), a market leading Property Management Company is looking for a Property Manager, experienced within block/estate management, as we manage small and large blocks and estates for RMC (Resident Management Companies), L&T (Landlord & Tenant) and Developers. This is a great career opportunity to join a large, organically growing, market leading managing agent. You'll be working alongside an experienced and supportive team of property management professionals, led b…",4320,28100,,2025-04-07T12:14:03Z,https://www.adzuna.co.uk/jobs/land/ad/5133423259?se=_tnH4TEe8BGla2k9OSZXLA&utm_medium=api&utm_source=e1ad5111&v=A16DD4165C5D6E2E31047DFCF2DDE5FE7044B9D9,Trade & Construction Jobs,management
Property Manager,Residential Management Group,"Northampton, Northamptonshire","Residential Management Group (RMG), a market leading Property Management Company is looking for a Property Manager, experienced within block/estate management, as we manage small and large blocks and estates for RMC (Resident Management Companies), L&T (Landlord & Tenant) and Developers. This is a great career opportunity to join a large, organically growing, market leading managing agent. You'll be working alongside an experienced and supportive team of property management professionals, led b…",31000,31000,,2025-04-07T12:14:03Z,https://www.adzuna.co.uk/jobs/land/ad/5133423283?se=_tnH4TEe8BGla2k9OSZXLA&utm_medium=api&utm_source=e1ad5111&v=C2F0B7BE98F03E4C06F05E473928BC4FD7A32663,Trade & Construction Jobs,management
Property Manager,Residential Management Group,"Redcliffe, Bristol","Residential Management Group (RMG), a market leading Property Management Company is looking for a Property Manager, experienced within block/estate management, as we manage small and large blocks and estates for RMC (Resident Management Companies), L&T (Landlord & Tenant) and Developers. This is a great career opportunity to join a large, organically growing, market leading managing agent. You'll be working alongside an experienced and supportive team of property management professionals, led b…",31000,31000,,2025-04-07T12:14:03Z,https://www.adzuna.co.uk/jobs/land/ad/5133423265?se=_tnH4TEe8BGla2k9OSZXLA&utm_medium=api&utm_source=e1ad5111&v=84575BD33D23383D254532E0715512B38D3EE925,Trade & Construction Jobs,management
Property Manager,Residential Management Group,"Caversham, Reading","We have a great career opportunity for a Property Manager with block/estate management experience, to join a large and organically growing market leading property managing agent. You'll be working alongside an experienced and supportive team of property management professionals. Where will you be located? You'll work from home and be conveniently located to visit your developments in and around your portfolio in Cambridge, Reading, Slough and the surrounding areas. You will visit our Hoddesdon …",36000,36000,,2025-03-13T12:23:05Z,https://www.adzuna.co.uk/jobs/land/ad/5091255073?se=_tnH4TEe8BGla2k9OSZXLA&utm_medium=api&utm_source=e1ad5111&v=D46FBF26519E5AF24711EB05017D2B074F71601C,Trade & Construction Jobs,management
Building Manager,Residential Management Group,"Bristol, South West England","Residential Management Group, a large, established market leading property management company, is looking for an experienced Building Manage r, based at our development at Lakeshore, Bristol. The Building Manager 's primary responsibility is to provide a property management service to a residential building, ensuring the building is managed in line with the client's expectations whilst providing an excellent customer service to residents and visitors. What hours will I be working? You will be w…",0,30000,,2025-03-12T12:16:09Z,https://www.adzuna.co.uk/jobs/land/ad/5088599441?se=_tnH4TEe8BGla2k9OSZXLA&utm_medium=api&utm_source=e1ad5111&v=0EB6D05685854263338C28D00179F496ACDFCEAB,Trade & Construction Jobs,management
Property Services Manager,Residential Management Group,"Millbank, South West London","Role Purpose: Are you an experienced leader in Social Housing with a passion for service development? Residential Management Group is seeking a Property Services Manager to lead our Public Sector Property Management team. You will be accountable for the effective and efficient management of a large and growing portfolio of properties used by Westminster City Council as temporary accommodation for housing applicants. Additionally, you will lead the development of a single homelessness property m…",53000,53000,,2025-04-09T13:36:31Z,https://www.adzuna.co.uk/jobs/land/ad/5137125679?se=_tnH4TEe8BGla2k9OSZXLA&utm_medium=api&utm_source=e1ad5111&v=8952F7222F8D17787CB4B1D2C797D42229E3C8B6,Social work Jobs,management
Head Gardener,Residential Management Group,"Snodland, Kent","About Us: Join our team at RMG where we pride ourselves on maintaining a beautiful and welcoming environment for our residents and visitors. We are seeking a dedicated and experienced Head Gardener to lead our gardening team and ensure our estate remains at Holborough Lakes, ME6 5PD is a pleasant and safe place for everyone. Job Description: Objectives: As the Head Gardener, your main objective is to ensure the estate is a pleasant environment for residents and visitors, as well as a positive w…",0,32000,,2025-04-07T12:14:03Z,https://www.adzuna.co.uk/jobs/land/ad/5133423258?se=_tnH4TEe8BGla2k9OSZXLA&utm_medium=api&utm_source=e1ad5111&v=339ABF17C836515A9061412CC8E3C2F87F661B6A,Social work Jobs,management
Complaints Analyst,Residential Management Group,"Rudheath, Northwich","Residential Management Group, one of the UK's largest Property Management Companies, is looking for a Complaints Analyst to join our complaints team. The successful candidate will ensure that all complaints are acknowledged within three working days and customers are kept informed throughout the complaints process. You will be the first point of contact setting customer expectation and will liaise with the relevant areas of the business to ensure full responses are provided, ensuring the correc…",24654,24654,,2025-04-07T12:14:03Z,https://www.adzuna.co.uk/jobs/land/ad/5133423263?se=_tnH4TEe8BGla2k9OSZXLA&utm_medium=api&utm_source=e1ad5111&v=84DCD37206F0CB2897321FD680E435E64A15B723,Customer Services Jobs,management
Customer Service Advisor,Residential Management Group,"Rudheath, Northwich","RMG is growing and its medium sized inbound Customer Service Contact Centre has exciting opportunities for permanent Customer Service Advisors, to join our supportive team based in Northwich. To be considered for these opportunities, you must be able to work a rota'd shift between 8am and 8pm and be fluent in both written and spoken English. As a Customer Service Advisor in our Inbound Customer Contact Centre, you will join a friendly team of established and supportive Customer Service colleagu…",24654,24654,permanent,2025-04-07T12:14:03Z,https://www.adzuna.co.uk/jobs/land/ad/5133423260?se=_tnH4TEe8BGla2k9OSZXLA&utm_medium=api&utm_source=e1ad5111&v=12268BB39BF46F80281855260B9AF7392E502DF7,Customer Services Jobs,management
Technical Delivery Manager,Barclays Bank PLC,"Cliftonville, Northampton","Join us as a Technical Delivery Manager at Barclays, where you'll support the delivery of ALM Strategic Transformation (Lansdowne) Barclays Europe Day 1 and meet the JST commitment. The role holder will primarily support the reporting and testing workstreams to help define and drive delivery across multiple teams, working with an iterative / agile methodology. To be successful as a Technical Delivery Manager, you should have experience with Delivering new solutions & products across the full SD…",32892.79,32892.79,permanent,2025-04-16T00:04:02Z,https://www.adzuna.co.uk/jobs/land/ad/5146571813?se=_tnH4TEe8BGla2k9OSZXLA&utm_medium=api&utm_source=e1ad5111&v=3F1E109EF20F5089EB9206340A155CD9F6A34F5E,IT Jobs,management
Complaints Manager,Teleperformance,"Birkenshaw, Larkhall",Job Title: Financial Services Customer Resolutions Manager (Complaints) Department: Customer Resolutions Management Responsibility for: Management of a Team Leader and up to 15 Complaints handlers Reports to : Call Centre Manager Location: Glasgow Cuprum UK – (Hybrid - 3 Days in Office 2 Days - Work at home) Contract Type: Full time ( 40 hours per week) Salary: £45k Job Summary / Overview Main responsibilities of the role include leading a team of Complaints Handlers who are responsible for tho…,38016.57,38016.57,,2025-03-03T20:18:43Z,https://www.adzuna.co.uk/jobs/land/ad/5072655391?se=_tnH4TEe8BGla2k9OSZXLA&utm_medium=api&utm_source=e1ad5111&v=53F4AED5C953CE27A8BC9A27F080F8AB5D5352A5,Customer Services Jobs,management
Complaints Manager,Teleperformance,"Glenboig, Coatbridge",Job Title: Financial Services Customer Resolutions Manager (Complaints) Department: Customer Resolutions Management Responsibility for: Management of a Team Leader and up to 15 Complaints handlers Reports to : Call Centre Manager Location: Glasgow Cuprum UK – (Hybrid - 3 Days in Office 2 Days - Work at home) Contract Type: Full time ( 40 hours per week) Salary: £45k Job Summary / Overview Main responsibilities of the role include leading a team of Complaints Handlers who are responsible for tho…,39431.69,39431.69,,2025-03-03T20:18:43Z,https://www.adzuna.co.uk/jobs/land/ad/5072655384?se=_tnH4TEe8BGla2k9OSZXLA&utm_medium=api&utm_source=e1ad5111&v=0E3F07086483D075E42B0EA689C539EE8BBB7BDA,Customer Services Jobs,management
Complaints Manager,Teleperformance,"Bogend, Symington",Job Title: Financial Services Customer Resolutions Manager (Complaints) Department: Customer Resolutions Management Responsibility for: Management of a Team Leader and up to 15 Complaints handlers Reports to : Call Centre Manager Location: Glasgow Cuprum UK – (Hybrid - 3 Days in Office 2 Days - Work at home) Contract Type: Full time ( 40 hours per week) Salary: £45k Job Summary / Overview Main responsibilities of the role include leading a team of Complaints Handlers who are responsible for tho…,32390.67,32390.67,,2025-03-03T20:18:43Z,https://www.adzuna.co.uk/jobs/land/ad/5072655386?se=_tnH4TEe8BGla2k9OSZXLA&utm_medium=api&utm_source=e1ad5111&v=C21DDCD4D617D8F1621294C39E72F9893C65D503,Customer Services Jobs,management
Complaints Manager,Teleperformance,"Duntocher, Clydebank",Job Title: Financial Services Customer Resolutions Manager (Complaints) Department: Customer Resolutions Management Responsibility for: Management of a Team Leader and up to 15 Complaints handlers Reports to : Call Centre Manager Location: Glasgow Cuprum UK – (Hybrid - 3 Days in Office 2 Days - Work at home) Contract Type: Full time ( 40 hours per week) Salary: £45k Job Summary / Overview Main responsibilities of the role include leading a team of Complaints Handlers who are responsible for tho…,33148.81,33148.81,,2025-03-03T20:18:43Z,https://www.adzuna.co.uk/jobs/land/ad/5072655389?se=_tnH4TEe8BGla2k9OSZXLA&utm_medium=api&utm_source=e1ad5111&v=96555608BB83B276F229B41BC7020831E5775DC9,Customer Services Jobs,management
Complaints Manager,Teleperformance,"Langbank, Port Glasgow",Job Title: Financial Services Customer Resolutions Manager (Complaints) Department: Customer Resolutions Management Responsibility for: Management of a Team Leader and up to 15 Complaints handlers Reports to : Call Centre Manager Location: Glasgow Cuprum UK – (Hybrid - 3 Days in Office 2 Days - Work at home) Contract Type: Full time ( 40 hours per week) Salary: £45k Job Summary / Overview Main responsibilities of the role include leading a team of Complaints Handlers who are responsible for tho…,35571.14,35571.14,,2025-03-03T20:18:43Z,https://www.adzuna.co.uk/jobs/land/ad/5072655395?se=_tnH4TEe8BGla2k9OSZXLA&utm_medium=api&utm_source=e1ad5111&v=68C81FB648A1855051A309CCA6D2255CCE8751DF,Customer Services Jobs,management
Complaints Manager,Teleperformance,"Annandale, Kilmarnock",Job Title: Financial Services Customer Resolutions Manager (Complaints) Department: Customer Resolutions Management Responsibility for: Management of a Team Leader and up to 15 Complaints handlers Reports to : Call Centre Manager Location: Glasgow Cuprum UK – (Hybrid - 3 Days in Office 2 Days - Work at home) Contract Type: Full time ( 40 hours per week) Salary: £45k Job Summary / Overview Main responsibilities of the role include leading a team of Complaints Handlers who are responsible for tho…,36052.28,36052.28,,2025-03-03T20:18:43Z,https://www.adzuna.co.uk/jobs/land/ad/5072655393?se=_tnH4TEe8BGla2k9OSZXLA&utm_medium=api&utm_source=e1ad5111&v=FE3BC2B17CF419FD73B5ECC318EC3E4F6E810D47,Customer Services Jobs,management
Complaints Manager,Teleperformance,"Meigle, Skelmorlie",Job Title: Financial Services Customer Resolutions Manager (Complaints) Department: Customer Resolutions Management Responsibility for: Management of a Team Leader and up to 15 Complaints handlers Reports to : Call Centre Manager Location: Glasgow Cuprum UK – (Hybrid - 3 Days in Office 2 Days - Work at home) Contract Type: Full time ( 40 hours per week) Salary: £45k Job Summary / Overview Main responsibilities of the role include leading a team of Complaints Handlers who are responsible for tho…,34915.15,34915.15,,2025-03-03T20:18:43Z,https://www.adzuna.co.uk/jobs/land/ad/5072655385?se=_tnH4TEe8BGla2k9OSZXLA&utm_medium=api&utm_source=e1ad5111&v=3C01F8D4733FFE3EECC3C0799C38E1A092FCF3B4,Customer Services Jobs,management
Complaints Manager,Teleperformance,"Braidwood, Carluke",Job Title: Financial Services Customer Resolutions Manager (Complaints) Department: Customer Resolutions Management Responsibility for: Management of a Team Leader and up to 15 Complaints handlers Reports to : Call Centre Manager Location: Glasgow Cuprum UK – (Hybrid - 3 Days in Office 2 Days - Work at home) Contract Type: Full time ( 40 hours per week) Salary: £45k Job Summary / Overview Main responsibilities of the role include leading a team of Complaints Handlers who are responsible for tho…,35034.5,35034.5,,2025-03-03T20:18:43Z,https://www.adzuna.co.uk/jobs/land/ad/5072655382?se=_tnH4TEe8BGla2k9OSZXLA&utm_medium=api&utm_source=e1ad5111&v=BBE8FE5F1600B9506A469ECC900AC1113DD72250,Customer Services Jobs,management
Complaints Manager,Teleperformance,"Kilbarchan, Johnstone",Job Title: Financial Services Customer Resolutions Manager (Complaints) Department: Customer Resolutions Management Responsibility for: Management of a Team Leader and up to 15 Complaints handlers Reports to : Call Centre Manager Location: Glasgow Cuprum UK – (Hybrid - 3 Days in Office 2 Days - Work at home) Contract Type: Full time ( 40 hours per week) Salary: £45k Job Summary / Overview Main responsibilities of the role include leading a team of Complaints Handlers who are responsible for tho…,40768.56,40768.56,,2025-03-03T20:18:43Z,https://www.adzuna.co.uk/jobs/land/ad/5072655387?se=_tnH4TEe8BGla2k9OSZXLA&utm_medium=api&utm_source=e1ad5111&v=17AC766125ADD54EC1977A6091380B1A67944FA9,Customer Services Jobs,management
Complaints Manager,Teleperformance,"Orbiston, Bellshill",Job Title: Financial Services Customer Resolutions Manager (Complaints) Department: Customer Resolutions Management Responsibility for: Management of a Team Leader and up to 15 Complaints handlers Reports to : Call Centre Manager Location: Glasgow Cuprum UK – (Hybrid - 3 Days in Office 2 Days - Work at home) Contract Type: Full time ( 40 hours per week) Salary: £45k Job Summary / Overview Main responsibilities of the role include leading a team of Complaints Handlers who are responsible for tho…,37097.51,37097.51,,2025-03-03T20:18:43Z,https://www.adzuna.co.uk/jobs/land/ad/5072655394?se=_tnH4TEe8BGla2k9OSZXLA&utm_medium=api&utm_source=e1ad5111&v=1CD0001F2DB72340F274DCC1CC2720ECFAF34055,Customer Services Jobs,management
Complaints Manager,Teleperformance,"Calderbank, Airdrie",Job Title: Financial Services Customer Resolutions Manager (Complaints) Department: Customer Resolutions Management Responsibility for: Management of a Team Leader and up to 15 Complaints handlers Reports to : Call Centre Manager Location: Glasgow Cuprum UK – (Hybrid - 3 Days in Office 2 Days - Work at home) Contract Type: Full time ( 40 hours per week) Salary: £45k Job Summary / Overview Main responsibilities of the role include leading a team of Complaints Handlers who are responsible for tho…,39157.08,39157.08,,2025-03-03T20:18:43Z,https://www.adzuna.co.uk/jobs/land/ad/5072655388?se=_tnH4TEe8BGla2k9OSZXLA&utm_medium=api&utm_source=e1ad5111&v=6A1E01DA2E97DCF6AC15FBFC354213390A650A38,Customer Services Jobs,management
Complaints Manager,Teleperformance,"Ferniegair, Hamilton",Job Title: Financial Services Customer Resolutions Manager (Complaints) Department: Customer Resolutions Management Responsibility for: Management of a Team Leader and up to 15 Complaints handlers Reports to : Call Centre Manager Location: Glasgow Cuprum UK – (Hybrid - 3 Days in Office 2 Days - Work at home) Contract Type: Full time ( 40 hours per week) Salary: £45k Job Summary / Overview Main responsibilities of the role include leading a team of Complaints Handlers who are responsible for tho…,38600.04,38600.04,,2025-03-03T20:18:43Z,https://www.adzuna.co.uk/jobs/land/ad/5072655390?se=_tnH4TEe8BGla2k9OSZXLA&utm_medium=api&utm_source=e1ad5111&v=56A2FDD6EA49D9D43F1087236D3C91073099C9F7,Customer Services Jobs,management
Complaints Manager,Teleperformance,"Hillhead, Glasgow City Centre",Job Title: Financial Services Customer Resolutions Manager (Complaints) Department: Customer Resolutions Management Responsibility for: Management of a Team Leader and up to 15 Complaints handlers Reports to : Call Centre Manager Location: Glasgow Cuprum UK – (Hybrid - 3 Days in Office 2 Days - Work at home) Contract Type: Full time ( 40 hours per week) Salary: £45k Job Summary / Overview Main responsibilities of the role include leading a team of Complaints Handlers who are responsible for tho…,39078.59,39078.59,,2025-03-03T20:18:43Z,https://www.adzuna.co.uk/jobs/land/ad/5072655396?se=_tnH4TEe8BGla2k9OSZXLA&utm_medium=api&utm_source=e1ad5111&v=78BD5930A488C3F0B1F025945050EA91ACE1B708,Customer Services Jobs,management
Complaints Manager,Teleperformance,"Throsk, Stirling",Job Title: Financial Services Customer Resolutions Manager (Complaints) Department: Customer Resolutions Management Responsibility for: Management of a Team Leader and up to 15 Complaints handlers Reports to : Call Centre Manager Location: Glasgow Cuprum UK – (Hybrid - 3 Days in Office 2 Days - Work at home) Contract Type: Full time ( 40 hours per week) Salary: £45k Job Summary / Overview Main responsibilities of the role include leading a team of Complaints Handlers who are responsible for tho…,43089.63,43089.63,,2025-03-03T20:18:43Z,https://www.adzuna.co.uk/jobs/land/ad/5072655383?se=_tnH4TEe8BGla2k9OSZXLA&utm_medium=api&utm_source=e1ad5111&v=278AED59CF5D52BDCA8C8522522AD2E22FFBD607,Customer Services Jobs,management
