title,company,location,description,salary_min,salary_max,contract_type,created,redirect_url,category,specialty
Director of Learning for Maths,Harris Academy Chobham,"London, UK","Main Areas of Responsibility ABOUT THIS OPPORTUNITY We are currently looking to appoint a qualified, experienced teacher to join Harris Academy Chobham as Director of Mathematics to ensure high standards of teaching and learning across the subject area, continuously developing and enhancing the quality of teaching and learning. Qualifications & Experience MAIN AREAS OF RESPONSIBILITY The purpose of your role will be: To be accountable for student progress and development in the subject area acr…",65731,71615,permanent,2025-03-28T14:56:53Z,https://www.adzuna.co.uk/jobs/land/ad/5115854612?se=qilG7zEe8BG-i3PTGXcHCQ&utm_medium=api&utm_source=e1ad5111&v=9FBB2958BB62CB3C0762306F8CC73F6A91BB4D8A,Teaching Jobs,management
Programme Director,Travelers,"London, UK","Who Are We? Taking care of our customers, our communities and each other. That’s the Travelers Promise. By honoring this commitment, we have maintained our reputation as one of the best property casualty insurers in the industry for over 160 years. Join us to discover a culture that is rooted in innovation and thrives on collaboration. Imagine loving what you do and where you do it. Target Openings 1 What Is the Opportunity? As the Programme Director, Europe for Travelers Insurance, you will be…",58315.28,58315.28,,2024-06-18T16:35:22Z,https://www.adzuna.co.uk/jobs/land/ad/4742340020?se=qilG7zEe8BG-i3PTGXcHCQ&utm_medium=api&utm_source=e1ad5111&v=6762F60B9CEA362DE52D135034361605BB515082,HR & Recruitment Jobs,management
Director of HR,Marlborough College,"Marlborough, Wiltshire","Founded in 1843, Marlborough College is the UK’s largest co-educational full boarding school, educating over 1,000 pupils aged 13 to 18 years on a stunning 286-acre campus in Wiltshire. Our mission is to be recognised globally for our holistic education, which combines an outstanding academic provision, vibrant community spirit and broad co-curriculum designed to equip pupils to be intellectually agile innovators ready to make a difference in society. We are defined by Boundless Expectations, M…",62236.93,62236.93,,2025-04-19T11:57:08Z,https://www.adzuna.co.uk/jobs/land/ad/5153145592?se=qilG7zEe8BG-i3PTGXcHCQ&utm_medium=api&utm_source=e1ad5111&v=EAC973767C8092A2E15BEB86ABCC7945C6FBFD5E,HR & Recruitment Jobs,management
Chief Project Engineer,Rolls Royce,"St. Pauls, Bristol","Job Description Job Title: Chief Project Engineer Working Pattern: Hybrid - Minimum of 3 Days a week in the office Working location: Bristol NautIQ Solutions (UK) Chief Project Engineer (Commercial & Naval Marine Installed Products) The Chief Project Engineer (Commercial & Naval Marine Installed Products) will be the representative for all technical issues with suppliers, customers, and operators for the installed product base (electrical), specifically ASTUTE, DREADNOUGHT (once Boat 1 hardware…",54798.12,54798.12,,2025-03-27T12:36:43Z,https://www.adzuna.co.uk/jobs/land/ad/5113432978?se=PvjpFTIe8BGla2k9OSZXLA&utm_medium=api&utm_source=e1ad5111&v=5278F1F38C3FF697ED3B5CB324049F6075D10827,Engineering Jobs,management
Chief Project Engineer,Rolls Royce,"St. Pauls, Bristol","Job Description Job Title: Chief Project Engineer Working Pattern: Hybrid - Minimum of 3 Days a week in the office Working location: Bristol NautIQ Solutions (UK) Chief Project Engineer (Commercial & Naval Marine Installed Products) The Chief Project Engineer (Commercial & Naval Marine Installed Products) will be the representative for all technical issues with suppliers, customers, and operators for the installed product base (electrical), specifically ASTUTE, DREADNOUGHT (once Boat 1 hardware…",54745.63,54745.63,,2025-03-26T00:49:24Z,https://www.adzuna.co.uk/jobs/land/ad/5111432131?se=PvjpFTIe8BGla2k9OSZXLA&utm_medium=api&utm_source=e1ad5111&v=DFF5A73855E4C3EC8A22ACD9870954B5A0662FE5,Engineering Jobs,management
Chief Executive,NI Social Care Council,"Belfast, Northern Ireland","Northern Ireland Social Care Council Chief Executive We are seeking a Chief Executive to provide leadership, vision and strategic direction to the Northern Ireland Social Care Council. Key to the role is the delivery of the organisation’s aim to protect the public through improving safeguards for vulnerable people, raising the standards of social work and social care practice and strengthening the professionalism of the workforce. This will be underpinned by robust corporate governance arrangem…",82669,108180,,2025-04-02T03:43:22Z,https://www.adzuna.co.uk/jobs/land/ad/5123274605?se=PvjpFTIe8BGla2k9OSZXLA&utm_medium=api&utm_source=e1ad5111&v=201A2B10AA14D4B4BD8C503D98F03629A7B7466C,Admin Jobs,management
Chief Underwriting Officer,IPS Group,UK,"This is a fantastic opening for a highly experienced Motor Underwriting management professional to join this long established motor specialist insurance group. Your experience should come from a predominantly commercial motor background with experience within commercial vehicle and fleet, ideally some exposure to haulage and specialisms such as taxi / courier insurance. You should have already had overall responsibility for P&L, product ownership/development/oversight, extensive pricing / analy…",100000,100000,permanent,2025-03-28T15:55:07Z,https://www.adzuna.co.uk/jobs/details/5116064188?utm_medium=api&utm_source=e1ad5111,Accounting & Finance Jobs,management
Chief Executive Officer,Tourism NI,"Belfast, Northern Ireland","Tourism continues to be one of Northern Irelands most recognisable good news stories. Tourism Northern Ireland is responsible for the development of tourism in Northern Ireland, supporting the tourism industry and for marketing the region as a tourist destination. A non-departmental public body of the Department for the Economy, the organisation works closely with other tourism bodies to help develop the visitor economy. In 2023, almost two million overseas visitors chose to visit Northern Irel…",40919.5,40919.5,,2025-04-04T07:07:36Z,https://www.adzuna.co.uk/jobs/land/ad/5128717836?se=PvjpFTIe8BGla2k9OSZXLA&utm_medium=api&utm_source=e1ad5111&v=921DA0DA2646DB2C1F34B2C7BE5818BD2096E1F8,Customer Services Jobs,management
Chief Financial Officer,Amplifi Talent,"Castlewellan, County Down","Amplifi Talent are partnering with an established family business to recruit a high calibre CFO on a permanent basis. This is a fantastic opportunity to play a key role in driving the groups continued growth and expansion, working closely with the CEO and wider Leadership Team. This is a high-profile position in a fast-paced, multi-site SME, and therefore requires a senior finance leader who can clearly evidence first-class strategic, commercial, and operational delivery in a similar business e…",100000,100000,permanent,2025-04-09T07:40:27Z,https://www.adzuna.co.uk/jobs/land/ad/5136893757?se=PvjpFTIe8BGla2k9OSZXLA&utm_medium=api&utm_source=e1ad5111&v=32DFD974DC811BED541EFD4066306BBA7F78AC73,Accounting & Finance Jobs,management
Chief Host/Hostess,Paragon Talent,"Snowhill, Walcot",Chief Host/Hostess Needed for a luxury Brasserie in Bath Our amazing client is in search of an experienced Chief Host/Hostess to lead their Restaurant reception team of 4. This property is an extremely busy outlet catering for up to 120 covers per service. You would be in charge of welcoming all guests and large bookings. This venue is very much focused on luxury lifestyle so requires an operator w ADZN1_UKCT,35000,35000,,2025-03-21T19:50:49Z,https://www.adzuna.co.uk/jobs/land/ad/5105068591?se=PvjpFTIe8BGla2k9OSZXLA&utm_medium=api&utm_source=e1ad5111&v=BA5912525CF8DF86E769254177842405F137A0FE,Hospitality & Catering Jobs,management
Chief Executive,Penna Executive Search,"Manchester, Greater Manchester","Empower Change, Inspire Futures Chief Executive Salary £198k Are you a visionary leader ready to shape the future of Tameside? Do you have the drive and ambition to lead an organisation committed to delivering excellence, tackling inequalities, and putting residents first? We are seeking an exceptional Chief Executive to provide bold, visible leadership – not just within the Council but across the borough, Greater Manchester, and beyond. Working closely with elected Members, strategic partners,…",198000,198000,permanent,2025-04-18T11:18:41Z,https://www.adzuna.co.uk/jobs/details/5151456781?utm_medium=api&utm_source=e1ad5111,Consultancy Jobs,management
Chief Executive,PERIDOT PARTNERS,"Fife, Scotland","We are looking for a Chief Executive with exceptional leadership skills and a proven track record in delivering sustainable change initiatives for The University of St Andrews’ Students’ Association. Location: St Andrews, Fife (on site 3 days per week) Applications close at 9 a.m. Wednesday 7th May Who we are Every student at St Andrews is automatically a member of The University of St Andrews’ Students’ Association (aka Your Union). We work to support students through three broad categories: R…",70000,80000,permanent,2025-04-07T07:20:13Z,https://www.adzuna.co.uk/jobs/details/5133305783?utm_medium=api&utm_source=e1ad5111,Admin Jobs,management
Chief Executive,CHARITY PEOPLE,"Toxteth, Liverpool","Could you bring the passion and leadership we need to drive forward a pioneering wellbeing and advocacy charity for BAME and refugee communities in Liverpool? Salary | £50,000 Liverpool | Mostly onsite, with potential for some homeworking Contract | Permanent, 37.5 hours full-time or reduced hours considered Benefits | 28 days holiday (bank), 8% pension contribution (3% from employer) Culture | Flexible, life and family-friendly We're looking for a new Chief Executive : a compassionate and visi…",50000,50000,permanent,2025-04-18T05:16:26Z,https://www.adzuna.co.uk/jobs/details/5151039565?utm_medium=api&utm_source=e1ad5111,Charity & Voluntary Jobs,management
Chief Software Engineer,Visa Inc,"Belfast, Northern Ireland","Visa is a world leader in payments and technology, with over 259 billion payments transactions flowing safely between consumers, merchants, financial institutions, and government entities in more than 200 countries and territories each year. Our mission is to connect the world through the most innovative, convenient, reliable, and secure payments network, enabling individuals, businesses, and economies to thrive while driven by a common purpose to uplift everyone, everywhere by being the best w…",69293.52,69293.52,,2025-04-04T07:08:05Z,https://www.adzuna.co.uk/jobs/land/ad/5128718488?se=PvjpFTIe8BGla2k9OSZXLA&utm_medium=api&utm_source=e1ad5111&v=A8EC379A3E57F349AA8D19A733D5E783D70D7678,IT Jobs,management
Chief Information Security Officer,FCDO Services,"Hanslope, Milton Keynes","Chief Information Security Officer £58,123 plus £1,750 location allowance and excellent benefits, including Civil Service pension Full time Based at Hanslope Park near Milton Keynes, with the flexibility of hybrid working depending on business need Free shuttle bus available between central Milton Keynes and Hanslope Park An expert in information security and information risk management, this may be the most unique and important opportunity in your career to date. Not only will you assure data …",55000,55000,permanent,2025-04-07T17:32:31Z,https://www.adzuna.co.uk/jobs/details/5133650419?utm_medium=api&utm_source=e1ad5111,IT Jobs,management
Chief Engineer,Leidos,"London, UK","Leidos is expanding in the National Security and Defence domain and are looking for a DV cleared Chief Engineer to support one of our existing delivery programmes based in the UK working across sites in Farnborough, Cambridgeshire and SW London. The Chief Engineer has overall responsibility for all engineering activities on the project and is part of the project leadership team. You will be leading a team of highly skilled and highly motivated individuals delivering solutions based on a large r…",67172.48,67172.48,,2025-01-25T13:22:50Z,https://www.adzuna.co.uk/jobs/land/ad/5023955226?se=PvjpFTIe8BGla2k9OSZXLA&utm_medium=api&utm_source=e1ad5111&v=1DF517F3B46CEA30197232C2BD8D24C4EA9ADDC0,IT Jobs,management
Chief Engineer,Leidos,"Cambridge, Cambridgeshire","Leidos is expanding in the National Security and Defence domain and are looking for a DV cleared Chief Engineer to support one of our existing delivery programmes based in the UK working across sites in Farnborough, Cambridgeshire and SW London. The Chief Engineer has overall responsibility for all engineering activities on the project and is part of the project leadership team. You will be leading a team of highly skilled and highly motivated individuals delivering solutions based on a large r…",63520.04,63520.04,,2025-01-25T13:23:07Z,https://www.adzuna.co.uk/jobs/land/ad/5023955448?se=PvjpFTIe8BGla2k9OSZXLA&utm_medium=api&utm_source=e1ad5111&v=4F18BEE0BB38D085EEAADDAEBBC20501F4A30937,IT Jobs,management
Chief Engineer,Leidos,"Farnborough, Hampshire","Leidos is expanding in the National Security and Defence domain and are looking for a DV cleared Chief Engineer to support one of our existing delivery programmes based in the UK working across sites in Farnborough, Cambridgeshire and SW London. The Chief Engineer has overall responsibility for all engineering activities on the project and is part of the project leadership team. You will be leading a team of highly skilled and highly motivated individuals delivering solutions based on a large r…",65643.34,65643.34,,2025-01-25T13:23:05Z,https://www.adzuna.co.uk/jobs/land/ad/5023955395?se=PvjpFTIe8BGla2k9OSZXLA&utm_medium=api&utm_source=e1ad5111&v=798FEACA48684032A68E93EF88DD59732550A385,IT Jobs,management
Chief Financial Officer,AR Hine Associates,"Manchester, Greater Manchester",Client is a PE Backed niche service business with a turnover of c£15m The business has now reached the stage where it is seeking a new Chief Financial Officer (CFO) to help lead the business into its next stage of development. The CFO will be a critical appointment as part of that development. The Role of CFO To play an active role as CFO on the main board and contribute to all aspects of day-to-day and long-term strategy decisions where appropriate. Take an active lead in managing the PE House…,63604.9,63604.9,,2025-04-15T08:33:26Z,https://www.adzuna.co.uk/jobs/land/ad/5145303069?se=PvjpFTIe8BGla2k9OSZXLA&utm_medium=api&utm_source=e1ad5111&v=FA003B1331561F93B8F62C3E712FE593A645D8C9,Accounting & Finance Jobs,management
Chief Engineer,Hilton Leeds,"Leeds, West Yorkshire","WELCOME TO A WORLD OF OPPORTUNITIES AT THE WORLD'S 1 BEST WORKPLACE, AWARDED BY GREAT PLACE TO WORK & FORTUNE.- No two days or two hotels are the same, but our spirit and passion for hospitality always brings all our teams together to create a culture of inclusiveness, positivity and drive to achieve our common goal. To share the light and warmth of hospitality. With amazing training, resources and support from both managers and colleagues, there is always an opportunity to develop and grow. WO…",52116.04,52116.04,,2025-04-17T20:18:18Z,https://www.adzuna.co.uk/jobs/land/ad/5150458738?se=PvjpFTIe8BGla2k9OSZXLA&utm_medium=api&utm_source=e1ad5111&v=B4A694E829287F8358CDA2F4605D34B694D70767,Hospitality & Catering Jobs,management
Chief Officer Town Clerk,Ad Warrior,"Wales, UK","Chief Officer (Town Clerk) Location: Barry Salary: Scale LC4 (Points 50-54 £62,377 to £70,065 per annum) (Pay award pending from 1st April) Hours: Full Time (37 Hours Per Week) The Town Council is committed to serving the people of the town, by providing essential facilities and fostering community development and well-being for the residents. They are the largest Town Council in Wales, made of up 22 elected members, and served by 30 members of staff. The Council provides cemetery services, man…",70000,70000,permanent,2025-04-11T13:48:34Z,https://www.adzuna.co.uk/jobs/details/5140477938?utm_medium=api&utm_source=e1ad5111,Admin Jobs,management
Chief Officer - Legal and Governance,Rugby Borough Council,"New Bilton, Rugby","Chief Officer - Legal and Governance £67,243 - £78,011 (including Statutory Role Allowance of £5,978) Full time 37 hours a week Rugby Borough Council is dedicated to both community and colleague growth with a commitment to creating a Thriving, Fairer, Greener and Healthier Borough. With a focus on wellbeing and personal development, we offer a range of career opportunities where you can take pride in the positive changes you help create. Join an organisation committed to the success of one of t…",75000,75000,permanent,2025-04-05T05:35:35Z,https://www.adzuna.co.uk/jobs/details/5130680686?utm_medium=api&utm_source=e1ad5111,Legal Jobs,management
Chief Executive,HARRIS HILL EXECUTIVE SEARCH,"Shropshire, West Midlands","Harris Hill is delighted to be working with Shropshire Youth Support Trust (SYST) to recruit its new Chief Executive Officer. SYST is a registered Charity that provides a wide range of support for young people in Shropshire, including Telford and Wrekin, aged between 16 – 30 years, who are not in education, employment, or training. SYST supports and empowers young people across Telford & Wrekin, Shropshire to identify their unique strengths and passions, whilst giving them the tools to sustain …",55000,55000,permanent,2025-04-12T03:32:26Z,https://www.adzuna.co.uk/jobs/details/5141588738?utm_medium=api&utm_source=e1ad5111,Admin Jobs,management
Chief of Staff,Liverpool City Region Combined Authority,"Low Hill, Liverpool","About the Role We’re looking for an exceptional individual to become the Chief of Staff to the Mayor of the Liverpool City Region. The Chief of Staff will serve as a trusted adviser to the Mayor, playing a critical role in supporting the work and vision of the Mayor, collaborating within and outside the Combined Authority, ensuring the effective running of the Mayor’s office. You will report directly to the Chief Executive and work closely with the Executive Directors and their teams. About the…",0,113319,permanent,2025-04-01T02:25:33Z,https://www.adzuna.co.uk/jobs/details/5120618390?utm_medium=api&utm_source=e1ad5111,Accounting & Finance Jobs,management
Chief Executive,Homes for Wells,"Holkham, Wells-Next-The-Sea",HOMES FOR WELLS is a small local Housing Association in the beautiful town of Wells-next-the-Sea. We house local key workers in affordable rented accommodation and currently manage around 30 properties. We are a Charitable Community Benefit Society a CLT and a RSL. We have a board of volunteers and two part time staff – a Chief Executive and an Administrator. We are seeking a new Chief Executive to be responsible for the day to day running of the organisation. The successful applicant will have…,45000,50000,permanent,2025-04-12T03:32:26Z,https://www.adzuna.co.uk/jobs/details/5141588746?utm_medium=api&utm_source=e1ad5111,Admin Jobs,management
Chief Executive,Premier League Charitable Fund,"London, UK","This is a fantastic opportunity to join one of the biggest sport charities in the world, and make a difference to the lives of hundreds of thousands of people every year. Launched in 2010 to support the delivery of the Premier League Communities strategy, the Premier League Charitable Fund distributes around £35million a year to professional football club community organisations (CCOs), from the Premier League and partners. As Chief Executive, you will be responsible for leading a team of 30 to…",100000,115000,permanent,2025-04-19T06:47:12Z,https://www.adzuna.co.uk/jobs/details/5152802657?utm_medium=api&utm_source=e1ad5111,Customer Services Jobs,management
Chief Engineer,Hilton Leeds,"Hyde Park, Leeds","WELCOME TO A WORLD OF OPPORTUNITIES AT THE WORLD'S 1 BEST WORKPLACE, AWARDED BY GREAT PLACE TO WORK & FORTUNE.- No two days or two hotels are the same, but our spirit and passion for hospitality always brings all our teams together to create a culture of inclusiveness, positivity and drive to achieve our common goal. To share the light and warmth of hospitality. With amazing training, resources and support from both managers and colleagues, there is always an opportunity to develop and grow. WO…",50963.61,50963.61,,2025-04-18T06:37:02Z,https://www.adzuna.co.uk/jobs/details/5151107163?utm_medium=api&utm_source=e1ad5111,Hospitality & Catering Jobs,management
Chief of Staff,Liverpool City Region Combined Authority,"Merseyside, North West England","About the Role We’re looking for an exceptional individual to become the Chief of Staff to the Mayor of the Liverpool City Region. The Chief of Staff will serve as a trusted adviser to the Mayor, playing a critical role in supporting the work and vision of the Mayor, collaborating within and outside the Combined Authority, ensuring the effective running of the Mayor’s office. You will report directly to the Chief Executive and work closely with the Executive Directors and their teams. About the…",60754.36,60754.36,,2025-04-02T10:55:53Z,https://www.adzuna.co.uk/jobs/details/5123852586?utm_medium=api&utm_source=e1ad5111,Accounting & Finance Jobs,management
Chief Executive,Penna Executive Search,"Norfolk, Eastern England","Flood, Drought, and Everything In Between Be Part of the Solution Chief Executive - £Competitive Water Management Alliance – King’s Lynn, Norfolk The Water Management Alliance (WMA) is dedicated to maintaining and improving water level management across lowland environments. We provide flood and drought response services, surface water drainage, and water level management to safeguard communities, businesses, and the environment and reduce flood risk to people, property, infrastructure, and the…",53548.54,53548.54,,2025-04-12T11:25:29Z,https://www.adzuna.co.uk/jobs/details/5141948509?utm_medium=api&utm_source=e1ad5111,Engineering Jobs,management
Chief Executive,Homes for Wells,"Norfolk, Eastern England",HOMES FOR WELLS is a small local Housing Association in the beautiful town of Wells-next-the-Sea. We house local key workers in affordable rented accommodation and currently manage around 30 properties. We are a Charitable Community Benefit Society a CLT and a RSL. We have a board of volunteers and two part time staff – a Chief Executive and an Administrator. We are seeking a new Chief Executive to be responsible for the day to day running of the organisation. The successful applicant will have…,44139.58,44139.58,,2025-04-13T11:45:06Z,https://www.adzuna.co.uk/jobs/details/5143139854?utm_medium=api&utm_source=e1ad5111,Admin Jobs,management
Chief Executive,Memcom Executive,"London, UK","This is an exceptional opportunity to lead a dynamic, values-led professional body at a time of great momentum, ambition and possibility. With a growing membership of over 36,000 and a proud history of advancing occupational therapy for over 90 years, the Royal College of Occupational Therapists (RCOT) stands at the forefront of supporting one of the most impactful and human-centred professions in health and social care. We’re seeking a visionary, energetic and transformational Chief Executive …",63658.18,63658.18,,2025-04-16T17:53:40Z,https://www.adzuna.co.uk/jobs/details/5147552483?utm_medium=api&utm_source=e1ad5111,Healthcare & Nursing Jobs,management
Chief Executive,Immigration Law Practitioners Assoc,"London, UK","The Chief Executive has overall responsibility for the management, strategic direction, and visionary leadership of the Immigration Law Practitioners’ Association (ILPA). They will drive organisational sustainability and impact by: Setting, with the Committee of Trustees, the overall direction of ILPA and developing both all-encompassing and project aligned strategies and outcomes. Managing ILPA’s day to day operations. Managing human resource matters, including reporting lines and working with…",49087.75,49087.75,,2025-04-11T11:09:17Z,https://www.adzuna.co.uk/jobs/details/5140324143?utm_medium=api&utm_source=e1ad5111,Admin Jobs,management
Chief Executive,Tees Valley Combined Authority,"North Yorkshire, Yorkshire And The Humber","Chief Executive Tees Valley Combined Authority £160,000 pa We are Tees Valley. Anything is Possible. Tees Valley Combined Authority is driving transformational change across the five boroughs of Darlington, Hartlepool, Middlesbrough, Redcar & Cleveland and Stockton-on-Tees. Backed by an investment pot of £1.7billion, the organisation is tasked with creating jobs, growing the economy and changing lives through its responsibility and funding over areas such as business support; inward investment;…",61552.34,61552.34,,2025-04-06T11:09:45Z,https://www.adzuna.co.uk/jobs/details/5132277828?utm_medium=api&utm_source=e1ad5111,Accounting & Finance Jobs,management
Chief Engineer,AXIOM HOSPITALITY LIMITED,"The City, Central London","Salary - £50,000 per annum We are currently recruiting for a Chief Engineer to join our Truly Talented team. As a Chief Engineer, you will be responsible for the upkeep, maintenance, and management of all areas of the hotel, including energy conservation. You will use your leadership skills to inspire your team and provide a seamless guest experience every time. What we offer £50,000 per annum Permanent, full-time contract Your role The role requires someone who will be hands-on with repair and…",44772.81,44772.81,permanent,2025-04-15T17:32:16Z,https://www.adzuna.co.uk/jobs/details/5145898619?utm_medium=api&utm_source=e1ad5111,Hospitality & Catering Jobs,management
