title,company,location,description,salary_min,salary_max,contract_type,created,redirect_url,category,specialty,source_country,query,query_type,remote_friendly,international
Senior AIX Administrator - Secret Clearance Required,Maximus,"Savage, Anne Arundel County","General information Job Posting Title Senior AIX Administrator Date Tuesday, April 8, 2025 City Annapolis Junction State MD Country United States Working time Full-time Description & Requirements Maximus is seeking an experienced Senior AIX Administrator in support of our homeland security customer. As part of our AIX team, you will be responsible for managing and maintaining the AIX-based infrastructure. Your role will involve overseeing system administration, troubleshooting, performance opti…",120215.65,120215.65,,2025-04-15T01:17:04Z,https://www.adzuna.com/land/ad/5145089220?se=5JwDefEo8BGT4w9x5LWCew&utm_medium=api&utm_source=e1ad5111&v=9E1EC9172EFDD531A6542F063F7016E34562B705,IT Jobs,infrastructure,us,infrastructure,standard,False,False
Director of Cloud Infrastructure,Jobot,"Boston, Suffolk County","Director of Cloud Infrastructure This Jobot Job is hosted by: Steven Zacharias Are you a fit? Easy Apply now by clicking the ""Apply Now"" button and sending us your resume. Salary: $200,000 - $300,000 per year A bit about us: We are looking for a hands on Director of Cloud Infrastructure to join our team on-site in Boston, MA! This opportunity can work HYBRID remote or 100% on-site if preferred. Must be based in a commutable distance to the Boston, MA area. You can quickly apply by sending an up…",151049.45,151049.45,,2025-05-01T00:55:22Z,https://www.adzuna.com/land/ad/5171845238?se=5JwDefEo8BGT4w9x5LWCew&utm_medium=api&utm_source=e1ad5111&v=C9665013C99F2B831164CD4589B77C00BD4D291E,IT Jobs,infrastructure,us,infrastructure,standard,True,False
Infrastructure Support Engineer,Jobot,"Tulsa, Tulsa County","This Jobot Job is hosted by: Dan Dungy Are you a fit? Easy Apply now by clicking the ""Apply Now"" button and sending us your resume. Salary: $65,000 - $75,000 per year A bit about us: Growing Tech company. Capabilities include Managed Services, hardware/software sales and implementation, security services, NOC, SOC, network engineering and architecture. Why join us? Career Growth Opportunities, company paid training and certifications, performance bonuses, great benefits and unlimited PTO Job De…",75550.55,75550.55,,2025-05-01T00:57:09Z,https://www.adzuna.com/land/ad/5171851436?se=5JwDefEo8BGT4w9x5LWCew&utm_medium=api&utm_source=e1ad5111&v=E4C816AE6B1862A2B409E24B3D29DAA90CFAC7D9,IT Jobs,infrastructure,us,infrastructure,standard,False,False
Cloud Infrastructure Engineer,Jobot,"Temecula, Riverside County","Remote Opportunity for a Cloud Engineer to lead scalable, secure Azure solutions in a dynamic, multi-cloud environment! This Jobot Job is hosted by: Liz Valdez Are you a fit? Easy Apply now by clicking the ""Apply Now"" button and sending us your resume. Salary: $140,000 - $165,000 per year A bit about us: We're the nation’s leading supplier of biopharmaceuticals, plasma products, and vaccines with a flawless safety track record and an unwavering commitment to customer-driven innovation. Our stra…",146465.97,146465.97,,2025-05-01T00:56:58Z,https://www.adzuna.com/land/ad/5171851016?se=5JwDefEo8BGT4w9x5LWCew&utm_medium=api&utm_source=e1ad5111&v=92056F1D1922FE7C23184BB620CCD9C92A74A893,IT Jobs,infrastructure,us,infrastructure,standard,True,False
"Mechanical Engineer, Infrastructure",Jobot,"Atlanta, Fulton County","Building Design engineering firm looking for a Mechanical Engineer to join their Infrastructure team, opportunity to work on a variety of project types - energy systems, decarbonization, piping design This Jobot Job is hosted by: Riley Duffy Are you a fit? Easy Apply now by clicking the ""Apply Now"" button and sending us your resume. Salary: $120,000 - $150,000 per year A bit about us: We are a Full-Service Engineering company that specializes in providing design and engineering services for all…",98444.83,98444.83,,2025-05-01T00:55:49Z,https://www.adzuna.com/land/ad/5171846824?se=5JwDefEo8BGT4w9x5LWCew&utm_medium=api&utm_source=e1ad5111&v=5EAB6312B3ADA77CAFCFB38E5969F64414E0CE01,Engineering Jobs,infrastructure,us,infrastructure,standard,False,False
Superintendent - Water Infrastructure,Jobot,"Orem, Utah County","Competitive Pay | Excellent Benefits | Long-Term Growth This Jobot Job is hosted by: Kellie Hatcher Are you a fit? Easy Apply now by clicking the ""Apply Now"" button and sending us your resume. Salary: $120,000 - $150,000 per year A bit about us: Our client, a water infrastructure industry leader in the Southwest for over 40 years, is seeking a Construction Superintendent to add value to their growing team. Specializing in all forms of water general contracting throughout Arizona, New Mexico, an…",95116.27,95116.27,,2025-05-01T00:57:10Z,https://www.adzuna.com/land/ad/5171851550?se=5JwDefEo8BGT4w9x5LWCew&utm_medium=api&utm_source=e1ad5111&v=24C50E9302144722EC8EFA0A243D67532DEE059F,Engineering Jobs,infrastructure,us,infrastructure,standard,False,False
Infrastructure Database Senior Engineer,VALUECONNECT CONSULTING CORPORATION,"Lancaster, Dallas","Posting Title: Infrastructure Database Senior Engineer Work Type: On-Site Work Type Instructions: onsite Job Location: Dallas, TX Exact Company Location/Pin: 75241 Candidate Location Accepted by Client: Dallas, TX Work Authorization - Visa Name: (USC) US Citizen;(GC) Green Card Minimum Work Experience: 8 Years Mandatory Skills: Azure SQL, Azure SQL MI, Azure SQL for PostgreSQL. Good to Have Skills: MongoDB, DynamoDB, Azure Cosmos DB, Neo4j, Neptune etc Contract Duration in Months: 6 Contract Du…",122311.33,122311.33,contract,2025-04-17T08:37:03Z,https://www.adzuna.com/land/ad/5149597019?se=5JwDefEo8BGT4w9x5LWCew&utm_medium=api&utm_source=e1ad5111&v=6DB562CE9196C00A7580ACD448AC566B9E0F36CE,IT Jobs,infrastructure,us,infrastructure,standard,False,False
Infrastructure Application support engineer,Marvel Info Tech Inc,"Stamford, Fairfield County","Greetings, I hope you're doing well. This is Gufran from Marvel Infotech, reaching out to share an exciting opportunity with you. Please find the job description below. If you're interested, kindly share your updated resume. Role- Infrastructure Application support engineer Location: Stamford, CT onsite Job Summary – The role is for Infra application support engineer working in US NWM Infra team. The candidate will be responsible for the design, implementation, and 2nd level support of large-sc…",75241.52,75241.52,,2025-04-11T07:33:05Z,https://www.adzuna.com/land/ad/5140392406?se=5JwDefEo8BGT4w9x5LWCew&utm_medium=api&utm_source=e1ad5111&v=2EF482B01E4F430E91D59AC45141D619ADA52E7B,IT Jobs,infrastructure,us,infrastructure,standard,False,False
Infrastructure Engineer Sr - Contractor,System One,"Bloomfield, Allegheny County","Visa: USC/GC Position Tittle: Sr. Infrastructure Engineer (153144-1) Duration: Contract to Hire Primary Location: Phoenix AZ (Hybrid) Years of Experience: 10 years applicable experience required For immediate consideration, you can email me at “shafique.mohammed@systemone.com"" Connect with me on LinkedIn https://www.linkedin.com/in/shafique-m-519421bb/ Industry Background: Banking Candidate Technical and skills profile: Devops exp with Kubernetes and Openshift Roles and Responsibilities: Experi…",112032.79,112032.79,,2025-05-02T10:26:22Z,https://www.adzuna.com/land/ad/5176371441?se=5JwDefEo8BGT4w9x5LWCew&utm_medium=api&utm_source=e1ad5111&v=AE81D4D58A26CEBD6F44D95784ADB21093AEEF99,IT Jobs,infrastructure,us,infrastructure,standard,False,False
PGD Technical Services Specialist - Critical Infrastructure Protection,NextEra,"Palm Beach Gardens, Palm Beach County","here to learn more. Employee Group: Exempt Employee Type: Full Time Job Category: Technical Specialist Organization: NextEra Energy Resources, LLC Relocation Provided: Yes, if applicable NextEra Energy is an Equal Opportunity Employer. Qualified applicants are considered for employment without regard to race, color, age, national origin, religion, marital status, sex, sexual orientation, gender identity, gender expression, genetics, disability, protected veteran status or any other basis prohib…",108666.19,108666.19,,2025-05-02T06:53:40Z,https://www.adzuna.com/details/5175969123?utm_medium=api&utm_source=e1ad5111,"Energy, Oil & Gas Jobs",infrastructure,us,infrastructure,standard,False,False
Senior Project Manager-Water Infrastructure,Kimmel & Associates,"Salt Lake City, Salt Lake County","About the Company: The company is dedicated to tackling complex projects with innovative and effective solutions, regardless of their size or scope. As a professional contractor with extensive experience, the company has earned a reputation for integrity and reliability. Their portfolio spans a diverse array of projects, including highways, pipelines, bridges, dams, airports, mines, and environmental reclamation across the Intermountain West and Southwest, encompassing states like Utah, Arizona…",107072.01,107072.01,,2025-02-09T01:13:33Z,https://www.adzuna.com/land/ad/5043598188?se=5JwDefEo8BGT4w9x5LWCew&utm_medium=api&utm_source=e1ad5111&v=38D7FEC6BC840285A3DF82C8460276F047FCB0F4,Engineering Jobs,infrastructure,us,infrastructure,standard,False,False
IAM/Security Infrastructure Architect,SMBC Group,"White Plains, Westchester County","SMBC Group is a top-tier global financial group. Headquartered in Tokyo and with a 400-year history, SMBC Group offers a diverse range of financial services, including banking, leasing, securities, credit cards, and consumer finance. The Group has more than 130 offices and 80,000 employees worldwide in nearly 40 countries. Sumitomo Mitsui Financial Group, Inc. (SMFG) is the holding company of SMBC Group, which is one of the three largest banking groups in Japan. SMFG’s shares trade on the Tokyo…",143752.56,143752.56,,2025-04-01T12:52:31Z,https://www.adzuna.com/land/ad/5121851123?se=5JwDefEo8BGT4w9x5LWCew&utm_medium=api&utm_source=e1ad5111&v=EE177FC6F15387B123CCEEB62F581E845B2EFDBF,Accounting & Finance Jobs,infrastructure,us,infrastructure,standard,False,True
"Infrastructure Manager, Information Technology",Brooks Rehabilitation,"Jacksonville, Duval County","The Infrastructure Manager will have a key role in solution and enterprise architecture enablement and maturity growth within the IT group. It will be achieved by following the Brook’s Rehab vision and strategy and high contribution to IT team strategic priorities implementation. In the role, the manger will lead the team by driving the solutions, implementations, and documentation ensuring that we meet our businesses needs in availability, security, performance, and scale. The ideal candidate …",118667.2,118667.2,,2025-03-12T07:58:04Z,https://www.adzuna.com/land/ad/5088578697?se=5JwDefEo8BGT4w9x5LWCew&utm_medium=api&utm_source=e1ad5111&v=5166EFB21293EDBA867EBF28A00E63F942334EB8,IT Jobs,infrastructure,us,infrastructure,standard,False,False
"Director, Software Engineering - Infrastructure",Samsara,"Highland Park, Dallas","Samsara (NYSE: IOT) is the pioneer of the Connected Operations™ Cloud, which is a platform that enables organizations that depend on physical operations to harness Internet of Things (IoT) data to develop actionable insights and improve their operations. At Samsara, we are helping improve the safety, efficiency and sustainability of the physical operations that power our global economy. Representing more than 40% of global GDP, these industries are the infrastructure of our planet, including ag…",170560.67,170560.67,,2025-03-12T08:00:17Z,https://www.adzuna.com/land/ad/5088582543?se=5JwDefEo8BGT4w9x5LWCew&utm_medium=api&utm_source=e1ad5111&v=BD46E6A87F53B935B58F1EB471AEAAC8E604E475,Engineering Jobs,infrastructure,us,infrastructure,standard,False,True
Infrastructure Engineer (Citrix & Virtualization),BNY Mellon,"Lake Mary, Seminole County","At BNY, our culture empowers you to grow and succeed. As a leading global financial services company at the center of the world’s financial system we touch nearly 20% of the world’s investible assets. Every day around the globe, our 50,000 employees bring the power of their perspective to the table to create solutions with our clients that benefit businesses, communities and people everywhere. We continue to be a leader in the industry, awarded as a top home for innovators and for creating an i…",80579.91,80579.91,,2024-07-25T12:19:43Z,https://www.adzuna.com/land/ad/4795175948?se=qmbvevEo8BGDGO_HSiZXLA&utm_medium=api&utm_source=e1ad5111&v=A3DF948A5E0AAD49FF5DDBC4850482075965834C,IT Jobs,infrastructure,us,infrastructure,standard,True,True
Audit Manager - IT Infrastructure,SMBC Group,"White Plains, Westchester County","SMBC Group is a top-tier global financial group. Headquartered in Tokyo and with a 400-year history, SMBC Group offers a diverse range of financial services, including banking, leasing, securities, credit cards, and consumer finance. The Group has more than 130 offices and 80,000 employees worldwide in nearly 40 countries. Sumitomo Mitsui Financial Group, Inc. (SMFG) is the holding company of SMBC Group, which is one of the three largest banking groups in Japan. SMFG’s shares trade on the Tokyo…",140324.81,140324.81,,2025-04-01T12:54:24Z,https://www.adzuna.com/land/ad/5121854750?se=qmbvevEo8BGDGO_HSiZXLA&utm_medium=api&utm_source=e1ad5111&v=04D47A355527F929EAFF7BE6C5BB1B2DFC4B972A,Accounting & Finance Jobs,infrastructure,us,infrastructure,standard,False,True
IT Infrastructure Architect,Uline,"Kenosha, Kenosha County","IT Infrastructure Architect Pay from $121,000 to $185,000 per year Corporate Headquarters 12575 Uline Drive, Pleasant Prairie, WI 53158 Develop your ideal IT career, crafting custom software solutions, at Uline. Bring your expertise to help manage our industry-leading team behind one of the largest e-commerce sites in the U.S. Better together! This position is on-site in Pleasant Prairie, WI or Waukegan, IL based on need, and we are looking for people who share our passion. Position Responsibil…",139207.83,139207.83,,2025-04-03T13:37:29Z,https://www.adzuna.com/land/ad/5127189320?se=qmbvevEo8BGDGO_HSiZXLA&utm_medium=api&utm_source=e1ad5111&v=EFF61DF0DD57AAF436432F0C243F777828FDB21C,IT Jobs,infrastructure,us,infrastructure,standard,False,False
"Executive Director, Infrastructure Sponsors - Underwriting & Portfolio Managment - New York",Santander Holdings USA Inc,"Franklin D Roosevelt, Manhattan","Executive Director, Infrastructure Sponsors - Underwriting & Portfolio Managment - New York New York, United States of America The Executive Director is responsible for managing the Underwriting & Portfolio Management of a defined portfolio of Financial Sponsor driven transactions. The Portfolio is primary comprised of Infrastructure Finance Corporate Loans and NAV Credit Facilities used to finance Infrastructure Assets. This position will work closely with the Infrastructure Sponsors Coverage …",199256.22,199256.22,,2025-04-27T23:10:59Z,https://www.adzuna.com/land/ad/5166346041?se=qmbvevEo8BGDGO_HSiZXLA&utm_medium=api&utm_source=e1ad5111&v=E1B028C643ECBF43CB483E12E122EA8A237AA7AD,Accounting & Finance Jobs,infrastructure,us,infrastructure,standard,False,False
"Senior Manager, IT Infrastructure",Avidity Biosciences,"San Diego, San Diego County","Job Title: Senior Manager, IT Infrastructure Location: San Diego, CA / Hybrid Position type: FLSA: Full time Exempt Department: Finance ID: IT Security, Infrastructure and EA 9180-2024-2-P Profoundly Improve People’s lives by Revolutionizing the Delivery of RNA Therapeutics At Avidity Biosciences, we are passionate about the impact of every employee in realizing our vision of improving people’s lives by delivering a new class of RNA therapeutics. Avidity is revolutionizing the field of RNA with…",177898.81,177898.81,,2025-04-17T10:15:46Z,https://www.adzuna.com/land/ad/5149747039?se=qmbvevEo8BGDGO_HSiZXLA&utm_medium=api&utm_source=e1ad5111&v=9D6F807F0579263DE798F6D199660789359F0171,IT Jobs,infrastructure,us,infrastructure,standard,False,False
Associate Director - Infrastructure Lead,Eli Lilly and Company,"Lebanon, Boone County","At Lilly, we unite caring with discovery to make life better for people around the world. We are a global healthcare leader headquartered in Indianapolis, Indiana. Our employees around the world work to discover and bring life-changing medicines to those who need them, improve the understanding and management of disease, and give back to our communities through philanthropy and volunteerism. We give our best effort to our work, and we put people first. We’re looking for people who are determine…",105046.22,105046.22,,2025-05-01T22:35:48Z,https://www.adzuna.com/land/ad/5175111180?se=qmbvevEo8BGDGO_HSiZXLA&utm_medium=api&utm_source=e1ad5111&v=D4AB84B56FDD680D49D017696CC0C9893396FAD7,IT Jobs,infrastructure,us,infrastructure,standard,False,True
Sr Infrastructure Engineer,Ryan Consulting Group,"Charlotte, Mecklenburg County","Job Description Job Description We are seeking a skilled Infrastructure Engineer to join our team in Charlotte, NC. This role is ideal for a proactive professional who thrives in a dynamic environment and is eager to support and optimize infrastructure systems as we transition to cutting-edge technologies. Key Responsibilities: • Virtualization Management: Maintain and support VMware infrastructure with a planned migration to Nutanix. • Containerization: Utilize Docker to build, manage, and opt…",114261.83,114261.83,,2025-05-03T01:22:23Z,https://www.adzuna.com/land/ad/5177940718?se=qmbvevEo8BGDGO_HSiZXLA&utm_medium=api&utm_source=e1ad5111&v=8CE3B9045A5DF22EF3A0C2A1D99BD322C6E6D7F3,IT Jobs,infrastructure,us,infrastructure,standard,True,False
IT Infrastructure Engineer,Robert Half,"Brookfield, Fairfield County","Job Description Job Description We’re partnering with a thriving IT consulting firm known for their strong client relationships, technical excellence, and industry-leading employee retention. They are built on collaboration, growth, and trust—with both their clients and their tenured team. As they continue to grow, they are in need of a well-rounded Infrastructure Engineer to join them and make an immediate impact. Position Overview: This is a hands-on role for a versatile IT professional with …",85000,145000,,2025-04-24T15:49:36Z,https://www.adzuna.com/land/ad/5160975083?se=qmbvevEo8BGDGO_HSiZXLA&utm_medium=api&utm_source=e1ad5111&v=7971E17D0CA54C888F68B43807798C22E3E9B462,IT Jobs,infrastructure,us,infrastructure,standard,False,False
Systems Infrastructure Engineer,California Coast Credit,"San Diego, San Diego County","Job Description Job Description This position is accountable for overall design, installation and maintenance of the organization’s LAN, WAN and network security systems. Responsibilities include analyzing system performance, utilization reporting and capacity planning, establishing and implementing policies and procedures for LAN/WAN usage throughout the organization, executing network and security projects, executing and implementing security compliance, practices and policies, executing risk…",140614.17,140614.17,,2025-05-02T01:14:00Z,https://www.adzuna.com/land/ad/5175377354?se=qmbvevEo8BGDGO_HSiZXLA&utm_medium=api&utm_source=e1ad5111&v=0103C59D38AE42BB0DC428283E882567D8BB01B8,IT Jobs,infrastructure,us,infrastructure,standard,False,False
Senior Infrastructure Engineer,DBI Staffing,"New York City, New York","Job Description Job Description Position Summary: This position is responsible for the architecture, design, support, implementation and preventive maintenance of the firms’ server and storage infrastructure including on premise and cloud solutions. This position is also responsible for the integrity and availability of all firm data. Principal Duties and Responsibilities: Design, maintain, upgrade, monitor server and data storage infrastructure in all firm offices and datacenters and Microsoft…",105908.18,105908.18,,2025-05-02T01:17:29Z,https://www.adzuna.com/land/ad/5175395863?se=qmbvevEo8BGDGO_HSiZXLA&utm_medium=api&utm_source=e1ad5111&v=51044BD747E3579B77D8840E414B03DFC7E3F5D1,IT Jobs,infrastructure,us,infrastructure,standard,False,False
"IT Analyst, Infrastructure & Operations (IT and App Support)",MILROSE CONSULTANTS LLC,"New York City, New York","Job Description Job Description Company Overview: Milrose Consultants is hiring an IT Analyst, Infrastructure & Operations (IT and App Support) in our large expanding company! This position will be in our Milrose Consultants NYC headquarters. With over 30 years of experience, Milrose is a leading national provider of building code compliance and consulting solutions, serving clients and agencies across the U.S. Our expertise includes areas such as code analysis, land use, zoning, and permit exp…",70593.53,70593.53,,2025-04-29T23:45:43Z,https://www.adzuna.com/land/ad/5169887461?se=qmbvevEo8BGDGO_HSiZXLA&utm_medium=api&utm_source=e1ad5111&v=EA012BCFF30492426AF953E4FE42CBFF5FBFD3FF,IT Jobs,infrastructure,us,infrastructure,standard,False,False
"Director , Treasury Systems & Infrastructure",Lennar Homes,"Miami, Miami-Dade County","We are Lennar Lennar is one of the nation's leading homebuilders, dedicated to making an impact and creating an extraordinary experience for their Homeowners, Communities, and Associates by building quality homes and providing exceptional customer service, giving back to the communities in which we work and live in, and fostering a culture of opportunity and growth for our Associates throughout their career. Lennar has been recognized as a Fortune 500® company and consistently ranked among the …",126481.87,126481.87,,2025-04-30T14:51:29Z,https://www.adzuna.com/land/ad/5171292620?se=qmbvevEo8BGDGO_HSiZXLA&utm_medium=api&utm_source=e1ad5111&v=BC36BDC5AC3E4C6887D2AF0DD67CFA4C80B11ECC,Accounting & Finance Jobs,infrastructure,us,infrastructure,standard,False,False
Senior Infrastructure & Security Engineer,Appian Corporation,"Pimmit, Fairfax County","Here at Appian, our core values of Respect, Work to Impact, Ambition, and Constructive Dissent & Resolution define who we are. In short, this means we constantly seek to understand the best for our customers, we go beyond completion in our work, we strive for excellence with intensity, and we embrace candid communication. These values guide our actions and shape our culture every day. When you join Appian, youll be part of a passionate team thats dedicated to accomplishing hard things. Appian’s…",114245.48,114245.48,,2025-03-24T12:28:25Z,https://www.adzuna.com/land/ad/5108912105?se=qmbvevEo8BGDGO_HSiZXLA&utm_medium=api&utm_source=e1ad5111&v=73FBC40BA3811B301A87DE45078FE334D650B2FA,IT Jobs,infrastructure,us,infrastructure,standard,False,False
"Software Engineer, AI Infrastructure",Pure Storage,"Santa Clara, Santa Clara County","We’re in an unbelievably exciting area of tech and are fundamentally reshaping the data storage industry. Here, you lead with innovative thinking, grow along with us, and join the smartest team in the industry. This type of work—work that changes the world—is what the tech industry was founded on. So, if youre ready to seize the endless opportunities and leave your mark, come join us. At Pure Storage, we are on a mission to revolutionize AI infrastructure. AI & Data Science is complex, but our …",183984.94,183984.94,,2025-03-19T12:18:45Z,https://www.adzuna.com/land/ad/5101332399?se=qmbvevEo8BGDGO_HSiZXLA&utm_medium=api&utm_source=e1ad5111&v=4A13A641BC88F5BA76E5D674DFE10E300C8C390A,IT Jobs,infrastructure,us,infrastructure,standard,False,False
"Electrical Engineer, Infrastructure Design",Jobot,"Baltimore, Baltimore County","National Building Design Engineering firm looking for an Electrical Designer with infrastructure design experience This Jobot Job is hosted by: Riley Duffy Are you a fit? Easy Apply now by clicking the ""Apply Now"" button and sending us your resume. Salary: $120,000 - $150,000 per year A bit about us: We are a Full-Service Engineering company that specializes in providing design and engineering services for all aspects of building and utility infrastructure construction. Our retention rates are …",93154.5,93154.5,,2025-05-02T03:18:33Z,https://www.adzuna.com/land/ad/5175664415?se=qmbvevEo8BGDGO_HSiZXLA&utm_medium=api&utm_source=e1ad5111&v=2996E11CAC8DD853DF858FC745B77BE4BC69DB42,Trade & Construction Jobs,infrastructure,us,infrastructure,standard,False,False
Senior Big Data Infrastructure Engineer,INSPYR Solutions,"Financial District, San Francisco","Senior Big Data Infrastructure Engineer - Long Term Project - San Francisco, CATitle: Senior Big Data Infrastructure Engineer Location: San Francisco, CA Duration: Long Term Project - 6 Months Compensation: $80-100/hr Work Requirements: US Citizen, GC Holders or Authorized to Work in the U.S. Summary The Ad Infrastructure team is looking for a seasoned Software and Cloud Infrastructure Engineer to help build and scale our data processing platforms. This role is focused on enabling infrastructur…",195520.81,195520.81,,2025-04-26T10:42:50Z,https://www.adzuna.com/land/ad/5164240509?se=qmbvevEo8BGDGO_HSiZXLA&utm_medium=api&utm_source=e1ad5111&v=7F87B61F4CA8E5A80B362A3C5A348AB37F0FC462,IT Jobs,infrastructure,us,infrastructure,standard,False,False
