title,company,location,description,salary_min,salary_max,contract_type,created,redirect_url,category,specialty,source_country,query,query_type,remote_friendly,international
Consultant·e.S Nantes - Cto Advisory - CDI H/F,Wavestone1,"Pont-Rousseau, Rezé","Au sein du bureau de Nantes, vous intervenez aux côtés de 150 consultant.e.s seniors et managers sur des missions permettant d'accompagner nos clients et de développer votre maîtrise de leurs problématiques. Nos consultant.e.s interviennent au sein d'entreprises de référence implantées dans toute la région Grand Ouest, et accompagnent en proximité nos clients dans leurs transformations digitales et leurs décisions stratégiques. Le bureau de Nantes adresse une grande majorité des savoir-faire du…",,,,2025-02-04T20:15:19Z,https://www.adzuna.fr/land/ad/5037491703?se=1PzvTPAo8BGT4w9x5LWCew&utm_medium=api&utm_source=e1ad5111&v=5A3DD8350769E2C38CF88326FF9961DC29C21136,Emplois Autres/Général,embedded systems,fr,embedded systems,standard,False,False
Technicien AIT Mécanique - Spatial H/F,Expleo,"Haute-Garonne, Occitanie","Au sein de l’équipe Electronics & Embedded Systems rattaché à l’agence de Toulouse vous occuperez le rôle de Experienced Embedded System Technician H/F. En tant que Technicien AIT - Mécanique, vous serez responsable de la configuration et de la qualification de systèmes et sous-systèmes dans le domaine du spatial . Missions : Préparer les activités (lecture des As-Run, préparation du matériel, etc.) Mettre à jour les procédures mécaniques ou les process AIT Développer et améliorer les moyens so…",,,permanent,2025-04-10T03:20:38Z,https://www.adzuna.fr/details/5138027315?utm_medium=api&utm_source=e1ad5111,Unknown,embedded systems,fr,embedded systems,standard,False,False
Technicien ait Mécanique - Spatial H/F,Expleo,"Rangueuil, Toulouse","Description du poste : Au sein de l'équipe Electronics & Embedded Systems rattaché à l'agence de Toulouse vous occuperez le rôle de Experienced Embedded System Technician H/F. En tant que Technicien AIT - Mécanique, vous serez responsable de la configuration et de la qualification de systèmes et sous-systèmes dans le domaine du spatial. Missions : - Préparer les activités (lecture des As-Run, préparation du matériel, etc.) - Mettre à jour les procédures mécaniques ou les process AIT - Développe…",,,,2025-04-11T04:51:43Z,https://www.adzuna.fr/details/5139922847?utm_medium=api&utm_source=e1ad5111,Unknown,embedded systems,fr,embedded systems,standard,False,False
Technicien développement Banc de Test H/F,Expleo,"Haute-Garonne, Occitanie","Au sein de l’équipe Electronics & Embedded Systems, rattaché à l’agence de Toulouse vous occuperez le rôle de Technicien Banc de Test H/F. Rattaché au responsable du bureau d’études et sous la responsabilité d'un chef de projet, vous participez à la conception et au développement de banc de test dans divers domaines comme l'aéronautique, le spatial, l'automobile… Au sein de l’équipe Electronics & Embedded Systems, rattaché à l’agence de Toulouse vous occuperez le rôle de Technicien développemen…",,,permanent,2025-03-15T02:24:31Z,https://www.adzuna.fr/details/5094461165?utm_medium=api&utm_source=e1ad5111,Unknown,embedded systems,fr,embedded systems,standard,False,False
Technicien Développement Banc de Test H/F,Expleo,"Rangueuil, Toulouse","Description du poste : Au sein de l'équipe Electronics & Embedded Systems, rattaché à l'agence de Toulouse vous occuperez le rôle de Technicien Banc de Test H/F. Rattaché au responsable du bureau d'études et sous la responsabilité d'un chef de projet, vous participez à la conception et au développement de banc de test dans divers domaines comme l'aéronautique, le spatial, l'automobile Au sein de l'équipe Electronics & Embedded Systems, rattaché à l'agence de Toulouse vous occuperez le rôle de T…",26000,26000,,2025-03-14T05:30:14Z,https://www.adzuna.fr/details/5092552159?utm_medium=api&utm_source=e1ad5111,Unknown,embedded systems,fr,embedded systems,standard,False,False
Internship: Advanced Formal Methods for RISC-V CPU Verification,Codasip,"Villeneuve-Loubet, Grasse","A 6-month internship starting in 2025 - For students in their last University, Engineering schools (computer science, electronics, embedded systems). Candidates must have the right to study and work in France. Locations: Villeneuve-Loubet, France. Hybrid work allowed. Objective To develop formal verification IP based on a new methodology to test Codasip RISC-V IPs. Background Formal methods are used for CPU verification at Codasip. We have several extensions in consideration to improve the veri…",,,,2025-02-25T21:50:10Z,https://www.adzuna.fr/details/5063456944?utm_medium=api&utm_source=e1ad5111,Emplois Autres/Général,embedded systems,fr,embedded systems,standard,False,False
Account Manager Junior IT Cloud Data IA H/F,Thomas Search Consulting,"Fontaine, Grenoble","Descriptif de notre client : Nous sommes une société de prestation de conseil en ingénierie en forte croissance qui rayonne déjà sur l'hexagone et à l'échelle internationale. Aujourd'hui, nous mandatons Thomas Search Consulting pour nous aider à trouver notre futur(e) Account Manager (Business Dev avec un embarqué de consultants) F/H. Nous proposons la mise à disposition de compétences à forte valeur ajoutée auprès des principaux acteurs Grenoblois. Notre mission est d'accompagner nos clients, …",55000,65000,,2025-02-08T07:35:36Z,https://www.adzuna.fr/details/5042357973?utm_medium=api&utm_source=e1ad5111,Emplois Autres/Général,embedded systems,fr,embedded systems,standard,False,True
SAP EWM Consultant,Recruit 121 Group,"Paris, Ile-de-France","Job Opportunity: SAP EWM Consultant Location: Paris Duration: 4.5 months Onsite Requirement: 3 days per week in Paris, plus monthly travel to Strasbourg Language Requirement: French (essential) We are looking for a senior-level SAP EWM Consultant to support a high-impact project involving an embedded EWM solution within an S/4HANA environment. The focus will be on ongoing user support, issue resolution, and managing stoppages in production flows. This role is ideal for someone with a strong bac…",,,,2025-05-02T09:10:52Z,https://www.adzuna.fr/land/ad/5175655295?se=1PzvTPAo8BGT4w9x5LWCew&utm_medium=api&utm_source=e1ad5111&v=A0208EF923F59124ABD88FE63411559B2910FA5F,Emplois Informatique,embedded systems,fr,embedded systems,standard,False,False
Embedded Software Engineer Ii H/F,Netatmo,"Saint-Cloud, Boulogne-Billancourt","Join our Embedded Software team, a group of ~40 passionate engineers shaping the intelligence behind our innovative connected products. As an Embedded Software Engineer II, you will contribute significantly to the design, development, and testing of embedded systems that bring our devices to life. With typically 3 to 7 years of experience, you'll take increasing ownership of software components, applying best practices to ensure quality, performance, and maintainability. Working closely with ha…",,,,2025-04-22T06:26:32Z,https://www.adzuna.fr/land/ad/5155882341?se=1PzvTPAo8BGT4w9x5LWCew&utm_medium=api&utm_source=e1ad5111&v=6A69AF5A8AB197AD51938CCC036297F61768D27F,Emplois Informatique,embedded systems,fr,embedded systems,standard,False,False
Enseignant chercheur Informatique/Cybersécurité H/F,CESI,"Nice 13e Canton, Nice","Being a Researcher at CESI means participating in research and innovation activities within our LINEACT laboratory (Digital Innovation Laboratory for Business and Apprenticeships at the service of Regional Competitiveness). The LINEACT presentation: https://lineact.cesi.fr/en/presentation-lineact/ More specifically: Reporting to the Head of Research and Innovation, the Associate Professor and Researcher in informatics will strengthen the team involved in the teaching of cybersecurity, networks,…",,,,2023-10-18T01:31:28Z,https://www.adzuna.fr/details/4377667919?utm_medium=api&utm_source=e1ad5111,Unknown,embedded systems,fr,embedded systems,standard,False,False
Enseignant chercheur Informatique/Cybersécurité H/F,Cesi,"Aix en Provence Sud-Ouest, Aix-en-Provence","Being a Researcher at CESI means participating in research and innovation activities within our LINEACT laboratory (Digital Innovation Laboratory for Business and Apprenticeships at the service of Regional Competitiveness). The LINEACT presentation: https://lineact.cesi.fr/en/presentation-lineact/ More specifically: Reporting to the Head of Research and Innovation, the Associate Professor and Researcher in informatics will strengthen the team involved in the teaching of cybersecurity, networks,…",,,,2024-01-24T19:16:27Z,https://www.adzuna.fr/details/4542977381?utm_medium=api&utm_source=e1ad5111,Unknown,embedded systems,fr,embedded systems,standard,False,False
Senior Python Developer- Network Systems Engineer,Ekinops,"Grasse, Alpes-Maritimes","For over 20 years, Ekinops has been driving innovation in network systems. We provide solutions focused on the needs of communication service providers and enterprises worldwide. We provide open , trusted and innovative network connectivity and enable our customers’ success by delivering high value-added software-driven solutions. Today, over 120 international service providers, including numerous Tier 1 carriers around the world, trust our people and technologies. Over 50% of our 500 strong te…",,,,2025-04-11T05:27:51Z,https://www.adzuna.fr/land/ad/5139961918?se=1PzvTPAo8BGT4w9x5LWCew&utm_medium=api&utm_source=e1ad5111&v=D84874A763D15FE1C0B75896B10027EE7209E664,Unknown,embedded systems,fr,embedded systems,standard,False,True
Ingénieure ou Ingénieur de Recherche en Informatique - CDI H/F,Télécom Paris,"Villebon-sur-Yvette, Palaiseau","Qui sommes-nous ? Télécom Paris, école de l'IMT (Institut Mines-Télécom) et membre fondateur de l'Institut Polytechnique de Paris, est une grande école du top 5 des écoles d'ingénieurs généralistes françaises. La Raison d'Être de Télécom Paris est de former, imaginer et entreprendre pour concevoir des modèles, des technologies et des solutions numériques au service d'une société et d'une économie respectueuses de l'humain et de son environnement. Nous recherchons un.e ingénieur.e de recherche e…",,,,2025-03-22T05:37:56Z,https://www.adzuna.fr/details/5105677643?utm_medium=api&utm_source=e1ad5111,Unknown,embedded systems,fr,embedded systems,standard,False,False
"Senior Software Engineer - Qualcomm - Issy, Paris - France",Qualcomm,"Issy-les-Moulineaux, Boulogne-Billancourt","Company: Qualcomm France S.A.R.L. Job Area: Engineering Group, Engineering Group > Software Engineering General Summary: This position is for an experienced Embedded system/network software engineer with strong technology background, problem solving and communication skills. Major technical area is focused on networking and enabling embedded system and other components required to enable a networking platform, WLAN (Wi-Fi) driver/firmware, networking protocol, WLAN-related software on Linux OS.…",,,,2025-03-04T19:05:03Z,https://www.adzuna.fr/details/5075141210?utm_medium=api&utm_source=e1ad5111,Unknown,embedded systems,fr,embedded systems,standard,False,False
Product Owner,KPIT,"Paris, Ile-de-France","The Product Owner is responsible for planning and execution of sprint activities with the prioritised roadmap creation. KEY ROLES & RESPONSIBILITIES Be the Project manager who will be responsible for planning and execution of sprints. Responsible for deciding which topics need to be taken based upon the sprint plan or product backlog, along with stakeholders. Makes service roadmap and is responsible for what to be added as features in each launch. Shall be able to prioritize the features and ch…",,,,2025-03-29T15:42:01Z,https://www.adzuna.fr/land/ad/5117926040?se=1PzvTPAo8BGT4w9x5LWCew&utm_medium=api&utm_source=e1ad5111&v=573643E92691AF90FCA77A8DC551B6949317046F,Emplois Consultants,embedded systems,fr,embedded systems,standard,False,False
Embedded SW Engineering Manager I,Netatmo,"Boulogne-Billancourt, Hauts-de-Seine","Company Description What we do?  We develop groundbreaking, intuitive and beautifully-designed connected consumer electronics. Truly smart, our innovative products provide a seamless experience that helps users create a safer, healthier and more comfortable & eco-friendly home. We carefully design the mechanics, electronics and embedded software of all our products to the highest standards. Our mobile and web applications are designed to be simple to operate, yet deliver a rich user experience.…",,,,2025-05-01T10:56:40Z,https://www.adzuna.fr/land/ad/5172380858?se=1PzvTPAo8BGT4w9x5LWCew&utm_medium=api&utm_source=e1ad5111&v=05095FB4F3D818D6A3DFD1644B5FE61698CC6216,Unknown,embedded systems,fr,embedded systems,standard,False,False
Ingénieur Validation WDM H/F,ARealTI,"Marcoussis, Les Ulis","marins. Parmi vos responsabilités, vous serez amené à : - Rédiger des fiches de test à l'aide de l'outil TestLink - Développer des scripts de tests automatisés (Pytest, Playwright, GitLab) - Installer et configurer les environnements de test (Linux, Kubernetes, Podman, Grafana?) - Exécuter des campagnes de tests manuels et automatisés - Créer, suivre et requalifier les tickets dans JIRA - Collaborer étroitement avec les équipes R&D, validation et infrastructure Profil recherché : Titulaire d'un…",40000,50000,permanent,2025-04-26T19:57:38Z,https://www.adzuna.fr/details/5164599455?utm_medium=api&utm_source=e1ad5111,Emplois Informatique,embedded systems,fr,embedded systems,standard,False,False
Embedded Software Engineer - Infotainment,La Fosse Associates,"Toulouse, Haute-Garonne","Senior Embedded Software Engineer - Infotainment Location: Toulouse | Contract | Hybrid We're seeking a hands-on Embedded Software Engineer to join a Semiconductor Automotive Application Engineering team that works closely with OEMs and Tier 1 suppliers - from early design to production. This is a customer-facing role focused on supporting the development and integration of Board Support Packages (BSPs) across platforms like Linux, Android, QNX, and Green Hills Integrity. You'll be involved in …",,,,2025-04-23T14:43:46Z,https://www.adzuna.fr/details/5158083929?utm_medium=api&utm_source=e1ad5111,Unknown,embedded systems,fr,embedded systems,standard,False,False
Ingénieur Essais Systèmes Avioniques H/F,Expleo,"Haute-Garonne, Occitanie","Au sein de l’équipe Electronics & Embedded Systems, rattaché à l’agence de Toulouse, vous occuperez le rôle de Ingénieur Essai Systèmes Avioniques H/F. Vous serez acteur sur l'ensemble du cycle de vie d'un produit et notamment dans la réalisation des essais des systèmes Cockpit Avion. Missions Spécifier les moyens d'essais, de les valider ainsi que d'écrire les procédures d'essais Réaliser les essais sur les moyens appropriés (bancs de tests, simulateurs) Investiguer lors de la découverte d'ano…",,,permanent,2025-03-21T02:27:17Z,https://www.adzuna.fr/details/5103727912?utm_medium=api&utm_source=e1ad5111,Unknown,embedded systems,fr,embedded systems,standard,False,False
CTF Challenge Creation for IoT and OT Intern,Fortinet,France,"Description We are looking for an enthusiastic intern passionate about cybersecurity to help create challenges for Ph0wn CTF , a security competition focused on connected objects . During this internship, you will: Design and develop various CTF challenges, including challenges specifically related to Operational Technology (OT) (e.g., industrial automation, medical automated systems, climate control, elevators etc.). Test and refine the challenges to ensure a smooth and engaging experience for…",,,,2025-03-29T22:26:35Z,https://www.adzuna.fr/details/5118320612?utm_medium=api&utm_source=e1ad5111,Emplois Informatique,embedded systems,fr,embedded systems,standard,False,False
Technicien banc de test H/F,Expleo,"Cholet, Maine-et-Loire","Au sein de l’équipe Electronics & Embedded Systems, rattaché à l’agence de Saint-Nazaire vous occuperez le rôle de Technicien Banc de Test H/F. Missions : Réaliser du design électronique (schématique, routage), Réaliser du design pour l’intégration mécanique, Rédiger des dossiers techniques, Intégrer et valider les produits, Assurer le suivi des sous-traitants et la gestion des achats. Profil : De formation BAC2/3 en électronique ou électrotechnique , Vous avez une première expérience dans le d…",,,permanent,2025-04-21T03:19:53Z,https://www.adzuna.fr/details/5154863241?utm_medium=api&utm_source=e1ad5111,Unknown,embedded systems,fr,embedded systems,standard,False,False
Ingénieur Validation Wdm H/F,ARealTI,"Marcoussis, Les Ulis","Nous recherchons pour l'un de nos clients, leader mondial de la fabrication et de la pose de câbles sous-marins, un Ingénieur Validation WDM. Vous serez intégré au sein du département « Test », chargé d'intégrer et de valider les équipements de transmission ainsi que le système de gestion des réseaux DWDM sous-marins. Parmi vos responsabilités, vous serez amené à : - Rédiger des fiches de test à l'aide de l'outil TestLink - Développer des scripts de tests automatisés (Pytest, Playwright, GitLab…",,,,2025-04-27T06:59:52Z,https://www.adzuna.fr/details/5165178827?utm_medium=api&utm_source=e1ad5111,Unknown,embedded systems,fr,embedded systems,standard,False,False
Technicien Banc de Test H/F,Expleo,"Cholet 1er Canton, Cholet","Description du poste : Au sein de l'équipe Electronics & Embedded Systems, rattaché à l'agence de Saint-Nazaire vous occuperez le rôle de Technicien Banc de Test H/F. Missions : - Réaliser du design électronique (schématique, routage), - Réaliser du design pour l'intégration mécanique, - Rédiger des dossiers techniques, - Intégrer et valider les produits, - Assurer le suivi des sous-traitants et la gestion des achats. Profil : - De formation Bac 2/3 en électronique ou électrotechnique, - Vous a…",26000,26000,,2025-03-22T06:08:49Z,https://www.adzuna.fr/details/5105747327?utm_medium=api&utm_source=e1ad5111,Unknown,embedded systems,fr,embedded systems,standard,False,False
Embedded Firmware Engineer,Tekever,"Rangueuil, Toulouse","Are you ready to revolutionise the world with TEKEVER?  Join us, the European leader in unmanned technology, where cutting-edge advancements meet unparalleled innovation. We offer a unique surveillance-as-a-service solution that provides real-time intelligence, enhancing maritime safety and saving lives. TEKEVER is setting new standards in intelligence services, data and AI technologies. Become part of a dynamic team transforming maritime surveillance and making a significant impact on global s…",,,,2025-03-26T03:48:58Z,https://www.adzuna.fr/details/5111482723?utm_medium=api&utm_source=e1ad5111,Unknown,embedded systems,fr,embedded systems,standard,False,True
Engineering Processs Apprentice,Hitachi,France,"Location: Drancy, Paris, France Job ID: R0080283 Date Posted: 2025-04-22 Company Name: HITACHI ASTEMO FRANCE S.A.S. Profession (Job Category): Engineering & Science Job Schedule: Full time Remote: No Job Description: Your goal is to improve the existing System/Software/Safety/Hardware development processes in order to increase the maturity with respect to A-SPICE standard. Applicable process: MAN3, SYS1 to SYS5, SWE1 to SWE6, SUP9, SUP10 To achieve this target, you will: Understand the existing…",,,,2025-04-24T21:59:39Z,https://www.adzuna.fr/details/5160988122?utm_medium=api&utm_source=e1ad5111,Unknown,embedded systems,fr,embedded systems,standard,True,False
Ingénieur Essai Systèmes Propulsifs H/F,Expleo,"Haute-Garonne, Occitanie","Au sein de l’équipe Electronics & Embedded Systems, rattaché à l’agence de Toulouse, vous occuperez le rôle d’Ingénieur Essai Systèmes Propulsifs H/F. Vous intervenez depuis la demande d’essais formulée par le bureau d’étude jusqu’à la rédaction du rapport d’essai. Missions Définir et valider l’instrumentation nécessaire pour répondre à la demande d’essais Définir et préparer tout moyen pertinent pour permettre le suivi des essais Réaliser en temps réel les essais grâce aux outils de télémesure…",,,permanent,2025-03-21T02:27:17Z,https://www.adzuna.fr/details/5103727911?utm_medium=api&utm_source=e1ad5111,Unknown,embedded systems,fr,embedded systems,standard,False,False
Industrial IT Developer H/F,Approach People Recruitment,"Paris, Ile-de-France","Industrial IT Developer (M/F) - Paris Join an innovative company and contribute to industrial transformation ! Our client, a key player in the industrial sector, is looking for an Industrial IT Developer to strengthen its teams and develop innovative software solutions. Your Mission : As an Industrial IT Developer, you will BE responsible for designing, developing, and optimizing software dedicated to industrial systems. Your main responsibilities include : - Developing software applications fo…",45000,70000,,2025-04-30T12:15:43Z,https://www.adzuna.fr/details/5170320981?utm_medium=api&utm_source=e1ad5111,Unknown,embedded systems,fr,embedded systems,standard,False,False
Technicien Maintenance Bancs de Test H/F,Expleo,"Brive-la-Gaillarde-Sud-Ouest, Brive-la-Gaillarde","Description du poste : Au sein de l'équipe Electronics & Embedded Systems, rattaché à l'agence de Toulouse vous occuperez le rôle de Technicien Maintenance Bancs de Test H/F. Rattaché au responsable de l'activité, vous interviendrez sur la maintenance en série d'équipements électroniques complexes. Missions : - Effectuer les maintenances préventives des bancs en s'appuyant sur les fiches existantes - Effectuer les maintenances curatives des bancs : - Détecter la panne en adoptant une méthodolog…",,,,2025-03-23T06:00:22Z,https://www.adzuna.fr/details/5107276308?utm_medium=api&utm_source=e1ad5111,Unknown,embedded systems,fr,embedded systems,standard,False,False
Business Engineer H/F,Thomas Search Consulting,France,"Descriptif de notre client : Poste basé à Bruxelles Nous sommes une société de prestation de conseil en ingénierie en forte croissance qui rayonne déjà sur l'hexagone et à l'échelle internationale. Aujourd'hui, nous mandatons Thomas Search Consulting pour nous aider à trouver notre futur(e) ingénieur(e) d'affaires / Business Manager F/H. Nous proposons la mise à disposition de compétences à forte valeur ajoutée auprès des principaux acteurs du Digital et de l'Industrie. Notre mission est d'acco…",45000,70000,,2025-04-23T06:16:23Z,https://www.adzuna.fr/details/5157410370?utm_medium=api&utm_source=e1ad5111,Emplois Autres/Général,embedded systems,fr,embedded systems,standard,False,True
Business Engineer,Thomas Search Consulting,"Ile-de-France, France","Descriptif de notre client : Poste basé à Bruxelles Nous sommes une société de prestation de conseil en ingénierie en forte croissance qui rayonne déjà sur l'hexagone et à l'échelle internationale. Aujourd'hui, nous mandatons Thomas Search Consulting pour nous aider à trouver notre futur(e) ingénieur(e) d'affaires / Business Manager F/H. Nous proposons la mise à disposition de compétences à forte valeur ajoutée auprès des principaux acteurs du Digital et de l'Industrie. Notre mission est d'acco…",45000,70000,,2025-04-26T07:57:21Z,https://www.adzuna.fr/details/5163595410?utm_medium=api&utm_source=e1ad5111,Emplois Autres/Général,embedded systems,fr,embedded systems,standard,False,True
Image Quality Engineer,EnduroSat,France,"About us We are EnduroSat! A fast-growing space scale-up at the forefront of satellite innovation, specializing in advanced software-flexible satellites for commercial, governmental, and scientific endeavors. This is more than a job, it`s a mission We are making space universally accessible and redefining the possible We get things done We take ownership of what we do and we work hard to make a difference We are fearless Transpаrancy is our only way forward. We dare to address and resolve issue…",,,,2025-05-01T10:46:16Z,https://www.adzuna.fr/land/ad/5172368345?se=1PzvTPAo8BGT4w9x5LWCew&utm_medium=api&utm_source=e1ad5111&v=463A48FC45D3CAF1AEB8AE392D44B9A014CF3AF1,Unknown,embedded systems,fr,embedded systems,standard,False,False
Ingénieur Développement Software Banc de Test H/F,Expleo,"Brive-la-Gaillarde-Sud-Ouest, Brive-la-Gaillarde","Au sein de l’équipe Electronics & Embedded Systems , rattaché à l’agence de Toulouse vous interviendrez à Brive-la-Gaillarde et vous occuperez le rôle d’Ingénieur Développement Software Banc de Test H/F. Vous serez garant de l'implémentation de la solution technique et jouerez un rôle central dans le développement logiciel. Missions : Développer des drivers pour le pilotage d'instruments de mesure Développer des séquences de tests Valider les développements Rédiger de la documentation technique…",,,permanent,2025-02-20T01:52:53Z,https://www.adzuna.fr/details/5056948138?utm_medium=api&utm_source=e1ad5111,Unknown,embedded systems,fr,embedded systems,standard,False,False
Expert Système MBSE H/F,Expleo,"Montigny-le-Bretonneux, Versailles","Au sein de l’équipe Product & System Engineering, rattaché à l’agence de Montigny le Bretonneux, vous occuperez le rôle de Senior Embedded System Engineer H/F. Votre mission principale sera de concevoir, développer et maintenir des systèmes complexes. Vous répondrez aux exigences des parties prenantes par des solutions techniques et organisationnelles et coordonnerez les activités telles que le développement de matériels et de logiciels. Missions : Analyser et élucider les besoins des parties p…",,,permanent,2025-05-04T03:27:29Z,https://www.adzuna.fr/details/5179616829?utm_medium=api&utm_source=e1ad5111,Unknown,embedded systems,fr,embedded systems,standard,False,False
