title,company,location,description,salary_min,salary_max,contract_type,created,redirect_url,category,specialty,source_country,query,query_type,remote_friendly,international
Architectural Designer,FatAtelier,"Newark, Essex County","Company Description At Fatatelier, we are more than just a design firm; we are fabricators with designer skills, creators of spaces, and craftsmen of precision. Established with a passion for transforming visions into reality, we specialize in architectural design and precision millwork. Our work offers a seamless blend of innovation, creativity, and meticulous attention to detail. Role Description This full-time role for an Architectural Designer is based on-site in Newark, NJ. The Architectur…",57507.52,57507.52,,2025-04-24T16:51:11Z,https://www.adzuna.com/details/5161082660?utm_medium=api&utm_source=e1ad5111,Creative & Design Jobs,urban planning,us,urban planning,standard,False,False
FatAtelier is hiring: Architectural Designer in Newark,FatAtelier,"Newark, Essex County","Company Description At Fatatelier, we are more than just a design firm; we are fabricators with designer skills, creators of spaces, and craftsmen of precision. Established with a passion for transforming visions into reality, we specialize in architectural design and precision millwork. Our work offers a seamless blend of innovation, creativity, and meticulous attention to detail. Role Description This full-time role for an Architectural Designer is based on-site in Newark, NJ. The Architectur…",57916.95,57916.95,,2025-04-25T15:44:39Z,https://www.adzuna.com/details/5162978342?utm_medium=api&utm_source=e1ad5111,Creative & Design Jobs,urban planning,us,urban planning,standard,False,False
Director of Urban Design & Development,Keller Executive Search,"Phoenix, Maricopa County","Our client is searching for a visionary and experienced Director of Urban Design & Development to lead and shape innovative design initiatives in a rapidly evolving urban landscape. In this strategic role, you will be responsible for overseeing projects that enhance community aesthetics while promoting sustainable development practices. If you are passionate about creating vibrant urban spaces and possess a deep understanding of urban planning, this is the ideal opportunity for you. To learn mo…",160000,200000,permanent,2025-04-11T03:03:34Z,https://www.adzuna.com/details/5140253849?utm_medium=api&utm_source=e1ad5111,Creative & Design Jobs,urban planning,us,urban planning,standard,False,False
Deputy Chief Of Staff,Cook County,"Chicago, Cook County","Job Description Job Description The Cook County Office of the President is seeking a Deputy Chief of Staff - Operations to join our team. This person will assist the Chief of Staff and President in the development of policies, procedures, programs, and other executive functions to maintain operational standards and improve operational processes across Offices Under the President. Cook County offers great benefits and the chance to participate in a strong tradition of public service. Cook County…",74504.34,74504.34,,2025-05-04T01:31:06Z,https://www.adzuna.com/details/5179823362?utm_medium=api&utm_source=e1ad5111,Hospitality & Catering Jobs,urban planning,us,urban planning,standard,False,False
Urban Designer I,City of Boston,"Boston, Suffolk County","The Urban Design division is responsible for crafting and executing a beautiful, human-scale, and inclusive vision for the design of the built environment across Boston. We champion the transformative power of beautiful, sustainable, walkable communities for everyone that support social, mental, and physical health while improving resiliency and promoting equity. Under the direction of the Assistant Deputy Director for Urban Design, the Urban Designer will contribute to new and ongoing planning…",85689.88,85689.88,,2024-06-13T09:16:57Z,https://www.adzuna.com/details/4734353078?utm_medium=api&utm_source=e1ad5111,Creative & Design Jobs,urban planning,us,urban planning,standard,False,False
Senior Planner,City of Odessa,"Odessa, Ector County","Senior Planner Summary: Under the general supervision of the Planning Manager, the Senior Planner will administer the Comprehensive Plan and Zoning and Subdivision Regulation Ordinances and prepare documents, reports, and studies related to future land use, development standards, demographics, population, transportation, environment, and grants. Coordinate the administration and development plans with surrounding municipalities, regional planning organizations, and State and Federal planning ag…",66535,66535,,2025-04-30T21:00:11Z,https://www.adzuna.com/details/5171546142?utm_medium=api&utm_source=e1ad5111,Healthcare & Nursing Jobs,urban planning,us,urban planning,standard,False,False
Senior Urban Planner,McAdams,"Raleigh, Wake County","McAdams is a full-service land planning, landscape architecture, civil engineering, transportation and geomatics firm located in North Carolina, Texas and Florida. We seek a partnership with our clients to create meaningful experiences through inspired design. Our employees are what makes McAdams different. We bring experiences to the forefront of everything we do and to do that takes special people. McAdams is seeking an energetic planning professional to join our Planning  Design team as a Se…",91193.09,91193.09,,2024-08-10T07:08:49Z,https://www.adzuna.com/details/4820085934?utm_medium=api&utm_source=e1ad5111,Consultancy Jobs,urban planning,us,urban planning,standard,False,False
Assistant Professor in Urban Informatics/Analytics- City & Metropolitan Planning,The University of Utah,"Salt Lake County, Utah",Details The University of Utah seeks to fill a tenure-track position at the Assistant Professor level to begin in Fall 2025. This is a joint hire between the Department of City & Metropolitan Planning and the Scientific Computing and Imaging ( SCI ) Institute at the University of Utah. We seek a colleague with a commitment to excellence in teaching and demonstrated ability to obtain research funding and publish high-quality peer-reviewed research. We are especially interested in candidates who …,65866.71,65866.71,,2024-11-29T10:12:37Z,https://www.adzuna.com/details/4955671730?utm_medium=api&utm_source=e1ad5111,Scientific & QA Jobs,urban planning,us,urban planning,standard,False,False
Temporary Medical Assistant (Bilingual- Spanish/English),Urban Health Plan,"Boulevard, Bronx",Full Time Temporary Roles at Urban Health Plan (Medical Assistant Positions) At Urban Health Plan we hire full-time temporary associates to work on our team to cover for spans of 3-month (or greater) assignments throughout the year. We are currently seeking applicants that are looking for seasonal/temporary roles in alignment with their availability to fulfill Medical Assistant positions at Urban Health Plan. If you have experience in medical assisting and are seeking an opportunity to work in …,51624.88,51624.88,contract,2025-03-10T19:45:26Z,https://www.adzuna.com/details/5085980736?utm_medium=api&utm_source=e1ad5111,Healthcare & Nursing Jobs,urban planning,us,urban planning,standard,False,False
Assistant Director of Planning,City of Midlothian,"Midlothian, Ellis County","Position Summary Starting Hiring Range: $88,088.83 - $112,313.26, annually Under limited supervision, this position is responsible for the administration of the City’s zoning and subdivision ordinances, acting as technical advisor to various agencies, boards, and the general public regarding the City’s overall planning and zoning policies, assisting the Director of Planning in all job functions and activities, and acting as director during the absence of the Director of Planning. Essential Job …",88088,136537,,2025-05-03T19:45:50Z,https://www.adzuna.com/details/5179498318?utm_medium=api&utm_source=e1ad5111,Consultancy Jobs,urban planning,us,urban planning,standard,False,False
Planning and Zoning Director,Randolph County,"Asheboro, Randolph County","Description This position plays a key role in overseeing development projects through the coordination and administration of a comprehensive and strategic planning program designed to maintain quality and sustainable growth within Randolph County. This is an advanced professional, administrative and leadership position. The Director reports to the County Manager. The position is responsible for leading and directing the Planning & Zoning staff in coordination with other County Departments. The …",83827,128840,,2025-03-06T20:35:19Z,https://www.adzuna.com/details/5080118725?utm_medium=api&utm_source=e1ad5111,Admin Jobs,urban planning,us,urban planning,standard,False,False
Urban Planner (Law Firm Experience),SourcePro Search,"Washington, Washington, D.C.","SourcePro Search is conducting a search for an experienced Land Use Planner with a Master's degree in urban planning, urban design, or a related field, or equivalent professional experience. The ideal candidate will be a member of the American Planning Association (APA) and hold AICP or LEED certification. The ideal candidate will collaborate with real estate attorneys, senior land planners, and development specialists to assist owners, developers, and investors with all aspects of land use and…",100764.77,100764.77,,2024-08-04T05:36:48Z,https://www.adzuna.com/details/4809737440?utm_medium=api&utm_source=e1ad5111,Property Jobs,urban planning,us,urban planning,standard,False,False
Principal Planner,City of Mesa,"Mesa, Maricopa County","Description/Duties The current vacancy is for the Urban Design and Planning Assignment . First review of applications will be on Monday, February 3, 2025, and weekly thereafter. A Principal Planner performs advanced-level professional planning and supervisory work that may oversee an entire Unit or portions of a Unit within the department. A Principal Planner is responsible for administrative functions, and for managing/supervising professional planners, architects, landscape architects, engine…",84405,124603,,2025-01-23T13:23:57Z,https://www.adzuna.com/details/5021315996?utm_medium=api&utm_source=e1ad5111,Consultancy Jobs,urban planning,us,urban planning,standard,False,False
Planner II,HNTB Corporation,"Detroit, Wayne County","What We're Looking For The time is right to join HNTB Michigan We are seeking candidates for a Transportation Planner II position in our planning group. At HNTB, you can invest in a career that is meaningful and rewarding to you while making a difference for Michigan communities that matter to all of us. As part of a nationwide firm, HNTB Michigan has been a part of delivering solutions for some of the largest and most innovative infrastructure projects across the state. With our historic growt…",86823.75,86823.75,,2025-04-13T01:12:06Z,https://www.adzuna.com/details/5142957012?utm_medium=api&utm_source=e1ad5111,Engineering Jobs,urban planning,us,urban planning,standard,False,False
Planning Intern,AECOM,"Rocky Hill, Hartford County","Job Description AECOM, a global leader in transportation and urban planning, is seeking a student in urban planning or transportation planning for an internship in the Rocky Hill, CT office. Our planning team is housed in the AECOM transportation business line, but we also contribute to projects across other disciplines. We strongly value curiosity, a collaborative spirit, an openness to different viewpoints, and a strong focus on producing excellent work. We provide a supportive work environme…",46635.5,46635.5,,2025-04-28T20:11:27Z,https://www.adzuna.com/details/5167520905?utm_medium=api&utm_source=e1ad5111,Consultancy Jobs,urban planning,us,urban planning,standard,False,True
MPO Associate Planner,City of Farmington,"Bisti, San Juan County","JOB OPENING CITY OF FARMINGTON JOB POSITION  158 : MPO Associate Planner NUMBER OF VACANCIES: 1 DEPARTMENT: Community Works/Downtown WORK LOCATION: Downtown Center, 100 W. Broadway PAY CLASS : L, Exempt HIRING RANGE : $50,776.82 - $78,998.85 /Annually DAYS WORKED: Monday - Friday HOURS WORKED: 8:00 a.m. - 5:00 p.m. TYPE OF POSITION: Regular, Full-Time APPLICATIONS WILL BE RECEIVED: Until Filled JOB DUTIES ESSENTIAL DUTIES Assists in in the daily operation of the MPO, including scheduling, draft…",50776,78998,,2024-09-07T10:30:30Z,https://www.adzuna.com/details/4856111171?utm_medium=api&utm_source=e1ad5111,Logistics & Warehouse Jobs,urban planning,us,urban planning,standard,False,False
Architectural Designer / Design Architect,J29:7 Planning & Development Corp,"Ypsilanti, Washtenaw County",Position Type: Contract or Full-Time (Multiple Positions Available) Candidates need not be licensed and must upload a portfolio of work to be considered POSITION We are seeking talented Design Architects to join our team and contribute to high-quality design assessments for real estate development projects. This role focuses on creating concept and schematic level designs to evaluate project feasibility. The Design Architect will collaborate closely with our real estate development analysts and…,78549.21,78549.21,,2024-10-16T12:51:05Z,https://www.adzuna.com/details/4904218302?utm_medium=api&utm_source=e1ad5111,Property Jobs,urban planning,us,urban planning,standard,False,False
Urban Planner,Freese and Nichols,"Charlotte, Mecklenburg County","Freese and Nichols, Inc. (FNI) is currently searching for a highly-motivated, passionate and energetic Urban Planner to join the Urban Planning and Design Group in Charlotte, as we increase our capacity to serve our clients. Our ideal candidate would strengthen our capabilities across a broad spectrum of project types, including comprehensive planning, development regulations, campus master planning, small area planning such as downtown revitalization plans and corridor plans, and parks and rec…",93782.21,93782.21,,2025-04-03T19:46:41Z,https://www.adzuna.com/details/5128257257?utm_medium=api&utm_source=e1ad5111,Trade & Construction Jobs,urban planning,us,urban planning,standard,False,False
Transportation Planning Intern - Summer 2025,Wsp Wsp Usa,US,"Description This Opportunity Nationally recognized as a Top 100 Internship Program, WSP USA hosts hundreds of interns across the United States to gain hands-on, meaningful work experience to enhance their education and professional aptitude. Our interns gain exposure to real projects while working side by side with senior staff. Through our Developing Professionals Network, interns gain mentorship, networking opportunities and lifelong career connections. Our Advisory Team is seeking a Transpor…",40300.85,40300.85,contract,2025-05-04T01:05:13Z,https://www.adzuna.com/details/5179807262?utm_medium=api&utm_source=e1ad5111,Engineering Jobs,urban planning,us,urban planning,standard,False,False
"SR Manager, Seismic SME | Planning Design  Construction",Stamford American International Hospital,"Stanford, Santa Clara County","This is a Stanford Health Care job. “This role will serve as a seismic subject matter expert, which will include expertise in structural and non-structural issues for Stanford Medicine, including all campuses with regard to seismic safety compliance and coordination.” A Brief Overview Responsible for program management and planning services for all projects within the assigned area in support of Stanford Health Care (SHC) and Stanford Childrens Health (SCH). Expected to exercise significant exp…",193427.3,193427.3,,2025-03-05T10:34:48Z,https://www.adzuna.com/land/ad/5077370014?se=gI3BM_Eo8BGT4w9x5LWCew&utm_medium=api&utm_source=e1ad5111&v=18E1BC4AC6E5307A8C9DD5C6FA8A59E605D5E7EA,Healthcare & Nursing Jobs,urban planning,us,urban planning,standard,False,False
Development Specialist,Housing Authority of Kansas City,"Westwood Hills, Johnson County","The Housing Authority of Kansas City, Missouri is seeking qualified candidates for the position of Development Specialist. Our Development Specialist supports the Planning and Development department by assisting with the creation and preservation of affordable housing including public housing and project-based Housing Choice Vouchers as well as the planning and development of new programs to create or preserve high quality affordable housing and supportive services for residents. (A full job de…",65000,75000,,2025-04-26T22:30:35Z,https://www.adzuna.com/details/5165109097?utm_medium=api&utm_source=e1ad5111,Property Jobs,urban planning,us,urban planning,standard,False,False
Marketing and Communications Intern,PRTC,"Woodbridge, Prince William County","Job Description Job Description The Marketing and Communication Intern is an opportunity for current or future students with an interest in the transit industry to gain valuable, real-world experience. Based on your interests and experience, you will have the opportunity to work closely with OmniRide staff. We are seeking applicants to begin the Internship in early May or June 2025 for three (3) to six (6) months. Qualifications Enrolled or planning to enroll in a bachelor’s or master’s degree …",53318.41,53318.41,,2025-04-30T01:06:11Z,https://www.adzuna.com/land/ad/5169939717?se=gI3BM_Eo8BGT4w9x5LWCew&utm_medium=api&utm_source=e1ad5111&v=1043FD09273A67155B09EF8AD2B076416B8C29E3,"PR, Advertising & Marketing Jobs",urban planning,us,urban planning,standard,False,False
Research Intern (2 positions),Dine College,"Tsaile, Apache County","Research Intern (2 positions) Tribal Housing Research Office of President Hybrid/Tsaile Campus _________________________ Start Date: 3-31-2025 End Date: 08-08-2025 Duty Schedule: Work hours are between 8:00 am and 7:00 pm, with occasional hours on weekends. 10-25 hours per week. Summary/Objective of Position: The Tribal Housing Research team is seeking an undergraduate student intern to support research on housing issues impacting tribal communities. This position is ideal for students interest…",41600,41600,,2025-03-07T07:48:01Z,https://www.adzuna.com/details/5080932679?utm_medium=api&utm_source=e1ad5111,Social work Jobs,urban planning,us,urban planning,standard,False,False
GIS Research Associate for Center of Excellence for Housing and Community Development Policy R,Texas Southern University,"Houston, Harris County",*Security Sensitive Position?:*Yes *Hours of Work:*8:00 AM - 5:00 PM M-F *Posting Number:*TSU203349 *Official TSU Title:*GIS Research Associate for Center of Excellence for Housing and Community Development Policy Research *Grant Title:*GIS Research Associate for Center of Excellence for Housing and Community Development Policy Research *Job Description Summary / TWC Summary:*We are seeking an enthusiastic and skilled Research Associate to join our dynamic research team. The ideal candidate wil…,58318.84,58318.84,,2025-05-01T08:26:58Z,https://www.adzuna.com/land/ad/5172953934?se=gI3BM_Eo8BGT4w9x5LWCew&utm_medium=api&utm_source=e1ad5111&v=6A024CC089D8D6697F4DFBDF725427DE5E129EEC,Scientific & QA Jobs,urban planning,us,urban planning,standard,False,False
Senior/Principal Planner & Housing Planner – Long-Range Planning & Sustainability,The City of Oxnard,"Textile Finance, Los Angeles County","Join a team where you can enjoy work-life balance and do meaningful work Receive a competitive annual salary plus generous benefits Join an organization where you can experience career growth About The City of Oxnard The City of Oxnard is an employer of choice for both job seekers and professionals seeking a thriving and fulfilling career. Nestled along the stunning coastline, this beautiful coastal city offers a wealth of employment opportunities that cater to a diverse range of skills and pas…",100234.37,100234.37,,2025-04-08T07:15:57Z,https://www.adzuna.com/land/ad/5135350765?se=gI3BM_Eo8BGT4w9x5LWCew&utm_medium=api&utm_source=e1ad5111&v=F71528845053BB095C8A692FB9E42C67B0C2B521,Property Jobs,urban planning,us,urban planning,standard,False,False
FT - Planner - Planning Division,Ogden City Corporation,"Marriott Slaterville, Weber County","PLANNER Department: Community & Economic Development Division: Planning Pay Grade: GRADE 145 $60,995.61 - $88,443.63 Annual Salary, ($29.32 - $42.52 Hourly Rate) FLSA Status: Non-Exempt, Merit, Full-Time, & Eligible for Benefits GENERAL PURPOSE This position performs professional level work in the field of land use planning and development and provides information and assistance to developers, the business community, elected and appointed officials, and the public on planning, land use, histori…",60985,88441,,2025-04-24T20:57:53Z,https://www.adzuna.com/details/5161468384?utm_medium=api&utm_source=e1ad5111,Other/General Jobs,urban planning,us,urban planning,standard,False,False
Transportation Manager,City of Ann Arbor,"Loch Alpine, Washtenaw County","Salary: $100,000 - $130,000 (Offer will be commensurate with experience) Benefits offered for this opportunity: Non-Union Benefits Summary Role Summary: Plan, direct, manage, and oversee the operations of the Transportation Unit, which includes transportation engineering, transportation planning, active transportation, project management, and signs/signals/streetlight maintenance. Maintains liaisons with individuals, units, and organizations and acts independently on technical matters pertainin…",87577.27,87577.27,,2025-04-06T21:09:35Z,https://www.adzuna.com/details/5132967443?utm_medium=api&utm_source=e1ad5111,Engineering Jobs,urban planning,us,urban planning,standard,False,False
Chief of Staff to the CEO,Karp Strategies,"Prince, Manhattan","Application Deadline April 30, 2025 Department Operations Employment Type Full Time Location New York | Fidi Workplace type Hybrid Compensation $110,000 - $130,000 / year Reporting To Key Responsibilities Skills, Knowledge and Expertise Benefits About Karp Strategies Karp Strategies is an equity-driven, WBE/DBE/SBE-certified urban strategy consultancy founded in 2015 that has become one of the Northeast’s go-to firms for community and economic development planning, stakeholder engagement, and r…",110000,130000,,2025-04-01T23:22:35Z,https://www.adzuna.com/details/5123302771?utm_medium=api&utm_source=e1ad5111,Consultancy Jobs,urban planning,us,urban planning,standard,False,False
Business Development Intern,Karp Strategies,"Prince, Manhattan","Application Deadline April 30, 2025 Department Business Development Employment Type Internship Location New York | Fidi Workplace type Hybrid Compensation $25.00 - $33.00 / hour Key Responsibilities Skills, Knowledge and Expertise Benefits About Karp Strategies Karp Strategies is an equity-driven, WBE/DBE/SBE-certified urban strategy consultancy founded in 2015 that has become one of the Northeast’s go-to firms for community and economic development planning, stakeholder engagement, and real es…",52000,68640,contract,2025-01-26T06:39:37Z,https://www.adzuna.com/details/5024774705?utm_medium=api&utm_source=e1ad5111,Consultancy Jobs,urban planning,us,urban planning,standard,False,False
Senior Development Manager - LIHTC,CyberCoders,"Dedham, Norfolk County","Senior Development Manager - LIHTC *Job Title: *Senior* *Development Manager - LIHTC, Real Estate Finance, Asset Management *Job Location: *Dedham, MA *Salary: *Competitive Salary DOE, Benefits, 401k Match, Bonus Potential *Requirements: *5 Years Experience in real estate development & finance *Position Overview* We are seeking a highly skilled Senior Development Manager to oversee our Low-Income Housing Tax Credit (LIHTC) projects. The ideal candidate will have a comprehensive understanding of…",100000,150000,,2025-05-04T01:42:27Z,https://www.adzuna.com/details/5179842650?utm_medium=api&utm_source=e1ad5111,Property Jobs,urban planning,us,urban planning,standard,False,False
Planner II,Town of Garner,"Garner, Wake County","The Town of Garner is seeking a Planner II to perform intermediate/journey-level professional planning work in a variety of projects for current and long-range planning efforts. Examples of Duties: Reviews permits/plans and associated documents as assigned, including but not limited to, commercial building permits, final plats, site/subdivision plans and sign permits for compliance with adopted codes, ordinances and policies, and managing all related correspondence. Utilizes the department’s pe…",62108,80747,,2025-01-18T06:13:14Z,https://www.adzuna.com/details/5015607719?utm_medium=api&utm_source=e1ad5111,Scientific & QA Jobs,urban planning,us,urban planning,standard,False,False
Video Producer and Editor Job at Planetizen in Los Angeles,Planetizen,"Los Angeles, Los Angeles County","Who We Are Planetizen is the most visited urban planning website in the United States, providing training, news, jobs, and continuing education across multiple products and services. Planetizen publishes 40 times a week, including news, analysis, and commentary, in addition to hosting regularly updated jobs and events boards. Planetizen Courses provides the leading online professional education website for planners and urban designers, with 350 of the highest quality video courses available to …",59556.37,59556.37,,2025-03-26T15:23:58Z,https://www.adzuna.com/details/5112653668?utm_medium=api&utm_source=e1ad5111,Creative & Design Jobs,urban planning,us,urban planning,standard,False,False
