title,company,location,description,salary_min,salary_max,contract_type,created,redirect_url,category,specialty,source_country,query,query_type,remote_friendly,international
AI Engineer (Embedded Systems),Chroma Recruitment Ltd,"Low Prudhoe, Prudhoe","This innovative company in the Electronics and Embedded industry are looking for an AI Engineer to join their team. The primary responsibility for the AI Engineer will be to improve their product range through the application of real time AI, this will be a mix of computer vision and real-time data streams. AI Engineer requirements: Degree qualified in Computer Science/Electronics (or equivalent) 5 years industry experience (flexibility on this) Embedded Systems experience Real Time Application…",65000,65000,permanent,2025-04-24T10:26:05Z,https://www.adzuna.co.uk/jobs/land/ad/5159742207?se=yGyvPfAo8BGT4w9x5LWCew&utm_medium=api&utm_source=e1ad5111&v=3478D90D766FAB67AC1B3091A2366428B9A17D8A,Engineering Jobs,embedded systems,gb,embedded systems,standard,False,False
Electronics and Embedded Systems Engineer,Noir,"Wokingham, Berkshire","Electronics and Embedded Systems Engineer - Engineering Company – Wokingham, Berkshire (Tech stack: Electronics and Embedded Systems Engineer, Electronics and Embedded Systems Engineer, Developer, Architect, Electronics and Embedded Systems Engineer) Are you ready to be part of a company that is shaping the future of high-performance electronic systems? Our client is a global engineering leader with over 10,000 employees worldwide, delivering cutting-edge technology solutions across industries …",49758.55,49758.55,,2025-05-01T06:56:35Z,https://www.adzuna.co.uk/jobs/land/ad/5171940424?se=yGyvPfAo8BGT4w9x5LWCew&utm_medium=api&utm_source=e1ad5111&v=6B80D7C961F5928F9F761F34B0B3073CD9A9F382,Engineering Jobs,embedded systems,gb,embedded systems,standard,False,True
Software Engineer (Embedded systems),Head Resourcing,"Edinburgh, Scotland","Software Engineer (Embedded Systems) Chinese/ English bilingual  Location: Edinburgh, Scotland (Office-Based)  Experience Level: Entry to Mid-Level Are you ready to shape the future of mobile security? Or innovative, award winning tech client is looking for a Software Engineer with a passion for embedded systems and mobile security. This is an exciting opportunity to work on cutting-edge technology, researching how mobile apps interact with operating systems to enhance security solutions. If yo…",50149.62,50149.62,,2025-04-30T15:57:33Z,https://www.adzuna.co.uk/jobs/land/ad/5170691033?se=yGyvPfAo8BGT4w9x5LWCew&utm_medium=api&utm_source=e1ad5111&v=659CE88B0524F4009AB88220B57399A4AFE94335,IT Jobs,embedded systems,gb,embedded systems,standard,False,False
IP KVM Engineer/Developer - Embedded Systems,Prospero Integrated,"Cambridge, Cambridgeshire","IP KVM Engineer/Developer - Embedded Systems (£60,000 - £70,000  Excellent Benefits) Job Description Excellent opportunity for an experienced IP KVM Engineer to join our Client's growing team. You will have a deep understanding of embedded systems development including design and implementation of IP-based KVM (Keyboard, Video, Mouse) functionality for embedded hardware platforms. You will work on developing low-level software for video capture, compression, streaming, and input redirection to …",70000,70000,permanent,2025-04-19T18:26:00Z,https://www.adzuna.co.uk/jobs/land/ad/5153423455?se=yGyvPfAo8BGT4w9x5LWCew&utm_medium=api&utm_source=e1ad5111&v=D7E5850719AF7FFF9C889146037A536CD3ED588A,Engineering Jobs,embedded systems,gb,embedded systems,standard,False,False
Embedded Systems Engineer,Everfox,"London, UK","Intelligent. Dynamic. Resilient. Everfox, formerly Forcepoint Federal, has been defending the world’s most critical data and networks against the most complex cyber threats imaginable for more than 25 years. As trailblazers in defense-grade, high assurance cyber security, we have been leading the way in developing and delivering innovative cyber security technology. We protect data wherever it resides. Our unwavering dedication and commitment to our customers and the critical missions they serv…",33200,48100,permanent,2025-03-07T11:03:48Z,https://www.adzuna.co.uk/jobs/details/5080686541?utm_medium=api&utm_source=e1ad5111,Engineering Jobs,embedded systems,gb,embedded systems,standard,False,False
Embedded Systems Engineer,Vantage Consulting,"Pickering, North Yorkshire","Job Purpose: To provide engineering design and support functions, and to be responsible for small projects or sub-sections of larger projects under instruction of more senior engineers. Key Responsibilities: (Key Tasks) Manage design projects from initial concept/enquiry through detailed design to manufacturing handover. Provide design input on projects, using the technical competencies listed below. Generation of ideas for developments and new products. Be responsible for small projects, or su…",0,10000,permanent,2025-04-19T20:04:13Z,https://www.adzuna.co.uk/jobs/details/5153800737?utm_medium=api&utm_source=e1ad5111,Engineering Jobs,embedded systems,gb,embedded systems,standard,False,False
Embedded Systems Engineer,Owen Daniels,"Slingsby, York","Do you have software development experience using C, C++ and testing with C#? Are you confident designing analogue and digital circuitry? Our client is a global leader in manufacturing vehicle systems and are looking for an Embedded Systems Engineer to join on a permanent basis! Embedded Systems Engineer Permanent Site based position (8.30am to 4.30pm Mon-Thurs and 8.30am to 4pm Friday) Slingsby Embedded Systems Engineer Job Description Responsible for software development. This would involve b…",40000,48000,permanent,2025-04-28T13:31:44Z,https://www.adzuna.co.uk/jobs/land/ad/5166664499?se=yGyvPfAo8BGT4w9x5LWCew&utm_medium=api&utm_source=e1ad5111&v=70F95A95D85CD9D08F1999E22952EFE96236EAEB,IT Jobs,embedded systems,gb,embedded systems,standard,False,True
Embedded Systems Engineer,Platform Recruitment,"Wytham, Oxford","Embedded Systems Engineer - £ 40 - 65k – Oxford - Hybrid 2/3 days in office My client is a rapidly growing company in their niche researching and manufacturing groundbreaking products for market launch. Due to sustained success, they’re growing their product teams. Main duties:  Oversee productization of quantum technologies.  Design and develop electronics and microsystems, encompassing various subsystems and I/O interfaces.  Program firmware as needed, and create software for interfacing with…",40000,65000,,2023-11-06T23:18:48Z,https://www.adzuna.co.uk/jobs/land/ad/4417597072?se=yGyvPfAo8BGT4w9x5LWCew&utm_medium=api&utm_source=e1ad5111&v=288BCEA85F4CA31551FFC91A026303C4CDDAA0DB,Engineering Jobs,embedded systems,gb,embedded systems,standard,False,False
Embedded Systems Engineer - experienced,Everfox,"London, UK","Intelligent. Dynamic. Resilient. Everfox, formerly Forcepoint Federal, has been defending the world’s most critical data and networks against the most complex cyber threats imaginable for more than 25 years. As trailblazers in defense-grade, high assurance cyber security, we have been leading the way in developing and delivering innovative cyber security technology. We protect data wherever it resides. Our unwavering dedication and commitment to our customers and the critical missions they serv…",51300,69600,permanent,2025-03-31T12:25:42Z,https://www.adzuna.co.uk/jobs/details/5119758823?utm_medium=api&utm_source=e1ad5111,Engineering Jobs,embedded systems,gb,embedded systems,standard,False,False
Senior Embedded Systems Engineer,IONATE,"London, UK","£65-80K – Full-time – London/Hybrid IONATE is a deep technology start-up building the technology backbone for smart grids. Our team is looking for a Senior Embedded Software Engineer who will be responsible for developing and implementing real time software, taking concepts through to commercial product for customers. Requiring extensive knowledge and experience in embedded software development, this position will involve working with our hardware and software team. With a focus on real-time em…",65000,80000,,2025-04-08T20:27:02Z,https://www.adzuna.co.uk/jobs/details/5135824789?utm_medium=api&utm_source=e1ad5111,IT Jobs,embedded systems,gb,embedded systems,standard,False,False
Senior Embedded Systems Developer,Platform Recruitment,"Englefield, Reading","Senior Embedded Systems Developer - £55k - £65k – Reading - Hybrid My client is an established company in their niche providing end-to-end solutions for a range of sectors. Due to sustained success, they’re expanding their development team. Main duties:  Creating, implementing, and managing software programmes  Continuous integration and development of software.  Collaborating with a multi-skilled team of managers and developers.  Mentoring and guiding junior developers.  Meeting with quality t…",55000,65000,,2023-11-01T23:00:35Z,https://www.adzuna.co.uk/jobs/land/ad/4407844325?se=yGyvPfAo8BGT4w9x5LWCew&utm_medium=api&utm_source=e1ad5111&v=7F12A5F344AEA256E2A4AFD801F08F77E19C34DA,IT Jobs,embedded systems,gb,embedded systems,standard,False,False
Engineering Team Lead (Embedded Systems),James Fisher and Sons,"Elrick, Westhill","Team Lead Embedded Systems Architect Full-Time, Permanent NHC, Aberdeen - Hybrid working About the Company: JFD is the world leading underwater capability provider, serving the commercial and defence markets with innovative diving, submarine and hyperbaric rescue, technical solutions and services. Operating worldwide, the company is the leading provider of submarine rescue capability and an established provider of submarine escape training. The company is at the forefront of hyperbaric rescue, …",52542.02,52542.02,permanent,2025-03-18T17:07:17Z,https://www.adzuna.co.uk/jobs/details/5099191061?utm_medium=api&utm_source=e1ad5111,Engineering Jobs,embedded systems,gb,embedded systems,standard,False,True
Advanced Embedded System Engineering Firmware & Embedded Engineer,accenture,UK,"About Accenture: Accenture is a global professional services company with leading capabilities in digital, cloud and security. Combining unmatched experience and specialized skills across more than 40 industries, we offer Strategy and Consulting, Technology and Operations services and Accenture Song-all powered by the world's largest network of Advanced Technology and Intelligent Operations centers. Our 699,000 people deliver on the promise of technology and human ingenuity every day, serving c…",61513.96,61513.96,,2023-11-13T22:01:38Z,https://www.adzuna.co.uk/jobs/details/4430367275?utm_medium=api&utm_source=e1ad5111,Engineering Jobs,embedded systems,gb,embedded systems,standard,False,True
Special Projects Engineer - Robotics & Embedded Systems,Marble,"Chippenham, Wiltshire","At Marble, we're building the future of autonomous earth observation—and that includes everything on the ground, too. We’re looking for a Special Projects Engineer to take on one of our most ambitious challenges: build our robotic hangar system. This is the critical infrastructure that enables full automation of UAV operations—charging, maintenance, data offloading, and redeployment, all without human touch. You’ll be the technical lead on this project, bridging robotics, embedded systems, and …",54202.49,54202.49,,2025-04-16T20:08:43Z,https://www.adzuna.co.uk/jobs/details/5148137594?utm_medium=api&utm_source=e1ad5111,IT Jobs,embedded systems,gb,embedded systems,standard,False,False
Advanced Embedded System Engineering Application Developer,accenture,UK,"About Accenture: Accenture is a global professional services company with leading capabilities in digital, cloud and security. Combining unmatched experience and specialized skills across more than 40 industries, we offer Strategy and Consulting, Technology and Operations services and Accenture Song-all powered by the world's largest network of Advanced Technology and Intelligent Operations centers. Our 699,000 people deliver on the promise of technology and human ingenuity every day, serving c…",70299.81,70299.81,,2023-11-17T09:55:53Z,https://www.adzuna.co.uk/jobs/details/4437883186?utm_medium=api&utm_source=e1ad5111,IT Jobs,embedded systems,gb,embedded systems,standard,False,True
Embedded Products System Architect,Octagon Group,"Handy Cross, High Wycombe","Job Description Senior Embedded Software Engineer – Remote I am currently working for an exciting organisation who are one of the market leaders within the audio industry who are involved in the design, development and manufacturer of audio interfaces. They are currently seeking for an experienced Senior Embedded Software Engineer to join their busy Research & Development where you will be involved in delivering their class-leading audio products. You will be passionate about designing and brin…",70000,90000,,2024-09-28T13:40:06Z,https://www.adzuna.co.uk/jobs/details/4880267337?utm_medium=api&utm_source=e1ad5111,IT Jobs,embedded systems,gb,embedded systems,standard,True,False
Senior Software Engineer Embedded & Edge Systems,Yoh Solutions Ltd,"Warrington, Cheshire","Senior Software Engineer Embedded & Edge Systems Location: Warrington (4 days per week on-site) Salary: Up to £65,000  benefits A rare opportunity to take technical ownership of a cutting-edge system with real-world impact. A well-funded, early-stage technology company developing sensor solutions for the utilities industry are looking for a Senior Software Engineer to lead the evolution of their edge and embedded software systems. Their technology is designed to help reduce waste and improve th…",65000,65000,permanent,2025-05-03T11:26:10Z,https://www.adzuna.co.uk/jobs/land/ad/5178365449?se=yGyvPfAo8BGT4w9x5LWCew&utm_medium=api&utm_source=e1ad5111&v=59CE8DDC945A1C2556C5B4977F4E2FB4D4F15F6E,IT Jobs,embedded systems,gb,embedded systems,standard,False,False
Senior Embedded Software/Systems Engineer,SAIF Autonomy Ltd,"London, UK","ONLY FOR THOSE EFFECTED BY THE REDUNDANCIES AT BEAM. Senior Embedded Software Engineer SAIF Autonomy is building the next generation of safety-tech t hat will unlock the true benefits of AI and Autonomous Systems, for humanity. We are looking for candidates that want to help rapidly grow our company, contributing to the strategic and technical direction of our high performing team. If you are looking for a challenge, potential for significant career progression internally as we grow and opportu…",51083.81,51083.81,permanent,2025-05-03T01:06:48Z,https://www.adzuna.co.uk/jobs/details/5177503613?utm_medium=api&utm_source=e1ad5111,Engineering Jobs,embedded systems,gb,embedded systems,standard,False,False
FPGA Engineer,HAYS,"Cambridge, Cambridgeshire","Join a global technology leader as an FPGA/Embedded System Engineer! Job Overview: We are seeking an experienced FPGA / Embedded System Engineer to join our client’s team in Cambridge, UK. You will work on their silicon automation board control FPGA design, collaborating with both board designers and software engineers. This role involves RTL design, verification, and bringing-up on the hardware. Location: Cambridge (up to 3 times per week on-site) Daily Rate: £600 per day through umbrella Cont…",156000,156000,contract,2025-03-01T09:43:01Z,https://www.adzuna.co.uk/jobs/land/ad/5068273201?se=yGyvPfAo8BGT4w9x5LWCew&utm_medium=api&utm_source=e1ad5111&v=AA6082E1F69195D386DE127B71805E686AFD48A0,IT Jobs,embedded systems,gb,embedded systems,standard,False,True
Software Engineer,KO2 Embedded Recruitment Solutions Ltd,"Bensham, Gateshead","Role : Software Engineer - Embedded Systems Location: Newcastle (Office-Based) Salary: Up to £50,000 KO2's client, a leading innovator in the electric vehicle and power industry, is seeking a talented Software Engineer to join their growing development team. This is a fantastic opportunity to be part of the design and development of a diverse range of next-generation devices that are helping to shape the future of sustainable energy solutions. The Role You will be involved in the full software …",50000,50000,permanent,2025-04-10T21:46:08Z,https://www.adzuna.co.uk/jobs/land/ad/5139647711?se=yGyvPfAo8BGT4w9x5LWCew&utm_medium=api&utm_source=e1ad5111&v=BC79D862F94B8394E636586CE59B5B35354309C2,IT Jobs,embedded systems,gb,embedded systems,standard,False,False
Embedded Software Engineer,KO2 Embedded Recruitment Solutions Ltd,"Romanby, Northallerton","Embedded Software Engineer - Intrinsically Safe Avionics Systems Northallerton, North Yorkshire Up to £65,000 per annum Permanent, Full-Time KO2's client, a specialist in designing intrinsically safe embedded systems for use in challenging and high-reliability environments - including cutting-edge avionics applications - is seeking an experienced Embedded Software Engineer to join their growing engineering team in Northallerton. This is a fantastic opportunity for an engineer who thrives in a s…",65000,65000,permanent,2025-04-22T22:11:55Z,https://www.adzuna.co.uk/jobs/land/ad/5156973146?se=yGyvPfAo8BGT4w9x5LWCew&utm_medium=api&utm_source=e1ad5111&v=59D9C33D07029F9AA3B6028797A76E8E57AFE26C,IT Jobs,embedded systems,gb,embedded systems,standard,False,False
Technology Field Application Engineer AI,"Arrow Electronics, Inc.",UK,"Position: Technology Field Application Engineer AI Job Description: As Arrow Global Components (AGC), a part of Arrow Electronics, we are a leader in distribution and value-added services related to electronic components. We resell, customize, and distribute electronic components to our clients all over the world. Our business is based on a trusted, long-lasting net of relationships with industry leaders, both on the supplier and customer side. Find more information about us on our page: www.ar…",56925.8,56925.8,,2025-03-28T02:16:28Z,https://www.adzuna.co.uk/jobs/land/ad/5114737387?se=yGyvPfAo8BGT4w9x5LWCew&utm_medium=api&utm_source=e1ad5111&v=46FDCAB80608C5740895549445DE010F7AAFFCAE,IT Jobs,embedded systems,gb,embedded systems,standard,False,True
Software Developer - C#,KO2 Embedded Recruitment Solutions Ltd,"Trafford Park, Manchester","Join KO2's Client - A Leader in Complex Automation Systems Using Novel AI Techniques Are you an ambitious developer looking to work at the cutting edge of access control technology? KO2's client, a leader in designing and developing complex automation systems, is seeking a talented developer to join their dynamic team. Specialising in novel AI techniques, this unique business creates highly intricate automation systems used in access control that run on embedded environments. This is a rare opp…",55000,55000,permanent,2025-04-28T18:47:38Z,https://www.adzuna.co.uk/jobs/land/ad/5166948349?se=yGyvPfAo8BGT4w9x5LWCew&utm_medium=api&utm_source=e1ad5111&v=C72C17B8BC7B17442EF75A14D60059291E973613,IT Jobs,embedded systems,gb,embedded systems,standard,False,False
Senior Embedded C++ Engineer – Camera Systems,ALTEN,"Fareham, Hampshire","Job Description Are you an expert in Embedded C++ looking to take on a challenging role developing high-performance camera and video systems ? ALTEN UK is hiring a Senior Embedded Software Engineer to work on advanced marine imaging technology, where you'll lead the development of camera control , video streaming , and system-level integration on Linux-based platforms. Key Responsibilities: Design and implement robust Embedded C++ software for real-time camera applications Develop video streami…",71453.05,71453.05,,2025-04-18T02:20:27Z,https://www.adzuna.co.uk/jobs/details/5150857069?utm_medium=api&utm_source=e1ad5111,Engineering Jobs,embedded systems,gb,embedded systems,standard,False,False
Software Test Automation Architect - Embedded 4G / 5G,Integrity Personnel Limited,"Chesterton, Cambridge","Software Test Automation Architect Embedded / 4G/5G : You will define, design and implement a scalable test automation framework for cutting edge communication systems solutions. Proven experience in test automation architecture, framework design and implementation. Strong background in automating tests for embedded systems, telecom or mission-critical applications. Strong coding in Python, Java, C# or JavaScript. Experience testing 3G, 4G or 5G LTE wireless communications technologies. Underst…",70000,70000,permanent,2025-05-01T02:32:01Z,https://www.adzuna.co.uk/jobs/land/ad/5171589085?se=yGyvPfAo8BGT4w9x5LWCew&utm_medium=api&utm_source=e1ad5111&v=0F3838F8187DF28E9DF5F99ABD5FAE86E81FE57E,IT Jobs,embedded systems,gb,embedded systems,standard,False,False
Embedded Software Engineer,ZENOVO LTD,"Cheltenham, Gloucestershire","Location : Cheltenham, Gloucestershire (3 Day's Per Week On-Site) Overview of Business & Opportunity: This is a chance for 2 Embedded Software Engineers to join a growing team for a business that is a global leader in their field, focusing on communication and sensor based products used across the world. Key Responsibilities: - Develop, Implement Embedded Software (C/C++) for ARM Based MicroControllers - Work with Embedded Software on a Real-Time Operating System - Test & Debug Existing Embedde…",80000,80000,permanent,2024-09-25T11:15:27Z,https://www.adzuna.co.uk/jobs/land/ad/4875629405?se=yGyvPfAo8BGT4w9x5LWCew&utm_medium=api&utm_source=e1ad5111&v=C6F487AF314CDC81413BD146411A3096D42FAD51,Engineering Jobs,embedded systems,gb,embedded systems,standard,False,True
Electronics Design Team Lead,Rednal Recruitment,"Kenn, Clevedon","We are currently seeking an Electronics Design Team Lead, to join a multidisciplinary engineering design team. Our client designs and manufactures specialist electronic products supplying a nationwide industrial market. Duties and responsibilities of the role will include - Design, development and support of power and control circuits, both digital and analog - Team Lead responsibilities - New product implementation as part of the design team Skills and experience sought will include: - Degree …",55000,55000,permanent,2025-03-07T14:21:11Z,https://www.adzuna.co.uk/jobs/land/ad/5081111818?se=yGyvPfAo8BGT4w9x5LWCew&utm_medium=api&utm_source=e1ad5111&v=0E21FD97343488073C4A1005BAF09344EBDC7E77,Engineering Jobs,embedded systems,gb,embedded systems,standard,False,False
Test Engineer,Latham & Bond HR,"Cannock, Staffordshire","Automotive Test Engineer Location : Cannock Salary : £60,000 - £65,000 Job Type : Full-time, permanent Latham & Bond HR are currently working with a specialist manufacturing organization operating in the automotive sector. This is a key opportunity to join a well-established Electronics R&D department, supporting the design, development, and testing of cutting-edge embedded systems and software tools. Key Responsibilities: Support the R&D team in the implementation and maintenance of software s…",48395.76,48395.76,permanent,2025-04-21T03:48:43Z,https://www.adzuna.co.uk/jobs/land/ad/5154913391?se=yGyvPfAo8BGT4w9x5LWCew&utm_medium=api&utm_source=e1ad5111&v=5BB9D5F59FC4E95861CED037D805B886C105ADDF,IT Jobs,embedded systems,gb,embedded systems,standard,False,False
Embedded Software Engineer C/C++,Octagon Group,"Southampton, Hampshire","Are you a skilled Embedded Software Enginee r looking to contribute to cutting-edge defence technology? Based in Southampton , this Embedded Software Engineer job offers the opportunity to work on advanced embedded systems in a dynamic and secure environment. Due to the sensitive nature of the projects, security clearance will be required. The Embedded Software Engineer’s main responsibilities: - Develop C/C++ code for embedded systems and user interfaces - Design and develop GUIs using commerc…",53603.52,53603.52,,2025-04-21T03:48:33Z,https://www.adzuna.co.uk/jobs/land/ad/5154913130?se=yGyvPfAo8BGT4w9x5LWCew&utm_medium=api&utm_source=e1ad5111&v=C11C03FBCD9A0AB2FB6EB01BF88785453FC2F758,IT Jobs,embedded systems,gb,embedded systems,standard,False,False
Electronics Manager,ETS Technical Selection,"Derby, Derbyshire","Job Title: Electronics Manager Qualifications and Experience: A degree or equivalent qualification in Electronic Engineering. Minimum of 5 years of relevant experience in electronic design. Proven experience with embedded systems and microcontroller programming. Strong leadership experience in managing electronics development teams and projects. Experience overseeing the full electronics development lifecycle, from concept to production. Role and Responsibilities: We are seeking an experienced …",75000,75000,permanent,2025-04-12T09:46:50Z,https://www.adzuna.co.uk/jobs/land/ad/5141915764?se=yGyvPfAo8BGT4w9x5LWCew&utm_medium=api&utm_source=e1ad5111&v=063B62F0EA96DE1360FEC0249E0A147E1FFABC04,Engineering Jobs,embedded systems,gb,embedded systems,standard,False,False
Nursery Class Teacher in Greenwich,HAYS,"Greenwich, South East London","Nursery Class Teacher in Greenwich, South-East London. Urgent Start. Competitive Salary! Are you an enthusiastic and inspirational nursery teacher seeking a new opportunity? Join Hays and work with experienced recruiters who have a background in the teaching profession! Location: Greenwich, South-East London Salary: £38,766 - £50,288 per annum based on experience Working pattern: 8:30am – 3:30pm, 5 days per week Contract: Full-time/ Fixed-Term Start date: 01/05/2025 New Primary School This prim…",39163.13,39163.13,contract,2025-04-25T19:56:25Z,https://www.adzuna.co.uk/jobs/land/ad/5162900929?se=yGyvPfAo8BGT4w9x5LWCew&utm_medium=api&utm_source=e1ad5111&v=667F01A3781F1F8062DA0FF251AB4C6A53F684A4,Teaching Jobs,embedded systems,gb,embedded systems,standard,False,False
