title,company,location,description,salary_min,salary_max,contract_type,created,redirect_url,category,specialty,source_country,query,query_type,remote_friendly,international
Full Stack Engineer,IBM - Avature,"London, UK","At IBM CIC, we deliver deep technical and industry expertise to a wide range of public and private sector clients in the UK. A career in IBM CIC means you'll have the opportunity to work with visionaries across multiple industries to improve the hybrid cloud and AI journey for the most innovative and valuable companies in the world. Your ability to accelerate impact and make meaningful change for your clients is enabled by our strategic partner ecosystem and our robust technology platforms acro…",47023.01,47023.01,contract,2025-04-25T20:16:07Z,https://www.adzuna.co.uk/jobs/land/ad/5162939363?se=WJrfKu0o8BGDGO_HSiZXLA&utm_medium=api&utm_source=e1ad5111&v=BB896871EE2C024FEF7E6D94649580B3F2022D23,IT Jobs,full stack,gb,full stack,standard,False,False
Azure Full Stack Engineer,IBM - Avature,"London, UK","In this role, you'll work in one of our IBM Consulting Client Innovation Centres (Delivery Centres), where we deliver deep technical and industry expertise to a wide range of public and private sector clients around the world. Our delivery centres offer our clients locally based skills and technical expertise to drive innovation and adoption of new technology. You'll work with visionaries across multiple industries to improve the hybrid cloud and AI journey for the most innovative and valuable …",49483.14,49483.14,contract,2025-04-29T19:33:34Z,https://www.adzuna.co.uk/jobs/land/ad/5169128492?se=WJrfKu0o8BGDGO_HSiZXLA&utm_medium=api&utm_source=e1ad5111&v=0CC0CE6068CAE6BCA58104C33C087CD12D14FD80,IT Jobs,full stack,gb,full stack,standard,False,False
Senior Azure Full Stack Engineer,IBM - Avature,"London, UK","In this role, you'll work in one of our IBM Consulting Client Innovation Centres (Delivery Centres), where we deliver deep technical and industry expertise to a wide range of public and private sector clients around the world. Our delivery centres offer our clients locally based skills and technical expertise to drive innovation and adoption of new technology. You'll work with visionaries across multiple industries to improve the hybrid cloud and AI journey for the most innovative and valuable …",51140.54,51140.54,contract,2025-04-28T08:28:37Z,https://www.adzuna.co.uk/jobs/land/ad/5166510394?se=WJrfKu0o8BGDGO_HSiZXLA&utm_medium=api&utm_source=e1ad5111&v=5AB1FCD06E28F542B1B9AA5B195C865562EF1898,IT Jobs,full stack,gb,full stack,standard,False,False
Full Stack Developer,DVF Recruitment,"Ipswich, Suffolk","x2 FULL STACK DEVELOPER ROLES  Senior Full Stack Developer - up to £80,000 Full Stack Developer - up to £65,000 Suffolk based - x2 days per week. Must have: - Modern Angular (My client are using v18 - looking to upgrade to v19) - C#/ .NET - API/ Microservices Apply now! ADZN1_UKTJ",80000,80000,permanent,2025-04-22T02:38:49Z,https://www.adzuna.co.uk/jobs/land/ad/5155796293?se=WJrfKu0o8BGDGO_HSiZXLA&utm_medium=api&utm_source=e1ad5111&v=0C094816FC53E0F7FBE411919C6A11C9C4B2680D,IT Jobs,full stack,gb,full stack,standard,False,False
Full Stack Developer,La Fosse,"Westminster, South West London","Full Stack Engineer | Hybrid | £60,000 | React.js | Python | SQL | TypeScript Opportunity to join a global leader in payments! La Fosse has exclusively partnered with a renowned payments company on their mission to develop a cutting-edge, all-in-one compliance platform—designed for both transactional and enterprise use. This is a greenfield project , providing engineers with a rare opportunity to shape the foundation of a high-impact platform using modern technologies and best practises from th…",60000,60000,permanent,2025-04-24T22:18:14Z,https://www.adzuna.co.uk/jobs/land/ad/5161190050?se=WJrfKu0o8BGDGO_HSiZXLA&utm_medium=api&utm_source=e1ad5111&v=BB2CA131D467190B9DDF79D8BA63DDD5327F4CB7,IT Jobs,full stack,gb,full stack,standard,False,True
Full stack engineer,Bloc Recruitment,"Clerkenwell, Central London","Full Stack Software Engineer (NodeJS, React, TypeScript) London - 2/3 Days a week Salary Up to £70k  Equity Join a VC backed fast-moving London startup helping businesses drive revenue, maximise operational efficiency, and retain more clients through smarter, integrated tooling. Backed by experienced founders and led by a CTO who helped scale multiple Tech businesses. The business is still early—and things can be messy. Priorities shift, and things move fast, and you will be learning constantly…",70000,70000,permanent,2025-04-30T18:38:04Z,https://www.adzuna.co.uk/jobs/land/ad/5170880971?se=WJrfKu0o8BGDGO_HSiZXLA&utm_medium=api&utm_source=e1ad5111&v=5619E057FAD101D2D618659B8346BF19D277974A,IT Jobs,full stack,gb,full stack,standard,False,False
Full-Stack Developer,ADLIB Recruitment,"St. Augustines, Bristol","React, Typescript, Node. Fast-growing Climate Tech startup. Exciting projects, collaborative mission-driven team. Were looking for a full-stack developer with React, Typescript skills to join one of the regions most exciting Climate Tech companies. Theyve built a platform which helps to drive the transition away from fossil fuel heating in peoples homes and are now looking to add to their team. Theyre helping to seriously reduce carbon emissions whilst also helping to reduce homeowner energy bi…",60000,60000,permanent,2025-04-24T14:24:40Z,https://www.adzuna.co.uk/jobs/land/ad/5160138830?se=WJrfKu0o8BGDGO_HSiZXLA&utm_medium=api&utm_source=e1ad5111&v=6FE6F76DAEFF3F3981699A5C81F9931A01D0C968,IT Jobs,full stack,gb,full stack,standard,False,False
Full Stack Engineer,PA Consulting,"Belfast, Northern Ireland","Company description We believe in the power of ingenuity to build a positive human future. As strategies, technologies, and innovation collide, we create opportunity from complexity. Our teams of interdisciplinary experts combine innovative thinking and breakthrough technologies to progress further, faster. Our clients adapt and transform, and together we achieve enduring results. We are over 4,000 strategists, innovators, designers, consultants, digital experts, scientists, engineers, and tech…",61468.11,61468.11,,2025-05-03T03:19:53Z,https://www.adzuna.co.uk/jobs/land/ad/5177698918?se=WJrfKu0o8BGDGO_HSiZXLA&utm_medium=api&utm_source=e1ad5111&v=010DFBB848B2C802C0A050388752F33ACE011B9F,IT Jobs,full stack,gb,full stack,standard,False,False
Senior Full Stack Engineer,Circle Group,"South East London, London","Senior Full Stack Engineer £70K -85k UK - Fully Remote Excited by the challenge of working at a fast-moving cybersecurity startup? We're looking for a Senior Full Stack Engineer to join their team on a fully remote bases in the UK, where you'll have a real impact working with cutting-edge technology to help organisations tackle security threats in real time. This is a fully remote role with a starting salary between £70k -£85k. For this role you MUST be resident and eligible to work in the UK, …",85000,85000,permanent,2025-05-02T20:04:54Z,https://www.adzuna.co.uk/jobs/land/ad/5177150431?se=WJrfKu0o8BGDGO_HSiZXLA&utm_medium=api&utm_source=e1ad5111&v=796D6C635338FC0D7225521D0900C3A7D77B342B,IT Jobs,full stack,gb,full stack,standard,True,False
Full Stack developer Crypto,La Fosse,"South East London, London","Full-Stack Developer – Crypto | JavaScript/PHP | Blockchain | £80,000 - £85,000 | London (Onsite)/(fully remote) Join a pioneering fintech startup on a mission to reshape how crypto is used in everyday payments. Backed by a strategic partnership with Tellers, this is one of the few companies bringing real-world utility to Web3 – and they're looking for a Full-Stack Developer to play a key role in the journey. You'll be building a high-impact crypto payments platform from the ground up — working…",85000,85000,permanent,2025-04-16T17:58:42Z,https://www.adzuna.co.uk/jobs/land/ad/5147555952?se=WJrfKu0o8BGDGO_HSiZXLA&utm_medium=api&utm_source=e1ad5111&v=0B363A94796451866CF6646F0AAF4C07CCB65245,IT Jobs,full stack,gb,full stack,standard,True,False
C# Full Stack Developer,Franklin Bates Limited,"Manchester, Greater Manchester","C# Full Stack Engineer - AI Product Fully Remote Salary: 60k About Us: Our client is a forward-thinking organization committed to leveraging AI to revolutionize business decision-making. Their innovative products empower businesses with smarter, faster, and more strategic solutions. Be part of a team driving this transformation through cutting-edge engineering and technology. Role Overview: They are seeking several skilled C# Full Stack Engineers with strong expertise in JavaScript to join the …",70000,70000,permanent,2025-04-28T18:47:37Z,https://www.adzuna.co.uk/jobs/land/ad/5166948303?se=WJrfKu0o8BGDGO_HSiZXLA&utm_medium=api&utm_source=e1ad5111&v=EE4599C8F733A12B74323EB04757ABDDF2502828,IT Jobs,full stack,gb,full stack,standard,True,False
Full Stack Software Developer,Franklin Bates Limited,"Ocean Village, Southampton","Full Stack Software Developer Up to £60,000 depending on experience and skillset Flexible hybrid set up, willing to be onsite (travel can be expensed) in the south coast of the UK ideally once a fortnight Join a thriving technology organisation providing security solutions for regulated industries from government roots spanning back 15 years as they fulfil client requirements in this role, working with an onsite client team of solution architects and technical subject matter experts as the Full…",60000,60000,permanent,2025-04-23T22:17:36Z,https://www.adzuna.co.uk/jobs/land/ad/5159099983?se=WJrfKu0o8BGDGO_HSiZXLA&utm_medium=api&utm_source=e1ad5111&v=00DC74E28395BA25EE4B88EEEE5E06FF5738CEC8,IT Jobs,full stack,gb,full stack,standard,False,False
Full Stack Software Developer,t2 group,"Cardiff County, Wales","Role: Software Developer (Full Stack Developer ASP.NET / .NET Core) Job Type: Full-time, Permanent Office Hours: Monday - Thursday 8:45am - 4:45pm and Friday 8:45am - 3:30pm Salary and benefits £35,000 - £40,000 depending on qualifications and experience Hybrid role, must be able to work from St Mellons, Cardiff Laptop and mobile phone provided 25 Days annual leave plus bank holidays (increasing with length of service) Christmas and New Year shutdown period Pension scheme Specsavers scheme NUS …",40000,40000,permanent,2025-04-02T05:19:00Z,https://www.adzuna.co.uk/jobs/land/ad/5123362410?se=WJrfKu0o8BGDGO_HSiZXLA&utm_medium=api&utm_source=e1ad5111&v=5AB59D59FDA085D03E26EB1315E7580088F7AE02,IT Jobs,full stack,gb,full stack,standard,False,False
Java Developer - Full Stack,Network IT,"Kidderminster, Worcestershire",An experienced Java Developer (Full Stack) is now sought by a well-established software Company. Working in a dedicated agile team you will focus on hands-on delivery of both enhanced back endarchitecture and front enduser experience. The code you create will directly improve the customer user experience for the Companys flagship products. As the Java Developer you will also be involved in: Design and code new product features Contribute to agile work flows Resolution of issues within the produ…,50000,50000,permanent,2025-04-02T17:12:27Z,https://www.adzuna.co.uk/jobs/land/ad/5124490584?se=WJrfKu0o8BGDGO_HSiZXLA&utm_medium=api&utm_source=e1ad5111&v=08822ACA3ED53696CC03D7523531CCE1C5A34FBE,IT Jobs,full stack,gb,full stack,standard,False,False
Senior Full Stack Developer,Proactive Appointments Limited,UK,"Senior Full Stack Developer Surrey - on-site - up to £65,000 per annum Our client is looking to onboarding a Senior Full Stack web developer on a permanent basis. The right candidate will play a vital role in the redevelopment of the company's website and back-end system, Collaborating with colleagues to accurately implement new features into their systems and have a sound understanding of architecture, programming, and solutions. Experience required: Experience across C# .NET & Node.js Experie…",65000,65000,permanent,2025-04-10T21:46:08Z,https://www.adzuna.co.uk/jobs/land/ad/5139647708?se=WJrfKu0o8BGDGO_HSiZXLA&utm_medium=api&utm_source=e1ad5111&v=B23F45E445C134944637397A37E4BD674B245E1B,IT Jobs,full stack,gb,full stack,standard,False,False
Full Stack Engineer - Python,Rebel Recruitment,"Nottingham, Nottinghamshire","Role: Python/Django Full-Stack Software Engineer Location: Nottingham Working Arrangement: Hybrid 3 days a week in the office Salary: Up to £ 80,000  Benefits Are you a software engineering veteran? Can you showcase your battle scars from all the development projects that youre proud of over the years? Have you previously solved the problem of what many would see as a technical nightmare or impossibility? Do you dream of coding? If so, keep reading because Ive got a cracking role on! I'm on the…",80000,80000,permanent,2025-04-03T21:34:42Z,https://www.adzuna.co.uk/jobs/land/ad/5127858163?se=WJrfKu0o8BGDGO_HSiZXLA&utm_medium=api&utm_source=e1ad5111&v=ED31F32F188E87577276A623D7991E07C74FB4B8,IT Jobs,full stack,gb,full stack,standard,False,False
DevOps - Full Stack Engineer,LA International Computer Consultants Ltd,"Sheffield, South Yorkshire","DevOps - Full Stack Engineer Hybrid working (60% office - 40% remote) 7 Month contract initially, good scope for extension £450 - £475 P/D (Umbrella-PAYE) One of our blue chip clients are looking for a DevOps - Full Stack Engineer to join the team on a long term programme of work. Key Responsibilities: Solid experience of experience in CI/CD Advanced knowledge and experience using CloudBees Jenkins (Installation, configuration and administration) Experience of Cloud Platforms specifically Googl…",117000,123500,contract,2025-04-16T17:58:48Z,https://www.adzuna.co.uk/jobs/land/ad/5147556021?se=WJrfKu0o8BGDGO_HSiZXLA&utm_medium=api&utm_source=e1ad5111&v=97FD6194D65821A0843BC2EE40113D11A1E2031F,IT Jobs,full stack,gb,full stack,standard,True,False
Full Stack PHP Developer,Hays,"Frome, Somerset","Full Stack PHP Systems Developer Frome/Trowbridge (3 days in office) £35000 - £45000 Please note my client cannot offer VISA sponsorship for this position. You will need your own transport for this role and to be living around Wiltshire or Somerset. Your new company This hyper-growth online business have a global presence and are winners of multiple awards. They are seeking a mid-level PHP Developer to work on site 3 days in the office, bolstering their in-house Systems Development team. Your n…",45000,45000,permanent,2025-04-22T18:14:07Z,https://www.adzuna.co.uk/jobs/land/ad/5156379358?se=WJrfKu0o8BGDGO_HSiZXLA&utm_medium=api&utm_source=e1ad5111&v=4EAE3B3C4DA6C370DA65E1C7B5894B4031BE9644,IT Jobs,full stack,gb,full stack,standard,False,True
Full Stack Angular Developer,Bromcom Computers Plc,"Hayes, Bromley","Full Stack Developer (Angular) Job description Team player to provide End to End solution, including coding and defect fixes Build scalable solution and work with testers to analyse and fix issues Perform Code Reviews, analyse issues identified and triage those Collaborate with DevOps team for troubleshooting deployment issues, if any Develop and deploy application to Azure using Azure DevOps and Azure PaaS Collaborative design and implementation of modern user-friendly interfaces Evaluate, red…",40818.78,40818.78,permanent,2025-04-10T17:44:18Z,https://www.adzuna.co.uk/jobs/land/ad/5138977157?se=WJrfKu0o8BGDGO_HSiZXLA&utm_medium=api&utm_source=e1ad5111&v=8B4139356A5688F459BBE2D81B8887F65096639D,IT Jobs,full stack,gb,full stack,standard,False,False
Software Engineer - Full-Stack,Spectrum It Recruitment Limited,"Ocean Village, Southampton","Mid - Snr Software Engineer - Tech for good Location: Remote/Hybrid (UK or Ireland-based, occasional in-person travel) Contract: 9-month fixed-term (Full-time, PAYE) Salary: Up to £65k Make an Impact, Tech That Matters Join a pioneering startup on a mission to break down digital barriers for the deaf community. This company is the first of its kind, using cutting-edge tech to translate digital and written content into sign language - making information truly accessible for everyone. They're sma…",65000,65000,permanent,2025-05-03T10:43:12Z,https://www.adzuna.co.uk/jobs/land/ad/5178221681?se=WJrfKu0o8BGDGO_HSiZXLA&utm_medium=api&utm_source=e1ad5111&v=745777A2FC1D358EDC7FF7E7BF62D91A05E4BC0A,IT Jobs,full stack,gb,full stack,standard,True,False
"Full-Stack Developer - Nuxt, Vue",Coburg Banks Limited,"Cambridge, Cambridgeshire","Role: Full-Stack Developer (Nuxt, Vue) Location: Home based Remote Salary: Circa £60,000 to £70,000 We are looking for a full stack developer with a couple of years' experience in developing, and deploying core web and mobile applications using Nuxt, Vue, and Ionic/Capacitor. You will be happy working across the stack, from backend development to frontend and mobile applications. Working in a small team you will have the opportunity to get your hands on all the latest tech including AI. What wi…",70000,70000,permanent,2025-04-15T17:55:29Z,https://www.adzuna.co.uk/jobs/land/ad/5145908353?se=WJrfKu0o8BGDGO_HSiZXLA&utm_medium=api&utm_source=e1ad5111&v=EA2EBA053BD0004F7E6DE9581D14D898BEB8EB0F,IT Jobs,full stack,gb,full stack,standard,True,False
Full-Stack Developer - React.js,Connexa,"Milton Keynes, Buckinghamshire","Junior Full Stack Developer - React.js Location: Milton Keynes Working Structure: Hybrid (1 day onsite per week) Job Type: Full-time, Permanent Are you passionate about front-end development and ready to build high-impact public sector solutions? We're seeking a Junior Full Stack Developer with a front-end focus (React.js) to join our growing, highly skilled team. You'll spend most of your time building engaging, responsive web applications in React.js, while gaining experience working across t…",50000,50000,permanent,2025-04-29T06:47:47Z,https://www.adzuna.co.uk/jobs/land/ad/5168019670?se=WJrfKu0o8BGDGO_HSiZXLA&utm_medium=api&utm_source=e1ad5111&v=17887122CAFB1F9BECF7C5F47898FE75D0196F95,IT Jobs,full stack,gb,full stack,standard,False,False
Senior Full Stack Java Engineer,Movement8,"South East London, London","Senior Software Engineer - Full Stack Engineer- Java, React, SpringBoot An exciting opportunity to join an innovative SaaS provider in the online gaming space. Work with top-tier clients in the UK and USA, contributing to the development of new software solutions within a rapidly expanding company. Work within their software engineering squads to develop new and modernize legacy applications using microservices. You'll primarily focus on Java backend, with a practical understanding of frontend …",65000,65000,permanent,2025-04-30T14:35:28Z,https://www.adzuna.co.uk/jobs/land/ad/5170492927?se=WJrfKu0o8BGDGO_HSiZXLA&utm_medium=api&utm_source=e1ad5111&v=7561E7D3B79C027D08A6BE901601C043E3A1662E,IT Jobs,full stack,gb,full stack,standard,False,False
Senior Full Stack Software Developer,Apex8 Ltd,"Chichester, West Sussex","A very exciting opportunity has arisen to join a progressive tech company based in West Sussex. Apex8 encompasses a group of companies which deals with the marketing, pricing and purchase of thousands of vehicles every month. We are the fastest growing company in our sector and we have seen rapid growth over the past 6 years. We focus on lead generation and develop our own products and tools to provide a first-rate user experience and allow us to process over 100,000 enquiries each month. We pr…",65000,65000,permanent,2025-04-25T18:25:16Z,https://www.adzuna.co.uk/jobs/land/ad/5162483942?se=WJrfKu0o8BGDGO_HSiZXLA&utm_medium=api&utm_source=e1ad5111&v=7853D00EE942A4EA2CAB50FF2793C8EB069D076B,IT Jobs,full stack,gb,full stack,standard,False,False
Senior Software Engineer Full Stack,Experian Ltd,"West Bridgford, Nottingham","Experian is a global data and technology company, powering opportunities for people and businesses around the world. We help to redefine lending practices, uncover and prevent fraud, simplify healthcare, create marketing solutions, and gain deeper insights into the automotive market, all using our unique combination of data, analytics and software. We also assist millions of people to accomplish their financial goals and help them save time and money. We operate across a range of markets, from …",58179.19,58179.19,permanent,2025-04-02T21:16:42Z,https://www.adzuna.co.uk/jobs/land/ad/5125066588?se=WJrfKu0o8BGDGO_HSiZXLA&utm_medium=api&utm_source=e1ad5111&v=791CFB93BCF4D341BD262008457909E5A4800443,IT Jobs,full stack,gb,full stack,standard,False,True
Senior Full Stack Engineer,VANRATH,"Belfast, Northern Ireland","Senior Full Stack Engineer (Node.js / React or Angular) - Hybrid - Belfast Professional Services | VANRATH Exclusive VANRATH is delighted to be partnering with a leading professional services organisation based in Belfast to recruit a Senior Full Stack Engineer. This is an exciting opportunity to join a company undergoing significant digital transformation, offering the chance to work on high-impact projects in a flexible hybrid environment. The Role: You'll join a dynamic team responsible for …",100000,100000,,2025-04-30T06:03:23Z,https://www.adzuna.co.uk/jobs/land/ad/5169935825?se=WJrfKu0o8BGDGO_HSiZXLA&utm_medium=api&utm_source=e1ad5111&v=B2116E8205B8982DEEF632287BB44A6206A5EA45,IT Jobs,full stack,gb,full stack,standard,False,False
Senior Full-Stack Developer,Staffline Recruitment  Ltd.,"Dungannon, County Tyrone","We are seeking an ambitious Senior Full-Stack Developer to join our clients team on a permanent basis. Key Responsibilities: Architect, develop and maintain high-quality web applications, native apps, and drive large-scale development projects. Liaise with customers to understand requirements, offer solutions, and build long-term relationships. Handle and protect highly sensitive information with a strong focus on security and compliance. Ensure technical excellence and maintain best practices …",70000,70000,permanent,2025-04-28T20:57:00Z,https://www.adzuna.co.uk/jobs/land/ad/5167318385?se=WJrfKu0o8BGDGO_HSiZXLA&utm_medium=api&utm_source=e1ad5111&v=5A64ACB2182D80FCD2B712D91CA1FF548C8F4945,IT Jobs,full stack,gb,full stack,standard,False,False
Lead Full Stack Engineer,PA Consulting,"Belfast, Northern Ireland","Company description We believe in the power of ingenuity to build a positive human future. As strategies, technologies, and innovation collide, we create opportunity from complexity. Our teams of interdisciplinary experts combine innovative thinking and breakthrough technologies to progress further, faster. Our clients adapt and transform, and together we achieve enduring results. We are over 4,000 strategists, innovators, designers, consultants, digital experts, scientists, engineers, and tech…",76830.16,76830.16,,2025-05-03T03:19:54Z,https://www.adzuna.co.uk/jobs/land/ad/5177698940?se=WJrfKu0o8BGDGO_HSiZXLA&utm_medium=api&utm_source=e1ad5111&v=3522CA40A1BDA502CEF00270C5F04DC44AA3998D,IT Jobs,full stack,gb,full stack,standard,False,False
Senior Full Stack Engineer,PA Consulting,"Belfast, Northern Ireland","Company description We believe in the power of ingenuity to build a positive human future. As strategies, technologies, and innovation collide, we create opportunity from complexity. Our teams of interdisciplinary experts combine innovative thinking and breakthrough technologies to progress further, faster. Our clients adapt and transform, and together we achieve enduring results. We are over 4,000 strategists, innovators, designers, consultants, digital experts, scientists, engineers, and tech…",75287.02,75287.02,,2025-05-03T03:19:52Z,https://www.adzuna.co.uk/jobs/land/ad/5177698889?se=WJrfKu0o8BGDGO_HSiZXLA&utm_medium=api&utm_source=e1ad5111&v=2FC64E79477D833DB5B6C0405E0D38A7D43DDC64,IT Jobs,full stack,gb,full stack,standard,False,False
Senior Full Stack Engineer,Version 1,"Belfast, Northern Ireland","Version 1 has celebrated over 26 years in Technology Services and continues to be trusted by global brands to deliver solutions that drive customer success. Our expertise enables our customers to navigate the rapidly changing Digital-First world we live in. We foster strong partnerships with leading technology giants including Microsoft, AWS, Oracle, Red Hat, OutSystems, and Snowflake, ensuring that our customers are provided with the highest quality solutions and services. Were an award-winnin…",57123.37,57123.37,,2025-05-02T06:13:27Z,https://www.adzuna.co.uk/jobs/land/ad/5175373266?se=WJrfKu0o8BGDGO_HSiZXLA&utm_medium=api&utm_source=e1ad5111&v=31E6F32B05940A1CCD21E364E7196463E2212F02,IT Jobs,full stack,gb,full stack,standard,False,True
Full Stack PHP Developer,VANRATH,"Belfast, Northern Ireland",An opportunity for a talented developer to join an ambitious and local scale-up to help supercharge a unique product through the first tech rebuild. This is a broad role where you'll be able to help shape the direction of the technology and processes to achieve big goals. Requirements You have 3-5 years of experience with Laravel and PHP Ideally front-end experience with VueJS Can work independently but also a team player You have excellent communication and collaboration skills You are passion…,60000,60000,,2025-04-30T06:03:23Z,https://www.adzuna.co.uk/jobs/land/ad/5169935882?se=WJrfKu0o8BGDGO_HSiZXLA&utm_medium=api&utm_source=e1ad5111&v=E35BA25B5C9C71DA706FBA2068E532D27D5E4790,IT Jobs,full stack,gb,full stack,standard,False,False
