title,company,location,description,salary_min,salary_max,contract_type,created,redirect_url,category,specialty,source_country,query,query_type,remote_friendly,international
Senior DevSecOps Engineer,Core4ce Careers,"Remote, Coos County","We are seeking a Senior DevSecOps Engineer to lead the secure development and deployment of cloud-native infrastructure in support of a mission-critical cybersecurity modernization effort. This role requires hands-on expertise in Infrastructure as Code (IaC), Configuration as Code (CaC), containerization, secure image creation, and CI/CD automation. The engineer will design and develop systems that enable multi-cloud deployment pipelines, secrets management, system interoperability, and environ…",170000,200000,,2025-03-25T23:17:30Z,https://www.adzuna.com/details/5111511380?utm_medium=api&utm_source=e1ad5111,IT Jobs,infrastructure,us,infrastructure,remote,False,False
Engineering (general app),Turnkey,"Remote, Coos County","Your role Design and build systems from the ground up without cutting corners on security or usability Develop signing infrastructure & applications to run inside secure computing environments Collaborate effectively across the company to design and deliver the core product Write internal product specifications, external developer documentation, whitepapers, etc. Design and build new product features end-to-end driven by customer requests Assist in scaling out a world-class engineering team Dev…",150000,275000,,2025-05-02T20:30:51Z,https://www.adzuna.com/details/5177534213?utm_medium=api&utm_source=e1ad5111,IT Jobs,infrastructure,us,infrastructure,remote,False,False
Maicom - Project Manager,Centerline,"Remote, Coos County","The Project Manager will lead the project management for critical infrastructure, telecommunication design/build projects. Projects are centered around electrical, HVAC, and civil infrastructure supporting customer’s requirements. Responsibilities include client meetings, project planning, equipment selection and logistics, on-site management, and project closeouts. Ideal candidate would have solid construction management experience and strong experience dealing with customers in the cable or t…",99119.24,99119.24,,2025-04-29T21:15:21Z,https://www.adzuna.com/details/5169692440?utm_medium=api&utm_source=e1ad5111,Trade & Construction Jobs,infrastructure,us,infrastructure,remote,False,False
Network / Unified Communication (UC) Subject Matter Expert (SME),Core4ce Careers,"Remote, Coos County","Network / Unified Communication (UC) Subject Matter Expert (SME) The primary responsibility for the Network / UC SME position is to plan, design, deploy, and continue to support a mission critical project for the Cisco UC Manager and Session Border Controller (SBC) platform. Technologies utilized by the Enterprise UC Network Engineer SME include: Multiple Switch vendors, Juniper, Ruckus, Aruba, Cisco switches, Palo Alto Firewall, Panorama, and Wireless. The position also requires demonstrated c…",65000,165000,,2025-04-17T20:58:00Z,https://www.adzuna.com/details/5150830318?utm_medium=api&utm_source=e1ad5111,IT Jobs,infrastructure,us,infrastructure,remote,False,False
Job in Germany: Infrastructure / DevOps Engineer (w/m/d),DFS Deutsche Flugsicherung GmbH,France,"Safety first - and much more. This is our best-known task: the safe and precise organization of air traffic in Germany. Experienced, excellently trained air traffic controllers are responsible for this. As an employer, however, we have an even broader base - this is underlined by the fact that we have over 5,600 employees. At our headquarters, branches and tower sites, we offer attractive career prospects to newcomers and professionals from many areas. With people who love their job and in an e…",,,,2025-03-21T04:54:53Z,https://www.adzuna.fr/land/ad/5103872056?se=0js5f_Eo8BGFil_oKXcHCQ&utm_medium=api&utm_source=e1ad5111&v=DF578CEE1E6D177A1FF992C394E86845BE207B6C,Unknown,infrastructure,fr,infrastructure,standard,False,False
"Job in Germany: IT System Administrator (f/m/d) Infrastructure - Network, Firewall, Storage",Stadtverwaltung Kehl,France,"IT System Administrator (f/m/d) Infrastructure - Network, Firewall, Storage We at the City of Kehl are looking for a full-time, permanent position as soon as possible for a IT System Administrator (f/m/d) Infrastructure - network, firewall, storage The Information and Communication Technology (ICT) department manages around 900 PC workstations for the city administration, Kehl Technical Services and schools. WE OFFER Attractive remuneration according to pay group 11 TVöD; salary range between €…",,,,2025-04-10T06:36:09Z,https://www.adzuna.fr/land/ad/5138207609?se=0js5f_Eo8BGFil_oKXcHCQ&utm_medium=api&utm_source=e1ad5111&v=C369920670C21E2E4CFBFBE289C2884255EFC8C8,Unknown,infrastructure,fr,infrastructure,standard,False,False
Infrastructure Engineer,Next Ventures,France,"Infrastructure Engineer - Freelance - 6-12 Months - Remote Next Ventures are currently looking for a Infrastructure Engineer to join our clients team for a 6-12 month contract where you will focus on AWS, Kubernetes, and modern DevOps best practices. This role involves designing, implementing, and maintaining highly scalable and resilient cloud infrastructure to support their trading operations. Key Responsibilities Design, deploy, and maintain scalable and resilient infrastructure on AWS using…",,,,2025-05-03T08:11:33Z,https://www.adzuna.fr/land/ad/5178000392?se=0js5f_Eo8BGFil_oKXcHCQ&utm_medium=api&utm_source=e1ad5111&v=8919B9C009D025F384F11D058F1E7AD3374713C0,Unknown,infrastructure,fr,infrastructure,standard,True,False
Architecte infrastructure,Aleysia,"Pierrelatte, Nyons","Tu as une forte expertise en infrastructures, tu es à l’aise autant sur le réseau que sur les systèmes, et tu veux intégrer une équipe dynamique sur des projets à fort enjeu ? Cette opportunité d’ Architecte Infrastructure / IT (H/F) est faite pour toi ! ⬇️  Ton challenge si tu l’acceptes : • Collecter les besoins auprès des métiers • Travailler avec les chefs de projet pour établir une roadmap claire • Définir les patterns d’architecture adaptés aux enjeux • Rédiger les dossiers d’architectur…",,,,2025-04-11T05:27:54Z,https://www.adzuna.fr/land/ad/5139962047?se=0js5f_Eo8BGFil_oKXcHCQ&utm_medium=api&utm_source=e1ad5111&v=662A093246FDF72D3B3AA2F30685D5123751FE6F,Unknown,infrastructure,fr,infrastructure,standard,False,False
Architecte infrastructure,LFB GROUP,"Colombier-Saugnieu, Genas","Vous démontrez un intérêt pour les environnements challengeants et innovants, Vous souhaitez vous investir au sein d’une équipe IT dynamique et proche du Business, Vous percevez la diversité culturelle comme une force … => Alors rejoignez la Team LFB et venez partager nos valeurs ! Qui sommes-nous ? LFB Group , entreprise de dimension internationale et acteur de 1er plan dans le domaine de la CVC et de la Réfrigération compte 900 salariés en Europe, 3 sites de production, une présence commercia…",,,,2025-04-14T07:37:15Z,https://www.adzuna.fr/land/ad/5143865782?se=0js5f_Eo8BGFil_oKXcHCQ&utm_medium=api&utm_source=e1ad5111&v=EF40D4337927916F967F69EF317E747F3620AA9E,Unknown,infrastructure,fr,infrastructure,standard,False,True
Responsable infrastructure,Aleysia,"Lyon, Rhône","Tu es passionné·e par la gestion des systèmes d'information et tu veux jouer un rôle clé dans une équipe innovante ? Ce poste de Responsable infrastructure est fait pour toi ! ⬇️  Ton challenge si tu l’acceptes : Animer les réunions de suivi et de coordination d'équipe Piloter la qualité de service via le monitoring, les visites et des KPIs Superviser les déploiements techniques et les projets IT Garantir le respect des délais, budgets et procédures Intégrer, former et accompagner les nouveaux…",,,,2025-05-02T09:08:25Z,https://www.adzuna.fr/land/ad/5175641562?se=0js5f_Eo8BGFil_oKXcHCQ&utm_medium=api&utm_source=e1ad5111&v=9A1150A429960B3D054399CAFE7CABC207B81043,Unknown,infrastructure,fr,infrastructure,standard,False,False
Administrateur d’infrastructure/Administratrice d’infrastructure,Comutitres,"Paris, Ile-de-France","COMUTITRES est un acteur incontournable de la mobilité durable. Comutitres assure la gestion opérationnelle de la plupart des titres de transports en Île-de-France tels que Navigo Annuel, imagine R, Navigo Mois/Semaine, Solidarité Transport, Navigo Liberté  et Améthyste. Notre structure exploite et enrichit un système billettique mutualisé avec les transporteurs d’Île-de-France servant les 6,7 millions de clients du réseau de transport public francilien. Nous aidons nos clients dans leurs parco…",,,,2025-05-04T09:28:08Z,https://www.adzuna.fr/land/ad/5179913255?se=0js5f_Eo8BGFil_oKXcHCQ&utm_medium=api&utm_source=e1ad5111&v=C9FB117A6F6F66C798FC63A6FC4B256FE072EAD7,Unknown,infrastructure,fr,infrastructure,standard,False,False
Directeur de l’infrastructure/Directrice de l’infrastructure,ALBYA - Conseil en recrutement et ressources humaines,"Toulouse, Haute-Garonne","Notre client est une ESN, spécialisée dans l’accompagnement de la transformation numérique responsable de leurs clients, à travers une offre globale de solutions. Dans le cadre de leur évolution, ils sont à la recherche d'un Senior Manager Design et Production H/F, pour piloter les infrastructures et la production informatique. Vous jouerez un rôle central dans la transformation et l’innovation de leurs départements. Vous serez le moteur de projets stratégiques, tout en garantissant l’excellenc…",,,,2025-05-01T10:58:32Z,https://www.adzuna.fr/land/ad/5172383076?se=0js5f_Eo8BGFil_oKXcHCQ&utm_medium=api&utm_source=e1ad5111&v=DEE8949B2EB363874D5CF28AB015D14120B8AE8D,Unknown,infrastructure,fr,infrastructure,standard,False,True
Administrateur d’infrastructure/Administratrice d’infrastructure,Robert Half,France,"Notre client situé à Saint Denis, recherche un Administrateur infrastructure H/F pour renforcer l'équipe au sein de le Direction des Systèmes d'information. Vos Missions seront les suivantes : Architecture technique Documenter des architectures réseau et système robustes , adaptées aux besoins opérationnels et aux contraintes de sécurité. Participer à la conception des infrastructures réseau complexes basées sur des équipements CISCO, Alcatel, et des solutions Zero Trust comme Zscaler. Administ…",,,,2025-05-01T10:53:17Z,https://www.adzuna.fr/land/ad/5172374153?se=0js5f_Eo8BGFil_oKXcHCQ&utm_medium=api&utm_source=e1ad5111&v=D97149C829ABA114355BA3D1A4B222157E7CDDB7,Unknown,infrastructure,fr,infrastructure,standard,False,False
Job in Germany: Team Leader IT Infrastructure & IT Operations (m/f/d),BlueMetering GmbH,France,"About BlueMetering Our goal is to digitize every meter that is installed anywhere - no ifs, ands or buts. Whether we achieve this goal through the traditional use of the smart meter gateway or by breaking completely new technical ground, thinking creatively - even innovating - is based on the needs and requirements of our customers. And we know them better than almost any other competitive metering point operator. As a spin-off from the BRUNATA-METRONA Group, our team is made up exclusively of …",,,,2025-04-05T06:11:24Z,https://www.adzuna.fr/land/ad/5130645343?se=0js5f_Eo8BGFil_oKXcHCQ&utm_medium=api&utm_source=e1ad5111&v=DA51F435537AFED323A4760D289BEBB47CD4516B,Unknown,infrastructure,fr,infrastructure,standard,True,False
Responsable en Infrastructure H/F,Armée de l'Air et de l'Espace,"Perpignan 7e Canton, Perpignan","L'armée de l'Air et de l'Espace a pour mission d'assurer la sécurité du territoire et le maintien de la paix. Notre plan stratégique s'articule autour de 3 missions : Protéger, les français à l'intérieur de nos frontières et au-delà, Intervenir, par le déploiement d'actions immédiates, Dissuader, notamment par la mise en oeuvre de la composante aéroportée de la dissuasion nucléaire. L'armée de l'Air et l'Espace compte près de 40 500 militaires. En fonction de votre affectation, en unité ou en É…",1800,1800,,2025-02-09T07:34:32Z,https://www.adzuna.fr/land/ad/5043600955?se=0js5f_Eo8BGFil_oKXcHCQ&utm_medium=api&utm_source=e1ad5111&v=B651DDD6A16624DAA9C8F9B370251A314A4D4436,Unknown,infrastructure,fr,infrastructure,standard,False,False
Responsable Infrastructure H/F,Externatic,"Rangueuil, Toulouse","Nous recrutons pour un client final basé au Nord de Toulouse un Responsable infrastructure (F/H) en CDI. Il s'agit d'un poste à la fois opérationnel et stratégique vous serez le pilier de l'infrastructure technique, garantissant la performance, la sécurité et la disponibilité des services pour trois établissements et 4000 utilisateurs. Vos principales responsabilités incluent : - La gestion et optimisation des infrastructures IT : Supervisez nos serveurs, solutions de stockage SAN, réseaux, vir…",45000,50000,,2025-03-26T08:19:38Z,https://www.adzuna.fr/land/ad/5111961390?se=mkTzgPEo8BGT4w9x5LWCew&utm_medium=api&utm_source=e1ad5111&v=85DF4C2C9D1AFED171DB5A34C439A26BF21775D6,Unknown,infrastructure,fr,infrastructure,standard,False,False
Chef de Projet Infrastructure H/F,SYD Digital Care,"Pont-Rousseau, Rezé","Quel sera votre poste ? Poste : Chef de projet Infrastructure H/F Lieu : Nantes Sud (Vendée) Contexte client : Au sein de l'équipe Infrastructure Management, vous aurez pour mission de piloter et coordonner des projets d'infrastructures IT pour nos clients. Vous serez le garant du respect des délais, des coûts et de la qualité des livrables. Vos missions : - Planifier, organiser et diriger des projets d'infrastructure IT - Collaborer avec les équipes techniques pour définir les besoins et les s…",,,,2025-02-04T19:56:41Z,https://www.adzuna.fr/land/ad/5037296167?se=mkTzgPEo8BGT4w9x5LWCew&utm_medium=api&utm_source=e1ad5111&v=03B9C3B7A584D1C582C6513B6DD634E666F2FE4C,Unknown,infrastructure,fr,infrastructure,standard,False,False
Chef de Projet Infrastructure H/F,REEL IT,"Vitrolles, Istres","Nous recherchons un Chef de Projet Infrastructure (H/F). Si vous êtes passionné(e) par les technologies et aimez relever des défis dans un environnement stimulant, ce poste est fait pour vous ! Missions principales : - Piloter et coordonner les projets d'infrastructure IT, depuis l'analyse des besoins jusqu'à la clôture. - Superviser la mise en oeuvre des infrastructures réseaux et systèmes. - Gérer les budgets, les plannings et les ressources associées aux projets. - Collaborer étroitement ave…",,,,2025-02-04T19:56:32Z,https://www.adzuna.fr/land/ad/5037294181?se=mkTzgPEo8BGT4w9x5LWCew&utm_medium=api&utm_source=e1ad5111&v=D9CE17C103B214BD5AE6984C1700D943F2A1EBCD,Emplois Informatique,infrastructure,fr,infrastructure,standard,False,False
Chef de Projet Infrastructure,AS International Group,"Ile-de-France, France","AS International Group, société de conseil et de solutions innovantes en informatique, se positionne aujourd’hui comme le partenaire incontournable des grands comptes et PME, dans leur stratégie de transformation digitale. AS International recherche un(e) che(ffe) de projet afin d'intégrer notre client grand compte. Au sein du département Informatique (Infrastructure et Production IT), votre mission consiste à conduire les projets de mise en œuvre de nouveaux services IT. Votre rôle sera de  Pi…",,,,2025-03-19T03:14:51Z,https://www.adzuna.fr/land/ad/5100160397?se=mkTzgPEo8BGT4w9x5LWCew&utm_medium=api&utm_source=e1ad5111&v=9A527AB84A24B3F49666A26ED2F22DC5C21E4085,Unknown,infrastructure,fr,infrastructure,standard,False,True
Architecte Infrastructure - Paris,Capgemini,"Paris, Ile-de-France","Architecte Infrastructure - Paris Choisir Capgemini, c'est choisir une entreprise où vous serez en mesure de façonner votre carrière selon vos aspirations. Avec le soutien et l'inspiration d'une communauté d’experts dans le monde entier, vous pourrez réécrire votre futur. Rejoignez-nous pour redéfinir les limites de ce qui est possible, contribuer à libérer la valeur de la technologie pour les plus grandes organisations et participer à la construction d’un monde plus durable et inclusif. Vos mi…",,,,2024-03-24T07:11:49Z,https://www.adzuna.fr/land/ad/4621921806?se=mkTzgPEo8BGT4w9x5LWCew&utm_medium=api&utm_source=e1ad5111&v=21E5A58CE5C2B66202BCE3697507014FA3BFF0B0,Unknown,infrastructure,fr,infrastructure,standard,False,False
Ingénieur Sécurité Infrastructure,NEVERHACK,France,"QUI SOMMES-NOUS ? NEVERHACK, c'est le guichet unique de la cybersécurité ! Concrètement, cela signifie que nous protégeons les entreprises et les individus via un panel d’outils : de l’expertise technique, un SOC, de la formation, des produits, de l’intelligence artificielle… Portés par nos fortes ambitions et convictions, nous avons vu notre team s'agrandir de plus de 1200 collaborateurs à travers le monde en un an et nous avons levé des fonds, pas une, mais bien deux fois, en seulement un an…",,,,2025-03-23T03:01:42Z,https://www.adzuna.fr/land/ad/5107183664?se=mkTzgPEo8BGT4w9x5LWCew&utm_medium=api&utm_source=e1ad5111&v=A32687B726BBBAEE77C93AAB47D97A3CDE8DEAF0,Unknown,infrastructure,fr,infrastructure,standard,False,False
Expert Technique Infrastructure H/F,SPIE ICS,"Fontaine, Grenoble","Sous la responsabilité du Responsable de production, en tant qu'expert vous serez l'interface de référence, avec les différents acteurs internes et externes, pour tout ce qui relève du suivi technique. Production : - Analyser les demandes de haute complexité des clients, - Prendre en charge la gestion des escalades techniques, - Participer à la gestion des crises, et en assure l'analyse et le suivi technique, - Participer au traitement d'incidents et demandes, - Aider aux diagnostiques et propo…",,,,2025-03-22T06:28:19Z,https://www.adzuna.fr/land/ad/5105769431?se=mkTzgPEo8BGT4w9x5LWCew&utm_medium=api&utm_source=e1ad5111&v=E37A7B974CAF91929D88DB70BC14F2DAD6BF3484,Unknown,infrastructure,fr,infrastructure,standard,False,False
Responsable infrastructure informatique,Alten,"Ile-de-France, France","Offre d’emploi – Chef de Projet Infrastructure IT (H/F) – CDI – Île-de-France Leader mondial de l’Ingénierie et du Conseil en Technologies, ALTEN réalise des projets de conception et d’études pour les grands comptes industriels, télécoms et tertiaires (les Directions Techniques et les Directions des Systèmes d’Information). Désormais présent à travers 30 pays, le Groupe ALTEN a réalisé un chiffre d’affaires de 4,07 milliards d’euros en 2023 et compte actuellement 57 000 collaborateurs, dont 90%…",,,,2025-04-12T06:06:12Z,https://www.adzuna.fr/land/ad/5141657455?se=mkTzgPEo8BGT4w9x5LWCew&utm_medium=api&utm_source=e1ad5111&v=25A4EDE2869E2817E654F21A8CEA4C529469CDD3,Unknown,infrastructure,fr,infrastructure,standard,False,False
Infrastructure & DevOps engineer,StrangeBee,"Paris, Ile-de-France","StrangeBee est un éditeur de solutions de cybersécurité dédiées à la Réponse aux Incidents . En 2018, Thomas, Nabil & Jérôme créent la société StrangeBee et poursuivent le développement et l’enrichissement des applications open source TheHive & Cortex, entamés 4 ans auparavant. Devenue la référence, TheHive épaule aujourd’hui des milliers d’analystes à travers le monde, à défendre leur entreprise contre les cyberattaques quotidiennes. Ses ambitions ? Renforcer son offre, répondre aux besoins gr…",,,,2025-04-21T04:49:30Z,https://www.adzuna.fr/land/ad/5154915598?se=mkTzgPEo8BGT4w9x5LWCew&utm_medium=api&utm_source=e1ad5111&v=E4E4F45DC930749880CA012339903118D24688F7,Emplois Informatique,infrastructure,fr,infrastructure,standard,False,False
Ingénieur Infrastructure H/F,Chantiers de l'Atlantique,"Montoir-de-Bretagne, Saint-Nazaire","Au sein de la DSI des Chantiers de l'Atlantique composé d'une quarantaine de personnes, et plus particulièrement du Secteur Infrastructure, vous êtes le garant du maintien en condition opérationnelle des infrastructures informatiques et radio géré en relation avec nos différents partenaires. Les missions attendues sont : - Gérer les projets infrastructures. - Participer à la définition des architectures. - Piloter la gestion des changements réalisés par notre infogéreur - Assurer un accompagnem…",,,,2025-04-24T06:51:26Z,https://www.adzuna.fr/land/ad/5159527347?se=mkTzgPEo8BGT4w9x5LWCew&utm_medium=api&utm_source=e1ad5111&v=0696DD8EE41C40621291185E1051968D0C8721BD,Unknown,infrastructure,fr,infrastructure,standard,False,False
Investment Associate - Infrastructure,Pearse Partners,"Paris, Ile-de-France","Pearse Partners est en partenariat avec l'un des plus prestigieux fonds en Infrastructure Private Equity qui cherche un(e) Associate de haut niveau pour rejoindre son équipe d'investissement européenne à Paris. La société gère plusieurs fonds axés sur différentes stratégies en infrastructure, avec une présence mondiale couvrant l'Amérique du Nord, et l'Europe. Responsabilités principales : Jouer un rôle clé au sein des équipes de transaction, en dirigeant et soutenant les principaux volets des …",,,,2025-04-26T06:21:14Z,https://www.adzuna.fr/land/ad/5163441280?se=mkTzgPEo8BGT4w9x5LWCew&utm_medium=api&utm_source=e1ad5111&v=B9ACB4B14D134D7F8CA222CAF8578DA801D3E77E,Unknown,infrastructure,fr,infrastructure,standard,False,False
"Infrastructures, Vice President",Eiffel Investment Group,"Paris, Ile-de-France","Created in 2009, Eiffel is a portfolio manager that places energy transition and impact at the very heart of its investment strategies. As an independent management company, Eiffel mainly invests on private markets ( private equity, infrastructure and corporate financing ). The company currently has c. €7 billion in assets under management. Its clients are large institutional investors (insurers, mutuals, pension funds, banks, large family offices, public investors, etc.), as well as retail inv…",,,,2025-04-21T04:50:43Z,https://www.adzuna.fr/land/ad/5154918349?se=mkTzgPEo8BGT4w9x5LWCew&utm_medium=api&utm_source=e1ad5111&v=7A5628A26317F625A62D4438674190BD61EF3B31,Unknown,infrastructure,fr,infrastructure,standard,False,False
Référent Technique Infrastructure Cloud H/F,Externatic,"Pont-Rousseau, Rezé","Je suis Thomas, consultant en recrutement chez Externatic. Je serai ravi de vous accompagner dans votre recherche et de vous présenter cette belle opportunité sur Nantes. Entreprise Leader européen de la sécurité des biens et des personnes, la société est présente en France, Angleterre, Allemagne, Belgique et USA. Le site de Nantes est l'entité R&D du groupe. Il conçoit, développe et édite une plateforme logicielle SaaS intégrée de services intelligents pour l'IoT avec une surcouche IA, qui rép…",44000,50000,,2025-02-04T19:55:42Z,https://www.adzuna.fr/land/ad/5037289076?se=mkTzgPEo8BGT4w9x5LWCew&utm_medium=api&utm_source=e1ad5111&v=42E14FEC4FA725F72E78FC5B045E64DC05965DC3,Unknown,infrastructure,fr,infrastructure,standard,False,False
Administrateur des Infrastructures Rubrik H/F,Nyou,"Rangueuil, Toulouse","Missions : - Valorise et gère les évolutions en adéquation avec les besoins fonctionnels ou techniques tout en assurant conseil, assistance, information, formation et alerte. - Effectue une veille technologique. Peut intervenir directement sur tout ou partie d'un projet qui relève de son domaine d'expertise et participer aux études de l'architecture générale et de son évolution ainsi qu'à la qualification des plates-formes informatiques. - Assure l'ingénierie d'installation et de paramétrage de…",50000,60000,,2025-02-20T05:12:13Z,https://www.adzuna.fr/land/ad/5057143255?se=mkTzgPEo8BGT4w9x5LWCew&utm_medium=api&utm_source=e1ad5111&v=90280319833D3B518613D77C3CAD809CB93D22CA,Emplois Informatique,infrastructure,fr,infrastructure,standard,False,False
Chargé d'Affaires Infrastructure H/F,SNEF,"Blois 2e Canton, Blois","SNEF Centre-Val de Loire réalise des travaux d'électricité aussi bien en milieu industriel que tertiaire mais aussi en maintenance et travaux CVC. Nos agences de Tours et de Blois comptent 76 collaborateurs et réalisent aujourd'hui un chiffre d'affaires de 11M€. La diversité et la complémentarité de nos activités nous permettent de proposer à nos clients, industriels et tertiaires, une offre globale et adaptée depuis la conception jusqu'aux travaux de réalisation ainsi que la maintenance de leu…",,,,2025-03-27T07:44:05Z,https://www.adzuna.fr/land/ad/5113224789?se=mkTzgPEo8BGT4w9x5LWCew&utm_medium=api&utm_source=e1ad5111&v=3FF4EFF6531C176266A513697729C8C9A0C3303F,Unknown,infrastructure,fr,infrastructure,standard,False,True
Ouvrier de Maintenance Infrastructure F/H,APRR,"Dagneux, Meximieux","Chaque jour, les 3 500 collaborateurs d'APRR agissent pour rendre les voyages plus sûrs et plus confortables. Tout au long des 2 300 kilomètres de son réseau, APRR répond aux attentes de ses clients à travers la modernisation des infrastructures, le développement de nouveaux services, l'intégration",,,permanent,2025-04-29T21:19:28Z,https://www.adzuna.fr/land/ad/5169343837?se=mkTzgPEo8BGT4w9x5LWCew&utm_medium=api&utm_source=e1ad5111&v=9CD439B41D4FABE2FD71EBB8E1709452DE1A7444,Emplois Maintenance,infrastructure,fr,infrastructure,standard,False,False
