title,company,location,description,salary_min,salary_max,contract_type,created,redirect_url,category,specialty
Client Accounting Administrator,HAYS,"Edinburgh, Scotland","Client Accounts Administrator Opportunity Based in EdinburghHybrid Working£28000-£35000 Your new company Hays are proud to be working with a fast-growing and well established private sector organisation who are looking to add an enthusiastic client accounting administrator to their team. This is a brand-new position within the company where you can utilise your skills and develop alongside a supportive finance function. Your new role In your new role, you will be responsible for: Managing end-t…",28000,35000,,2025-03-24T11:00:03Z,https://www.adzuna.co.uk/jobs/land/ad/5108658217?se=8i4mOzEe8BGla2k9OSZXLA&utm_medium=api&utm_source=e1ad5111&v=AAD269F8130A740C04AFF20E0F1FA3014FAD724A,Accounting & Finance Jobs,accounting
Accounting Technician,VickerStock,"Armagh, Northern Ireland","Vickerstock are working in partnership with a Food Manufacturing business on the appointment of an Accounting Technician/PQ Accountant on a full-time permanent basis. This position is based in Armagh City, but occasional travel to Monaghan may be required. As the Accounting Technician, you will provide accurate financial administration to three divisions of the growing business, reporting to both the Management Accountant and Financial Controller. If you are looking for your next career move to…",40000,40000,permanent,2025-04-02T07:09:00Z,https://www.adzuna.co.uk/jobs/land/ad/5123611667?se=8i4mOzEe8BGla2k9OSZXLA&utm_medium=api&utm_source=e1ad5111&v=A3167B9F2BF0AC9FA96E156BC900BC4A9AF16696,Accounting & Finance Jobs,accounting
Accounting Technicians,Cartmill Stewart & Co Chartered Accountant,"Lisburn, Northern Ireland","Accounting Technicians - Looking for a career move? Were on the lookout for Full and Part-Time qualified Accounting Technicians to join our digital, forward thinking team If youre ready to take your career to the next level in a supportive environment, this could be the next move for you. Role Overview: Youll assist with and manage a portfolio of clients, handling: Accounts preparation (ST, Partnerships, Ltd) Bookkeeping VAT returns Payroll processing Self-Assessment Tax Returns What Were Looki…",30510.81,30510.81,,2025-04-17T22:48:38Z,https://www.adzuna.co.uk/jobs/land/ad/5150627275?se=8i4mOzEe8BGla2k9OSZXLA&utm_medium=api&utm_source=e1ad5111&v=83B05B3FEBF7C018637D701878FFB9406EDC13CF,Accounting & Finance Jobs,accounting
Accounting Teacher - September 2025 (Birmingham),HAYS,"Birmingham, West Midlands","Accounting Teacher for September 2025 - Birmingham Job Title: Accounting TeacherLocation: BirminghamSalary: £120 - £250 per day. Dependent on experience.Contract Type: 2 days a week, 8:30 AM to 3:30 PMStart Date:September 2025 About them: We are working on behalf of an academy located in Birmingham. It is a high performing specialist sixth form they are dedicated to providing the very best academic and technical education for successful and rewarding careers in engineering, science, health, and…",120,250,,2025-04-11T16:41:55Z,https://www.adzuna.co.uk/jobs/land/ad/5140567687?se=8i4mOzEe8BGla2k9OSZXLA&utm_medium=api&utm_source=e1ad5111&v=1C0C6200E7710DB7DACD504D2B1ECAA609BD0FD7,Teaching Jobs,accounting
Accounting Apprenticeship 2025,Dentons,"Glasgow, Scotland","In 2025 Dentons are excited to launch our first Accounting Apprenticeship Programme If you’re currently a year 13 student or a school leaver based in Scotland who isn’t going on to study a full-time degree in September 2025, we want to hear from you. As an Apprentice within Dentons Finance Team, you will be enrolled in an Accountancy Graduate Apprenticeship. Over the four-year programme you will work four days a week in our Scottish offices and study one day per week towards your degree. This a…",23000,23000,,2025-03-06T13:11:12Z,https://www.adzuna.co.uk/jobs/land/ad/5079204850?se=8i4mOzEe8BGla2k9OSZXLA&utm_medium=api&utm_source=e1ad5111&v=D1C244B166C117ED6A52F9653AF88DA796C28123,Accounting & Finance Jobs,accounting
Forensic Accounting Manager,Downey Osborne Limited,"Belfast, Northern Ireland","This unique role offers the opportunity to engage in intricate and stimulating assignments, ranging from litigation support to fraud investigations, all while collaborating with a dedicated team of professionals at a distinguished boutique advisory firm. Competitive Benefits Package Work-Life Balance Professional Growth Inclusive and Diverse Workplace About You Qualified Chartered Accountant with at least 2 years' experience in Forensic Accounting Strong analytical skills with the ability to qu…",55000,55000,,2025-04-02T07:09:01Z,https://www.adzuna.co.uk/jobs/land/ad/5123611741?se=8i4mOzEe8BGla2k9OSZXLA&utm_medium=api&utm_source=e1ad5111&v=28AFF8916B92FCC7C1A3A5F9315A2FAB4288EEA3,Accounting & Finance Jobs,accounting
Forensic Accounting Partner,Ward Simpson Ltd,"London, UK",We are currently conducting a search for a successfully growing and highly regarded Top 20 Accountancy Practice who are looking to appoint an additional Partner to their Forensic Accounting team. The ideal candidate is likely to be an experienced ACA / ACCA qualified Forensic Accounting Director seeking Partnership or an already established Partner who is looking for a collegiate team environment with all support and resources required to be successful. They are open to considering candidates w…,56147.72,56147.72,,2025-04-16T08:14:04Z,https://www.adzuna.co.uk/jobs/land/ad/5147003414?se=8i4mOzEe8BGla2k9OSZXLA&utm_medium=api&utm_source=e1ad5111&v=C8D0412EB1297C8290629673472690C3F14E0183,Accounting & Finance Jobs,accounting
"Accounting Technician (Belfast, Hybrid)",VANRATH,"Belfast, Northern Ireland","Are you an experienced Accounting Technician looking for a new opportunity that makes a positive impact? VANRATH are pleased to partnered with a leading charity an excellent opportunity for an Accounting Technician to join a committed team, contributing to effective financial management and supporting the organisation's ongoing success. If you're seeking a role where your skills can truly make an impact, this is the ideal opportunity. What you'll get In order to attract the very best talent on …",30000,30000,,2025-04-11T04:50:28Z,https://www.adzuna.co.uk/jobs/land/ad/5139974069?se=8i4mOzEe8BGla2k9OSZXLA&utm_medium=api&utm_source=e1ad5111&v=28A7E4CF55CDF28F7C87EFB4877A81EA4A89F193,Accounting & Finance Jobs,accounting
Accounting Internship,Legal & General,"Cardiff, Cardiff County","Company Description Legal & General is a leading UK financial services group and major global investor. We've been safeguarding people's financial futures since 1836, aiming to build a better society for the long term by investing our customers' money in things that make life better for everyone and create value for our shareholders. Legal & General looks after around 700,000 institutional customers who have their retirement benefits secured with us. Our Retail division helps people enjoy a mor…",38027.19,38027.19,contract,2025-03-05T13:26:03Z,https://www.adzuna.co.uk/jobs/land/ad/5076918999?se=8i4mOzEe8BGla2k9OSZXLA&utm_medium=api&utm_source=e1ad5111&v=EEF5C500664841422B5223CDCB325BB6029DE25E,Accounting & Finance Jobs,accounting
"Associate, Investment Accounting",BlackRock,"Edinburgh, Scotland","Are you an Investment Accounting professional searching for an exciting, significant, multi-faceted opportunity with the worlds largest asset manager? If you pride yourself on building positive relationships, developing process solutions and bringing strategic visions to fruition, then look no further BlackRock is pursuing an Associate to become a part of the team. We recognize that strength comes from diversity, and will accept rare skills, eagerness, and passion. All the while supporting the …",54999.64,54999.64,,2024-08-29T16:58:37Z,https://www.adzuna.co.uk/jobs/land/ad/4843998410?se=8i4mOzEe8BGla2k9OSZXLA&utm_medium=api&utm_source=e1ad5111&v=E5D98734A09747BDF6F783A6627CDC4339E2E683,Accounting & Finance Jobs,accounting
Investment Accounting Associate,BlackRock,"Edinburgh, Scotland","Are you an Investment Accounting professional searching for a rewarding, significant, multi-faceted opportunity with the worlds largest asset manager? Do you pride yourself on building positive relationships, developing process solutions and bringing strategic visions to fruition? Look no further. BlackRock is pursuing an Associate of Investment Accounting to become a part of the team. We recognize that strength comes from diversity, and will accept your rare skills, eagerness, and passion whil…",46502.8,46502.8,,2025-04-18T14:27:35Z,https://www.adzuna.co.uk/jobs/land/ad/5151657726?se=8i4mOzEe8BGla2k9OSZXLA&utm_medium=api&utm_source=e1ad5111&v=B287A1B5BC7A36723201CC882D52090C9BBFB0AF,Accounting & Finance Jobs,accounting
Institutional Accounting Associate,BlackRock,"Edinburgh, Scotland","Elevate your career by joining the worlds largest asset manager Thrive in an environment that promotes positive relationships and recognises outstanding performance. We know you want to feel valued every single day and be recognised for your contribution. At BlackRock, we strive to empower our employees and effectively engage your involvement in our success. With over USD $9 trillion of assets we have an outstanding responsibility: our technology and services empower millions of investors to sa…",56333.62,56333.62,,2025-04-18T14:27:35Z,https://www.adzuna.co.uk/jobs/land/ad/5151657725?se=8i4mOzEe8BGla2k9OSZXLA&utm_medium=api&utm_source=e1ad5111&v=D19059BE1856DFEF3EBDFA419BEF78EE92EC040B,Accounting & Finance Jobs,accounting
Corporate Accounting Manager,Jacobs,"Glasgow, Scotland","Corporate Accounting Manager We are seeking a highly motivated and detail-oriented Corporate Accounting Manager to join our team in Glasgow. Reporting to the UK Corporate Controller, the role will include responsibility for the filing of UK Statutory Financial Statements for a number of UK group companies. About the Opportunity Your day-to-day duties will include, but are not limited to, the following:  Ensuring all external statutory reporting requirements are fulfilled  Ensure all financial s…",45993.69,45993.69,,2025-03-11T13:37:25Z,https://www.adzuna.co.uk/jobs/land/ad/5087062091?se=8i4mOzEe8BGla2k9OSZXLA&utm_medium=api&utm_source=e1ad5111&v=534853236B273895BFBECC12142166F4E2BA31F8,Accounting & Finance Jobs,accounting
Accounting Manager - Hospitality - £60-75k,Hays Accountancy and Finance,"London, UK","Your new company: I am currently recruiting for an Accounting Manager to join an exciting and fast-growing Hospitality Company This is a newly created role, reporting into the FD and managing a direct report. This role will support building out the finance functions, taking ownership over month-end duties, and enhancing financial strategy. This role will be suited for someone ACA qualified, either coming straight from a Top 10 Accountancy Practice with Retail/Hospitality clients OR Top 10 train…",55315.62,55315.62,permanent,2025-04-01T06:44:08Z,https://www.adzuna.co.uk/jobs/land/ad/5120841080?se=8i4mOzEe8BGla2k9OSZXLA&utm_medium=api&utm_source=e1ad5111&v=B72ACE072008F4856E910504C37119B56CFC65F9,Accounting & Finance Jobs,accounting
Finance Manager Accounting,Fair4All Finance,"London, UK","Finance Manager - Accounting Role: Finance Manager (Accounting) Employment Type: Full time (will consider compressed hours etc.) Location: Hybrid/London (travel to London on an approximately monthly basis and for some team meetings) Salary: £52,000 - £57,000 (excellent benefits, inc. 27 days holiday, 2:1 pension - up to 12% employer contribution and more) Closing: 5:00pm, 22nd Apr 2025 Did you know that there are at least 20.3m people in the UK in vulnerable financial circumstances, who are poo…",52000,57000,permanent,2025-04-11T03:12:52Z,https://www.adzuna.co.uk/jobs/details/5139891767?utm_medium=api&utm_source=e1ad5111,Accounting & Finance Jobs,accounting
Head of Management Accounting,MICHAEL PAGE,"South Yorkshire, Yorkshire And The Humber","Key leadership role within the senior management team Lead financial strategy, optimise performance, and shape the future direction About Our Client Working for South Yorkshire Police doesn't have to mean patrolling the streets; our police staff work side by side with uniformed officers. A strong team of professional support staff work behind the scenes in many different areas of our organisation, including in finance. We need skilled people, like you, to join our police family to keep our Sout…",63874.43,63874.43,,2025-04-17T18:05:38Z,https://www.adzuna.co.uk/jobs/details/5149901180?utm_medium=api&utm_source=e1ad5111,Accounting & Finance Jobs,accounting
Finance Accounting Manager,Nordomatic UK LTD,"Sale, Greater Manchester","Nordomatic is steadfast in its commitment to creating a smarter, more sustainable future for everyone. As The Brain of the Building, we combine extensive expertise in system integration with innovative, intelligent software solutions to help customers and end-users enhance property well-being and indoor performance. Our solutions are smart and reliable, empowering customers and end-users to improve well-being and performance while delivering profitability and actionable data insights. At the sa…",55000,55000,permanent,2025-04-12T09:48:56Z,https://www.adzuna.co.uk/jobs/details/5141916660?utm_medium=api&utm_source=e1ad5111,Accounting & Finance Jobs,accounting
Treasury Accounting Manager,Ashurst,"Glasgow, Scotland","The Opportunity: We are currently recruiting for a Treasury Accounting Manager to join us in our Glasgow office to play a leading role in the Global Finance function through cash flow forecast preparation, month end accounting, variance analysis, forecasting and annual budgeting for the Treasury function. Key responsibilities of the role will include: Production of monthly Group cash flow forecast and of monthly and daily cash flow updates and forecasts for the UK, Australia and other RoW offic…",39322.56,39322.56,,2025-04-16T20:56:56Z,https://www.adzuna.co.uk/jobs/land/ad/5148252955?se=8i4mOzEe8BGla2k9OSZXLA&utm_medium=api&utm_source=e1ad5111&v=5B53BA606E1C39F45269F8199EADECA0277D20C1,Accounting & Finance Jobs,accounting
Accounting Implementations Consultant - Analyst,BlackRock,"Edinburgh, Scotland","Are you a highly motivated professional looking to elevate your career by joining the worlds largest asset manager? Would you thrive in an environment that fosters positive relationships and recognizes outstanding performance, working with both internal partners and clients? We know how important it is to feel valued every single day and be recognized for your contribution. At BlackRock, we strive to empower our employees and effectively engage your involvement in our success. With over $8 tril…",67543.9,67543.9,,2025-04-18T14:27:44Z,https://www.adzuna.co.uk/jobs/land/ad/5151657809?se=8i4mOzEe8BGla2k9OSZXLA&utm_medium=api&utm_source=e1ad5111&v=8D24067D0BF26A5D5FFC68FEFBFE62DC7F4259EC,Accounting & Finance Jobs,accounting
Hydrocarbon & Accounting Technician,Perenco,"Norwich, Norfolk","This is an exciting development opportunity to be part of our Hydrocarbon & Accounting department. You will be responsible for supporting the routine accounting processes of the team and have responsibility for the day-to-day production portfolio performing a key role linking our commercial, environmental, technical, and operational areas. The department is responsible for meeting many regulatory and contractual obligations and you will play an important part in maintaining routine day to day a…",35475.47,35475.47,,2025-04-05T07:36:20Z,https://www.adzuna.co.uk/jobs/land/ad/5130856723?se=8i4mOzEe8BGla2k9OSZXLA&utm_medium=api&utm_source=e1ad5111&v=0071B492ADC65DC2EC541DD65B45F23880F1B829,Scientific & QA Jobs,accounting
Chief Executive Officer (Accounting Officer),University of Lincoln Academy Trust-1,"Norfolk, Eastern England","Chief Executive Officer (Accounting Officer) £120,000 - £140,000 (Full time/part time (minimum 3 days per week would be considered)) University of Lincolnshire Academy Trust is seeking an outstanding Chief Executive Officer. The Trust is committed to social mobility and providing the best educational experience for its young people. The University of Lincoln, the Trust’s Sponsors, are extremely supportive of that commitment and continually work with us to ensure that our ethos is maintained. Th…",120000,140000,permanent,2025-04-08T14:05:05Z,https://www.adzuna.co.uk/jobs/details/5135447291?utm_medium=api&utm_source=e1ad5111,Admin Jobs,accounting
Accounting Manager - Integrations & Projects,Gallagher,"Hillhead, Glasgow City Centre","Introduction Indulge your passion for problem-solving and embrace the thrill of addressing risk head-on at Gallagher's global brokerage team. Join a family of diverse minds, united by a relentless pursuit of excellence. As part of our team, you'll be the architect of protection, safeguarding businesses and empowering their ambitions. Together, we'll build a legacy of trust and triumph in the dynamic world of risk management. We believe that every candidate brings something special to the table,…",46809.23,46809.23,,2024-12-02T17:30:39Z,https://www.adzuna.co.uk/jobs/land/ad/4959784611?se=8i4mOzEe8BGla2k9OSZXLA&utm_medium=api&utm_source=e1ad5111&v=0B69F666291D17F74F4862889A1264A911FD09FE,Accounting & Finance Jobs,accounting
Technical Banking Accounting Advisory - Assistant Manager,KPMG-7,"London, UK","Job details Location: Birmingham, Leeds, Leeds Broadgate, London, Manchester, Sheffield Capability: Audit Experience Level: Associate/Assistant Manager Type: Full Time Service Line: AAA Contract type: Permanent Job description Job Title/Req Number: Technical Banking Accounting Advisory - Assistant Manager (106005) Base Location: London plus network of 20 offices nationally: www.kpmg88careers.co.uk/experienced-professional/LeBlender.OfficeLocations The KPMG FS Consulting function is a cornerston…",63804.54,63804.54,permanent,2025-04-15T06:32:21Z,https://www.adzuna.co.uk/jobs/details/5145110302?utm_medium=api&utm_source=e1ad5111,Accounting & Finance Jobs,accounting
Manager - CLR - Accounting Advisory Services (AAS),KPMG-7,"London, UK","Job details Location: London Capability: Audit Experience Level: Manager Type: Full Time Service Line: AAA Contract type: Permanent Job description Manager – CLR AAS Base Location: London We have an exciting opportunity for a Manager to join our rapidly expanding Accounting Advisory Services (AAS) team. The team provides specialist accounting and financial reporting advice to clients across a range of complex accounting issues. You will work across a diverse range of projects, varying in magnit…",51729.75,51729.75,permanent,2025-04-15T06:32:21Z,https://www.adzuna.co.uk/jobs/details/5145110288?utm_medium=api&utm_source=e1ad5111,Accounting & Finance Jobs,accounting
Public Sector Financial Reporting and Accounting Manager,GRANT THORNTON-1,"London, UK","Job ID: R1032983 Job type: Permanent Time type: Full time Categories: Audit & Assurance More than you expected The UK member firms of Grant Thornton are part of global network of independent audit, tax and advisory firms, made up of some 76,000 in over 150 countries. We're a team of independent thinkers who put quality, inclusion and integrity first. All around the world we bring a different experience to our clients. A better experience. One that delivers the expertise they need in a way that …",73237.14,73237.14,permanent,2025-04-01T02:25:09Z,https://www.adzuna.co.uk/jobs/details/5120617594?utm_medium=api&utm_source=e1ad5111,Accounting & Finance Jobs,accounting
Outsourcing Senior Manager - Accounting Services,Focus Resourcing Group,"Reading, Berkshire","Our client prides themselves on helping people and businesses achieve their goals. We are seeking an ambitious mangers or assistant manager to help deliver cloud-accounting, management report and whole finance services to their diverse range of clients. You will manage a team of approximately 15 staff and ensure clients reporting is timely and accurate. This is a fantastic opportunity to join and help shape a growing team in one of most exciting and varied roles in accountancy. The person we ar…",39355.12,39355.12,permanent,2025-04-06T09:43:45Z,https://www.adzuna.co.uk/jobs/details/5132216700?utm_medium=api&utm_source=e1ad5111,Accounting & Finance Jobs,accounting
Outsourcing Senior Manager - Accounting Services,Focus Resourcing Group,"Southampton, Hampshire","Our client prides themselves on helping people and businesses achieve their goals. We are seeking an ambitious mangers or assistant manager to help deliver cloud-accounting, management report and whole finance services to their diverse range of clients. You will manage a team of approximately 15 staff and ensure clients reporting is timely and accurate. This is a fantastic opportunity to join and help shape a growing team in one of most exciting and varied roles in accountancy. The person we ar…",38362.89,38362.89,permanent,2025-04-05T05:37:28Z,https://www.adzuna.co.uk/jobs/details/5130681237?utm_medium=api&utm_source=e1ad5111,Accounting & Finance Jobs,accounting
Outsourcing Senior Manager - Accounting Services,Focus Resourcing Group,"Oxford, Oxfordshire","Our client prides themselves on helping people and businesses achieve their goals. We are seeking an ambitious mangers or assistant manager to help deliver cloud-accounting, management report and whole finance services to their diverse range of clients. You will manage a team of approximately 15 staff and ensure clients reporting is timely and accurate. This is a fantastic opportunity to join and help shape a growing team in one of most exciting and varied roles in accountancy. The person we ar…",39413.64,39413.64,permanent,2025-04-03T17:22:42Z,https://www.adzuna.co.uk/jobs/details/5126917847?utm_medium=api&utm_source=e1ad5111,Accounting & Finance Jobs,accounting
Client Manager / Senior Bookkeeper,SH Accounting Bookkeeping,"London, UK","Client Manager / SeniorBookkeeper AnnualSalary:£35,000-£42,000 Location:Liverpool Street JobType:Full-time We are a growing practice based in Liverpool Street, seeking a highly skilled Client Manager / Senior Bookkeeper to join our expanding team. This role is ideal for a professional with extensive experience in managing a diverse client portfolio across various industries. The successful candidate will be responsible for overseeing bookkeeping, VAT return processes, and ensuring the accuracy …",40000,40000,permanent,2025-03-20T23:38:25Z,https://www.adzuna.co.uk/jobs/details/5103610134?utm_medium=api&utm_source=e1ad5111,Accounting & Finance Jobs,accounting
Accounting Technician,e-Careers Limited,"Birmingham, West Midlands",Take your first steps towards a new and exciting career in the Accounting industry. e-Careers is a dynamic and forward-thinking training company that is dedicated to changing lives through innovative training solutions. The market is facing a severe skills shortage for newly trained accounting and finance personnel. e-Careers will provide you with the training and help you get AAT certified before matching you to an employer where you will undergo a remote work experience programme. If successf…,25000,35000,,2024-10-09T16:02:39Z,https://www.adzuna.co.uk/jobs/details/4895781590?utm_medium=api&utm_source=e1ad5111,Accounting & Finance Jobs,accounting
Accounting Technician,e-Careers Limited,"London, UK",Take your first steps towards a new and exciting career in the Accounting industry. e-Careers is a dynamic and forward-thinking training company that is dedicated to changing lives through innovative training solutions. The market is facing a severe skills shortage for newly trained accounting and finance personnel. e-Careers will provide you with the training and help you get AAT certified before matching you to an employer where you will undergo a remote work experience programme. If successf…,25000,35000,,2024-10-09T16:02:31Z,https://www.adzuna.co.uk/jobs/details/4895781490?utm_medium=api&utm_source=e1ad5111,Accounting & Finance Jobs,accounting
Accounting Technician,e-Careers Limited,"Liverpool, Merseyside",Take your first steps towards a new and exciting career in the Accounting industry. e-Careers is a dynamic and forward-thinking training company that is dedicated to changing lives through innovative training solutions. The market is facing a severe skills shortage for newly trained accounting and finance personnel. e-Careers will provide you with the training and help you get AAT certified before matching you to an employer where you will undergo a remote work experience programme. If successf…,25000,35000,,2024-10-09T16:02:31Z,https://www.adzuna.co.uk/jobs/details/4895781492?utm_medium=api&utm_source=e1ad5111,Accounting & Finance Jobs,accounting
Accounting Technician,e-Careers Limited,"Bristol, South West England",Take your first steps towards a new and exciting career in the Accounting industry. e-Careers is a dynamic and forward-thinking training company that is dedicated to changing lives through innovative training solutions. The market is facing a severe skills shortage for newly trained accounting and finance personnel. e-Careers will provide you with the training and help you get AAT certified before matching you to an employer where you will undergo a remote work experience programme. If successf…,25000,35000,,2024-10-09T16:02:40Z,https://www.adzuna.co.uk/jobs/details/4895781608?utm_medium=api&utm_source=e1ad5111,Accounting & Finance Jobs,accounting
