title,company,location,description,salary_min,salary_max,contract_type,created,redirect_url,category,specialty,source_country,query,query_type,remote_friendly,international
Ingénieur Full Stack/Ingénieure Full Stack,Sander,"Ile-de-France, France","Rejoignez une scale-up innovante au cœur de Paris, qui révolutionne les opérations des usines dans le monde entier grâce à une technologie de pointe. En pleine croissance, cette entreprise recherche un Ingénieur Full Stack passionné pour relever des défis techniques ambitieux, collaborer avec des clients et évoluer dans un environnement flexible, stimulant et bienveillant. Vos missions : En tant qu’Ingénieur Full Stack, vous participerez activement à toutes les étapes du développement logiciel …",,,,2025-05-04T09:28:08Z,https://www.adzuna.fr/land/ad/5179913248?se=pHJWOu0o8BGFil_oKXcHCQ&utm_medium=api&utm_source=e1ad5111&v=36219E91C5449E437735F439C830DD34C9605D5C,Unknown,full stack,fr,full stack,standard,False,False
Ingénieur Full Stack/Ingénieure Full Stack,Groupe SII,"Niort, Deux-Sèvres","Groupe SII, Agence de Niort, nous recherchons un Développeur Fulls stack h/f, avec une expérience d'au minima 5ans sur le développement Java et React JS. Au sein de squad agile, vous serez en charge de la partie analyse des spécifications, développement, contrôle et maintenance de votre code, réalisation de vos tests, gestion de la partie documentaire et un peu de CI/CD. Vous êtes encore la? Ok, je continue sur les pré-requis de ce poste: Maîtrise du développement java (11.17) et React JS (ou A…",,,,2025-04-09T04:55:49Z,https://www.adzuna.fr/land/ad/5136513727?se=pHJWOu0o8BGFil_oKXcHCQ&utm_medium=api&utm_source=e1ad5111&v=482EB5F3943ECB2B50FB7C92AA2B698071F56BB8,Unknown,full stack,fr,full stack,standard,False,False
Ingénieur Full Stack/Ingénieure Full Stack,ACENSI,France,"Nouvelle Opportunité Ingénieurs / Développeurs BACK-END au sein de Acensi-Nord Lieu : Villeneuve d’Ascq (59) Type de contrat : CDI Salaire : À négocier selon l’expérience Expérience : 4 ans minimum en tant que Développeur Back-End et/ou Full Stack POSTE : DEVELOPPEUR BACK-END CONFIRME (H/F) Dans le cadre d’un projet stratégique de modernisation du système d’échanges inter-applicatifs, nous recherchons un Développeur Backend Java confirmé , intervenant sur des problématiques d’intégration et de…",,,,2025-04-26T06:24:12Z,https://www.adzuna.fr/land/ad/5163443458?se=pHJWOu0o8BGFil_oKXcHCQ&utm_medium=api&utm_source=e1ad5111&v=6DEF6EE65718FA8744D4A37289953C3E024B72A4,Unknown,full stack,fr,full stack,standard,False,False
Ingénieur Full Stack/Ingénieure Full Stack,Plus que pro,"Obernai, Sélestat-Erstein","Description du poste Si tu entends Laravel tu sais que ce n’est pas un compositeur célèbre ! Tu sais que PHP ne fait pas partie du tableau périodique des éléments de chimie, mais c’est pour toi tout un univers que tu maîtrises ! Tu viens de lire « HTML, CSS ou JAVASCRIPT» et tu as déjà cliqué sur le bouton « postulez » ? Pour toi la compatibilité n’est pas que sur Tinder ou AdopteunMec.com ? La veille ? Non ce n’était pas juste hier… mais c’est pour toi un quotidien ! Tu veux relever de nouveau…",,,,2025-04-06T10:07:49Z,https://www.adzuna.fr/land/ad/5132204866?se=pHJWOu0o8BGFil_oKXcHCQ&utm_medium=api&utm_source=e1ad5111&v=F0508ED1214119359BE908392E01EC70CA96E52C,Emplois Informatique,full stack,fr,full stack,standard,False,False
Ingénieur Full Stack/Ingénieure Full Stack,Nextoo,"Lille, Nord","Java n’a plus aucun secret pour toi et tu veux relever un nouveau challenge en tant que Développeur Fullstack Java-EE (F/H) en métropole lilloise ? Tu es au bon endroit pour postuler chez Nextoo ! Ton Profil ✅Tu as une expérience d’au moins 3 ans en développement backend (JAVA-EE/Spring) ✅Tu connais une ou plusieurs des BDD suivantes : PostgreSQL, Oracle, MongoDB, MariaDB ✅Tu accordes de l'importance à la qualité du code que tu produis ✅ Tu es autonome et motivé(e) par le travail en équipe  Te…",,,,2024-11-01T09:33:23Z,https://www.adzuna.fr/land/ad/4921116836?se=pHJWOu0o8BGFil_oKXcHCQ&utm_medium=api&utm_source=e1ad5111&v=1524668EF74E99C531AC4A54606602A08BFF7C82,Unknown,full stack,fr,full stack,standard,False,False
Développeuse Full Stack / Développeur Full Stack,Sogeti,"Lille, Nord","Chez Sogeti, la technologie coule dans nos veines. C’est cet intérêt pour la technologie qui nous guide au quotidien et qui est reflété dans notre slogan « Made In Tech ». Grâce à notre passion commune pour la technologie, à notre culture entrepreneuriale et à l'importance que nous accordons à la formation continue, nous mettrons tout en œuvre pour vous accompagner à libérer votre plein potentiel. Vos missions Piloter des projets techniques : vérifier la bonne progression des développements, dé…",,,,2025-04-06T10:07:49Z,https://www.adzuna.fr/land/ad/5132204882?se=pHJWOu0o8BGFil_oKXcHCQ&utm_medium=api&utm_source=e1ad5111&v=C0D99AC63C2454EA0E806A27B3D2E36023C875F4,Unknown,full stack,fr,full stack,standard,False,False
Ingénieur Full Stack/Ingénieure Full Stack,Sogeti,"Le Mans, Sarthe","Chez Sogeti, la technologie coule dans nos veines. C’est cet intérêt pour la technologie qui nous guide au quotidien et qui est reflété dans notre slogan « Made In Tech ». Grâce à notre passion commune pour la technologie, à notre culture entrepreneuriale et à l'importance que nous accordons à la formation continue, nous mettrons tout en œuvre pour vous accompagner à libérer votre plein potentiel. Vos missions En tant que développeuse ou développeur fullstack au sein d‘une équipe dans nos locau…",,,,2025-04-21T04:49:23Z,https://www.adzuna.fr/land/ad/5154914905?se=pHJWOu0o8BGFil_oKXcHCQ&utm_medium=api&utm_source=e1ad5111&v=9E0CCF5AEA415C45ADE09876D846E3D5623B7BD4,Unknown,full stack,fr,full stack,standard,False,False
Ingénieur Full Stack/Ingénieure Full Stack,Urban Linker,"Biarritz, Bayonne","LA SOCIETE Notre client est une startup innovante implantée au cœur du BAB (Bayonne-Anglet-Biarritz), portée par un ADN unique mêlant technologie de pointe, innovation financière et responsabilité sociétale. Composée d’une équipe d’une quinzaine de talents passionnés, cette jeune pousse de la FrenchTech ambitionne de transformer le quotidien des professionnels grâce à une gamme de solutions technologiques à la fois agiles, intuitives et à forte valeur ajoutée. Déjà rentable et affichant une cro…",,,,2025-04-12T06:06:11Z,https://www.adzuna.fr/land/ad/5141657388?se=pHJWOu0o8BGFil_oKXcHCQ&utm_medium=api&utm_source=e1ad5111&v=0FD2EB199333699577EBEED3FB0BA8946B470002,Unknown,full stack,fr,full stack,standard,False,False
Ingénieur Full Stack/Ingénieure Full Stack,KPC,"Aix-en-Provence, Bouches-du-Rhône","KPC est un acteur de premier plan dans les services et solutions de gestion de la performance et de l'expérience client. Grâce à la combinaison de nos expertises, nous sommes en mesure de guider nos clients dans leur transition vers l’entreprise intelligente du futur. Le groupe est articulé autour de différentes offres et équipes, dont la Digital Factory. La Digital Factory a pour but d’assister nos clients dans la réalisation d’applications et solutions métiers sur mesure. Nous appliquons une …",,,,2025-04-04T08:21:32Z,https://www.adzuna.fr/land/ad/5128734000?se=pHJWOu0o8BGFil_oKXcHCQ&utm_medium=api&utm_source=e1ad5111&v=A02B00C2C0FB0FFD3B6A8421ADB53603AA89B4FA,Unknown,full stack,fr,full stack,standard,False,False
Développeur Full-Stack - Java et Angular - (H/F) - En alternance,OpenClassrooms,"Montreuil, Bobigny","Description du poste Vos missions en tant que Développeur Full-Stack - Java et Angular en alternance : - Analyser les besoins du produit et concevoir des solutions IT - Coder dans le respect des Normes et Standards de développement et de sécurité (approche TDD) - Exécuter les campagnes de tests sur les applicatifs du périmètre - Analyser les incidents et proposer des plans d'actions préventifs d'amélioration - Garantir le bon fonctionnement du produit, sa maintenabilité (dont documentation) et …",108000,192000,contract,2025-04-28T17:07:47Z,https://www.adzuna.fr/land/ad/5166780570?se=pHJWOu0o8BGFil_oKXcHCQ&utm_medium=api&utm_source=e1ad5111&v=403DBF35562B9B478330A90A4E14AAC86F44C468,Emplois Autres/Général,full stack,fr,full stack,standard,False,False
Développeur full-stack,Tikamoon,France,"Tikamoon est une DNVB spécialisée dans la création et la vente de meubles en bois massif – uniques, premium & durables – proposés au prix le plus juste. Plus qu’un distributeur, Tikamoon est un concepteur-constructeur qui travaille sans intermédiaire avec des partenaires artisans en Asie et en Europe et s’attache à maîtriser tous les maillons de la chaîne (du design à la logistique, du marketing au service client) pour proposer des produits authentiques, de qualité et au moindre impact environn…",,,,2025-04-04T08:20:32Z,https://www.adzuna.fr/land/ad/5128733378?se=pHJWOu0o8BGFil_oKXcHCQ&utm_medium=api&utm_source=e1ad5111&v=FEFDCE71839CF9DFFEE7CE2FCB50162252E75945,Unknown,full stack,fr,full stack,standard,False,False
Développeur.se Full Stack,Listen too,"Lille, Nord","Imagines un lieu où ta voix compte autant que tes compétences… Chez Listen too, nous sommes convaincus que l’écoute est indissociable du progrès. Cultivée au quotidien, elle devient un catalyseur de croissance et de réussite, tant pour l’entreprise que pour ses collaborateur·rice·s. Listen too est une agence conseil spécialisée depuis 2013 dans la digitalisation de la Relation Client & Collaborateur. Grâce à la justesse de l’accompagnement offert à nos clients comme à nos consultant·e·s, nous …",,,,2025-05-02T09:09:18Z,https://www.adzuna.fr/land/ad/5175643210?se=pHJWOu0o8BGFil_oKXcHCQ&utm_medium=api&utm_source=e1ad5111&v=C31AC9125290D5EEB1996019212497F69FBC6DB6,Unknown,full stack,fr,full stack,standard,False,False
Ingénieur Full Stack/Ingénieure Full Stack Java/React,Aubay,"Ile-de-France, France","Rejoignez AUBAY et participez à la transformation du secteur de l’ÉNERGIE ! ⚡ AUBAY ouvre un nouveau marché stratégique dans l’ÉNERGIE, un tournant majeur qui façonne notre avenir et renforce notre rôle dans la transition énergétique. Avec plus de 150 consultants déjà en mission chez les grands acteurs du secteur, notre ambition est de dépasser les 200 experts d’ici fin 2023.  Pourquoi nous rejoindre ? Notre succès repose non seulement sur nos compétences techniques, mais aussi sur nos valeurs…",,,,2025-03-28T03:31:25Z,https://www.adzuna.fr/land/ad/5114758942?se=pHJWOu0o8BGFil_oKXcHCQ&utm_medium=api&utm_source=e1ad5111&v=652195768EDA1CC4438F0F0D5F2715F625BE903D,Unknown,full stack,fr,full stack,standard,False,False
Full Stack Architect,Ampstek,"Molsheim, Bas-Rhin","Job Title: Full Stack Architect (Java  ReactJS) Experience: 8–10 years (Minimum 8 years relevant) Location : Molsheim, Grand Est, France Contract Duration: 12 months (with possible extension) Mandatory Skills: Proven experience in solution design and development using Java/J2EE , Spring Boot , and ReactJS Strong expertise in frontend technologies (HTML5, CSS/SASS, JavaScript, ES6, ReactJS, Redux, JSX) Deep understanding of software architecture , design patterns , and object-oriented programmin…",,,,2025-04-27T06:53:47Z,https://www.adzuna.fr/land/ad/5165175417?se=pHJWOu0o8BGFil_oKXcHCQ&utm_medium=api&utm_source=e1ad5111&v=46297B0E6E7C94832E9FC0BFBB68F9856EB47B89,Unknown,full stack,fr,full stack,standard,False,False
Développeur Full Stack,Cramif,"Paris, Ile-de-France","Vous travaillerez au sein de la DSI au Département Études Informatiques, dont la trentaine de collaborateurs accompagne les directions métiers dans l'évolution de leur système d'information (intégration d'outils nationaux, progiciel,…) et développe des applications pour le compte des utilisateurs de l'organisme ou des structures nationales. Sous la responsabilité d'un Chef de Projet, vous serez amené à travailler sur l'amélioration ou la création des applications métiers ainsi que sur des servi…",,,,2025-04-11T05:29:13Z,https://www.adzuna.fr/land/ad/5139963962?se=pHJWOu0o8BGFil_oKXcHCQ&utm_medium=api&utm_source=e1ad5111&v=C2BAEE718ECEE8551FA4E2014F1D0025AD6FE36A,Unknown,full stack,fr,full stack,standard,False,False
Developpeur full stack,DOXALLIA,"Bozouls, Rodez","L’entreprise : Filiale du groupe Crédit Agricole, DOXALLIA partage avec ses clients, partenaires et collaborateurs une grande ambition : être le référent français d’excellence sur l’ensemble des maillons de la chaîne documentaire, de l’édition papier au 100 % digital. C'est une entreprise humaine, digitale et créative, disposant de 9 sites en France et dont le siège social se situe à Rodez (12). Le Business Plan ambitieux, projette à 5 ans une multiplication du chiffre d’affaires par trois et u…",,,,2025-04-14T07:38:07Z,https://www.adzuna.fr/land/ad/5143868821?se=pHJWOu0o8BGFil_oKXcHCQ&utm_medium=api&utm_source=e1ad5111&v=04205C7E06C3A69BF7426E9A4F2067764D27C6CA,Unknown,full stack,fr,full stack,standard,False,False
Ingénieur Full Stack/Ingénieure Full Stack Java/react,Infotel,"Nantes, Loire-Atlantique","NOTRE ENTREPRISE Infotel Conseil accompagne les directions Informatiques et Métiers des grandes entreprises depuis plus de 40 ans (Airbus, BNP Paribas, Banque de France, BPCE, Air France, Arkéa, Stellantis, etc.). C’est aujourd’hui plus de 3 000 Infotéliens qui ont rejoint le groupe en France (Paris, Toulouse, Lyon, Bordeaux, Lille, Rennes, Nantes, etc.) et à l’étranger (UK, Monaco, Allemagne, US, Canada, Inde, Maroc). Nous avons ainsi réalisé en 2023 un chiffre d’affaires de 307,5 M€. Infotel …",,,,2025-04-24T06:47:41Z,https://www.adzuna.fr/land/ad/5159524148?se=pHJWOu0o8BGFil_oKXcHCQ&utm_medium=api&utm_source=e1ad5111&v=0D25BE399D22B14FE38F852AF958523C0BA3FDE2,Unknown,full stack,fr,full stack,standard,False,True
Full Stack TypeScript – Mobile,Sander,"Paris, Ile-de-France","Rejoignez une entreprise technologique française innovante, acteur incontournable du secteur de la mobilité. Animée par une forte culture produit et des valeurs RSE affirmées, elle propose des solutions de transport premium combinant exigence opérationnelle, innovation technologique et engagement environnemental. Dans une organisation à taille humaine et en forte croissance, vous contribuerez au développement d'une plateforme mobile et web ambitieuse, utilisée par des milliers d’utilisateurs au…",,,,2025-05-04T09:28:08Z,https://www.adzuna.fr/land/ad/5179913243?se=pHJWOu0o8BGFil_oKXcHCQ&utm_medium=api&utm_source=e1ad5111&v=9D54E1BC29DCFC54F9933A4222167CEB1AC219DF,Unknown,full stack,fr,full stack,standard,False,False
Développeur Full Stack Niort,Néosoft,"Niort, Deux-Sèvres","Groupe indépendant de conseil en transformation digitale de près de 1800 collaborateurs, Néosoft s’est construit, depuis 2005, sur un modèle qui place l’excellence, le dépassement de soi et la RSE au cœur de sa stratégie. En nous rejoignant, vous intégrez des communautés d’experts et de talents qui vous permettent de développer vos compétences et d’offrir à nos clients le meilleur accompagnement possible. Notre savoir-faire s’articule autour de nos 6 domaines d’expertise : Conseil & Agilité Cyb…",,,,2025-04-21T04:51:23Z,https://www.adzuna.fr/land/ad/5154919228?se=pHJWOu0o8BGFil_oKXcHCQ&utm_medium=api&utm_source=e1ad5111&v=FF265B63E4CB6F6CAD1E7724EF00A91A9E83A6F3,Unknown,full stack,fr,full stack,standard,False,False
Développeur Full-Stack H/F,Plus que PRO,"Rosheim, Molsheim","Description du poste Si tu entends Laravel tu sais que ce n'est pas un compositeur célèbre ! Tu sais que PHP ne fait pas partie du tableau périodique des éléments de chimie, mais c'est pour toi tout un univers que tu maîtrises ! Tu viens de lire « HTML, CSS ou JavaScript» et tu as déjà cliqué sur le bouton « postulez » ? La veille ? Non ce n'était pas juste hier mais c'est pour toi un quotidien ! Tu veux relever de nouveaux challenges, tu as une envie débordante de te dépasser et d'évoluer au s…",,,,2025-05-03T06:22:01Z,https://www.adzuna.fr/land/ad/5177863529?se=pHJWOu0o8BGFil_oKXcHCQ&utm_medium=api&utm_source=e1ad5111&v=6E035A822BE8C13371953B50685C30A1BAB7F25D,Emplois Autres/Général,full stack,fr,full stack,standard,False,False
Lead Développeur·se Full Stack,"Sénova - AMO, maître d'œuvre et bureau d'études engagé pour la transition écologique des bâtiments","Lyon, Rhône","L'entreprise  Sénova est une entreprise à mission qui existe pour contribuer activement et avec enthousiasme à la transition écologique des bâtiments . En tant qu’ AMO , maître d’œuvre et bureau d’études , nous aidons nos clients, qu’ils soient promoteurs, bailleurs, copropriétés ou particuliers à réaliser des projets de construction ou de rénovation beaux et enthousiasmants . En effet, grâce à notre expertise architecturale, technique et financière, nos clients obtiennent, pour chaque projet,…",,,,2025-04-21T04:50:17Z,https://www.adzuna.fr/land/ad/5154917555?se=pHJWOu0o8BGFil_oKXcHCQ&utm_medium=api&utm_source=e1ad5111&v=25CAE08997DCD0E7E87081212C87D81CB3A0AFBD,Unknown,full stack,fr,full stack,standard,False,False
Développeur Java Full Stack,Extia,"Niort, Deux-Sèvres","D'abord qui, ⦁ Engagé : vous êtes à 100% quand vous y croyez ! ⦁ Souple : vous recherchez l’amélioration continue et vous adaptez aux nouvelles propositions avec plaisir, ⦁ Créatif : vous avez toujours une solution inédite mais adéquate à proposer, ⦁ Rigoureux : vous ne laissez rien au hasard. ⦁ Indépendant : vous appréciez une certaine liberté d’action. Ensuite quoi, Au sein d'une équipe dynamique vous serez amené à : ⦁ Participer à la rédaction du cahier des charges afin de comprendre les bes…",,,,2024-07-22T06:36:11Z,https://www.adzuna.fr/land/ad/4790096607?se=pHJWOu0o8BGFil_oKXcHCQ&utm_medium=api&utm_source=e1ad5111&v=18D2A67706672D3CFBF23137BB140FAE5F3489C8,Unknown,full stack,fr,full stack,standard,False,False
Developpeur Full Stack Java H/F,INETUM SOFTWARE,"Saint-Ouen, Saint-Denis","Inetum Software, éditeur de logiciels pour le secteur public, propose des logiciels responsables destinés aux collectivités, aux établissements publics et aux entreprises. Nous contribuons à fournir les services indispensables à la vie en société. Filiale d'Inetum Software, Ilex International est l'éditeur de logiciels français leader dans la gestion des identités et des accès (IAM pour Identity and Access Management). Partenaire de la plupart des grands comptes et de nombreuses ETI, nous avons…",,,,2025-05-03T06:21:58Z,https://www.adzuna.fr/land/ad/5177863359?se=pHJWOu0o8BGFil_oKXcHCQ&utm_medium=api&utm_source=e1ad5111&v=CACE116E53A186DBB1D0CE6F09D4D4C9874A96CC,Emplois Informatique,full stack,fr,full stack,standard,False,True
Développeur Full-Stack - Lyon H/F,AXEAL,"Caluire-et-Cuire, Lyon","Nous recherchons un Développeur Full Stack pour intégrer notre équipe. Vous aurez la charge de la conception et du développement de fonctionnalités de bout en bout, allant des interfaces utilisateur aux services et systèmes de contrôle. Poste basé à Lyon 6e depuis notre centre de service. Les missions du poste En tant que Développeur full-stack, vous aurez les responsabilités suivantes : - Concevoir des interfaces utilisateur intuitives et efficaces. - Développer l'infrastructure back-end (base…",35000,45000,,2025-05-02T05:37:31Z,https://www.adzuna.fr/land/ad/5175210157?se=pHJWOu0o8BGFil_oKXcHCQ&utm_medium=api&utm_source=e1ad5111&v=95A09C4DE995EA3BCADA9962DB774A2C7C90487E,Emplois Autres/Général,full stack,fr,full stack,standard,False,False
Architecte Logiciel Full Stack H/F,SFR,"La Défense, Courbevoie","Informations générales 1er opérateur à avoir lancé la 3G la 4G et la 5G en France, SFR fait partie du groupe Altice France et accompagne quotidiennement près de 27 millions de clients. SFR Distribution est la filiale du groupe dédiée à l'activité de distribution Grand Public. Nous proposons à nos clients une offre de services et de produits complets. Riche d'un réseau de 300 points de vente en propre et avec près de 2100 collaborateurs engagés, la relation de proximité et la satisfaction de nos…",,,,2025-03-13T05:51:03Z,https://www.adzuna.fr/land/ad/5090593676?se=pHJWOu0o8BGFil_oKXcHCQ&utm_medium=api&utm_source=e1ad5111&v=34F5FFC402248A53982BFBCFE2EF480DDD330A90,Emplois Informatique,full stack,fr,full stack,standard,False,False
Développeur Web Full Stack H/F,VitiBot,"Reims 1er Canton, Reims","Notre Bureau d'études se compose de 5 pôles distincts, mécanique, électronique, informatique embarqué, informatique haut niveau et web. L'informatique web a la charge du développement des interfaces qui vont permettre aux utilisateurs d'interagir avec nos robots. Elle créée aussi les interfaces de support qui donne à nos équipes la possibilité d'intervenir à distance sur nos machines. En tant que développeur web full stack vous aurez notamment en charge les missions suivantes : - Concevoir et i…",30000,42000,,2025-05-03T06:22:01Z,https://www.adzuna.fr/land/ad/5177863520?se=pHJWOu0o8BGFil_oKXcHCQ&utm_medium=api&utm_source=e1ad5111&v=999FAA40BFFAF1AADEC13A775FBA677D1CC9E47B,Emplois Fabrication,full stack,fr,full stack,standard,False,False
Développeur Full Stack Senior H/F,Groupe Studi,"Hérault, Occitanie","Avec plus de 1000 collaborateurs, Studi est LA grande école en ligne française, acteur incontournable de l'edtech et leader sur son marché de la formation en ligne et l'alternance. Filiale Edtech de Galileo Global Education - N°1 groupe mondial de l'enseignement supérieur privé - Studi propose plus de 200 formations reconnues par l'État du niveau CAP au Bac 5 et forme plus de 70 000 apprenants chaque jour. Pour y parvenir, Studi accélère son développement en France et à l'international, et souh…",,,,2025-05-03T06:21:58Z,https://www.adzuna.fr/land/ad/5177863367?se=pHJWOu0o8BGFil_oKXcHCQ&utm_medium=api&utm_source=e1ad5111&v=DA26B223DF68D0F1DBD9320ADD070E2B1D2BAF89,Unknown,full stack,fr,full stack,standard,False,True
Développeur(se) Full Stack (Java / Angular) F/H,CGI France,"Amiens, Somme","Développeur(se) Full Stack (Java / Angular) F/HDescription du poste :Développement front-end, Back-end, Full stack,  Ça vous parle ? Nous rejoindre, c’est intégrer une communauté technique animée aussi bien par le défi de répondre aux enjeux de nos clients en proposant des solutions innova",,,permanent,2025-04-28T13:38:27Z,https://www.adzuna.fr/land/ad/5166615196?se=pHJWOu0o8BGFil_oKXcHCQ&utm_medium=api&utm_source=e1ad5111&v=B26CBB744447664BAA4AA858BA075D2A8D180EAD,Emplois Création et Design,full stack,fr,full stack,standard,False,False
Développeur(se) Full Stack Secteur Energie F/H,CGI France,"Lyon, Rhône","Développeur(se) Full Stack Secteur Energie F/HDescription du poste :Développement front-end, Back-end, Fullstack, Ca vous parle ? Nous rejoindre, c’est intégrer une communauté technique animée aussi bien par le défi de répondre aux enjeux de nos clients en proposant des solutions innovantes, q",,,permanent,2025-04-28T13:38:53Z,https://www.adzuna.fr/land/ad/5166615286?se=pHJWOu0o8BGFil_oKXcHCQ&utm_medium=api&utm_source=e1ad5111&v=844203B738B776B4B4EC91808C85E6F2A963DC8F,Emplois Création et Design,full stack,fr,full stack,standard,False,False
Développeur(se) Full Stack - Cloud AWS F/H,CGI France,"Lyon, Rhône","Développeur(se) Full Stack - Cloud AWS F/HDescription du poste :Développement front-end, Back-end, Fullstack, Ça vous parle ? Nous rejoindre, c’est intégrer une communauté technique animée aussi bien par le défi de répondre aux enjeux de nos clients en proposant des solutions innovantes, que l",,,permanent,2025-04-28T13:38:40Z,https://www.adzuna.fr/land/ad/5166615229?se=pHJWOu0o8BGFil_oKXcHCQ&utm_medium=api&utm_source=e1ad5111&v=1354810226410B9E6EE510673A206A27DA049008,Emplois Création et Design,full stack,fr,full stack,standard,False,False
Ingénieur Full Stack (H/F),Thales,"Lyon, Rhône","Nous recherchons un Ingénieur Full Stack, basé à Lyon Quelques mots sur les activités numériques de Thales Lyon : Les activités numériques représentent une entité rattachée au groupe Thales, spécialisée dans l’IT et présente au national. L’agence de Lyon adresse divers sujets d’expertise : ingénierie logiciels, cybersécurité, infogérance des infrastructures et transformation digitale.  Votre rôle et missions En tant qu'Ingénieur Full Stack chez Thales, vous serez amené(e) à : Travailler au sei…",,,,2025-04-11T05:29:10Z,https://www.adzuna.fr/land/ad/5139963718?se=pHJWOu0o8BGFil_oKXcHCQ&utm_medium=api&utm_source=e1ad5111&v=1ACA3624FED1225626C2A8CA1352F83C5B7A757C,Unknown,full stack,fr,full stack,standard,False,False
Développeur full-stack (H/F),néosoft,"Orléans, Loiret","Tous nos postes sont ouverts au télétravail Groupe indépendant de conseil en transformation digitale de près de 1800 collaborateurs, Néosoft s’est construit, depuis 2005, sur un modèle qui place l’excellence, le dépassement de soi et la RSE au cœur de sa stratégie. En nous rejoignant, vous intégrez des communautés d’experts et de talents qui vous permettent de développer vos compétences et d’offrir à nos clients le meilleur accompagnement possible. Notre savoir-faire s’articule autour de nos 6 …",,,,2025-03-19T03:15:26Z,https://www.adzuna.fr/land/ad/5100162574?se=pHJWOu0o8BGFil_oKXcHCQ&utm_medium=api&utm_source=e1ad5111&v=192413CBEACC7004A15134B5BAC9C5D57E657C99,Unknown,full stack,fr,full stack,standard,True,False
