title,company,location,description,salary_min,salary_max,contract_type,created,redirect_url,category,specialty,source_country,query,query_type,remote_friendly,international
Frontend Engineer,YunoJuno,"Oxford Circus, Central London","YunoJuno powers The Future of Work. What started as a platform to connect the best freelancers with forward-thinking companies has now redefined how businesses source and manage their entire contingent workforce. Whether it’s building a new department at a creative startup or building an enterprise solution for the world’s largest communications network, we use technology to power the freelance revolution. About the role: We’re looking for a delivery-focused React JavaScript engineer that would…",41696.68,41696.68,contract,2024-08-09T22:11:08Z,https://www.adzuna.co.uk/jobs/details/4819275161?utm_medium=api&utm_source=e1ad5111,IT Jobs,frontend,gb,frontend,standard,False,False
Senior Frontend Developer – Angular / Typescript - Cambridge,Mayflower Recruitment Ltd,"Cambridge, Cambridgeshire","If you're an experienced engineer with extensive knowledge about Frontend Web development, who also has a passion for building delightful user experiences, join us! As an Angular / TypeScript Software Engineer, you will be responsible for building front end interfaces to our flagship products. What you'll do: Implement compelling, usable web applications; contribute to their design; and engineer them with Angular & Typescript Develop clean, maintainable, reusable cross-browser code Champion the…",46881.96,46881.96,,2025-05-04T08:51:30Z,https://www.adzuna.co.uk/jobs/land/ad/5179916147?se=yGS0Zu0o8BGT4w9x5LWCew&utm_medium=api&utm_source=e1ad5111&v=C5EA3586263377B2D001678D62A376598C03B082,IT Jobs,frontend,gb,frontend,standard,False,False
Frontend Developer - React & TypeScript - £100-120k - London,Scalexperts,"London, UK",Frontend Developer - React & TypeScript - £100-120k  Equity - London Scalexperts have partnered with an innovative AI company based in London who are developing the latest AI tools for video. They have an increasing client base and are looking to scale their engineering team to keep up with the development of new features and ensure they meet client demand. They are looking for talented engineers who have experience of developing highly responsive UIs to give users a seamless interaction with t…,48690.75,48690.75,,2025-04-28T03:28:35Z,https://www.adzuna.co.uk/jobs/land/ad/5166315938?se=yGS0Zu0o8BGT4w9x5LWCew&utm_medium=api&utm_source=e1ad5111&v=2CCAA8F6598FE2EDEBA80F96EFE6ABF17827252F,IT Jobs,frontend,gb,frontend,standard,False,False
Frontend Developer - Tebex,Overwolf,"Nottingham, Nottinghamshire","We're on the hunt for a brave Frontend Developer to join the Tebex team and take our ever-evolving platform to exciting new heights. As our Frontend Champion, you'll spearhead the development of innovative features with your epic coding skills, ensuring our products not only meet but exceed our high standards of user experience. So if you're renowned for your meticulous code craftsmanship, fueled by a drive to conquer new tech frontiers, and can clear entire dungeons with your Vue.js magic – co…",42278.05,42278.05,,2025-04-16T00:39:54Z,https://www.adzuna.co.uk/jobs/details/5146605820?utm_medium=api&utm_source=e1ad5111,IT Jobs,frontend,gb,frontend,standard,False,False
Senior Frontend Developer,OnBuy,UK,"Who are OnBuy? OnBuy are an online marketplace who are on a mission of being the best choice for every customer, everywhere. We have recently been named one of the UK's fastest-growing tech companies in the Sunday Times 100 Tech list. All achievements we are very proud of, but we don't let that go to our head. We are all laser focused on our mission and understand the huge joint effort ahead of us needed to succeed. Working at OnBuy: We are a team of driven and motivated people who thrive when …",50000,55000,,2025-04-03T15:33:12Z,https://www.adzuna.co.uk/jobs/details/5126448490?utm_medium=api&utm_source=e1ad5111,IT Jobs,frontend,gb,frontend,standard,False,False
Sr. Frontend Engineer,Reown,UK,"Welcome to Reown, the onchain UX platform. Founded in 2018, Reown (formerly WalletConnect Inc.) began with a QR code protocol and pioneered the 1st Web3Modal, the first tool enabling developers to integrate multiple wallets into dApps via a customizable interface. Today, Reown is a leading platform delivering web3 developer toolkits— AppKit and WalletKit —that power seamless, secure, and intuitive digital ownership experiences. Our mission is to make blockchain technology accessible and user-fr…",57848.67,57848.67,,2025-04-03T18:42:29Z,https://www.adzuna.co.uk/jobs/details/5127198100?utm_medium=api&utm_source=e1ad5111,IT Jobs,frontend,gb,frontend,standard,False,False
Principal Frontend Engineer,Matillion,"Manchester, Greater Manchester","Matillion is The Data Productivity Cloud. We are on a mission to power the data productivity of our customers and the world, by helping teams get data business ready, faster. Our technology allows customers to load, transform, sync and orchestrate their data. We are looking for passionate, high-integrity individuals to help us scale up our growing business. Together, we can make a dent in the universe bigger than ourselves. About the Role The Principal Frontend Engineer has responsibility for t…",93600,140400,,2025-02-16T14:42:10Z,https://www.adzuna.co.uk/jobs/details/5052478958?utm_medium=api&utm_source=e1ad5111,IT Jobs,frontend,gb,frontend,standard,False,False
Senior Frontend Engineer,AJ Bell,UK,"Job Description We're now recruiting a Senior Frontend Engineer to join our Investcentre team and help in enhancing our successful award-winning platform. You will be joining a team which has a philosophy of continuous improvement, and a strong focus on engineering excellence. What does the job involve? Agile methodologies and a passion for continuous improvement and working in a high-performance engineering team Work with the team to design and deliver high quality products At AJ Bell we pair,…",44204.84,44204.84,,2025-04-24T20:50:26Z,https://www.adzuna.co.uk/jobs/details/5160976357?utm_medium=api&utm_source=e1ad5111,IT Jobs,frontend,gb,frontend,standard,False,False
Frontend Software Engineer,Nuclera,"Cambridge, Cambridgeshire","We’re looking for a skilled Frontend Developer with expertise in TypeScript and React to build and enhance the cutting-edge design and analysis tools behind our revolutionary eProtein Discovery platform. Join us in shaping the future of protein prototyping technology Nuclera is a venture-backed, founder-driven biotech company headquartered in Cambridge, UK with significant operations in Boston, USA. The company’s mission is to improve human health by making proteins accessible. We are beginning…",62783,62783,,2025-02-18T11:09:03Z,https://www.adzuna.co.uk/jobs/details/5054780694?utm_medium=api&utm_source=e1ad5111,IT Jobs,frontend,gb,frontend,standard,False,False
Senior Frontend Engineer,Mintago,"London, UK","Mintago is looking for a Senior Frontend engineer (individual contributor) to join our growing team. We’re building sleek, responsive web applications with cutting-edge technologies and frameworks underpinned by TypeScript and React. You will join Mintago at the start of its engineering journey. As a crucial member of our team, you will make decisions that will shape the future of engineering within our company, working in a fast-paced start up environment. As part of our commitment to deliveri…",81533.8,81533.8,,2025-04-24T13:45:42Z,https://www.adzuna.co.uk/jobs/details/5160120327?utm_medium=api&utm_source=e1ad5111,IT Jobs,frontend,gb,frontend,standard,False,False
Frontend Engineer (Drive),Proton,"London, UK","Join Proton and build a better internet where privacy is the default At Proton, we believe that privacy is a fundamental human right and the cornerstone of democracy. Since our inception in 2014, founded by a team of scientists from CERN, we have dedicated ourselves to providing free and open-source technology to millions worldwide, ensuring access to privacy, security, and freedom online. Our journey began with Proton Mail, the largest secure email service globally, and has since expanded to i…",70394.74,70394.74,,2025-03-05T17:04:39Z,https://www.adzuna.co.uk/jobs/details/5077536147?utm_medium=api&utm_source=e1ad5111,IT Jobs,frontend,gb,frontend,standard,False,True
Frontend Engineer (Account),Proton,"London, UK","Join Proton and build a better internet where privacy is the default At Proton, we believe that privacy is a fundamental human right and the cornerstone of democracy. Since our inception in 2014, founded by a team of scientists from CERN, we have dedicated ourselves to providing free and open-source technology to millions worldwide, ensuring access to privacy, security, and freedom online. Our journey began with Proton Mail, the largest secure email service globally, and has since expanded to i…",70730.34,70730.34,,2025-03-05T17:17:43Z,https://www.adzuna.co.uk/jobs/details/5077576466?utm_medium=api&utm_source=e1ad5111,IT Jobs,frontend,gb,frontend,standard,False,True
Senior Frontend Developer,AND Digital,"Manchester, Greater Manchester",Who We Are: AND Digital are a tech company focused on accelerating digital delivery and dedicated to closing the digital skills gap. We’ve been helping organisations build better digital products and stronger digital teams since 2014. We believe our work should always leave a legacy for the client. We do this through close relationships with our offices (or ‘Clubs’) so that our partners are always prioritised by a regional team close to them. This unique model has driven success for our clients…,53140.23,53140.23,,2025-03-20T18:56:27Z,https://www.adzuna.co.uk/jobs/details/5103220579?utm_medium=api&utm_source=e1ad5111,IT Jobs,frontend,gb,frontend,standard,False,False
Principal Frontend Developer,The Portfolio Group,"Rusholme, Manchester","Tech Stack: React, TypeScript, Next.js, GraphQL You're a leader who codes. You've architected complex frontend systems, led teams through product launches, and mentored developers into rockstars. Now you're ready for the next big challenge. We're looking for a Principal Frontend Developer with people leadership experience to own our web experience, guide frontend engineering standards, and elevate our product to a whole new level. You'll be the tech authority and the human connector-driving per…",60000,60000,,2025-05-02T22:14:20Z,https://www.adzuna.co.uk/jobs/land/ad/5177318105?se=yGS0Zu0o8BGT4w9x5LWCew&utm_medium=api&utm_source=e1ad5111&v=1B6FE5DFD8712924F0BFD0D68A89AA63E256CF6A,IT Jobs,frontend,gb,frontend,standard,False,False
Tech Lead - Frontend,Parkside Office Professional,"London, UK",Lead the Cutting Edge of Frontend Innovation Are you a highly skilled and visionary Frontend expert ready to take the lead? Do you thrive on architecting sophisticated web applications and empowering a team of talented engineers? We're on the lookout for a dynamic Tech Lead - Frontend to drive our digital transformation initiatives. This is an exceptional opportunity to leverage your deep proficiency in modern frontend technologies and your leadership capabilities to shape the future of our use…,80000,90000,permanent,2025-04-29T20:17:53Z,https://www.adzuna.co.uk/jobs/details/5169339541?utm_medium=api&utm_source=e1ad5111,IT Jobs,frontend,gb,frontend,standard,False,False
Frontend Magento Developer,InterQuest Group  Limited,"Manchester, Greater Manchester","Frontend Magento Developer - Up to 50k - UK Remote - eCommerce ECOM are delighted to have partnered with an eCommerce agency with extensive experience in delivering complex digital solutions for a wide range of national and international clients. Established over a decade ago, our client have become a trusted partner for implementing advanced eCommerce platforms and delivering strategic digital marketing campaigns. Their expertise lies in platforms like Adobe Commerce (Magento), and they are se…",50000,50000,permanent,2025-03-26T13:02:14Z,https://www.adzuna.co.uk/jobs/details/5112127056?utm_medium=api&utm_source=e1ad5111,IT Jobs,frontend,gb,frontend,standard,True,True
Senior Frontend Engineer,InterQuest Group  Limited,"Manchester, Greater Manchester","Senior Frontend Engineer - Tech4Good - Up to 60k - Manchester (2 days p/w, 3 days WFH) ECOM are delighted to have teamed up with a Tech4Good organisation based in Manchester on their search for a Senior Frontend Engineer, which will be the first dedicated frontend hire into the organisation. They're a Tech for Good organisation that are using technology to help people save money on their energy consumption and in turn, helping the environment - so a win win for everyone. As the first Frontend h…",60000,60000,,2025-04-16T10:41:18Z,https://www.adzuna.co.uk/jobs/details/5147043448?utm_medium=api&utm_source=e1ad5111,IT Jobs,frontend,gb,frontend,standard,False,False
Senior Frontend Developer,Appius,"Bournemouth, Dorset","Position: Senior Frontend Developer Location: Bournemouth office 3-5 days per week, up to 2 days remote working. Hours: Monday to Friday (with flexi-time and hybrid working options). Salary: Subject to Experience. Role Description This is an exciting role for anyone wanting to work at the heart of a digital agency with a 25-year history and an excellent client portfolio. The role is focused on frontend development and ongoing maintenance of websites with Experience Platforms. You will develop a…",33597.34,33597.34,,2025-04-10T00:41:42Z,https://www.adzuna.co.uk/jobs/details/5137924203?utm_medium=api&utm_source=e1ad5111,IT Jobs,frontend,gb,frontend,standard,True,False
Graduate Frontend Engineer,AlphaSights,"London, UK","The role: We are looking for highly driven, aspiring Frontend software engineers who take pride in their work, to expand our Engineering team in London. Successful candidates will join a cross functional team including product managers and designers working closely with the rest of our business to deliver working code that solves real problems for both internal and external customers. You will take ownership of the problems that your team solves, ensuring a high level of quality in everything t…",37954.59,37954.59,,2025-02-25T16:31:27Z,https://www.adzuna.co.uk/jobs/details/5063215699?utm_medium=api&utm_source=e1ad5111,Graduate Jobs,frontend,gb,frontend,standard,False,False
Senior Frontend Engineer,Wahed,"London, UK","About Wahed: We have a passion to reduce financial inequality and exclusion by building world leading financial products and services aimed at giving access to all. We are a New York headquartered Financial Technology (FinTech) company focused on serving values-based (shariah compliant) digital financial services to retail clients globally, starting with wealth management. We have an impressive global team aligned with this purpose and are looking for trail blazers in their fields that will tak…",47476,47476,,2025-03-18T17:03:19Z,https://www.adzuna.co.uk/jobs/details/5099183783?utm_medium=api&utm_source=e1ad5111,IT Jobs,frontend,gb,frontend,standard,False,True
Senior Frontend Engineer,Gendo,"London, UK","Location: London or Bristol (3 days a week in-office) About Gendo Gendo is a revolutionary, browser-based AI platform designed to empower architects and designers to generate accurate, high-quality visual representations of their designs in seconds, not days - a huge improvement on existing workflows. Within 18 months of founding we built an alpha product, beta product and, in summer of this year, launched our early-access product publicly. Today this product has thousands of users across many …",70000,90000,,2024-12-13T11:34:30Z,https://www.adzuna.co.uk/jobs/details/4976724280?utm_medium=api&utm_source=e1ad5111,IT Jobs,frontend,gb,frontend,standard,False,False
Senior Frontend Engineer,Robin AI,"London, UK","About Robin AI Robin AI is on a mission to rebuild the legal industry — starting with making contracts simple for everyone. We are a pioneer in Legal AI, built on proprietary models, licensed data, and deep partnerships with Anthropic and AWS. Since 2019, we’ve expanded our footprint to 4 continents and have been supporting many of the world’s most successful businesses, including GE, Pfizer, KPMG, and UBS. Why is this role important to Robin AI? At Robin AI, we create groundbreaking products t…",95000,110000,,2025-04-27T17:10:51Z,https://www.adzuna.co.uk/jobs/details/5165753378?utm_medium=api&utm_source=e1ad5111,IT Jobs,frontend,gb,frontend,standard,False,False
Lead Frontend Developer,InterQuest Group  Limited,"Manchester, Greater Manchester","Lead Frontend Engineer - 75k - Fully Remote (Some Travel to Manchester Required) - eCommerce ECOM are delighted to have teamed up with a leading eCommerce company on their search for a Lead Frontend Engineer to lead a team and provide technical ownership in a brilliant web app setup. The client have been established for a number of years and their eCommerce side is growing, with huge ambitions for growth. The team tend to work remotely but do occasionally get together for collaboration, so as l…",75000,75000,,2025-04-16T20:43:57Z,https://www.adzuna.co.uk/jobs/details/5148229602?utm_medium=api&utm_source=e1ad5111,IT Jobs,frontend,gb,frontend,standard,True,False
Snr. Frontend Engineer,Gendo,"London, UK","Location: London or Bristol (3 days a week in-office) About Gendo Gendo is a revolutionary, browser-based AI platform designed to empower architects and designers to generate accurate, high-quality visual representations of their designs in seconds, not days - a huge improvement on existing workflows. Within 18 months of founding we built an alpha product, beta product and, in summer of this year, launched our early-access product publicly. Today this product has thousands of users across many …",70000,100000,,2025-05-02T17:33:58Z,https://www.adzuna.co.uk/jobs/details/5176585550?utm_medium=api&utm_source=e1ad5111,IT Jobs,frontend,gb,frontend,standard,False,False
Senior Frontend Engineer,Thriva Limited,"London, UK","Meet our product team We have a small but mighty product team that works across both our direct-to-consumer and B2B products. Working in the healthcare space provides interesting product challenges but also great rewards when the products you build have a positive impact on the lives of our customers. We work very collaboratively with engineers, designers and product managers all getting very hands-on about the experiences we’re building. Why work with us You’ll be working alongside humble peop…",64351.46,64351.46,permanent,2025-03-03T23:55:05Z,https://www.adzuna.co.uk/jobs/details/5072825755?utm_medium=api&utm_source=e1ad5111,IT Jobs,frontend,gb,frontend,standard,False,False
Senior Frontend Developer,Vertu Motors plc,"Gateshead, Tyne & Wear","Senior Frontend Developer – Vertu Motors, Gateshead (Hybrid) Join Vertu Motors, one of the UK’s top automotive retailers, and drive innovation in our digital landscape. With over 200 dealerships representing over 30 of the world's leading automotive brands, we are dedicated to creating exceptional digital experiences within the automotive industry. Our platforms support millions of customers every month, and we need your expertise to take them to the next level. We’re looking for a proactive an…",52073.11,52073.11,,2025-04-27T00:59:20Z,https://www.adzuna.co.uk/jobs/details/5164960349?utm_medium=api&utm_source=e1ad5111,IT Jobs,frontend,gb,frontend,standard,False,False
Principal Frontend Engineer,Fresha,"London, UK","About Fresha Fresha is the leading marketplace platform for beauty & wellness trusted by millions of consumers and businesses worldwide . Fresha is used by 120,000 businesses and 450,000 stylists and professionals worldwide , processing over 1 billion appointments to date . The company is headquartered in London, United Kingdom , with 12 global offices located across North America, EMEA and APAC. Fresha allows consumers to discover, book and pay for beauty and wellness appointments with local b…",68802.95,68802.95,,2024-07-31T15:07:56Z,https://www.adzuna.co.uk/jobs/details/4802560169?utm_medium=api&utm_source=e1ad5111,IT Jobs,frontend,gb,frontend,standard,False,True
Senior Frontend Engineer,Conduktor,"London, UK","About Conduktor Conduktor is an Enterprise Data Management (EDM) platform that specialises in streaming. We empower industry leaders to implement their Streaming Data Strategy with a comprehensive approach to data control, compliance, and security; unconstrained by their infrastructure providers. Our platform mitigates data security risks while enhancing communication, automation, and observability across data flows, enabling teams to collaborate effortlessly across the organisation. We have hu…",60264.14,60264.14,,2025-03-27T11:30:21Z,https://www.adzuna.co.uk/jobs/details/5113391605?utm_medium=api&utm_source=e1ad5111,IT Jobs,frontend,gb,frontend,standard,False,False
Product Engineer (Frontend),V7,"London, UK","V7 turns human knowledge into trustworthy AI, powering products that solve our hardest problems. Our platform lets customers build no-code AI workflows that solve knowledge work with V7 Go, and leverage expert humans to improve frontier AI model knowledge with V7 Darwin. V7 were recently ranked No 1 in Sifted’s top B2B companies for 2024 and raised a $33m Series A including the AI Fund @ Radical Ventures. We are backed by some of the best minds in AI, from Ashish Vaswani (Invented Transformers,…",90000,130000,contract,2024-07-31T15:05:49Z,https://www.adzuna.co.uk/jobs/details/4802534655?utm_medium=api&utm_source=e1ad5111,IT Jobs,frontend,gb,frontend,standard,False,False
Frontend Developer (React),Countercheck GmbH,UK,"Intro As part of the Platform Tech team you will be involved in developing new, cool features and maintaining the existing ones for the platforms that our customers use. We’re looking for a Web/Front-End Developer fluent in English working fully remotely. The ideal candidate would be responsible for designing, developing, testing, and debugging responsive web applications for the company. Using JavaScript, HTML, and CSS, this candidate will be able to translate user and business needs into func…",45385.29,45385.29,,2023-10-21T12:42:12Z,https://www.adzuna.co.uk/jobs/details/4385052900?utm_medium=api&utm_source=e1ad5111,IT Jobs,frontend,gb,frontend,standard,True,False
"Product Engineer, Frontend",Granola,"London, UK","Hey! We're team Granola  If you haven't already, you should check out what we're building , and why you should work here . We're looking for a frontend-focused engineer who loves building delightful user experiences in a fast-paced, iterative environment. In this role, you will craft delightful user interfaces that make complex AI capabilities accessible and valuable. You'll build responsive, performant components that enhance the quality and user experience of our application. You'll be talkin…",51974.93,51974.93,,2025-03-18T17:00:15Z,https://www.adzuna.co.uk/jobs/details/5099175742?utm_medium=api&utm_source=e1ad5111,IT Jobs,frontend,gb,frontend,standard,False,False
"Software Engineer, Frontend",Travelex,UK,"Job Role: Software Engineer, Frontend Job Type: Full Time, Permanent Location: London, Hybrid Role purpose As a valued member of our engineering team, you will contribute to the development of our new web application, powered by a Headless CMS, using the latest frontend technologies. Working with a modern JavaScript stack, your primary focus will be on coding, testing, and enhancing the functionality of Travelex's and partner applications. Being part of the Online team, you will be working clos…",51641.62,51641.62,permanent,2025-03-20T01:47:14Z,https://www.adzuna.co.uk/jobs/details/5101898599?utm_medium=api&utm_source=e1ad5111,IT Jobs,frontend,gb,frontend,standard,False,False
"Software Engineer, Frontend",Travelex Central Services,"London, UK","Job Role: Software Engineer, Frontend Job Type: Full Time, Permanent Location: London, Hybrid Role purpose As a valued member of our engineering team, you will contribute to the development of our new web application, powered by a Headless CMS, using the latest frontend technologies. Working with a modern JavaScript stack, your primary focus will be on coding, testing, and enhancing the functionality of Travelex's and partner applications. Being part of the Online team, you will be working clos…",48727.21,48727.21,permanent,2025-03-21T12:11:25Z,https://www.adzuna.co.uk/jobs/details/5104470514?utm_medium=api&utm_source=e1ad5111,IT Jobs,frontend,gb,frontend,standard,False,False
Senior Frontend Engineer,ICEO - Venture Builder,UK,"Senior Frontend Engineer (React) About the role: As a Senior Frontend Engineer, you’ll ensure our user-facing applications are intuitive, scalable, and high-performing. You would be expected to contribute to the ongoing development of our platform, take ownership of new features and enhancements that deliver exceptional user experience. Help shape next-generation solutions that drive the fintech industry forward, delivering a seamless experience to our users. From building dynamic, responsive i…",61825.79,61825.79,,2025-04-23T00:50:58Z,https://www.adzuna.co.uk/jobs/details/5157096307?utm_medium=api&utm_source=e1ad5111,IT Jobs,frontend,gb,frontend,standard,False,False
