title,company,location,description,salary_min,salary_max,contract_type,created,redirect_url,category,specialty,source_country,query,query_type,remote_friendly,international
Ingénieur logiciel Banc de test,STEP UP,"Pau-Est, Pau","Dans le cadre du développement logiciel pour des bancs de tests d'intégration, nous recherchons un Ingénieur Logiciel pour prendre en charge diverses activités liées à la mise à jour et à l'optimisation des outils de test, ainsi que pour assurer un support aux utilisateurs. Activités principales : Mettre à jour le logiciel des outils de test d'intégration pour garantir leur bon fonctionnement sur les bancs de test. Assurer un support technique aux utilisateurs des bancs de test. Prendre en comp…",,,permanent,2025-03-12T23:30:42Z,https://www.adzuna.fr/details/5090139785?utm_medium=api&utm_source=e1ad5111,Emplois Informatique,ingénieur logiciel,fr,ingénieur logiciel,standard,False,False
Ingenieur Logiciel H/F,ARIAL INDUSTRIES,"Cergy-Sud, Pontoise","NOS OPPORTUNITES / LES MISSIONS Dans le cadre d'un projet de R&T pour l'industrie Défense, nous recherchons un Ingénieur Logiciel (H/F) pour le développement d'un système de Radio Navigation. Le poste est à pourvoir sur Eragny (95). Les principales missions sont les suivantes : - Concevoir et développer tous les modules composant la stack logicielle applicative - Garantir la qualité des modules logiciels via des tests approfondis (unitaires, fonctionnels, intégration) - Assurer la conformité de…",42000,50000,,2025-02-18T03:13:48Z,https://www.adzuna.fr/details/5054341872?utm_medium=api&utm_source=e1ad5111,Emplois Informatique,ingénieur logiciel,fr,ingénieur logiciel,standard,False,False
Ingénieur Logiciel H/F,LR Technologies Sud Ouest,"Toulouse 14e Canton, Toulouse","Afin d'accompagner notre client, nous sommes à la recherche d'un(e) Ingénieur(e) Logiciel pour assurer la migration d'un projet C++ / Qt de QMake vers CMake. Vos missions inclueront : - Analyse et planification de la migration - Conception et implémentation de la migration - Tests et validation - Documentation et formation - Support et amélioration continue L'ingénieur développeur doit être rigoureux, organisé et proactif. Il anticipe les étapes critiques des projets, de la conception à la livr…",36000,42000,,2025-03-14T07:32:35Z,https://www.adzuna.fr/details/5092675278?utm_medium=api&utm_source=e1ad5111,Emplois Autres/Général,ingénieur logiciel,fr,ingénieur logiciel,standard,False,False
Ingénieur logiciel & développement expérimenté,IRCEM,"Roubaix, Lille","Rejoindre le Groupe IRCEM, c’est participer à Ecouter, Guider et Protéger nos publics. En tant que Groupe de protection sociale, notre responsabilité est d’accompagner les familles dans toutes les étapes de leur vie à travers la Complémentaire Retraite, la Prévoyance, la Mutuelle, l’Action Sociale et la Prévention.Le Groupe IRCEM, c’est plus de 500 co-élaborateurs qui partagent les mêmes valeurs que sont l’ambition, la solidarité, le respect et la performance.A l’écoute de ses 5 millions de cli…",,,,2025-05-13T19:15:59Z,https://www.adzuna.fr/details/5196591164?utm_medium=api&utm_source=e1ad5111,Emplois Informatique,ingénieur logiciel,fr,ingénieur logiciel,standard,False,False
Ingénieur logiciel Backend - Guyancourt,iDAKTO,"Saint-Quentin-en-Yvelines, Versailles","Nous recherchons un.e développeur.se backend passionné.e et motivé.e pour rejoindre notre équipe technique. Tu seras en charge du développement et de l’optimisation des services backend de nos applications, en assurant performance, scalabilité et sécurité.",,,,2025-04-02T21:49:02Z,https://www.adzuna.fr/details/5125015079?utm_medium=api&utm_source=e1ad5111,Unknown,ingénieur logiciel,fr,ingénieur logiciel,standard,False,False
Ingénieur Logiciel Backend - Angers,iDAKTO,"Angers-Est, Angers","Tu seras basé dans notre centre R&D à Angers. Au sein d’une équipe de 10 personnes, tu participeras à la conception, la réalisation et le suivi d’un ou plusieurs modules de la solution côté backend . Voici quelques unes de tes missions : Conception technique Développement des fonctionnalités Tests et rédaction technique Veille technologique et sécuritaire Tu rejoindras un environnement de passionnés où tu pourras mettre en valeur et améliorer tes compétences, dans un contexte riche en diversité…",,,,2024-07-30T23:47:04Z,https://www.adzuna.fr/details/4801585868?utm_medium=api&utm_source=e1ad5111,Unknown,ingénieur logiciel,fr,ingénieur logiciel,standard,False,False
Ingenieur Logiciel H/F,Howden France,"9ème Arrondissement, Paris","Votre rôle : Au sein du pôle Domaine applicatif, Data et Reporting, vos principales missions seront : - Mise en place, maintenance et évolution des applications hors ERP - Echanges réguliers avec nos prestataires / partenaires externes - Paramétrage / Support technique des utilisateurs - Instruction et mise en œuvre des nouvelles demandes en collaboration avec les chefs de projets Vous interviendrez sur les domaines : - TMA AS 400 - SAGE - TALEND (ETL) - POWER BI - SKENSE Ce qui fait de cette o…",,,,2025-04-16T21:35:28Z,https://www.adzuna.fr/details/5148209771?utm_medium=api&utm_source=e1ad5111,Emplois Comptabilité et Finance,ingénieur logiciel,fr,ingénieur logiciel,standard,False,False
Jobposting - Ingénieur logiciel embarqué,OneSide Technologies,"Essonne, Ile-de-France","Votre rôle sera : D'intervenir au sein des équipes R&D d'un groupe reconnu pour son expertise en matière de technologies embarquées, de robotique et d'automatisation dans des contextes exigeants. Vous travaillerez sur des produits à destinations de clients civils et militaires. Vous serez amené à réaliser à prendre en main plusieurs aspects du poste : - Analyse des besoins à partir des spécifications systèmes et rédaction des spécifications logicielles - Définition de l'architecture des logicie…",,,permanent,2025-05-02T00:51:04Z,https://www.adzuna.fr/details/5174810996?utm_medium=api&utm_source=e1ad5111,Emplois Ingénierie,ingénieur logiciel,fr,ingénieur logiciel,standard,False,False
Ingénieur logiciel Frontend - Guyancourt,iDAKTO,"Saint-Quentin-en-Yvelines, Versailles","Nous recherchons un.e développeur.se frontend passionné.e et motivé.e pour rejoindre notre équipe R&D. Tu interviendras principalement sur le développement d’interfaces dynamiques avec Angular, en adoptant une approche de programmation réactive. Une sensibilité au backend, notamment en Go, est un plus apprécié. En résumé, tu devras offrir une expérience utilisateur fluide, performante et maintenable.",,,,2025-05-04T22:05:16Z,https://www.adzuna.fr/details/5180733226?utm_medium=api&utm_source=e1ad5111,Unknown,ingénieur logiciel,fr,ingénieur logiciel,standard,False,False
Ingénieur Logiciel H/F,Unlck Recrutement,"Paris, Ile-de-France","Vous êtes fraîchement diplômé et souhaitez vous lancer sur votre tout premier challenge professionnel ? Rejoindre une entreprise en pleine croissance s'inscrit dans vos ambitions futures et vous avez à coeur d'apporter votre pierre à l'édifice ? La base - Contrat : CDI chez le client final - Activité : secteur de l'éducation - Localisation : Paris - Taille de l'entreprise : 35 collaborateurs - Taille de l'équipe technique : 10 personnes - N1 : CTO La stack - Front-end : TypeScript, VueJS - Fram…",43000,55000,,2025-04-23T06:12:55Z,https://www.adzuna.fr/details/5157409354?utm_medium=api&utm_source=e1ad5111,Unknown,ingénieur logiciel,fr,ingénieur logiciel,standard,False,False
Ingénieur Logiciel H/F,IT Link,"Marcoussis, Les Ulis","Dans le cadre de nos activités relatives à la mutation des mobilités, nous recherchons un / e ingénieur pour participer aux activités de développement logiciel dans des environnements contraints et à fortes valeurs ajoutées. Vous aurez la charge de : - Analyser et comprendre les référentiels systèmes (exigences fonctionnelles, d'architecture, Interfaces) - Rédiger et maintenir les spécifications logicielles. - Développer et implémenter les fonctions spécifiées. - Participer au débogage et à l'a…",45000,50000,,2025-04-01T02:50:52Z,https://www.adzuna.fr/details/5120576033?utm_medium=api&utm_source=e1ad5111,Unknown,ingénieur logiciel,fr,ingénieur logiciel,standard,False,False
Ingénieur Logiciel R&D (IT),ALTEN,"Paris, Ile-de-France","Leader mondial de l’Ingénierie et du Conseil en Technologies, ALTEN réalise des projets de conception et d’études pour les grands comptes industriels, télécoms et tertiaires (les Directions Techniques et les Directions des Systèmes d’Information). Vous interviendrez sur la réalisation de projets tous supports (web, mobile, tablette et autres) avec un large spectre technologique. Nos activités sont réalisées dans en mode Agile dans des équipes pluridisciplinaires. Nous sommes à la recherche d'un…",,,permanent,2025-05-13T13:47:48Z,https://www.adzuna.fr/details/5196288790?utm_medium=api&utm_source=e1ad5111,Emplois Vente,ingénieur logiciel,fr,ingénieur logiciel,standard,False,False
Ingénieur logiciel C++ / Solutions de simulation (H/F),ALTAIDE,"Paris, Ile-de-France","Distributeur exclusif européen de logiciels, notre objectif principal est de fournir à nos clients les technologies les plus récentes en matière de réalité virtuelle, de simulation et de rendu visuel. Nous intervenons principalement sur les secteurs de l’aérospatial, la construction, la défense et l’éducation. Notre volonté est de travailler en étroite collaboration avec nos clients dans le cadre de projets basés sur un partenariat solide. En tant qu’équipe primée d’experts enthousiastes, nous …",,,,2025-05-08T02:17:20Z,https://www.adzuna.fr/land/ad/5187507655?se=2sFcRWMw8BGvSxMLQyZXLA&utm_medium=api&utm_source=e1ad5111&v=6C8A2D7B588D6ECAA83CA45D39ADCD550E02F844,Unknown,ingénieur logiciel,fr,ingénieur logiciel,standard,False,False
Ingénieur.e logiciel python H/F,ManpowerGroup,"Toulouse, Haute-Garonne","Notre client est une entreprise qui conçoit un logiciel d’automatisation et d’optimisation des processus d’ingénierie , adopté par des leaders industriels pour révolutionner leurs méthodes de travail. Dans un environnement international, Manpower Experts&Cadres recherche pour son client : Un·e ingénieur·e logiciel en CDI sur Toulouse pour renforcer leur équipe et améliorer l’intégration de leur solution.  Tes missions : -Développer et maintenir des blocs d’intégration pour la plateforme en Pyth…",,,,2025-04-21T04:51:05Z,https://www.adzuna.fr/land/ad/5154918624?se=2sFcRWMw8BGvSxMLQyZXLA&utm_medium=api&utm_source=e1ad5111&v=19FABA77B8C05DD12F2291E8DFC10D6B615384CE,Emplois Informatique,ingénieur logiciel,fr,ingénieur logiciel,standard,False,True
Ingénieur Qualité Logiciels Senior - Dispositifs Médicaux,ManpowerGroup,"Grenoble, Isère","Manpower Life Sciences , division spécialisée dans le recrutement pour les industries de la Santé, accompagne ses clients dans leurs projets de recrutement stratégique et de développement. À propos de notre client Notre client, entreprise spécialisée dans les technologies médicales, et plus précisément dans le domaine de la chirurgie assistée par ordinateur, recherche un(e) Ingénieur qualité logiciels (H/F) en CDI. Missions Rattaché(e) au Directeur Qualité et Affaires Règlementaires, vous aurez…",,,,2025-03-21T07:40:53Z,https://www.adzuna.fr/land/ad/5104021639?se=2sFcRWMw8BGvSxMLQyZXLA&utm_medium=api&utm_source=e1ad5111&v=C9AF9239039DF289E2663A3E7877521E6CB15617,Unknown,ingénieur logiciel,fr,ingénieur logiciel,standard,False,False
Ingénieur tests logiciels/Ingénieure tests logiciels,Sogeti,"Le Mans, Sarthe","Chez Sogeti, la technologie coule dans nos veines. C’est cet intérêt pour la technologie qui nous guide au quotidien et qui est reflété dans notre slogan « Made In Tech ». Grâce à notre passion commune pour la technologie, à notre culture entrepreneuriale et à l'importance que nous accordons à la formation continue, nous mettrons tout en œuvre pour vous accompagner à libérer votre plein potentiel. Vos missions : Participer à l’élaboration de la stratégie de test : définition des critères qualit…",,,,2025-04-21T04:51:05Z,https://www.adzuna.fr/land/ad/5154918605?se=2sFcRWMw8BGvSxMLQyZXLA&utm_medium=api&utm_source=e1ad5111&v=1CA3A1CCD75FD9D9C675E7F1A7E393F452CB113C,Unknown,ingénieur logiciel,fr,ingénieur logiciel,standard,False,False
Ingénieur tests logiciels/Ingénieure tests logiciels,Audensiel,"Lille, Nord","Titre du poste : Testeur Automatisation Description du poste : En tant que Testeur Automatisation, vous jouerez un rôle clé dans l’amélioration continue de la qualité de nos solutions logicielles. Vous serez responsable de la mise en place et de l’exécution de tests automatisés pour garantir des livrables robustes et performants. Vos missions principales : Concevoir, développer et maintenir des scripts de test automatisés en utilisant des outils et frameworks adaptés (ex. : Selenium, Cypress). …",,,,2025-05-03T08:15:36Z,https://www.adzuna.fr/land/ad/5178007801?se=2sFcRWMw8BGvSxMLQyZXLA&utm_medium=api&utm_source=e1ad5111&v=31D618577EA31EB08F0FCD9977C59AA22703E724,Unknown,ingénieur logiciel,fr,ingénieur logiciel,standard,False,False
Ingénieur Architecte Logiciel Temps Réel H/F,Assystem,"Peyrolles-en-Provence, Aix-en-Provence","Votre future équipe Sous la responsabilité d'Alex, Responsable d'équipe, vous rejoignez une équipe dynamique d'une dizaine de collaborateurs intégrée chez notre client ITER. ITER est un immense projet expérimental, qui rassemble 35 pays engagés dans la construction du plus grand tokamak jamais conçu, une machine qui doit démontrer que la fusion - l'énergie du Soleil et des étoiles - peut être utilisée comme source d'énergie à grande échelle, non émettrice de CO2, pour produire de l'électricité.…",,,,2025-05-01T05:50:04Z,https://www.adzuna.fr/land/ad/5171780656?se=2sFcRWMw8BGvSxMLQyZXLA&utm_medium=api&utm_source=e1ad5111&v=18E3F891426AEE0D4225C71E41D2502D6DD8C13E,Unknown,ingénieur logiciel,fr,ingénieur logiciel,standard,False,False
Ingénieur·e Logiciel Embarqué - Débugging H/F,Randstad Digital,"Nice 13e Canton, Nice","Nos 25 000 collaborateurs dans le monde ont un impact positif sur la société en aidant les gens à réaliser leur véritable potentiel tout au long de leur vie professionnelle. your job Dans le cadre de nos projets, nous recherchons nos futurs ingénieurs pour prendre part au développement des nouvelles gammes de véhicules électriques prévues pour les années à venir. Vos missions principales sont les suivantes : - Garantir la qualité des livrables logiciels en participant à la conformité d'acceptat…",,,,2025-05-11T05:40:54Z,https://www.adzuna.fr/land/ad/5193279476?se=2sFcRWMw8BGvSxMLQyZXLA&utm_medium=api&utm_source=e1ad5111&v=4EFB5BCCC91479387E7CC6F16D28BE497B31C0D5,Emplois Autres/Général,ingénieur logiciel,fr,ingénieur logiciel,standard,False,False
Ingénieur Logiciel - Web Front-End - Angular (F/H) (CDI),THALES,France,"Poste : Lieu : Brest, France Construisons ensemble un avenir de confiance Thales est un leader mondial des hautes technologies spécialisé dans trois secteurs d'activité : Défense & Sécurité, Aéronautique & Spatial, et Cyber & Digital. Il développe des produits et solutions qui contribuent à un monde plus sûr, plus respectueux de l'environnement et plus inclusif. Le Groupe investit près de 4 milliards d'euros par an en Recherche & Développement, notamment dans des domaines clés de l'innovation t…",,,permanent,2025-05-08T17:35:00Z,https://www.adzuna.fr/land/ad/5188619648?se=2sFcRWMw8BGvSxMLQyZXLA&utm_medium=api&utm_source=e1ad5111&v=991E3C6789D8C712650796FF121390A3334BA5D7,Unknown,ingénieur logiciel,fr,ingénieur logiciel,standard,False,False
INGENIEUR LOGICIEL PYTHON F/H,Ingérop,"Cébazat, Clermont-Ferrand","Description du poste Vous souhaitez mettre vos compétences informatiques au service de la ville de demain ? Les grands projets de construction vous fascinent ? Vous voulez comprendre l'impact des activités humaines sur notre environnement ? Vous aimez échanger des idées avec des experts passionnés de divers domaines ? Pour concrétiser la vision stratégique d'une ingénierie augmentée par le numérique, portée par le groupe dans sa Vision 2027, le service des outils métiers numériques, aka la ""cel…",,,,2025-04-22T21:27:10Z,https://www.adzuna.fr/details/5156896721?utm_medium=api&utm_source=e1ad5111,Emplois Ingénierie,ingénieur logiciel,fr,ingénieur logiciel,standard,False,False
Ingénieur Logiciel Embarqué (H/F),Alten,France,"Description du poste Dans le cadre du renfort aux équipes présentes sur place, vous êtes chargés des missions suivantes : Spécification, conception, développement et test de logiciels embarqués, Intervention sur l'ensemble du cycle de développement, Participation au développement et intégration des produits électroniques",,,,2025-05-05T21:49:51Z,https://www.adzuna.fr/details/5182094471?utm_medium=api&utm_source=e1ad5111,Emplois Ingénierie,ingénieur logiciel,fr,ingénieur logiciel,standard,False,False
Ingénieur commercial logiciel santé H-F,Axess,"Lyon, Rhône","Pourquoi nous rejoindre ? Vous intégrerez une entreprise experte et ambitieuse où il fait bon travailler, et vous accompagnerez le développement d'un logiciel innovant dans le domaine de la santé. AXESS SOFTWARE est un leader dans le développement et la commercialisation de logiciels dédiés à la santé au travail. Nous proposons des solutions innovantes pour améliorer le bien-être des employés et optimiser la gestion de la santé en entreprise. Dans le cadre de notre expansion, nous recherchons u…",,,,2025-05-05T05:19:30Z,https://www.adzuna.fr/land/ad/5181040130?se=2sFcRWMw8BGvSxMLQyZXLA&utm_medium=api&utm_source=e1ad5111&v=6AF1D25E4C7453C8642A256010BBE3CDA7B3303A,Unknown,ingénieur logiciel,fr,ingénieur logiciel,standard,False,False
Ingénieur Développement Logiciel H/F,Thales Las France Sas,"Saint-Chéron, Etampes","Lieu : Limours, France Construisons ensemble un avenir de confiance Thales est un leader mondial des hautes technologies spécialisé dans trois secteurs d'activité : Défense & Sécurité, Aéronautique & Spatial, et Cyber & Digital. Il développe des produits et solutions qui contribuent à un monde plus sûr, plus respectueux de l'environnement et plus inclusif. Le Groupe investit près de 4 milliards d'Euros par an en Recherche & Développement, notamment dans des domaines clés de l'innovation tels qu…",,,,2025-04-14T06:34:35Z,https://www.adzuna.fr/land/ad/5143816448?se=2sFcRWMw8BGvSxMLQyZXLA&utm_medium=api&utm_source=e1ad5111&v=192F44E6765BD86EB705DDDE9C3581E11560B773,Emplois Autres/Général,ingénieur logiciel,fr,ingénieur logiciel,standard,False,False
Ingénieur Logiciel Embarqué H/F,GYS,"Saint-Berthevin, Laval","Description du poste Rejoignez notre équipe dynamique en tant qu'Ingénieur Logiciel Embarqué F/H ! Vous êtes passionné par l'innovation technologique et souhaitez participer au développement de solutions embarquées à la pointe ? Rejoignez notre bureau d'études composé d'ingénieurs et de techniciens experts, et devenez un acteur clé dans l'évolution de nos projets ! En tant qu'Ingénieur Logiciel Embarqué, vous intégrerez une équipe dynamique de 9 ingénieurs et serez en charge du développement lo…",,,,2025-03-28T08:10:24Z,https://www.adzuna.fr/details/5115400033?utm_medium=api&utm_source=e1ad5111,Emplois Fabrication,ingénieur logiciel,fr,ingénieur logiciel,standard,False,False
CDI - Ingénieur Logiciel H/F,Naval Group,"Six-Fours-les-Plages, Toulon","Naval Group recherche pour son site d'Ollioules, un Ingénieur Logiciel H/F. En interface avec les équipes logiciels et systèmes, vous évoluerez dans un environnement naval. Vous contribuerez, en tant qu'Ingénieur Logiciel à la maintenance corrective et évolutive du système de management de combat sur des bâtiments de surface. A ce titre, vos missions sont les suivantes : Assurer l'ingénierie logiciel d'un ou plusieurs composants : - Vous établissez les notes techniques relatives aux développeme…",,,,2025-05-13T06:44:40Z,https://www.adzuna.fr/details/5195840995?utm_medium=api&utm_source=e1ad5111,Unknown,ingénieur logiciel,fr,ingénieur logiciel,standard,False,False
Ingénieur Logiciel Naval H/F,Exail,"Tréguier, Lannion","Nous recherchons un Ingénieur Logiciel Naval passionné et expérimenté, prêt à contribuer à la conception de solutions logicielles de haute qualité pour des projets stratégiques dans le domaine naval. Vous prendrez part au développement de projets logiciels complexes dans le cadre de solutions de simulation navale. Vos missions : - Analyser et comprendre les spécifications techniques des éléments à simuler ainsi que les contraintes de la simulation - Spécifier, concevoir et développer des modèle…",,,,2025-04-01T04:20:40Z,https://www.adzuna.fr/details/5120682856?utm_medium=api&utm_source=e1ad5111,Emplois Fabrication,ingénieur logiciel,fr,ingénieur logiciel,standard,False,False
Ingénieur Logiciel Embarqué H/F,DLSI France,"Villebon-sur-Yvette, Palaiseau","Le Groupe DLSI et son agence d'Orsay recrutent pour un de leurs clients, un Ingénieur logiciel embarqué (h/f)- Procède à l'analyse du besoin, et rédige les spécifications des développements logiciels - Prend en charge la conception, le développement, le codage et la validation d'applications et de drivers - Rédige la documentation et constitue le dossier technique associé (INS, DMS, VER) - Assiste les chargés d'affaires sur la rédaction du cahier de procédures et cahier de résultats d'acceptati…",40000,50000,,2025-04-17T04:51:55Z,https://www.adzuna.fr/details/5148759516?utm_medium=api&utm_source=e1ad5111,Unknown,ingénieur logiciel,fr,ingénieur logiciel,standard,False,False
Ingénieur Logiciel Java H/F,Inetum,"Antibes-Biot, Grasse","Nous recherchons un Ingénieur Logiciel Java expérimenté pour rejoindre notre équipe à Sophia Antipolis. Dans ce rôle, vous contribuerez à développer des solutions innovantes pour la recherche et la tarification des voyages, un secteur en constante évolution. Vos missions : Concevoir et implémenter de nouvelles fonctionnalités Mettre en place des tests automatisés Collaborer avec les équipes QA, PO et les leaders SAFe Assurer l'évolution durable de l'architecture logicielle Produire la documenta…",,,,2025-02-04T19:45:15Z,https://www.adzuna.fr/details/5037180451?utm_medium=api&utm_source=e1ad5111,Unknown,ingénieur logiciel,fr,ingénieur logiciel,standard,False,False
Ingénieur Logiciel Embarqué F/H,GYS,"Saint-Berthevin, Laval","L'entreprise GYS est un groupe familial français en croissance, regroupant actuellement plus de 900 collaborateurs dans le monde. Fort d'un centre de recherche de premier plan, GYS est un acteur majeur dans la conception et la fabrication d’équipements de soudage, de chargeurs de batteries et de systèmes de réparation de carrosserie automobile. Description du poste Rejoignez notre équipe dynamique en tant qu' Ingénieur Logiciel Embarqué F/H  Vous êtes passionné par l’innovation technologique et…",,,,2025-03-31T20:48:12Z,https://www.adzuna.fr/details/5120310415?utm_medium=api&utm_source=e1ad5111,Emplois RH et Recrutement,ingénieur logiciel,fr,ingénieur logiciel,standard,False,False
Ingénieur Logiciel Embarqué H/F,L'Recrute,"Mantes-la-Ville, Mantes-la-Jolie","L'Recrute, cabinet de recrutement généraliste, recrute pour son client, spécialiste de la fabrication de cartes électroniques et l'industrialisation de produits électroniques, leur futur Ingénieur logiciel embarqué H/F/X. A PROPOS DU POSTE Rattaché(e) au Directeur du BE, vous serez en charge de concevoir des cartes électroniques et de développer des logiciels embarqués dans les produits dans le domaine de la sécurité et du contrôle d'accès. Pour ce faire, vous avez notamment pour missions princ…",47000,52000,,2025-04-29T07:50:35Z,https://www.adzuna.fr/details/5168024037?utm_medium=api&utm_source=e1ad5111,Emplois Autres/Général,ingénieur logiciel,fr,ingénieur logiciel,standard,False,False
Ingénieur Logiciel Embarqué H/F,SOLUXAN,"Saint-Etienne-Nord-Ouest-2, Saint-Etienne","Tu es Ingénieur Logiciel Embarqué H/F ? Nous avons une opportunité d'emploi chez un de nos clients à Saint-Etienne pour du traitement de signal. Missions Au sein du département R&D de notre client, tu auras des missions enrichissantes, plus particulièrement : - Tu seras amené(e) à réaliser l'analyse, la conception, le développement et la mise au point de fonctions logicielles pour les instruments de mesures optiques. - Tu seras en charge du développement logiciel en C/C++ dans un environnement …",,,,2025-02-04T19:44:41Z,https://www.adzuna.fr/details/5037171735?utm_medium=api&utm_source=e1ad5111,Emplois Informatique,ingénieur logiciel,fr,ingénieur logiciel,standard,False,False
Ingénieur logiciel embarqué H/F,L'Recrute,"Mantes-la-Ville, Mantes-la-Jolie","L'Recrute, cabinet de recrutement généraliste, recrute pour son client, spécialiste de la fabrication de cartes électroniques et l'industrialisation de produits électroniques, leur futur Ingénieur logiciel embarqué H/F/X. A PROPOS DU POSTE Rattaché(e) au Directeur du BE, vous serez en charge de concevoir des cartes électroniques et de développer des logiciels embarqués dans les produits dans le domaine de la sécurité et du contrôle d'accès. Pour ce faire, vous avez notamment pour missions princ…",47000,52000,,2025-04-29T08:00:18Z,https://www.adzuna.fr/details/5168038858?utm_medium=api&utm_source=e1ad5111,Emplois Ingénierie,ingénieur logiciel,fr,ingénieur logiciel,standard,False,False
