title,company,location,description,salary_min,salary_max,contract_type,created,redirect_url,category,specialty
Accounting Technician,e-Careers Limited,"Glasgow, Scotland",Take your first steps towards a new and exciting career in the Accounting industry. e-Careers is a dynamic and forward-thinking training company that is dedicated to changing lives through innovative training solutions. The market is facing a severe skills shortage for newly trained accounting and finance personnel. e-Careers will provide you with the training and help you get AAT certified before matching you to an employer where you will undergo a remote work experience programme. If successf…,25000,35000,,2024-10-09T16:02:31Z,https://www.adzuna.co.uk/jobs/details/4895781489?utm_medium=api&utm_source=e1ad5111,Accounting & Finance Jobs,accounting
Director of Accounting,Robert Half,"Manchester, Greater Manchester","This US headquartered global entertainment company is seeking to appoint a Director of Accounting to join the finance team in Manchester. The business has a growing omni-channel presence and this is a key role reporting into the VP of finance for its digital business. This role requires a strategic thinker with strong leadership skills and a deep understanding of financial principles and accounting standards.You will be a technically strong qualified ACA, ACCA or CIMA accountant. Key responsibi…",90000,104000,permanent,2025-04-18T06:53:38Z,https://www.adzuna.co.uk/jobs/details/5151171517?utm_medium=api&utm_source=e1ad5111,Accounting & Finance Jobs,accounting
Accounting Intern,The Opportunity Hub UK,"London, UK","Graduate Accounting Intern (12 month internship) Salary between £25k - £30k, Graduate opportunity with an ASAP start date. A prominent European mid-market value investment firm with a robust legacy in the DACH and Nordic regions, is currently seeking an Accounting Intern. Operating with offices in all over Europe and in China our client stands out for its sector specialisation and a diverse team of over 350 professionals. People First Success here is propelled by highly diverse, solutions-orien…",25000,30000,permanent,2025-04-15T13:19:12Z,https://www.adzuna.co.uk/jobs/details/5145644942?utm_medium=api&utm_source=e1ad5111,Accounting & Finance Jobs,accounting
Accounting Assistant,Rise Technical Recruitment Limited,"Basingstoke, Hampshire","Accounting Assistant Basingstoke - Office based £25,000- £31,000  Pension  Holiday  Private Healthcare Are you an Accounting assistant/Bookkeeper looking to move to a new company where you will be technically challenged and have scope to progress your career with a growing company? Join this dynamic team as a n Accounting assistant You will be working on the company's Invoices, budgeting, financial planning, and analysis. Elevate your career by joining a growing team providing opportunities to …",30000,30000,permanent,2025-04-04T09:46:16Z,https://www.adzuna.co.uk/jobs/details/5128835334?utm_medium=api&utm_source=e1ad5111,Accounting & Finance Jobs,accounting
Accounting Technician,SF Recruitment,"Nottingham, Nottinghamshire","ACCOUNTING TECHNICIAN £27,000 PA FULL TIME, PERMANENT NOTTINGHAM CITY CENTRE, NG1 SF Recruitment are currently recruiting for an Accounting Technician to join their clients city centre based team in Nottingham. This role is full time, permanent and is fully office based. Responsibilities to include: - Implementing budgets on the accounting system - Preparation of accounting pack to send to auditors - Utility recharging - Posting cash daily - Bank reconciliations - Transfers at the bank (all ban…",27000,27000,permanent,2025-03-25T16:49:50Z,https://www.adzuna.co.uk/jobs/details/5110650453?utm_medium=api&utm_source=e1ad5111,Accounting & Finance Jobs,accounting
Accounting Technician,SF Recruitment,"Bestwood Village, Nottingham","ACCOUNTING TECHNICIAN £27,000 PA FULL TIME, PERMANENT NOTTINGHAM CITY CENTRE, NG1 SF Recruitment are currently recruiting for an Accounting Technician to join their clients city centre based team in Nottingham. This role is full time, permanent and is fully office based. Responsibilities to include: - Implementing budgets on the accounting system - Preparation of accounting pack to send to auditors - Utility recharging - Posting cash daily - Bank reconciliations - Transfers at the bank (all ban…",27000,27000,permanent,2025-03-25T19:37:04Z,https://www.adzuna.co.uk/jobs/details/5111206036?utm_medium=api&utm_source=e1ad5111,Accounting & Finance Jobs,accounting
Accounting Technician,REED Specialist Recruitment,"Belfast, Northern Ireland",Practice Accounting Technician- Belfast Reed Accountancy is delighted to be working with a highly successful and prestigious Accountancy Practice based in Belfast. Our client has an exciting new opportunity for an experienced Accounting Technician to join their supportive and dynamic team. This is an excellent opportunity for an individual who is keen to develop their skill-set and purse a chartered career with the support of their senior staff. Duties & Responsibilities Assist in the preparati…,28000,28000,,2025-04-11T04:50:28Z,https://www.adzuna.co.uk/jobs/land/ad/5139974091?se=8i4mOzEe8BGla2k9OSZXLA&utm_medium=api&utm_source=e1ad5111&v=DD10150995A17E34E6803FA7DC7359012B2B973E,Accounting & Finance Jobs,accounting
Accounting Manager,Direct Test Account 4/02,"Fulford, York","Job Title: Accounting Manager Company: Direct Test Account 4/02.inen We are seeking a highly skilled and experienced Accounting Manager to join our team at Direct Test Account 4/02.inen. As the Accounting Manager, you will be responsible for managing the financial operations of our company and ensuring the accuracy and timeliness of all financial reporting. You will play a crucial role in ensuring our company’s financial success and will have the opportunity to make a significant impact on our …",8840,9100,,2025-04-02T07:21:32Z,https://www.adzuna.co.uk/jobs/details/5123638050?utm_medium=api&utm_source=e1ad5111,Accounting & Finance Jobs,accounting
Accounting Manager,CBRE,UK,"Accounting Manager Job ID 206106 Posted 12-Mar-2025 Service line Advisory Segment Role type Full-time Areas of Interest Accounting/Finance Location(s) Glasgow - Scotland - United Kingdom of Great Britain and Northern Ireland Accounting Manager - IA&R We are seeking an experienced Accounting Manager to join our General Accounting team, where you will be responsible for delivering high-quality services to a portfolio of clients. As a key member of our team, you will play a vital role in shaping o…",53801.82,53801.82,,2025-02-26T11:08:39Z,https://www.adzuna.co.uk/jobs/details/5064170697?utm_medium=api&utm_source=e1ad5111,Accounting & Finance Jobs,accounting
Accounting Manager,Shionogi Europe,"London, UK","Description About Us At Shionogi, we are dedicated to improving global health and well-being. As a leading pharmaceutical company, we are committed to innovation, excellence, and making a positive impact on healthcare worldwide. Join us in our mission to shape the future of healthcare and make a difference in the lives of millions. Why Choose Shionogi Shionogi offers a dynamic, collaborative work environment where you can grow your career and contribute to groundbreaking healthcare advancements…",51015.64,51015.64,,2025-03-18T17:09:47Z,https://www.adzuna.co.uk/jobs/details/5099194936?utm_medium=api&utm_source=e1ad5111,Accounting & Finance Jobs,accounting
Accounting Technician,Reed,"County Antrim, Northern Ireland",Practice Accounting Technician- Belfast Reed Accountancy is delighted to be working with a highly successful and prestigious Accountancy Practice based in Belfast. Our client has an exciting new opportunity for an experienced Accounting Technician to join their supportive and dynamic team. This is an excellent opportunity for an individual who is keen to develop their skill-set and purse a chartered career with the support of their senior staff. Duties & Responsibilities Assist in the preparati…,24000,28000,permanent,2025-04-10T17:01:29Z,https://www.adzuna.co.uk/jobs/details/5138936913?utm_medium=api&utm_source=e1ad5111,Accounting & Finance Jobs,accounting
Director of Accounting,Aristocrat Tech Europe P/L,"London, UK","Aristocrat is a highly successful business delivering Class III and Class II gaming machines across the EMEA region. As the Director of Accounting - Gaming, this senior finance role is responsible for the delivery of accurate and timely accounting and reporting services for the EMEA region. This role will lead the UK based accounting team and partner with finance leaders across the business. This role is responsible for all financial areas in relation to accounting and reporting for EMEA. This …",80640.34,80640.34,,2025-02-19T14:48:49Z,https://www.adzuna.co.uk/jobs/details/5056359129?utm_medium=api&utm_source=e1ad5111,Accounting & Finance Jobs,accounting
Accounting Assistant,Rise Technical Recruitment,"Cliddesden, Basingstoke","Accounting Assistant Basingstoke - Office based £25,000- £31,000  Pension  Holiday  Private Healthcare Are you an Accounting assistant/Bookkeeper looking to move to a new company where you will be technically challenged and have scope to progress your career with a growing company? Join this dynamic team as a n Accounting assistant You will be working on the company's Invoices, budgeting, financial planning, and analysis. Elevate your career by joining a growing team providing opportunities to …",25000,31000,,2025-04-03T21:07:17Z,https://www.adzuna.co.uk/jobs/details/5127822898?utm_medium=api&utm_source=e1ad5111,Accounting & Finance Jobs,accounting
Accounting Manager,Brook Street,"Kirk Deighton, Wetherby","Accounting Manager Location: Wetherby, United Kingdom Employment Type: Permanent Salary: Competitive, depending on experience We are recruiting on behalf of a Top 20 accountancy and business advisory firm that prides itself on delivering expert financial guidance to SMEs. With a collaborative network of professionals across the UK and Ireland, the firm is committed to providing tailored solutions while supporting employees' career growth. Key Responsibilities: Manage a portfolio of clients, ens…",50000,55000,permanent,2025-03-27T19:49:44Z,https://www.adzuna.co.uk/jobs/details/5114505520?utm_medium=api&utm_source=e1ad5111,Accounting & Finance Jobs,accounting
Accounting Manager,Brook Street UK,"Wetherby, West Yorkshire","Accounting Manager Location: Wetherby, United Kingdom Employment Type: Permanent Salary: Competitive, depending on experience We are recruiting on behalf of a Top 20 accountancy and business advisory firm that prides itself on delivering expert financial guidance to SMEs. With a collaborative network of professionals across the UK and Ireland, the firm is committed to providing tailored solutions while supporting employees' career growth. Key Responsibilities: Manage a portfolio of clients, ens…",55000,55000,permanent,2025-04-04T13:41:42Z,https://www.adzuna.co.uk/jobs/details/5129252531?utm_medium=api&utm_source=e1ad5111,Accounting & Finance Jobs,accounting
Accounting Manager,Brook Street UK,"Wetherby, West Yorkshire","Accounting Manager Location: Wetherby, United Kingdom Employment Type: Permanent Salary: Competitive, depending on experience We are recruiting on behalf of a Top 20 accountancy and business advisory firm that prides itself on delivering expert financial guidance to SMEs. With a collaborative network of professionals across the UK and Ireland, the firm is committed to providing tailored solutions while supporting employees' career growth. Key Responsibilities: Manage a portfolio of clients, ens…",55000,55000,permanent,2025-03-28T05:05:50Z,https://www.adzuna.co.uk/jobs/details/5115227051?utm_medium=api&utm_source=e1ad5111,Accounting & Finance Jobs,accounting
Accounting Manager,HR Dept,"Hugglescote, Coalville","Accounting Manager Coalville, Leicestershire £30,000 - £35,000 You won’t need to worry about stability here You will be part of a company who are a leader in their field and are continuing to rapidly expand. With expansion comes progression and exciting times ahead so if you are after the next step in your career and have a background in accounting, then this is a great opportunity for you Job Overview As the Accounting Manager you will report to the Head of Controlling UK. This is a standalone…",30000,35000,,2025-03-25T13:28:05Z,https://www.adzuna.co.uk/jobs/details/5110216271?utm_medium=api&utm_source=e1ad5111,Accounting & Finance Jobs,accounting
Accounting Manager,Mature Accountants Ltd,"London, UK",Accounting Manager role in a family owned and long established business in the drinks industry. They have a head office in London and sites in Scotland. Turnover is approx. £70m Due to ongoing expansion they now have a requirement for an important role in the Head Office in London for an Accounting Manager . The successful applicant will work with an established and very experienced team. Please note that this role is office based in Central London On offer is a salary of between £60k - £65k de…,65000,65000,,2025-04-18T02:36:00Z,https://www.adzuna.co.uk/jobs/details/5150865687?utm_medium=api&utm_source=e1ad5111,Accounting & Finance Jobs,accounting
Accounting Manager,Mature Accountants ltd,"London, UK",Accounting Manager role in a family owned and long established business in the drinks industry. They have a head office in London and sites in Scotland. Turnover is approx. £70m Due to ongoing expansion they now have a requirement for an important role in the Head Office in London for an Accounting Manager . The successful applicant will work with an established and very experienced team. Please note that this role is office based in Central London On offer is a salary of between £55k - £65k de…,55000,65000,permanent,2025-04-17T19:44:31Z,https://www.adzuna.co.uk/jobs/details/5150228246?utm_medium=api&utm_source=e1ad5111,Accounting & Finance Jobs,accounting
Accounting Manager,Signet Resources,"Wokingham, Berkshire","INTERIM Accounting Manager - established life science business based on the outskirts of Reading is looking for an Interim Accounting Manager for a period of 3-6 months. Key Responsibilities will include Financial Reporting: Oversee the preparation and accuracy of monthly, quarterly, and annual financial statements in accordance with UKGAAP General Ledger Management: Ensure accurate and timely processing of transactions, including journal entries, reconciliations, and accruals. Oversee the gene…",91000,117000,contract,2025-03-27T13:57:30Z,https://www.adzuna.co.uk/jobs/details/5113541295?utm_medium=api&utm_source=e1ad5111,Accounting & Finance Jobs,accounting
Accounting Assistant,Get Staffed Online Recruitment Online Recruitment,"Great Houghton, Northampton","Accounting Assistant - Treasury Contract: Permanent, Full-time ( hours per week), Monday to Friday between 8am and 6pm Location: Hybrid - 3 days per week in the Northampton office, NN4 Salary: £27,000 per annumAs an Accounting Assistant at our client, you will play a vital r",27000,27000,permanent,2025-04-09T15:22:20Z,https://www.adzuna.co.uk/jobs/land/ad/5137191153?se=DDauPDEe8BG-i3PTGXcHCQ&utm_medium=api&utm_source=e1ad5111&v=9915C4A8270609234D6B72E4BEDEB31A3C28253E,Accounting & Finance Jobs,accounting
Accounting Assistant,Medigold Health,"Northampton, Northamptonshire","Accounting Assistant - Treasury Contract: Permanent, Full-time (37.5 hours per week), Monday to Friday between 8am and 6pm Location: Hybrid - 3 days per week in our Northampton office, NN4 Salary: £27,000 per annum As an Accounting Assistant at Medigold Health, you will play a vital role in supporting the day-to-day financial operations of a fast-growing business. Working closely with the wider finance team, you’ll be responsible for reconciling group bank accounts, posting transactions, resolv…",27000,27000,permanent,2025-04-09T17:46:32Z,https://www.adzuna.co.uk/jobs/details/5137301265?utm_medium=api&utm_source=e1ad5111,Accounting & Finance Jobs,accounting
Accounting Assistant,Get Staffed Online Recruitment,"Northampton, Northamptonshire","Accounting Assistant - Treasury Contract: Permanent, Full-time (37.5 hours per week), Monday to Friday between 8am and 6pm Location: Hybrid - 3 days per week in the Northampton office, NN4 Salary: £27,000 per annum As an Accounting Assistant at our client, you will play a vital role in supporting the day-to-day financial operations of a fast-growing business. Working closely with the wider finance team, you'll be responsible for reconciling group bank accounts, posting transactions, resolving c…",26000,26000,permanent,2025-04-09T20:04:59Z,https://www.adzuna.co.uk/jobs/details/5137511434?utm_medium=api&utm_source=e1ad5111,Accounting & Finance Jobs,accounting
"Manager, Accounting",Gen 2 Careers,"Whiteley, Fareham","What you’ll be doing Accounts Review & Preparation Review financial statements for a wide range of client structures and differing complexity to UK GAAP, US GAAP or IFRS standards Prepare & review Net Asset Values Prepare & review quarterly investor financial reporting pack which includes quarterly management accounts and investors’ capital account statements Review a full file of working papers for all financial statements and/or management accounts prepared Liaise with auditors in respect of …",53801.05,53801.05,,2025-03-18T17:10:01Z,https://www.adzuna.co.uk/jobs/details/5099195139?utm_medium=api&utm_source=e1ad5111,Accounting & Finance Jobs,accounting
Accounting Manager,Autograph Recruitment,"Cwmbran, Torfaen","Accounting Manager Location: Cwmbran Salary: Competitive We are seeking an experienced and strategic Accounting Manager to join a growing practice in Cwmbran. This is a hybrid role offering the opportunity to combine flexibility with in-office collaboration, allowing you to lead a high-performing team while providing exceptional service to clients. The Accounting Manager will play a pivotal role in building and maintaining strong client relationships, managing client portfolios, and ensuring th…",53702.17,53702.17,,2025-03-24T17:21:59Z,https://www.adzuna.co.uk/jobs/details/5108969046?utm_medium=api&utm_source=e1ad5111,Accounting & Finance Jobs,accounting
Accounting Manager,Autograph Recruitment,"New Buildings, Sandford","Accounting Manager Location: Crediton | Salary: Competitive DOE | Hybrid Are you a strategic, client-focused accountant looking for a leadership role in a growing practice? As an Accounting Manager, you’ll lead a high-performing team, manage client portfolios, and drive business success—all while enjoying the flexibility of hybrid working. What You’ll Do: Manage and grow a portfolio of clients, ensuring exceptional service and compliance. Build strong relationships with clients, directors, and …",45000,55000,,2025-03-25T19:36:49Z,https://www.adzuna.co.uk/jobs/details/5111205715?utm_medium=api&utm_source=e1ad5111,Accounting & Finance Jobs,accounting
Accounting Manager,Autograph Recruitment Ltd,"Crediton, Devon","Accounting Manager Location: Crediton | Salary: Competitive DOE | Hybrid Are you a strategic, client-focused accountant looking for a leadership role in a growing practice? As an Accounting Manager , you’ll lead a high-performing team, manage client portfolios, and drive business success—all while enjoying the flexibility of hybrid working. What You’ll Do: Manage and grow a portfolio of clients, ensuring exceptional service and compliance. Build strong relationships with clients, directors, and…",45000,55000,permanent,2025-03-25T16:51:15Z,https://www.adzuna.co.uk/jobs/details/5110656472?utm_medium=api&utm_source=e1ad5111,Accounting & Finance Jobs,accounting
Accounting Intern,The Opportunity Hub UK,"London, UK","Graduate Accounting Intern 12 month internship Salary between £25k - £30k, Graduate opportunity with an ASAP start date. A prominent European mid-market value investment firm withGraduate Accounting Intern 12 month internship Salary between £25k - £30k, Graduate opportunity with an ASAP start date. A prominent European mid-market value investment firm with a robust legacy in the DACH and Nordic regions, is currently seeking an Accounting Intern. Operating with offices in all over Europe and in …",25000,30000,permanent,2025-04-18T23:41:42Z,https://www.adzuna.co.uk/jobs/details/5152423267?utm_medium=api&utm_source=e1ad5111,Accounting & Finance Jobs,accounting
Accounting Assistant,EMBASSY OF PERU IN THE UNITED KINGDOM AND NORTHERN IRELAND,"London, UK","We are looking for an Accounting Assistant looking to make the next step in their career We want a candidate to join our team on a permanent basis to support the Deputy Head of Mission in maintaining accurate and up to date accounts for the Embassy of Peru in the UK. Key responsibilities: - Monitoring spending and budgets - Assist with coordination of internal and external communications - Auditing and analysing financial performance - Processing transactions including receipts and payments, in…",30816.69,30816.69,permanent,2023-12-28T17:21:14Z,https://www.adzuna.co.uk/jobs/details/4500004239?utm_medium=api&utm_source=e1ad5111,Accounting & Finance Jobs,accounting
Accounting Manager,Gensler,"London, UK","Your Role As a Gensler Accounting Manager , you will be responsible for supervising the Europe regional Accounts Payable function and assist the Regional Finance Director with cash management, budgets and P&L. Your success lies in being highly organised, data-driven, and passionate about delivering a high degree of customer service to meet the needs of internal customers and business partners. You will work with a team of collaborative colleagues as well as partner with the Regional Finance Dir…",56595.44,56595.44,,2025-01-16T12:27:02Z,https://www.adzuna.co.uk/jobs/details/5013051165?utm_medium=api&utm_source=e1ad5111,Accounting & Finance Jobs,accounting
Accounting Technician,i-Jobs,"Hilsea, Portsmouth","Job Opportunity: Accounting Technician Location: Civic Offices, PO1 2AL Start date: 05/05/2025 Contract duration: 6 months Working hours: Mon - Fri, 09:00 - 17:00, 37 hours per week Pay rate: £18.28 per hour PAYE About the role: Supporting budget preparation, forecasting and monthly financial monitoring. Producing final accounts and statutory financial statements. Developing and maintaining financial models. Supporting project appraisals and funding returns. Deputising for the Senior Accountant…",38022,42619,contract,2025-04-17T20:54:17Z,https://www.adzuna.co.uk/jobs/details/5150526820?utm_medium=api&utm_source=e1ad5111,Accounting & Finance Jobs,accounting
Accounting Manager,TC-Group,UK,"Salary – £32,000 - £37,000 per annum, dependant on experience  study support package Hours - Monday to Friday, 35 hours per week with flexible working hours and hybrid working on completion of probation Holiday – 25 days annual leave (excluding bank holidays) About the Accounting Manager role We are TC Group, the fastest-growing top 25 accountancy firm in the UK. We’re business advisors and accountants, with over 30 years of experience we’ve honed our skills and developed our service offering t…",32000,37000,,2025-04-14T09:16:14Z,https://www.adzuna.co.uk/jobs/details/5143979453?utm_medium=api&utm_source=e1ad5111,Accounting & Finance Jobs,accounting
Accounting Intern,The Opportunity Hub UK,"Central London, London","Accounting Intern (12 month internship) A prominent European mid-market value investment firm with a robust legacy in the DACH and Nordic regions, is currently seeking an Accounting Intern. Operating with offices in all over Europe and in China our client stands out for its sector specialisation and a diverse team of over 350 professionals. This is a 12 month internship, Salary between £25k - £30k, Graduate opportunity with an ASAP start date. People First Success here is propelled by highly di…",25000,30000,contract,2025-04-15T11:43:22Z,https://www.adzuna.co.uk/jobs/details/5145484717?utm_medium=api&utm_source=e1ad5111,Accounting & Finance Jobs,accounting
Accounting Intern,The Opportunity Hub UK,"Central London, London","Accounting Intern 12 month internshipA prominent European mid-market value investment firm with a robust legacy in the DACH and Nordic regions, is currently seekingAccounting Intern 12 month internshipA prominent European mid-market value investment firm with a robust legacy in the DACH and Nordic regions, is currently seeking an Accounting Intern. Operating with offices in all over Europe and in China our client stands out for its sector specialisation and a diverse team of over 350 profession…",25000,30000,permanent,2025-04-18T23:41:51Z,https://www.adzuna.co.uk/jobs/details/5152423557?utm_medium=api&utm_source=e1ad5111,Accounting & Finance Jobs,accounting
Accounting Manager,TC Group,"Stanley, County Durham","Salary – £32,000 - £37,000 per annum, dependant on experience  study support package Hours - Monday to Friday, 35 hours per week with flexible working hours and hybrid working on completion of probation Holiday – 25 days annual leave (excluding bank holidays) About the Accounting Manager role We are TC Group, the fastest-growing top 25 accountancy firm in the UK. We’re business advisors and accountants, with over 30 years of experience we’ve honed our skills and developed our service offering t…",32000,37000,permanent,2025-04-16T13:07:05Z,https://www.adzuna.co.uk/jobs/details/5147320654?utm_medium=api&utm_source=e1ad5111,Accounting & Finance Jobs,accounting
