title,company,location,description,salary_min,salary_max,contract_type,created,redirect_url,category,country,specialty
Business Developper H/F,OUIHELP,"Argonay, Annecy","Directement rattaché(e) à Lionel Sales manager et sous le pilotage de Pauline Directrice réseau, votre rôle sera de sensibiliser les professionnels de santé et essentiellement le secteur hospitalier sur le secteur de Chambéry et Annecy, aux problématiques liées au maintien à domicile de personnes en perte d'autonomie (assistantes sociales). Votre Mission : Votre mission est d'accompagner les acteurs de santé du secteur public, semi-public et privé dans la gestion des sorties d'hospitalisation e…",,,,2025-02-21T07:31:22Z,https://www.adzuna.fr/land/ad/5058487570?se=ArrYvS4e8BG-i3PTGXcHCQ&utm_medium=api&utm_source=e1ad5111&v=2CF7CCE7D00A9E16FBCC730979FAE253B61A86F3,Emplois Autres/Général,fr,ingenierie_informatique
Lead Developer,NW,"Paris, Ile-de-France","Type de contrat : CDI Localisation : Paris, 7ème (présentiel) Date de début : dès que possible Expérience requise : 4 à 5 ans d’expérience A propos de NW NW vise à rendre la transition énergétique accessible à tous. Depuis 2007, le groupe déploie des solutions innovantes pour augmenter la part des énergies décarbonées dans le mix électrique français, soutenir la stabilité du réseau électrique et contribuer au développement de la mobilité électrique. Première licorne française de la transition é…",,,,2025-04-01T10:05:27Z,https://www.adzuna.fr/land/ad/5121030404?se=ArrYvS4e8BG-i3PTGXcHCQ&utm_medium=api&utm_source=e1ad5111&v=090ECEBD5B52D2896A0E725B6CA6E08A7CCFDFD2,Unknown,fr,ingenierie_informatique
JAVA Developer,Sogeti,France,"Chez Sogeti, la technologie coule dans nos veines. C’est cet intérêt pour la technologie qui nous guide au quotidien et qui est reflété dans notre slogan « Made In Tech ». Grâce à notre passion commune pour la technologie, à notre culture entrepreneuriale et à l'importance que nous accordons à la formation continue, nous mettrons tout en œuvre pour vous accompagner à libérer votre plein potentiel. VOS MISSIONS En tant que Développeur JAVA, vous participerez au développement de notre activité et…",,,,2025-04-01T10:03:38Z,https://www.adzuna.fr/land/ad/5121026174?se=ArrYvS4e8BG-i3PTGXcHCQ&utm_medium=api&utm_source=e1ad5111&v=CFDD7A24CD80669C20DDE3A3B459C7B9A5D6E798,Unknown,fr,ingenierie_informatique
Job in Germany: Software Developer/Programmer (m/f/d),Bildung und Chancen im Kreis Gütersloh gGmbH,France,"Software Developer/Programmer (m/f/d) The Center for Education and Opportunities (gGmbH) pursues the goal of promoting the educational opportunities of children and young people in the Gütersloh district so that they become more independent of their background or social situation. To this end, we are already implementing projects for elementary school. In the future, projects for daycare centers will also be developed and tested in three municipalities in the Gütersloh district. We are looking …",,,,2025-04-18T06:46:35Z,https://www.adzuna.fr/land/ad/5151053134?se=ArrYvS4e8BG-i3PTGXcHCQ&utm_medium=api&utm_source=e1ad5111&v=FE339EB2555946FFBA80CAEC90BCE53AF733AC52,Unknown,fr,ingenierie_informatique
Java Developer,Stott and May,"Strasbourg, Strasbourg-Ville","Java Developer | €350-€450 per day | Strasbourg, France | 1 year contract Role: Java Developer Day Rate: €350-€450 per day Type: Contract Location: Strasbourg, France (5 days per week) Stott and May are partnered with a European Union Agency who are looking for 5-10 Java Developers to design, develop, and deploy enterprise-level applications. This will be a renewable 1 year contract and you will be required to be on site 5 days per week in Strasborg. Technical Skills: Programming: Java Database…",,,,2025-04-01T10:05:27Z,https://www.adzuna.fr/land/ad/5121030401?se=ArrYvS4e8BG-i3PTGXcHCQ&utm_medium=api&utm_source=e1ad5111&v=B1DD1708052356B1F5C544AAD3DF13874B73BAB4,Unknown,fr,ingenierie_informatique
Storage Developer,OVHcloud,France,"Poste basé à Rennes ou dans un de nos 7 autres bureaux en France. OVHcloud Vous voulez contribuer à des projets uniques pour construire ensemble le cloud libre ? Allons-y Chez OVHcloud, nous sommes animés par la même volonté, celle de construire l’avenir ensemble pour défendre la liberté d’innover. Avec plus d'1,6 millions de clients dans le Monde, OVHcloud est le leader Européen du cloud computing et le 3ème hébergeur Internet au rang mondial. Notre entreprise emploie plus de 2800 collaborateu…",,,,2025-03-19T03:14:34Z,https://www.adzuna.fr/land/ad/5100159422?se=ArrYvS4e8BG-i3PTGXcHCQ&utm_medium=api&utm_source=e1ad5111&v=ABA70D9EFF74ED6C0BF3D70A95F80EA8BA3252DD,Emplois Informatique,fr,ingenierie_informatique
Software Developer,FIME,"Caen, Calvados","Software Developer (F/M/D) Company: Fime enables its clients to create and launch trusted and secure solutions with consulting, test tools and testing services across payments, smart mobility, and digital identity. With 900 experts around the world in over 20 locations, Fime is a multi-cultural global leading player in its industry. Inspired by our talented people, we are empowered to take ownership and innovate for the benefit of our clients. Employee growth is therefore our priority, and we d…",,,,2025-04-11T05:27:59Z,https://www.adzuna.fr/land/ad/5139962186?se=ArrYvS4e8BG-i3PTGXcHCQ&utm_medium=api&utm_source=e1ad5111&v=DD9A272608B9D76E21D6A923C993F36A6602BF13,Unknown,fr,ingenierie_informatique
Alliance Developer,Creditsafe,"Lille, Nord","Envie de booster les Alliances Stratégiques chez Creditsafe ? Creditsafe est un leader mondial des solutions d'information commerciale, reconnu pour fournir des données fiables et innovantes aux entreprises de toutes tailles. Présents dans plus de 14 pays, nous avons pour mission de simplifier la gestion des risques financiers grâce à des outils performants et accessibles. Notre croissance repose sur un écosystème de partenaires stratégiques et, aujourd’hui, les alliances technologiques représ…",,,,2025-04-03T08:04:01Z,https://www.adzuna.fr/land/ad/5125963969?se=ArrYvS4e8BG-i3PTGXcHCQ&utm_medium=api&utm_source=e1ad5111&v=0848B33B500C05845DD3426D678021526C492959,Emplois Informatique,fr,ingenierie_informatique
Chargé de Développement H/F,Coopérative U,"Sainte-Luce-sur-Loire, Nantes","Vous avez envie de vous challenger, être partie prenante dans notre développement de magasins ? Vous aimez convaincre, défendre votre point de vue, négocier, être sur le terrain et développer vos relations ? Vous serez, sur le métier que nous vous proposons, l'interlocuteur(trice) privilégié(e) de divers groupes d'intérêts en lien avec vos missions (acteurs économiques locaux, politiques, commerçants, propriétaires de magasins). Vous assurez le suivi du parc magasins de votre secteur et garanti…",,,,2025-03-26T08:33:37Z,https://www.adzuna.fr/land/ad/5111973194?se=ArrYvS4e8BG-i3PTGXcHCQ&utm_medium=api&utm_source=e1ad5111&v=17919172999D6A04D9F9DEE917936886047E378F,Emplois Vente,fr,ingenierie_informatique
Chargé du Développement H/F,AMISdesSENIORS,France,"Je vous propose de développer dans votre ville, Si possible en liaison avec l'association locale des commerçants leur un outil de communication et beaucoup plus https://votrevilleSHOPPING.fr Je le personnaliserai au nom de votre ville Vous seriez l'agence de com et l'animateur de l'association des commerçants de votre ville En cette veille d'élection municipale, Il est important que les commerçants deviennent une force dans leur ville 1) Prenez contact avec le président de l'association des com…",30000,50000,,2025-03-23T06:48:17Z,https://www.adzuna.fr/land/ad/5107325910?se=ArrYvS4e8BG-i3PTGXcHCQ&utm_medium=api&utm_source=e1ad5111&v=6EA5A94434F7C1A7297CE055E61E22896B1BFF30,Emplois Autres/Général,fr,ingenierie_informatique
Chargé de Développement H/F,Electricité de Strasbourg,"Vendenheim, Strasbourg","Envie d'être acteur de la transition énergétique en participant à votre niveau à des projets d'envergure dans le domaine des énergies renouvelables ? Vous voulez mettre à profit vos compétences en électricité et votre sens de l'organisation et de l'anticipation ? Vous êtes reconnu pour votre autonomie, votre esprit d'équipe et votre adaptabilité ? Ce poste est fait pour vous  MISSIONS Intégré au sein de Planigy par ÉS, vous devenez notre chargé de développement. Vous êtes un rouage essentiel de…",,,,2025-02-22T05:26:44Z,https://www.adzuna.fr/land/ad/5060113825?se=ArrYvS4e8BG-i3PTGXcHCQ&utm_medium=api&utm_source=e1ad5111&v=737EA80F13E0AA8DEB9B69993F5D5A6D3ED6EE62,Unknown,fr,ingenierie_informatique
Responsable Développement H/F,Dachser France,"Salon-de-Provence, Aix-en-Provence","Poste à pourvoir en CDI. La diversité de nos offres associée à la haute qualité de prestations ainsi que notre réseau intégré, l'un des plus importants en Europe, font de Dachser un acteur reconnu. Composées d'experts, nos équipes commerciales conçoivent et organisent des solutions adaptées aux problématiques les plus complexes et exigeantes de chacun de nos clients. Vous souhaitez apporter aux clients les meilleures solutions ? Au sein de notre agence de Salon de Provence spécialisée dans le t…",,,,2025-02-04T20:21:35Z,https://www.adzuna.fr/land/ad/5037576152?se=ArrYvS4e8BG-i3PTGXcHCQ&utm_medium=api&utm_source=e1ad5111&v=E8EC8C7CF139F8C7EE5863A0BEEA3AF8A90BEB8E,Unknown,fr,ingenierie_informatique
Responsable développement / Business Developer,TEMPORIS,"Alès, Gard","Temporis Alès, révélateur de talents et partenaire de votre évolution professionnelle, recherche pour l'un de ses clients un·e Business Developer Junior H/F, dans le cadre du développement de son activité dans les secteurs du workplace et de l'hospitality. Notre client est une entreprise innovante, experte dans l'aménagement d'espaces de travail et d'accueil, en pleine croissance et en recherche constante de nouveaux challenges  Vos missions principales : Vous intégrez une équipe dynamique où v…",,,permanent,2025-04-18T14:30:41Z,https://www.adzuna.fr/land/ad/5151611077?se=ArrYvS4e8BG-i3PTGXcHCQ&utm_medium=api&utm_source=e1ad5111&v=6F50680828EA4CF878B3C7AA9AB3C68AE3632F59,Unknown,fr,ingenierie_informatique
Senior Developer,Albert Bow,"Paris, Ile-de-France","I am currently partnered with a fintech trading firm who specialise in electronic trading across multi-assets including digital. Looking for a Senior Developer, the role will be based in either Paris, Rennes, or Nantes and will offer hybrid working. Responsibilities : Develop and maintain code - primarily in Java International collaboration Providing technical expertise Innovate and design new solutions Requirements : Java is essential Knowledge or interest in Scala, Docker, SQL Typescript Aero…",,,,2025-01-26T05:48:04Z,https://www.adzuna.fr/land/ad/5024434986?se=ArrYvS4e8BG-i3PTGXcHCQ&utm_medium=api&utm_source=e1ad5111&v=52543DFE4DFE0B0193183A7073942EDBB62F1034,Emplois Comptabilité et Finance,fr,ingenierie_informatique
Business Developer H/F,Walter Learning,"Bouches-du-Rhône, Provence-Alpes-Côte d'Azur","Vous souhaitez intégrer une entreprise en pleine croissance en développant vos compétences commerciales ? En rejoignant Walter Learning, vous aurez l'opportunité de travailler dans une équipe commerciale structurée et un environnement bienveillant. Vous serez challengé.e avec des défis commerciaux et pourrez rapidement monter en compétences à l'aide de votre manager de proximité. La vente par téléphone n'aura plus de secret pour vous : véritable école de vente, vous deviendrez un expert des ven…",27000,40000,,2025-02-04T20:21:22Z,https://www.adzuna.fr/land/ad/5037572583?se=ArrYvS4e8BG-i3PTGXcHCQ&utm_medium=api&utm_source=e1ad5111&v=2B4AD68BAA467609DFA7A98938C4343653FE09BA,Emplois Enseignement,fr,ingenierie_informatique
Charge de Developpement H/F,EPSI,"Rhône, Auvergne-Rhône-Alpes","Au sein de l'équipe commerciale de Lyon, vous commercialiserez l'ensemble des formations et services associés de l'école par tous les moyens de promotion (journées portes ouvertes, salons, présentations dans les établissements de formation) dans le respect du parcours client. Concrètement, quelles seront vos missions ? Réaliser une veille concurrentielle et économique, Participer à l'élaboration du Plan d'Action Commercial jeunes, à l'élaboration et au respect du budget nécessaire à sa réalisat…",,,,2025-04-05T04:24:25Z,https://www.adzuna.fr/land/ad/5130515150?se=ArrYvS4e8BG-i3PTGXcHCQ&utm_medium=api&utm_source=e1ad5111&v=B36E474E0E03FC92E81B20E81C5E437B2F1CBAD3,Emplois Enseignement,fr,ingenierie_informatique
Job in Germany: Software Developer / RPG Programmer - IBM i (m/f/d),Sauerländer Spanplatten GmbH & Co. KG,France,"We are a manufacturer of special materials for the door industry. Since its foundation in 1951, our owner-managed company has enjoyed continuous growth thanks to its outstanding market position and today employs a total of 420 people in Arnsberg and Gotha as an industry leader with a high export share. SAUERLAND Spanplatte uses its own ERP system based on AS/400 RPG programming. We would like to support the existing IT team with an ambitious developer (m/f/d) who internalizes our company proces…",,,,2025-04-15T06:38:43Z,https://www.adzuna.fr/land/ad/5145057322?se=ArrYvS4e8BG-i3PTGXcHCQ&utm_medium=api&utm_source=e1ad5111&v=8E953E37EDB9C395EFD82B53BD9A206CE8102823,Unknown,fr,ingenierie_informatique
Job in Germany: ERP Application Developer for Microsoft Systems (m/f/d),Burghardt+Schmidt GmbH,France,"ERP application developer for Microsoft systems (m/f/d) Permanent position Remchingen Wanted immediately (permanent) 40 h per week Your tasks: Adaptation, optimization and further development of the abas ERP system according to operational requirements Creation and maintenance of scripts, reports and interfaces in the ERP system. Implementation of business processes in abas. Close cooperation with the specialist departments to identify and implement lT solutions. Support with rollouts and the i…",,,,2025-04-12T06:33:36Z,https://www.adzuna.fr/land/ad/5141689103?se=ArrYvS4e8BG-i3PTGXcHCQ&utm_medium=api&utm_source=e1ad5111&v=3C5F666639DAEBDF9EA1542E943E1A7F038A128C,Unknown,fr,ingenierie_informatique
Responsable du développement immobilier,Aspen RH,"Paris, Ile-de-France","Aspen RH, cabinet de conseil en recrutement de cadres et de dirigeants, recrute pour l'un de ses clients, (distribution alimentaire spécialisée, snacking et boulangerie / pâtisserie), sa/son : Responsable du développement immobilier « Île-de-France » Vous reportez au Directeur de l’expansion, vos principales missions sont la recherche d’emplacements afin de déployer le réseau des points de vente en Île-de-France et de veiller également à la rentabilité économique des emplacements trouvés. Pour …",,,,2025-04-12T06:07:37Z,https://www.adzuna.fr/land/ad/5141658924?se=-uKDvy4e8BGla2k9OSZXLA&utm_medium=api&utm_source=e1ad5111&v=DAB394A0DC260E53458F85654A7CC6A6F5D7D655,Unknown,fr,ingenierie_informatique
Responsable Développement H/F,Dachser France,"Villecresnes, Créteil","Poste à pourvoir en CDI. La diversité de nos offres associée à la haute qualité de prestations ainsi que notre réseau intégré, l'un des plus importants en Europe, font de Dachser un acteur reconnu. Composées d'experts, nos équipes commerciales conçoivent et organisent des solutions adaptées aux problématiques les plus complexes et exigeantes de chacun de nos clients. Vous souhaitez apporter aux clients les meilleures solutions ? Au sein de notre agence de Santeny (94) spécialisée dans le transp…",,,,2025-02-04T20:21:11Z,https://www.adzuna.fr/land/ad/5037568529?se=-uKDvy4e8BGla2k9OSZXLA&utm_medium=api&utm_source=e1ad5111&v=8E647782CDE8FF30D2C651DB26E0806450217D6D,Unknown,fr,ingenierie_informatique
Chargé de Développement H/F,GROUPE PARERA,"Malzéville, Nancy","- Prospection des cibles couvrant l'ensemble des métiers du Groupe ; - Développement du portefeuille clients selon la stratégie de développement fixée par la Direction ; - Recherche de partenaires, de cotraitance ou sous-traitance ; - Identification de projets, obtention de cahiers des charges ; - Recherche de solutions adaptées avec un appui des experts métiers du Groupe ; - Participation à la réponse aux consultations, devis et appels d'offres ; - Animation de la représentation du Groupe sur …",36000,40000,,2025-04-08T04:29:05Z,https://www.adzuna.fr/land/ad/5134666727?se=-uKDvy4e8BGla2k9OSZXLA&utm_medium=api&utm_source=e1ad5111&v=597A69389D2AF2AC6652E815F77883AC86115C38,Unknown,fr,ingenierie_informatique
Chargé de Développement H/F,Cogedis,"Champagne-au-Mont-d'Or, Lyon","Votre métier : Vous commercialisez, dans le cadre d'une approche globale, les produits et services du groupe COGEDIS (Conseil aux entreprises : Comptabilité, social, stratégie, gestion de patrimoine) afin d'optimiser la gestion courante de vos clients et d'accompagnez ces derniers dans la réalisation de leurs projets en mobilisant des spécialistes. Vous travaillez en synergie avec les autres métiers du groupe et établissez des relations privilégiées avec les différents experts. Si l'esprit de c…",30000,45000,,2025-02-04T20:21:23Z,https://www.adzuna.fr/land/ad/5037572766?se=-uKDvy4e8BGla2k9OSZXLA&utm_medium=api&utm_source=e1ad5111&v=DACBB19C5B3D8899A61E1694959F1F56C62DA22E,Unknown,fr,ingenierie_informatique
Chargé de Développement Admission H/F,IONIS Education Group,"Pont-Rousseau, Rezé","Nous recherchons, un(e) Chargé(e) de Développement, Admission et Alternance, basé(e) à Nantes. En tant que Chargé(e) de Développement, Admission et Alternance, vos principales missions seront les suivantes : Prospection, Admission et Fidélisation : - Renforcer les relations avec les lycées et universités - Participer à l'organisation et l'animation des événements promotionnels (salons étudiants, phoning, présentations, visites d'établissements, Journées Portes Ouvertes, forums, CIO, bibliothèqu…",,,,2025-03-25T05:22:03Z,https://www.adzuna.fr/land/ad/5109598506?se=-uKDvy4e8BGla2k9OSZXLA&utm_medium=api&utm_source=e1ad5111&v=85776C4DD3076AD9A15F836EEC3C020FE6045A1D,Emplois Enseignement,fr,ingenierie_informatique
Chargé de Développement Packaging H/F,Segula Technologies,"Calvados, Normandie","En tant que Chargé(e) Développement Packaging, vos missions seront les suivantes : Méthodes : - Participer au développement des emballages en intégrant les contraintes liées à l'usine - Initialiser la nomenclature produit pour un projet sous forme d'une base de données logistique - Analyser les éléments de la base de données et s'assurer de sa mise à jour pour répondre au besoin du client - Assurer le suivi des affaires en vie projet - Piloter et être l'interlocuteur privilégié des différents M…",,,,2025-02-04T19:48:21Z,https://www.adzuna.fr/land/ad/5037233253?se=-uKDvy4e8BGla2k9OSZXLA&utm_medium=api&utm_source=e1ad5111&v=7058B3033E7286FAAEFE5F18E3BA49CC57893710,Unknown,fr,ingenierie_informatique
Chef de Projet Développements,Corse Composites Aeronautiques,"Ajaccio, Corse-du-Sud","Fort d’une expérience de près de 40 ans, Corse Composites Aéronautiques conçoit, développe, certifie et produit des sous-ensembles complexes en matériaux composites à destination du marché aéronautique mondial. Grâce à notre expertise et notre capacité d’innovation , notre société est aujourd’hui présente sur la plupart des nouveaux programmes aéronautiques. Afin de poursuivre cette formidable aventure et d'accompagner notre transformation : nous continuons de rechercher des talents, susceptibl…",,,,2025-02-22T07:15:12Z,https://www.adzuna.fr/land/ad/5060200795?se=-uKDvy4e8BGla2k9OSZXLA&utm_medium=api&utm_source=e1ad5111&v=D9018EF6599BEEB1963B25DE6AECDC0FD13CACF1,Unknown,fr,ingenierie_informatique
Responsable développement RH,Arts et Métiers - École Nationale Supérieure d'Arts et Métiers,"Paris, Ile-de-France","Dans le contexte d'une direction des Ressources Humaines en profonde mutation, Arts et Métiers recherche un ou une responsable du service développement RH. Au-delà de la sécurisation des parcours professionnels et de la gestion de la paie, la direction des Ressources Humaines vise à construire, en concertation avec les communautés concernées, des politiques RH favorisant une amélioration continue des conditions de travail et des parcours professionnels diversifiés. Rattaché/e à la Directrice de…",,,,2025-03-30T05:41:43Z,https://www.adzuna.fr/land/ad/5118438479?se=-uKDvy4e8BGla2k9OSZXLA&utm_medium=api&utm_source=e1ad5111&v=A88DDE89F87176E2CF05C4D0825334BA50082B51,Unknown,fr,ingenierie_informatique
Responsable recherche et développement,Pane Vivo,"Paris, Ile-de-France","✊ Notre mission : Redonner le droit et le plaisir de manger du pain à tous ✊ Fruit de sept ans de recherche, Pane Vivo propose un pain qui fait du bien à la santé, au palais et à la planète. Seule boulangerie de France reconnue “Jeune Entreprise Innovante” par le Ministère de la Recherche, Pane Vivo compte déjà 6 points de vente en propre à Paris, ainsi qu’un programme florissant d’expéditions dans toute la France. Aujourd’hui, Pane Vivo recherche un(e) Responsable de la Recherche et du Dévelop…",,,,2025-04-04T08:20:42Z,https://www.adzuna.fr/land/ad/5128733571?se=-uKDvy4e8BGla2k9OSZXLA&utm_medium=api&utm_source=e1ad5111&v=35ACAE8EB8D8ABDF344D878C24E0616A1209E5DF,Unknown,fr,ingenierie_informatique
Business Developer International,SteamOne,France,"Sous la direction commerciale, tu seras responsable de l’expansion des activités commerciales B to B de l’entreprise sur les marchés Internationaux. Ton rôle consistera à identifier, développer et entretenir des relations avec les acteurs clés de l’industrie hôtelière en Europe. Tu devras élaborer des stratégies commerciales efficaces pour promouvoir les services de la société et renforcer sa position sur le marché. Pour y parvenir, voici tes missions : Prospection & Développement Commercial : …",,,,2025-03-21T07:40:48Z,https://www.adzuna.fr/land/ad/5104021508?se=-uKDvy4e8BGla2k9OSZXLA&utm_medium=api&utm_source=e1ad5111&v=9FB2692474E63E88BB08D753E03A3794A9CBF802,Unknown,fr,ingenierie_informatique
Ingénieur en Développement Instrumental,Observatoire de Paris | PSL,France,"Rejoignez l’Observatoire de Paris-PSL, établissement public à caractère scientifique, culturel et professionnel spécialisé dans les disciplines liées aux sciences de l’univers et à l’astronomie. C’est au sein de l’Académie des Sciences, en 1666, lors de la première séance, que Louis XIV et Jean-Baptiste Colbert décident la création de l'observatoire royal, qui deviendra l'actuel Observatoire de Paris. L’Observatoire Radio-astronomique de Station est une Unité Scientifique de l'Observatoire de P…",,,,2025-04-06T10:07:47Z,https://www.adzuna.fr/land/ad/5132204831?se=-uKDvy4e8BGla2k9OSZXLA&utm_medium=api&utm_source=e1ad5111&v=8D4889C1B268159F43E5E608158E70121DE4E481,Unknown,fr,ingenierie_informatique
Business Developer IT,Bechtle,"Antony, Hauts-de-Seine","Rejoignez Bechtle et boostez votre carrière commerciale dans l'IT   Vous êtes passionné(e) par le secteur technologique et vous avez une expérience dans la vente de solutions IT ? Nous avons une opportunité faite pour vous   Bechtle , leader européen de la fourniture de solutions IT, recherche un(e) Business Developer IT talentueux(se) pour rejoindre notre équipe dynamique. Sous la direction de Farba , notre manager, vous serez au cœur de notre stratégie de développement commercial et aurez l’o…",,,,2025-03-30T05:42:39Z,https://www.adzuna.fr/land/ad/5118438915?se=-uKDvy4e8BGla2k9OSZXLA&utm_medium=api&utm_source=e1ad5111&v=2D26C9D98F2573C32A33AC74113D4D2B0A4536CE,Unknown,fr,ingenierie_informatique
Responsable développement commercial,Apave,France,"À propos de l'entreprise Apave recherche un(e) Commercial(e) H/F, en CDI pour BVT Filiale du Groupe Apave spécialisé dans la réalisation des formations réglementaires pour le transport de marchandises dangereuses, que ce soit par camion, par avion, par train ou par navire. Nous formons 25 000 stagiaires par an et comptons 50 formateurs. Cela fait de nous le leader français dédié au transport de marchandises dangereuses. À propos du rôle Nous recherchons un(e) Commercial(e) dynamique et motivé(e…",,,,2025-04-11T05:27:21Z,https://www.adzuna.fr/land/ad/5139961319?se=-uKDvy4e8BGla2k9OSZXLA&utm_medium=api&utm_source=e1ad5111&v=81CCC89F05A3CC8E3067F0BCFA205BB6DD3C5C9D,Unknown,fr,ingenierie_informatique
Responsable du développement de la clientèle,Groupe Actual,"Ermont, Pontoise","Nous recherchons un ou une responsable développement clientèle dans la gestion immobilière pour rejoindre notre équipe. Vous serez en charge d’assurer le suivi commercial ainsi que la coordination des équipes et des partenaires. A ce titre, vous intervenez sur plusieurs volets et vos missions sont les suivantes : I. Management d’équipe Encadrer et animer une équipe de 9 assistants d’attribution Garantir la qualité de l’accueil en agence et la continuité du service Accompagner le développement d…",,,,2025-04-09T04:54:55Z,https://www.adzuna.fr/land/ad/5136512527?se=-uKDvy4e8BGla2k9OSZXLA&utm_medium=api&utm_source=e1ad5111&v=1BE92688698ACF6772722EC8C836E6701938E083,Unknown,fr,ingenierie_informatique
