title,company,location,description,salary_min,salary_max,contract_type,created,redirect_url,category,specialty,source_country,query,query_type,remote_friendly,international
Mining Massive Data Sets,Stanford University,UK,"We introduce the participant to modern distributed file systems and MapReduce, including what distinguishes good MapReduce algorithms from good algorithms in general. The rest of the course is devoted to algorithms for extracting models and information from large datasets. Participants will learn how Google's PageRank algorithm models importance of Web pages and some of the many extensions that have been used for a variety of purposes. We'll cover locality-sensitive hashing, a bit of magic that…",56669.86,56669.86,,2023-09-10T16:04:22Z,https://www.adzuna.co.uk/jobs/details/4305362125?utm_medium=api&utm_source=e1ad5111,Engineering Jobs,data mining,gb,data mining,standard,False,False
Data Warehouse Manager,Shortlist Recruitment,"Chester, Cheshire","Data Warehouse Manager £60,000 Chester ShortList Recruitment are working with an excellent Chester-based client who are recruiting for a Data Warehouse Manager to join their growing team. The Data Warehouse Manager will ensure the data warehouse team is managed appropriately, scheduled jobs run without error and are delivered within SLA. This is a hands-on role which will primarily support the business with SAS, being used as the primary tool for analytics, data mining, data warehousing and pro…",60000,60000,permanent,2025-04-04T21:23:47Z,https://www.adzuna.co.uk/jobs/land/ad/5129909444?se=FNO-Me8o8BGDGO_HSiZXLA&utm_medium=api&utm_source=e1ad5111&v=D6D75AAF1CCEFC174A92C1F8CAD98617A83BA378,IT Jobs,data mining,gb,data mining,standard,False,False
Senior Data Scientist,ADLIB Recruitment,"South East London, London","Investment Firm Build cutting-edge investment signals with real-world impact. Work at the intersection of quant, sustainability, and tech. Combine research, engineering, and publishing in one role. This is a fantastic opportunity to join a growing, tech-forward quant research team. As a Senior Data Scientist, youll be joining a collaborative and innovation-focused environment where youll help solve complex problems using modern AI and machine learning techniques. Youll work on designing intelli…",100000,100000,permanent,2025-05-01T14:40:08Z,https://www.adzuna.co.uk/jobs/land/ad/5173067951?se=FNO-Me8o8BGDGO_HSiZXLA&utm_medium=api&utm_source=e1ad5111&v=31B73D2AE299BA579CF992880B3F87C2D243B16F,IT Jobs,data mining,gb,data mining,standard,False,False
Senior Data Engineer,JSS Transform,"London, UK","Senior Data Engineer - Contract - London A Senior Data Engineer is required by a Reinsurance broker to design, implement, and maintain data solutions in their Azure cloud platforms. You will need extensive experience in SQL, NoSQL, Data Lakes, Data Mining, DML, DQL, Data Modelling, and Scripting. This is a hybrid contract role. Sound like a bit of you? Then get involved.",45631.85,45631.85,contract,2025-05-03T07:28:58Z,https://www.adzuna.co.uk/jobs/land/ad/5178024568?se=FNO-Me8o8BGDGO_HSiZXLA&utm_medium=api&utm_source=e1ad5111&v=F57CAD4AE03948E896459C6CD4CCAA262B974850,IT Jobs,data mining,gb,data mining,standard,False,False
Senior Credit Data Analyst,JSS Search,"London, UK","My client is an established corporate bank, looking to expand their London team with the addition of a Senior Credit Risk Analyst. This role is data-driven and will have clear influence on credit strategy and the bank's risk appetite. The ideal candidate will have a minimum of 4 years of experience in credit risk, with a particular focus on data/analytics. Experience with SAS, SQL, Python or Tableau is also beneficial. Responsibilities Analysis of credit risk profile for the bank's property por…",44517.52,44517.52,,2025-04-28T03:28:40Z,https://www.adzuna.co.uk/jobs/land/ad/5166316440?se=FNO-Me8o8BGDGO_HSiZXLA&utm_medium=api&utm_source=e1ad5111&v=C424D6232D7D2ED6C9AD1148A498CA17F647E927,Accounting & Finance Jobs,data mining,gb,data mining,standard,False,False
Data Engineer,Anson McCade,"Belfast, Northern Ireland","Data Engineer Shape the Future of Data Innovation Belfast, Northern Ireland (Hybrid) Competitive Salary - Up to £55,000 An exciting opportunity has opened for an experiencedData Engineer to design and build large-scale data solutions in a fast-paced, high-impact environment. This role is ideal for someone with a strong background in AWS cloud technologies, ETL pipelines, data warehousing, and big data architectures. The Role As a Data Engineer, you will: Design and deploy production data pipeli…",55000,55000,,2025-04-16T20:30:19Z,https://www.adzuna.co.uk/jobs/land/ad/5148200758?se=FNO-Me8o8BGDGO_HSiZXLA&utm_medium=api&utm_source=e1ad5111&v=A6A28AB560C763EF8A252465290CB0E48C9DD34A,IT Jobs,data mining,gb,data mining,standard,False,False
"Data Product Intern, Gaming",Tencent,"London, UK","Level Infinite is Tencent’s global gaming brand. It is a global game publisher offering a comprehensive network of services for games, development teams, and studios around the world. We are dedicated to delivering engaging and original gaming experiences to a worldwide audience, whenever and wherever they choose to play while building a community that fosters inclusivity, connection, and accessibility. Level Infinite also provides a wide range of services and resources to our network of develo…",27045.75,27045.75,contract,2025-04-21T03:49:06Z,https://www.adzuna.co.uk/jobs/land/ad/5154914400?se=FNO-Me8o8BGDGO_HSiZXLA&utm_medium=api&utm_source=e1ad5111&v=774A471114502CA285D8D0824A1635382A82700A,IT Jobs,data mining,gb,data mining,standard,False,True
Data Warehouse Manager,ShortList Recruitment Limited,"Chester, Cheshire","Data Warehouse Manager £60,000 Chester ShortList Recruitment are working with an excellent Chester-based client who are recruiting for a Data Warehouse Manager to join their growing team. The Data Warehouse Manager will ensure the data warehouse team is managed appropriately, scheduled jobs run without error and are delivered within SLA. This is a hands-on role which will primarily support the business with SAS, being used as the primary tool for analytics, data mining, data warehousing and pro…",51242.18,51242.18,,2025-04-28T03:43:54Z,https://www.adzuna.co.uk/jobs/land/ad/5166328288?se=FNO-Me8o8BGDGO_HSiZXLA&utm_medium=api&utm_source=e1ad5111&v=DB1EFD10B1B165DCA2E877D23E097F3884EE0B2A,IT Jobs,data mining,gb,data mining,standard,False,False
"AVP, Text Mining/NLP - Data Science and Insights-COR027184",genpact,UK,"Now, we’re calling upon the thinkers and doers, those with a natural curiosity and a hunger to keep learning, keep growing. People who thrive on fearlessly experimenting, seizing opportunities, and pushing boundaries to turn our vision into reality. And as you help us create a better world, we will help you build your own intellectual firepower. Welcome to the relentless pursuit of better. Inviting applications for the role of AVP, Text Mining/NLP - Data Science and Insights. The candidate shou…",52613.52,52613.52,,2023-11-22T22:05:45Z,https://www.adzuna.co.uk/jobs/details/4448449254?utm_medium=api&utm_source=e1ad5111,IT Jobs,data mining,gb,data mining,standard,False,False
"AVP, Text Mining/NLP - Data Science and Insights-COR027182",genpact,UK,"Now, we’re calling upon the thinkers and doers, those with a natural curiosity and a hunger to keep learning, keep growing. People who thrive on fearlessly experimenting, seizing opportunities, and pushing boundaries to turn our vision into reality. And as you help us create a better world, we will help you build your own intellectual firepower. Welcome to the relentless pursuit of better. Inviting applications for the role of AVP, Text Mining/NLP - Data Science and Insights. The candidate shou…",52613.52,52613.52,,2023-11-22T16:19:23Z,https://www.adzuna.co.uk/jobs/details/4447482958?utm_medium=api&utm_source=e1ad5111,IT Jobs,data mining,gb,data mining,standard,False,False
BI Delivery Manager,Intertek,UK,"ABOUT YOU As the Business Intelligence Delivery Manager, you will be expected to collaborate with other Technical Team Leads, particularly Data Architect and Data Integrations Team Lead. In addition, work closely with other application leads, Infrastructure, Security, DBA and App hosting teams for cross platform initiatives. Required skills and experience: • Degree/Masters in the field of Computer Science • Certification from professional bodies is desired • Proven track record of Data delivery…",67661.62,67661.62,permanent,2025-04-25T10:23:53Z,https://www.adzuna.co.uk/jobs/land/ad/5162008054?se=FNO-Me8o8BGDGO_HSiZXLA&utm_medium=api&utm_source=e1ad5111&v=FF8FF550A253344B97D7904B261E8F2D97C0A830,IT Jobs,data mining,gb,data mining,standard,False,False
Senior Data Scientist,ADLIB Recruitment | B Corp™,"London, UK","Investment Firm Build cutting-edge investment signals with real-world impact. Work at the intersection of quant, sustainability, and tech. Combine research, engineering, and publishing in one role. This is a fantastic opportunity to join a growing, tech-forward quant research team. As a Senior Data Scientist, you’ll be joining a collaborative and innovation-focused environment where you’ll help solve complex problems using modern AI and machine learning techniques. You’ll work on designing inte…",68261.01,68261.01,,2025-04-30T15:54:58Z,https://www.adzuna.co.uk/jobs/land/ad/5170676197?se=FNO-Me8o8BGDGO_HSiZXLA&utm_medium=api&utm_source=e1ad5111&v=27A1EC82968A3538CA089A050AA2865CEED5760D,IT Jobs,data mining,gb,data mining,standard,False,False
Customer Category Manager,Muller Dairy,"Longford Turning, Market Drayton","Company description: Mller UK & Ireland is wholly owned by the Unternehmensgruppe Theo Mller which employs over 24,000 people throughout Europe. In the UK, Mller develops, manufactures and markets a wide range of branded and private label dairy products made with milk from more than 1,700 British farmers. The Mller brand is ranked at No.7 in The Grocers Top 100 list of Britains Biggest Brands, and is also the 7th most chosen brand in the UK. Job description: Customer Category Manager Full-time …",38331.66,38331.66,permanent,2025-04-07T17:32:51Z,https://www.adzuna.co.uk/jobs/land/ad/5133650873?se=FNO-Me8o8BGDGO_HSiZXLA&utm_medium=api&utm_source=e1ad5111&v=8799859445EAD48F9D1B4C33F6A1378339F8CC01,Sales Jobs,data mining,gb,data mining,standard,False,False
Data & Analytics Consultant - (CRA / Scorecards),Ventula Consulting,"London, UK","Data & Analytics Consultant - (CRA / Scorecards) I’m helping one of the world’s great financial institutions recruit a Data & Analytics Consultant - to help develop scorecards. Consultants are responsible for providing external clients with analytical support and project analysis. This includes answering client queries related to data characteristics, scores and also involvement in analytical projects, for example, credit strategy development, model development and other bespoke analytics to so…",47673.59,47673.59,,2025-04-30T15:56:18Z,https://www.adzuna.co.uk/jobs/land/ad/5170681968?se=FNO-Me8o8BGDGO_HSiZXLA&utm_medium=api&utm_source=e1ad5111&v=18CF14FB808284FF06AFB5C342750B3958CB65FB,Accounting & Finance Jobs,data mining,gb,data mining,standard,False,False
Credit Risk Consultant - (CRA / Scorecards),Ventula Consulting,"London, UK","Data & Analytics Consultant - (CRA / Scorecards) I’m helping one of the world’s great financial institutions recruit a Data & Analytics Consultant - to help develop scorecards. Consultants are responsible for providing external clients with analytical support and project analysis. This includes answering client queries related to data characteristics, scores and also involvement in analytical projects, for example, credit strategy development, model development and other bespoke analytics to so…",47842.47,47842.47,,2025-04-30T15:57:29Z,https://www.adzuna.co.uk/jobs/land/ad/5170690663?se=FNO-Me8o8BGDGO_HSiZXLA&utm_medium=api&utm_source=e1ad5111&v=64869B4CCAEE09F88C0A18E454D822937969F600,Accounting & Finance Jobs,data mining,gb,data mining,standard,False,False
Research Lead - Social Health,Spalding Goobey,"London, UK","Research Lead – Social Health London/Hybrid £49-59,000 depending on experience This proactive and influential government funded not-for-profit organisation has created the new role of Research Lead in order to help deliver a major mental health initiative across the country. You will be responsible for identifying research opportunities to shape and improve the programme. Already operating at the forefront of implementing high-quality, evidence-based practices our client is ambitious to continu…",48162.56,48162.56,,2025-05-03T07:30:18Z,https://www.adzuna.co.uk/jobs/land/ad/5178027788?se=FNO-Me8o8BGDGO_HSiZXLA&utm_medium=api&utm_source=e1ad5111&v=F10F226AE689A0748D7C1EAEA5099DF1BC9C98CD,IT Jobs,data mining,gb,data mining,standard,False,False
Credit Risk Analyst- (CRA / Scorecards),Ventula Consulting,"London, UK","Data & Analytics Consultant - (CRA / Scorecards) I’m helping one of the world’s great financial institutions recruit a Data & Analytics Consultant - to help develop scorecards. Consultants are responsible for providing external clients with analytical support and project analysis. This includes answering client queries related to data characteristics, scores and also involvement in analytical projects, for example, credit strategy development, model development and other bespoke analytics to so…",43572.87,43572.87,,2025-04-30T15:56:51Z,https://www.adzuna.co.uk/jobs/land/ad/5170685921?se=FNO-Me8o8BGDGO_HSiZXLA&utm_medium=api&utm_source=e1ad5111&v=8C8B10E523E0AEAA24E090CECE22C16224C5B3AA,Accounting & Finance Jobs,data mining,gb,data mining,standard,False,False
HR Management & Information Analyst,Carter Jonas,"Peterborough, Eastern England","HR Management & Information Analyst Location: Peterborough Contract Type: Permanent Salary: Competitive Do you have experience in analysing data and an interest in HR? We are looking for a HR Management and Information Analyst (HRMI Analyst) to join our growing team in Peterborough. In this new and varied role, you will provide support to the HR Manager and Head of HR on a variety of data and system-based activities across both areas of HR, Learning and Development and Recruitment. The role wil…",38376.43,38376.43,permanent,2025-04-23T22:17:47Z,https://www.adzuna.co.uk/jobs/land/ad/5159100050?se=FNO-Me8o8BGDGO_HSiZXLA&utm_medium=api&utm_source=e1ad5111&v=65803570736205F2F5B0318125A30B2A2A16DB00,IT Jobs,data mining,gb,data mining,standard,False,False
Inside Sales Representative (UK&I) - NGS,Novogene Europe,"Eastern England, UK","Novogene is a leading global provider of genomic services and solutions. Leveraging the latest next-generation sequencing (NGS), bioinformatics expertise, and the largest sequencing capacity in the world, Novogene provides unsurpassed data quality and fast turnaround time to all our customers. We are seeking a proactive and results-driven Inside Sales Representative (NGS background) to expand our business across the UK and Ireland . The ideal candidate will be responsible for identifying and pr…",41531.39,41531.39,,2025-04-30T15:55:20Z,https://www.adzuna.co.uk/jobs/land/ad/5170677602?se=FNO-Me8o8BGDGO_HSiZXLA&utm_medium=api&utm_source=e1ad5111&v=EC692EE71BDCFD0EB63622596957C762DFC6CACD,Sales Jobs,data mining,gb,data mining,standard,False,True
Data Scientist - Manchester,Circle Group,"Manchester, Greater Manchester","Data Scientist - Manchester Data Scientist with experience of creating financial models, machine learning, SQL, Python and forecasting experience is required by a leading company in Manchester. As the Data Scientist, you will be responsible for defining & shaping of all financial modelling and forecasting to enhance decision making, deliver more targeted acquisition, and deliver profitable growth. Tools wise they are using SQL, Python & R, so you should ideally have strong experience in these a…",70000,70000,permanent,2025-04-17T22:00:33Z,https://www.adzuna.co.uk/jobs/land/ad/5150602378?se=FNO-Me8o8BGDGO_HSiZXLA&utm_medium=api&utm_source=e1ad5111&v=0049436F9B47C948BDFBDDB878DA934F73519B57,IT Jobs,data mining,gb,data mining,standard,False,False
Executive Assistant,Signify Technology,"London, UK","Executive Assistant | Robotics Start-up  | London  Location: Paddington, London  Work Mode: Full-time, in-office,  Compensation: Competitive salary from £80-100k  benefits (incl. visa sponsorship, pension, private medical care) I'm looking to recruit a tech-savvy, proactive Executive Assistant with a passion for supporting top-level executives. To work for an innovative robotics start-up , pushing the boundaries of technology to create groundbreaking solutions in the development of advanced rob…",38925.79,38925.79,,2025-04-13T04:23:54Z,https://www.adzuna.co.uk/jobs/land/ad/5142897309?se=FNO-Me8o8BGDGO_HSiZXLA&utm_medium=api&utm_source=e1ad5111&v=832857DC23A9C3E9E502270D32D07CB796146E07,Admin Jobs,data mining,gb,data mining,standard,False,False
Legal Counsel (Hybrid),Lennoxvale Recruitment Limited,"London, UK","Your New Company A media services company based in the South of England, are conducting a search for a capable Legal Counsel to join their legal team on a contract basis to cover a period of maternity. This is a hybrid role which will require travel to the office once per week. The company represents the intellectual property rights of many prominent publishing brands in the UK, such as leading newspapers, magazine publishers and their thousands of brands, in print and online. The combination o…",80000,80000,contract,2025-05-02T15:14:23Z,https://www.adzuna.co.uk/jobs/land/ad/5176308143?se=FNO-Me8o8BGDGO_HSiZXLA&utm_medium=api&utm_source=e1ad5111&v=71CE1A50B013039A0DC2B2070676235142088C09,Legal Jobs,data mining,gb,data mining,standard,False,False
Graduate Management Trainee Programme – Executive Search,Walker Cole International,"London, UK","Walker Cole International is a pharmaceutical and life sciences executive search company who specialise in global recruitment consultancy services. We are currently searching for applicants to join our July & September 2025 Graduate Management Trainee Programme as a Trainee Recruitment Consultant to work from our central London offices, with the opportunity to relocate internationally in the future, as a part of our global expansion. Key Responsibilities: · Identify specialist pharmaceutical pr…",35164.27,35164.27,,2025-04-30T15:57:01Z,https://www.adzuna.co.uk/jobs/land/ad/5170687148?se=FNO-Me8o8BGDGO_HSiZXLA&utm_medium=api&utm_source=e1ad5111&v=25FA26B9114597370C133F8312C5E37FE778EEB8,Graduate Jobs,data mining,gb,data mining,standard,False,True
Executive Assistant (Russian Speaking),Signify Technology,"London, UK","Executive Assistant | Robotics Start-up  | London  Location: Paddington, London  Work Mode: Full-time, in-office,  Compensation: Competitive salary from £70k  benefits (incl. visa sponsorship, pension, private medical care) I'm looking to recruit a tech-savvy, proactive Executive Assistant with a passion for supporting top-level executives. To work for an innovative robotics start-up , pushing the boundaries of technology to create groundbreaking solutions in the development of advanced robots …",40101.72,40101.72,,2025-04-28T03:20:41Z,https://www.adzuna.co.uk/jobs/land/ad/5166304424?se=FNO-Me8o8BGDGO_HSiZXLA&utm_medium=api&utm_source=e1ad5111&v=8DBB5661D075813CBD176E31DF8CA36423C6BCD7,Admin Jobs,data mining,gb,data mining,standard,False,False
Personal Assistant (Russian Speaking),Signify Technology,"London, UK","Personal Assistant | Robotics Start-up  | London  Location: Paddington, London  Work Mode: Full-time, in-office,  Compensation: Competitive salary from £70k  benefits (incl. visa sponsorship, pension, private medical care) I'm looking to recruit a tech-savvy, proactive Executive Assistant with a passion for supporting top-level executives. To work for an innovative robotics start-up , pushing the boundaries of technology to create groundbreaking solutions in the development of advanced robots d…",42400.23,42400.23,,2025-04-28T03:20:44Z,https://www.adzuna.co.uk/jobs/land/ad/5166304576?se=FNO-Me8o8BGDGO_HSiZXLA&utm_medium=api&utm_source=e1ad5111&v=F2178FC6EB2D5C99D8E09AAC1829A53888D2B428,Admin Jobs,data mining,gb,data mining,standard,False,False
Senior Marketing Data Scientist,ECM Talent,"London, UK","Senior Marketing Data Scientist/MMM Specialist Location: London (Hybrid Working) Duration: Minimum 6 month contract  long term extensions - Project scope scheduled for the next 2/3 years. Start Date: ASAP We have an excellent opportunity for a Senior Marketing Data Scientist/MMM Specialist to join a multinational FMCG brand in London. Hybrid working, initial 6 month contract  opportunity to extend long-term & start date May 2025. Role Summary: Lead data activities including extraction, transfor…",63642.16,63642.16,contract,2025-04-28T03:28:35Z,https://www.adzuna.co.uk/jobs/land/ad/5166315944?se=FNO-Me8o8BGDGO_HSiZXLA&utm_medium=api&utm_source=e1ad5111&v=D5BFFDF68B70B52FD6BF2B568777A2A2B8BF06A1,IT Jobs,data mining,gb,data mining,standard,False,False
CMA Financial Markets Sales,Commerzbank AG,"London, UK","A leading corporate banking and capital markets organisation is seeking a CMA Financial Markets Sales individual to join their team in London. Main Purpose of the Role: FX/MM/Commodity Sales Coverage of MENA and Africa FIs. Responsible for backing up day-to-day senior sales, trade executions, client management, business originations and strategy developments. Help optimize revenue streams from targeted clients by collating facts, data-mining and actioning appropriate account plans. Key Activiti…",62534.06,62534.06,,2025-04-30T15:55:45Z,https://www.adzuna.co.uk/jobs/land/ad/5170678765?se=FNO-Me8o8BGDGO_HSiZXLA&utm_medium=api&utm_source=e1ad5111&v=7537D17AF97EFC72112B2634EFA7F6457D2297CB,Sales Jobs,data mining,gb,data mining,standard,False,True
Senior Credit Strategy Analyst,InterQuest Group,"London, UK","Senior Credit Strategy Analyst InterQuest are supporting a business lender in London who are seeking an experienced Senior Credit Strategy Analyst to join their team. You will play a critical role in assessing and managing risk, optimizing the credit risk process, and forecasting the performance of loan portfolios. You will collaborate with various teams, including credit risk modelling, engineering, data management, capital markets, and business operations, to align on goals and deliver impact…",49986.09,49986.09,,2025-04-28T03:36:38Z,https://www.adzuna.co.uk/jobs/land/ad/5166321826?se=FNO-Me8o8BGDGO_HSiZXLA&utm_medium=api&utm_source=e1ad5111&v=F162CCFCFB2BBD70A732A629CFA1677E832F4F2C,Accounting & Finance Jobs,data mining,gb,data mining,standard,False,False
Data Analyst,Hanson Lee,"London, UK","My client are an Insurance consultancy seeking a highly skilled Senior Data Analyst with expertise in Azure Services to play a pivotal role in designing and developing data solutions within our organization. Role Type: Permanent/ Hybrid Location: London Responsibilities Interpret data, analyze results using statistical techniques, and provide ongoing reports. Develop and implement databases, data collection systems, data analytics, and other strategies that optimize statistical efficiency and q…",35580.1,35580.1,permanent,2025-04-30T15:56:36Z,https://www.adzuna.co.uk/jobs/land/ad/5170683625?se=FNO-Me8o8BGDGO_HSiZXLA&utm_medium=api&utm_source=e1ad5111&v=2F9577984A354059A013F5250C6A30B84A0C5C68,IT Jobs,data mining,gb,data mining,standard,False,False
"Lead Business Analyst (Manager), Finance, CBS, Belfast",EY,"Belfast, Northern Ireland","UKI Finance Job Description Role Title: Lead Business Analyst Business Unit: UKI Finance Reports to: UKI Head of Reporting & Analytics Location: Newcastle, Belfast JOB OVERVIEW An exciting opportunity has arisen within the UKI Finance team for a Lead Business Analyst. The primary focus will be to support the UK working in the centre on activities across all of our Service Lines. The role will work with Senior Leadership. The role will require the individual to provide high quality financial and…",47902.51,47902.51,,2025-05-02T06:13:08Z,https://www.adzuna.co.uk/jobs/land/ad/5175371375?se=FNO-Me8o8BGDGO_HSiZXLA&utm_medium=api&utm_source=e1ad5111&v=570E02AAE4BECB6BDE20F3C92A88580398DD0B97,Accounting & Finance Jobs,data mining,gb,data mining,standard,False,False
Artificial Intelligence Engineer,Burns Sheehan,"Eastern England, UK","AI Engineer £80,000-£110,000 UK remote with London office with expectation to be seen in person at least once a month. Equity options 25 days holiday  bank Pension matched to 7% Work abroad for up to 3 months Are you looking to be part of a world-class data lead organisation who are continuously moving forward with the latest AI trends? This company is a true innovator in building data-driven products using machine learning, computer vision, natural language processing, speech and audio, and kn…",40908.18,40908.18,,2025-05-01T06:53:56Z,https://www.adzuna.co.uk/jobs/land/ad/5171931407?se=FNO-Me8o8BGDGO_HSiZXLA&utm_medium=api&utm_source=e1ad5111&v=49894A6C7AFE5FAFB21C12A461CD0A3FF840E45A,IT Jobs,data mining,gb,data mining,standard,True,True
