title,company,location,description,salary_min,salary_max,contract_type,created,redirect_url,category,specialty,source_country,query,query_type,remote_friendly,international
Inside Sales Representative,Magneto & Diesel Injector Service Inc,"Humble, Harris County","Job Description Job Description Description: The Inside Sales Representative assist customers through Counter Sales, Phone Calls, and Email. This position requires an enthusiastic desire to consistently provide top-notch customer service. Interact with walk-in customers at the front counter Assist customers in selecting required parts and recommend associated products and services Receive and process orders via the counter, phone, and email Informs customer of unit prices, shipping date, antici…",56335.83,56335.83,,2025-04-28T02:07:26Z,https://www.adzuna.com/land/ad/5166450855?se=KhCnPO8o8BGT4w9x5LWCew&utm_medium=api&utm_source=e1ad5111&v=2A80C1D4E53AD579B609BB8EA5E03F8CB9556936,Sales Jobs,data mining,us,data mining,standard,False,False
Credit Strategy Sr Analyst,"Climb Credit, Inc.","New York City, New York","Job Description Job Description About Us Climb (NMLS 1240013) is an innovative student payment platform that makes career-focused education more accessible and affordable. Driven by a mission to empower individuals to unlock their potential – no matter their credit profile – Climb identifies programs and schools that offer skill-based training programs, then provides learners with payment options that are structured to meet the unique needs of those seeking career training. Recognizing the dyna…",124090.27,124090.27,,2025-04-09T23:46:38Z,https://www.adzuna.com/land/ad/5138156775?se=KhCnPO8o8BGT4w9x5LWCew&utm_medium=api&utm_source=e1ad5111&v=E06AB081571C3256707FB7DCAF56E5DEF2065C68,Accounting & Finance Jobs,data mining,us,data mining,standard,False,False
Financial Analyst - Entry Level,Robert Half,"New York City, New York","Job Description Job Description We are in search of a Financial Analyst - Entry Level to join our team in the non-profit sector, based in New York. As a Financial Analyst, your key role will be to handle customer credit applications, maintain precise customer credit records, and manage customer inquiries. You will also monitor customer accounts and take necessary actions when needed. Responsibilities: • Ensure the accurate and efficient processing of customer credit applications. • Maintain det…",52000,62400,,2025-04-20T06:19:44Z,https://www.adzuna.com/land/ad/5154345842?se=KhCnPO8o8BGT4w9x5LWCew&utm_medium=api&utm_source=e1ad5111&v=054E811D9CF4AE7A43A88961E2C14637A49B73AE,Accounting & Finance Jobs,data mining,us,data mining,standard,False,False
Senior FP&A Analyst,Robert Half,"Memphis, Clark County","Job Description Job Description We are looking for an experienced Senior FP& A Analyst to join our team in Memphis, Tennessee. In this role, you will play a key part in financial planning and analysis, ensuring accurate reporting and supporting organizational initiatives. Your expertise will contribute to optimizing processes, managing budgets, and driving strategic decision-making. The successful candidate should have a Bachelor’s degree in Accountancy and be a Certified Public Accountant (CPA…",80000,110000,,2025-05-03T22:36:08Z,https://www.adzuna.com/land/ad/5179668177?se=KhCnPO8o8BGT4w9x5LWCew&utm_medium=api&utm_source=e1ad5111&v=24F11C1FEB97734BB1522A1A96823A51114FEA83,Accounting & Finance Jobs,data mining,us,data mining,standard,False,False
Senior Systems Analyst,Fidelity Investments,"South Boston, Suffolk County","Job Description: We are currently sourcing for a Sr. Systems/Data Analyst to work in Boston, Ma. The Role We (Fidelity Fund and Investment Operations Technology) are looking for a highly motivated individual to join one of our agile development squads to provide analytical excellence to our suite of corporate actions applications. We are in the midst of an exciting evolution to meet the strategic corporate actions needs of Fidelity. If you are customer obsessed and passionate about advocating f…",103414.57,103414.57,,2025-05-01T04:36:08Z,https://www.adzuna.com/land/ad/5172343536?se=KhCnPO8o8BGT4w9x5LWCew&utm_medium=api&utm_source=e1ad5111&v=70570D5BF32338D89A3178CEF38368AA91336774,IT Jobs,data mining,us,data mining,standard,False,False
Postdoctoral Fellow,Tulane University,"New Orleans, Orleans Parish","Postdoctoral Fellow *Location:* New Orleans, LA *Open Date:* Apr 30, 2025 *Close Date:* Jun 2, 2025 *Description:* This is a full-time, twelve-month position. The Postdoctoral Fellow will work closely with Newcomb Institute Executive Director and Director of Research on projects related to quantitative database building, data mining and data analysis as well as report generation on issues of gender equity, with a focus on reproductive, maternal, and infant health data from hospitals and governm…",60085.33,60085.33,,2025-05-02T08:30:14Z,https://www.adzuna.com/land/ad/5176102813?se=KhCnPO8o8BGT4w9x5LWCew&utm_medium=api&utm_source=e1ad5111&v=C8D86EECB9F589EE9A218E9EA2A777BCAAE73028,Scientific & QA Jobs,data mining,us,data mining,standard,False,False
Data Engineer,Axelon Services Corporation,"Tampa, Hillsborough County","Global Financial Firm located in Tampa, FL and JC, NJ has an immediate contract opportunity for an experienced Data Engineer ""This role is currently on a Hybrid Schedule. You will need to have reliable internet, computer and android or iphone for remote access into the client systems during remote work. We will be expected in the office weekly 2-3 days depending on the team requirement. Video/ f2f interviews are required prior to all offers. Pay rate range: $ 70 .00 - $ 85.00 Negotiable based u…",85927.36,85927.36,,2025-05-01T00:57:33Z,https://www.adzuna.com/land/ad/5171853115?se=KhCnPO8o8BGT4w9x5LWCew&utm_medium=api&utm_source=e1ad5111&v=D262C75C4FBB03278DA23628D09E4F7C4D2A1795,IT Jobs,data mining,us,data mining,standard,True,True
Decision Scientist,Aim Point Innovation LLC,"Washington, Washington, D.C.","Understand and improve the judgment and decision making of individuals, groups, and organizations. Apply principles of psychology to business, analytic and other decision-making processes to improve and empirically evaluate those processes. Activities may include assisting in policy planning; workflow procedures testing and evaluation, analytic workflow redesign, training and development. May work with management to prescribe workflow modifications that improve worker productivity and analytic …",144254.1,144254.1,,2025-03-30T12:04:34Z,https://www.adzuna.com/details/5118809323?utm_medium=api&utm_source=e1ad5111,IT Jobs,data mining,us,data mining,standard,False,False
Software Developer,Leidos,"Glendale, Denver","Description Make an Impact with Leidos! Leidos National Security Sector has an opportunity in the Integrated Tactical Warning/Attack Assessment (ITW/AA) and Missile Defense mission areas. Your Greatest Work is Ahead! This Software Developer role includes trade studies, system engineering, model-based system engineering, portfolio analysis, software development demonstration and product testing and deployment to Cheyenne Mountain. Leidos is focused on finding the best people, processes, and tool…",102306.4,102306.4,,2025-05-01T13:28:44Z,https://www.adzuna.com/land/ad/5173741055?se=KhCnPO8o8BGT4w9x5LWCew&utm_medium=api&utm_source=e1ad5111&v=6C4E47F12551AF4A26DBB332A33542CAA01A9746,IT Jobs,data mining,us,data mining,standard,False,False
Supply Chain Financial Analyst,Uline,"Kenosha, Kenosha County","Supply Chain Financial Analyst Corporate Headquarters 12575 Uline Drive, Pleasant Prairie, WI 53158 Are you an expert at interpreting data to identify trends that make an impact? Then you belong at Uline - one of the largest freight shippers in North America! Join our Logistics team as a Supply Chain Financial Analyst using cutting-edge analytics to help us deliver legendary customer service. Better together! This position is on-site, and we are looking for people who share our passion. Positio…",101074.09,101074.09,,2025-04-03T13:36:10Z,https://www.adzuna.com/land/ad/5127188428?se=KhCnPO8o8BGT4w9x5LWCew&utm_medium=api&utm_source=e1ad5111&v=366CD3467C93C412BEB0DF8F58E048E678DE58E3,Logistics & Warehouse Jobs,data mining,us,data mining,standard,False,False
Senior Information Security Analysts,"American Express Travel Related Services Company, Inc.","Grand Central, Manhattan","American Express Travel Related Services Company, Inc. seeks Senior Information Security Analysts to provide analytical and technical support for issue management, project assessment, and reporting. Support user access control and data analysis activities for monitoring and reporting purposes. Evaluate and automate products and procedures to enhance productivity and effectiveness. Develop and debug complex code and conduct code reviews in alignment with best practices. Engineer and develop stan…",111718.9,111718.9,,2025-04-26T10:43:09Z,https://www.adzuna.com/land/ad/5164240795?se=KhCnPO8o8BGT4w9x5LWCew&utm_medium=api&utm_source=e1ad5111&v=21183293C40ED412B533071B4F088F481705AE3D,IT Jobs,data mining,us,data mining,standard,False,False
Financial Analyst - REMOTE,Ryder System,"Boise, Ada County","Job Seekers can review the Job Applicant Privacy Policy by clicking here (http://ryder.com/job-applicant-privacy-policy) . Job Description : Summary The Financial Analyst will provide financial analysis, planning and data mining support for Fleet Management Solutions (FMS). The candidate will directly support Asset Management Finance and coordinate with multiple departments to deliver results. Candidate must be inquisitive, collaborative, accurate, and efficient to ensure leadership receives in…",66291.83,66291.83,,2025-05-01T22:39:32Z,https://www.adzuna.com/land/ad/5175113123?se=KhCnPO8o8BGT4w9x5LWCew&utm_medium=api&utm_source=e1ad5111&v=819589EFB1A36E9CBCF45B4932E150809C365663,Accounting & Finance Jobs,data mining,us,data mining,standard,True,False
Vending Specialist,Robert Half,"Liverpool, Perry County","Job Description Job Description We are looking for a detail-oriented Vending Specialist to join our team in Liverpool, New York. In this Contract-to-Permanent position, you will play a vital role in analyzing financial data, ensuring operational efficiency, and supporting key business decisions. This is an excellent opportunity to grow your career in a fast-paced environment within the vending industry. Responsibilities: • Perform in-depth financial audits and analyze vending operations, includ…",47840,54080,,2025-05-02T22:37:20Z,https://www.adzuna.com/land/ad/5177722420?se=KhCnPO8o8BGT4w9x5LWCew&utm_medium=api&utm_source=e1ad5111&v=1A1F74B890416744E2F3205CC9160936C27AFAD2,Accounting & Finance Jobs,data mining,us,data mining,standard,False,False
(5/4/2025) Philanthropy Data Analyst,Legacy Health,"Portland, Multnomah County","Philanthropy Data Analyst US-OR-PORTLAND Job ID: 25-42507 Type: Regular Full-Time System Office 1919 Building Overview Remote Position (OR/WA Only) This is a remote position – incumbents, who reside in Oregon or Washington only. There may be occasional situations that require work to be performed on-site at an assigned Legacy Health location. All new hires are required to come to a designated Legacy Health office location in Portland, Oregon prior to their start date for a new hire health asses…",70865,105560,,2025-05-01T07:52:20Z,https://www.adzuna.com/land/ad/5172858327?se=KhCnPO8o8BGT4w9x5LWCew&utm_medium=api&utm_source=e1ad5111&v=C4816B5D6D276FB80B83F6565B8AB94897AE4BEB,IT Jobs,data mining,us,data mining,standard,True,False
Physician-Neurology,Banner Health,"Phoenix, Maricopa County","Banner Alzheimer's Institute (BAI) in Phoenix, AZ, is seeking a Neurologist with subspecialty training and experience in Movement Disorders and associated procedures. Candidates must have fellowship training in Movement Disorders, and possess a demonstrated commitment to compassionate patient care and movement disorders clinical research. The candidate will work to develop external funding for movement disorders research through a combination of research grants and clinical trials. What you can…",64382.03,64382.03,,2025-05-02T14:52:20Z,https://www.adzuna.com/land/ad/5177122578?se=KhCnPO8o8BGT4w9x5LWCew&utm_medium=api&utm_source=e1ad5111&v=72BA9D0A98044DD612128D0FD128D7D0ACF86B9D,Healthcare & Nursing Jobs,data mining,us,data mining,standard,False,False
Data Visualization & Analytics Engineer,Takeda,"Lexington, Middlesex County","By clicking the “Apply” button, I understand that my employment application process with Takeda will commence and that the information I provide in my application will be processed in line with Takeda’s Privacy Notice and Terms of Use . I further attest that all information I submit in my employment application is true to the best of my knowledge. Job Description Thank you for your interest in the Data Visualization & Analytics role. We are thrilled to receive such a high volume of applications…",131774.19,131774.19,,2025-04-11T10:09:47Z,https://www.adzuna.com/land/ad/5140526789?se=KhCnPO8o8BGT4w9x5LWCew&utm_medium=api&utm_source=e1ad5111&v=9AD742ED5F6F0D6B687266B483474199D69DC573,IT Jobs,data mining,us,data mining,standard,False,False
Associate Director Clinical Informatics (Physician Scientist),"Regeneron Pharmaceuticals, Inc.","Tarrytown, Westchester County","We are seeking a Physician Scientist in our TAG-CI (Therapeutic Area Genetics- Clinical Informatics) department to tap into the growing database of more than 2.5 million sequenced exomes and associated deidentified health information to make meaningful biological discoveries at speed and scale. The role requires strong research data management, healthcare ontologies and analytical skills to assess, validate and provide guidelines for creation of phenotypic assets that can be used in a standard …",245780.77,245780.77,,2025-04-15T10:10:18Z,https://www.adzuna.com/land/ad/5145761771?se=KhCnPO8o8BGT4w9x5LWCew&utm_medium=api&utm_source=e1ad5111&v=251BDBDC40E4657B72264AAD1CC4AADCDC4D9A6F,IT Jobs,data mining,us,data mining,standard,False,False
Actuarial AI / ML Director - Remote,Optum,"Eden Prairie, Hennepin County","Actuarial AI / ML Director - Remote at Optum summary: As an Actuarial AI/ML Director at Optum, you will leverage your extensive experience in healthcare actuarial roles and machine learning to improve health outcomes through innovative data analytics. You will lead a high-performing team in developing AI/ML forecasting models, conduct complex analyses, and collaborate with stakeholders to advance business objectives in the health sector. This role emphasizes a culture of diversity and inclusion…",106519.38,106519.38,,2025-05-02T20:07:51Z,https://www.adzuna.com/land/ad/5177507830?se=KhCnPO8o8BGT4w9x5LWCew&utm_medium=api&utm_source=e1ad5111&v=FD5C9F60894F0AF332E2ADD6F6A6354F3C12808E,IT Jobs,data mining,us,data mining,standard,True,False
Data Analyst,Ferry Machine Corporation,"Little Ferry, Bergen County","Job purpose We are currently seeking a Data Analytics & Resource Planning Specialist to support the People & Culture Department in making data-driven decisions. . Duties and responsibilities The Data Analyst will maintain data storage; assess database design; and gather, organize, and interpret statistical information based on the data in the database. Perform industry research using publically available data sources Requisition and purchase private data sources to provide research and analysis…",66133.84,66133.84,,2024-08-07T08:32:42Z,https://www.adzuna.com/details/4814689290?utm_medium=api&utm_source=e1ad5111,IT Jobs,data mining,us,data mining,standard,False,False
Financial Data Analyst,Robert Half,"Woodbridge, San Joaquin County","Job Description Job Description We are looking for a highly skilled Financial Data Analyst to join our team in Woodbridge, New Jersey. This long-term contract position offers an exciting opportunity within the financial services industry, focusing on advanced actuarial modeling, financial analysis, and data management. The ideal candidate will play a key role in developing and maintaining predictive models, conducting risk assessments, and ensuring the accuracy of financial data processes. Resp…",83510,83510,,2025-05-02T10:20:59Z,https://www.adzuna.com/land/ad/5176343086?se=KhCnPO8o8BGT4w9x5LWCew&utm_medium=api&utm_source=e1ad5111&v=41E82760238D5FB6708E2AD87C9C7FD28A62DFAE,IT Jobs,data mining,us,data mining,standard,False,False
Peoplesoft Functional/ Integration Tester,Axelon Services Corporation,"New York, US","The client has a vacancy for a Peoplesoft Functional/ Integration Tester to support ongoing production maintenance and system enhancements of the HR, Benefits and Payroll functions. Under the direction of the Manager, the Peoplesoft Functional/ Integration Tester shall have the primary responsibility of ensuring the quality of the software and any associated custom development to meet the City s functional and technical requirements and enable client to operate and maintain the software applica…",105065.36,105065.36,,2025-05-01T00:56:33Z,https://www.adzuna.com/land/ad/5171849447?se=KhCnPO8o8BGT4w9x5LWCew&utm_medium=api&utm_source=e1ad5111&v=F448C010940E3B763B2D4EA48D17CCDA8833DC21,IT Jobs,data mining,us,data mining,standard,False,False
Senior - Radiology Technologist - $92K-137K per year,Mayo Clinic,"Jacksonville, Duval County","Mayo Clinic is seeking a Radiology Technologist Senior for a job in Jacksonville, Florida. Job Description & Requirements Specialty: Radiology Technologist Discipline: Allied Health Professional Start Date: ASAP Duration: Ongoing Employment Type: Staff Leads a cross-functional team and provides in-depth data insights for complex business problems which can be approached with advanced analytics techniques to collect, explore, and extract insights from structure and unstructured data to create pr…",92000,137000,,2025-04-30T13:54:09Z,https://www.adzuna.com/land/ad/5171034398?se=KhCnPO8o8BGT4w9x5LWCew&utm_medium=api&utm_source=e1ad5111&v=4BE25527D2B631DB3632B9603AFA2768AB04FBC1,IT Jobs,data mining,us,data mining,standard,False,False
Business Intelligence Analyst,PharmaEssentia USA Corporation,"Burlington, Middlesex County","Requirements: Bachelors degree in Statistics, Mathematics, or related field and 2 years of experience as Business Intelligence Analyst, Strategist, Associate, or related position. Experience with statistical modeling and data mining methods and tools for business and operational analysis. Experience collecting business intelligence data and querying the data to generate reports. Experience identifying and analyzing pharmaceutical industry and geographic trends with business strategy implication…",95335.59,95335.59,,2025-04-05T11:06:17Z,https://www.adzuna.com/details/5131122551?utm_medium=api&utm_source=e1ad5111,IT Jobs,data mining,us,data mining,standard,False,False
Trade Up Coordinator,Stuckey Automotive,"Hollidaysburg, Blair County",Job description The Vehicle exchange Coordinator will help generate sales through the service department by utilizing data mining tools to identify customers who fit the criteria to upgrade or trade in their vehicle. This position is also heavily focused on acquiring vehicles for the used car department through our service department customer base. Responsibilities include but are not limited to: Manage data mining tool (Equity Connect) in the “Quote” Platform Manage service lane positive/healt…,54087.7,54087.7,,2025-04-12T22:34:16Z,https://www.adzuna.com/details/5142861721?utm_medium=api&utm_source=e1ad5111,Sales Jobs,data mining,us,data mining,standard,False,False
Trade Up Coordinator - State College,Stuckey Automotive,"State College, Centre County",Job description The Vehicle exchange Coordinator will help generate sales through the service department by utilizing data mining tools to identify customers who fit the criteria to upgrade or trade in their vehicle. This position is also heavily focused on acquiring vehicles for the used car department through our service department customer base. Responsibilities include but are not limited to: Manage data mining tool (Equity Connect) in the “Quote” Platform Manage service lane positive/healt…,53502.39,53502.39,,2025-04-22T23:41:58Z,https://www.adzuna.com/details/5157391547?utm_medium=api&utm_source=e1ad5111,Sales Jobs,data mining,us,data mining,standard,False,False
Celonis Process Mining Hands on consultant,CapB InfoteK,"Charlotte, Mecklenburg County","For one of our ongoing multiyear project, we are looking for a Hands on Celonis Process Mining Data Architect or Lead Data enginner Hands on experience with Celonis Process Mining Strong data manipulation skills SQL Experience in Big Data Data Mining and Process Mining",79622.6,79622.6,,2024-07-31T10:14:01Z,https://www.adzuna.com/details/4802598704?utm_medium=api&utm_source=e1ad5111,IT Jobs,data mining,us,data mining,standard,False,False
Data Analyst / Business Analytics Consultant,Michael Page,"New York City, New York","We are seeking a long-term Data Analyst contractor with strong potential for conversion to a full-time role. This is a W2-only position and requires on site work 5 days a week. No visa sponsorship is available. *Client Details* Leading Chinese bank in Midtown, NY! *Description* *Dashboard Production Oversight:* Oversee and coordinate the review and approval process for dashboards across the bank, ensuring accuracy, compliance, and alignment with organizational standards. *BI Dashboard Developme…",139729.22,139729.22,,2025-04-18T00:12:33Z,https://www.adzuna.com/land/ad/5151032838?se=KhCnPO8o8BGT4w9x5LWCew&utm_medium=api&utm_source=e1ad5111&v=A90CE2740ECDD9F89FFDD220388D02079CF768A9,IT Jobs,data mining,us,data mining,standard,False,False
Genealogist/Probate Generator of HeirSearch Division,Lauth Investigations International,US,"Join us The HeirSearch Division of Lauth Investigations International is an Indianapolis-based firm with locations in Indianapolis, IN, Tampa, FL and Boulder CO. One area of focus is locating missing heirs to estates, making sure an heir has received what is rightfully theirs in the eye of the court. With our extensive resources, our highly skilled team seeks to make the process of documenting ownership a painless and efficient experience for our clients. We are looking for an ambitious Probate…",83933.17,83933.17,contract,2025-04-28T16:25:45Z,https://www.adzuna.com/details/5167352858?utm_medium=api&utm_source=e1ad5111,Admin Jobs,data mining,us,data mining,standard,False,True
Healthcare Analyst II - Must Live In CA - Healthcare Experience / Claims Experience Needed,Jobot,"Chiriaco Summit, Riverside County","Transform Healthcare with Data-Driven Insights - Join Us as a Healthcare Analyst II! Remote Work Offered - Must Reside in CA This Jobot Job is hosted by: Sean Kaufmann Are you a fit? Easy Apply now by clicking the ""Apply Now"" button and sending us your resume. Salary: $43.15 - $52.91 per hour A bit about us: The Healthcare Analyst II is responsible for developing and architecting programming logic, modeling, and machine learning algorithms for predictive analytics and reporting. If you're looki…",73086.78,73086.78,,2025-05-01T00:57:58Z,https://www.adzuna.com/land/ad/5171854103?se=KhCnPO8o8BGT4w9x5LWCew&utm_medium=api&utm_source=e1ad5111&v=81D6A6022273038C01C4BD969172E0866A5D977A,Consultancy Jobs,data mining,us,data mining,standard,True,False
Data Engineer,S3,"Charlotte, Mecklenburg County","Job Description Data Engineer Location: Charlotte, NC Pay: $70/hr - W2 ONLY Duration: 12 Month Contract Description: The primary role of the Data Engineer is to function as a critical member of a data team by designing data integration solutions that deliver business value in line with the company's objectives. They are responsible for the design and development of data/batch processing, data manipulation, data mining, and data extraction/transformation/loading into large data domains using Pyt…",126054.14,126054.14,contract,2025-04-14T20:42:25Z,https://www.adzuna.com/details/5144870451?utm_medium=api&utm_source=e1ad5111,IT Jobs,data mining,us,data mining,standard,False,False
Data Science Development Manager,"Altec Industries , Inc.","Birmingham, Jefferson County","Responsibilities Purpose Responsible for managing a team of data scientists, architecting complex enterprise data solutions, and delivering maximum business value through advanced analytics. This role will oversee the full data science lifecycle—from model ideation and development to deployment and maintenance—leveraging AWS services (particularly Amazon SageMaker) and modern MLOps best practices. Key Responsibilities Manage and mentor data scientists, fostering continuous learning Design end-t…",130752.95,130752.95,,2025-04-03T13:37:30Z,https://www.adzuna.com/land/ad/5127189356?se=KhCnPO8o8BGT4w9x5LWCew&utm_medium=api&utm_source=e1ad5111&v=AAFABEBB58E2F7E2DE2C8F344EF9BAED671C1228,IT Jobs,data mining,us,data mining,standard,False,False
Post Doctoral Scholar-Ophthalmology,University of Tennessee,"Tennessee, US","Description The postdoc scholar will participate in several research projects currently funded by the Pl. Including multi-center projects to develop various machine data mining models including convolutional neural networks (CNNs) and large language models (LLMs) to analyze retinal and corneal data including visual fields, fundus photographs, optical coherence tomography {OCT) images and genetics data for automated screening, diagnosis, prognosis, and monitoring of major eye diseases such as gl…",78650.4,78650.4,,2025-03-04T22:12:28Z,https://www.adzuna.com/details/5076018134?utm_medium=api&utm_source=e1ad5111,Scientific & QA Jobs,data mining,us,data mining,standard,False,False
