title,company,location,description,salary_min,salary_max,contract_type,created,redirect_url,category,specialty
AI Frontend Developer,Fletchers Solicitors,UK,"Role AI Frontend Developer Location- Hybrid, expect remote with one or two days per month in offices in Manchester/Liverpool Fletchers Solicitors Ltd have a fantastic opportunity to join our growing Team. Fletchers Solicitors is seeking a skilled Frontend Developer to join our growing AI team. This person will be responsible for building and maintaining scalable, high-performance web applications that support our backend systems and enable seamless integration of our AI tools. This is a core pa…",50513.41,50513.41,,2025-03-28T11:32:23Z,https://www.adzuna.co.uk/jobs/details/5115572404?utm_medium=api&utm_source=e1ad5111,IT Jobs,frontend
Senior Frontend Developer,Appius,"Bournemouth, Dorset","Position: Senior Frontend Developer Location: Bournemouth office 3-5 days per week, up to 2 days remote working. Hours: Monday to Friday (with flexi-time and hybrid working options). Salary: Subject to Experience. Role Description This is an exciting role for anyone wanting to work at the heart of a digital agency with a 25-year history and an excellent client portfolio. The role is focused on frontend development and ongoing maintenance of websites with Experience Platforms. You will develop a…",33597.34,33597.34,,2025-04-10T00:41:42Z,https://www.adzuna.co.uk/jobs/details/5137924203?utm_medium=api&utm_source=e1ad5111,IT Jobs,frontend
Frontend Software Engineer,Morgan McKinley,"London, UK","Frontend Software Engineer We are looking for an experienced Frontend Software Engineer to join an agile team. You'll play a key role in developing and improving customer experiences across a range of high-traffic digital products, for a global leader in data and technology. What You'll Do: Build and enhance high-volume web applications using React, JavaScript (ES6), TypeScript, Node.js, Redux, and SCSS. Work with Microservice architectures, consuming REST and GraphQL APIs. Utilise AWS, CI/CD t…",88400,114400,contract,2025-04-04T16:03:14Z,https://www.adzuna.co.uk/jobs/details/5129332578?utm_medium=api&utm_source=e1ad5111,IT Jobs,frontend
Frontend Software Engineer,Plexus Resource Solutions Ltd,"The City, Central London","Frontend Software Engineer (Web3 & Blockchain) Location: Remote Salary: £100K- £120K We have another great opportunity in the Web3 space. It is a company whose vision is to build the most powerful data platform for Web3. A fast-growing Web3 data platform backed by $20M in funding and they are searching for a Frontend Software Engineer to build high-performance user interfaces. Their team includes experts from Meta, Google, and Activision, working on scalable infrastructure. Responsibilities Dev…",100000,100000,,2025-03-20T03:01:13Z,https://www.adzuna.co.uk/jobs/details/5101973778?utm_medium=api&utm_source=e1ad5111,IT Jobs,frontend
Lead Frontend Engineer,Assa Abloy,UK,"Can you bring your experience to our team at ASSA ABLOY, Biosite? Join our team based in Solihull, UK and enjoy a collaborative culture that empowers you to build a career you can be proud of. This is a fully remote role. Biosite is a tried and trusted partner for the construction industry, specialising in biometric access control and workforce management software solutions since 2010. Additional, integrated solutions for fire safety, site management software and site surveillance technology, f…",57168.33,57168.33,,2025-04-16T14:30:37Z,https://www.adzuna.co.uk/jobs/details/5147387599?utm_medium=api&utm_source=e1ad5111,IT Jobs,frontend
Lead Frontend Engineer,Assa Abloy,"Solihull, West Midlands","Can you bring your experience to our team at ASSA ABLOY, Biosite? Join our team based in Solihull, UK and enjoy a collaborative culture that empowers you to build a career you can be proud of. This is a fully remote UK role. Biosite is a tried and trusted partner for the construction industry, specialising in biometric access control and workforce management software solutions since 2010. Additional, integrated solutions for fire safety, site management software and site surveillance technology…",57091.02,57091.02,,2025-04-16T00:27:01Z,https://www.adzuna.co.uk/jobs/details/5146584421?utm_medium=api&utm_source=e1ad5111,IT Jobs,frontend
Graduate Frontend Engineer,AlphaSights,"London, UK","The role: We are looking for highly driven, aspiring Frontend software engineers who take pride in their work, to expand our Engineering team in London. Successful candidates will join a cross functional team including product managers and designers working closely with the rest of our business to deliver working code that solves real problems for both internal and external customers. You will take ownership of the problems that your team solves, ensuring a high level of quality in everything t…",37954.59,37954.59,,2025-02-25T16:31:27Z,https://www.adzuna.co.uk/jobs/details/5063215699?utm_medium=api&utm_source=e1ad5111,Graduate Jobs,frontend
Senior Frontend Engineer,Wahed,"London, UK","About Wahed: We have a passion to reduce financial inequality and exclusion by building world leading financial products and services aimed at giving access to all. We are a New York headquartered Financial Technology (FinTech) company focused on serving values-based (shariah compliant) digital financial services to retail clients globally, starting with wealth management. We have an impressive global team aligned with this purpose and are looking for trail blazers in their fields that will tak…",47476,47476,,2025-03-18T17:03:19Z,https://www.adzuna.co.uk/jobs/details/5099183783?utm_medium=api&utm_source=e1ad5111,IT Jobs,frontend
Senior Frontend Engineer,Gendo,"London, UK","Location: London or Bristol (3 days a week in-office) About Gendo Gendo is a revolutionary, browser-based AI platform designed to empower architects and designers to generate accurate, high-quality visual representations of their designs in seconds, not days - a huge improvement on existing workflows. Within 18 months of founding we built an alpha product, beta product and, in summer of this year, launched our early-access product publicly. Today this product has thousands of users across many …",55597.52,55597.52,,2024-12-13T11:34:30Z,https://www.adzuna.co.uk/jobs/details/4976724280?utm_medium=api&utm_source=e1ad5111,IT Jobs,frontend
Lead Frontend Developer,InterQuest Group  Limited,"Manchester, Greater Manchester","Lead Frontend Engineer - 75k - Fully Remote (Some Travel to Manchester Required) - eCommerce ECOM are delighted to have teamed up with a leading eCommerce company on their search for a Lead Frontend Engineer to lead a team and provide technical ownership in a brilliant web app setup. The client have been established for a number of years and their eCommerce side is growing, with huge ambitions for growth. The team tend to work remotely but do occasionally get together for collaboration, so as l…",75000,75000,,2025-04-16T20:43:57Z,https://www.adzuna.co.uk/jobs/details/5148229602?utm_medium=api&utm_source=e1ad5111,IT Jobs,frontend
Senior Frontend Engineer,Thriva Limited,"London, UK","Meet our product team We have a small but mighty product team that works across both our direct-to-consumer and B2B products. Working in the healthcare space provides interesting product challenges but also great rewards when the products you build have a positive impact on the lives of our customers. We work very collaboratively with engineers, designers and product managers all getting very hands-on about the experiences we’re building. Why work with us You’ll be working alongside humble peop…",64351.46,64351.46,permanent,2025-03-03T23:55:05Z,https://www.adzuna.co.uk/jobs/details/5072825755?utm_medium=api&utm_source=e1ad5111,IT Jobs,frontend
Senior Frontend Engineer,Twist IT Recruitment,"Rusholme, Manchester","I am looking for a Senior Frontend Developer with strong React skills for a Global Insurance Business who are currently disrupting the industry. They have strong ambitions to continue growing and are always seeking the brightest people to join them on their journey. Currently, they have their Software Development mainly based in their European offices, however, as their need for innovative technical solutions grows, they are hiring more tech people including building a team based in their Manch…",55000,65000,,2025-04-02T01:07:18Z,https://www.adzuna.co.uk/jobs/details/5123079208?utm_medium=api&utm_source=e1ad5111,IT Jobs,frontend
Founding Frontend Engineer,Cerve Global,UK,"About Cerve At Cerve, our mission is to power a digitally-enabled global food system. We believe that creating a sustainable and resilient food system hinges on making data accessible and transparent. By democratising data and fostering connectivity, we empower organisations to build solutions that reduce waste, improve food security, drive growth and optimise operational efficiency. About the role As a Founding Frontend Engineer at Cerve, you will play a pivotal role in designing, developing, …",66169.42,66169.42,,2025-02-14T14:42:41Z,https://www.adzuna.co.uk/jobs/details/5049816486?utm_medium=api&utm_source=e1ad5111,IT Jobs,frontend
Principal Frontend Engineer,Fresha,"London, UK","About Fresha Fresha is the leading marketplace platform for beauty & wellness trusted by millions of consumers and businesses worldwide . Fresha is used by 120,000 businesses and 450,000 stylists and professionals worldwide , processing over 1 billion appointments to date . The company is headquartered in London, United Kingdom , with 12 global offices located across North America, EMEA and APAC. Fresha allows consumers to discover, book and pay for beauty and wellness appointments with local b…",68802.95,68802.95,,2024-07-31T15:07:56Z,https://www.adzuna.co.uk/jobs/details/4802560169?utm_medium=api&utm_source=e1ad5111,IT Jobs,frontend
Senior Frontend Engineer,Conduktor,"London, UK","About Conduktor Conduktor is an Enterprise Data Management (EDM) platform that specialises in streaming. We empower industry leaders to implement their Streaming Data Strategy with a comprehensive approach to data control, compliance, and security; unconstrained by their infrastructure providers. Our platform mitigates data security risks while enhancing communication, automation, and observability across data flows, enabling teams to collaborate effortlessly across the organisation. We have hu…",60264.14,60264.14,,2025-03-27T11:30:21Z,https://www.adzuna.co.uk/jobs/details/5113391605?utm_medium=api&utm_source=e1ad5111,IT Jobs,frontend
Product Engineer (Frontend),V7,"London, UK","V7 turns human knowledge into trustworthy AI, powering products that solve our hardest problems. Our platform lets customers build no-code AI workflows that solve knowledge work with V7 Go, and leverage expert humans to improve frontier AI model knowledge with V7 Darwin. V7 were recently ranked No 1 in Sifted’s top B2B companies for 2024 and raised a $33m Series A including the AI Fund  Radical Ventures. We are backed by some of the best minds in AI, from Ashish Vaswani (Invented Transformers, …",62866.88,62866.88,contract,2024-07-31T15:05:49Z,https://www.adzuna.co.uk/jobs/details/4802534655?utm_medium=api&utm_source=e1ad5111,IT Jobs,frontend
Frontend Developer (React),Countercheck GmbH,UK,"Intro As part of the Platform Tech team you will be involved in developing new, cool features and maintaining the existing ones for the platforms that our customers use. We’re looking for a Web/Front-End Developer fluent in English working fully remotely. The ideal candidate would be responsible for designing, developing, testing, and debugging responsive web applications for the company. Using JavaScript, HTML, and CSS, this candidate will be able to translate user and business needs into func…",45385.29,45385.29,,2023-10-21T12:42:12Z,https://www.adzuna.co.uk/jobs/details/4385052900?utm_medium=api&utm_source=e1ad5111,IT Jobs,frontend
"Product Engineer, Frontend",Granola,"London, UK","Hey We're team Granola  If you haven't already, you should check out what we're building , and why you should work here . We're looking for a frontend-focused engineer who loves building delightful user experiences in a fast-paced, iterative environment. In this role, you will craft delightful user interfaces that make complex AI capabilities accessible and valuable. You'll build responsive, performant components that enhance the quality and user experience of our application. You'll be talking…",51974.93,51974.93,,2025-03-18T17:00:15Z,https://www.adzuna.co.uk/jobs/details/5099175742?utm_medium=api&utm_source=e1ad5111,IT Jobs,frontend
"Software Engineer, Frontend",Travelex Central Services,"London, UK","Job Role: Software Engineer, Frontend Job Type: Full Time, Permanent Location: London, Hybrid Role purpose As a valued member of our engineering team, you will contribute to the development of our new web application, powered by a Headless CMS, using the latest frontend technologies. Working with a modern JavaScript stack, your primary focus will be on coding, testing, and enhancing the functionality of Travelex's and partner applications. Being part of the Online team, you will be working clos…",48727.21,48727.21,permanent,2025-03-21T12:11:25Z,https://www.adzuna.co.uk/jobs/details/5104470514?utm_medium=api&utm_source=e1ad5111,IT Jobs,frontend
"Software Engineer, Frontend",Travelex,UK,"Job Role: Software Engineer, Frontend Job Type: Full Time, Permanent Location: London, Hybrid Role purpose As a valued member of our engineering team, you will contribute to the development of our new web application, powered by a Headless CMS, using the latest frontend technologies. Working with a modern JavaScript stack, your primary focus will be on coding, testing, and enhancing the functionality of Travelex's and partner applications. Being part of the Online team, you will be working clos…",51641.62,51641.62,permanent,2025-03-20T01:47:14Z,https://www.adzuna.co.uk/jobs/details/5101898599?utm_medium=api&utm_source=e1ad5111,IT Jobs,frontend
Senior Frontend Engineer,9fin,"London, UK","About 9fin The world's largest asset class, debt, operates with the worst data. Technology has revolutionized equity markets with electronic trading, quant algos and instantaneous news. However, in debt capital markets, the picture is completely different. It still behaves like it’s in the 1980s; trillions of dollars of trades are placed over the phone, news is slow, and corporate credit information is imperfect and scattered. Our mission is to change this. 9fin's proprietary technology deliver…",55602.82,55602.82,,2025-04-15T09:12:07Z,https://www.adzuna.co.uk/jobs/details/5145314362?utm_medium=api&utm_source=e1ad5111,IT Jobs,frontend
Software Engineer (Frontend),Aurora Energy Research,"Oxford, Oxfordshire","Department: Tech - Software Development Location: Oxford, UK Description Aurora is a fast growing software-focused global business, and we're looking for a Software Engineer to own and evolve our user interface. In this role, you will be responsible for the architecture, design and evolution of our React based micro-frontend framework. Ensuring the developer experience and deployment process are best in class as well leading on creating and driving the adoption of a consistent design language. …",46661.79,46661.79,,2025-04-10T00:41:43Z,https://www.adzuna.co.uk/jobs/details/5137924265?utm_medium=api&utm_source=e1ad5111,IT Jobs,frontend
Senior Frontend Engineer,Isometric,"London, UK","About Us Isometric is the world’s most trusted carbon registry . We issue scientifically rigorous carbon credits to help Fortune 100 companies avoid greenwashing while tackling climate change. Our customers include Google, Meta, J.P. Morgan, McKinsey and Microsoft. We're growing quickly, but we’re intentional about hiring people who contribute to our unique culture. Our team is smart, meticulous and courageous—but warm, kind and supportive too. We’re looking for doers with a bias to action. If …",85000,115000,,2025-04-11T18:12:17Z,https://www.adzuna.co.uk/jobs/details/5140650540?utm_medium=api&utm_source=e1ad5111,IT Jobs,frontend
React Frontend Architect,N Consulting Ltd,"Holborn, Central London","Contract duration: 6 months Location: Fully remote in the UK  JOB DETAILS Role Title: React Frontend Architect Minimum years of experience: 10 years Required Core Skills: 1. Previous experience working as a ReactJS developer or UI Architect. 2. In-depth knowledge of JavaScript, CSS3, Semantic HTML, and front-end languages. 3. Proficiency with ReactJS, including concepts like JSX, components, state, and props. 4. Nodejs, Bootstrap experience will be added advantage Detailed Job Description: 1. L…",65000,71500,contract,2025-04-01T19:27:38Z,https://www.adzuna.co.uk/jobs/details/5122395360?utm_medium=api&utm_source=e1ad5111,IT Jobs,frontend
Junior Frontend Engineer,La Fosse,"Central London, London","Software Engineer | Hybrid | React | Node | Typescript | AWS | £55k Company Overview: La Fosse have partnered with a hypergrowth D2C company that are looking for a Junior Software Engineer with a strong JavaScript background, you can be either Full stack or Frontend focused Key Responsibilities: Develop modern web applications using TypeScript, JavaScript, Node.js, and React.js Collaborate with cross-functional teams to deliver high-quality solutions Build and maintain scalable, performant, and…",55000,55000,,2025-04-16T00:28:57Z,https://www.adzuna.co.uk/jobs/details/5146587219?utm_medium=api&utm_source=e1ad5111,IT Jobs,frontend
Lead Frontend Engineer,Acre Software,"London, UK","Better homebuying for everyone involved Acre is rebuilding the UK’s £1.4 trillion mortgage market from the ground up, with a completely new, end-to-end management system for mortgages. Our platform cuts out the unnecessary admin, pain and friction from buying a home. We're covering the entire journey, from figuring out what you can borrow, to getting your keys. We're guided both by the voice of real home buyers and by our close relationships with brokers, lenders and insurers. After a record-br…",58270.25,58270.25,,2025-02-22T14:37:47Z,https://www.adzuna.co.uk/jobs/details/5060579211?utm_medium=api&utm_source=e1ad5111,IT Jobs,frontend
Senior Frontend Engineer,Menlo Security,"Bracknell, Berkshire","Menlo Security's mission is enabling the world to connect, communicate and collaborate securely without compromise. COVID-19 has made our mission all the more real. We support customers across various enterprises including Fortune 500 companies, 9/10 of the largest global banks and the Department of Defense. The world has fundamentally changed. We are growing from 400 employees into the next phase of our journey, and we need passionate talent filled with empathy and agility. The right candidate…",50251.6,50251.6,,2025-04-10T18:14:22Z,https://www.adzuna.co.uk/jobs/details/5139017634?utm_medium=api&utm_source=e1ad5111,IT Jobs,frontend
Senior Frontend Engineer,Checkout.com,"London, UK","Global payments are complex and ever-evolving. At Checkout our software engineers develop the next-generation payments technologies that enable our Merchants to boost their acceptance rates, cut processing costs, fight fraud, and create cutting edge technology that enables extraordinary customer experiences. We're looking for engineers who bring fresh ideas, have a curious nature and are passionate about working in an Engineering environment which focuses on building products to achieve the com…",60458.02,60458.02,,2025-04-13T15:57:14Z,https://www.adzuna.co.uk/jobs/details/5143268962?utm_medium=api&utm_source=e1ad5111,IT Jobs,frontend
Frontend Software Engineer,PhysicsX,"Shoreditch, East London","Introduction PhysicsX is a deep-tech company of scientists and engineers, developing machine learning applications to massively accelerate physics simulations and enable a new frontier of optimization opportunities in design and engineering. Born out of numerical physics and proven in Formula One, we help our customers radically improve their concepts and designs, transform their engineering processes and drive operational product performance. We do this in some of the most advanced and importa…",59481.89,59481.89,,2025-01-14T14:27:32Z,https://www.adzuna.co.uk/jobs/details/5010032064?utm_medium=api&utm_source=e1ad5111,IT Jobs,frontend
