title,company,location,description,salary_min,salary_max,contract_type,created,redirect_url,category,specialty,source_country,query,query_type,remote_friendly,international
Architecte Frontend React - Startup IA & Big Data - 80K H/F,Octopus IT,"Paris, Ile-de-France","La société Créée en 2015, cette start-up en hyper-croissance fournit une solution complète pour piloter la performance des magasins, centres commerciaux et tout lieu accueillant un flux visiteur conséquent (gares, aéroports). Avec l'augmentation du e-Commerce et de la digitalisation du parcours clients : avis sur Internet, essayage en boutique puis achat sur mobile. Le CA seul ne suffit plus pour analyser les différents points de vente physique. Grâce à des réseaux de neurones appliqués en temp…",,,,2025-03-17T05:54:26Z,https://www.adzuna.fr/land/ad/5096898186?se=oC23cu0o8BGDGO_HSiZXLA&utm_medium=api&utm_source=e1ad5111&v=FFBA5BA46893C250ECFFF10D3CEF7B994E6E1C59,Emplois Informatique,frontend,fr,frontend,standard,False,False
Apprentice - Frontend Developer Angular Typescript H/F,1047 Amadeus S.A.S.,"Nice 13e Canton, Nice","Working with us in Nice, France This office is exceptionally multicultural, with more than 4000 people of around 97 nationalities working together. To get the best from our people we have created a work environment that promotes innovative ways of working and a better work-life balance. GO Explore. GO Together. Make a difference. Role Overview TSR division (Travel Shopping & Reservation) at Amadeus brings together key shopping and reservation expertise to position Amadeus as a technology leader…",486,1802,,2025-04-16T04:23:24Z,https://www.adzuna.fr/land/ad/5146759833?se=oC23cu0o8BGDGO_HSiZXLA&utm_medium=api&utm_source=e1ad5111&v=03D50E63AD2B78B1A803DA138801AEA91728143D,Unknown,frontend,fr,frontend,standard,False,False
Développeur·se Backend - Frontend .Net - SQL Server H/F,Step Up,"Talence, Bordeaux","Il s'agit d'intervenir sur l'ensemble des activités liées au cycle de vie d'un portefeuille d'IT Solutions au travers de projets et de demandes de maintenance (évolutive et corrective) sur les différents applicatifs du domaine. Nous recherchons une développeuse ou un développeur expérimenté.e, c'est-à-dire à partir de 5 ans sur une bonne partie de la stack technique. Analyse et Conception : - Compréhension du cahier des charges client et des spécifications fonctionnelles - Contribuer à l'estima…",35000,40000,,2025-04-30T12:15:40Z,https://www.adzuna.fr/land/ad/5170320863?se=oC23cu0o8BGDGO_HSiZXLA&utm_medium=api&utm_source=e1ad5111&v=6C338B7B53A03A5BA9B8E2440E09590882CB972A,Emplois Informatique,frontend,fr,frontend,standard,False,False
React Frontend Developper,Cryptonext Security,"Paris, Ile-de-France","Who we are CryptoNext Security is a deeptech startup specializing in post-quantum cryptography. Our solutions help businesses and institutions prepare for a future where quantum computers will challenge traditional data security. We work with leading clients in finance, defense, and telecommunications. On a daily basis, you will Design and develop React-based user interfaces for our post quantum cryptography products. Collaborate with Product and Backend teams to ensure a smooth and intuitive u…",,,,2025-03-04T19:03:18Z,https://www.adzuna.fr/details/5075139630?utm_medium=api&utm_source=e1ad5111,Emplois Autres/Général,frontend,fr,frontend,standard,False,False
Frontend Design Engineer,Giskard,"10ème Arrondissement, Paris","Giskard defends the vision of a Responsible AI that serves the economic performance of companies while respecting the rights of citizens. To embody this mission, we are building a holistic testing platform for AI professionals to evaluate the quality & security of Generative AI applications based on Large Language Models (LLMs). Since 2021, we've been building based on open-source foundations (4.2K stars on GitHub ) and pushing the frontier of AI Safety & Security research, to help major custom…",50,75,,2025-01-21T16:18:09Z,https://www.adzuna.fr/details/5018557492?utm_medium=api&utm_source=e1ad5111,Emplois Ingénierie,frontend,fr,frontend,standard,False,False
Senior Frontend Engineer,TheraPanacea,"8ème Arrondissement, Paris","We are looking for people ready to change the future of healthcare by building ART-Plan, an innovating web application for radio-oncology treatment and beyond that serves our AI tools in hospitals to doctors and physicists. Senior Frontend Developer Mission: • Implement and test new User Interfaces and frontend functionalities for ART-Plan • Contribute to the evolution of ART-Plan’s frontend architecture • Review frontend code, ensuring good practices and maintainability for the frontend part. …",,,,2025-03-02T17:22:57Z,https://www.adzuna.fr/details/5070790251?utm_medium=api&utm_source=e1ad5111,Unknown,frontend,fr,frontend,standard,False,False
Frontend Software Engineer,Socotec,France,"Company Description SOCOTEC is a leader in niche consulting services within the architecture, engineering, and construction industries, with a focus on high-performance buildings and specialty structures. We take an integrated, holistic approach to solving challenges in building envelopes, energy efficiency, sustainability, code advisory, and construction advisory projects. SOCOTEC's reputation for excellence continues to drive its growth and recognition as a best-in-class service provider. We …",,,,2024-10-09T03:00:57Z,https://www.adzuna.fr/details/4894719946?utm_medium=api&utm_source=e1ad5111,Emplois Hospitalité et Restauration,frontend,fr,frontend,standard,False,False
Senior Frontend Developer,Lyreco,"Valenciennes, Nord","Senior Frontend Developer works in scrum team which develops Next Generation of ecommerce frontend. In the work of the scrum team that develops new functions for the eCommerce platform. Senior Frontend Developer works in scrum team which develops Next Generation of ecommerce frontend. In the work of the scrum team that develops new functions for the eCommerce platform. Role will participate in the implementation of technical and process innovations in frontend development, help in solving any e…",,,,2025-04-24T21:33:33Z,https://www.adzuna.fr/details/5160948032?utm_medium=api&utm_source=e1ad5111,Emplois Informatique,frontend,fr,frontend,standard,False,False
Software Engineer - Frontend,Sifflet,"9ème Arrondissement, Paris","Sifflet is used by technical and less technical users alike. The design and implementation of the Sifflet web UI are critical to ensure our product is usable by all targeted personas, including data engineers, data analyst, business users… As a frontend engineer, you’ll join one of our feature teams to implement new features in the Sifflet web UI or browser extensions, and ensure the user experience meets our standards. In this role, you will: Collaborate with product managers, designers and ba…",,,,2025-02-25T17:27:56Z,https://www.adzuna.fr/details/5063212731?utm_medium=api&utm_source=e1ad5111,Emplois Informatique,frontend,fr,frontend,standard,False,False
Stage Frontend development,Haiku,"Bègles, Bordeaux","Lieu : Bordeaux / télétravail Date de début : Dès que possible Haiku : Pionnier dans l’intelligence artificielle juridique, nous révolutionnons la profession juridique avec notre assistant virtuel. Né du désir de maximiser l’efficacité des cabinets d’avocats, notre outil, conçu par des experts juridiques, apporte de l’innovation au droit sans le remplacer. Ensemble, façonnons l’avenir juridique. Description du poste : En tant qu’ingénieur(e) frontend logiciel chez Haiku, vous serez intégré(e) d…",1100,1400,,2025-03-23T12:02:29Z,https://www.adzuna.fr/details/5107588880?utm_medium=api&utm_source=e1ad5111,Unknown,frontend,fr,frontend,standard,True,False
"Software Engineer, Frontend",Dust,"Paris, Ile-de-France","About Dust We're creating a new AI operating system that has the potential to change the way companies operate . Our mission at Dust is to transform how work gets done by letting any team and employee shape the exact agents they need to accelerate their jobs. With 70% weekly active users, people stick with Dust as much as they do with Slack and Notion. We already are a core part of their jobs. We are at an exciting stage of our journey. We‘ve raised our Series A, expanded in the US, and hit the…",60000,150000,,2025-01-18T14:12:16Z,https://www.adzuna.fr/details/5015733547?utm_medium=api&utm_source=e1ad5111,Emplois Informatique,frontend,fr,frontend,standard,False,False
Senior frontend engineer,Urban Linker,"Paris, Ile-de-France","Tu intègres une squad composé de 7 personnes (en général de 4 développeurs, 2 product et 1 Data) et tes missions seront les suivantes : Faire évoluer la plateforme et développer de nouvelles solutions Travailler sur l'amélioration continue du front-end et de l'UX-UI de l'entreprise Apporter de la séniorité aux équipes, notamment sur les bonnes pratiques de code Mentorer les plus juniors afin de les aider à progresser Participer à la refonte graphique de la plateforme J-18808-Ljbffr",,,,2024-11-11T15:44:00Z,https://www.adzuna.fr/land/ad/4934710031?se=oC23cu0o8BGDGO_HSiZXLA&utm_medium=api&utm_source=e1ad5111&v=5AC8B0A91CF2E5C840950F0F5ACCB05916616118,Emplois Consultants,frontend,fr,frontend,standard,False,False
Ingénieur en développement frontend,Budgetbox,"9ème Arrondissement, Paris","Vous rejoindrez la squad en charge du développement de notre solution self-scanning. Vous développerez les applications web mobile et backoffice à destination des consommateurs et des opérateurs. Vous contribuerez à transformer l’expérience d’achat des consommateurs en magasin  En tant qu’ingénieur en développement, vous écrirez du code de qualité, simple, testé et performant, et vous participerez aux relectures de code de manière avisée et constructive. En tant qu’expert web, vous en maîtrisez…",,,,2025-01-08T14:04:28Z,https://www.adzuna.fr/details/5002026641?utm_medium=api&utm_source=e1ad5111,Unknown,frontend,fr,frontend,standard,False,False
Frontend VueJS Developer,Leetchi,"9ème Arrondissement, Paris","Leetchi est la cagnotte en ligne de référence avec 3 millions de visiteurs uniques chaque mois. Depuis sa création en 2009, la plateforme facilite la générosité grâce à une cagnotte en ligne simple, rapide et sécurisée. Elle permet à chacun·e de réaliser le projet qui lui tient à cœur en collectant de l’argent pour offrir un cadeau commun, organiser un événement à plusieurs ou concrétiser un projet solidaire. En 2024, 275 millions d’euros ont été collectés sur la plateforme dont 62 millions d’e…",,,,2025-03-30T21:00:27Z,https://www.adzuna.fr/details/5119201824?utm_medium=api&utm_source=e1ad5111,Emplois Informatique,frontend,fr,frontend,standard,False,False
Stagiaire Frontend Developer,onRuntime,France,"Qui sommes nous ? onRuntime Studio onRuntime Studio est une association, un studio français spécialisé dans la création et le développement d'applications, de sites web et de plateformes de jeux. Notre équipe de créateurs passionnés (développeurs, designers, communicants etc.) travaille main dans la main pour donner vie à des projets numériques innovants. Chez onRuntime Studio, nous valorisons la créativité, l'apprentissage continu et la passion pour la technologie. En tant qu'association, nous…",,,,2025-03-13T10:52:44Z,https://www.adzuna.fr/details/5091047589?utm_medium=api&utm_source=e1ad5111,Emplois Informatique,frontend,fr,frontend,standard,False,False
Developpeur frontend (VueJS),KLANIK,"Rhône, Auvergne-Rhône-Alpes","Cette consultation fait suite à un besoin identifié au sein de la Squad Legal de la unit Corp Business Applications en charge du développement, de l'automatisation et de l'intégration des outils nécessaire au département juridique d'OVH. La squad Legal d'OVH gère les projets et le RUN du SI légal d'OVH. Cette prestation s'inscrit dans le cadre de la réalisation d'interfaces utilisateurs pour le service juridique de l'entreprise. Ces outils sont en lien avec différentes activités avec entre autr…",,,permanent,2025-04-30T00:49:56Z,https://www.adzuna.fr/details/5169505609?utm_medium=api&utm_source=e1ad5111,Emplois Informatique,frontend,fr,frontend,standard,False,False
Frontend Developer (VueJS),GlobalExam,"17ème Arrondissement, Paris","Chez GlobalExam, nous aidons nos utilisateurs à relever les défis de leur vie professionnelle et académique grâce à une plateforme innovante. Nous croyons que la technologie ne remplace pas l’humain mais aide plutôt l’humain à faire ce qu’il sait faire de mieux. En rejoignant notre équipe, vous ferez partie d’une communauté passionnée, engagée dans la réussite collective et l’accompagnement des talents à travers le monde. Si vous partagez notre vision et souhaitez contribuer à notre mission en …",44000,50000,,2025-04-26T21:46:26Z,https://www.adzuna.fr/details/5164851476?utm_medium=api&utm_source=e1ad5111,Emplois Informatique,frontend,fr,frontend,standard,False,True
"Développeur Front-End Mobile - Expertise en Micro-frontend, React Native H/F",CRIT France,"Paris, Ile-de-France","Plongez au cœur de l'Innovation avec le Groupe CRIT et rejoignez-nous en tant que Développeur Front-End Mobile React Native ! Passionné(e) par la création d'expériences mobiles exceptionnelles, les architectures modulaires et les défis technologiques stimulants ? Le Groupe CRIT, leader du travail temporaire et du recrutement en France, recherche un(e) Développeur Front-End Mobile talentueux(se) pour rejoindre notre équipe innovation. Si React Native est votre terrain de jeu favori, que vous ête…",,,,2025-04-21T04:48:52Z,https://www.adzuna.fr/land/ad/5154913825?se=oC23cu0o8BGDGO_HSiZXLA&utm_medium=api&utm_source=e1ad5111&v=7363E91CC39FAE4EABD33FDDBE8FB06B4514BAFE,Unknown,frontend,fr,frontend,standard,False,False
Alternance - Frontend Web Developer For Trading Solutions H/F,Axa IM,"Puteaux, Nanterre","DÉCOUVREZ votre opportunité Description du Département : Le/la candidat(e) sera intégré(e) au département Technology Transversal Products d'AXA Investment Managers. Ce département fourni des solutions IT aux différentes expertises métier. Plus précisément le/la candidat(e) sera intégré(e) à l'équipe Technology Front Office Factory dédiée au département Trading, Securities Financing and Derivative. Cette équipe est en charge des outils informatiques utilisés par les traders et est composée d'une…",486,1802,,2025-04-26T07:41:34Z,https://www.adzuna.fr/land/ad/5163531400?se=oC23cu0o8BGDGO_HSiZXLA&utm_medium=api&utm_source=e1ad5111&v=A1057557F09716BFC7C1BC52B21C313DAD0AB224,Emplois Comptabilité et Finance,frontend,fr,frontend,standard,False,False
Développeur Frontend Angular (IT),Tenth Revolution Group,"Paris, Ile-de-France","Développeur Frontend Angular Confirmé / Senior Dans le cadre de la modernisation complète d?un outil métier central pour les équipes internes, nous accompagnons un client final basé à Paris dans la recherche d?un Développeur Frontend Angular confirmé ou senior. L?application, véritable colonne vertébrale du quotidien opérationnel, doit faire peau neuve pour offrir une interface moderne, performante et facile à faire évoluer dans le temps. Vos missions :Participer au design et au développement d…",500,550,contract,2025-04-10T13:29:01Z,https://www.adzuna.fr/details/5138602488?utm_medium=api&utm_source=e1ad5111,Emplois Informatique,frontend,fr,frontend,standard,False,False
Ingénieur.e Développement Frontend,Humanship Partner,"Bas-Rhin, Grand-Est","Description Humanship Partner , premier cabinet de recrutement avec coaching intégré, accompagne son partenaire, société de conseil spécialisée dans la transformation digitale et l’ingénierie logicielle , dans la recherche d’un.e Ingénieur.e Développement Frontend . Recruté.e par ce partenaire, vous interviendrez en mission longue au sein de la Direction des Systèmes d’Information d’un acteur majeur de l’assurance de personnes , engagé dans une modernisation complète de son SI et la refonte de …",30000,36000,contract,2025-03-19T11:43:20Z,https://www.adzuna.fr/details/5100752335?utm_medium=api&utm_source=e1ad5111,Unknown,frontend,fr,frontend,standard,False,False
Frontend Engineer (m/f/d),Hornetsecurity France,"Lannoy, Lille","Intro Notre équipe « UX/UI » composée de designers et de développeurs conçoit et développe les produits du groupe Hornet mais aussi notre Design System. En vue de continuer à transformer nos produits, nous recherchons un(e) Frontend Engineer pour compléter notre équipe. Missions Qu'est-ce qui rend l'équipe UX/UI géniale ? Une superbe ambiance, au travail comme en dehors et qui s’adapte à tous les profils Une équipe d’une quinzaine de personnes, repartie entre ingénieurs et designers On design e…",,,,2025-04-14T21:26:05Z,https://www.adzuna.fr/details/5144606377?utm_medium=api&utm_source=e1ad5111,Unknown,frontend,fr,frontend,standard,False,False
Senior frontend developer (React),LegalVision,"Gironde, Nouvelle-Aquitaine","En tant que Développeur·se Frontend Senior spécialisé·e React , tu seras un pilier de notre équipe produit pour concevoir une interface performante, élégante et intelligente, au service d’un usage métier exigeant. Ton objectif : délivrer une expérience utilisateur fluide, performante et fiable, tout en contribuant activement à la qualité et à la maintenabilité du code. A savoir : Concevoir, développer et maintenir une interface React moderne, performante et évolutive, avec un haut niveau d’atte…",,,,2025-04-12T21:50:19Z,https://www.adzuna.fr/details/5142523740?utm_medium=api&utm_source=e1ad5111,Emplois Informatique,frontend,fr,frontend,standard,False,False
Developpeur Frontend react JS,PROPULSE IT,"Essonne, Ile-de-France","PROPULSE IT recherche un développeur Frontend JS Dans ce cadre, les missions et travaux à mener en tant que développeur sur l'applicatif du cockpit du SI sont : Cette prestation aura pour objectif principal la maintenance et la production sur la base des technologies existantes mais également de travailler avec l'équipe en charge de la refonte de la couche technique sous-jacente. •Prendre en main l'architecture existante, •Participer aux activités de corrections des Faits Techniques pouvant êtr…",,,permanent,2025-04-25T00:48:19Z,https://www.adzuna.fr/details/5161293352?utm_medium=api&utm_source=e1ad5111,Emplois Informatique,frontend,fr,frontend,standard,False,False
Frontend Engineer H/F,Talend,"Pont-Rousseau, Rezé","Description What makes us Qlik? A Gartner® Magic Quadrant Leader for 15years in a row, Qlik transforms complex data landscapes into actionable insights, driving strategic business outcomes. Serving over 40,000 global customers, our portfolio leverages pervasive data quality and advanced AI/ML capabilities that lead to better decisions, faster. We Excel in integration and governance solutions that work with diverse data sources, and our real-time analytics uncover hidden patterns, empowering tea…",,,,2025-04-05T02:52:59Z,https://www.adzuna.fr/details/5130298965?utm_medium=api&utm_source=e1ad5111,Emplois Informatique,frontend,fr,frontend,standard,False,True
Ganacos Frontend F/H,Talents Digital,"Nantes, Loire-Atlantique","Nous sommes à la recherche d'un(e) développeur(se) frontend passionné(e) et innovant(e) pour rejoindre notre équipe dynamique. En tant que développeur frontend, vous serez responsable de la création et de l'optimisation d'interfaces utilisateur attrayantes et fonctionnelles, en veillant à offrir une expérience utilisateur exceptionnelle. Vous travaillerez en étroite collaboration avec nos designers et développeurs backend pour assurer l'intégration harmonieuse des éléments visuels et techniques…",40000,40000,permanent,2025-04-23T07:45:28Z,https://www.adzuna.fr/details/5157498287?utm_medium=api&utm_source=e1ad5111,Emplois Industrie et Construction,frontend,fr,frontend,standard,False,False
Senior Software Engineer - Frontend,Datadog,"Paris, Ile-de-France","As a Software Engineer - Frontend on a feature team, you'll be responsible for building an intuitive, responsive product. Your work will help thousands of customers to monitor the health and performance of their systems, no matter the scale. In this capacity, you’ll use tools like React and Typescript to help streamline the flow of data from platform to user, enable seamless pivots from one view to the next, and build a powerful yet easy-to-use platform. You will work on complex frontend challe…",,,,2024-12-13T13:54:47Z,https://www.adzuna.fr/details/4976804693?utm_medium=api&utm_source=e1ad5111,Emplois Informatique,frontend,fr,frontend,standard,False,False
Développeur Angular Frontend – CDI,Vidal,"Hérault, Occitanie","Pourquoi rejoindre Weda ?  Depuis notre création en 2010, nous avons su combiner expertise, passion et innovation pour devenir un acteur incontournable dans le domaine des logiciels médicaux en ligne. Fondée par les visionnaires Fabrice Greenbaum et Steven Golding-Dwyre (créateurs du tout premier logiciel de gestion médicale sous Windows), notre histoire a toujours été marquée par des avancées significatives pour la santé connectée.  De la première lecture de Carte Vitale chez les praticiens en…",,,,2025-04-19T21:50:54Z,https://www.adzuna.fr/details/5153846442?utm_medium=api&utm_source=e1ad5111,Unknown,frontend,fr,frontend,standard,False,False
Senior Frontend Engineer (PMP),Didomi,"Paris, Ile-de-France","We are looking for a Senior Frontend Engineer to join our Engineering team. Our main office is in Paris, but we are a very distributed team with people working remotely across Europe and the Americas. Leveraging your experience in building and maintaining complex front-end applications, you will drive the development of our user-facing web applications built with React , ensuring high performance, excellent user experience, and strong maintainability. You will join our PMP (Preference Managemen…",,,,2025-05-02T21:50:20Z,https://www.adzuna.fr/details/5177252483?utm_medium=api&utm_source=e1ad5111,Unknown,frontend,fr,frontend,standard,True,False
Développeur Frontend JS (alternance),Happypal,"10ème Arrondissement, Paris","En tant que Développeur Frontend JS , vous jouerez un rôle clé dans la conception et le développement de nos solutions techniques. Vous serez directement rattaché a votre SquadLead et travaillerez en Squad aux côtés d’un Product Manager , d’un Product Designer , et les autres développeurs qui composent votre équipe. Tes missions Développer des features de A à Z , depuis leur conception technique jusqu’à leur mise en production. Garantir un code de qualité et respecter les standards de développe…",,,,2025-04-28T21:27:35Z,https://www.adzuna.fr/details/5167250247?utm_medium=api&utm_source=e1ad5111,Unknown,frontend,fr,frontend,standard,False,False
Remote Frontend Developer (React),Scanz,France,"Scanz is the developer of the fastest and most actionable trader workstation in the market. Our proprietary terminal helps thousands of traders identify market-moving opportunities via powerful scanners, alerts, news feeds, and charts. Since 2002, we've been helping traders stay ahead of market movements. The Role We're seeking an exceptional Frontend Developer who combines strong React expertise with an eye for design to help evolve our trader workstation. You'll be working on features that pr…",,,,2025-04-03T15:45:53Z,https://www.adzuna.fr/details/5126286517?utm_medium=api&utm_source=e1ad5111,Unknown,frontend,fr,frontend,standard,True,False
Senior Frontend Web Developer,Pictarine,"Labège;, Castanet-Tolosan","Missions and challenges  Et si tu venais révolutionner le monde de l’impression photo avec nous ? Au fur et à mesure de la croissance de Pictarine, nos besoins, et par conséquent nos projets Web, se sont multipliés. Tu rejoindras une équipe de 7 personnes qui a pour mission de développer et faire évoluer nos applications web aussi bien internes qu’externes. Au sein du département Engineering , composé de 4 pôles (Frontend, Backend, IA et Data), l’équipe Web est l’une des trois équipes du Pôle F…",,,,2025-03-06T18:58:41Z,https://www.adzuna.fr/details/5079499908?utm_medium=api&utm_source=e1ad5111,Unknown,frontend,fr,frontend,standard,False,False
Dévveloppeur Frontend Angular (IT),CAT-AMANIA,"Gironde, Nouvelle-Aquitaine","Mission Participer à la conception et assurer la traduction technique des User Stories Développer les nouvelles fonctionnalités côté front-end ANGULAR Participer à l'amélioration de la qualité du code Assurer le déploiement et le suivi des applications en production Partager les bonnes pratiques, les difficultés rencontrées, l?avancement des projets avec l?équipe Présence sur Bordeaux 2j / semaine TECHNICAL ENVIRONMENT Angular 18, Typescript RxJs & NgRx NiceToHave : AWS / NestJS Intégration con…",,,contract,2025-03-18T12:04:24Z,https://www.adzuna.fr/details/5098616539?utm_medium=api&utm_source=e1ad5111,Emplois Informatique,frontend,fr,frontend,standard,False,False
