title,company,location,description,salary_min,salary_max,contract_type,created,redirect_url,category,specialty,source_country,query,query_type,remote_friendly,international
"Video Streaming Engineer - Imaging, Playback and Review Tools",DNEG,UK,"Description Position at DNEG English version will follow Rédigé au masculin pour alléger le texte Résumé DNEG recherche un ingénieur logiciel C++ expérimenté pour rejoindre l’équipe derrière xSTUDIO , notre application open source de lecture vidéo et de revue d’images conçue pour les industries du VFX et de l’animation. Dans ce rôle, vous contribuerez au développement d’une solution de diffusion en temps réel de vidéo HD entre nos studios à l’international, avec l’objectif d’offrir une expérien…",51049.81,51049.81,,2025-04-27T17:16:56Z,https://www.adzuna.co.uk/jobs/details/5165760865?utm_medium=api&utm_source=e1ad5111,IT Jobs,ingénieur logiciel,gb,ingénieur logiciel,standard,False,True
Machine Learning: Performance Developer Remote or Hybrid Canada or United States,Autodesk,"SoMa, San Francisco","Job Requisition ID  25WD85972 25WD85972, Machine Learning : Développeur de performances French translation will follow!/La traduction en français suivra! Présentation du poste Le travail que nous faisons chez Autodesk touche presque chaque personne sur la planète. En créant des outils logiciels pour la construction de bâtiments, de machines et même des derniers films, nous influençons et donnons les moyens d'agir à certaines des personnes les plus créatives au monde. En tant qu'ingénieur en app…",123043.71,123043.71,,2025-02-24T09:15:08Z,https://www.adzuna.com/details/5062118834?utm_medium=api&utm_source=e1ad5111,Engineering Jobs,ingénieur logiciel,us,ingénieur logiciel,standard,True,False
Responsable Technique Logiciels,Mobyclic,US,"Informations générales Référence Equans_60781 Filière Métier Réf métier Bouygues SA - INFORMATIQUE Intitulé du poste Responsable Technique Logiciels Contrat CDI Temps de travail Temps complet Description de la mission Saviez-vous que chez Equans, nos équipes Ineo Defense interviennent sur des projets critiques et stratégiques de la Défense Nationale en concevant et produisant des solutions complexes, innovantes et uniques afin de répondre aux besoins stratégiques des forces armées ? Ineo Défens…",53237.62,53237.62,,2025-03-03T19:08:24Z,https://www.adzuna.com/details/5072853773?utm_medium=api&utm_source=e1ad5111,IT Jobs,ingénieur logiciel,us,ingénieur logiciel,standard,False,False
Responsable Technique Logiciels,Groupe Bouygues,US,"Informations générales Référence Equans_60781 Date de parution 08/05/2025 Filière Métier Réf métier Bouygues SA - INFORMATIQUE Intitulé du poste Responsable Technique Logiciels Contrat CDI Temps de travail Temps complet Description de la mission Saviez-vous que chez Equans, nos équipes Ineo Defense interviennent sur des projets critiques et stratégiques de la Défense Nationale en concevant et produisant des solutions complexes, innovantes et uniques afin de répondre aux besoins stratégiques des…",59515.6,59515.6,,2025-03-03T19:05:15Z,https://www.adzuna.com/details/5072847462?utm_medium=api&utm_source=e1ad5111,IT Jobs,ingénieur logiciel,us,ingénieur logiciel,standard,False,False
Software Engineer (Jr to Sr Levels),nomic,US,"About us: Nomic was founded with the purpose of making biology easier to measure. To do this, we have untangled some of the most difficult problems in protein profiling. Our team is combining DNA nanotechnology, high-dimensional flow cytometry, laboratory automation, and machine learning to develop the world’s highest throughput proteomic platform: the nELISA. Since spinning out of McGill University, we have partnered with and provided platform access to dozens of drug discovery groups includin…",78663.91,78663.91,,2024-08-08T09:50:50Z,https://www.adzuna.com/details/4816981591?utm_medium=api&utm_source=e1ad5111,Scientific & QA Jobs,ingénieur logiciel,us,ingénieur logiciel,standard,False,False
Ingénieur logiciel Java,FINAXYS,"Nantes, Loire-Atlantique","Au sein de l’équipe de développement agile, votre rôle sera de participer aux développements afin de faire évoluer le produit au fil des besoins du projet. Vos tâches : · Vous participez activement à la vie de l’équipe et êtes autonomes sur l'attribution des tâches · Vous concevez des solutions pour répondre au besoin du Produit et contribuez au maintien des outils de l'équipe · Vous réalisez des estimations de charge ou de complexité d’une évolution et des tâches à effectuer, vous remontez les…",,,,2025-04-30T07:24:02Z,https://www.adzuna.fr/land/ad/5169960475?se=EiGGQ2Mw8BGJwwQk3LWCew&utm_medium=api&utm_source=e1ad5111&v=0AB094111F2B62ED421739C643D3EFED2C0224FA,Emplois Comptabilité et Finance,ingénieur logiciel,fr,ingénieur logiciel,standard,False,False
Ingénieur Logiciel Expert H/F,Docaposte,"Bouches-du-Rhône, Provence-Alpes-Côte d'Azur","Description de la mission Développeur polyvalent en capacité de modéliser clairement des problématiques métiers, parfois complexes, propre au logiciel EDT. Missions principales : - Modélisation et co-construction avec l'équipe design et les testeurs logiciels des nouvelles fonctionnalités de EDT. - Correction des anomalies remontées - Evolution de la base de données SCOLYS (requêtes, services, tests unitaires) - Refactoring et refontes diverses pour maintien à l'état de l'art technique. - Rédac…",,,,2025-03-28T08:32:40Z,https://www.adzuna.fr/land/ad/5115415430?se=EiGGQ2Mw8BGJwwQk3LWCew&utm_medium=api&utm_source=e1ad5111&v=6522FFA3776E3B2CBC38B59861C27A02763BE707,Emplois Autres/Général,ingénieur logiciel,fr,ingénieur logiciel,standard,False,False
Ingénieur logiciel/Ingénieure logiciel,Groupe DLSI,"Villebon-sur-Yvette, Palaiseau","Le Groupe DLSI et son agence d'Orsay recrutent pour un de leurs clients, un : Ingénieur Logiciel (h/f) Votre profil Titulaire d’un Bac 5 en informatique, électronique ou formation généraliste avec une spécialisation en développement logiciel 2 ans d'expérience minimum dans un domaine similaire Maîtrise des langages Python et C++ Connaissance de frameworks comme Django, Flask ou Pyramid Esprit de synthèse et sens de l'organisation Capacité à travailler en autonomie et en équipe Votre mission Dév…",,,,2025-05-07T04:12:16Z,https://www.adzuna.fr/land/ad/5184406365?se=EiGGQ2Mw8BGJwwQk3LWCew&utm_medium=api&utm_source=e1ad5111&v=830496974EC41FF91A428078E686C55E7388A7E2,Unknown,ingénieur logiciel,fr,ingénieur logiciel,standard,False,False
Ingénieur logiciel/Ingénieure logiciel,Paragon Western Europe,"Marcq-en-Baroeul, Lille","Type de contrat : CDI  Expérience requise : Minimum 3 ans  Qui sommes-nous ? Le Groupe Paragon, leader mondial de la transformation des process métiers, de la communication client omnicanale et de l'identification des produits et des personnes est présent à l'international dans 17 pays et emploie plus de 10 000 personnes à travers l'Europe pour un chiffre d'affaires annuel de plus d'1,5 milliards d'€. Notre région, Paragon Western Europe, représente 2000 collaborateurs et 300m€ de CA. Dans le …",,,,2025-04-30T07:25:47Z,https://www.adzuna.fr/land/ad/5169961398?se=EiGGQ2Mw8BGJwwQk3LWCew&utm_medium=api&utm_source=e1ad5111&v=AB56BF893D0B055DA20FD42CC2EB0FBE180ED91F,Unknown,ingénieur logiciel,fr,ingénieur logiciel,standard,False,True
Ingénieur logiciel/Ingénieure logiciel,Thales,France,"Nous recherchons un Ingénieur Full Stack (F/H) Quelques mots sur les activités numériques de Thales : Les activités numériques représentent une entité rattachée au groupe Thales, spécialisée dans l’IT et présente au national. L’agence de Montbonnot adresse divers sujets d’expertise : ingénierie logiciels, cybersécurité, infogérance des infrastructures et transformation digitale. Votre rôle et missions Travailler au sein d'une équipe Scrum avec d'autres développeurs de logiciels, en mode Agile C…",,,,2025-04-21T04:49:25Z,https://www.adzuna.fr/land/ad/5154914988?se=EiGGQ2Mw8BGJwwQk3LWCew&utm_medium=api&utm_source=e1ad5111&v=D4F3EB5F90F279E7484231F94B4BEB8EF508589C,Unknown,ingénieur logiciel,fr,ingénieur logiciel,standard,False,False
Ingénieur logiciel/Ingénieure logiciel,UpTalent,"Romans-sur-Isère, Valence","Bienvenue chez UpTalent ! Experts et passionnés, nous accompagnons et conseillons nos clients sur le recrutement de profils digitaux et IT. N'hésitez pas à consulter nos annonces sur notre site : https://up-talent.fr/nos-offres-demploi Notre client basé à Romans-Sur-Isère est un éditeur et intégrateur proposant des solutions SIRH innovantes pour la gestion des ressources humaines dans plus de 25 pays dans le monde. Dans le cadre de son développement, nous recherchons un Chef de projet SIRH (H/F…",,,,2025-04-21T04:48:52Z,https://www.adzuna.fr/land/ad/5154913891?se=EiGGQ2Mw8BGJwwQk3LWCew&utm_medium=api&utm_source=e1ad5111&v=A889ADB59CE426B1C496A56A27913302ABA1916A,Unknown,ingénieur logiciel,fr,ingénieur logiciel,standard,False,False
Ingénieur Logiciel Sécurité Expérimenté H/F,ELSYS Design,"Vallauris-Antibes-Ouest, Grasse","Description du poste : Dans le cadre du développement d'une nouvelle plate-forme SoC à base de double coeur ARM Cortex A7, l'objectif du projet est de fournir une expertise technique en Cyber Sécurité, orientée développement embarqué. Ces nouvelles fonctions permettront de sécuriser la plate-forme, qui pourrait être soumise à des attaques réseau ou à du hacking in-situ. Les différentes tâches à réaliser sont : - Etude de l'architecture du SoC et de la plate-forme - Etude des OS (Linux et VxWork…",30000,40000,,2025-04-24T07:18:42Z,https://www.adzuna.fr/land/ad/5159569643?se=EiGGQ2Mw8BGJwwQk3LWCew&utm_medium=api&utm_source=e1ad5111&v=BE6053C3667BECB04349290D80A0333203221DC5,Emplois Comptabilité et Finance,ingénieur logiciel,fr,ingénieur logiciel,standard,False,False
Ingénieur Logiciel Embarqué F/H,ELITYS,"Ile-de-France, France","Vous souhaitez rejoindre une entreprise innovante et challengeante dans l’univers de l’Industrie ?  Elitys propose une nouvelle expérience du conseil et de la gestion de carrière des ingénieurs. Donner du sens et favoriser la valeur travail sont au cœur de nos préoccupations. Selon nous, l’évolution passe par le développement des compétences professionnelles autant que par l’encouragement des initiatives personnelles. Notre vocation est d’être pour chacun de nos ingénieurs une réelle force de c…",,,,2024-03-06T08:09:52Z,https://www.adzuna.fr/land/ad/4595023069?se=EiGGQ2Mw8BGJwwQk3LWCew&utm_medium=api&utm_source=e1ad5111&v=625D3B591E86C0563248BF5450F7BB7F5261BC6E,Unknown,ingénieur logiciel,fr,ingénieur logiciel,standard,False,False
Ingénieur logiciel embarqué F/H,Elitys,"Ile-de-France, France","Vous souhaitez rejoindre une entreprise innovante et challengeante dans l’univers de l’Industrie ?  Elitys propose une nouvelle expérience du conseil et de la gestion de carrière des ingénieurs. Donner du sens et favoriser la valeur travail sont au cœur de nos préoccupations. Selon nous, l’évolution passe par le développement des compétences professionnelles autant que par l’encouragement des initiatives personnelles. Notre vocation est d’être pour chacun de nos ingénieurs une réelle force de c…",,,,2024-07-17T06:03:26Z,https://www.adzuna.fr/land/ad/4782552090?se=EiGGQ2Mw8BGJwwQk3LWCew&utm_medium=api&utm_source=e1ad5111&v=A5E24A02710AA67DD044EA237C82C7047E6CB739,Unknown,ingénieur logiciel,fr,ingénieur logiciel,standard,False,False
Ingénieur Logiciel Embarqué (H/F),ALTEN,"Brest, Finistère","Description de l'entreprise Leader mondial de l'Ingénierie et du Conseil en Technologies (ICT), ALTEN accompagne la stratégie de développement de ses clients dans les domaines de l’innovation, de la R&D et des systèmes d’information. Créé il y a 35 ans et présent dans plus de 30 pays, le Groupe a réalisé un chiffre d'affaires de plus de 3 milliards d'euros en 2022 et compte actuellement 57000 collaborateurs, dont 88% sont des ingénieurs. Labellisé top employeur 2024 , ALTEN intervient auprès de…",,,,2025-03-07T03:44:47Z,https://www.adzuna.fr/land/ad/5080164443?se=EiGGQ2Mw8BGJwwQk3LWCew&utm_medium=api&utm_source=e1ad5111&v=9E06C5B06880AE3E48510A32524557AB0E32AD8D,Unknown,ingénieur logiciel,fr,ingénieur logiciel,standard,False,False
Ingénieur Logiciel Contrôle-Commande - Confirmé H/F,TECHNICATOME,"Aix en Provence Sud-Ouest, Aix-en-Provence","TechnicAtome recrute pour le site d'Aix-en-Provence son/sa futur(e) Ingénieur logiciel contrôle-commande. Intégré au métier du développement logiciel du contrôle-commande, vous jouez un double rôle clé : - Vous prenez part au développement des logiciels - Vous assurez le maintien et l'optimisation des moyens de développement (réseaux, serveur, outils). Ce poste a un rôle essentiel dans la définition et la gestion des environnements de travail pour nos équipes de développement et dans le maintie…",,,,2025-03-04T06:35:21Z,https://www.adzuna.fr/land/ad/5073437805?se=EiGGQ2Mw8BGJwwQk3LWCew&utm_medium=api&utm_source=e1ad5111&v=7DF42B52746008BBAE9CBC192B6C6F7D2645D2BD,Emplois Fabrication,ingénieur logiciel,fr,ingénieur logiciel,standard,False,False
Ingénieur Logiciel Labview pour Bancs Optroniques H/F,MBDA,"Le Plessis-Robinson, Antony","La Direction Engineering soutient nos programmes dans la conduite des activités d'ingénierie et des essais, met en oeuvre les méthodes d'optimisation de notre excellence technique et garantit un service optimal auprès de nos clients. Au sein du service Équipements et Moyens optroniques (EM) de MBDA France, votre mission est de définir, réaliser, et valider l'architecture logicielles des moyens optroniques développés pour ses différents systèmes de missiles. En tant qu'Ingénieur développement lo…",,,,2025-02-27T05:59:07Z,https://www.adzuna.fr/land/ad/5065246125?se=EiGGQ2Mw8BGJwwQk3LWCew&utm_medium=api&utm_source=e1ad5111&v=FACA6E3B25CEDDCA89F455082D9E99F0068794C4,Unknown,ingénieur logiciel,fr,ingénieur logiciel,standard,False,False
Ingénieur logiciel embarqué,Silkhom,"Metz, Metz-Ville","Au sein d’une équipe composée de 8 personnes (ingénieurs logiciel embarqué, ingénieurs systèmes, ingénieurs validation) vous serez directement rattaché au responsable R&D du pôle électronique. Vous participerez au développement et à l’intégration de nouvelles fonctionnalités embarquées dans les presses agricoles de la société. De plus, vous participerez également à l’amélioration continue des produits existants, afin d’optimiser la précision des équipements. Vos missions seront : - Rédaction du…",,,permanent,2025-05-07T12:31:46Z,https://www.adzuna.fr/land/ad/5184999674?se=EiGGQ2Mw8BGJwwQk3LWCew&utm_medium=api&utm_source=e1ad5111&v=537EDF84C9438645F77BCA5CABCF9C54BB1CDB07,Unknown,ingénieur logiciel,fr,ingénieur logiciel,standard,False,False
Ingénieur Logiciel Java - Client Lourd H/F,Hager Group,"Marmoutier, Saverne","Pourquoi rejoindre la BU Energy management ? Notre Business Unit Hager Energy est dédiée aux produits de management de l'énergie avec essentiellement des bornes de charge pour véhicule électrique ainsi que des bornes de stockage d'énergie. 100% propriété du groupe Hager, la BU est structurée comme une PME et rassemble sur site les équipes nécessaires au bon développement des produits. Vous apprécierez la flexibilité et la convivialité d'une petite structure, tout en bénéficiant des avantages d'…",,,,2025-02-04T19:55:31Z,https://www.adzuna.fr/land/ad/5037288342?se=EiGGQ2Mw8BGJwwQk3LWCew&utm_medium=api&utm_source=e1ad5111&v=5284C17C13E31EFC59F0E9DA606FF837C71A8A50,Unknown,ingénieur logiciel,fr,ingénieur logiciel,standard,False,False
Ingénieur logiciel Embarqué/Ingénieure logiciel Embarqué,CAHORS,France,"Groupe Cahors (46), cherche son ou sa futur(e) Développeur de Logiciel Embarqué F/H sur son site de Mercuès (46). Intégré au service Bureau d’Etudes, l’Ingénieur Logiciel Embarqué (H/F) est en charge de la conception logicielle des produits électroniques destinés à être utilisés pour le pilotage et le contrôle des réseaux électriques, ou ceux composant une partie d’un réseau Smartgrid. Vos activités principales seront : La rédaction de spécifications techniques La définition de l’architecture l…",,,,2025-04-30T07:24:09Z,https://www.adzuna.fr/land/ad/5169960526?se=EiGGQ2Mw8BGJwwQk3LWCew&utm_medium=api&utm_source=e1ad5111&v=79D599E58A8CA2308729149F31FF1CB4393E7DF3,Unknown,ingénieur logiciel,fr,ingénieur logiciel,standard,False,False
Ingénieur Logiciel Backend Python H/F,BeeBryte - New Ways for Energy Efficiency,"Lyon, Rhône","Vous souhaitez rejoindre une jeune entreprise française (et singapourienne) en forte croissance, tournée vers l’innovation et l’international ?  Vous êtes soucieux(se) des défis énergétiques et environnementaux de notre époque, et vous voulez contribuer concrètement à la sobriété énergétique et à la réduction des émissions de CO2 ?  Alors rejoignez-nous !  Implantée en France (Lyon, Rennes), à Singapour et en Espagne et forte d’une expertise transdisciplinaire (IT, data-science, génie thermique…",,,,2025-05-02T09:08:15Z,https://www.adzuna.fr/land/ad/5175641336?se=EiGGQ2Mw8BGJwwQk3LWCew&utm_medium=api&utm_source=e1ad5111&v=E38D2C61EB6B1DF58EC61ECC02DB27E7A6A5FD99,Unknown,ingénieur logiciel,fr,ingénieur logiciel,standard,False,True
Ingénieur logiciel Java/Ingénieure logiciel Java,Capgemini,"Montpellier, Hérault","L’heure est arrivée de booster ta carrière et Capgemini Financial Services est fait pour toi ! Notre site Montpelliérains est en quête de nouveaux talents pour accompagner sa croissance , et recherche Une ingénieure / Un ingénieur logiciel Java confirmé .e pour intégrer nos équipes CCA (Cloud and Custom Application) Nos projets IT visent à accompagner nos clients dans l'adoption des nouvelles technologies Cloud grâce à notre approche Strategy Design. Nous nous engageons à transformer leurs appl…",,,,2025-03-22T08:53:50Z,https://www.adzuna.fr/land/ad/5105890040?se=EiGGQ2Mw8BGJwwQk3LWCew&utm_medium=api&utm_source=e1ad5111&v=0939474BCEF5BBA6834B0D0AFACB70BBB9D25006,Unknown,ingénieur logiciel,fr,ingénieur logiciel,standard,False,False
Ingénieur Logiciel Java / React H/F,Groupe Luminess,France,"En bref :  Vous maitrisez Java ☕ & React⚛️ ?  Luminess : nous accompagnons nos clients dans la gestion électronique de documents et nous développons des solutions informatiques adaptées à leurs besoins.  Mission : Analyser, développer et maintenir des projets informatiques, tout en assurant la qualité, la sécurité et le respect des délais dans une démarche agile. Poste basé à Rennes, Laval ou Lens avec 3 jours de tt/semaine.  ​​ Notre équipe Run Delivery recrute un(e) Ingénieur(e) Logiciel Java…",,,,2025-01-03T08:02:28Z,https://www.adzuna.fr/land/ad/4996173907?se=EiGGQ2Mw8BGJwwQk3LWCew&utm_medium=api&utm_source=e1ad5111&v=320C5C4F8D00BBDCB885446FA9CD22CA3B197853,Unknown,ingénieur logiciel,fr,ingénieur logiciel,standard,False,False
Ingénieur logiciel Java/Ingénieure logiciel Java,Lynx RH - Cabinets de recrutements spécialisés en Informatique - Ingénierie - Fonctions supports,"Boulogne-Billancourt, Hauts-de-Seine","Bonjour, Je travaille pour le cabinet de recrutement Lynx RH, et suis spécialisée dans les profils en IT. Je recrute actuellement pour une entreprise internationale spécialisée dans le domaine de la télécommunications et du CPaaS, un profil de Développeur senior Java EE/ Anglais (obligatoire) Missions : Participation à l'analyse des besoins Participation aux réunions techniques Conception du code : design patterns, security by design Garantir la performance des applications backend et frontend …",,,,2025-04-25T05:36:46Z,https://www.adzuna.fr/land/ad/5161663876?se=EiGGQ2Mw8BGJwwQk3LWCew&utm_medium=api&utm_source=e1ad5111&v=B13824FC35388BDF57C7E8B0250EDC03DE385D5D,Unknown,ingénieur logiciel,fr,ingénieur logiciel,standard,False,True
Ingénieur logiciel Java/Ingénieure logiciel Java,Synanto,"Avignon, Vaucluse","Info sur le poste : Nous recherchons un développeur (F/H) senior JAVA pour renforcer son équipe R&D de 18 personnes. Participation à l’analyse des besoins et aux choix des solutions techniques Conception et développement de projets client ou produit, dans le respect des engagements de délai et de qualité Tests de validation de la solution logicielle Maintenance logicielle évolutive ou corrective des solutions déployées Veille technologique Compétences techniques requises: Maîtrise des langages …",,,,2025-04-24T06:46:58Z,https://www.adzuna.fr/land/ad/5159523566?se=EiGGQ2Mw8BGJwwQk3LWCew&utm_medium=api&utm_source=e1ad5111&v=2CAF6923DA7596577EC7D93343ADA7CCF629CAC8,Emplois Informatique,ingénieur logiciel,fr,ingénieur logiciel,standard,False,False
Ingénieur logiciel Java/Ingénieure logiciel Java,ALTEN,"Ile-de-France, France","À propos de l'entreprise Alten, la maison des ingénieurs, qui sommes-nous ? Fort de plus de 35 ans d'expériences, le groupe Alten exerce dans plus de 30 pays. Cette couverture mondiale, nos 54 000 collaborateurs, composés de 88% d'ingénieurs, nous permettent d'être un groupe international et leader de son marché. Soucieux du bien-être de nos collaborateurs, cela nous a permis, cette année et pour la 12eme fois consécutive, d'être labellisé Top Employer. L'obtention de ce label s'appuie sur un a…",,,,2025-01-19T07:33:52Z,https://www.adzuna.fr/land/ad/5016360692?se=EiGGQ2Mw8BGJwwQk3LWCew&utm_medium=api&utm_source=e1ad5111&v=F50F3B934EE89CFBB1C121C913F84A3C705CAD42,Unknown,ingénieur logiciel,fr,ingénieur logiciel,standard,False,True
Ingénieur logiciel Java/Ingénieure logiciel Java,Néosoft,France,"Groupe indépendant de conseil en transformation digitale de près de 1800 collaborateurs, Néosoft s’est construit, depuis 2005, sur un modèle qui place l’excellence, le dépassement de soi et la RSE au cœur de sa stratégie. En nous rejoignant, vous intégrez des communautés d’experts et de talents qui vous permettent de développer vos compétences et d’offrir à nos clients le meilleur accompagnement possible. Notre savoir-faire s’articule autour de nos 6 domaines d’expertise : Conseil & Agilité Cyb…",,,,2025-01-19T07:33:56Z,https://www.adzuna.fr/land/ad/5016361249?se=EiGGQ2Mw8BGJwwQk3LWCew&utm_medium=api&utm_source=e1ad5111&v=AD126B653D03A6CD956DBC3A2711E015F9ADBDFC,Unknown,ingénieur logiciel,fr,ingénieur logiciel,standard,False,False
"Ingénieur logiciel/Ingénieure logiciel, (devops-oriented)",NEO2 Digital,"Colombes, Nanterre","L'entreprise NEO2 Digital est une entité du groupe NEO2 créée en 2021, imaginée comme une start-up. Nous accompagnons nos clients industriels sur leurs projets de Data Management et Product Management. Comment ? Nous détachons, sur site client, nos ingénieurs experts sur : l’exploitation des données brutes industrielles, le delivery de projets digitaux et l’infrastructure (sécurité, hébergement des données, cloud). Cette petite tribu agile intervient partout en France à Paris, Nantes, Lyon, Lil…",,,,2025-05-09T07:58:32Z,https://www.adzuna.fr/land/ad/5189850217?se=EiGGQ2Mw8BGJwwQk3LWCew&utm_medium=api&utm_source=e1ad5111&v=3862BAADBAA343E25457E07BA0BFCBD2576F9C2D,Unknown,ingénieur logiciel,fr,ingénieur logiciel,standard,False,False
Ingénieur logiciel Java/Ingénieure logiciel Java,Aleysia,"Lyon, Rhône","Tu as l'esprit d'initiative et tu aimes travailler dans un environnement stimulant, postule sans attendre cette offre de Développeur·se Java Fullstack qui est faite pour toi ! ⬇️  Ton challenge si tu l’acceptes : Concevoir et développer des solutions avec un code performant et documenté Gérer la maintenance corrective et évolutive de l'application Participer activement à l'amélioration continue Implémenter des tests unitaires et d’intégration pour assurer la qualité du code Suivre les bonnes p…",,,,2025-03-05T06:19:34Z,https://www.adzuna.fr/land/ad/5076163123?se=EiGGQ2Mw8BGJwwQk3LWCew&utm_medium=api&utm_source=e1ad5111&v=7C5A4BE2A23881B3B5C5F4372838BCA6B41C1813,Unknown,ingénieur logiciel,fr,ingénieur logiciel,standard,False,False
Ingénieur logiciel embarqué/Ingénieure logiciel embarqué,Adentis,"Ile-de-France, France","ADENTIS est une société de conseil en ingénierie de la R&D spécialisée dans les systèmes embarqués et les nouvelles technologies . Nous travaillons également sur des projets en IT et en cybersécurité . Nous intervenons sur des secteurs d'activités diversifiés tels que l'aéronautique, l'automobile, le ferroviaire, la TV numérique, l'électronique grand public, l'énergie, le médical et la défense. Depuis 2014, notre société se développe au niveau national et après Paris , Toulouse , Grenoble et Re…",,,,2025-05-04T09:26:20Z,https://www.adzuna.fr/land/ad/5179912972?se=EiGGQ2Mw8BGJwwQk3LWCew&utm_medium=api&utm_source=e1ad5111&v=8757B84D180F3A162B0554C36A11CDAF97BA51CD,Unknown,ingénieur logiciel,fr,ingénieur logiciel,standard,False,False
