title,company,location,description,salary_min,salary_max,contract_type,created,redirect_url,category,specialty
Financial Controller,HAYS,"Doncaster, South Yorkshire","Exciting NEW Manufacturing Financial Controller Role About the Role: We are working with an established manufacturing client, who are looking to expand their finance team due to their recent and expected rapid growth. We are seeking a highly skilled and motivated Finance Controller. This role is pivotal in managing the company's financial operations, ensuring accuracy and compliance with financial regulations, and providing strategic financial guidance to support our growth and sustainability. …",51677.34,51677.34,,2025-04-11T16:41:49Z,https://www.adzuna.co.uk/jobs/land/ad/5140567452?se=nmKsYTEe8BG-i3PTGXcHCQ&utm_medium=api&utm_source=e1ad5111&v=CCA0017BEABA6BEFF0DB2D53EE6EB0C4B2DA25C6,Accounting & Finance Jobs,banking
Senior Financial Accountant,KP Snacks,"Chalvey, Slough","Senior Financial Accountant FTC until July 2026 Slough Hybrid - at least 2 days per week in the office. Join our snack-loving team We're looking for a Senior Financial Accountant to join our team at KP Snacks. Fancy being part of a group where your ideas matter and your growth is celebrated? Keep reading – this might just be your next adventure Our Finance team provides the insights and analysis that drive smart, strategic decision-making across the business. From budgeting and forecasting to f…",38407.18,38407.18,contract,2025-04-17T13:35:15Z,https://www.adzuna.co.uk/jobs/land/ad/5149593733?se=nmKsYTEe8BG-i3PTGXcHCQ&utm_medium=api&utm_source=e1ad5111&v=F616A920589722F3FBD2B7D103427ACDADE3F4FF,Accounting & Finance Jobs,banking
Financial Reporting Accountant,BAE Systems,"Glascoed, Pontypool","Job Title: Financial Reporting Accountant Location : Glascoed, Wales. Preston or Frimley, Surrey will also be considered, with occasional travel to Glascoed approximately once per month. We offer a range of hybrid and flexible working arrangements – please speak to your recruiter about the options for this particular role. Salary: Circa £47,000 depending on experience What you’ll be doing: Prepare, review, and consolidate statutory financial statements, ensuring accuracy and timely completion M…",59039.38,59039.38,,2025-04-08T18:45:56Z,https://www.adzuna.co.uk/jobs/land/ad/5135673156?se=nmKsYTEe8BG-i3PTGXcHCQ&utm_medium=api&utm_source=e1ad5111&v=5174408165751D8A076ABCC4342F18F66E4EF2D9,Accounting & Finance Jobs,banking
Senior Finance Analyst,BAE Systems,"Preston, Lancashire","Job Title: Senior Finance Analyst Location: Flexible, UK. We offer a range of hybrid and flexible working arrangements – please speak to your recruiter about the options for this particular role. Salary: £60,000 What you’ll be doing: Managing a team of 1 to deliver a range of inputs & outputs to Business Processes in a variety of toolsets, across a range of finance deliverables Operating Business Processes to create/manage data/activities in Business ERP’s where a Financial Control role is nomi…",47116.02,47116.02,,2025-04-14T21:00:15Z,https://www.adzuna.co.uk/jobs/land/ad/5144671780?se=nmKsYTEe8BG-i3PTGXcHCQ&utm_medium=api&utm_source=e1ad5111&v=8F9DB9D311066DA7EBE02DC0B182376009FFEAD3,Accounting & Finance Jobs,banking
Finance Business analyst,Places Leisure,"Blackwater, Camberley","We are Places for People Group; we're a social enterprise that believes it's people that make a community. That's why we build homes and deliver services for everyone in the community to thrive. At Places Leisure we are changing lives by creating active places and healthy people for communities to thrive, and we want to be the UK's leading health and wellbeing enabler. We aren't your typical company. We apply the same philosophy to our People as we do to our communities, ensuring our team is ap…",0,40000,,2025-04-10T21:21:11Z,https://www.adzuna.co.uk/jobs/land/ad/5139632117?se=nmKsYTEe8BG-i3PTGXcHCQ&utm_medium=api&utm_source=e1ad5111&v=CA4374462E80FDFF880127189B6FB0B10EE4BA79,IT Jobs,banking
Finance Assistant,HAYS,"Preston, Lancashire","Finance Assistant | £25,000 | Hybrid Working (1 Day in the Office) Your new company I am assisting an ambitious Finance Manager at a rapidly expanding organisation in Preston with the recruitment of a Finance Assistant. This organisation prides itself on fostering a culture of continuous improvement and professional development, ensuring that employees have access to the latest tools and training to excel in their roles. With a strong focus on integrity and reliability, the company has built a …",25000,25000,,2025-04-11T16:41:59Z,https://www.adzuna.co.uk/jobs/land/ad/5140568187?se=nmKsYTEe8BG-i3PTGXcHCQ&utm_medium=api&utm_source=e1ad5111&v=9153C0ADEA9E118C41CA69F37F7C1FF69144BFF5,Accounting & Finance Jobs,banking
Finance Administrator,HAYS,"Stockton-On-Tees, County Durham","Temporary Finance Assistant, Immediate Start - Stockton-based Temporary Finance AssistantLocation: Stockton, United KingdomSalary: £25,000 per annum (pro-rata)Job Type: Temporary ongoing Hays are seeking a motivated Temporary Finance Assistant to join a fast-paced company in Stockton. This role is ideal for someone looking to gain valuable experience in finance within a dynamic and supportive environment.Key Responsibilities: Assist with the preparation of financial statements and reports. Proc…",25000,25000,contract,2025-04-11T16:41:59Z,https://www.adzuna.co.uk/jobs/land/ad/5140568213?se=nmKsYTEe8BG-i3PTGXcHCQ&utm_medium=api&utm_source=e1ad5111&v=82BC3EF7E345FCD64C79BC8B88EFFC3E47909C43,Accounting & Finance Jobs,banking
Finance Assistant,HAYS,"Llantrisant, Holyhead",Finance Assistant - Llantrisant - Part-time Finance Assistant – 30 Hours Per Week | Study Support Available Are you a detail-oriented and proactive individual looking to grow your career in finance? We’re looking for a Finance Assistant to join our team on a 30-hour-per-week basis. What You’ll Be Doing:• Processing invoices and speaking with customers over the phone• Matching invoices against purchase receipts• Reconciling supplier statements and sending remittance advice• Supporting the wider …,16000,19000,,2025-03-06T19:57:29Z,https://www.adzuna.co.uk/jobs/land/ad/5079768910?se=nmKsYTEe8BG-i3PTGXcHCQ&utm_medium=api&utm_source=e1ad5111&v=033A0ECF15E896C6DD4CBBC478CC259799A1863D,Accounting & Finance Jobs,banking
Finance Administrator,HAYS,"Swansea, Wales","Perfect role for an administrator looking to step into finance Flexibility to work around family or study Financial Administrator Permanent & Full-Time Swansea £20-25,000 per annum This role is an awesome opportunity for a competent administrator to take on a role with some financial scope You will need to be a highly organised person and passionate about customer service and delivering excellence to clients & customers alike. You will be responsible for liaising with customers and suppliers to…",20000,24000,permanent,2025-03-24T11:00:03Z,https://www.adzuna.co.uk/jobs/land/ad/5108658232?se=nmKsYTEe8BG-i3PTGXcHCQ&utm_medium=api&utm_source=e1ad5111&v=7CE8A8CBD6B12EC5E30464CD488A6BDE06AD315D,Accounting & Finance Jobs,banking
Finance assistant,HAYS,"Bristol, South West England","Temporary finance assistant Temporary Finance Assistant - Bath Duration: 2 months Start Date: ASAP Working Hours: Monday to Friday, 08:30-16:30 Location: Bath, 2 days a week working from home Key Responsibilities: Assisting with day-to-day financial operations. Processing invoices and managing expense claims. Reconciling accounts and bank statements. Supporting month-end closing processes. Providing administrative support to the finance team. Requirements: Previous experience in a finance-relat…",29120,31200,contract,2025-04-11T16:41:57Z,https://www.adzuna.co.uk/jobs/land/ad/5140567978?se=nmKsYTEe8BG-i3PTGXcHCQ&utm_medium=api&utm_source=e1ad5111&v=20FF019F13B84431B77A0D265844C9F78FBC44FB,Accounting & Finance Jobs,banking
Finance Assistant,HAYS,"London, UK","Finance Assistant / Insurance Brokers / Hybrid / London / Competitive Salary / Finance Your new company We are working with a dynamic recruitment firm based in London, dedicated to connecting top talent with leading companies for technology firms. Their team is passionate about helping individuals and businesses achieve their goals. They are looking for an ambitious Assistant Management Accountant to join our finance team and support our Senior Management Accountant in the day-to-day management…",40000,45000,,2024-12-04T14:49:15Z,https://www.adzuna.co.uk/jobs/land/ad/4962587075?se=nmKsYTEe8BG-i3PTGXcHCQ&utm_medium=api&utm_source=e1ad5111&v=B8CEC038D855039CA7516148A04069263AA22ADF,Accounting & Finance Jobs,banking
Finance Assistant,HAYS,"Billingham, County Durham","Finance Assistant job in Billingham Your new company This exciting new business based in Billingham are looking for a dynamic and proactive Finance Assistant to join the team. This is a brand-new role, offering the unique opportunity to shape and implement new systems and processes from the ground up. Your new role Key Responsibilities: System Implementation: Develop and implement new financial systems and processes to streamline operations. Bank Reconciliations: Perform regular bank reconcilia…",29734.72,29734.72,,2025-03-05T18:45:30Z,https://www.adzuna.co.uk/jobs/land/ad/5077678556?se=nmKsYTEe8BG-i3PTGXcHCQ&utm_medium=api&utm_source=e1ad5111&v=EF02F2BD556767712E717A04CF92233D6ECF8B24,Accounting & Finance Jobs,banking
Finance Assistant,HAYS,"London, UK","A luxury construction company with high-end clients is looking for a Finance Assistant for 6months. Job Purpose As a Finance Assistant, you will support the Finance team by organising day-to-day accounting procedures and contributing to finance-related projects. This junior-level role is an excellent opportunity for someone beginning their financial career, offering involvement in a variety of responsibilities and projects, including the NetSuite integration. Key Responsibilities Processing acc…",37000,42000,,2025-04-11T16:41:57Z,https://www.adzuna.co.uk/jobs/land/ad/5140567968?se=nmKsYTEe8BG-i3PTGXcHCQ&utm_medium=api&utm_source=e1ad5111&v=A0991515A726E57B5220CC09351CA9D7D79B6006,Accounting & Finance Jobs,banking
Finance Assistant,HAYS,"London, UK","Temp to Perm / Finance Assistant / £32k - £38k / Hybrid / Temp to perm / City of London / Your new company An exclusive opportunity with Hays to work within an established Insurance & re-insurance brokerage which has seen year-on-year growth and development. This organisation is looking to expand their finance team and employ an account assistant to support the general finance function with room to progress. You will be working within the finance department, made up of 8 individuals, reporting …",30000,36000,contract,2024-09-30T13:56:38Z,https://www.adzuna.co.uk/jobs/land/ad/4882058228?se=nmKsYTEe8BG-i3PTGXcHCQ&utm_medium=api&utm_source=e1ad5111&v=921D2A54D79AEF2CB7BD009B701294964D1D824E,Accounting & Finance Jobs,banking
Finance Assistant,HAYS,"North Kilworth, Lutterworth","Temporary Finance Assistant Job In Leicestershire Your new company Hays Accountancy and Finance are working with a multi-academy trust operating across Leicestershire and Nottinghamshire who are looking for a finance assistant to join their head office team. You will be working on a temporary basis initially, with the potential to go permanent for the right candidate. Your new role You will be working 37 hours per week within a friendly and supportive team as a finance assistant reporting to th…",27210.31,27210.31,contract,2025-02-28T17:35:42Z,https://www.adzuna.co.uk/jobs/land/ad/5067223202?se=nmKsYTEe8BG-i3PTGXcHCQ&utm_medium=api&utm_source=e1ad5111&v=C461B6A7E8B014CDC590789A793015A59D54C272,Accounting & Finance Jobs,banking
Finance Assistant,HAYS,"Bury St. Edmunds, Suffolk","Temporary-to-Permanent Finance Assistant - Bury St Edmunds - £28000 - £30000 Your new company An established organisation located near Bury St Edmunds, my client is experiencing an exciting period of growth and looking to bring a proactive and organised Accounts Assistant / Finance Assistant to join their team. Your new role Reporting to the Financial Controller and working as part of the wider finance team, key duties will include customer database maintenance, raising sales invoices, payment …",28000,30000,contract,2025-04-11T16:41:59Z,https://www.adzuna.co.uk/jobs/land/ad/5140568199?se=nmKsYTEe8BG-i3PTGXcHCQ&utm_medium=api&utm_source=e1ad5111&v=D25D5CED73D98E1B270A1F28484A808FC0E05AD8,Accounting & Finance Jobs,banking
Finance Assistant,HAYS,"Woking, Surrey","Finance Assistant job based in the Woking area paying up to £30,000 Your new company You will be working for a growing private equity backed business delivering Finance support to the FC and FD. Your new role You will be part of a friendly, close knit, finance team providing support to the Financial Controller and Finance director. You will be delivering bank reconciliations and cash flow management, updating Accruals & Prepayments, intercompany accounts and posting journals. What you'll need t…",0,30,,2025-02-28T17:35:42Z,https://www.adzuna.co.uk/jobs/land/ad/5067223193?se=nmKsYTEe8BG-i3PTGXcHCQ&utm_medium=api&utm_source=e1ad5111&v=7B24C4130C4F391EC2A6851CBB1C4D4E12425C7D,Accounting & Finance Jobs,banking
Finance Assistant,HAYS,"London, UK","A great opportunity for a Finance Assistant to work for a thriving Media PR agency in London Your new company You will work for a multi-award-winning PR Agency, based in the heart of London City. They are trusted by multiple well-known brands, and aspire to be the best in what they do. Your new role In this varied Finance Assistant job, you will work in a high-performing team of four people, reporting to the Director of Finance & Operations. Your responsibilities will include (but not be limite…",26000,30000,,2025-02-28T17:35:43Z,https://www.adzuna.co.uk/jobs/land/ad/5067223247?se=nmKsYTEe8BG-i3PTGXcHCQ&utm_medium=api&utm_source=e1ad5111&v=93405E0970333540AB4B6E8EAC2E1583B6135D95,Accounting & Finance Jobs,banking
Finance Assistant,HAYS,"London, UK","Finance Assistant Your new company: You will be working for a large recruitment firm that sources highly skilled workers for Engineering, Technology and the Government Sector in the heart of London City. Driven by their commitment to growth, the elite team of experienced specialists work hard to deliver expert candidates to the world's most innovative companies. You will be in a lively office based on the same floor as the sales team. Your new role: As the Finance Assistant you will be responsi…",28000,28000,,2024-12-18T16:48:35Z,https://www.adzuna.co.uk/jobs/land/ad/4982237185?se=nmKsYTEe8BG-i3PTGXcHCQ&utm_medium=api&utm_source=e1ad5111&v=BCDF30CDC50FA398CB30E7F717AF80C60963601E,Accounting & Finance Jobs,banking
Finance Assistant,HAYS,"Edinburgh, Scotland","Part-Time Finance Assistant Opportunity Based in Edinburgh12 month FTCHybrid Working Your new company Hays are proud to be working with a well-established public sector organisation based in Edinburgh City Centre who are looking to add a motivated Finance Assistant to their team. Your new role In your new role, you will be responsible for: Processing invoices Payment runs Processing expenses Credit card transactions Journal Preparation Credit control Resolving internal and external queries Dail…",25000,30000,,2025-03-13T08:20:40Z,https://www.adzuna.co.uk/jobs/land/ad/5090786461?se=nmKsYTEe8BG-i3PTGXcHCQ&utm_medium=api&utm_source=e1ad5111&v=A486CB041002CABAA9EA24EA08C8E7DFAF12F9F9,Accounting & Finance Jobs,banking
Finance Assistant,HAYS,"Belfast, Northern Ireland","Finance Assistant, Accounts Assistant, Finance Admin, Sales ledger SummaryOur client is a market leader in the financial services industry. As a Financial Administrator, you will be reporting to the Financial Controller. Your role will involve managing accounting tasks, data entry, and utilising software such as Sage 50. Main Responsibilities: Daily maintenance of Payment List for distribution to directors Accurately identify and record receipts by liaising with Account Executives daily to ensu…",27000,27000,,2025-03-20T23:14:34Z,https://www.adzuna.co.uk/jobs/land/ad/5103597749?se=nmKsYTEe8BG-i3PTGXcHCQ&utm_medium=api&utm_source=e1ad5111&v=F61B7E405183BEA9C31023BDC3F8915F0D9C0E31,Accounting & Finance Jobs,banking
Finance Assistant,HAYS,"Swansea, Wales","Finance Assistant - Swansea - Temp to Perm Your new company Your new company are a well-known, rapidly expanding retail business who are looking for a Finance Assistant on a temp to perm basis. Your new role Although you will need a solid understanding of transactional finance, the main part of the role will be to look after the Sales Ledger of the finance function. This is a very fast-paced role. What you'll need to succeed In order to succeed, you will need a good understanding of transaction…",13,14,contract,2025-02-28T17:35:42Z,https://www.adzuna.co.uk/jobs/land/ad/5067223186?se=nmKsYTEe8BG-i3PTGXcHCQ&utm_medium=api&utm_source=e1ad5111&v=F4614B450F61A8D055E150A136F58F0294380594,Accounting & Finance Jobs,banking
Finance Administrator,HAYS,"London, UK",Finance Assistant Your new role Finance Administrator 3 months £19- £21/hour 2 days a week in the office Nearest Station - Green Park Public Sector Organisation Role Description Downloading VAT invoices. Downloading corresponding Payment proposals and bank statement. Compile the VAT invoices with the corresponding payment proposal and the bank statement for submission. Experience Required Previously worked in a similar role Bookeeping or accountancy qualification or studying towards it What you…,39520,43680,,2025-04-11T16:41:57Z,https://www.adzuna.co.uk/jobs/land/ad/5140567931?se=nmKsYTEe8BG-i3PTGXcHCQ&utm_medium=api&utm_source=e1ad5111&v=AE5D99F41718A8DAF1E466B2EC8CBD5CD2F59F0E,Accounting & Finance Jobs,banking
Finance Assistant,HAYS,"Rotherham, South Yorkshire","Finance Assistant - Rotherham - Flexible & Hybrid working - £23K - Excel Usage Your new company Hays Accountancy and Finance South Yorkshire are working with a large public sector organisation in Rotherham. Due to an internal restructure, the role is immediately available for an enthusiastic and innovative candidate to step in. Reporting to the Finance Team Leader, you will support efficient and effective delivery. Your new role Key role duties will include supporting your team leader to gather…",23000,23000,,2025-02-28T17:35:42Z,https://www.adzuna.co.uk/jobs/land/ad/5067223243?se=nmKsYTEe8BG-i3PTGXcHCQ&utm_medium=api&utm_source=e1ad5111&v=0CA6CFD8B988BEE50DBB6231BF813FC2AFCECFB8,Accounting & Finance Jobs,banking
Finance Assistant,HAYS,"Hull, East Riding Of Yorkshire","An established organisation in Hull is recruiting a Finance Assistant to join the team. An exciting opportunity is available for an experienced finance assistant to join a successful organisation based in North Hull. Joining a team of 3, this role will be focussed on payroll as well as general finance duties and some HR administration. You will also support the Finance Director with day-to-day duties, including reporting. Responsibilities will include: • Undertake all weekly Payroll processing,…",0,35000,,2025-04-11T16:41:59Z,https://www.adzuna.co.uk/jobs/land/ad/5140568200?se=nmKsYTEe8BG-i3PTGXcHCQ&utm_medium=api&utm_source=e1ad5111&v=2F23729AEB4F5ADBA8C80544E3D3A9952F1F82FE,Accounting & Finance Jobs,banking
Finance Assistant,HAYS,"Bath, Bath & N E Somerset","Finance Assistant job in central Bath with hybrid working and fantastic benefits Your new company A market-leading business are actively looking to appoint a Finance Assistant. Your new role The Finance Assistant will support various areas of the business’s finance and administration functions.The Finance Assistant must be self-motivated individual, comfortable working under pressure in a busy role where they will be responsible for their own workload, maintain a high working standard and meet …",25000,28000,contract,2025-02-28T17:35:43Z,https://www.adzuna.co.uk/jobs/land/ad/5067223251?se=nmKsYTEe8BG-i3PTGXcHCQ&utm_medium=api&utm_source=e1ad5111&v=BCC748CE92761EAD8BD0757478BBA7FE61FFD59C,Accounting & Finance Jobs,banking
Finance Assistant,HAYS,"Rugeley, Staffordshire","Permanent Finance Assistant job - based in Rugeley paying up to £30,000 per annum Your new company Hays are working with a leading company based in Rugeley who are looking for a Finance Assistant to join their team on a permanent basis. Your new role As a Finance Assistant, you will play a vital role in supporting the finance department. Your primary responsibilities will include processing purchase orders, managing invoices, reconciling expenses, and ensuring compliance with administrative and…",25000,30000,permanent,2025-04-11T16:41:59Z,https://www.adzuna.co.uk/jobs/land/ad/5140568193?se=nmKsYTEe8BG-i3PTGXcHCQ&utm_medium=api&utm_source=e1ad5111&v=0720B544539FA2F95687E65B055F5B01494B8C4F,Accounting & Finance Jobs,banking
Finance Assistant,HAYS,"Cambridge, Cambridgeshire",Finance Officer (Part-Time) - Cambridge Your new company Hays Accountancy & Finance are working with a college to recruit a part-time Finance Officer to join their Finance Team. Your new role You'll be reporting to the Management Accountant and your key responsibilities will include: Reviewing invoice transactions. Maintaining accurate records. Processing transactions. Reviewing reports. What you'll need to succeed At least 2 years' experience in a similar role. Experience using accounting soft…,0,30000,,2025-03-19T21:26:40Z,https://www.adzuna.co.uk/jobs/land/ad/5101754189?se=nmKsYTEe8BG-i3PTGXcHCQ&utm_medium=api&utm_source=e1ad5111&v=AC56C20E341D26CF809879E3344128183B1EC82C,Accounting & Finance Jobs,banking
Finance Administrator,HAYS,"Telford, Shropshire","Finance Administrator, Telford, Permanent Your New Company Hays is proud to partner with a highly successful manufacturer seeking a Finance Administrator to join their team in Telford on a permanent basis. Your New Role As a Finance Administrator, you will oversee the Purchase Ledger and Sales Ledger functions in Telford while working closely with the Finance Manager. Your key responsibilities will include: Processing purchase ledger invoices Resolving supplier queries efficiently Assisting wit…",0,27500,permanent,2025-04-11T16:41:57Z,https://www.adzuna.co.uk/jobs/land/ad/5140567974?se=nmKsYTEe8BG-i3PTGXcHCQ&utm_medium=api&utm_source=e1ad5111&v=E9151DA56704A47532F5AE1BCCC807861C51418E,Accounting & Finance Jobs,banking
Finance Assistant,HAYS,"London, UK","Management Accountant Vacancy at an exclusive hospitality company Job Advertisement: Management Accountant Position: Management Accountant Location: West End, London Salary: £40,000 per annum Type: Temporary (with potential to become permanent after 3 months)Working Days: 5 days a week About Us: Join our prestigious and exclusive hospitality company located in the heart of London's West End. We pride ourselves on delivering exceptional service and luxury experiences to our esteemed clientele. W…",52000,52000,contract,2025-02-28T17:35:41Z,https://www.adzuna.co.uk/jobs/land/ad/5067223155?se=nmKsYTEe8BG-i3PTGXcHCQ&utm_medium=api&utm_source=e1ad5111&v=B351EA4A2B252CC8CE1A4027A35FAD100FF71241,Accounting & Finance Jobs,banking
Finance Administrator,HAYS,"Bristol, South West England",Finance Administrator required for a professional services firm in BS1 Your new company BS1 based business Your new role Key Responsibilities Dealing with increases/decreases in capital contributions and liaising directly with stakeholders Liaising with banks in relation to members capital arrangements including loan documentation Payment of interest to banks on the correct payment dates Calculation of interest on capital Dealing with mortgage reference requests Liaising with HMRC in respect of…,30000,35000,,2025-03-24T11:00:03Z,https://www.adzuna.co.uk/jobs/land/ad/5108658235?se=nmKsYTEe8BG-i3PTGXcHCQ&utm_medium=api&utm_source=e1ad5111&v=90D8DC6D42292EE2367088D102E674E09E75B0E4,Accounting & Finance Jobs,banking
Finance Assistant,HAYS,"Bath, Bath & N E Somerset","Finance Assistant job, outskirts of Bath with parking Your new company An innovative organisation on the outskirts of Bath are looking to appoint a temporary Finance Assistant, initially for 3-6 months. Your new role Reporting to the Assistant Accountant you will be responsible for: Responding to messages and queries in the shared finance inbox Raising invoices Processing expenses Allocating payments Logging deposits Processing refunds What you'll need to succeed The successful candidate will h…",25000,25000,,2025-03-13T08:20:40Z,https://www.adzuna.co.uk/jobs/land/ad/5090786460?se=nmKsYTEe8BG-i3PTGXcHCQ&utm_medium=api&utm_source=e1ad5111&v=B547EA043A49890AFBD255C87641D6D24FD68EA3,Accounting & Finance Jobs,banking
Finance Assistant,HAYS,UK,"Finance Assistant, Derry City, Permanent Job, Competitive Salary Your new company You will work for an independent wholesale company that has been in business for over 30 years. They have outlets throughout the Northwest and employ over 40 people. Due to expansion, they now require a Finance Assistant to join their dedicated team at their Derry City office. Your new role As Finance Assistant, you will work within a dedicated and established team of accounting professionals. Your main duties wil…",27099.6,27099.6,permanent,2025-03-01T09:43:03Z,https://www.adzuna.co.uk/jobs/land/ad/5068273225?se=nmKsYTEe8BG-i3PTGXcHCQ&utm_medium=api&utm_source=e1ad5111&v=3B09A1BBF3B17D4FA823FA3FBDE6487858804BAB,Accounting & Finance Jobs,banking
