title,company,location,description,salary_min,salary_max,contract_type,created,redirect_url,category,specialty,source_country,query,query_type,remote_friendly,international
Full Stack Engineer,55 Exec Search,"Manchester, Greater Manchester","Location: [Manchester - Hybrid (3 days in office) / Home Working.  Salary: £50,000 - £70,000 base (dependent on experience and expertise) We are seeking a Full-Stack Software Engineer to join a vibrant early-stage tech startup in Manchester. Our client is an AI-driven company at the forefront of behavioural biometrics. It is building systems that understand how people behave, move, and interact with technology to enhance security, identity verification, and user experience. They are looking fo…",64308.58,64308.58,,2025-04-28T03:20:43Z,https://www.adzuna.co.uk/jobs/land/ad/5166304527?se=KLu7QfAo8BGDGO_HSiZXLA&utm_medium=api&utm_source=e1ad5111&v=89D236CB4CDCFC1F28C0EA0209EEB64554EB2C69,IT Jobs,embedded systems,gb,embedded systems,standard,False,False
Software Engineer,Innovate,"Bristol, South West England","Software Engineer Salary: Depending on experience Location: Hybrid working, with a minimum of 4 days per week on-site ________________________________________ About the Role A skilled and adaptable software engineer is needed to support the development of middleware solutions within complex embedded systems. This position involves configuring and securing Linux-based environments, contributing to software design, and working closely with hardware and integration teams. _________________________…",52813.31,52813.31,,2025-04-11T04:29:04Z,https://www.adzuna.co.uk/jobs/land/ad/5139963531?se=KLu7QfAo8BGDGO_HSiZXLA&utm_medium=api&utm_source=e1ad5111&v=01142BEE2E5B780B9C6BEFE97CB7E33E6CF7AA27,IT Jobs,embedded systems,gb,embedded systems,standard,False,False
Firmware Engineer,microTECH Global LTD,"Hemel Hempstead, Hertfordshire","Job Title: Firmware Developer Job Sector: Semiconductor Job Type: Permanent Location: Hemel-Hempstead, UK Develop low-level firmware and system software for our GPU and AI platform, focusing on boot processes, resource management, and hardware abstraction. Key Responsibilities: · Implement boot firmware and initialization sequences for our platform · Develop hardware abstraction layers and device drivers · Create and maintain system-level resource management software · Collaborate with hardware…",60861.7,60861.7,permanent,2025-05-04T08:49:00Z,https://www.adzuna.co.uk/jobs/land/ad/5179916011?se=KLu7QfAo8BGDGO_HSiZXLA&utm_medium=api&utm_source=e1ad5111&v=25123F08BFE6C1C8ABA3C146D7DE37E81CD110CC,IT Jobs,embedded systems,gb,embedded systems,standard,False,False
Radar Software Engineer,ALTEN,"Portsmouth, Hampshire","Job Description About the Role: We are seeking Radar Software Engineers to develop cutting-edge radar systems for the defence sector . This role requires strong C++ expertise, embedded software capability , and experience in signal processing while adhering to defence coding standards . Key Responsibilities: Develop and optimize radar software using C++ for embedded systems. Implement and enhance signal processing algorithms for radar applications. Ensure software meets defence standards and op…",54225.81,54225.81,,2025-04-08T02:05:49Z,https://www.adzuna.co.uk/jobs/details/5134578011?utm_medium=api&utm_source=e1ad5111,IT Jobs,embedded systems,gb,embedded systems,standard,False,False
Radio Frequency Engineer - Defence,Anson Mccade,"Gloucester, Gloucestershire","RF Engineer – Defence Technology Programmes Overview: A leading organisation in the defence and national security sector is seeking RF Engineers to support the development of next-generation RF systems. This role involves contributing to a variety of secure, high-impact projects focused on RF communications, vulnerability analysis, and mission system design. The position provides exposure to the full RF engineering lifecycle, from circuit modelling and antenna design through to system integrati…",57234.72,57234.72,permanent,2025-04-21T03:49:09Z,https://www.adzuna.co.uk/jobs/land/ad/5154914610?se=KLu7QfAo8BGDGO_HSiZXLA&utm_medium=api&utm_source=e1ad5111&v=55B096B19DA88ED55079C8A15CF2FEF8DA7517CD,Engineering Jobs,embedded systems,gb,embedded systems,standard,False,False
Hardware Design Engineer,Eclectic Recruitment Ltd,"Royston, Hertfordshire","Our client, a long term partner of ours and a leader in their field, are looking for a Hardware Design Engineer to join their busy team. The successful candidate will get the chance to work for a fantastic employer, working on some exciting products. Skills and Experience Required Excellent experience within core electronics, including digital and analogue circuit design A deep understanding of embedded systems, including knowledge of FPGA, High End CPU's and SOCs, high speed communication tech…",54784.59,54784.59,,2025-04-02T16:17:42Z,https://www.adzuna.co.uk/jobs/land/ad/5124371356?se=KLu7QfAo8BGDGO_HSiZXLA&utm_medium=api&utm_source=e1ad5111&v=81DD07154E354ABF820C24E14C7272C9AA87FD0E,Engineering Jobs,embedded systems,gb,embedded systems,standard,False,False
Senior Firmware Engineer,5V Tech | Certified B Corp™,"Bristol, South West England","Snr/Staff Firmware Engineer Location: Bristol, UK Salary: Up to £120,000 pa Visa sponsorship and extensive relocation support Are you a skilled and motivated Firmware Engineer ready to lead a global team and drive innovation in computing infrastructure? Join a pioneering organisation where you’ll play a key role in transforming the future of digital infrastructure. What We’re Looking For: Expertise in C programming for embedded systems with strong debugging skills. Hands-on experience in develo…",49042.84,49042.84,,2025-04-26T04:30:11Z,https://www.adzuna.co.uk/jobs/land/ad/5163393999?se=KLu7QfAo8BGDGO_HSiZXLA&utm_medium=api&utm_source=e1ad5111&v=EA488C6C0A58C3BF2A6C8B4059318CCF249E8D87,IT Jobs,embedded systems,gb,embedded systems,standard,False,True
FPGA Engineer,IC Resources,"Cambridge, Cambridgeshire","We are working with a pioneering consultancy at the forefront of the UK’s defence and security innovation. Our client is seeking an FPGA Enginee r to support the design and development of cutting-edge technologies that have a real-world impact on national security. As an FPGA Engineer, you will be involved across the full product lifecycle: from capturing requirements through to design, implementation, testing, and prototype delivery. This position offers a varied and intellectually stimulating…",47140.69,47140.69,,2025-05-03T07:26:51Z,https://www.adzuna.co.uk/jobs/land/ad/5178019630?se=KLu7QfAo8BGDGO_HSiZXLA&utm_medium=api&utm_source=e1ad5111&v=B5B279E8D43B3796233707C92C76FD634282036C,IT Jobs,embedded systems,gb,embedded systems,standard,False,False
AI / ML Software Engineer,55 Exec Search,"Manchester, Greater Manchester","AI / ML Software Engineer– Start-Up  Location: [Manchester - Hybrid 3 days in office / Home working  Salary: £50,000 - £70,000 base (dependent on experience and expertise) We’re looking for an AI / ML Software Engineer with commercial experience and exposure to AI and Machine learning models This role is ideal for someone who enjoys building robust software systems while exploring the exciting intersection of software engineering and intelligent technologies. If you’ve worked alongside data sci…",72787.61,72787.61,,2025-04-28T03:36:44Z,https://www.adzuna.co.uk/jobs/land/ad/5166322503?se=KLu7QfAo8BGDGO_HSiZXLA&utm_medium=api&utm_source=e1ad5111&v=81FB3E8E2E7AACEFE100E96293F257B9BBE26F02,IT Jobs,embedded systems,gb,embedded systems,standard,False,False
Lead ADCS Engineer,Yolk Recruitment,"South East London, London","Meritus are seeking an experienced ADCS engineer to play a pivotal role in the development of a novel spacecraft platform with unique dynamic and environmental challenges. This is a hands on opportunity to shape system architecture, guide critical design decisions, and deliver high-performance control solutions from ground testing through in orbit operations. This role is completely onsite in Berkshire. The role is paying £400-£500pd outside of IR35. Extended hours may be required. Contract can…",104000,130000,contract,2025-05-04T14:42:09Z,https://www.adzuna.co.uk/jobs/land/ad/5180171757?se=KLu7QfAo8BGDGO_HSiZXLA&utm_medium=api&utm_source=e1ad5111&v=E13A7A16758E99ECB29BEBA60D2C95F7238F494F,IT Jobs,embedded systems,gb,embedded systems,standard,False,False
Hardware Engineering Manager,"Yoh, A Day & Zimmermann Company","Guildford, Surrey","Hardware Engineering Manager – High-Performance Space Communications Location: Guildford, Surrey (Hybrid) Package: Highly competitive base salary  equity  pension  private medical Join a fast-growing, well-backed startup building next-generation space communications technology. This is a rare opportunity to take on a hands-on leadership role at an early stage, helping shape the electronic hardware and integration efforts that underpin our cutting-edge, high-throughput platforms for space-based …",70812.54,70812.54,permanent,2025-05-03T07:26:19Z,https://www.adzuna.co.uk/jobs/land/ad/5178019401?se=KLu7QfAo8BGDGO_HSiZXLA&utm_medium=api&utm_source=e1ad5111&v=5C0C27822B47A40964666D192DDFC37F404D24E3,Engineering Jobs,embedded systems,gb,embedded systems,standard,False,False
Application Engineer,Luneus,"Eastern England, UK","Our Client develops cutting-edge software-defined radio (SDR) products and processing solutions to enable spectrum dominance for maritime, land, air, and space domains. With over 15 years serving government and commercial enterprise customers and 25K devices fielded to date, our client is a trusted partner with a proven heritage of delivering open architecture products in radically small form factors where time-to-market, cost, and performance are critical for mission success. JOB OPENING Our c…",38986.12,38986.12,,2025-04-26T04:29:50Z,https://www.adzuna.co.uk/jobs/land/ad/5163393845?se=KLu7QfAo8BGDGO_HSiZXLA&utm_medium=api&utm_source=e1ad5111&v=D1FF6E078A145452E7FDFD2BF6AA20D720782192,Engineering Jobs,embedded systems,gb,embedded systems,standard,False,False
Software Engineer,Platform Recruitment,"Reading, Berkshire","C++ Developer – Reading Location: Reading Salary: Up to 70k Were you the kid taking apart remotes, building weird projects in the garage, or writing code before most people knew what Python was? If so, this might be your kind of job. We’re looking for a hands-on, curious C++ Developer to join a tight-knit engineering team. You'll be coding close to the hardware - think C, C++, Qt , embedded systems - and learning across software, electronics, and mechanics. You’ll thrive here if:  You’re fluent…",44288.34,44288.34,,2025-05-03T07:28:55Z,https://www.adzuna.co.uk/jobs/land/ad/5178024371?se=KLu7QfAo8BGDGO_HSiZXLA&utm_medium=api&utm_source=e1ad5111&v=1D578EF2EFA57BCB9E14EAD7AF5D7F1686970B18,IT Jobs,embedded systems,gb,embedded systems,standard,True,False
VP Engineering – Electronic Systems & Board Level Design,Altium Associates,"Oxfordshire, South East England",VP Engineering – Electronic Systems & Board Level Design Location - UK (Hybrid Model) Six-figure package  Stock Our client is a highly ambitious UK based early-stage venture developing advanced processing and networking hardware solutions for High Performance Computing applications. The company is looking to appoint an experienced technical leader with a track record of taking highly complex electronics products from concept to production. The role will involve leading and growing a multidiscip…,67565.16,67565.16,,2025-04-30T15:56:14Z,https://www.adzuna.co.uk/jobs/land/ad/5170681566?se=KLu7QfAo8BGDGO_HSiZXLA&utm_medium=api&utm_source=e1ad5111&v=F5C18848312C53BC9131E21701AD85DEE3D3F506,Engineering Jobs,embedded systems,gb,embedded systems,standard,False,False
Embedded Linux Developer,The ONE Group Ltd,"Cambridge, Cambridgeshire","Role: Linux Embedded Platform Engineer Salary: up to £85k Location: Cambridge / Hybrid An exciting opportunity has arisen for a Platform Engineer to join a company in a strong growth phase, operating in a fast-paced, start-up-like environment. Key Responsibilities: Develop and maintain BSPs for NXP-based platforms. Customise and maintain Linux kernels and modules. Debug and optimise networking and system performance. Contribute to open-source Linux projects. Automate system configuration and de…",59869.57,59869.57,,2025-04-25T04:09:21Z,https://www.adzuna.co.uk/jobs/land/ad/5161635095?se=KLu7QfAo8BGDGO_HSiZXLA&utm_medium=api&utm_source=e1ad5111&v=D8D0A32806EDFF9B8E11D3CB132D76B4EDCB8A1E,IT Jobs,embedded systems,gb,embedded systems,standard,False,False
Senior Systems Engineer,Converge,"London, UK","Want to work to decarbonise one of the world’s most important industries? Are you a great team player? Can you ship high-quality products faster than others think is possible? We’re looking for a Senior Systems Engineer who will do all these things and more. Come join us. And you want me to do what? We are seeking a Senior Systems Engineer with deep expertise in firmware development and embedded systems to join our team. In this role, you will define and specify interfaces between low-power emb…",65000,65000,,2025-03-11T15:33:24Z,https://www.adzuna.co.uk/jobs/details/5087299371?utm_medium=api&utm_source=e1ad5111,Engineering Jobs,embedded systems,gb,embedded systems,standard,False,False
Embedded Software Engineer,IC Resources,"Cambridgeshire, Eastern England","Embedded Software Engineer Cambridge, UK | Full-time | Permanent Salary: £75k - £85k Join a leading defence and security technology consultancy, working on cutting-edge projects to protect the UK from technological and cyber threats. Security clearance required . No UK Visa sponsorship available. About The Embedded Software Role: As an Embedded Software Engineer, you'll collaborate with top scientists, engineers, and designers to create innovative solutions. You'll work across the full product …",56326.32,56326.32,permanent,2025-04-30T15:57:09Z,https://www.adzuna.co.uk/jobs/land/ad/5170687994?se=KLu7QfAo8BGDGO_HSiZXLA&utm_medium=api&utm_source=e1ad5111&v=C29F51AC7CFA0E8495B06535519501111C54F634,IT Jobs,embedded systems,gb,embedded systems,standard,False,False
Embedded Digital Design Engineer,Eclectic Recruitment,"Walkern, Hertfordshire","Are you a driven and proficient Embedded Digital Design Engineer looking for an exceptional opportunity to showcase your problem-solving abilities and contribute to world-class engineering projects? As an Embedded Digital Design Engineer, you’ll have the opportunity to work on innovative projects with advanced technology. With involvement at all phases of the development cycle, you’ll ultimately see the overall embedded system come to life Key Responsibilities: Involvement at all phases of the …",40000,60000,,2025-01-17T18:02:10Z,https://www.adzuna.co.uk/jobs/land/ad/5014807857?se=KLu7QfAo8BGDGO_HSiZXLA&utm_medium=api&utm_source=e1ad5111&v=2E80D8606CA882A2DC7BC8D041222136445C0C8A,Engineering Jobs,embedded systems,gb,embedded systems,standard,False,False
Senior Test Engineer,Planet Pharma,"London, UK","Job Title: Senior Test Engineer Rate: Competitive in line with skills / experience Type: Contract Location: London My client, a specialist in the world of medical devices urgently have a requirement for several Senior Test Engineers on a freelance basis. I am seeking a highly skilled and experienced engineer to join a dynamic team developing a next-generation video processing platform, playing host to AI-powered applications. Key Responsibilities: Design, develop, and execute robust test plans …",65772.74,65772.74,contract,2025-04-28T03:43:56Z,https://www.adzuna.co.uk/jobs/land/ad/5166328475?se=KLu7QfAo8BGDGO_HSiZXLA&utm_medium=api&utm_source=e1ad5111&v=73B22159511622EBE72E74A77A99BB4231BE7225,IT Jobs,embedded systems,gb,embedded systems,standard,False,False
Junior Software Engineer,Cubiq Recruitment,"Dundee, Scotland","Role: Junior Software Engineer Location: Dundee, Scotland Work arrangements: Hybrid Start date: ASAP Salary: £40k An excellent opportunity has arisen in the Engineering organisation for Graduate Software Engineer in Dundee. The company is seeking a self-motivated, and tenacious individual educated to degree level in Computer Science, Electronics or other Engineering or Science with a keen interest in software. The successful applicants will work as part of a highly motivated team striving to me…",31274.41,31274.41,,2025-04-25T04:08:35Z,https://www.adzuna.co.uk/jobs/land/ad/5161634387?se=KLu7QfAo8BGDGO_HSiZXLA&utm_medium=api&utm_source=e1ad5111&v=6050EEEF70A55F018A3318889C74B3C51CC1109C,IT Jobs,embedded systems,gb,embedded systems,standard,False,False
Senior FPGA Designer,Henderson Scott,"Stevenage, Hertfordshire","FPGA Design Engineer - Take Your Expertise Further  Salary: £60,000 - £85,000  Bonus  Market-Leading Benefits  Hybrid / Flexible working options available We're looking for innovative FPGA Design Engineers ready to take on advanced challenges in signal processing, embedded systems, and safety-critical technology. Join a team where engineering excellence meets purpose - solving complex problems that impact real-world applications. Whether you're passionate about performance optimisation, buildin…",76098.97,76098.97,,2025-05-01T06:55:24Z,https://www.adzuna.co.uk/jobs/land/ad/5171938361?se=KLu7QfAo8BGDGO_HSiZXLA&utm_medium=api&utm_source=e1ad5111&v=436405F6E55885B0BE8F40DA834F28E329912517,Engineering Jobs,embedded systems,gb,embedded systems,standard,False,False
Firmware Engineer,Elevation Recruitment Group,"Leeds, West Yorkshire","We’re Hiring: Firmware Engineer | EMEA | Vehicle Safety Solutions ️ Are you a firmware wizard with a passion for safety and innovation? Ready to bring your embedded C skills to a global stage? Join a world-leading manufacturer of vehicle safety tech — from back-up alarms to amber warning lights — as they continue to raise the bar in quality, innovation, and trusted performance. ✨  Role: Firmware Engineer  Location: Leeds  Reports To: Global Engineering Director  What You’ll Be Doing: Develop p…",43899.33,43899.33,,2025-04-30T15:57:00Z,https://www.adzuna.co.uk/jobs/land/ad/5170687003?se=KLu7QfAo8BGDGO_HSiZXLA&utm_medium=api&utm_source=e1ad5111&v=354F7D96EC2911F1B33A4DEB547BD4EBECD292A7,IT Jobs,embedded systems,gb,embedded systems,standard,False,True
Software Defined Radio Engineer,Anson Mccade,"Gloucester, Gloucestershire","Open CPI Engineer Industry: Tier 1 Defence Prime Location: Fully onsite – Gloucester Working Week: 37.5 hrs across 4 days Security Clearance: DV (Developed Vetting) required! The Opportunity: Operate where most engineers never get access — a classified R&D environment building the UK’s next-gen RF systems for intelligence and defence operations. You’ll take point on OpenCPI-based SDR systems — designing, integrating, and optimising platforms that are deployed into live mission environments. You…",59059.09,59059.09,,2025-04-21T03:49:27Z,https://www.adzuna.co.uk/jobs/land/ad/5154915204?se=KLu7QfAo8BGDGO_HSiZXLA&utm_medium=api&utm_source=e1ad5111&v=DF69A88F0B507AAC581854E12E605E577B06E68C,IT Jobs,embedded systems,gb,embedded systems,standard,False,False
Senior Electronics Systems Engineer,Premier Group,"Leicester, Leicestershire","Job Title: Senior Electronics Systems Engineer Location: Leicester (Leicestershire, East Midlands) Salary: £50,000 - £70,000 per annum Great benefits package – See Below Overview of company and job title: An exceptional Global Multi Billion Pound Engineering organisation located in Leicester (Leicestershire, East Midlands) who’re Global Leading experts in the industry sectors for Renewable Energy, Automotive, Aerospace, Medical, Industrial and many more have an exciting position to hire for a b…",59670.87,59670.87,,2025-04-14T06:37:53Z,https://www.adzuna.co.uk/jobs/land/ad/5143868258?se=KLu7QfAo8BGDGO_HSiZXLA&utm_medium=api&utm_source=e1ad5111&v=BA7601CE9E3050C9176BEA0BDA55F3DB7225A9C4,Engineering Jobs,embedded systems,gb,embedded systems,standard,False,True
Electronic Design Engineer,VRS Recruitment,"Southampton, Hampshire","Are you ready to help shape the future of scientific research, life sciences, medical science, and quantum technologies? A fast-paced, innovative engineering team is seeking an Electronic Design Engineer to work on cutting-edge, computer-controlled electronics systems. You’ll contribute to the design and maintenance of high voltage power supplies, ultra-sensitive current measurement systems, and ultra-precise imaging and positioning technologies. Role Overview: As an Electronic Design Engineer,…",46372.68,46372.68,,2025-05-01T06:53:56Z,https://www.adzuna.co.uk/jobs/land/ad/5171931389?se=KLu7QfAo8BGDGO_HSiZXLA&utm_medium=api&utm_source=e1ad5111&v=EA7E95C286F8293F244451F709EDC80B9C6BDE5A,Engineering Jobs,embedded systems,gb,embedded systems,standard,False,False
Software Test Engineer,Avanti,"Aldershot, Hampshire","Job Title: Software Test Engineer Duration : 12 Months (Contract) Location: Aldershot Salary : Negotiable on experience Avanti Recruitment is seeking an experienced Senior Software Test Engineer in the automotive space to join their growing team. In this role, you will be responsible for developing and implementing comprehensive testing strategies for our automotive control systems, ensuring our software meets the highest standards of quality, reliability, and safety. Key Responsibilities Devel…",93600,114400,contract,2025-04-23T15:15:51Z,https://www.adzuna.co.uk/jobs/land/ad/5158139510?se=KLu7QfAo8BGDGO_HSiZXLA&utm_medium=api&utm_source=e1ad5111&v=C90E2983934375C3B05F6492229630E7B04A3079,IT Jobs,embedded systems,gb,embedded systems,standard,False,False
Embedded Software Engineer,Platform Recruitment,"Gillingham, Kent",Kent - Embedded Software Engineer (R&D) - Salary 50-55k This is a great opportunity to join a client of ours who work within safety systems. They are now looking to bring on a couple of Embedded Software Engineers to work within the R&D team. More information below. Main Duties:  Work on existing and development of new products Work on a wide range of microcontrollers including ARM Work within the R&D team and be responsible for the firmware development of embedded systems Skills Needed:  Exper…,50000,55000,permanent,2025-04-14T16:53:31Z,https://www.adzuna.co.uk/jobs/land/ad/5144239040?se=KLu7QfAo8BGDGO_HSiZXLA&utm_medium=api&utm_source=e1ad5111&v=AFBEB7958A5115F03C87821FDFA64A0A9F170705,Engineering Jobs,embedded systems,gb,embedded systems,standard,False,False
Cybersecurity,capgemini,UK,"Job Description Building next-generation vehicle systems using Software-defined vehicle and cloud-native concepts. Good knowledge of cloud development, Virtualization technology, and embedded systems is required. SDV Concept, SOAFEE, Adaptive Autosar, COVESA, Amazon AWS, Java, C/C++, Embedded System, Linux, yacto, agl ]]>",49202.68,49202.68,,2023-11-13T15:51:26Z,https://www.adzuna.co.uk/jobs/details/4429845594?utm_medium=api&utm_source=e1ad5111,IT Jobs,embedded systems,gb,embedded systems,standard,True,False
Electronics Design Engineer,SJR Partners,"Kirkhamgate, Wakefield","Electronics Design Engineer – Power & Embedded Systems  West Yorkshire |  Full-Time, Permanent |  Hybrid Working  Competitive Salary  Benefits Are you an innovative Electronics Design Engineer ready to shape the future of power and embedded systems? Join a skilled engineering team developing mission-critical technology for demanding real-world environments. The Role: We’re looking for a hands-on engineer with experience in analogue power electronics and embedded systems. You'll design, simulate…",40000,50000,permanent,2025-05-02T15:58:21Z,https://www.adzuna.co.uk/jobs/details/5176436132?utm_medium=api&utm_source=e1ad5111,Engineering Jobs,embedded systems,gb,embedded systems,standard,False,False
Test Engineer,LATHAM & BOND HUMAN RESOURCES LTD,"Rugeley, Staffordshire","Automotive Test Engineer Location : Cannock Salary : £60,000 - £65,000 Job Type : Full-time, permanent Latham & Bond HR are currently working with a specialist manufacturing organization operating in the automotive sector. This is a key opportunity to join a well-established Electronics R&D department, supporting the design, development, and testing of cutting-edge embedded systems and software tools. Key Responsibilities: Support the R&D team in the implementation and maintenance of software s…",65000,65000,permanent,2025-04-16T00:25:36Z,https://www.adzuna.co.uk/jobs/details/5146583444?utm_medium=api&utm_source=e1ad5111,IT Jobs,embedded systems,gb,embedded systems,standard,False,False
FPGA Engineer,Eclectic Recruitment Ltd,"Stevenage, Hertfordshire",About the Company We are currently working closely with a leading organisation who are looking for an FPGA Designer / Lead FPGA Designer join the team. This is a full-time permanent position based on-site in Stevenage. About the Role: Key responsibilities will include: Lead a team of talented engineers. Take technical lead on complex projects to ensure deliverables are met against provided deadlines. Produce low-level software to facilitate testing and integration within embedded systems. Produ…,60882.19,60882.19,permanent,2025-04-05T07:37:33Z,https://www.adzuna.co.uk/jobs/land/ad/5130857548?se=KLu7QfAo8BGDGO_HSiZXLA&utm_medium=api&utm_source=e1ad5111&v=98092C0B83300EBB185C81D01D82880C47D95D92,IT Jobs,embedded systems,gb,embedded systems,standard,False,False
