title,company,location,description,salary_min,salary_max,contract_type,created,redirect_url,category,specialty,source_country,query,query_type,remote_friendly,international
Ingénieur Logiciel Robotique H/F,Kicklox,"Magny-les-Hameaux, Maurepas","L'offre Projet Ingénieur Logiciel Robotique - ROS 2 Secteurs Aéronautique, Défense & Sécurité Description de l'offre Dans le cadre d'un projet stratégique en robotique autonome, nous recherchons deux ingénieurs en développement logiciel (SW) pour renforcer une équipe dédiée à l'intégration de systèmes autonomes terrestres et aériens. L'objectif est de développer une solution avancée d'autonomie collaborative, intégrant des capacités de navigation, détection et interaction dynamique dans un envi…",,,,2025-03-12T07:04:13Z,https://www.adzuna.fr/details/5088196610?utm_medium=api&utm_source=e1ad5111,Emplois Fabrication,ingénieur logiciel,fr,ingénieur logiciel,standard,False,False
CDI - Ingénieur logiciel H/F,Naval Group,France,"Informations générales Organisation NAVAL GROUP Nous sommes un acteur international dans l'industrie navale de défense depuis plus de 400 ans, repoussant continuellement les limites pour construire l'avenir. Nous recrutons des talents pour concevoir, réaliser et entretenir des produits exceptionnels tels que des sous-marins, des porte-avions et des frégates dont la composante digitale est essentielle. UN ENVIRONNEMENT DE TRAVAIL POSITIF Implantés sur 10 sites en France et dans 18 pays, nous val…",,,,2025-03-03T17:58:47Z,https://www.adzuna.fr/details/5072322654?utm_medium=api&utm_source=e1ad5111,Unknown,ingénieur logiciel,fr,ingénieur logiciel,standard,False,True
Ingénieur Logiciels Embarqués H/F,ELSYS Design,"Villeurbanne, Lyon","Tu souhaites intégrer une entreprise dynamique et reconnue pour son savoir faire dans les systèmes embarqués ? Dans le cadre du renforcement de notre équipe logiciel embarqué, Elsys Design Lyon recherche un ingénieur spécialisé en développement logiciel embarqué. Vos missions : - Intégrer nos équipes d'ingénieurs logiciel et développer des briques logicielles génériques en C sur OS Linux - Implémenter de nouvelles fonctions logiciels - Tu pourras être amené à développer en Python dans le cadre …",35000,50000,,2025-05-07T07:31:25Z,https://www.adzuna.fr/details/5184608624?utm_medium=api&utm_source=e1ad5111,Emplois Comptabilité et Finance,ingénieur logiciel,fr,ingénieur logiciel,standard,False,False
Ingénieur Logiciel Embarqué H/F,ELSYS Design,"Villeurbanne, Lyon","Tu souhaites intégrer une entreprise dynamique et reconnue pour son savoir faire dans les systèmes embarqués ? Dans le cadre du renforcement de notre équipe logiciel embarqué, Elsys Design Lyon recherche un ingénieur spécialisé en développement logiciel embarqué. Vos missions : - Intégrer nos équipes d'ingénieurs logiciel et développer des briques logicielles génériques en C sur OS Linux - Implémenter de nouvelles fonctions logiciels - Tu pourras être amené à développer en Python dans le cadre …",35000,50000,,2025-04-27T06:45:18Z,https://www.adzuna.fr/details/5165171050?utm_medium=api&utm_source=e1ad5111,Emplois Comptabilité et Finance,ingénieur logiciel,fr,ingénieur logiciel,standard,False,False
Ingénieur Logiciel Embarqué H/F,Kicklox,"Paris, Ile-de-France","L'offre Secteurs Automobile, Aéronautique, Spatial, Défense & Sécurité, Ferroviaire, Télécommunications, Energie, Services & Systèmes d'Informations, Chimie / Pétrochimie, Digital & E-Commerce, Naval, Machines & Industrie Lourde, Pharmaceutique / Biotechnologie, Banque & Assurance, BTP Description de l'offre Nous recrutons pour l'un de nos clients un Ingénieur logiciel embarqué, à pourvoir dès que possible. Ce rôle implique : - Concevoir, coder, tester et déboguer des logiciels embarqués. - Tra…",,,,2025-05-06T06:09:57Z,https://www.adzuna.fr/details/5182569598?utm_medium=api&utm_source=e1ad5111,Emplois Fabrication,ingénieur logiciel,fr,ingénieur logiciel,standard,False,False
Ingénieur Logiciel Embarqué H/F,Akkodis,"Le Cannet, Grasse","La ligne de service Consulting & Solutions d'Akkodis France renforce ses équipes en région Sud-Est et recrute un Ingénieur logiciel Embarqué H/F en CDI dans les Alpes Maritimes ! Descriptif de la mission - Concevoir, implémenter et tester des fonctionnalités en tenant compte de la scalabilité, des performances, du déploiement, de l'exploitation et de l'expérience utilisateur finale. - Appliquer les meilleures pratiques de codage/implémentation pour produire un code élégant, de haute qualité et …",,,,2025-02-04T19:45:00Z,https://www.adzuna.fr/details/5037176997?utm_medium=api&utm_source=e1ad5111,Unknown,ingénieur logiciel,fr,ingénieur logiciel,standard,False,False
Ingénieur Logiciel Embarqué H/F,Savane Consulting,"Betton, Rennes","Ingénieur logiciel embarqué - CDI - Rennes (35) - 45/55K€ Contexte du poste Rattaché à la direction R&D d'un acteur innovant du secteur technologique, vous interviendrez sur des projets de développement logiciel embarqué à forte composante technique, en lien avec des équipes pluridisciplinaires (électronique, mécanique, optique). Vous serez impliqué dans l'ensemble du cycle de développement, de l'architecture à la mise en production, en passant par la validation système et le support à l'indust…",45000,55000,,2025-05-06T06:09:31Z,https://www.adzuna.fr/details/5182569373?utm_medium=api&utm_source=e1ad5111,Unknown,ingénieur logiciel,fr,ingénieur logiciel,standard,False,False
Ingénieur Logiciel Embarqué (F/H),Savane Consulting,"Ille-et-Vilaine, Bretagne","Ingénieur logiciel embarqué - CDI - Rennes (35) - 45/55K€ Contexte du poste Rattaché à la direction R&D d'un acteur innovant du secteur technologique, vous interviendrez sur des projets de développement logiciel embarqué à forte composante technique, en lien avec des équipes pluridisciplinaires (électronique, mécanique, optique). Vous serez impliqué dans l'ensemble du cycle de développement, de l'architecture à la mise en production, en passant par la validation système et le support à l'indust…",45000,55000,,2025-05-06T07:40:20Z,https://www.adzuna.fr/details/5182634591?utm_medium=api&utm_source=e1ad5111,Emplois Ingénierie,ingénieur logiciel,fr,ingénieur logiciel,standard,False,False
Ingénieur Logiciel 3D temps réel,Theoris,"10ème Arrondissement, Paris","Nous recherchons, plusieurs Ingénieurs logiciel 3D temps réel, pour des postes en CDI, basés à Paris et en Ile de France. $Votre environnement : Passionné de technologies 3D/XR (Réalité Mixte, Augmentée ou Virtuelle), vous souhaitez rejoindre une équipe alliant compétence, exigence et convivialité, pour contribuer à des projets à la pointe de l'innovation, et évoluer auprès d'experts techniques référents dans le domaine. $Votre mission : Intégré au sein de l'équipe 3D ou celle de nos Clients, v…",,,permanent,2025-03-19T20:33:10Z,https://www.adzuna.fr/details/5101482136?utm_medium=api&utm_source=e1ad5111,Emplois Informatique,ingénieur logiciel,fr,ingénieur logiciel,standard,False,False
Ingénieur logiciel Europe F/H,HONEYWELL,France,"En tant qu'Ingénieur Logiciel chez Honeywell, vous serez responsable du développement et de la maintenance de solutions logicielles répondant aux besoins de nos clients. Vous travaillerez sur des projets de pointe et collaborerez avec une équipe d'ingénieurs talentueux pour fournir des produits logiciels de haute qualité. Rejoignez-nous pour façonner l'avenir de la technologie et avoir un impact positif sur le monde. Vous serez directement rattaché(e) au Directeur des Programmes et des Services…",45000,45000,permanent,2025-04-03T08:06:53Z,https://www.adzuna.fr/details/5125966902?utm_medium=api&utm_source=e1ad5111,Emplois Maintenance,ingénieur logiciel,fr,ingénieur logiciel,standard,False,False
Ingénieur logiciel robotique H/F,,"Magny-les-Hameaux, Maurepas","L'offre Projet Ingénieur Logiciel Robotique – ROS 2 Secteurs Aéronautique, Défense & Sécurité Description de l'offre Dans le cadre d’un projet stratégique en robotique autonome , nous recherchons deux ingénieurs en développement logiciel (SW) pour renforcer une équipe dédiée à l’intégration de systèmes autonomes terrestres et aériens . L’objectif est de développer une solution avancée d’autonomie collaborative , intégrant des capacités de navigation, détection et interaction dynamique dans un e…",104000,156000,contract,2025-03-11T06:06:49Z,https://www.adzuna.fr/details/5086225305?utm_medium=api&utm_source=e1ad5111,Emplois Vente,ingénieur logiciel,fr,ingénieur logiciel,standard,False,False
Ingénieur Logiciels Monétiques - (H/F),Seyos,"Saint-André-de-Cubzac, Bordeaux","Description Description : MADIC Industries, autrefois connue sous le nom de LAFON, fut établie à Bordeaux en 1959 par Georges Lafon. Depuis 2006, l'entreprise est intégrée au groupe MADIC. La société se spécialise dans la conception et le développement de solutions novatrices pour l'exploitation des stations-service, la gestion des flottes privées, les moyens de paiements sans surveillance et l'installation de points de charge pour les véhicules électriques. Rattaché au pôle R&D et au sein de l…",39000,45000,,2025-04-06T00:06:22Z,https://www.adzuna.fr/details/5131715648?utm_medium=api&utm_source=e1ad5111,Emplois Consultants,ingénieur logiciel,fr,ingénieur logiciel,standard,False,False
Ingénieur Logiciel Systèmes F/H,HARRY HOPE,"Mulhouse, Haut-Rhin","Dans un contexte d'innovation technologique constante, vous pilotez les évolutions logicielles des bancs d'essais et systèmes de simulation : - Définition des architectures systèmes et logiciels - Conception, codage et validation des modules applicatifs - Analyse et optimisation continue des solutions existantes - Contribution aux phases d'avant-vente techniques - Animation et encadrement de l'équipe développement logiciel Votre profil : - Diplômé d'une école d'ingénieur en informatique industr…",45000,55000,permanent,2025-04-16T07:45:52Z,https://www.adzuna.fr/details/5146948548?utm_medium=api&utm_source=e1ad5111,Emplois Industrie et Construction,ingénieur logiciel,fr,ingénieur logiciel,standard,False,False
Ingénieur Logiciels Embarqués F/H,Manpower France,"Auray, Lorient","Rattaché au service Développement, vous participez à la conception de la gamme de produits embarqués et suivez son développement jusqu'à son industrialisation. Vous assurez l'évolution de l'architecture logicielle des produits embarqués et participez à l'assistance technique. Vos missions: ​- Elaborer la feuille de route de développement des fonctionnalités logicielles en concertation avec l’Ingénieur systèmes embarqués et le Responsable BE - Développer, tester et assurer la traçabilité des exi…",45000,50000,permanent,2025-05-10T07:58:40Z,https://www.adzuna.fr/details/5191758215?utm_medium=api&utm_source=e1ad5111,Emplois Comptabilité et Finance,ingénieur logiciel,fr,ingénieur logiciel,standard,False,False
Ingénieur Logiciel Embarqué - F/H,elsys-design,"Villeurbanne, Lyon","Tu souhaites intégrer une entreprise dynamique et reconnue pour son savoir faire dans les systèmes embarqués ? Dans le cadre du renforcement de notre équipe logiciel embarqué, Elsys Design Lyon recherche un ingénieur spécialisé en développement logiciel embarqué. Vos missions : • Intégrer nos équipes d'ingénieurs logiciel et développer des briques logicielles génériques en C sur OS Linux • Implémenter de nouvelles fonctions logiciels • Tu pourras être amené à développer en Python dans le cadre …",35000,50000,permanent,2025-04-29T07:49:59Z,https://www.adzuna.fr/details/5168022308?utm_medium=api&utm_source=e1ad5111,Emplois Ingénierie,ingénieur logiciel,fr,ingénieur logiciel,standard,False,False
Ingénieur Logiciels Embarqués - F/H,elsys-design,"Villeurbanne, Lyon","Tu souhaites intégrer une entreprise dynamique et reconnue pour son savoir faire dans les systèmes embarqués ? Dans le cadre du renforcement de notre équipe logiciel embarqué, Elsys Design Lyon recherche un ingénieur spécialisé en développement logiciel embarqué. Vos missions : • Intégrer nos équipes d'ingénieurs logiciel et développer des briques logicielles génériques en C sur OS Linux • Implémenter de nouvelles fonctions logiciels • Tu pourras être amené à développer en Python dans le cadre …",35000,50000,permanent,2025-05-07T07:55:56Z,https://www.adzuna.fr/details/5184643469?utm_medium=api&utm_source=e1ad5111,Emplois Ingénierie,ingénieur logiciel,fr,ingénieur logiciel,standard,False,False
Ingénieur Logiciels Embarqués H/F,Madic Industries,"Saint-André-de-Cubzac, Bordeaux","Rejoignez notre nouveau Pôle Technologique de Saint André de Cubzac en Gironde (33) C'est par ici. Nous recrutons des Ingénieurs Logiciels Embarqués (H/F) Intégrez le pôle R&D - LOGICIELS EMBARQUES au sein de nos équipes de développement talentueuses et passionnées. Acteur majeur de nos projets, vous interviendrez sur toutes les phases de la conception à la réalisation en étroite collaboration avec nos clients nos partenaires. - De l'analyse des besoins, la faisabilité, la conception, le dévelo…",,,,2025-02-04T19:56:20Z,https://www.adzuna.fr/details/5037292283?utm_medium=api&utm_source=e1ad5111,Unknown,ingénieur logiciel,fr,ingénieur logiciel,standard,False,False
Ingénieur Logiciel Embarqué H/F,Médiane Système,"Massy, Palaiseau","Pour l'un de nos clients dans le secteur de l'industrie, sous la responsabilité du Responsable du service Logiciel Embarqué, vous serez Intégré(e) à l'équipe organisée en méthode agile et supervisée par un chef de projet. Vous serez ainsi amené(e) à : - Participer aux réunions techniques - Participer au développement de nouveaux logiciels sous microcontrôleurs - Participer à la documentation : spécification, conception détaillée - Participer à l'intégration et aux tests de nouvelles fonctionnal…",,,,2025-04-16T04:23:24Z,https://www.adzuna.fr/details/5146759830?utm_medium=api&utm_source=e1ad5111,Unknown,ingénieur logiciel,fr,ingénieur logiciel,standard,False,False
Ingénieur Logiciels Embarqués F/H,CLEEVEN Li,"Annecy, Haute-Savoie","En intégrant une équipe projet, directement sur les sites de nos clients, vous êtes en charge de mettre à leurs services vos compétences techniques et humaines. Votre rôle en tant qu’Ingénieur Logiciels embarqués : - Développement de logiciels embarqués temps réel - Analyser les protocoles de communications propres aux produits - Développer des scripts de tests de validation - Faire le lien avec les différents services De formation Bac 5, vous justifiez d'une première expérience en software emb…",30000,45000,permanent,2025-03-21T14:45:02Z,https://www.adzuna.fr/details/5104722499?utm_medium=api&utm_source=e1ad5111,Emplois Ingénierie,ingénieur logiciel,fr,ingénieur logiciel,standard,False,False
Ingénieur Logiciels Monétiques - F/H,Seyos,France,"Description : MADIC Industries, autrefois connue sous le nom de LAFON, fut établie à Bordeaux en 1959 par Georges Lafon. Depuis 2006, l'entreprise est intégrée au groupe MADIC. La société se spécialise dans la conception et le développement de solutions novatrices pour l'exploitation des stations-service, la gestion des flottes privées, les moyens de paiements sans surveillance et l'installation de points de charge pour les véhicules électriques. Rattaché au pôle R&D et au sein de l'équipe spéc…",40000,45000,permanent,2025-04-29T07:52:49Z,https://www.adzuna.fr/details/5168027226?utm_medium=api&utm_source=e1ad5111,Emplois Consultants,ingénieur logiciel,fr,ingénieur logiciel,standard,False,False
ingénieur Logiciels Embarqués F/H,CLEEVEN Li,"Lyon, Rhône","En intégrant une équipe projet, directement sur les sites de nos clients, vous êtes en charge de mettre à leurs services vos compétences techniques et humaines. Votre rôle en tant qu’Ingénieur Logiciels embarqués : - Développement de logiciels embarqués temps réel - Analyser les protocoles de communications propres aux produits - Développer des scripts de tests de validation - Faire le lien avec les différents services De formation Bac 5, vous justifiez d'une première expérience en software emb…",30000,45000,permanent,2025-03-28T07:03:54Z,https://www.adzuna.fr/details/5115330551?utm_medium=api&utm_source=e1ad5111,Emplois Ingénierie,ingénieur logiciel,fr,ingénieur logiciel,standard,False,False
Ingénieur Logiciel Java H/F,Recrulab,"Rhône, Auvergne-Rhône-Alpes","PRÉSENTATION DE L'ENTREPRISE L'entreprise que nous accompagnons est un client final situé dans Lyon 8. Afin d'accompagner sa croissance, nous l'aidons à recruter un Ingénieur Logiciel Java H/F en CDI. DESCRIPTION DU POSTE Vous participerez à des activités de conception technique, de développement, d'intégration et de documentation de composants logiciels. Vos principales missions seront : - Analyse des besoins : Contribuer à l'analyse des exigences fonctionnelles et techniques des modules, ains…",50000,60000,,2025-05-07T06:11:18Z,https://www.adzuna.fr/details/5184541326?utm_medium=api&utm_source=e1ad5111,Emplois Autres/Général,ingénieur logiciel,fr,ingénieur logiciel,standard,False,False
Ingénieur logiciel NAVAL H/F,ARealTI,"Tréguier, Lannion","up et nous privilégions l'humain et le partenariat à long terme. Animés par la passion et le challenge technique, nos ingénieurs et indépendants évoluent dans un environnement technologique stimulant qui favorise le partage des expertises et la convivialité. Le poste : Nous recherchons pour l'un de nos clients, acteur industriel en haute technologie, spécialisé dans le secteur de la robotique, maritime, navigation, aérospatiale et photonique, un(e) Ingénieur'(e) Logiciel Naval. Vous serez respo…",45000,50000,contract,2025-05-09T19:50:36Z,https://www.adzuna.fr/details/5190856311?utm_medium=api&utm_source=e1ad5111,Emplois Informatique,ingénieur logiciel,fr,ingénieur logiciel,standard,False,False
Ingénieur logiciel embarqué F/H,GROUPE ASTEK,"Toulouse, Haute-Garonne","Dans le cadre du développement de solutions embarquées innovantes, nous recherchons un ingénieur logiciel embarqué pour intervenir sur la validation de cartes SoC FPGA et le développement d’outils de test automatisés. Relecture de cahiers des charges et définition des procédures de test. Développement de logiciels de test embarqué en C pour automatiser les tests électriques et valider les interfaces sur carte cible SoC FPGA Xilinx . Conception et test de modules Python sous Linux pour piloter à…",35000,37000,permanent,2025-05-03T07:57:06Z,https://www.adzuna.fr/details/5177978854?utm_medium=api&utm_source=e1ad5111,Emplois Informatique,ingénieur logiciel,fr,ingénieur logiciel,standard,False,False
Ingénieur Logiciel Embarqué H/F,Rheso.tech,"Talence, Bordeaux",Ingénieur logiciel embarqué IOT H/F - Type de contrat : CDI - Localisation : Bordeaux - Ref : 1860 - Contact : @. Vous : Vous avez envie de vous impliquer dans le développement de produits à forte complexité technique dans le domaine de l'IOT ? Vous souhaitez travailler pour des applications qui ont du sens et contribuent au bien-être de nombreuses personnes? L'entreprise : Société avec plus de 20 ans d'existence dans les systèmes embarqué et en pleine croissance. Notre client développe des sol…,,,,2025-04-17T04:31:34Z,https://www.adzuna.fr/details/5148726689?utm_medium=api&utm_source=e1ad5111,Emplois Informatique,ingénieur logiciel,fr,ingénieur logiciel,standard,False,False
Ingénieur Logiciel Aéronautique H/F,Audaxio,"Tréguier, Lannion",Tu souhaites participer à des projets d'envergure dans le secteur aéronautique ? Nous accompagnons un de nos clients industriels qui est à la recherche de son futur ingénieur développement logiciel (H/F). Le poste consiste à contribuer à la conception et à la validation de technologies aéronautiques de pointe grâce à des simulations informatiques. Vous serez en charge de : Compréhension et conception : - Vous commencerez par analyser les caractéristiques techniques de l'avion et les exigences s…,35000,45000,,2025-04-12T04:54:31Z,https://www.adzuna.fr/details/5141604983?utm_medium=api&utm_source=e1ad5111,Emplois Autres/Général,ingénieur logiciel,fr,ingénieur logiciel,standard,False,False
Ingenieur Logiciel Robotique H/F,ARIAL INDUSTRIES,"Magny-les-Hameaux, Maurepas","NOS OPPORTUNITES / LES MISSIONS Dans le cadre du développement d'un projet pour l'industrie Défense, nous recherchons un Ingénieur Logiciel Robotique (H/F). Le poste est à pourvoir sur Châteaufort (78), des déplacements seront à prévoir sur Massy (91). Les principales missions sont les suivantes : - Développer un code C++ en respectant les spécifications techniques identifiées en amont - Réaliser le développement & l'optimisation des Algorithmes intégrés aux systèmes - Réaliser la conteneurisat…",45000,53000,,2025-02-09T07:44:17Z,https://www.adzuna.fr/details/5043601763?utm_medium=api&utm_source=e1ad5111,Emplois Informatique,ingénieur logiciel,fr,ingénieur logiciel,standard,False,False
Ingénieur Logiciel C++ H/F,Scalian,"Rangueuil, Toulouse","Vous rejoindrez les équipes de notre client spécialisé dans la conception et le développement de produit pour les secteurs de la défense et de l'aérospatiale. Vos missions seront les suivantes : - Participer à la définition des besoins, à la conception des logiciels et aux décisions d'architecture dans les projets de développement. - Assurer l'intégration des composants logiciels pour constituer un système pleinement opérationnel. - Rédiger un code structuré, documenté et facilement testable. -…",40000,55000,,2025-02-07T08:19:40Z,https://www.adzuna.fr/details/5040738043?utm_medium=api&utm_source=e1ad5111,Unknown,ingénieur logiciel,fr,ingénieur logiciel,standard,False,False
Ingénieur logiciel NAVAL F/H,ARealTI,"Lannion, Côtes-d'Armor","Nous recherchons pour l'un de nos clients, acteur industriel en haute technologie, spécialisé dans le secteur de la robotique, maritime, navigation, aérospatiale et photonique, un(e) Ingénieur'(e) Logiciel Naval. Vous serez responsable du développement de projets logiciels complexes dans le cadre de solutions de simulation navale. Parmi vos responsabilités, vous serez amené à : - Spécifier, concevoir et développer des modèles de simulation - Rédiger les documents techniques en français et en an…",45000,45000,permanent,2025-05-13T07:57:55Z,https://www.adzuna.fr/details/5195872974?utm_medium=api&utm_source=e1ad5111,Emplois Informatique,ingénieur logiciel,fr,ingénieur logiciel,standard,False,False
Ingénieur logiciel embarqué H/F,Candidate Front Office Akka Group,France,"Informations générales Entité Akkodis, est un acteur mondial de l'ingénierie et de l'IT et un leader dans la smart industrie. Nous accompagnons nos clients dans leurs projets de transformation digitale via 4 lignes de service : Consulting, Solutions, Talent et Academy. Akkodis est un partenaire technologique de confiance pour ses clients à l'échelle internationale. Nous co-créons et nous imaginons des solutions de pointe pour répondre aux défis majeurs de notre société, qu'il s'agisse d'accélér…",,,,2025-03-19T11:46:04Z,https://www.adzuna.fr/details/5100763167?utm_medium=api&utm_source=e1ad5111,Unknown,ingénieur logiciel,fr,ingénieur logiciel,standard,False,True
Ingénieur logiciel embarqué H/F,Akkodis,France,"Informations générales Entité Akkodis, est un acteur mondial de l'ingénierie et de l'IT et un leader dans la smart industrie. Nous accompagnons nos clients dans leurs projets de transformation digitale via 4 lignes de service : Consulting, Solutions, Talent et Academy. Akkodis est un partenaire technologique de confiance pour ses clients à l'échelle internationale. Nous co-créons et nous imaginons des solutions de pointe pour répondre aux défis majeurs de notre société, qu'il s'agisse d'accélér…",,,,2025-03-19T11:47:02Z,https://www.adzuna.fr/details/5100765884?utm_medium=api&utm_source=e1ad5111,Unknown,ingénieur logiciel,fr,ingénieur logiciel,standard,False,True
Ingénieur Logiciel Naval H/F,Brain Power,"Tréguier, Lannion","! AVANTAGES DU POSTE ! - Un environnement stimulant et en pleine évolution - Des projets diversifiés et à fort impact - Des opportunités de formation continue et d'évolution de carrière - Une culture d'entreprise collaborative et bienveillante ! DESCRIPTION DU POSTE ! Notre client est un acteur industriel de haute technologie, spécialisé dans la robotique, la navigation, le maritime, l'aérospatial et la photonique. Présent dans plus de 80 pays, il fournit des composants, produits et systèmes ro…",,,,2025-05-09T05:43:20Z,https://www.adzuna.fr/details/5189709190?utm_medium=api&utm_source=e1ad5111,Emplois Autres/Général,ingénieur logiciel,fr,ingénieur logiciel,standard,False,False
Ingénieur Logiciel Système H/F,Baldwin Partners,"Saint-Cyr-sur-Loire, Tours","Le contexte industriel : Baldwin Partners recrute pour un client, spécialisé dans le matériel aéronautique, un Ingénieur Logiciel Système pour intégrer un projet d'une durée de 6 mois minimum. Le poste est basé près de Tours et ne nécessite pas de déplacements. Vous interviendrez dans le développement logiciel et système, en lien avec les domaines de l'électrique, de l'électronique de puissance et de la mécanique. Vous serez responsable de la conception, du développement et de la mise en oeuvre…",35000,45000,,2025-04-09T05:26:13Z,https://www.adzuna.fr/details/5136583540?utm_medium=api&utm_source=e1ad5111,Unknown,ingénieur logiciel,fr,ingénieur logiciel,standard,False,False
