title,company,location,description,salary_min,salary_max,contract_type,created,redirect_url,category,specialty
Frontend Developer,Money Advice Trust,"Ladywood, Birmingham","Frontend Developer Birmingham (hybrid) Salary: £40,755 per annum 1 year fixed term contract (maternity cover) This is a maternity cover position expected to last up to 12 months, with the possibility of an earlier end date depending on the return of the post-holder Closing Date: Thursday 1st May 2025 About the Role Were looking for a talented Frontend Developer to join our team If you love coding, designing great user experiences, and working on meaningful projects, this could be the perfect ro…",40000,40000,contract,2025-04-18T18:01:16Z,https://www.adzuna.co.uk/jobs/details/5151840246?utm_medium=api&utm_source=e1ad5111,IT Jobs,frontend
Lead Frontend Engineer,Assa Abloy,"Blythe Valley Park, Shirley","Can you bring your experience to our team at ASSA ABLOY, Biosite? Join our team based in Solihull, UK and enjoy a collaborative culture that empowers you to build a career you can be proud of. This is a fully remote UK role. Biosite is a tried and trusted partner for the construction industry, specialising in biometric access control and workforce management software solutions since 2010. Additional, integrated solutions for fire safety, site management software and site surveillance technology…",52269.79,52269.79,permanent,2025-04-15T17:55:29Z,https://www.adzuna.co.uk/jobs/details/5145908355?utm_medium=api&utm_source=e1ad5111,IT Jobs,frontend
Frontend Developer - Angular,VANRATH,"Belfast, Northern Ireland","An opportunity for a talented developer to join a well-known insurance company in Belfast. This is the chance to lead the frontend development of an award-winning product. You have 3 years of experience with JavaScript and Angular/React Can work independently, but also a team player You have excellent communication and collaboration skills Experience with AWS is a bonus Experience contributing to server-side deployment is a bonus What's on offer Salary up to £60k Hybrid and Remote Working Compa…",60000,60000,,2025-04-04T07:08:04Z,https://www.adzuna.co.uk/jobs/land/ad/5128718442?se=Tlv8ljAe8BG-i3PTGXcHCQ&utm_medium=api&utm_source=e1ad5111&v=EB2ADC5D19B337A07FDC7CFB7E98553F1CB5CA4E,IT Jobs,frontend
Frontend Magento Developer,InterQuest Group  Limited,"Manchester, Greater Manchester","Frontend Magento Developer - Up to 50k - UK Remote - eCommerce ECOM are delighted to have partnered with an eCommerce agency with extensive experience in delivering complex digital solutions for a wide range of national and international clients. Established over a decade ago, our client have become a trusted partner for implementing advanced eCommerce platforms and delivering strategic digital marketing campaigns. Their expertise lies in platforms like Adobe Commerce (Magento), and they are se…",50000,50000,permanent,2025-04-04T13:43:31Z,https://www.adzuna.co.uk/jobs/details/5129253230?utm_medium=api&utm_source=e1ad5111,IT Jobs,frontend
Senior Frontend Engineer,InterQuest Group  Limited,"Manchester, Greater Manchester","Senior Frontend Engineer - Tech4Good - Up to 60k - Manchester (2 days p/w, 3 days WFH) ECOM are delighted to have teamed up with a Tech4Good organisation based in Manchester on their search for a Senior Frontend Engineer, which will be the first dedicated frontend hire into the organisation. They're a Tech for Good organisation that are using technology to help people save money on their energy consumption and in turn, helping the environment - so a win win for everyone. As the first Frontend h…",60000,60000,permanent,2025-04-15T22:16:11Z,https://www.adzuna.co.uk/jobs/details/5146527742?utm_medium=api&utm_source=e1ad5111,IT Jobs,frontend
Senior Frontend Developer,SAGE GROUP PLC,"Newcastle Upon Tyne, Tyne & Wear","The Senior Frontend Software Engineer is responsible for building, enhancing and maintaining products and/or systems to enable Sage’s business plans and long-term objectives using the identified architecture. This role is hybrid three days a week in the office in Newcastle. The Senior Frontend Software Engineer will contribute and help lead in the design, development and delivery of high-quality products and/or systems and services that exceed customers’ or business partners’ expectations and w…",48712.49,48712.49,,2025-03-18T13:24:24Z,https://www.adzuna.co.uk/jobs/land/ad/5098887498?se=Tlv8ljAe8BG-i3PTGXcHCQ&utm_medium=api&utm_source=e1ad5111&v=5BCE5D7623B4C4A44B316A301491BA57C766D287,IT Jobs,frontend
Frontend Developer,Bluebird,UK,"Our client is a rapidly growing tech company revolutionising MS365 security policy management solutions for Managed Service Providers (MSPs) worldwide  What’s in it for you? Competitive salary between £65k – £100k Remote-first working environment with monthly meet-ups in the London office Flexible work hours, pension contributions and bonus structures Continuous career development & mentoring opportunities within a no-ego, close-knit team It would be fantastic if you React is second nature to y…",54163.84,54163.84,,2025-04-08T09:31:55Z,https://www.adzuna.co.uk/jobs/land/ad/5135270203?se=Tlv8ljAe8BG-i3PTGXcHCQ&utm_medium=api&utm_source=e1ad5111&v=F333E5DEC733797C61649959A07554734D30669F,IT Jobs,frontend
Frontend Developer,Phantom Hire,"Birmingham, West Midlands","We are looking for a Frontend Developer to lead the development of high-end, visually stunning, and high-performing websites. This role is ideal for someone who thrives on crafting pixel-perfect, fast-loading, SEO-optimised websites that deliver seamless user experiences. While some back-end experience is beneficial, this is a frontend-first role , focusing primarily on responsive website development, headless CMS integration (ButterCMS, Contentful, etc.), WordPress customisation, and performan…",35787.28,35787.28,permanent,2025-04-02T16:18:08Z,https://www.adzuna.co.uk/jobs/land/ad/5124373241?se=Tlv8ljAe8BG-i3PTGXcHCQ&utm_medium=api&utm_source=e1ad5111&v=22ED2D9A54D9E23BA0164CF18B7CCF27D5857009,IT Jobs,frontend
Frontend Developer,Arrows,"London, UK","Frontend Developer - React & React Native – Up to £500/day (Outside IR35) – Hybrid (London Bridge) – 2 month contract We’re a mission-driven tech company that builds products to help people make confident decisions about their finances and everyday services. From switching energy providers to finding the right mortgage, we use data, design, and smart tech to make complex choices simpler and more transparent for millions of users. Essential Skills: Strong commercial experience with React and Rea…",72368.45,72368.45,contract,2025-04-11T04:27:27Z,https://www.adzuna.co.uk/jobs/land/ad/5139961620?se=Tlv8ljAe8BG-i3PTGXcHCQ&utm_medium=api&utm_source=e1ad5111&v=5AD3DD719E4F96AB2BC7B91397A5E26ADCF4380D,IT Jobs,frontend
Frontend Developer,Harnham,"Liverpool, Merseyside","Frontend Developer Retail, Liverpool £45,000  Benefits OVERVIEW Harnham are currently working with a loved UK retailer based in Liverpool that is looking to hire 2x Software Developers to their engineering team. They have a current team of 3 engineers/developers (including a Team Lead) and due to internal demand are looking to expand the team As a team they have been tasked with rebuilding an essential internal platform responsible for merchandising and supply chain. As they look to modernise t…",39746.41,39746.41,,2025-04-02T16:17:37Z,https://www.adzuna.co.uk/jobs/land/ad/5124370865?se=Tlv8ljAe8BG-i3PTGXcHCQ&utm_medium=api&utm_source=e1ad5111&v=3B704331F8B438BF06D34722E20E264596B59282,IT Jobs,frontend
Frontend Developer,Vertus Partners,"London, UK","React Developer – Trading Systems – London (Hybrid) My client, a leading London-based investment bank, is embarking on a greenfield front-office React application build from the ground up. This is a fantastic opportunity to play a key role in designing and developing a cutting-edge trading system that will be used by traders and quantitative analysts. As part of a highly skilled and dynamic team, you’ll have the autonomy to shape the architecture, technical direction, and best practices in a fa…",64826.74,64826.74,,2025-04-03T07:04:07Z,https://www.adzuna.co.uk/jobs/land/ad/5125964295?se=Tlv8ljAe8BG-i3PTGXcHCQ&utm_medium=api&utm_source=e1ad5111&v=4E300404F949585F3C25CE45058588A81956C345,IT Jobs,frontend
Senior Frontend Developer,TechShack,"London, UK","Senior Frontend Developer | React, Next.js, Typescript | Full Time, up to £100k We have partnered with an innovative AI-driven platform transforming design workflows with a browser-based SaaS solution. Having secured strong investment and a growing user base, they seek a Senior Frontend Engineer to enhance their cutting-edge product. As a Senior Frontend Engineer , you will shape the user experience of an AI-powered platform. Working closely with designers and backend engineers, you will build …",62579.28,62579.28,,2025-04-02T16:16:19Z,https://www.adzuna.co.uk/jobs/land/ad/5124365234?se=Tlv8ljAe8BG-i3PTGXcHCQ&utm_medium=api&utm_source=e1ad5111&v=78C3909A2C016BF91765F445CAFD3716374EB0F6,IT Jobs,frontend
Senior Frontend Engineer,G.Digital,"Eastern England, UK","Senior Frontend Engineer | React, TypeScript | 100% remote (CANDIDATES MUST BE BASED IN THE UK | up to £70k At G.Digital, we love partnering with business' who are revolutionising their industry and it's a pleasure to be partnered with a FinTech who are one of THE leaders in this sector. They are: Privately invested Launched brand new function offerings (AI and Product) About the role‍ If you're an experienced Senior Frontend Engineer with a history and love for frontend, UI builds particularly…",59536.83,59536.83,,2025-04-02T16:15:42Z,https://www.adzuna.co.uk/jobs/land/ad/5124360981?se=Tlv8ljAe8BG-i3PTGXcHCQ&utm_medium=api&utm_source=e1ad5111&v=8C9972F6F7D893F5F304A67FC4570F38F89118B5,IT Jobs,frontend
Senior Frontend Engineer,Wave Talent,"London, UK","Product Engineer (Frontend) | £140,000 | TypeScript | Vue/React | Hybrid (1 day a week in London) My client are a cutting-edge AI company revolutionising AI-driven automation by transforming human expertise into trustworthy AI models . Their platform enables businesses to build no-code AI workflows that automate complex knowledge work, from document processing to medical imaging and industrial inspection. They have recently been ranked 1 in Sifted’s Top B2B Companies for 2024 and recently secur…",49509.9,49509.9,,2025-04-02T16:17:05Z,https://www.adzuna.co.uk/jobs/land/ad/5124369076?se=Tlv8ljAe8BG-i3PTGXcHCQ&utm_medium=api&utm_source=e1ad5111&v=1DFE595F6119DE7B228A2340470D3F96857D7E75,IT Jobs,frontend
Senior Software Engineer II - Frontend,Rightmove,"London, UK","As a Senior Software Engineer II, you will be responsible for delivering high-quality software and products, able to be deployed frequently and safely into production. Working with similarly minded people, you will help to shape the way we use and adopt technologies and practices, with a modern engineering mindset. You are an advocate of test automation and have a clear view of where to make the best use of it. At Rightmove we work as part of autonomous cross-functional teams in an agile enviro…",61403.42,61403.42,,2025-04-02T15:37:31Z,https://www.adzuna.co.uk/jobs/land/ad/5124313731?se=Tlv8ljAe8BG-i3PTGXcHCQ&utm_medium=api&utm_source=e1ad5111&v=D8D676B03F5B260BB09E8EAC9AF07E81ADC9007D,Engineering Jobs,frontend
Frontend Developer (React) – Remote UK,KivoHire,"Yorkshire And The Humber, UK","We're helping a fast-moving UK startup hire a Frontend Developer (React) to join their growing team.  You’ll be working on a product-led team building React-based web applications from scratch, scaling new features, and shipping clean, modern code.  What You'll Need: – Strong experience with React and JavaScript/TypeScript – Comfortable working with REST APIs – Good communication (you’ll collaborate directly with a small tech team) – UK-based or remote from Europe ✨ Nice-to-haves: – Experience …",45000,65000,permanent,2025-03-27T07:05:26Z,https://www.adzuna.co.uk/jobs/details/5113233982?utm_medium=api&utm_source=e1ad5111,IT Jobs,frontend
Frontend Developer - up to £60k - ID39064,Humand Talent,"Oxfordshire, South East England","Front-end Developer – Join a Design-Led Web Agency Are you passionate about crafting seamless, responsive, and accessible web experiences? Do you thrive in a collaborative environment where creativity and technology intersect? Our client, a design-led web agency, is seeking a Front-end Developer to join their talented team. Specialising in Drupal-based e-commerce and content management solutions , they champion open-source technologies, UX best practices, and cutting-edge web development. Why T…",42356.06,42356.06,,2025-04-02T16:15:39Z,https://www.adzuna.co.uk/jobs/land/ad/5124360545?se=Tlv8ljAe8BG-i3PTGXcHCQ&utm_medium=api&utm_source=e1ad5111&v=7E2D21749EBFC25CCC0540A4C4FF03CBB7B6EDE0,IT Jobs,frontend
Frontend Developer,Pearson Carter,"Newcastle Upon Tyne, Tyne & Wear","Job Title: Frontend Developer Frontend Developer Pearson Carter are currently working with a leading Investment Company up North East. They are looking to grow their team as they are expanding their services. They are looking for someone who has at least 2 years commercial experience in Frontend Engineering and is ready to broaden their experience. They offer Competitive salary, Bonus, and Flexible Hybrid working Get in touch if you’re looking for your next opportunity Responsibilities: Working…",40000,45000,permanent,2025-03-26T11:40:03Z,https://www.adzuna.co.uk/jobs/details/5112093531?utm_medium=api&utm_source=e1ad5111,IT Jobs,frontend
FrontEnd Developer,Northrop Grumman,UK,"UK CITIZENSHIP REQUIRED FOR THIS POSITION: Yes RELOCATION ASSISTANCE: Relocation assistance may be available CLEARANCE TYPE: UK-Highest Level of Government Clearance TRAVEL: Yes, 10% of the Time Define Possible at Northrop Grumman UK At Northrop Grumman UK, our mission is to solve the most complex challenges by shaping the technology and solutions of tomorrow. We call it Defining Possible. This mind-set goes beyond our customer solutions; it’s the foundation for your career development and the …",45712.86,45712.86,,2024-11-04T12:46:44Z,https://www.adzuna.co.uk/jobs/details/4925794687?utm_medium=api&utm_source=e1ad5111,IT Jobs,frontend
Frontend Developer,SThree UK,UK,"Frontend Developer - Exciting Opportunity in AI Product-Based Company Join the technical team dedicated to excellence at a forward-thinking AI product-based company that collaborates with clients across government, non-profit, and housing sectors. This is a permanent position offering the flexibility of fully remote work. The company is small and growing, so the right person will be friendly, flexible, hard-working and open to fast-paced environments Essential Skills: 4 years of experience Reac…",55000,65000,permanent,2025-04-09T19:00:04Z,https://www.adzuna.co.uk/jobs/details/5137436886?utm_medium=api&utm_source=e1ad5111,IT Jobs,frontend
Frontend Engineer,Everfox,"London, UK","Intelligent. Dynamic. Resilient. Everfox, formerly Forcepoint Federal, has been defending the world’s most critical data and networks against the most complex cyber threats imaginable for more than 25 years. As trailblazers in defense-grade, high assurance cyber security, we have been leading the way in developing and delivering innovative cyber security technology. We protect data wherever it resides. Our unwavering dedication and commitment to our customers and the critical missions they serv…",38613,66456,permanent,2025-03-31T12:27:25Z,https://www.adzuna.co.uk/jobs/details/5119759893?utm_medium=api&utm_source=e1ad5111,IT Jobs,frontend
Frontend Engineer,Starling Bank,"London, UK","Hello, we’re Starling - a fully licensed UK bank with the culture and spirit of a fast-moving, disruptive tech company. We’re on a mission to fix banking, and give people a new way to spend, save and manage their money. Our journey started in 2014, and since then we have surpassed 4.2 million accounts (and four account types) with 350,000 business customers. We employ more than 3,000 people across our London, Southampton, Cardiff and Manchester offices. We’re looking for a Front End Engineer to…",51854.02,51854.02,,2025-04-10T16:55:49Z,https://www.adzuna.co.uk/jobs/details/5138929999?utm_medium=api&utm_source=e1ad5111,IT Jobs,frontend
Frontend Designer,Zachary Daniels,"Fareham, Hampshire","Frontend Designer | up to £45k | Hybrid | 10% Pension Contribution | 36 Days Holiday including BH) | Life Insurance |Southampton | Not For Profit Organisation | Outdoor Sports An established and respected national organisation in the outdoor sports and recreational sector is seeking a highly skilled Frontend Designer to join its dynamic Digital Team. This hybrid position is based near Southampton, and offers an opportunity to lead the design and user experience of one of the UK's leading online…",40000,45000,permanent,2025-04-11T18:56:26Z,https://www.adzuna.co.uk/jobs/details/5140730486?utm_medium=api&utm_source=e1ad5111,IT Jobs,frontend
Frontend Manager,Soar,"London, UK","About Us: Soar is a global fintech startup that specializes in financing and investment. Currently headquartered in Saudi Arabia, Soar is growing throughout the region with a mission to help people achieve their financial goals with innovative financial and property investment solutions and tools through its multi-purpose platform, designed to offer a simple and seamless user experience. Role Purpose: We are seeking an experienced and passionate a Frontend Manager with a strong background in Ne…",47114,47114,,2025-04-07T08:31:01Z,https://www.adzuna.co.uk/jobs/details/5133344035?utm_medium=api&utm_source=e1ad5111,IT Jobs,frontend
Frontend Developer,In Technology Group,"Kirkhamgate, Wakefield","Position: Frontend Developer - Wakefield - Hybrid Salary: £37,000 - £39,500 per year Work Model: Hybrid - 2 days per week onsite in Wakefield We're excited to be working with a public sector business based in Wakefield, who are looking to hire a talented Frontend Developer to join their innovative team. This is a hybrid role, offering flexibility. About the Role: As the successful Frontend Developer you will be responsible for completing a variety of tasks after the daily sprints in Agile and S…",37000,39500,,2025-04-01T17:13:00Z,https://www.adzuna.co.uk/jobs/details/5121778091?utm_medium=api&utm_source=e1ad5111,IT Jobs,frontend
Frontend Developer,In Technology Group Limited,"Wakefield, West Yorkshire","Position: Frontend Developer - Wakefield - Hybrid Salary: £37,000 - £39,500 per year Work Model: Hybrid - 2 days per week onsite in Wakefield We're excited to be working with a public sector business based in Wakefield, who are looking to hire a talented Frontend Developer to join their innovative team. This is a hybrid role, offering flexibility. About the Role: As the successful Frontend Developer you will be responsible for completing a variety of tasks after the daily sprints in Agile and S…",35000,35000,,2025-04-02T07:21:52Z,https://www.adzuna.co.uk/jobs/details/5123638365?utm_medium=api&utm_source=e1ad5111,IT Jobs,frontend
Frontend Engineer,Wintermute,"London, UK","About Wintermute Wintermute is one of the largest crypto native algorithmic trading companies in digital assets. We provide liquidity across most cryptocurrency exchanges and trading platforms, a broad range of OTC trading solutions as well as support high profile blockchain projects and traditional financial institutions moving into crypto. Wintermute also has a Wintermute Ventures arm that invests in early stage DeFi projects. Wintermute was founded in 2017 and has successfully navigated indu…",59076.44,59076.44,,2024-12-09T18:02:28Z,https://www.adzuna.co.uk/jobs/details/4969200623?utm_medium=api&utm_source=e1ad5111,IT Jobs,frontend
Frontend Engineer,Wintermute,"London, UK","About WintermuteWintermute is one of the largest crypto native algorithmic trading companies in digital assets. We provide liquidity across most cryptocurrency exchanges and trading platforms, a broad range of OTC trading solutions as well as support high profile blockchain projects and traditional financial institutions moving into crypto. Wintermute also has a Wintermute Ventures arm that invests in early stage DeFi projects.Wintermute was founded in 2017 and has successfully navigated indust…",60005.04,60005.04,,2025-04-11T12:48:59Z,https://www.adzuna.co.uk/jobs/details/5140420644?utm_medium=api&utm_source=e1ad5111,IT Jobs,frontend
Frontend Developer,,UK,"Your technical duty is not building anything from scratch, instead its two things; - Debugging & Refactoring - Correctly implement and connect backend to the frontend For ONLY 4 tasks (part completed), carefully coordinated with our team engineer to get you onboard fast and support with any queries and guide as much as required. DEADLINE - ASAP PRICE - FIXED $35 Tech Specs; -React (Frontend) -NodeJS (Backend) -MongoDB (DB) - AI integration (GPTs, Claude, Gemini etc.) -Git Repo management",33737.49,33737.49,,2025-04-16T15:43:21Z,https://www.adzuna.co.uk/jobs/details/5147440060?utm_medium=api&utm_source=e1ad5111,IT Jobs,frontend
Frontend Engineer,Faculty AI,"London, UK","About Faculty At Faculty, we transform organisational performance through safe, impactful and human-centric AI. With a decade of experience, we provide over 300 global customers with software, bespoke AI consultancy , and Fellows from our award winning Fellowship programme . Our expert team brings together leaders from across government, academia and global tech giants to solve the biggest challenges in applied AI. Should you join us, you’ll have the chance to work with, and learn from, some of…",58230.98,58230.98,,2025-04-02T10:39:48Z,https://www.adzuna.co.uk/jobs/details/5123832745?utm_medium=api&utm_source=e1ad5111,IT Jobs,frontend
Frontend Developer,Identify Solutions,"Scotland, UK","Job Description Frontend Developer – £240.00 per day Outside IR35 – Fully Remote Day Rate: £240.00 per day (Outside IR35) Duration: 3 Months (Possible Extensions) Office Location: UK (Fully remote but MUST BE UK based) A UK based digital design company is looking for an experienced developer to work on web applications for desktop, mobile etc – This will be an initial 3 month contract and you will need to be immediately available. Key Skills & Experience: JS TypeScript Tailwind React Next.JS RE…",53137.34,53137.34,contract,2024-07-31T15:10:16Z,https://www.adzuna.co.uk/jobs/details/4802572747?utm_medium=api&utm_source=e1ad5111,IT Jobs,frontend
Frontend Developer,Searchability,"Manchester, Greater Manchester","Mid - Senior level Frontend Developer - 4 days a week on site in Central Manchester JavaScript / Typescript / React / CSS HYBRID WORKING - OFFICE IN MANCHESTER - SALARY UP TO £45,000 DOE Based in Manchester - Hybrid working 4 days onsite per week Salary up to?£45,000 - 25 days holiday plus bank holiday, pension, and other benefits. WHO ARE WE? We create software which provides workplaces with software for people management. Anything that might need tracking in the workplace we can produce softw…",30000,45000,permanent,2025-04-15T13:10:36Z,https://www.adzuna.co.uk/jobs/details/5145637305?utm_medium=api&utm_source=e1ad5111,IT Jobs,frontend
Frontend Developer,Damia Group Ltd,UK,"Frontend Developer - Remote - Circa Outside IR35 - 2/3 months All applicants must hold an active SC clearance. My client is a global leading IT consultancy. They are looking for a Software Engineer to develop and support a portfolio of applications. They are looking for multi skilled individuals that will carry out development and operational support. Skills needed: Wordpress, PHP, Mysql. Wagtail CMS, Node.js, front end dev skills. AWS platform skills: ECS, Fargate, LightSail, CloudWatch, WAF, …",117000,143000,contract,2025-03-27T13:44:35Z,https://www.adzuna.co.uk/jobs/details/5113468187?utm_medium=api&utm_source=e1ad5111,IT Jobs,frontend
Frontend Architect,Veeva Systems,"London, UK","Veeva Systems is a mission-driven organization and pioneer in industry cloud, helping life sciences companies bring therapies to patients faster. As one of the fastest-growing SaaS companies in history, we surpassed $2B in revenue in our last fiscal year with extensive growth potential ahead. At the heart of Veeva are our values: Do the Right Thing, Customer Success, Employee Success, and Speed. We're not just any public company – we made history in 2021 by becoming a public benefit corporation…",49144.81,49144.81,,2024-07-31T15:06:21Z,https://www.adzuna.co.uk/jobs/details/4802540049?utm_medium=api&utm_source=e1ad5111,IT Jobs,frontend
Frontend Developer,Research Central,"London, UK",About the role We're looking for a Frontend Developer to design and build our desktop experience. With great reviews and feedback from our mobile-first platforms you will be delivering on an ambitious roadmap of features and getting the opportunity to be part of that evolution. You'll be working with a world-class team of engineers who are passionate about what they do. You should have an insatiable hunger for learning new things and improving existing ones. If you're the right one for us you h…,34091.32,34091.32,,2024-07-31T14:58:43Z,https://www.adzuna.co.uk/jobs/details/4802484624?utm_medium=api&utm_source=e1ad5111,IT Jobs,frontend
