title,company,location,description,salary_min,salary_max,contract_type,created,redirect_url,category,specialty
Business Development Manager,NatWest,"Caversham, Reading","Join us as a Business Development Manager We’ll look to you to drive business development activities across the SME landscape You’ll build and maintain strong relationships with business leaders, business partners, and other related organisations to seek new opportunities This is a great opportunity to be involved in a new team and proposition and have the ability to help shape future strategy while developing your skills, knowledge, and network What you'll do As a Business Development Manager,…",42336.71,42336.71,,2025-04-01T07:44:20Z,https://www.adzuna.co.uk/jobs/land/ad/5120947753?se=JvTjazAe8BG-i3PTGXcHCQ&utm_medium=api&utm_source=e1ad5111&v=6572E4A7A48F5AD19998CFD463F1BF0CA86D0ADE,Accounting & Finance Jobs,developer
Business Development Manager,NatWest,"Downs Barn, Milton Keynes","Join us as a Business Development Manager We’ll look to you to drive business development activities across the SME landscape You’ll build and maintain strong relationships with business leaders, business partners, and other related organisations to seek new opportunities This is a great opportunity to be involved in a new team and proposition and have the ability to help shape future strategy while developing your skills, knowledge, and network What you'll do As a Business Development Manager,…",41221.32,41221.32,,2025-04-01T07:44:20Z,https://www.adzuna.co.uk/jobs/land/ad/5120947745?se=JvTjazAe8BG-i3PTGXcHCQ&utm_medium=api&utm_source=e1ad5111&v=29A63599925C6B0C2F6E1A2E5B3DF36FCD3721E1,Accounting & Finance Jobs,developer
Business Development Manager,NatWest,"Blackweir, Cardiff","Join us as a Business Development Manager We’ll look to you to drive business development activities across the SME landscape You’ll build and maintain strong relationships with business leaders, business partners, and other related organisations to seek new opportunities This is a great opportunity to be involved in a new team and proposition and have the ability to help shape future strategy while developing your skills, knowledge, and network What you'll do As a Business Development Manager,…",38276.9,38276.9,,2025-04-01T07:44:20Z,https://www.adzuna.co.uk/jobs/land/ad/5120947751?se=JvTjazAe8BG-i3PTGXcHCQ&utm_medium=api&utm_source=e1ad5111&v=E512DD080DB4AB959401AA9F46711921220912E7,Accounting & Finance Jobs,developer
Business Development Manager,NatWest,"Grange Park, Northampton","Join us as a Business Development Manager We’ll look to you to drive business development activities across the SME landscape You’ll build and maintain strong relationships with business leaders, business partners, and other related organisations to seek new opportunities This is a great opportunity to be involved in a new team and proposition and have the ability to help shape future strategy while developing your skills, knowledge, and network What you'll do As a Business Development Manager,…",42712,42712,,2025-04-01T07:44:20Z,https://www.adzuna.co.uk/jobs/land/ad/5120947763?se=JvTjazAe8BG-i3PTGXcHCQ&utm_medium=api&utm_source=e1ad5111&v=E38081B3F674E40DC6967F5FDC114F097EA9F9EE,Accounting & Finance Jobs,developer
Business Development Manager,NatWest,"North Hinksey Village, Oxford","Join us as a Business Development Manager We’ll look to you to drive business development activities across the SME landscape You’ll build and maintain strong relationships with business leaders, business partners, and other related organisations to seek new opportunities This is a great opportunity to be involved in a new team and proposition and have the ability to help shape future strategy while developing your skills, knowledge, and network What you'll do As a Business Development Manager,…",38466.12,38466.12,,2025-04-01T07:44:20Z,https://www.adzuna.co.uk/jobs/land/ad/5120947766?se=JvTjazAe8BG-i3PTGXcHCQ&utm_medium=api&utm_source=e1ad5111&v=F867E742985E6C135FCF0C24524705E3C01B590C,Accounting & Finance Jobs,developer
Software Developer,Network IT,"Bridgnorth, Shropshire","Role: Software Developer (Predominantly SQL Server Backend) Location: Bridgenorth (Initially Fully In-Office, 3 Days In-Office Per Week Once Settled) Salary: £55,000 - £65,000 Network IT are looking for an exceptional Software Developer to join our clients small internal development team who are undertaking a significant software transformation programme . You will undertake hands-on work supporting significant company-wide projects alongside BAU responsibilities to keep their critical processe…",65000,65000,permanent,2025-03-18T15:45:53Z,https://www.adzuna.co.uk/jobs/details/5099088832?utm_medium=api&utm_source=e1ad5111,IT Jobs,developer
C# Developer,Circle Group,"Mansfield, Nottinghamshire","C# Developer Mansfield £40k - £60k Are you a skilled C# Developer looking for an opportunity to work on innovative software solutions? Do you enjoy problem-solving, system development, and taking the opportunity to lead in projects? If so, we want to hear from you. Our client based in Mansfield is looking for a C# Developer to join them within their small team, offering a starting salary between £40k - £60k doe. Please note, this role will be fully office based. The Role: As a C# Developer , yo…",60000,60000,permanent,2025-04-02T21:16:42Z,https://www.adzuna.co.uk/jobs/details/5125066550?utm_medium=api&utm_source=e1ad5111,IT Jobs,developer
Software Developer,Guidant Global,"Portsmouth, Hampshire","Job Description The developer shall join a 7 member scrum team as part of a wider program to deliver a management systems for a new Satellite. The developer shall contribute to all stages of the software development lifecycle and thus have solid experience in design (particularly using UML), development (particularly using Java technologies) and test. The developer should have experience of working with microservices. Automated testing is a critical part of the project so any experience of this…",114400,114400,contract,2025-04-15T17:55:29Z,https://www.adzuna.co.uk/jobs/details/5145908378?utm_medium=api&utm_source=e1ad5111,IT Jobs,developer
Proclaim Developer,Erin Associates,"St. Helens, Merseyside",Proclaim Developer - St Helens - Up to £40k plus benefits This advanced legal company are looking to add a Proclaim Developer to their collaborative development team. The successful developer will be a team player and looking to build on their skills and experience in a vibrant working environment. The Proclaim Developer will be directly responsible for building solutions and enhancing existing functionality within the case management system. This role will require you to ensure the integration…,40000,40000,permanent,2025-04-04T13:36:41Z,https://www.adzuna.co.uk/jobs/details/5129242522?utm_medium=api&utm_source=e1ad5111,IT Jobs,developer
Dynamics365 Developer,LA International Computer Consultants Ltd,"South East London, London","Job Summary: We are looking for a skilled Microsoft Dynamics 365 Developer with expertise in D365 CE/CRM, PowerApps Component Framework (PCF), Plugin Development, C#/.Net, JavaScript/TypeScript, and Azure Services. The ideal candidate will design, develop, and implement solutions within the Dynamics 365 ecosystem while integrating with Azure services and other third-party applications. Key Responsibilities:  D365 CE/CRM Development:  Customize and extend Dynamics 365 CE/CRM using out-of-the-box…",78993.63,78993.63,contract,2025-03-25T19:59:49Z,https://www.adzuna.co.uk/jobs/details/5111239513?utm_medium=api&utm_source=e1ad5111,IT Jobs,developer
Software Developer,Intertek,"Scotland, UK","ABOUT YOU We are seeking a talented Software Developer to join our dynamic team on a 12-month fixed term contract. The successful candidate will play a crucial role in designing, developing, and maintaining high-quality software. We are seeking someone who has experience and knowledge of developing applications using Python, C#, JavaScript, .Net, HTML and CSS. Required skills and experience: Demonstrable experience in application development and integration Familiarity with computing science, d…",43330.45,43330.45,permanent,2025-04-10T17:44:18Z,https://www.adzuna.co.uk/jobs/details/5138977159?utm_medium=api&utm_source=e1ad5111,IT Jobs,developer
Software Developer,Intertek,"Blackdog, Bridge Of Don","We have an exciting opportunity for a highly motivated and dedicated Software Developer to join our dynamic team. The ideal candidate will have a solid background developing applications using Python, C#, JavaScript, .Net, HTML and CSS. ABOUT YOU We are seeking a talented Software Developer to join our dynamic team on a 12-month fixed term contract. The successful candidate will play a crucial role in designing, developing, and maintaining high-quality software. We are seeking someone who has e…",42025.2,42025.2,contract,2025-03-13T23:18:05Z,https://www.adzuna.co.uk/jobs/details/5092235920?utm_medium=api&utm_source=e1ad5111,IT Jobs,developer
.NET Developer,Shortlist Recruitment,"Wirral, Cheshire",".NET Developer £45,000 Wirral ShortList Recruitment have a fantastic opportunity for a .NET Developer to join our market leading client with ambitious growth plans who are based on the Wirral. This role is for a great company with a hugely interesting roadmap in place and they are looking for someone to join the team as soon as possible. As a .NET Developer, you will get the opportunity to work with modern frameworks on a range of cutting edge products, helping the development team move forward…",45000,45000,permanent,2025-03-15T03:37:03Z,https://www.adzuna.co.uk/jobs/details/5094593779?utm_medium=api&utm_source=e1ad5111,IT Jobs,developer
PHP Developer,Bright Purple Resourcing,"Glasgow, Scotland","PHP Developer - Glasgow Are you a PHP developer who thrives on tackling diverse projects and enjoys the camaraderie of a smaller team? A rapidly expanding technology company in central Glasgow is seeking a talented PHP developer to join their dynamic team. This role offers a unique chance to work on an array of projects, including database optimisation, integration tasks, and extensive product development for a variety of clients. Additionally, you will contribute to the development of the comp…",40000,40000,permanent,2025-03-31T21:04:25Z,https://www.adzuna.co.uk/jobs/details/5120361103?utm_medium=api&utm_source=e1ad5111,IT Jobs,developer
Developer - M365,TALENT INTERNATIONAL UK LTD,"Staffordshire Technology Park, Stafford","Job Description: Developer - M365 Permanent | Staffordshire Salary: £53,688  Package Hybrid: 3 days per week | Must reside within 1hr 30mins hour of Stafford. Staffordshire Police are seeking an experienced Developer to join their Digital, Data, and Technology (DDaT) team on a permanent basis. This team is at the forefront of transforming and supporting all digital technology needs across the force. As a Developer your responsibilities will include but not limited to; Responsible for end to dev…",50321.33,50321.33,permanent,2025-04-17T22:00:23Z,https://www.adzuna.co.uk/jobs/details/5150602297?utm_medium=api&utm_source=e1ad5111,IT Jobs,developer
Software Developer,Alces Flight,"Bicester, Oxfordshire","SOFTWARE DEVELOPER / OXFORDSHIRE / UP TO £45,000 & GREAT BENEFITS Amazing new opportunity for a Software Developer to join a growing tech organisation. Excellent pay, flexible hours and ongoing training and support to ensure you realise your potential Alces Flight designs and develops innovative software for AI & HPC/supercomputer systems across the UK. We are advocates of open-source software and strongly believe in community-driven development. We have a wide customer base in multiple market …",50000,50000,permanent,2025-04-16T17:58:44Z,https://www.adzuna.co.uk/jobs/details/5147555969?utm_medium=api&utm_source=e1ad5111,IT Jobs,developer
ServiceNow Developer,La Fosse,"East Midlands, UK","ServiceNow Developer (Contract) Location : Remote / East Midlands Rate: (Outside IR35) Duration : 6 months initial contract About the Role: We are seeking an experienced ServiceNow Developer to join a confidential project with a high-profile client. This role involves developing and enhancing ServiceNow capabilities to streamline the delivery and tracking of hardware kits to end users. The successful candidate will play a key role in automating order and change processes, managing ticket call f…",130000,136500,contract,2025-04-10T09:50:48Z,https://www.adzuna.co.uk/jobs/details/5138517458?utm_medium=api&utm_source=e1ad5111,IT Jobs,developer
.NET Developer,Shortlist Recruitment,"Chester, Cheshire",".NET Developer £45,000 Chester ShortList Recruitment have a fantastic opportunity for a .NET Developer to join our market leading client with ambitious growth plans who are based near Chester. This role is for a great company with a hugely interesting roadmap in place and they are looking for someone to join the team as soon as possible. As a .NET Developer, you will get the opportunity to work with modern frameworks on a range of cutting edge projects, helping the development team move forward…",45000,45000,permanent,2025-04-04T21:23:32Z,https://www.adzuna.co.uk/jobs/details/5129909282?utm_medium=api&utm_source=e1ad5111,IT Jobs,developer
Proclaim Developer,Circle Group,"Leeds, West Yorkshire","Proclaim Developer - Fully Remote - Up to £55K Proclaim - Proclaim Developer - SQL - Software Support - IT Support - Support - Desktop Support Are you a talented Proclaim Developer looking for a fully remote opportunity where your skills will make a real impact? A reputable and forward-thinking legal firm based in Leeds is seeking a Proclaim developer to help drive their digital systems forward. As a Proclaim Developer, you'll play a vital role in maintaining, developing, and enhancing the firm…",55000,55000,permanent,2025-04-19T18:10:54Z,https://www.adzuna.co.uk/jobs/details/5153409935?utm_medium=api&utm_source=e1ad5111,IT Jobs,developer
Web Developer,Reed Technology,UK,"Web Developer Annual Salary: Competitive (based on experience) Location: Wickford (2 days in office a week) Job Type: Full-time Must have Right to Work in the UK (cannot provide sponsorship) Join our dynamic Web Development team as a Web Developer, where you will have the opportunity to work with a range of web technology across the full stack. Our client base is growing, and we are enhancing our web-oriented product offerings. We are seeking highly motivated and creative web developers to be i…",38452.04,38452.04,permanent,2025-04-10T17:44:18Z,https://www.adzuna.co.uk/jobs/details/5138977137?utm_medium=api&utm_source=e1ad5111,IT Jobs,developer
Node Developer,Shortlist Recruitment,"Stockport, Greater Manchester","Node Developer £60,000 Stockport ShortList Recruitment are working with an exciting startup who are recruiting for a Node Developer to join their growing team based in Stockport, Greater Manchester. The Node Developer will be adept at producing good quality code, which is clear, maintainable and testable. You will contribute to all levels of the web application, ranging from backend technologies using Node.js, to frontend web interfaces using React. The Node Developer will be energised by makin…",60000,60000,permanent,2025-04-12T09:48:16Z,https://www.adzuna.co.uk/jobs/details/5141916537?utm_medium=api&utm_source=e1ad5111,IT Jobs,developer
ProIV Developer,Rise Technical Recruitment Limited,UK,"ProIV Developer 6-12 month contract Outside IR35 £450pd - £650pd DOE (LTD/Umbrella) Remote Immediately Available My client is looking for a ProIV Developer with mainframe ProIV skills and both online and batch development experience. The ideal candidate will have mainframe JCL experience to support ProIV in a batch environment. The Role: Develop and enhance software solutions using ProIV and JCL within existing engineering frameworks to support the company application Improve the efficiency, re…",117000,169000,contract,2025-04-04T13:36:40Z,https://www.adzuna.co.uk/jobs/details/5129242510?utm_medium=api&utm_source=e1ad5111,IT Jobs,developer
React Developer,Network IT,"Kidderminster, Worcestershire","Role: React Frontend Developer Location: Kidderminster (Hybrid 2 Days A Week In-Office) Salary: £45,000 - £55,000 Network IT are looking for a Front-End Developer who has exceptional experience using React . You will play a key role in developing user-friendly, performant interfaces against a robust ERP platform. You will work primarily on the frontend but also collaborate across the stack to deliver features that have a tangible impact on customers' day-to-day operations. Key Responsibilities …",55000,55000,permanent,2025-04-17T22:00:23Z,https://www.adzuna.co.uk/jobs/details/5150602309?utm_medium=api&utm_source=e1ad5111,IT Jobs,developer
.NET Developer,Shortlist Recruitment,"Warrington, Cheshire",".NET Developer £45,000 Warrington ShortList Recruitment are looking for a .NET Developer to join fast-growing and high-performing software company based in Warrington. The Developer will get the opportunity to work on greenfield applications, while also producing software focused on helping customers get the most out of their data and communications. The company have several products that you will be responsible for maintaining and enhancing, as well as being able to contribute to the technical…",45000,45000,permanent,2025-03-15T03:37:03Z,https://www.adzuna.co.uk/jobs/details/5094593781?utm_medium=api&utm_source=e1ad5111,IT Jobs,developer
Umbraco Developer,Network IT,"Kenilworth, Warwickshire","Role: Umbraco Developer Location: Kenilworth (Hybrid) Salary: £40,000 - £45,000 Network IT are looking for an Umbraco Developer to join a dynamic Information Services team, where youll help shape and maintain engaging, responsive digital platforms. Reporting to the Senior Web Developer , youll support and evolve the organisations web presence, working closely with communications, design, and IS colleagues to deliver impactful solutions. What youll be doing as a Web Developer Develop, support, a…",45000,45000,permanent,2025-04-06T05:23:30Z,https://www.adzuna.co.uk/jobs/details/5132005285?utm_medium=api&utm_source=e1ad5111,IT Jobs,developer
Python Developer,Morson Talent,"Heap Bridge, Bury","Python Developer (Remote or Office-Based) We are seeking a skilled Python Developer to join our team. This role is available on either a temporary or permanent basis, offering flexibility based on the candidate's preferences. While this is a fully remote position, those who prefer an office environment are welcome to work from one of our locations. Role Overview As a Python Developer , you will be responsible for developing and maintaining business applications that streamline workflows. Your w…",90000,90000,permanent,2025-04-03T17:22:21Z,https://www.adzuna.co.uk/jobs/details/5126915008?utm_medium=api&utm_source=e1ad5111,IT Jobs,developer
IFS Developer,Tunstall Healthcare  Ltd,"Manchester, Greater Manchester","We are currently recruiting for an IFS Developer to join our ERP team, helping us to design, customise, and successfully deliver our ERP system as required. This role could be based at our Manchester city centre or Whitley, Yorkshire office , working on a hybrid basis . You would need to be flexible based on project and business requirements and expect to be onsite more for your first few weeks, but we are flexible on the number of days required onsite on average per week/month. What will you b…",53320.86,53320.86,permanent,2025-03-23T19:44:50Z,https://www.adzuna.co.uk/jobs/details/5108015503?utm_medium=api&utm_source=e1ad5111,IT Jobs,developer
PHP Developer,La Fosse,"South East London, London","PHP Laravel Developer | Hybrid | PHP | Laravel | Vue.js | £65,000 - £75,000 Join a fast-growing marketing and technology company known for innovation, collaboration, and building exceptional digital products. My client is looking for a talented PHP Developer with strong experience in Laravel and Vue.js, who also brings solid experience with testing best practices. This is an exciting opportunity to work on meaningful projects in a supportive, forward-thinking team. Experience & Skills Required:…",75000,75000,permanent,2025-04-09T17:39:39Z,https://www.adzuna.co.uk/jobs/details/5137286563?utm_medium=api&utm_source=e1ad5111,IT Jobs,developer
PHP Developer,Shortlist Recruitment,"Chorley, Lancashire","PHP Developer £45,000 Chorley Shortlist Recruitment are looking for an experienced PHP Developer to join a market-leading software company based in Chorley. This business is an industry leader in their field, so we are looking for a PHP Developer who can work to exacting standards and who prides themselves on delivering world-class products. This is a full-stack role, and the successful candidate will work on a range of projects, designing and building new applications from scratch as well as i…",45000,45000,permanent,2025-04-12T13:53:53Z,https://www.adzuna.co.uk/jobs/details/5142065163?utm_medium=api&utm_source=e1ad5111,IT Jobs,developer
Proclaim Developer,Birchwell Associates Ltd,"Leeds, West Yorkshire","We are currently recruiting for an experienced Proclaim Developer to join the Information Technology team of a highly regarded, award-winning law firm based in North Leeds. This is a fantastic opportunity for a driven and motivated individual to contribute to the ongoing development and maintenance of the firms Proclaim database and App as it continues to expand. The successful candidate will play a crucial role in supporting the firms growing operations across multiple legal entities. This pos…",40000,40000,permanent,2025-04-05T09:19:19Z,https://www.adzuna.co.uk/jobs/details/5130892618?utm_medium=api&utm_source=e1ad5111,IT Jobs,developer
Lead Developer,Partnerscale Limited,"Bicester, Oxfordshire","Lead Developer Web & Mobile Apps Bicester, Oxfordshire (x1 day per week in office) / Hybrid £70,000 - £80,000 DOE  Benefits We are working with a highly established and successful Software Company who build Websites, Software and Mobile Apps for global clients across various industries. After a recent takeover, its exciting times for this technology company as they embark on the next phase of their growth. Due to an internal promotion, they are now looking for a Lead Developer to join the busin…",80000,80000,permanent,2025-04-05T13:31:05Z,https://www.adzuna.co.uk/jobs/details/5131041642?utm_medium=api&utm_source=e1ad5111,IT Jobs,developer
.NET Developer,Shortlist Recruitment,"Chester, Cheshire",".NET Developer £50,000 Chester Shortlist Recruitment are looking for a .NET Developer to join a market-leading business based in Chester. The company is forward-thinking and is always looking to work with the latest technologies. They are currently going through a period of expansion, making this an exciting time to join. This is a full-stack role, and the successful candidate will work on a range of projects, designing and building new applications from scratch as well as improving their exist…",50000,50000,permanent,2025-04-12T01:46:29Z,https://www.adzuna.co.uk/jobs/details/5141493953?utm_medium=api&utm_source=e1ad5111,IT Jobs,developer
Lead Developer,Hyperloop Recruitment,"Llanbedr Dyffryn Clwyd, Ruthin","Lead Developer £75,000 (DOE)  benefits North Wales (hybrid) Hyperloop Recruitment are working with a scale-up software house in North Wales who are looking for a Lead Developer to join their growing team. The successful candidate will have the opportunity to work on some great projects, creating new ideas and practices alongside a small, dedicated development team which will help the way the business develops, tests and releases software for their customer base. The role would suit a strong, ex…",75000,75000,permanent,2025-04-05T13:31:06Z,https://www.adzuna.co.uk/jobs/details/5131041648?utm_medium=api&utm_source=e1ad5111,IT Jobs,developer
Business Development Manager - Data Centers,"Arrow Electronics, Inc.","Woodditton, Newmarket","Position: Business Development Manager - Data Centers Job Description: Arrow's Enterprise Computing Solutions (ECS) business is a global technology enablement company that brings innovative IT solutions to the market to solve complex business challenges. We deliver value-added distribution, business consulting, and channel enablement services to the world's leading technology manufacturers and their channel partners that serve commercial and government markets. Find more information about us on…",40167.48,40167.48,,2025-03-17T14:20:46Z,https://www.adzuna.co.uk/jobs/land/ad/5097454862?se=OJCYbTAe8BG_XLfW0bWCew&utm_medium=api&utm_source=e1ad5111&v=1779A4F4F8BEC567B5BD360AF2E1BBEEB41636AC,Sales Jobs,developer
Python Developer,hireful,"Leeds, West Yorkshire","Are you looking to take your Python coding & Agile software engineering skills to the next level, working on AI focussed software solutions ? Interested in joining an ambitious AI tech start-up (established) & learning from software industry veterans, who have over 20 years in the Software Engineering & Tech world? If you are up for a challenging, yet very rewarding role at a company that provides an exceptional level of flexibility around technology & working practices, then we would like to h…",50000,50000,permanent,2025-04-11T13:49:45Z,https://www.adzuna.co.uk/jobs/details/5140478563?utm_medium=api&utm_source=e1ad5111,IT Jobs,developer
