title,company,location,description,salary_min,salary_max,contract_type,created,redirect_url,category,specialty
Accounting Assistant,Finlink Ltd,"Cardiff County, Wales","Accounting Administrative AssistantCardiff Hybrid working Are you looking for a step into a financial services accounting environment with a supportive and collaborative team? This opportunity is perfect for someone with some administrative experience and a genuine interest in Financial Services. The Business The company are an FCA-regulated, growing IFA Network. They are a robust, institutionally backed, mission driven group, with a diverse, supportive, and highly experienced team at a top 100…",31388.67,31388.67,permanent,2025-03-26T20:03:46Z,https://www.adzuna.co.uk/jobs/details/5112699834?utm_medium=api&utm_source=e1ad5111,Accounting & Finance Jobs,accounting
Accounting Manager,Mintel,"London, UK","Company Overview: Mintel is a global leader in market intelligence, providing market research, analysis, and insights to help businesses make better decisions. Our clients rely on us to provide reliable and actionable data that drives their business strategy and growth. Job Overview: Reporting to the Financial Manager, you will play a key role in supporting the maintenance of accurate and timely financial records for Mintel's global operations. You will assist the finance team in various financ…",37022.44,37022.44,,2025-04-19T09:25:19Z,https://www.adzuna.co.uk/jobs/details/5152931807?utm_medium=api&utm_source=e1ad5111,Accounting & Finance Jobs,accounting
Manager Accounting,"Caterpillar, Inc.","Shrewsbury, Shropshire","Career Area: Finance Job Description: Your Work Shapes the World at Caterpillar Inc. When you join Caterpillar, you're joining a global team who cares not just about the work we do - but also about each other. We are the makers, problem solvers, and future world builders who are creating stronger, more sustainable communities. We don't just talk about progress and innovation here - we make it happen, with our customers, where we work and live. Together, we are building a better world, so we can…",47648.77,47648.77,,2025-03-26T19:01:00Z,https://www.adzuna.co.uk/jobs/details/5112527704?utm_medium=api&utm_source=e1ad5111,Accounting & Finance Jobs,accounting
Head of Accounting,Reed,"Egham, Surrey","Location: Surrey, Egham Job Type: Full-time We are seeking a seasoned Accountant and Manager to lead our accountancy function in Surrey, Egham. This role is ideal for someone who is technically proficient and has extensive experience in accountancy at a senior level, particularly within the UK practice environment. Day-to-day of the role: Oversee the day-to-day operations of the Surrey accounting function, ensuring high standards of financial and operational control. Lead and coordinate the del…",65000,85000,permanent,2025-04-11T22:41:32Z,https://www.adzuna.co.uk/jobs/details/5141364730?utm_medium=api&utm_source=e1ad5111,Accounting & Finance Jobs,accounting
Coord-Accounting,marriott,UK,"채용 번호 23192515 작업 카테고리 Finance & Accounting 위치 JW Marriott Mumbai Juhu, Juhu Tara Road, Mumbai, Maharashtra, India 지도에서 보기 스케줄 Full-Time 원격 위치입니까? N 근무지 변경? N 직책 유형 Non-Management 메리어트는 기회 균등 고용주입니다. 저희는 다양한 직원을 고용하고 포괄적인 문화를 유지하기 위해 노력하고 있습니다. 장애인 및 퇴역 군인과 같이 보호를 받는 상태 또는 해당 법률에 의해 보호를 받는 기타 상태로 인해 차별하지 않을 것을 약속합니다. ]]>",61287.59,61287.59,,2023-11-13T15:51:46Z,https://www.adzuna.co.uk/jobs/details/4429847454?utm_medium=api&utm_source=e1ad5111,Accounting & Finance Jobs,accounting
Clerk-Accounting,marriott,UK,"채용 번호 23196729 작업 카테고리 Finance & Accounting 위치 JW Marriott Mumbai Juhu, Juhu Tara Road, Mumbai, Maharashtra, India 지도에서 보기 스케줄 Full-Time 원격 위치입니까? N 근무지 변경? N 직책 유형 Non-Management 메리어트는 기회 균등 고용주입니다. 저희는 다양한 직원을 고용하고 포괄적인 문화를 유지하기 위해 노력하고 있습니다. 장애인 및 퇴역 군인과 같이 보호를 받는 상태 또는 해당 법률에 의해 보호를 받는 기타 상태로 인해 차별하지 않을 것을 약속합니다. ]]>",61287.59,61287.59,,2023-11-13T15:51:21Z,https://www.adzuna.co.uk/jobs/details/4429844894?utm_medium=api&utm_source=e1ad5111,Accounting & Finance Jobs,accounting
Accounting Specialist,honeywell,UK,"Responsibilities q Manage Operations, businesses, Banks, Cash Services & Stakeholders within Honeywell. q Manage Operations for banking activities & ensure timely delivery with quality. q Manage bank processes e.g. Cash pooling, ctry specific banking requirements, Cash funding, DD etc q Ensure foreign transactions, translations and hedges are properly recorded. q Ensure queries / transactions are resolved timely and GL is not aged q Ensure banking recons are delivered on-time & with quality wit…",37427.21,37427.21,,2023-11-13T15:51:21Z,https://www.adzuna.co.uk/jobs/details/4429844900?utm_medium=api&utm_source=e1ad5111,Accounting & Finance Jobs,accounting
Accounting Technician,HireIQ,"Belfast, Northern Ireland","Job Title: Accounts Technician If you have sales ledger experience but are lacking in the other areas please feel free to apply as training will be provided Overview: We are seeking an experienced Accounts Technician to support the financial operations of the organisation. Reporting to the Financial Controller, you will be responsible for managing the sales ledger, assisting with management accounts, and using Sage 50 to ensure accurate financial reporting. Strong proficiency in Microsoft Excel…",35000,35000,,2025-03-26T05:52:28Z,https://www.adzuna.co.uk/jobs/land/ad/5111821645?se=DDauPDEe8BG-i3PTGXcHCQ&utm_medium=api&utm_source=e1ad5111&v=53FAF2911045B92E585E3D55AB07C17C69CBA6C8,Accounting & Finance Jobs,accounting
Accounting Technician,Triumph Recruitment Consultants,"H M Naval Base, Portsmouth","What's involved with this role: Temporary Accounting Technician Ref number: Portsmouth 5266399 Please do not apply for this role unless your CV meets the following general requirements, listed below: You must be UK based and have the right to work in the UK. Your commute to the place of work must be less than 1 hour. This is a temporary role. Please do not apply if you are seeking a permanent position. Skills & Experience: Be a qualified Accounting Technician or CCAB equivalent. Knowledge of Lo…",38022,38022,contract,2025-04-18T03:11:10Z,https://www.adzuna.co.uk/jobs/details/5150898642?utm_medium=api&utm_source=e1ad5111,Accounting & Finance Jobs,accounting
Coord-Accounting,marriott,UK,"职位编号 23192515 工作类别 Finance & Accounting 地点 JW Marriott Mumbai Juhu, Juhu Tara Road, Mumbai, Maharashtra, India 在地图中查看 编制 Full-Time 远程申请? N 重新安置？ N 职位类型 Non-Management 万豪国际给予所有应聘者公平机会。我们始终坚持打造多元化的员工团队，秉承包容、以人为本的文化。我们绝不歧视任何受保护人群，例如残疾和退伍军人，或适用法律规定的任何其他群体。 ]]>",61287.59,61287.59,,2023-11-13T15:51:21Z,https://www.adzuna.co.uk/jobs/details/4429844806?utm_medium=api&utm_source=e1ad5111,Accounting & Finance Jobs,accounting
Accounting Manager,Hays Specialist Recruitment Limited,"Wolverhampton, West Midlands","Your new company Hays are delighted to be exclusively working with a large housing association to recruit an Accounting Manager. They are looking for professionals who can identify and lead process or system improvement, alongside having experience of managing or supporting a team of up to 10 individuals. You will be working in a shared service environment and be comfortabledriving adoption in areas across the organisation. Your new role - Managing a team of 10 - Driving change and adoption - B…",40000,45000,permanent,2025-04-09T16:33:30Z,https://www.adzuna.co.uk/jobs/details/5137236233?utm_medium=api&utm_source=e1ad5111,Social work Jobs,accounting
Accounting Senior,Armstrong Watson,"Dumfries, Dumfries & Galloway","About Us Armstrong Watson are a trusted and leading independent Accountancy and Business Advisory firm based in the North of England and Scotland. Our services and advice are all centred around our Quest to support our clients to achieve prosperity, a secure future and peace of mind, which cannot be achieved without the expertise of our dedicated and valued colleagues. With approximately 700 colleagues situated across 19 offices, our people and our culture are at the heart of what we do. We rec…",38096.78,38096.78,,2025-04-03T08:25:30Z,https://www.adzuna.co.uk/jobs/details/5126016323?utm_medium=api&utm_source=e1ad5111,Accounting & Finance Jobs,accounting
Accounting manager,Michael Page,"Goole, East Riding Of Yorkshire","Based in Goole, managing a portfolio of clients and working closely with team members to manage the department generally. The work primarily involves the delivery of a wide range of timely, high quality accounts and tax compliance assignments for clients (including a significant number within the farming industry). The role also requires supervision and mentoring of trainees. Client Details A fantastic opportunity for a qualified chartered/certified accountant or someone qualified by experience…",50000,51000,,2025-04-08T21:51:40Z,https://www.adzuna.co.uk/jobs/details/5135971320?utm_medium=api&utm_source=e1ad5111,Accounting & Finance Jobs,accounting
Accounting manager,Michael Page Finance,UK,"Based in Goole, managing a portfolio of clients and working closely with team members to manage the department generally. The work primarily involves the delivery of a wide range of timely, high quality accounts and tax compliance assignments for clients (including a significant number within the farming industry). The role also requires supervision and mentoring of trainees. Client Details A fantastic opportunity for a qualified chartered/certified accountant or someone qualified by experience…",50000,51000,permanent,2025-04-09T00:34:47Z,https://www.adzuna.co.uk/jobs/details/5136217715?utm_medium=api&utm_source=e1ad5111,Accounting & Finance Jobs,accounting
Clerk-Accounting,marriott,UK,"ジョブ番号 23196729 求人カテゴリ Finance & Accounting 場所 JW Marriott Mumbai Juhu, Juhu Tara Road, Mumbai, Maharashtra, India 地図で表示 スケジュール Full-Time 遠隔地ですか? N 配置転換ですか? N 職位の種類 Non-Management マリオット・インターナショナルでは雇用機会均等の実現に向けて、多種多様な人材の雇用、従業員を第一に考え受け入れる企業文化の維持に取り組んでいます。当社は、身体障害者や退役軍人など、保護された根拠に基づく差別、あるいは準拠法の適用を受けるあらゆる根拠に基づく差別の撤廃に取り組んでいます。 ]]>",61287.59,61287.59,,2023-11-13T15:51:21Z,https://www.adzuna.co.uk/jobs/details/4429844899?utm_medium=api&utm_source=e1ad5111,Accounting & Finance Jobs,accounting
Lecturer (Accounting),BPP Holdings,"Manchester, Greater Manchester","Job Introduction Here at BPP we pride ourselves on providing the best possible client and learner experience, with our School of Business designing and delivering best-in-class programmes. We are looking for an engaging and passionate accountant who is looking to take a step into a teaching role and help support the delivery and development of Accounting programmes across the School. What if you read the description and don't meet every single requirement? We encourage you to apply anyway - we …",51140.39,51140.39,,2025-04-20T08:46:51Z,https://www.adzuna.co.uk/jobs/details/5154264507?utm_medium=api&utm_source=e1ad5111,Teaching Jobs,accounting
Accounting Manager,Armstrong Watson,"Penrith, Cumbria","About Us Armstrong Watson are a trusted and leading independent Accountancy and Business Advisory firm based in the North of England and Scotland. Our services and advice are all centred around our Quest to support our clients to achieve prosperity, a secure future and peace of mind, which cannot be achieved without the expertise of our dedicated and valued colleagues. With approximately 700 colleagues situated across 19 offices, our people and our culture are at the heart of what we do. We rec…",40031.79,40031.79,,2025-04-04T16:52:01Z,https://www.adzuna.co.uk/jobs/details/5129423795?utm_medium=api&utm_source=e1ad5111,Accounting & Finance Jobs,accounting
Accounting Assistant,Wincanton,"Stoke-On-Trent, Staffordshire","About the Role: We have an exciting opportunity to recruit an Accounting Assistant at our site in Trentham on a permanent basis. This position will report into the Site Accountant and is a brilliant opportunity for someone to become part of the finance team Shift pattern: Monday to Friday, 08:00 - 16:00 or 09:00 - 17:00 How will you contribute? In this role, you will be responsible for producing and developing operational reports for the Customer as well as producing site statistics, ratios and…",27059.29,27059.29,permanent,2025-03-31T08:19:30Z,https://www.adzuna.co.uk/jobs/details/5119695552?utm_medium=api&utm_source=e1ad5111,Accounting & Finance Jobs,accounting
Accounting Technician,North Yorkshire Council,"Harrogate, North Yorkshire","An exciting opportunity has arisen for a suitably qualified individual to join our team. The Role As a key enabling service, finance supports financial management across the whole council, as well as external clients and our council owned companies. As a recently restructured team supporting the Council to maintain a strong grip on its finances, we are currently: continuing to support services following reorganisation of 8 council budgets into a single cohesive budget for NYC; helping managers …",30000,39999,,2025-04-14T17:53:49Z,https://www.adzuna.co.uk/jobs/details/5144344701?utm_medium=api&utm_source=e1ad5111,Accounting & Finance Jobs,accounting
Accounting Technician,North Yorkshire Council,"Selby, North Yorkshire","An exciting opportunity has arisen for a suitably qualified individual to join our team. The Role As a key enabling service, finance supports financial management across the whole council, as well as external clients and our council owned companies. As a recently restructured team supporting the Council to maintain a strong grip on its finances, we are currently: continuing to support services following reorganisation of 8 council budgets into a single cohesive budget for NYC; helping managers …",30000,39999,,2025-04-14T17:53:49Z,https://www.adzuna.co.uk/jobs/details/5144344725?utm_medium=api&utm_source=e1ad5111,Accounting & Finance Jobs,accounting
Accounting Technician,North Yorkshire Council,"Northallerton, North Yorkshire","An exciting opportunity has arisen for a suitably qualified individual to join our team. The Role As a key enabling service, finance supports financial management across the whole council, as well as external clients and our council owned companies. As a recently restructured team supporting the Council to maintain a strong grip on its finances, we are currently: continuing to support services following reorganisation of 8 council budgets into a single cohesive budget for NYC; helping managers …",30000,39999,,2025-04-14T17:53:48Z,https://www.adzuna.co.uk/jobs/details/5144344625?utm_medium=api&utm_source=e1ad5111,Accounting & Finance Jobs,accounting
Accounting Technician,North Yorkshire Council,"Scarborough, North Yorkshire","An exciting opportunity has arisen for a suitably qualified individual to join our team. The Role As a key enabling service, finance supports financial management across the whole council, as well as external clients and our council owned companies. As a recently restructured team supporting the Council to maintain a strong grip on its finances, we are currently: continuing to support services following reorganisation of 8 council budgets into a single cohesive budget for NYC; helping managers …",30000,39999,,2025-04-14T17:53:49Z,https://www.adzuna.co.uk/jobs/details/5144344680?utm_medium=api&utm_source=e1ad5111,Accounting & Finance Jobs,accounting
Accounting Assistant,Morson Talent,"South West London, London","Job Title: Accounts Assistant (Contract) Location: London, Canary Wharf Contract: 3 Months FTC Hourly Rate: £14 - £15 About the Role: We're seeking an experienced and highly organised Accounts Assistant to join a high-profile company on a 3-month contract, covering paternity leave. This role offers the opportunity to work across two prestigious London locations, supporting the financial team with key tasks including raising PO requests, liaising with suppliers, and maintaining accurate financia…",29120,31200,contract,2025-03-11T15:49:11Z,https://www.adzuna.co.uk/jobs/details/5087344493?utm_medium=api&utm_source=e1ad5111,Accounting & Finance Jobs,accounting
Accounting Assistant,Armstrong Watson,"Newcastle Upon Tyne, Tyne & Wear","About Us Armstrong Watson are a trusted and leading independent Accountancy and Business Advisory firm based in the North of England and Scotland. Our services and advice are all centred around our Quest to support our clients to achieve prosperity, a secure future and peace of mind, which cannot be achieved without the expertise of our dedicated and valued colleagues. With approximately 700 colleagues situated across 19 offices, our people and our culture are at the heart of what we do. We rec…",30849.35,30849.35,,2025-04-04T16:45:48Z,https://www.adzuna.co.uk/jobs/details/5129415183?utm_medium=api&utm_source=e1ad5111,Accounting & Finance Jobs,accounting
Accounting Manager,Armstrong Watson,"Cumbria, North West England","About Us Armstrong Watson are a trusted and leading independent Accountancy and Business Advisory firm based in the North of England and Scotland. Our services and advice are all centred around our Quest to support our clients to achieve prosperity, a secure future and peace of mind, which cannot be achieved without the expertise of our dedicated and valued colleagues. With approximately 700 colleagues situated across 19 offices, our people and our culture are at the heart of what we do. We rec…",43060.71,43060.71,,2025-04-04T16:45:57Z,https://www.adzuna.co.uk/jobs/details/5129415398?utm_medium=api&utm_source=e1ad5111,Accounting & Finance Jobs,accounting
Accounting Manager,Armstrong Watson,"Workington, Cumbria","About Us Armstrong Watson are a trusted and leading independent Accountancy and Business Advisory firm based in the North of England and Scotland. Our services and advice are all centred around our Quest to support our clients to achieve prosperity, a secure future and peace of mind, which cannot be achieved without the expertise of our dedicated and valued colleagues. With approximately 700 colleagues situated across 19 offices, our people and our culture are at the heart of what we do. We rec…",41783.5,41783.5,,2025-04-04T16:51:19Z,https://www.adzuna.co.uk/jobs/details/5129422906?utm_medium=api&utm_source=e1ad5111,Accounting & Finance Jobs,accounting
Accounting Senior,Armstrong Watson,"Newcastle Upon Tyne, Tyne & Wear","About Us Armstrong Watson are a trusted and leading independent Accountancy and Business Advisory firm based in the North of England and Scotland. Our services and advice are all centred around our Quest to support our clients to achieve prosperity, a secure future and peace of mind, which cannot be achieved without the expertise of our dedicated and valued colleagues. With approximately 700 colleagues situated across 19 offices, our people and our culture are at the heart of what we do. We rec…",37899.97,37899.97,,2025-04-05T16:38:32Z,https://www.adzuna.co.uk/jobs/details/5131141795?utm_medium=api&utm_source=e1ad5111,Accounting & Finance Jobs,accounting
Accounting Assistant,Armstrong Watson,"Hexham, Northumberland","About Us Armstrong Watson are a trusted and leading independent Accountancy and Business Advisory firm based in the North of England and Scotland. Our services and advice are all centred around our Quest to support our clients to achieve prosperity, a secure future and peace of mind, which cannot be achieved without the expertise of our dedicated and valued colleagues. With approximately 700 colleagues situated across 19 offices, our people and our culture are at the heart of what we do. We rec…",32813.7,32813.7,,2025-04-19T09:31:50Z,https://www.adzuna.co.uk/jobs/details/5152945143?utm_medium=api&utm_source=e1ad5111,Accounting & Finance Jobs,accounting
Accounting Senior,Armstrong Watson,"Workington, Cumbria","About Us Armstrong Watson are a trusted and leading independent Accountancy and Business Advisory firm based in the North of England and Scotland. Our services and advice are all centred around our Quest to support our clients to achieve prosperity, a secure future and peace of mind, which cannot be achieved without the expertise of our dedicated and valued colleagues. With approximately 700 colleagues situated across 19 offices, our people and our culture are at the heart of what we do. We rec…",38458.57,38458.57,,2025-04-19T09:18:39Z,https://www.adzuna.co.uk/jobs/details/5152925712?utm_medium=api&utm_source=e1ad5111,Accounting & Finance Jobs,accounting
Accounting Senior,Armstrong Watson,"Leeds, West Yorkshire","About Us Armstrong Watson are a trusted and leading independent Accountancy and Business Advisory firm based in the North of England and Scotland. Our services and advice are all centred around our Quest to support our clients to achieve prosperity, a secure future and peace of mind, which cannot be achieved without the expertise of our dedicated and valued colleagues. With approximately 700 colleagues situated across 19 offices, our people and our culture are at the heart of what we do. We rec…",37709.25,37709.25,,2025-04-04T16:40:42Z,https://www.adzuna.co.uk/jobs/details/5129412739?utm_medium=api&utm_source=e1ad5111,Accounting & Finance Jobs,accounting
Accounting Assistant,Armstrong Watson,"Cumbria, North West England","About Us Armstrong Watson are a trusted and leading independent Accountancy and Business Advisory firm based in the North of England and Scotland. Our services and advice are all centred around our Quest to support our clients to achieve prosperity, a secure future and peace of mind, which cannot be achieved without the expertise of our dedicated and valued colleagues. With approximately 700 colleagues situated across 19 offices, our people and our culture are at the heart of what we do. We rec…",34536.1,34536.1,,2025-04-04T16:45:34Z,https://www.adzuna.co.uk/jobs/details/5129415029?utm_medium=api&utm_source=e1ad5111,Accounting & Finance Jobs,accounting
Accounting Assistant,Armstrong Watson,"Whitehaven, Cumbria","About Us Armstrong Watson are a trusted and leading independent Accountancy and Business Advisory firm based in the North of England and Scotland. Our services and advice are all centred around our Quest to support our clients to achieve prosperity, a secure future and peace of mind, which cannot be achieved without the expertise of our dedicated and valued colleagues. With approximately 700 colleagues situated across 19 offices, our people and our culture are at the heart of what we do. We rec…",33647.23,33647.23,,2025-04-04T16:51:10Z,https://www.adzuna.co.uk/jobs/details/5129422702?utm_medium=api&utm_source=e1ad5111,Accounting & Finance Jobs,accounting
