title,company,location,description,salary_min,salary_max,contract_type,created,redirect_url,category,specialty
Finance Assistant,HAYS,"Newark, Nottinghamshire","Finance Assistant, Newark Your new company Hays Accountancy & Finance are working with a fast-growing company in Newark to recruit a Finance Assistant to join the established team. Your new role Reporting to the Head of Finance, you will be responsible for invoice processing and scheduling, ensuring customer records are updated, reconciliations, credit control, supporting with month-end routines and holiday/sickness cover for other members of the team. What you'll need to succeed You will have …",26424.25,26424.25,,2025-02-28T17:35:42Z,https://www.adzuna.co.uk/jobs/land/ad/5067223180?se=nmKsYTEe8BG-i3PTGXcHCQ&utm_medium=api&utm_source=e1ad5111&v=1D044819696D7B760A8729740E501041A1C30997,Accounting & Finance Jobs,banking
Finance Administrator,HAYS,"London, UK","Finance Administrator (Microsoft Dynamics) - £30,000 - £35,000 - Hybrid working Your new company This is a company that specialises in converting waste products into renewables and new life products. The company is growing constantly and has a vision to be a leading player within the renewables sector. Operating currently in the UK, Europe & Asia, they are already established and are seeking to become a household name in the industry. The company is looking for a Finance Administrator to come o…",30000,35000,,2025-04-11T16:41:57Z,https://www.adzuna.co.uk/jobs/land/ad/5140567906?se=nmKsYTEe8BG-i3PTGXcHCQ&utm_medium=api&utm_source=e1ad5111&v=2C2B2062339D730FE0FEA707BABEF5395F981262,Accounting & Finance Jobs,banking
Finance Assistant,HAYS,"Edinburgh, Scotland","Finance Assistant (Temporary) Your new company Hays are proud to be working closely with an established and reputable private sector organisation who require an experienced Finance Assistant to join their team on an ongoing temporary basis. Your new role Some of the main responsibilities include: - Accounts Payable and Receivable - Bank Reconciliations - Assisting with Month End What you'll need to succeed In order to be successful in this role, you must be confident with the above job responsi…",28000,28000,contract,2025-04-11T16:41:57Z,https://www.adzuna.co.uk/jobs/land/ad/5140567941?se=nmKsYTEe8BG-i3PTGXcHCQ&utm_medium=api&utm_source=e1ad5111&v=5B8CFB5CA07D5CD1467D2762B41DCB018C0DD533,Accounting & Finance Jobs,banking
Finance Assistant,HAYS,"Birmingham, West Midlands","Permanent Finance Assistant, Birmingham City Centre Your new company A well-known Public-Sector organisation based in Birmingham City Centre. Your new role This is a permanent position to join the Finance team, reporting directly to the Accounts Payable Manager. The role is hybrid (2 days a week in the office) and is in a very accessible location. What you'll need to succeed Previous experience in a finance setting Highly experienced in MS Excel Experience in Purchase Ledger Team-Player What yo…",25000,26000,permanent,2025-04-11T16:41:59Z,https://www.adzuna.co.uk/jobs/land/ad/5140568216?se=nmKsYTEe8BG-i3PTGXcHCQ&utm_medium=api&utm_source=e1ad5111&v=106896F7F472BFFF2BFCAE74E877069127BDCDE1,Accounting & Finance Jobs,banking
Finance Assistant,HAYS,"Nottingham, Nottinghamshire","Full-time Temporary - Permanent Finance Assistant / Accounts Assistant Job Types: Full-time, Temporary to Permanent (for the right candidate) Pay: Up to £28,000 (hourly equivalent) Additional Pay: Bonus scheme An industry-leading and expanding company based in Nottingham are seeking a dedicated individual to join their finance team. What You Will Love About This Business: Competitive Salary: Up to £28,000, dependent on experience Study Support: AAT/ACCA study support available Bonus Scheme: Gen…",26855.22,26855.22,contract,2025-04-11T16:41:58Z,https://www.adzuna.co.uk/jobs/land/ad/5140567985?se=nmKsYTEe8BG-i3PTGXcHCQ&utm_medium=api&utm_source=e1ad5111&v=D487CCDE6E81F2161648A8FB24C7110E118D1632,Accounting & Finance Jobs,banking
Finance Administrator,HAYS,"Preston, Lancashire","Finance Administrator | Preston | £27,000 - £30,000 | Permanent | Full-time Your new company Become part of a vibrant and innovative team at a leading energy company that values creativity and excellence. Our client is a major player in the energy sector, known for its commitment to sustainability and innovation. They are dedicated to delivering exceptional services and fostering a supportive atmosphere where you can flourish and reach your full potential. Your new role As a Finance Administrat…",27000,30000,permanent,2025-04-11T16:41:59Z,https://www.adzuna.co.uk/jobs/land/ad/5140568203?se=nmKsYTEe8BG-i3PTGXcHCQ&utm_medium=api&utm_source=e1ad5111&v=8D7D7353CAE433695676ED799D5573BEFF806636,Accounting & Finance Jobs,banking
Finance Assistant,HAYS,"London, UK","Retail Bank in the heart of London - Looking for a Finance assistant to join their team temporarily Your new company You will be working in a dynamic team of 4 assisting with the day-to-day accounts and ad hoc administration duties. Your new role You will be working as a finance assistant, assisting with day-to-day accounting, including the duties below. General day to day bookkeeping Managing the accounts email inbox Processing and raising purchasing invoices Responsibility for the payment run…",31200,31200,,2025-02-28T17:35:42Z,https://www.adzuna.co.uk/jobs/land/ad/5067223192?se=nmKsYTEe8BG-i3PTGXcHCQ&utm_medium=api&utm_source=e1ad5111&v=8C55633144068A6758D3F770D7732E8ECACB07C1,Accounting & Finance Jobs,banking
Finance Assistant,HAYS,"Belfast, Northern Ireland","Finance assistant, purchase ledger, sales ledger, accounts payable, accounts assistant, Billing Position Overview: As a Billing & Receivables Assistant, you will play a pivotal role in maintaining the smooth functioning of the financial operations. You will primarily be responsible for issuing invoices, processing credits and new applications for our customers and suppliers. Over time, you will take on additional responsibilities, allowing you to expand your skill set and progress within the co…",0,27000,,2025-04-11T16:41:58Z,https://www.adzuna.co.uk/jobs/land/ad/5140568006?se=nmKsYTEe8BG-i3PTGXcHCQ&utm_medium=api&utm_source=e1ad5111&v=AA040F8BCB975E6E4705828F7940DC622B86872B,Accounting & Finance Jobs,banking
Finance Assistant,HAYS,"County Down, Northern Ireland","Finance Assistant, Co. Down, Perm, Industry Your new company My clients are a local supplier of specialist goods with a national client base and can offer the successful applicant excellent career development opportunities. They are seeking to appoint a Finance Assistant due to ongoing company success and growth. Your new role The ideal candidate will support daily accounting operations, including processing invoices, maintaining financial records, reconciling accounts, and assisting with month…",0,30000,permanent,2025-04-11T16:41:58Z,https://www.adzuna.co.uk/jobs/land/ad/5140568004?se=nmKsYTEe8BG-i3PTGXcHCQ&utm_medium=api&utm_source=e1ad5111&v=B82D29CB063650444BC121B3048F2F3814494AE3,Accounting & Finance Jobs,banking
Finance Assistant,HAYS,"London, UK","A hotel in the heart of London is looking for a temporary finance assistant to join their team. Your new company You will be working for a prestigious hotel in London as a Finance Assistant/Income Auditor on a 4-month placement. Your new role In this role within our London-based hotel group, your responsibilities will include: Comparing daily revenue with the Point of Sales (POS) system, creating and sharing daily reports with relevant parties Recording daily Paypoint Payments on the Property M…",31200,37440,,2025-04-11T16:41:59Z,https://www.adzuna.co.uk/jobs/land/ad/5140568220?se=nmKsYTEe8BG-i3PTGXcHCQ&utm_medium=api&utm_source=e1ad5111&v=40C81CF65014D58150F1DB2E125E8E21321B961F,Accounting & Finance Jobs,banking
Finance Assistant,HAYS,"Bath, Bath & N E Somerset","Finance Assistant job in Bath, ASAP start Your new company A well known Bath based employer is looking to appoint a Finance Assistant, initially for a period of 4 months. What you'll need to succeed The successful candidate will have proven experience working across both Accounts Payable and Accounts Receivable. You will be detailed-focussed, happy to work on your own initiative and work with other teams to investigate differences between PO's and PI's and make necessary corrections. What you'l…",29999.3,29999.3,,2025-03-09T00:59:01Z,https://www.adzuna.co.uk/jobs/land/ad/5083405273?se=nmKsYTEe8BG-i3PTGXcHCQ&utm_medium=api&utm_source=e1ad5111&v=D8B05B493E8F30DFF6741A8A6B4B96E89688FC31,Accounting & Finance Jobs,banking
Finance Assistant,HAYS,"Warwick, Warwickshire","Finance Assistant, Full time, Hybrid, up to £30k Your new company This company are a national property company that are expanding their finance team to keep up with the heightened workload, they are brining in 3-4 new members to look after this new expansion. Your new role The role will be looking after the large reconciliations of monies coming in each day as well as monthly reconciliations, deposit repayment, email inbox queries and some credit control. What you'll need to succeed You will ne…",26000,30000,,2025-03-09T00:59:05Z,https://www.adzuna.co.uk/jobs/land/ad/5083405281?se=nmKsYTEe8BG-i3PTGXcHCQ&utm_medium=api&utm_source=e1ad5111&v=ECDCE1C54B6D099DE870E5CFFF58A07303FFAAAA,Accounting & Finance Jobs,banking
Finance Assistant,HAYS,"Staines, Surrey","Great temporary opportunity for a Finance Assistant to join a global business in Staines. Your new company A market-leading organisation with a recognisable brand that operates across the globe. Due to additional workload, they are looking for some temporary support within their accounts team for the next 3 months. Your new role You will have a varied role that will include a number of key responsibilities across accounts payable and accounts receivable. You will manage the purchase order proce…",29120,33280,contract,2025-04-11T16:41:57Z,https://www.adzuna.co.uk/jobs/land/ad/5140567970?se=nmKsYTEe8BG-i3PTGXcHCQ&utm_medium=api&utm_source=e1ad5111&v=00FA02B7AC3FF1A3191C365FFB42D01CCDAEFEC2,Accounting & Finance Jobs,banking
Finance Assistant,HAYS,"Chesterfield, Derbyshire","Finance Assistant - Chesterfield - Manufacturing - Accounts - Full-time - AAT - SAP - Excel - Purchase Ledger Your new company You will be working for a business in the manufacturing sector based in Chesterfield, reporting to the finance manager. You will be dealing with the day to day running of the purchase ledger accounts throughout the business. Please note this role is fully office based. Your new role • Match supplier invoices with purchase orders and investigate discrepancies • Jointly m…",14,14,contract,2025-04-11T16:41:57Z,https://www.adzuna.co.uk/jobs/land/ad/5140567929?se=nmKsYTEe8BG-i3PTGXcHCQ&utm_medium=api&utm_source=e1ad5111&v=3325910511462E65FCE3E3C6FF9936591186B41C,Accounting & Finance Jobs,banking
Finance Assistant,HAYS,"Carlisle, Cumbria","Full or part-time hours available Your new company My client is a well-established company that specialises in delivering high-quality building and civil engineering services, with expertise in both residential and commercial projects. They offer a full range of services, from groundworks and drainage to large-scale construction and renovation projects. Your new role To log and proactively deal with supplier and invoice queries. Supplier Statement Reconciliations. To keep the planning and sub-c…",26000,26000,,2025-03-07T22:12:23Z,https://www.adzuna.co.uk/jobs/land/ad/5081794545?se=nmKsYTEe8BG-i3PTGXcHCQ&utm_medium=api&utm_source=e1ad5111&v=D0459789B7499F90C94660C5AB9915944E5E6EC7,Accounting & Finance Jobs,banking
Finance Assistant,Hays,"Hartlepool, County Durham",Temporary Finance Assistant - Hartlepool Based - Immediate Start - £14.00 - £14.25 premium rate per hour. Finance Assistant Temporary - Ongoing Hourly Rate: £14.00 - £14.25 premium rate per hour Based in Hartlepool Immediate Start Required A leading manufacturing company based in Hartlepool is looking for a temporary finance assistant to join a busy accounting team. You will be reporting to the Financial Controller and will be working with a friendly and welcoming team. Duties and Responsibilit…,24000,24000,,2025-03-14T10:37:07Z,https://www.adzuna.co.uk/jobs/land/ad/5093071432?se=nmKsYTEe8BG-i3PTGXcHCQ&utm_medium=api&utm_source=e1ad5111&v=8C8270BC53A811A5CACA8EF263C1A6C3E284B49E,Accounting & Finance Jobs,banking
Finance Administrator,Hays,"Stokesley, Middlesbrough","Finance Administrator job in Stokesley Your new company This very successful Wealth Management / Investment and Financial Services provider prides themselves on their loyal, ever-growing client base.Due to continued business growth, they now have an exciting opportunity for a Finance Graduate to join them, supporting the Director as an Associate with a clear, long-term career path provided. Your new role Full study support is provided as part of the role.Dealing with and responding to inbound q…",29338.4,29338.4,,2025-03-24T11:00:03Z,https://www.adzuna.co.uk/jobs/land/ad/5108658211?se=nmKsYTEe8BG-i3PTGXcHCQ&utm_medium=api&utm_source=e1ad5111&v=B915AAFDCE83A37599E50D5B65BFBB906373E3BF,Accounting & Finance Jobs,banking
Financial Crime Analyst,HAYS,"Liverpool, Merseyside","Permanent - Financial Crime Analyst - Liverpool City Centre - Hybrid - Immediate Start Your new company Are you ready to make an impact in an award-winning financial services company? With stunning contemporary offices in the heart of Liverpool, I am seeking a highly motivated Financial Crime Analyst to join a large supportive team.My client is a respected leader in the financial services sector, known for their commitment to innovation, excellence, and customer service. As part of their team, …",28000,28000,permanent,2025-04-11T16:41:48Z,https://www.adzuna.co.uk/jobs/land/ad/5140567398?se=kFV6YzEe8BGla2k9OSZXLA&utm_medium=api&utm_source=e1ad5111&v=7E068F203B6C88B5E56AE715CA8DEA643EFCE304,Accounting & Finance Jobs,banking
Administration & Finance Assistant,HAYS,"Wakefield, West Yorkshire",Admin & Finance Assistant I am recruiting for an Admin & Finance Assistant to join a school-based team in the Wakefield area. The role is Term Time Only plus 8 days and is offered on a temporary to permanent basis. The hours are 37 per week. Your new role : Proving administrative and financial support to staff and students Using school IT systems Organise school events What you'll need to succeed : Experience of working in an office environment - minimum of 3 years Experience of school systems …,21632,21632,contract,2025-04-11T16:41:48Z,https://www.adzuna.co.uk/jobs/land/ad/5140567363?se=kFV6YzEe8BGla2k9OSZXLA&utm_medium=api&utm_source=e1ad5111&v=24D94E9C3667485145B9E6A81C7D9403F2583E30,Teaching Jobs,banking
Head of Finance,Ramsay Health Care,"Nottingham, Nottinghamshire","Job Description Head of Finance Woodthorpe Hospital, Nottingham 37.5 hours per week The role Ramsay Health Care UK is part of a global hospital operating group that is the 4th largest provider of private healthcare in the world. In the UK, we’re growing rapidly, with 30 hospitals providing diagnostics and treatment for both private and NHS patients. Join us as the Head of Finance, and you’ll take responsibility for the entire finance function at Woodthorpe Hospital driving growth and innovation…",54850.2,54850.2,,2025-02-05T11:55:44Z,https://www.adzuna.co.uk/jobs/land/ad/5038446004?se=kFV6YzEe8BGla2k9OSZXLA&utm_medium=api&utm_source=e1ad5111&v=F866919535DBFEC760C4B1A772B140B539D663CE,Accounting & Finance Jobs,banking
"Customer Service Specialist, Lloyds Banking Group (Personal Banking) - GLASGOW",Teleperformance,"Braidwood, Carluke",CUSTOMER SERVICE SPECIALIST – OFFICE BASED IN GLASGOW Teleperformance is a fast-paced contact centre employer who works alongside a number of house-hold known clients to deliver world class customer service. We have a fantastic opportunity for inbound customer service specialist for our Personal Banking line of business Lloyds Banking Division campaign. Here is all you need to know… Start Date: June 2025 Salary: £12.21 per hour Job Type: Full Time – Permanent Working Hours: 40 hours per week (i…,25228.19,25228.19,permanent,2025-04-18T17:34:21Z,https://www.adzuna.co.uk/jobs/land/ad/5151825634?se=kFV6YzEe8BGla2k9OSZXLA&utm_medium=api&utm_source=e1ad5111&v=EE78B11414CA5279FB3B753F64DBE4431EFF8ECC,Customer Services Jobs,banking
"Customer Service Specialist, Lloyds Banking Group (Personal Banking) - GLASGOW",Teleperformance,"Kilbarchan, Johnstone",CUSTOMER SERVICE SPECIALIST – OFFICE BASED IN GLASGOW Teleperformance is a fast-paced contact centre employer who works alongside a number of house-hold known clients to deliver world class customer service. We have a fantastic opportunity for inbound customer service specialist for our Personal Banking line of business Lloyds Banking Division campaign. Here is all you need to know… Start Date: June 2025 Salary: £12.21 per hour Job Type: Full Time – Permanent Working Hours: 40 hours per week (i…,29357.12,29357.12,permanent,2025-04-18T17:34:21Z,https://www.adzuna.co.uk/jobs/land/ad/5151825635?se=kFV6YzEe8BGla2k9OSZXLA&utm_medium=api&utm_source=e1ad5111&v=81F6854FE7C796C8D165ED1105BCB1C238E49FC6,Customer Services Jobs,banking
"Customer Service Specialist, Lloyds Banking Group (Personal Banking) - GLASGOW",Teleperformance,"Glenboig, Coatbridge",CUSTOMER SERVICE SPECIALIST – OFFICE BASED IN GLASGOW Teleperformance is a fast-paced contact centre employer who works alongside a number of house-hold known clients to deliver world class customer service. We have a fantastic opportunity for inbound customer service specialist for our Personal Banking line of business Lloyds Banking Division campaign. Here is all you need to know… Start Date: June 2025 Salary: £12.21 per hour Job Type: Full Time – Permanent Working Hours: 40 hours per week (i…,28394.59,28394.59,permanent,2025-04-18T17:34:22Z,https://www.adzuna.co.uk/jobs/land/ad/5151825645?se=kFV6YzEe8BGla2k9OSZXLA&utm_medium=api&utm_source=e1ad5111&v=05145ACB210C96517CA1A633C0BAD391CC84EBBD,Customer Services Jobs,banking
"Customer Service Specialist, Lloyds Banking Group (Personal Banking) - GLASGOW",Teleperformance,"Springside, Irvine",CUSTOMER SERVICE SPECIALIST – OFFICE BASED IN GLASGOW Teleperformance is a fast-paced contact centre employer who works alongside a number of house-hold known clients to deliver world class customer service. We have a fantastic opportunity for inbound customer service specialist for our Personal Banking line of business Lloyds Banking Division campaign. Here is all you need to know… Start Date: June 2025 Salary: £12.21 per hour Job Type: Full Time – Permanent Working Hours: 40 hours per week (i…,23117.82,23117.82,permanent,2025-04-18T17:34:21Z,https://www.adzuna.co.uk/jobs/land/ad/5151825626?se=kFV6YzEe8BGla2k9OSZXLA&utm_medium=api&utm_source=e1ad5111&v=F162CBFDC44CD00D7F379CDB04C0327E49E900CB,Customer Services Jobs,banking
"Customer Service Specialist, Lloyds Banking Group (Personal Banking) - GLASGOW",Teleperformance,"Duntocher, Clydebank",CUSTOMER SERVICE SPECIALIST – OFFICE BASED IN GLASGOW Teleperformance is a fast-paced contact centre employer who works alongside a number of house-hold known clients to deliver world class customer service. We have a fantastic opportunity for inbound customer service specialist for our Personal Banking line of business Lloyds Banking Division campaign. Here is all you need to know… Start Date: June 2025 Salary: £12.21 per hour Job Type: Full Time – Permanent Working Hours: 40 hours per week (i…,23870.29,23870.29,permanent,2025-04-18T17:34:22Z,https://www.adzuna.co.uk/jobs/land/ad/5151825647?se=kFV6YzEe8BGla2k9OSZXLA&utm_medium=api&utm_source=e1ad5111&v=1D814CB8676802D0833BB87D9409730C59C842C3,Customer Services Jobs,banking
"Customer Service Specialist, Lloyds Banking Group (Personal Banking) - GLASGOW",Teleperformance,"Ferniegair, Hamilton",CUSTOMER SERVICE SPECIALIST – OFFICE BASED IN GLASGOW Teleperformance is a fast-paced contact centre employer who works alongside a number of house-hold known clients to deliver world class customer service. We have a fantastic opportunity for inbound customer service specialist for our Personal Banking line of business Lloyds Banking Division campaign. Here is all you need to know… Start Date: June 2025 Salary: £12.21 per hour Job Type: Full Time – Permanent Working Hours: 40 hours per week (i…,27795.67,27795.67,permanent,2025-04-18T17:34:22Z,https://www.adzuna.co.uk/jobs/land/ad/5151825643?se=kFV6YzEe8BGla2k9OSZXLA&utm_medium=api&utm_source=e1ad5111&v=51C9BF338D62CCB6B00A05CB64B711745C9D6D63,Customer Services Jobs,banking
"Customer Service Specialist, Lloyds Banking Group (Personal Banking) - GLASGOW",Teleperformance,"Meigle, Skelmorlie",CUSTOMER SERVICE SPECIALIST – OFFICE BASED IN GLASGOW Teleperformance is a fast-paced contact centre employer who works alongside a number of house-hold known clients to deliver world class customer service. We have a fantastic opportunity for inbound customer service specialist for our Personal Banking line of business Lloyds Banking Division campaign. Here is all you need to know… Start Date: June 2025 Salary: £12.21 per hour Job Type: Full Time – Permanent Working Hours: 40 hours per week (i…,25142.21,25142.21,permanent,2025-04-18T17:34:21Z,https://www.adzuna.co.uk/jobs/land/ad/5151825630?se=kFV6YzEe8BGla2k9OSZXLA&utm_medium=api&utm_source=e1ad5111&v=3F0AAFDD5576D43F87723B30A56F463CDDCC418C,Customer Services Jobs,banking
"Customer Service Specialist, Lloyds Banking Group (Personal Banking) - GLASGOW",Teleperformance,"Bogend, Symington",CUSTOMER SERVICE SPECIALIST – OFFICE BASED IN GLASGOW Teleperformance is a fast-paced contact centre employer who works alongside a number of house-hold known clients to deliver world class customer service. We have a fantastic opportunity for inbound customer service specialist for our Personal Banking line of business Lloyds Banking Division campaign. Here is all you need to know… Start Date: June 2025 Salary: £12.21 per hour Job Type: Full Time – Permanent Working Hours: 40 hours per week (i…,23324.3,23324.3,permanent,2025-04-18T17:34:21Z,https://www.adzuna.co.uk/jobs/land/ad/5151825619?se=kFV6YzEe8BGla2k9OSZXLA&utm_medium=api&utm_source=e1ad5111&v=9D88FD5C36143F2B25E4AAD3619FA197764B5EDE,Customer Services Jobs,banking
"Customer Service Specialist, Lloyds Banking Group (Personal Banking) - GLASGOW",Teleperformance,"Rosebank, Carluke",CUSTOMER SERVICE SPECIALIST – OFFICE BASED IN GLASGOW Teleperformance is a fast-paced contact centre employer who works alongside a number of house-hold known clients to deliver world class customer service. We have a fantastic opportunity for inbound customer service specialist for our Personal Banking line of business Lloyds Banking Division campaign. Here is all you need to know… Start Date: June 2025 Salary: £12.21 per hour Job Type: Full Time – Permanent Working Hours: 40 hours per week (i…,27431,27431,permanent,2025-04-18T17:34:22Z,https://www.adzuna.co.uk/jobs/land/ad/5151825644?se=kFV6YzEe8BGla2k9OSZXLA&utm_medium=api&utm_source=e1ad5111&v=6A08ADA7CFA3B98935424A8A960751178AEF43AC,Customer Services Jobs,banking
"Customer Service Specialist, Lloyds Banking Group (Personal Banking) - GLASGOW",Teleperformance,"Throsk, Stirling",CUSTOMER SERVICE SPECIALIST – OFFICE BASED IN GLASGOW Teleperformance is a fast-paced contact centre employer who works alongside a number of house-hold known clients to deliver world class customer service. We have a fantastic opportunity for inbound customer service specialist for our Personal Banking line of business Lloyds Banking Division campaign. Here is all you need to know… Start Date: June 2025 Salary: £12.21 per hour Job Type: Full Time – Permanent Working Hours: 40 hours per week (i…,31028.57,31028.57,permanent,2025-04-18T17:34:21Z,https://www.adzuna.co.uk/jobs/land/ad/5151825628?se=kFV6YzEe8BGla2k9OSZXLA&utm_medium=api&utm_source=e1ad5111&v=19D22E943B15A49F37D2B0FF392B34B1A0EDDF6B,Customer Services Jobs,banking
"Customer Service Specialist, Lloyds Banking Group (Personal Banking) - GLASGOW",Teleperformance,"Hillhead, Glasgow City Centre",CUSTOMER SERVICE SPECIALIST – OFFICE BASED IN GLASGOW Teleperformance is a fast-paced contact centre employer who works alongside a number of house-hold known clients to deliver world class customer service. We have a fantastic opportunity for inbound customer service specialist for our Personal Banking line of business Lloyds Banking Division campaign. Here is all you need to know… Start Date: June 2025 Salary: £12.21 per hour Job Type: Full Time – Permanent Working Hours: 40 hours per week (i…,25891.57,25891.57,permanent,2025-04-18T17:34:21Z,https://www.adzuna.co.uk/jobs/land/ad/5151825633?se=kFV6YzEe8BGla2k9OSZXLA&utm_medium=api&utm_source=e1ad5111&v=902CAA0DE3C1DEBF5BDF68BE53AFB9C0A06FB315,Customer Services Jobs,banking
