title,company,location,description,salary_min,salary_max,contract_type,created,redirect_url,category,specialty
Atlas Developer,Barclays Bank PLC,"Fenchurch St, Central London","Join us as an Atlas Developer at Barclays, where you`ll be a member of the global team responsible for building and enhancing the next generation of Barclays’ Atlas Platform. You will be responsible for the development and timely delivery of new and/or existing software, working with project managers and software engineers, both internal and external to the Atlas Trade team. You'll also be responsible for interacting with the end users in London from time to time to understand issues/feedback a…",32584.19,32584.19,permanent,2025-04-14T23:28:07Z,https://www.adzuna.co.uk/jobs/land/ad/5144760370?se=JvTjazAe8BG-i3PTGXcHCQ&utm_medium=api&utm_source=e1ad5111&v=E6DCC2D4851FF9BD4F401DCA2AABEB2975AE6DE3,IT Jobs,developer
Oracle Technical Developer (Payroll),IBM - Avature,"Rownhams, Southampton","In this role, you’ll work in one of our IBM Consulting Client Innovation Centres (Delivery Centres), where we deliver deep technical and industry expertise to a wide range of public and private sector clients around the world. Our delivery centres offer our clients locally based skills and technical expertise to drive innovation and adoption of new technology. A career in IBM Consulting is rooted by long-term relationships and close collaboration with clients across the globe. You’ll work with …",53509.03,53509.03,contract,2025-04-15T07:12:21Z,https://www.adzuna.co.uk/jobs/land/ad/5145243273?se=JvTjazAe8BG-i3PTGXcHCQ&utm_medium=api&utm_source=e1ad5111&v=DC6FB80AF14F2DB3B13A88C472632CD30FB17DF7,IT Jobs,developer
UI Developer Lead,Barclays Bank PLC,"Toft, Knutsford","Join us as a UI Developer Lead at Barclays, where you'll take part in the evolution of our digital landscape, driving innovation and excellence. You'll harness cutting-edge technology to revolutionise our digital offerings, ensuring unparalleled customer experiences. To be successful in this role you should have: Strong experience in front-end development with React Typescript, React Native, Angular framework, Html5 , JavaScript and CSS with Responsive grid framework Experience in Java, JSP, St…",35766.67,35766.67,permanent,2025-04-17T23:56:06Z,https://www.adzuna.co.uk/jobs/land/ad/5150674276?se=JvTjazAe8BG-i3PTGXcHCQ&utm_medium=api&utm_source=e1ad5111&v=2ABF4389F22BC58F0985D508D9CDF6BB5BC1FA44,Accounting & Finance Jobs,developer
Development Surveyor,HAYS,"Manchester, Greater Manchester","Associate Development Surveyor opportunity, based out of Manchester, non-corporate office environment, hybrid. Job Title: Development Surveyor (Commercial Real Estate Consultancy)Location: Manchester (1 -2 days a week working from home). Salary: £65,000-£75,000 basic salary  excellent bonuses  additional benefits package We have an exciting new opportunity to join an existing team with ambitious growth plans in the North West as an Associate Development Surveyor in a multidisciplinary Mancheste…",0,75000,,2025-02-22T22:17:31Z,https://www.adzuna.co.uk/jobs/land/ad/5060859393?se=JvTjazAe8BG-i3PTGXcHCQ&utm_medium=api&utm_source=e1ad5111&v=930E11CDC9FC855072215AC128DAEB8C52BF8445,Trade & Construction Jobs,developer
Reference Data Java Developer,Barclays Bank PLC,"Fenchurch St, Central London","Join us as a Reference Data Java Developer at Barclays, where you would participate on the development of a new strategic Reference Data System on cloud-based infrastructure . You would be involved in all stages of software development, focusing on gathering business requirements, features implementation and data analysis. To be successful as a Reference Data Java Developer, you should have experience with Hands-on software development on Goldensource EDM platform Developing/implementing Instru…",34224.03,34224.03,permanent,2025-04-14T03:51:46Z,https://www.adzuna.co.uk/jobs/land/ad/5143763261?se=JvTjazAe8BG-i3PTGXcHCQ&utm_medium=api&utm_source=e1ad5111&v=1E03DDFE49C1417FEE28CB4DEF0811DF08763548,Accounting & Finance Jobs,developer
UI Developer - Trading Platform,Barclays Bank PLC,"Fenchurch St, Central London","Join us as a Core UI Platform Developer at Barclays, where you will be performing activities related to the design, development, unit testing, deployment, support, and maintenance of an exciting transformational enterprise project with high visibility. This ambitious initiative leverages a modern tech stack, offering a unique opportunity to make a significant impact on our MarketsOne trading platform. To be successful as a UI Developer within this team, you should have: Strong proficiency in Ja…",38403.3,38403.3,permanent,2025-04-14T03:51:46Z,https://www.adzuna.co.uk/jobs/land/ad/5143763269?se=JvTjazAe8BG-i3PTGXcHCQ&utm_medium=api&utm_source=e1ad5111&v=79406629AAF52C7A3B650343A2560A5DE249FF84,IT Jobs,developer
Channel Development Manager,"Arrow Electronics, Inc.",UK,"Position: Channel Development Manager Job Description: Arrow's Enterprise Computing Solutions (ECS) business is a global technology enablement company that brings innovative IT solutions to the market to solve complex business challenges. We deliver value-added distribution, business consulting, and channel enablement services to the world's leading technology manufacturers and their channel partners that serve commercial and government markets. Find more information about us on our page: arrow…",54463.12,54463.12,,2025-03-25T19:52:02Z,https://www.adzuna.co.uk/jobs/land/ad/5111220272?se=JvTjazAe8BG-i3PTGXcHCQ&utm_medium=api&utm_source=e1ad5111&v=3709A51B4E7DD19F467DE36C8F71989AAB034737,Sales Jobs,developer
Business Development Manager,"Arrow Electronics, Inc.",UK,"Position: Business Development Manager Job Description: Arrow's Enterprise Computing Solutions (ECS) business is a global technology enablement company that brings innovative IT solutions to the market to solve complex business challenges. We deliver value-added distribution, business consulting, and channel enablement services to the world's leading technology manufacturers and their channel partners that serve commercial and government markets. Find more information about us on our page: arro…",50979.46,50979.46,,2025-03-14T18:32:26Z,https://www.adzuna.co.uk/jobs/land/ad/5093847784?se=JvTjazAe8BG-i3PTGXcHCQ&utm_medium=api&utm_source=e1ad5111&v=1F87BFB5E8B893E85DEAA9FB49C016005DA1A69C,Sales Jobs,developer
Business Development Manager,"Arrow Electronics, Inc.","Woodditton, Newmarket","Position: Business Development Manager Job Description: Arrow's Enterprise Computing Solutions (ECS) business is a global technology enablement company that brings innovative IT solutions to the market to solve complex business challenges. We deliver value-added distribution, business consulting, and channel enablement services to the world's leading technology manufacturers and their channel partners that serve commercial and government markets. Find more information about us on our page: arro…",50306.26,50306.26,,2025-03-14T18:32:26Z,https://www.adzuna.co.uk/jobs/land/ad/5093847785?se=JvTjazAe8BG-i3PTGXcHCQ&utm_medium=api&utm_source=e1ad5111&v=6B846790FBB412F7072F7742EEBEBA26E4D9FD9E,Sales Jobs,developer
Business Development Manager,"Arrow Electronics, Inc.","Woodditton, Newmarket","Position: Business Development Manager Job Description: Arrow's Enterprise Computing Solutions (ECS) business is a global technology enablement company that brings innovative IT solutions to the market to solve complex business challenges. We deliver value-added distribution, business consulting, and channel enablement services to the world's leading technology manufacturers and their channel partners that serve commercial and government markets. Find more information about us on our page: arro…",51332.57,51332.57,,2025-03-11T19:48:47Z,https://www.adzuna.co.uk/jobs/land/ad/5087543618?se=JvTjazAe8BG-i3PTGXcHCQ&utm_medium=api&utm_source=e1ad5111&v=6F9D42900005D0575C5DED5511C43091A2BF2FCB,Sales Jobs,developer
Business Development Manager,"Arrow Electronics, Inc.","Woodditton, Newmarket","Position: Business Development Manager Job Description: Arrow's Enterprise Computing Solutions (ECS) business is a global technology enablement company that brings innovative IT solutions to the market to solve complex business challenges. We deliver value-added distribution, business consulting, and channel enablement services to the world's leading technology manufacturers and their channel partners that serve commercial and government markets. Find more information about us on our page: arro…",48995.71,48995.71,,2025-03-07T19:55:44Z,https://www.adzuna.co.uk/jobs/land/ad/5081546283?se=JvTjazAe8BG-i3PTGXcHCQ&utm_medium=api&utm_source=e1ad5111&v=ED444BEC0B56C789191BE1228C88220852DC761D,Sales Jobs,developer
Business Development Manager,"Arrow Electronics, Inc.",UK,"Position: Business Development Manager Job Description: Arrow's Enterprise Computing Solutions (ECS) business is a global technology enablement company that brings innovative IT solutions to the market to solve complex business challenges. We deliver value-added distribution, business consulting, and channel enablement services to the world's leading technology manufacturers and their channel partners that serve commercial and government markets. Find more information about us on our page: arro…",49651.42,49651.42,,2025-03-07T19:55:44Z,https://www.adzuna.co.uk/jobs/land/ad/5081546262?se=JvTjazAe8BG-i3PTGXcHCQ&utm_medium=api&utm_source=e1ad5111&v=5089F7D37B0A01991893D278018D552097BC84B1,Sales Jobs,developer
Business Development Manager,"Arrow Electronics, Inc.",UK,"Position: Business Development Manager Job Description: Arrow's Enterprise Computing Solutions (ECS) business is a global technology enablement company that brings innovative IT solutions to the market to solve complex business challenges. We deliver value-added distribution, business consulting, and channel enablement services to the world's leading technology manufacturers and their channel partners that serve commercial and government markets. Find more information about us on our page: arro…",52019.56,52019.56,,2025-03-11T19:48:46Z,https://www.adzuna.co.uk/jobs/land/ad/5087543617?se=JvTjazAe8BG-i3PTGXcHCQ&utm_medium=api&utm_source=e1ad5111&v=35255953BDBC73C3060111E6EE59A5238EF3FF74,Sales Jobs,developer
Business Development Manager,"Arrow Electronics, Inc.",UK,"Position: Business Development Manager Job Description: Arrow's Enterprise Computing Solutions (ECS) business is a global technology enablement company that brings innovative IT solutions to the market to solve complex business challenges. We deliver value-added distribution, business consulting, and channel enablement services to the world's leading technology manufacturers and their channel partners that serve commercial and government markets. Find more information about us on our page: arro…",44194.21,44194.21,,2025-01-08T20:27:38Z,https://www.adzuna.co.uk/jobs/land/ad/5002549451?se=JvTjazAe8BG-i3PTGXcHCQ&utm_medium=api&utm_source=e1ad5111&v=E9EC51A9F3D23ADDE12D9A4BFF059886BAF39908,Sales Jobs,developer
Business Development Representative,"Arrow Electronics, Inc.","Woodditton, Newmarket","Position: Business Development Representative Job Description: Arrow's Enterprise Computing Solutions (ECS) business is a global technology enablement company that brings innovative IT solutions to the market to solve complex business challenges. We deliver value-added distribution, business consulting, and channel enablement services to the world's leading technology manufacturers and their channel partners that serve commercial and government markets. Find more information about us on our pag…",37600.65,37600.65,,2025-02-24T16:18:59Z,https://www.adzuna.co.uk/jobs/land/ad/5062194321?se=JvTjazAe8BG-i3PTGXcHCQ&utm_medium=api&utm_source=e1ad5111&v=FE55064045D99F8B407137600F5943C2F1AA588D,Sales Jobs,developer
Market Development Engineer,"Arrow Electronics, Inc.",UK,"Position: Market Development Engineer Job Description: As Arrow Global Components (AGC) , a part of Arrow Electronics, we are a leader in distribution and value-added services related to electronic components. We resell, customize, and distribute electronic components to our clients all over the world. Our business is based on a trusted, long-lasting network of relationships with industry leaders, both on the supplier and customer side. Find more information about us on our page: www.arrow.com/…",49447.75,49447.75,,2025-02-13T16:08:18Z,https://www.adzuna.co.uk/jobs/land/ad/5048475073?se=JvTjazAe8BG-i3PTGXcHCQ&utm_medium=api&utm_source=e1ad5111&v=75D89C2BC7241C8E753BC9F920F9CDA0DB8DC3FF,Engineering Jobs,developer
Business Development Manager,"Arrow Electronics, Inc.",UK,"Position: Business Development Manager Job Description: Arrow Enterprise Computing Solutions (ECS), a part of Arrow Electronics, brings innovative IT solutions to market to solve complex business challenges. We deliver value-added distribution, business consulting and channel enablement services to leading technology manufacturers and their channel partners. We help businesses grow faster, operate efficiently and transform in a dynamic market. Are you a natural-born salesperson? We have the per…",40119.77,40119.77,,2025-04-01T02:39:49Z,https://www.adzuna.co.uk/jobs/land/ad/5120631501?se=JvTjazAe8BG-i3PTGXcHCQ&utm_medium=api&utm_source=e1ad5111&v=5B085FB3C5E903E6E4EF111041DD3F7FDF9B651A,Sales Jobs,developer
Java Developer,Develop,"Glasgow, Scotland","This is a brilliant opportunity for a Java Developer to join a market leading consultancy for an upcoming project with their financial services client based in Glasgow Your responsibility as a Developer will be hands on, building new features and driving the growth of the business, whilst creating robust, scalable, and efficient applications. The position will be hybrid, with a salary of up to £85k on offer. Required skills: Java Springboot Microservices Rest APIs Docker / Kubernetes AWS Kafka …",85000,85000,permanent,2025-04-16T21:59:16Z,https://www.adzuna.co.uk/jobs/details/5148291463?utm_medium=api&utm_source=e1ad5111,IT Jobs,developer
Software Developer,Develop,"Liverpool, Merseyside","Contract Ruby Developer - 12-Month Contract - £400-£600 per day (Inside IR35) ?? Location: Liverpool -Hybrid (Flexible) Rate: £400-£600 per day (Inside IR35) Duration: 12 Months We are hiring a Ruby Contractor to support our client with the decommissioning of their existing Ruby-based systems. This is an exciting opportunity to work on a critical project, contributing to the strategic transition from legacy systems to a modernised tech stack. Skills and Experience Strong experience in Ruby and …",104000,156000,permanent,2025-04-09T17:39:39Z,https://www.adzuna.co.uk/jobs/details/5137286580?utm_medium=api&utm_source=e1ad5111,IT Jobs,developer
Senior Java Developer,Develop,"South East London, London","This is a brilliant opportunity for a Senior Java Developer to join a market leading cloud communications company based in Sussex who are looking to add to their growing Engineering team This business provides real-time insights that enhance their client's profiles, in turn helping drive revenue growth. Your responsibility as a Senior will be hands on, building new features and driving the growth of the business, whilst also taking on code review and mentorship responsibilities. The position wi…",75000,75000,permanent,2025-04-17T14:03:17Z,https://www.adzuna.co.uk/jobs/details/5149656570?utm_medium=api&utm_source=e1ad5111,IT Jobs,developer
Software engineer,Develop,"Newcastle Upon Tyne, Tyne & Wear","Position: Graduate Software Engineer Location: Newcastle (Onsite) The Client: Rapidly expanding financial services company based in Newcastle, renowned for an innovative approach and commitment to excellence. As we continue to grow, we are seeking multiple Graduate Engineers to join our dynamic team. Role Overview: As a Graduate Engineer, you will have the opportunity to work alongside industry experts on 100% greenfield projects, developing new products from the ground up. We offer diverse car…",50000,50000,permanent,2025-03-10T18:31:14Z,https://www.adzuna.co.uk/jobs/details/5085516905?utm_medium=api&utm_source=e1ad5111,IT Jobs,developer
Full Stack Engineer - MERN,Develop,UK,"This is an exciting new opportunity with a cybersecurity business who are looking to hire multiple mid level MERN Full Stack Engineers in permanent positions. For this role you will be an SME in the MERN space, working on elevating the team and implementing new features across the business. Fully remote opportunity that can be based anywhere /- 4 hours UTC. Salaries vary depending on experience, between £50,000-£65,000. You will be a product-focused developer who is looking to take on a challen…",65000,65000,permanent,2025-04-17T14:03:17Z,https://www.adzuna.co.uk/jobs/details/5149656571?utm_medium=api&utm_source=e1ad5111,IT Jobs,developer
Software Engineer - ML Developer Tools,ARM,"Chesterton, Cambridge","Job Overview: Arm-based hardware is deployed everywhere computing happens, from the cloud to the edge. It is essential that software developers have intuitive tools to take advantage of this hardware. In the Developer Platforms group, our mission is to make software development on the Arm architecture simple and intuitive. We are growing our team and are looking for a passionate software engineer to help us build the next generation of machine learning experiences for developers. Responsibiliti…",55393.33,55393.33,,2025-04-14T03:12:03Z,https://www.adzuna.co.uk/jobs/land/ad/5143735148?se=JvTjazAe8BG-i3PTGXcHCQ&utm_medium=api&utm_source=e1ad5111&v=98206E3E8A4DEC4384FCBBB1611E37CDDF5A5589,IT Jobs,developer
Business Development Manager,HAYS,"Nottingham, Nottinghamshire","Business Development Manager / £35-£38k (£65k OTE) / Hybrid / Nottingham Based Your new company Aleading UK-based hot tub manufacturer, this business has built a reputationover more than a decade for delivering high-quality, affordable products. Theyprovide a diverse selection of hot tubs and swim spas to meet a variety ofcustomer needs and preferences. Your new role Weare seeking a dynamic Business Development Manager who can commute around theNottingham area to establish and nurture relations…",35000,38000,,2025-04-11T16:41:49Z,https://www.adzuna.co.uk/jobs/land/ad/5140567457?se=JvTjazAe8BG-i3PTGXcHCQ&utm_medium=api&utm_source=e1ad5111&v=0B6875C19DC8DD49113711097558837A19351C53,Sales Jobs,developer
Python Developer,NatWest,"Davidsons Mains, Edinburgh","Join us as a Python Developer In this key role, you’ll lead and collaborate with multiple stakeholders to design, build and deliver solutions to internal customers You’ll be partnering with the business and technical stakeholders, driving out high quality value add web based solutions This is an opportunity to gain exposure as you educate and sell opportunities and developments in web based applications across the bank What you'll do As a Python Developer, you’ll be designing, building and supp…",40746.17,40746.17,,2025-04-16T20:33:48Z,https://www.adzuna.co.uk/jobs/land/ad/5148207111?se=JvTjazAe8BG-i3PTGXcHCQ&utm_medium=api&utm_source=e1ad5111&v=98E75BE2BA549EFE278B92560DC6334D60CD35C0,IT Jobs,developer
Python Developer,NatWest,"Deritend, Birmingham","Join us as a Python Developer In this key role, you’ll lead and collaborate with multiple stakeholders to design, build and deliver solutions to internal customers You’ll be partnering with the business and technical stakeholders, driving out high quality value add web based solutions This is an opportunity to gain exposure as you educate and sell opportunities and developments in web based applications across the bank What you'll do As a Python Developer, you’ll be designing, building and supp…",42317.26,42317.26,,2025-04-16T20:33:45Z,https://www.adzuna.co.uk/jobs/land/ad/5148206999?se=JvTjazAe8BG-i3PTGXcHCQ&utm_medium=api&utm_source=e1ad5111&v=4743A26BB14FC424ED06F7BBCF8E88416CD78742,IT Jobs,developer
Python Developer,NatWest,"Hulme, Manchester","Join us as a Python Developer In this key role, you’ll lead and collaborate with multiple stakeholders to design, build and deliver solutions to internal customers You’ll be partnering with the business and technical stakeholders, driving out high quality value add web based solutions This is an opportunity to gain exposure as you educate and sell opportunities and developments in web based applications across the bank What you'll do As a Python Developer, you’ll be designing, building and supp…",47885.25,47885.25,,2025-04-16T20:33:45Z,https://www.adzuna.co.uk/jobs/land/ad/5148206994?se=JvTjazAe8BG-i3PTGXcHCQ&utm_medium=api&utm_source=e1ad5111&v=3F57AD7D20BB025E4C2233E3369D44EC575B0A62,IT Jobs,developer
Power Asset Developer,BP Energy,"Charing Cross, Central London","Entity: Gas & Low Carbon Energy Job Family Group: Strategic Planning & Business Development Group Job Description: Job description: Net Zero Teesside Power – Power Asset Developer Synopsis: Power Asset Developer for bp’s flagship Net Zero Teesside (NZT) Power and Carbon Capture project. bp is operator of the NZT project, a world first Gas with Carbon Capture power plant which took its Final Investment Decision in December 2024. Decarbonisation is expected to drive a doubling of electricity dema…",53801.51,53801.51,,2025-04-09T20:22:56Z,https://www.adzuna.co.uk/jobs/land/ad/5137551319?se=JvTjazAe8BG-i3PTGXcHCQ&utm_medium=api&utm_source=e1ad5111&v=498FF75D517532D6B4DFE213FCEF1C875AEFA4CD,"Energy, Oil & Gas Jobs",developer
Learning & Development Consultant - Sales,Softcat,"Balsall Heath, Birmingham","Manchester based with candidates considered for Birmingham  Do you want to have an impact and join a business where you can make the difference? Do you enjoy working as part of an enthusiastic, passionate, and collaborative team? Join our Learning & Development Team This is an exciting time to join our sales L&D team. We are redefining how we develop sales capabilities, building upon our great foundations. We are looking at how we can continue to improve and deliver the very best enablement fo…",37145.48,37145.48,,2025-04-17T13:35:27Z,https://www.adzuna.co.uk/jobs/land/ad/5149593784?se=JvTjazAe8BG-i3PTGXcHCQ&utm_medium=api&utm_source=e1ad5111&v=981FF581FF03FC36D3569876FDECD6EB03239950,Sales Jobs,developer
Learning & Development Consultant - Sales,Softcat,"Ardwick, Manchester","Manchester based with candidates considered for Birmingham  Do you want to have an impact and join a business where you can make the difference? Do you enjoy working as part of an enthusiastic, passionate, and collaborative team? Join our Learning & Development Team This is an exciting time to join our sales L&D team. We are redefining how we develop sales capabilities, building upon our great foundations. We are looking at how we can continue to improve and deliver the very best enablement fo…",35154.04,35154.04,,2025-04-17T13:35:27Z,https://www.adzuna.co.uk/jobs/land/ad/5149593785?se=JvTjazAe8BG-i3PTGXcHCQ&utm_medium=api&utm_source=e1ad5111&v=80C5A3CADC8264D180826F576A1855F2BC8B417B,Sales Jobs,developer
Software Engineer,Develop,"Newcastle Upon Tyne, Tyne & Wear","Software Engineer, up to £50k, 3 days a week on-site in Newcastle Our client is a leading digital agency who possess a proven history of providing effective digital solutions to clients across the country. They specialise in e-commerce, mobile applications, and helping brands transition into the digital realm. Due to growth of the business they are looking to expand their software development team with a brand new role being released for a mid/senior level .NET developer. they ideal candidate w…",50000,50000,permanent,2025-04-13T10:12:36Z,https://www.adzuna.co.uk/jobs/details/5143105126?utm_medium=api&utm_source=e1ad5111,IT Jobs,developer
Mobile Development Manager,NatWest,"Temple Meads, Bristol","Join us as a Mobile Development Manager As a Mobile Development Manager, you’ll set the strategic direction of the team, supported by the senior technical members You’ll take responsibility for the end-to-end delivery of strategic and tactical projects, delivering agreed business outcomes and coordinating various technology and change teams to achieve this This is an exciting opportunity for an experienced manager to share their subject matter expertise and help shape the future direction of th…",61790.48,61790.48,,2025-04-09T22:49:39Z,https://www.adzuna.co.uk/jobs/land/ad/5137813710?se=JvTjazAe8BG-i3PTGXcHCQ&utm_medium=api&utm_source=e1ad5111&v=1ABBC82DD41CBF3C7973D34725FBEF0DCB841E37,IT Jobs,developer
Digital Development Manager,NatWest,"Temple Meads, Bristol","Join us as a Digital Development Manager As a Digital Development Manager, you’ll set the strategic direction of the team, supported by the senior technical members You’ll take responsibility for the end-to-end delivery of strategic and tactical projects, delivering agreed business outcomes and coordinating various technology and change teams to achieve this This is an exciting opportunity for an experienced manager to share their subject matter expertise and help shape the future direction of …",56775.83,56775.83,,2025-04-11T22:59:33Z,https://www.adzuna.co.uk/jobs/land/ad/5141379862?se=JvTjazAe8BG-i3PTGXcHCQ&utm_medium=api&utm_source=e1ad5111&v=D432B7887DAFD800BB3C9426CC7930AA3E4128F3,IT Jobs,developer
