title,company,location,description,salary_min,salary_max,contract_type,created,redirect_url,category,country,specialty
STAGE - Développement des partenariats,Motion Society,"Paris, Ile-de-France","Qui sommes-nous ? Motion Society propose aux créateurs de contenu une solution pour optimiser et distribuer leurs vidéos sur toutes les plateformes de réseaux sociaux. Notre mission est d'aider les créateurs de contenu à atteindre leur plein potentiel en débloquant leur croissance sur chaque plateforme. Au cœur de la Creator Economy, Motion Society est une startup en pleine croissance qui fournit déjà une solution à plus de 250 créateurs comptant des millions d'abonnés. Votre Rôle : En étroite …",,,,2025-04-12T06:06:31Z,https://www.adzuna.fr/land/ad/5141657810?se=-uKDvy4e8BGla2k9OSZXLA&utm_medium=api&utm_source=e1ad5111&v=65776A42CAAB6488849296915C1F43A3AA9D6004,Unknown,fr,ingenierie_informatique
Business Developer (lead generator) – Développement Pharmaceutique F/H,DELPHARM,France,"Nous recherchons un business Developpeur (lead generator) au sein de notre équipe développement. Rattaché(e) au Responsable du Business Développement, et donc au cœur du développement de l’activité vous contribuerez au développement de l’activité commerciale de la Business Unit Développement. MISSIONS : Prospection commerciale : Identifier et analyser de nouvelles cibles stratégiques telles que des start-ups innovantes/biotech et des entreprises pharmaceutiques de taille intermédiaire à partir …",,,,2025-04-11T05:28:58Z,https://www.adzuna.fr/land/ad/5139963311?se=-uKDvy4e8BGla2k9OSZXLA&utm_medium=api&utm_source=e1ad5111&v=B19775335D7C0B9532EE35DD6EEB62B75A639EF9,Unknown,fr,ingenierie_informatique
Business Developer (h/f) (CDI),LHH,France,"Poste : LHH Recruitment Solutions, cabinet de conseil en recrutement, travail temporaire spécialisé, gestion de transition et évaluation d'experts, cadres et dirigeants recherche pour son client un Business Developer (F/H) en CDI. Notre client est un acteur innovant du secteur marketing & média, spécialisé dans l’accompagnement des marques et distributeurs des PGC. Dans le cadre du lancement d’une nouvelle application mobile dédiée à l’engagement des consommateurs et à la performance des marque…",,,permanent,2025-04-03T11:45:47Z,https://www.adzuna.fr/land/ad/5126067063?se=-uKDvy4e8BGla2k9OSZXLA&utm_medium=api&utm_source=e1ad5111&v=B0E36A9ED25271F5419C86F6604580D4DA70941C,Unknown,fr,ingenierie_informatique
Responsable Développement H/F,Cotral Lab,"Périgny, Plateau-briard","Cotral Lab : la technologie du sur-mesure pour servir la santé et la sécurité des professionnels Avec une croissance de 15%/an depuis 30 ans, Cotral Lab - N°1 mondial de la protection auditive sur mesure - a été labélisé « Vitrine Usine du Futur » en 2019. Cotral Lab conçoit, fabrique et distribue 3 gammes de produits sur mesure : - Des protections auditives sur mesure depuis 1992, le savoir-faire historique, - Des lunettes Safety à verres correcteurs depuis 2020, - Des systèmes de communicatio…",,,,2025-04-17T04:57:05Z,https://www.adzuna.fr/land/ad/5148777094?se=-uKDvy4e8BGla2k9OSZXLA&utm_medium=api&utm_source=e1ad5111&v=60E585EB6C3551F0898A5402487CDB9CA3A3929F,Unknown,fr,ingenierie_informatique
Responsable Développement H/F,Vinci Immobilier,"Rangueuil, Toulouse","Sous l'autorité du Directeur du Développement, vous vous verrez confier des missions relatives à la recherche d'opportunités foncières sur lesquelles seront développées des opérations immobilières résidentielles, de leur prospection à leur acquisition. A ce titre, vos missions sont de : Identifier les opportunités foncières grâce à l'utilisation de Promolead, au développement de votre réseau d'apporteurs d'affaires, à vos actions de prospection en diffus sur le terrain et à vos rendez-vous en m…",,,,2025-03-19T06:37:39Z,https://www.adzuna.fr/land/ad/5100415191?se=-uKDvy4e8BGla2k9OSZXLA&utm_medium=api&utm_source=e1ad5111&v=4001545229151094E96B939C4A9AC22230FE5C99,Emplois Immobilier,fr,ingenierie_informatique
Business Developer H/F,Groupe Editor,"Malzéville, Nancy","Fabricant français depuis plus de 50 ans et leader de la communication émotionnelle, le Groupe Editor est présent sur 5 marchés : la carterie, l'emballage cadeau, la papeterie, le petit objet cadeaux, et le digital. L'ART DE L'EMOTION incarne l'évolution de notre métier : chez Editor nous ne commercialisons pas des produits. Nous sommes des passeurs détenteurs et gestionnaires des émotions : des familles, des amis, des amoureux Rejoignez l'aventure en devenant : BUSINESS DEVELOPER H/F Sur le se…",,,,2025-03-19T06:37:38Z,https://www.adzuna.fr/land/ad/5100415135?se=-uKDvy4e8BGla2k9OSZXLA&utm_medium=api&utm_source=e1ad5111&v=024218D99F091DB65E07E23A9A1F8D520AF271F6,Unknown,fr,ingenierie_informatique
Business Developer H/F,Régie Radio Régions,"Loir-et-Cher, Centre","En tant que Business Developer, vous aurez pour mission de devenir notre meilleur :  Chasseur de clients : Débusquez de nouveaux annonceurs à séduire et tissez des liens durables ;  Stratège publicitaire : Analysez les besoins de nos clients et soyez force de créativité pour proposer des messages percutants ;  Négociateur hors pair : Remportez un maximum de challenges et concluez des deals avec nos clients fidèles et historiques ;  Co-équipier de choc : Collaborez avec vos collègues commerciaux…",,,,2025-04-19T06:37:31Z,https://www.adzuna.fr/land/ad/5152707786?se=-uKDvy4e8BGla2k9OSZXLA&utm_medium=api&utm_source=e1ad5111&v=F4E4E5279D5081A875A75377D5E62FA55B6ECCB4,Unknown,fr,ingenierie_informatique
Business Developer H/F,Lease Protect,"1er-Arrondissement, Lyon","Notre méthode ? Un audit précis pour identifier les axes d'amélioration : Réduction des vols internes et externes Optimisation du panier moyen et des ventes additionnelles Augmentation du trafic en point de vente Analyse comportementale pour des stratégies toujours plus efficaces Envie de faire partie d'une équipe qui innove et qui agit ? Si l'avenir de la sécurité disruptive vous intéresse, vous êtes au bon endroit  Votre terrain de jeu : en région Auvergne-Rhône-Alpes (secteur géographique à …",,,,2025-04-19T06:37:28Z,https://www.adzuna.fr/land/ad/5152707640?se=-uKDvy4e8BGla2k9OSZXLA&utm_medium=api&utm_source=e1ad5111&v=81E5AC8D30CAD10EAED8FEA29C205102553926BC,Unknown,fr,ingenierie_informatique
Business Developer H/F,ENERGIES FRANCE,"Gennevilliers, Nanterre","Energies France recrute son futur Business Developer en BtoB (H/F/X) Une aventure énergisante vous attend  Depuis plus de 10 ans, Energies France aide les professionnels à trouver le contrat d'électricité ou de gaz qui leur correspond le mieux. Et après avoir accompagné plus de 13 000 clients pour un taux de satisfaction de 4,6/5 sur Trustpilot, notre expertise parle d'elle-même. Pourquoi nous rejoindre ? Vous intégrerez une équipe de champions, près de 130 collaborateurs passionnés qui partage…",22000,30000,,2025-04-19T06:37:31Z,https://www.adzuna.fr/land/ad/5152707791?se=-uKDvy4e8BGla2k9OSZXLA&utm_medium=api&utm_source=e1ad5111&v=0F842F9176A606D932B0F680AC885CD574069C68,Unknown,fr,ingenierie_informatique
Responsable Développement Stratégique H/F,Orano,"Massy, Palaiseau","Pour conquérir de nouveaux marchés et poursuivre son développement, la Business Démantèlement et Services recherche son Responsable développement Stratégique pour le périmètre Cycle et International. Rattaché à la Direction Clients, Stratégie, Marketing et Communication (DCSMC) de la BU DS, il a pour missions principales : D'élaborer une stratégie interne et externe de développement à partir de l'analyse des évolutions du marché, d'une bonne connaissance des principaux clients, De développer un…",,,,2025-02-04T20:21:16Z,https://www.adzuna.fr/land/ad/5037570655?se=-uKDvy4e8BGla2k9OSZXLA&utm_medium=api&utm_source=e1ad5111&v=38C2A0BD1C62C84072C62E0DE4523C2DAFC82330,Unknown,fr,ingenierie_informatique
Chargé Développement Packaging H/F,Segula Technologies,"Dieppe-Est, Dieppe","En tant que Chargé(e) Développement Packaging, vos missions seront les suivantes : Méthodes : - Participer au développement des emballages en intégrant les contraintes liées à l'usine - Initialiser la nomenclature produit pour un projet sous forme d'une base de données logistique - Analyser les éléments de la base de données et s'assurer de sa mise à jour pour répondre au besoin du client - Assurer le suivi des affaires en vie projet - Piloter et être l'interlocuteur privilégié des différents M…",,,,2025-02-04T19:48:22Z,https://www.adzuna.fr/land/ad/5037233483?se=-uKDvy4e8BGla2k9OSZXLA&utm_medium=api&utm_source=e1ad5111&v=1B4E8B8DC5D0ED688A921C7658F8C9BECB4A197E,Unknown,fr,ingenierie_informatique
Charge de Developpement - Conseiller H/F,CERFRANCE Orne,"Argentan-Ouest, Argentan","Vous aurez en charge le développement de la clientèle TPE/PME (artisans, commerçants, services) sur votre secteur : - Des actions commerciales pour développer une nouvelle clientèle (rencontres prospects, établissement de devis et contractualisation) - Du suivi des nouveaux clients et de leur satisfaction pendant la première année - Des actions de notoriété pour développer la relation avec nos partenaires et développer un réseau de prescripteurs Ainsi que l'accompagnement conseil d'un portefeui…",30000,42000,,2025-02-27T05:49:36Z,https://www.adzuna.fr/land/ad/5065235238?se=-uKDvy4e8BGla2k9OSZXLA&utm_medium=api&utm_source=e1ad5111&v=812D32171E522043E310543389CE9119A9668022,Emplois Autres/Général,fr,ingenierie_informatique
Chargé de Développement des Compétences H/F,LSDH,"Saint-Denis-de-l'Hôtel, Orléans","Au sein du service RH (15 personnes), sur le périmètre du site industriel (500 collaborateurs), vous travaillerez en binôme avec une autre chargée de développement des compétences. Chez LSDH, les journées sont rythmées et variées (parfois, pleines de surprises)  Au sein de cet environnement dynamique et rattaché(e) au Responsable RH, vos missions principales seront les suivantes : - RECRUTEMENT : prendre en charge le processus de recrutement de A à Z des services dont vous aurez la responsabili…",,,,2025-02-04T20:21:10Z,https://www.adzuna.fr/land/ad/5037568121?se=-uKDvy4e8BGla2k9OSZXLA&utm_medium=api&utm_source=e1ad5111&v=627668ADBF1194EDD55C6FB5B6B8048324A5EA25,Unknown,fr,ingenierie_informatique
Responsable de Développement Branches H/F,AG2R LA MONDIALE,"Paris, Ile-de-France","Vos missions principales sont les suivantes : - Développer nos relations avec les partenaires sociaux (organisations patronales et syndicales) et notre compréhension des attentes des entreprises et salariés des secteurs professionnels de ce portefeuille ; - Présenter aux partenaires sociaux les comptes de résultats de ces accords et les préconisations de pilotage associées (tarifs, garanties et paramètres des comptes techniques et financiers) en lien avec la Direction Technique ; - En relation …",,,,2025-02-12T03:01:36Z,https://www.adzuna.fr/land/ad/5046730774?se=-uKDvy4e8BGla2k9OSZXLA&utm_medium=api&utm_source=e1ad5111&v=ED3051C8AC59299E70D736EA989A324BB62F7F10,Unknown,fr,ingenierie_informatique
Charge de Developpement Commercial H/F,Eureka Éducation,"Indre, Centre","MISSION PRINCIPALE Dans le cadre de son développement, Ecole Terrade recherche son/sa Chargé de développement F/H. Ce poste en CDI basé à Châteauroux est à pourvoir dès que possible. En tant que chargé(e) de développement, vous assurez la promotion de nos formations auprès des entreprises et des candidats. Vos missions s'articulent autour de quatre grands axes : 1. Développement commercial (BtoB) - Vous démarchez, suivez et fidélisez les entreprises pour développer un réseau de partenaires enga…",,,,2025-03-01T05:46:48Z,https://www.adzuna.fr/land/ad/5067861994?se=-uKDvy4e8BGla2k9OSZXLA&utm_medium=api&utm_source=e1ad5111&v=3360FDB1B4FAED51256A0E8F399D2BCA8166AD02,Emplois Enseignement,fr,ingenierie_informatique
Chargé de Développement Commercial H/F,TGS France,"Putanges-Pont-Ecrepin, Argentan","Qui sommes-nous? TGS France : un groupe engagé et durable Portés par les relations humaines, l'inclusion et l'engagement, nos 1700 collaborateurs ont à coeur de travailler ensemble pour apporter à nos clients une offre de service globale et durable au travers d'une pluralité de métiers : Audit, Avocats, Conseil, Expertise comptable, Informatique, Paie et Ressources Humaines. Respectueux et responsable, notre groupe se développe autour de nos engagements RSE en faveur du handicap, du bien-être d…",35000,42000,,2025-02-12T03:01:34Z,https://www.adzuna.fr/land/ad/5046730686?se=-uKDvy4e8BGla2k9OSZXLA&utm_medium=api&utm_source=e1ad5111&v=7268EFC8FFF4E1A405759B6039C6E128736053EE,Unknown,fr,ingenierie_informatique
Business Developer H/F,Talents Industry,"Pont-Rousseau, Rezé","Dans le cadre de la croissance d'une entreprise spécialisée dans le secteur de la rénovation énergétique, nous recherchons un(e) Business Developer stratégique. Votre rôle consistera à développer et renforcer un réseau de partenaires professionnels du bâtiment tout en contribuant activement à la fidélisation client. Véritable acteur(trice) du développement commercial, vous travaillerez en lien étroit avec les équipes internes afin de maximiser la performance des partenariats. Vos Missions En ta…",32000,37000,,2025-04-20T05:22:02Z,https://www.adzuna.fr/land/ad/5154109047?se=-uKDvy4e8BGla2k9OSZXLA&utm_medium=api&utm_source=e1ad5111&v=083EC11B2D13DC22B0BB28E8478AE2461EEE93DD,Emplois Autres/Général,fr,ingenierie_informatique
Chargé du Développement des Compétences H/F,Croix-Rouge française,"Montrouge, Antony","MISSION 1 : Concevoir des programmes de formations humanitaires - Identifier, en collaboration avec les experts métiers de la CRF et du Mouvement, les compétences spécifiques attendues des équipes de réponse aux urgences (ERU et Rapid Response etc) dans des contextes de gestion de crise ; - Élaborer et structurer les contenus pédagogiques pertinents, outils et supports de formation adaptés (présentiel, e-learning, webinaires) intégrant des cas pratiques issus de situations humanitaires réelles …",,,,2025-03-23T06:48:10Z,https://www.adzuna.fr/land/ad/5107325196?se=-uKDvy4e8BGla2k9OSZXLA&utm_medium=api&utm_source=e1ad5111&v=48BBF2D8E090F1DC3D75997F2AD4FCACF3251EEC,Emplois Autres/Général,fr,ingenierie_informatique
Responsable du Developpement Commercial H/F,JL Executive,"Saint-Malo-Sud, Saint-Malo","Vous connaissez le secteur du transport comme votre poche ? Vous aimez proposer des solutions sur-mesure pour vos clients ? JL Executive recherche pour son client, expert en Transport routier de marchandises secteur industriel / TP, un Responsable du développement commercial H/F basé idéalement entre Saint-Malo et Rennes (35) Les conditions de cette offre : - Offre en CDI, statut cadre, forfait jour 218 ; - Rémunération : 3200€ b/mois  variable  titres restaurant 8€ par jour travaillé  mutuelle…",35000,40000,,2025-03-09T12:02:27Z,https://www.adzuna.fr/land/ad/5083852861?se=-uKDvy4e8BGla2k9OSZXLA&utm_medium=api&utm_source=e1ad5111&v=F111C03254FD9F64DDAFE3C0B17EBB376CD1F605,Emplois Autres/Général,fr,ingenierie_informatique
Stagiaire en développement Web,Hydre Ingénierie,France,"À propos de l'entreprise Hydre Ingénierie est spécialisé dans la négociation, la renégociation et l’acquisition de fonciers ou de surfaces pour le compte de ses clients (opérateurs télécom, parc photovoltaïque, data-centers, nouvelles technologies, etc.). À propos du poste Nous sommes à la recherche de notre futur(e) stagiaire passionné(e) par le développement d'application : Responsabilités Concevoir et développer des applications avec Microsoft Power Apps Automatiser des processus avec Power …",,,,2025-04-01T10:03:44Z,https://www.adzuna.fr/land/ad/5121026610?se=-uKDvy4e8BGla2k9OSZXLA&utm_medium=api&utm_source=e1ad5111&v=286F7C1E23572E59274AE29D0E8E756F0922CA45,Unknown,fr,ingenierie_informatique
LEAD DEVELOPER PYTHON,Harnham,"Paris, Ile-de-France","LEAD DEVELOPER PYTHON PARIS (75) 70-90K€ Cette société innovante en pleine croissance, développe une solution à fort impact. Leur produit phare, une application mobile utilisée directement par les clients finaux, est en pleine structuration technique. VOTRE RÔLE Revue de code, définition et amélioration des process backend Animation technique de l'équipe backend (sans responsabilités RH) Encadrement opérationnel de trois développeurs backend Contribution aux choix d'architecture technique en li…",,,,2025-04-11T05:28:04Z,https://www.adzuna.fr/land/ad/5139962264?se=-uKDvy4e8BGla2k9OSZXLA&utm_medium=api&utm_source=e1ad5111&v=2D087D157496EEAA33E114E12F93CF94FCD4201B,Unknown,fr,ingenierie_informatique
Lead Developer Python,Veesion,"Ile-de-France, France","Lead Developer Python Location: Paris, France (Hybrid - 2-3 days remote) Salary: €70-90k (depending on experience and skills) About Veesion Veesion is a pioneering company in in-store theft detection solutions. We leverage advanced AI and video analysis to help retailers protect their assets and optimize operations. As we continue to scale, we are looking for a Lead Developer Python to guide our technical team and enhance our backend architecture. Your Mission: - Take technical leadership in de…",,,,2025-04-05T08:48:10Z,https://www.adzuna.fr/land/ad/5130860401?se=-uKDvy4e8BGla2k9OSZXLA&utm_medium=api&utm_source=e1ad5111&v=910415CB4CC0B3C046AB284838BCC1473345E4A0,Emplois Informatique,fr,ingenierie_informatique
Java Developer Contract,Stott and May,France,"Java Developer / Java Architect – Strasbourg, France (On-Site)- 12 Months-Freelance- €450 Per Day Are you a skilled Java Developer or Java Architect looking for an exciting opportunity in a high-impact European project? Join a leading international organization managing critical IT systems. Your Role: You’ll be part of an international team designing, developing, and deploying enterprise-level applications. You’ll work with Java, PostgreSQL, Microservices, Docker, Kubernetes, and Apache Kafka ,…",,,,2025-04-04T08:22:24Z,https://www.adzuna.fr/land/ad/5128734902?se=-uKDvy4e8BGla2k9OSZXLA&utm_medium=api&utm_source=e1ad5111&v=A13160AE08BF2A5F8E1A4B38B115E3902B280D79,Unknown,fr,ingenierie_informatique
Python Flask Developer,Thrive IT Systems,France,"We have one open position of Python Flash Developer with one of our client based at Paris, France. This is a permanent position with our client. Below is the job description for your reference. Please share your application once you are interested. Role : Python Flask Developer Location : Paris, France Mode : Permanent/Fulltime Language Proficiency: French and English Hybrid Job Description: Technical Skills: Software Engineer mastering Python FLASK framework Capable to request Firewall rules C…",,,,2025-04-09T04:56:29Z,https://www.adzuna.fr/land/ad/5136516146?se=-uKDvy4e8BGla2k9OSZXLA&utm_medium=api&utm_source=e1ad5111&v=FA909B2015FE70187EE92A425C563891287DF941,Unknown,fr,ingenierie_informatique
Full Stack Developer,Talent,France,"We’re looking for a French-speaking Full Stack Developer to join a fully remote, Agile team working on the evolution and functional improvement of a Payroll Solution . This is an initial 5-month contract , with potential for extension. You’ll be collaborating closely with QA Engineers, Business Analysts, Product Owners, and fellow Developers, delivering scalable and secure cloud-based features that handle large volumes of data.  Key Details  Start: ASAP  Duration: 5 months (initially)  Location…",,,,2025-04-11T05:27:36Z,https://www.adzuna.fr/land/ad/5139961831?se=-uKDvy4e8BGla2k9OSZXLA&utm_medium=api&utm_source=e1ad5111&v=1DBB706604AE8CC60181EBB193B9D4EFF108F384,Unknown,fr,ingenierie_informatique
C#/.Net Developer,Persistent Systems,"Grenoble, Isère","About Persistent We are an AI-led, platform-driven Digital Engineering and Enterprise Modernization partner, combining deep technical expertise and industry experience to help our clients anticipate what’s next. Our offerings and proven solutions create a unique competitive advantage for our clients by giving them the power to see beyond and rise above. We work with many industry-leading organizations across the world, including 12 of the 30 most innovative global companies, 60% of the largest …",,,,2025-04-11T05:27:59Z,https://www.adzuna.fr/land/ad/5139962219?se=-uKDvy4e8BGla2k9OSZXLA&utm_medium=api&utm_source=e1ad5111&v=C1256ADC21BAEDA7BB98D13D7AE0300AF3C46E7C,Emplois Informatique,fr,ingenierie_informatique
Responsable recherche et développement,INA - Institut national de l'audiovisuel,"Bry-sur-Marne, Nogent-sur-Marne","Contexte : L'Institut national de l'audiovisuel recherche un·e Responsable Moteurs de Recherche pour un CDI , rattaché(e) à la Direction Data & Technologies. EPIC créé en 1975, l’INA, entreprise publique audiovisuelle et numérique, collecte, sauvegarde et transmet le patrimoine de la radio et de la télévision française. Premier centre d’archives numérisées au monde avec plus de 3 millions et demi d’heures de télévision et de radio auxquelles s’ajoutent chaque année 800 000 heures au titre du dé…",,,,2025-04-01T10:04:56Z,https://www.adzuna.fr/land/ad/5121029305?se=-uKDvy4e8BGla2k9OSZXLA&utm_medium=api&utm_source=e1ad5111&v=FD5E331DCAA791D71DFA63D99B776669635A1782,Unknown,fr,ingenierie_informatique
Stagiaire en développement Web,STEAMULO,"Paris, Ile-de-France","Qui sommes nous ? Steamulo est une Digital & Data Factory spécialisée dans les projets innovants. Nous sommes une startup de 10 ans d’existence, située en plein cœur de Paris (à deux pas de l’Opéra), en forte croissance et sommes en permanence en recherche de nouveaux candidats. Et si ton stage était une vraie mission ? Notre équipe d'experts accompagne nos clients sur leur projet en mode Agile. Nous développons des sites Web et des applications mobiles, en y intégrant éventuellement …",,,,2025-04-11T05:28:34Z,https://www.adzuna.fr/land/ad/5139962943?se=-uKDvy4e8BGla2k9OSZXLA&utm_medium=api&utm_source=e1ad5111&v=7A4849D3BE55535D9C504346432DFAB832AA8986,Unknown,fr,ingenierie_informatique
Conseiller Developpement Acs H/F,CERFRANCE Côtes d'Armor,"Plérin, Saint-Brieuc","Nous recherchons un(e) Conseiller(e) Développement Artisans-Commerçants-Services (ACS) dynamique et passionné(e) pour rejoindre notre équipe. Sous la responsabilité du responsable de développement, votre rôle principal sera d'attirer de nouveaux clients et de renforcer nos relations avec les clients existants. Ainsi : - - Vous êtes acteur de la dynamique commerciale par la prospection de nouveaux adhérents potentiels sur le secteur artisans, commerçants, services (ciblage, prise de rendez-vous)…",,,,2025-02-04T20:21:10Z,https://www.adzuna.fr/land/ad/5037568149?se=-uKDvy4e8BGla2k9OSZXLA&utm_medium=api&utm_source=e1ad5111&v=CC6FAFEFC32CF10309DCD3DE8548A84E7BE60D39,Unknown,fr,ingenierie_informatique
Lead Developer H/F,Chausséa,"Malzéville, Nancy","En tant que Lead Développeur, tu auras la responsabilité d'accompagner une équipe de 5 développeurs afin de garantir la réussite du développement technique d'un site e-commerce à fort trafic (30 M de visiteurs / an). Tes missions : - Concevoir et développer des solutions techniques robustes et évolutives : nouvelles fonctionnalités, correction de bugs. - Manager une équipe de développeurs : accompagner et fédérer. - Fournir un leadership technique solide à l'équipe de développement pour faire m…",45000,50000,,2025-02-07T08:26:58Z,https://www.adzuna.fr/land/ad/5040745497?se=-uKDvy4e8BGla2k9OSZXLA&utm_medium=api&utm_source=e1ad5111&v=F72F85543F7C5E84DB0A92CF2C4A7F823BB43344,Emplois Distribution et Entrepôts,fr,ingenierie_informatique
Lead Developer H/F,6TM,"Maine-et-Loire, Pays de la Loire","Directement rattaché(e) à notre agence d'Angers, vous aurez l'occasion de travailler en étroite collaboration avec Quentin et son équipe, en charge du développement de notre produit Seenaps. Seenaps, c'est quoi ? C'est notre plateforme 360° dédiée aux réseaux d'enseignes proposant une gamme complète de services à la fois tout-en-un et modulable. En tant que Lead Developer, voici un aperçu de vos missions quotidiennes : - Concevoir, développer et déployer des solutions logicielles robustes et év…",45000,50000,,2025-03-26T08:19:34Z,https://www.adzuna.fr/land/ad/5111961329?se=-uKDvy4e8BGla2k9OSZXLA&utm_medium=api&utm_source=e1ad5111&v=BF4498003B929E7B784B4B7F4B64315A2B920FAF,Unknown,fr,ingenierie_informatique
Lead Developer H/F,Assystem,"Rhône, Auvergne-Rhône-Alpes","Votre future équipe Nous vous invitons à rejoindre l'équipe de Maxime, Responsable d'activités, en tant que Lead Développeur (H/F) pour un projet innovant et stimulant dans le secteur industriel. Vos missions En tant que Lead Développeur (H/F), vous contribuez activement aux missions suivantes : - Conception et Développement : Concevoir une architecture technique complexe, répondant aux enjeux définis par les métiers et s'inscrivant dans un SI existant hybride (On Premise & Cloud). Implémentati…",,,,2025-03-18T06:35:56Z,https://www.adzuna.fr/land/ad/5098335941?se=-uKDvy4e8BGla2k9OSZXLA&utm_medium=api&utm_source=e1ad5111&v=6D6DDBED91C015A4D594F704429E8FDEDAD5E355,Unknown,fr,ingenierie_informatique
