title,company,location,description,salary_min,salary_max,contract_type,created,redirect_url,category,specialty,source_country,query,query_type,remote_friendly,international
IT Apprentice H/F,Faurecia,"Hauts-de-Seine, Ile-de-France","Forvia, a sustainable mobility technology leader We pioneer technology for mobility experience that matter to people. Your mission, roles and responsibilities You will BE working on challenges that matter ! GBS organization has selected advanced IT solutions and is looking for a motivated candidate in order to boost its digital transformation. He will BE the GBS data scientist apprentice and will support the GBS digital transformation manager to define and to implement the process improvement s…",486,1802,,2025-03-26T07:39:14Z,https://www.adzuna.fr/details/5111933660?utm_medium=api&utm_source=e1ad5111,Emplois Fabrication,data mining,fr,data mining,standard,False,False
Consultant(e) Senior Data Analyst,Sia,"Paris, Ile-de-France","Description du poste Pour accompagner son développement, Sia Partners recrute un(e) consultant(e) Data Analyst Confirmé/Senior. Au sein d’une équipe de consultants expérimentés et en plein essor, vous accompagnerez nos clients à chaque étape de la Data Analyse et Visualisation : Collaborer avec les différentes parties prenantes pour comprendre, définir et prioriser les besoins métiers (design thinking, ateliers, ). Coordonner et interagir avec les équipes techniques afin d’anticiper les risques…",,,,2025-04-11T21:02:36Z,https://www.adzuna.fr/details/5140908334?utm_medium=api&utm_source=e1ad5111,Emplois Consultants,data mining,fr,data mining,standard,False,False
Data Analyst In Competitive - Business Intelligence H/F,Servier,"Suresnes, Nanterre",". Reporting and assignements : Are you willing to join a team that will contribute to shape the future of Servier and its therapies? The Competitive Intelligence and Knowledge Management Department (CIKM) is reporting to Corporate Strategy and is highly exposed to the internal decision-making processes aimed at building the future of Servier. The CIKM function is indeed essential for inspiring and confirming corporate choices over the long term. In this context, the CIKM is looking for a data a…",,,,2025-03-07T05:08:04Z,https://www.adzuna.fr/details/5080241957?utm_medium=api&utm_source=e1ad5111,Unknown,data mining,fr,data mining,standard,False,False
Consultant Senior - Data for Risk | Data Science | CDI | H/F,PricewaterhouseCoopers,France,"Line of Service Assurance Industry/Sector Not Applicable Specialism Forensic Technology Management Level Senior Associate Job Description & Summary Dans le cadre du développement de nos activités Risk & Regulatory (forensic, audit interne, contrôle interne et cartographie des risques par exemple), nous investissons significativement dans les technologies émergentes. Nos équipes travaillent avec nos clients pour générer des informations pertinentes et faire parler les données afin de nous permet…",,,,2025-03-20T11:58:06Z,https://www.adzuna.fr/details/5102330575?utm_medium=api&utm_source=e1ad5111,Emplois Consultants,data mining,fr,data mining,standard,False,False
Ingénieur Maintenance Prédictive & Analyse de Données,Auum,"Châtillon, Antony","Dans le cadre du développement et de l’optimisation de nos produits hardware, nous recherchons un Ingénieur Maintenance Prédictive & Analyse de Données . Vous serez responsable d’améliorer la performance, fiabilité et durabilité de nos machines en organisant la collecte, réalisant l’analyse et de l’interprétation des données de fonctionnement. Nos produits étant complexes, mettant en jeu de nombreuses physiques et des aléas opérationnels, nous avons besoin de renforcer la compréhension des phén…",35000,55000,,2025-03-25T11:53:13Z,https://www.adzuna.fr/details/5109930549?utm_medium=api&utm_source=e1ad5111,Unknown,data mining,fr,data mining,standard,False,False
Consultant Risk Data Analyst - Data Scientist H/F,Deloitte,"La Défense, Courbevoie","La complexité croissante de l'environnement des systèmes d'information dans un contexte de digitalisation des métiers, d'une flexibilité et d'une adaptabilité accrue, et de profondes avancées technologiques, impose un recours à des compétences pointues en analytics pour nos missions de gestion des risques. Dans une dynamique de croissance constante, nous souhaitons renforcer nos équipes et nos solutions en recrutant des consultants expérimentés désireux d'intégrer une équipe motivée, profession…",,,,2025-03-31T04:15:13Z,https://www.adzuna.fr/details/5119417219?utm_medium=api&utm_source=e1ad5111,Unknown,data mining,fr,data mining,standard,False,False
Enseignant(E)-Chercheur(Euse) En Geomatique - H/F - Estp,ESTP,"Cachan, L'Haÿ-les-Roses","Le poste Dans le cadre de son plan de développement, le Groupe ESTP recherche pour son campus de Cachan un enseignant-chercheur spécialiste en géomatique et SIG-CIM. Rattachement hiérarchique : L’enseignant-chercheur mènera ses activités sous la direction du responsable de l’équipe de recherche « systèmes numériques et géo-informatique pour la construction ». Missions principales : Le titulaire du poste est chargé de mener des activités de recherche et d'enseignement dans les domaines de la géo…",,,,2024-10-12T14:31:44Z,https://www.adzuna.fr/details/4899811244?utm_medium=api&utm_source=e1ad5111,Unknown,data mining,fr,data mining,standard,False,False
Data Analyst Pilotage Opérationnel - CDI H/F,Gan Assurances,"Hauts-de-Seine, Ile-de-France","Gan Assurances, filiale du Groupe Groupama, est une entreprise à taille humaine qui constitue, grâce à un collectif de 5 000 personnes, le 5e réseau français d'Agents généraux. Rejoindre Gan Assurances, c'est avoir à la fois l'opportunité d'évoluer dans un environnement convivial et bienveillant mais aussi de monter en compétences sur des missions porteuses de sens. La confiance, la proximité, la détermination et l'efficacité sont les 4 valeurs partagées par l'ensemble de nos collaborateurs au …",,,,2025-04-12T05:38:05Z,https://www.adzuna.fr/details/5141644465?utm_medium=api&utm_source=e1ad5111,Unknown,data mining,fr,data mining,standard,False,False
ENSEIGNANT CONTRACTUEL 2ND DEGRE N°ETP_0101 Statistique F/H,UBS,"Ploemeur, Lorient","Poste susceptible d’être vacant PROFIL DU POSTE : - Filières de formation concernées : La personne recrutée s’intégrera dans le département Science des Données de l’IUT de Vannes. - Objectifs pédagogiques : L’IUT de Vannes recherche un intervenant souhaitant s'investir à hauteur de 192h (équivalent TD) dans le département Science des Données pour partager son expertise dans l’analyse des données en lien avec les enseignements proposés dans la formation, par exemple : · Data mining · Intelligenc…",22000,38000,contract,2025-04-16T07:46:48Z,https://www.adzuna.fr/details/5146950958?utm_medium=api&utm_source=e1ad5111,Emplois Enseignement,data mining,fr,data mining,standard,False,False
Technicien Fraude Cdd,Axa France,"Fontenay-sous-Bois, Nogent-sur-Marne","Au sein de la Direction Pilotage Actuariat et Fraude , rattachée à la Direction IARD Particuliers Professionnels et Règlements de Fréquence, vous rejoindrez l'équipe Service Études et Prévention. Cette équipe composée de 15 collaborateurs localisée sur le site de Val de Fontenay a pour principale mission de lutter contre la fraude sur les produits IARD en traitant toutes les alertes Data-mining. A ce titre, nous recherchons un technicien fraude IARD (F/H) en CDD pour 9 mois et vos mission sont …",,,,2025-02-24T17:22:29Z,https://www.adzuna.fr/details/5062205207?utm_medium=api&utm_source=e1ad5111,Emplois Comptabilité et Finance,data mining,fr,data mining,standard,False,False
Alternant Digital (F/H/X) - 1 an,Syensqo,"Saint-Just-Saint-Rambert, Montbrison","Job ID 32013 Alternant Digital (F/H/X) - 1 an Apprenticeship Saint-Fons, France (https://www.google.com/maps/place/Saint-Fons,France) My candidate profile null Syensqo, c'est toute une chimie. Nous ne parlons pas seulement de réactions chimiques, mais aussi de l'alchimie qui opère lorsque les esprits les plus brillants travaillent ensemble. C'est là que réside notre vraie force. En vous. En vos futurs collègues, et dans toutes vos différences. Et bien sûr, en vos idées qui contribuent à amélior…",,,,2025-03-30T20:22:57Z,https://www.adzuna.fr/details/5119121445?utm_medium=api&utm_source=e1ad5111,Unknown,data mining,fr,data mining,standard,False,False
Senior Data Architect,CEVA Logistics,"Marseille, Bouches-du-Rhône","DATA FACTORY MANAGER / SENIOR DATA ARCHITECT Based in France (Marseille or Puteaux). WHAT ARE YOU GOING TO DO? The Senior Data Architect will join the Global IT Data and Digital organization at CEVA Logistics within the Global CIO organization and will report to the Head of the CEVA Global Data Factory. This role operates in complex decision-making environments impacting the CEVA enterprise, works with senior management from IT, BD and Operations to ensure the best possible global solutions are…",,,,2025-04-26T10:24:13Z,https://www.adzuna.fr/land/ad/5163788679?se=uG7DQu8o8BGT4w9x5LWCew&utm_medium=api&utm_source=e1ad5111&v=5D8EDCB2AE8D7E6D70A96EEB628CC53F0062E120,Unknown,data mining,fr,data mining,standard,False,True
Développeur plateforme de pré-traitement F/H,CORIS INNOVATION,"Annecy, Haute-Savoie","Dans le cadre de l'élaboration d'algorithmes de type Machine Learning à partir de données issues de tests en laboratoire et sur site client, vous participerez au développement d'une plateforme de pré-traitement et de gestion de données multivariées et multisources. Missions - Concevoir et développer une plateforme de traitement de données sur PC intégrant un Dashboard interactif. - Réaliser les codes Python pour le nettoyage, la structuration (labellisation, concaténation, synchronisation) et l…",40000,40000,permanent,2025-05-01T07:50:27Z,https://www.adzuna.fr/details/5171917980?utm_medium=api&utm_source=e1ad5111,Emplois Ingénierie,data mining,fr,data mining,standard,False,False
Développeur plateforme de pré-traitement H/F,CORIS INNOVATION,"Haute-Savoie, Auvergne-Rhône-Alpes","Coris Innovation est une entreprise spécialisée dans les métiers de l'ingénierie système et des processus industriels. Fondée en 2015, notre société a été imaginée selon un principe clairement défini : Inscrire le consulting dans une relation durable et de proximité en assurant la satisfaction de nos partenaires, de nos consultants et de notre structure. Cette conception du conseil en ingénierie est aujourd'hui partagée par une centaine de collaborateurs répartis au sein de 5 agences entre la S…",,,permanent,2025-04-30T19:43:12Z,https://www.adzuna.fr/details/5170942347?utm_medium=api&utm_source=e1ad5111,Emplois Ingénierie,data mining,fr,data mining,standard,False,False
Développeur Python Expérimenté - Société dans la Cyberdéfense H/F,Silkhom,"Fontaine-Seyssinet, Grenoble","La société a comme défi principal le stockage de données et les puissances de calculs nécessaires au traitement de celles-ci. A terme, ce sont des dizaine de tera octets qui seront stockés sur la plateforme. L'équipe est aujourd'hui composée d'un lead développeur, et de 2 développeur Python expérimentés. En tant que développeur Python expérimenté, vous participerez à deux grands projets : - Gestion des flux de données : la plateforme agrège beaucoup de données en entrée, et l'autre partie des s…",50000,60000,,2025-03-14T07:33:14Z,https://www.adzuna.fr/details/5092675878?utm_medium=api&utm_source=e1ad5111,Emplois Autres/Général,data mining,fr,data mining,standard,False,False
Consultant(e) Senior - Chargé(e) de campagne Marketing (F/H),Thinkmarket,"Paris, Ile-de-France","DESCRIPTIF DU POSTE En intégrant Thinkmarket, vous aurez l’opportunité de diversifier votre expertise en travaillant dans différents secteurs d’activité : Services Financiers & Transports Services & Utilities Media & Telecom Luxe, Industrie & Retail Tout au long de votre expérience chez Thinkmarket, nous vous accompagnerons dans votre montée en compétence pour vous permettre d’évoluer vers un poste de Manager d’expertise ou Manager de comptes selon vos aspirations. Vous travaillerez en étroite …",,,,2025-04-30T07:25:57Z,https://www.adzuna.fr/land/ad/5169961624?se=uG7DQu8o8BGT4w9x5LWCew&utm_medium=api&utm_source=e1ad5111&v=712196D5F88CB22953A0C7A6440FEEBC04338043,Unknown,data mining,fr,data mining,standard,False,False
Alternance - 1 an - Analyste quantitatif des tests de résistance du marché F/H (Apprentissage/Alternance),Natixis SA,France,"Poste : Description de l’entreprise Institution financière internationale de premier plan, Natixis Corporate & Investment Banking met à disposition des entreprises, institutions financières, fonds d’investissement, agences souveraines et supranationales une palette de services en conseil, investment banking, financements, banque commerciale et sur les marchés de capitaux. Ses équipes d’experts, présentes dans environ 30 pays, conseillent les clients sur leur développement stratégique en les acc…",,,contract,2025-03-11T13:53:39Z,https://www.adzuna.fr/land/ad/5087007328?se=uG7DQu8o8BGT4w9x5LWCew&utm_medium=api&utm_source=e1ad5111&v=B7F89044054CE781608029DACAF28DE9CD98CDCF,Unknown,data mining,fr,data mining,standard,False,True
Applied Data Scientist (F/M),Alstom,"Saint-Ouen, Saint-Denis","Req ID: 479831 Leading societies to a low carbon future, and acknowledging the current transformative power of AI, Alstom develops and markets mobility solutions that provide the sustainable foundations for the future of transportation. Our product portfolio ranges from high-speed trains, metros, monorail, and trams to integrated systems, customised services, infrastructure, signalling and digital mobility solutions. Joining us means joining a caring, responsible, and innovative company where m…",,,,2025-03-06T08:05:18Z,https://www.adzuna.fr/details/5078621104?utm_medium=api&utm_source=e1ad5111,Unknown,data mining,fr,data mining,standard,False,False
Cell Biology Expert (M/F) H/F,Gi Group France,"Essonne, Ile-de-France","Cell Biology Expert (M/F) H/F 31417 Gi Group Consulting is an international consulting group, reporting a turnover of €2.84 million and a growth rate of 25%. As a family-owned company specializing in talent placement within the healthcare industry, we place human values at the heart of our mission. We leverage our expertise in Life Sciences to serve our clients: pharmaceutical companies, CROs, and biotech firms. We are recruiting in Saclay for a permanent position as a Cell Biology Expert (M/F)…",45000,50000,permanent,2025-04-30T19:29:53Z,https://www.adzuna.fr/details/5170859385?utm_medium=api&utm_source=e1ad5111,Emplois Soins de santé et infirmiers,data mining,fr,data mining,standard,False,True
Alternance Développeur Web & Growth Hacking - Marseille (F/H),ISCOD,"Marseille, Bouches-du-Rhône","Alternance Développeur Web & Growth Hacking - Marseille (F/H) Ceci est une offre pour un contrat en ALTERNANCE. Vous devez être titulaire d’un BACCALAUREAT et remplir les critères d’éligibilité. Qui sommes-nous ?L’ISCOD, spécialiste de la formation en Digital Learning, recherche un(e) Développeur Web & Growth Hacking en alternance pour une entreprise spécialisée dans le marketing digital et l’automatisation de la souhaitez exploiter vos compétences en développement web, scraping, IA et DevOps p…",,,,2025-05-01T03:16:43Z,https://www.adzuna.fr/land/ad/5171582202?se=uG7DQu8o8BGT4w9x5LWCew&utm_medium=api&utm_source=e1ad5111&v=9340B75209EA28FE78F54CBED913C614320A3716,Emplois Création et Design,data mining,fr,data mining,standard,False,False
Ingénieur Développement Produits et Procédés H/F,28939 SG EUROCOUSTIC,"Châtelus-Malvaleix, Guéret","Au sein du département Qualité & Développement de la société Saint-Gobain Eurocoustic, vous serez en charge du développement de produits et de l'économie circulaire (réduction et recyclage de déchets). Dans ce cadre, vos principales missions seront les suivantes: Mettre en place et suivre le plan d’essais développement produit. Suivre les essais sur ligne, collecter et capitaliser les observations et résultats. Analyser et corréler les données Qualité et Process pour déterminer des axes de chan…",,,,2023-12-20T21:02:55Z,https://www.adzuna.fr/details/4489293533?utm_medium=api&utm_source=e1ad5111,Unknown,data mining,fr,data mining,standard,False,False
Stage : Stage Ingénieur Data Science Systèmes Embarqués TOULOUSE H/F,alias,"Haute-Garonne, Occitanie","CAPGEMINI De 6 collaborateurs en 1967 à plus de 340 000 en 2022, Capgemini est aujourd’hui une référence mondiale en matière de conseils, de service informatique et de transformation numérique. Rejoignez notre branche Capgemini Engineering , et entrez dans la nouvelle ère de l’Ingénierie digitale  Get The Future You Want | www.capgemini.com VOTRE ROLE Afin d’accompagner notre développement sur notre site de Toulouse (31) nous recherchons un Stagiaire Ingénieur Data Science Systèmes Embarqués (H…",,,contract,2024-01-26T00:32:04Z,https://www.adzuna.fr/details/4544919675?utm_medium=api&utm_source=e1ad5111,Emplois Diplômés,data mining,fr,data mining,standard,False,False
Ingénieur data et fiabilité produit,Auum,"Châtillon, Antony","Missions principales : Dans le cadre du développement et de l’optimisation de nos produits hardware, nous recherchons un Ingénieur Data & Fiabilité Produit . Vous serez responsable de la collecte, de l’analyse et de l’interprétation des données issues de nos machines afin d’optimiser leur performance, leur fiabilité et leur durabilité Nos produits étant complexes, mettant en jeu de nombreuses physiques et des aléas opérationnels, nous avons besoin de renforcer la compréhension des phénomènes vi…",35000,55000,,2025-03-19T11:46:09Z,https://www.adzuna.fr/details/5100763326?utm_medium=api&utm_source=e1ad5111,Unknown,data mining,fr,data mining,standard,False,False
Data analyste en alternance - Paris,Alternance,France,"Contrat d’alternance basé à Paris et au sein de l'école MBA ESG . Découvrez notre offre d’alternance proposée exclusivement par MBA ESG et notre entreprise partenaire. Cette offre de contrat en alternance vous permet d'allier théorie académique de pointe et pratique professionnelle enrichissante au sein d'une entreprise. Bénéficiez d'une formation de qualité tout en acquérant une expérience concrète. Localisation du poste : Paris Localisation de l'école : Paris Secteur d'activité : Data, IA Les…",,,,2025-03-03T17:53:01Z,https://www.adzuna.fr/details/5072292671?utm_medium=api&utm_source=e1ad5111,Unknown,data mining,fr,data mining,standard,False,False
Consultant junior F/H,BearingPoint France,"Courbevoie, Nanterre","Afin d'aider nos clients à se transformer grâce à des solutions personnalisées, élaborées pour eux et avec eux, nous recrutons toute l’année des consultants juniors pour rejoindre l’une de nos équipes sectorielles ou fonctionnelles. Equipes sectorielles : Vous développerez vos connaissances dans un secteur d’activité, en ayant l’occasion d’intervenir sur des problématiques métiers diverses. - Gouvernement & Secteur Public : administrations, défense, santé, infrastructures et transports ; - Banq…",40000,40000,permanent,2025-04-09T07:58:48Z,https://www.adzuna.fr/details/5136827159?utm_medium=api&utm_source=e1ad5111,Emplois Consultants,data mining,fr,data mining,standard,False,False
Apprenti Développeur Outils Logiciel H/F,GE Vernova,"Montpellier, Hérault","Job Description Summary Vous cherchez à avoir un impact mondial et à résoudre des problèmes ? Grâce à une innovation incessante et à une collaboration continue avec nos clients, GE Grid Automation, qui fait partie de GE Vernova, fournit une énergie plus avancée, plus propre et plus efficace dont les gens dépendent aujourd'hui et construit les technologies énergétiques du futur. L'équipe Support Level 3 des solutions de Grid Automation, à la charge de développer des nouvelles applications et d'a…",,,,2025-03-19T11:44:53Z,https://www.adzuna.fr/details/5100759434?utm_medium=api&utm_source=e1ad5111,Unknown,data mining,fr,data mining,standard,False,False
"Ingénieur Instrumentation, Automatisme, Contrôle commande F/H",REM Tec,"Garches, Nanterre","Vous serez intégré(e) au sein d'une équipe multinationale d’ingénierie composée d'une quinzaine d'ingénieurs et techniciens. Les missions de l'équipe couvrent la réalisation de centrales agriPV intégrant les études d'instrumentation (capteurs et armoires d'acquisition/traitement), le contrôle commande de centrale photovoltaïques, la rédaction des manuels d’exploitation des centrales agriPV, le data mining de données process tant en France qu’à l’étranger et le support à l’innovation. Vos missio…",44000,60000,permanent,2025-04-23T07:45:57Z,https://www.adzuna.fr/details/5157498925?utm_medium=api&utm_source=e1ad5111,Emplois Ingénierie,data mining,fr,data mining,standard,False,False
Commercial de prestations digitales F/H,OPTIMAX STRUCTURES,"La Ciotat, Marseille","NOUS RECHERCHONS… Nous sommes à la recherche d'un(e) Commercial de Prestations Digitales (H/F) en CDI pour renforcer notre équipe en pleine expansion. VOS MISSIONS… Rattaché(e) à notre Directeur, vous aurez pour objectif de développer les ventes de nos prestations digitales. Vos missions spécifiques seront : Prospecter, identifier et acquérir de nouveaux clients, notamment en prenant contact avec les interlocuteurs clés et en construisant une collaboration commerciale durable. Développer les re…",,,permanent,2025-04-26T07:52:44Z,https://www.adzuna.fr/details/5163569480?utm_medium=api&utm_source=e1ad5111,Emplois Ingénierie,data mining,fr,data mining,standard,False,False
Data Engineer Senior H/F,Extia,"Bas-Rhin, Grand-Est","Vous aurez le rôle de support technique aux équipes d'analyse : structurer les données, réaliser des analyses « statistiques » ou « techniques » sur les données, développer des outils d'analyse Vous serez en charge de : Participer à la définition des besoins et à la rédaction des User Stories, Collaborer avec les Data Scientists au développement des modules d'analyse de donnée, Concevoir et construire des architectures de données, Intégrer des sources de données, Vous assurez que les données so…",30000,40000,,2025-04-08T05:57:40Z,https://www.adzuna.fr/details/5134827327?utm_medium=api&utm_source=e1ad5111,Unknown,data mining,fr,data mining,standard,False,False
Ingénieur Système H/F,fortil group,"Pont-Rousseau, Rezé","Vos responsabilités métier Au sein de l'équipe Innovation du département Corporate R&D, vous jouerez un rôle essentiel dans le développement de nouveaux concepts et solutions pour la création de nouveaux produits. Responsabilités principales : Développement et validation : - Piloter/spécifier le développement du système de commande des machines. - Concevoir l'architecture des systèmes électriques. - Réaliser le dimensionnement et les CDC des composants. - Garantir la conformité des systèmes aux…",35000,50000,,2024-12-21T06:22:22Z,https://www.adzuna.fr/details/4985214891?utm_medium=api&utm_source=e1ad5111,Emplois Informatique,data mining,fr,data mining,standard,False,False
Tech Lead Data Analyst H/F,JEMS Group,"Rhône, Auvergne-Rhône-Alpes","Nous avons la conviction que chaque entreprise peut adopter une démarche innovante de gestion de la donnée et créer des cas d'usage disruptifs en réduisant l'impact écologique et en diminuant la dette technique. Nous comptons plus de 840 collaborateurs en mission chez nos clients grands comptes dans tout secteur d'activité : banque, assurance, santé, énergie, e-commerce, automobile, luxe, retail, transport, agritech Vos missions Nous recherchons un(e) Tech Lead Data Analyst capable de trouver d…",,,,2025-03-08T05:24:11Z,https://www.adzuna.fr/details/5082139878?utm_medium=api&utm_source=e1ad5111,Unknown,data mining,fr,data mining,standard,False,False
Directeur administratif et financier (f / h) (CDI),GAN ASSURANCE,"Gennevilliers, Nanterre","Forvia, a sustainable mobility technology leader Our Group Data Office & Digital Transformation is looking for a Data Engineer Apprentice to join the Data Program Team at our Bercy site in Paris. New trends and expectations are reshaping the automotive industry. Inspired by the exciting new challenges associated with this revolution, FORVIA anticipates the future of mobility by developing cutting-edge solutions for smart life on board and sustainable mobility. If you’re willing to contribute an…",,,,2025-02-20T09:33:18Z,https://www.adzuna.fr/land/ad/5057319201?se=7PLMRO8o8BGT4w9x5LWCew&utm_medium=api&utm_source=e1ad5111&v=0972BFFACF6291E0DFF0DEC96FADB12145D6C248,Emplois Comptabilité et Finance,data mining,fr,data mining,standard,False,False
