title,company,location,description,salary_min,salary_max,contract_type,created,redirect_url,category,specialty
Frontend Engineer,Lightning AI,"London, UK","Who We Are Lightning AI is the company reimagining the way AI is built. After creating and releasing PyTorch Lightning in 2019, Lightning AI was launched to reshape the development of artificial intelligence products for commercial and academic use. We are on a mission to simplify AI development, making it accessible to everyone—from solo researchers to large enterprises. By removing the complexity of building and deploying AI tools, we empower innovators to focus on solving real-world problems…",40049.36,40049.36,,2025-01-29T16:56:16Z,https://www.adzuna.co.uk/jobs/details/5028485197?utm_medium=api&utm_source=e1ad5111,IT Jobs,frontend
Frontend Engineer,9fin,"London, UK","About 9fin The world's largest asset class, debt, operates with the worst data. Technology has revolutionized equity markets with electronic trading, quant algos and instantaneous news. However, in debt capital markets, the picture is completely different. It still behaves like it’s in the 1980s; trillions of dollars of trades are placed over the phone, news is slow, and corporate credit information is imperfect and scattered. Our mission is to change this. 9fin's proprietary technology deliver…",51770.17,51770.17,,2025-04-20T09:20:50Z,https://www.adzuna.co.uk/jobs/details/5154268533?utm_medium=api&utm_source=e1ad5111,IT Jobs,frontend
Frontend Developer,Money Advice Trust,"Ladywood, Birmingham","Frontend Developer Birmingham (hybrid) Salary: £40,755 per annum 1 year fixed term contract (maternity cover) This is a maternity cover position expected to last up to 12 months, with the possibility of an earlier end date depending on the return of the post-holder Closing Date: Thursday 1st May 2025 About the Role We’re looking for a talented Frontend Developer to join our team If you love coding, designing great user experiences, and working on meaningful projects, this could be the perfect r…",40755,40755,contract,2025-04-17T20:53:23Z,https://www.adzuna.co.uk/jobs/details/5150525540?utm_medium=api&utm_source=e1ad5111,IT Jobs,frontend
Frontend Developer,Money Advice Trust,"Birmingham, West Midlands","Frontend Developer Birmingham (hybrid) ?? Salary: £40,755 per annum 1 year fixed term contract (maternity cover) This is a maternity cover position expected to last up to 12 months, with the possibility of an earlier end date depending on the return of the post-holder Closing Date: Thursday 1st May 2025 About the Role We’re looking for a talented Frontend Developer to join our team If you love coding, designing great user experiences, and working on meaningful projects, this could be the perfec…",40755,40755,contract,2025-04-17T19:38:58Z,https://www.adzuna.co.uk/jobs/details/5150219289?utm_medium=api&utm_source=e1ad5111,IT Jobs,frontend
Frontend Developer,Money Advice Trust,"Birmingham, West Midlands","Frontend Developer Birmingham (hybrid) Salary: £40,755 per annum 1 year fixed term contract (maternity cover) This is a maternity cover position expected to last up to 12 months, with the possibility of an earlier end date depending on the return of the post-holder Closing Date: Thursday 1st May 2025 About the Role Were looking for a talented Frontend Developer to join our team If you love coding, designing great user experiences, and working on meaningful projects, this could be the perfect ro…",40000,40000,contract,2025-04-18T02:31:55Z,https://www.adzuna.co.uk/jobs/details/5150863220?utm_medium=api&utm_source=e1ad5111,IT Jobs,frontend
Frontend Developer,The Portfolio Group,"Manchester, Greater Manchester","Portfolio are proud to be representing our clients who are a Software provider based in the heart of Manchester, providing people solutions to over 100,000 clients worldwide and they're looking for a frontend developer. The role is paying up to £55,000 and is 5 days a week in the office. Essential: Client-side Javascript/Typescript Modern React Development (Hooks, Context, React Query) Unit & Component testing using React Testing Library Advanced version control using Git. Working with third pa…",50000,55000,permanent,2025-04-01T21:15:40Z,https://www.adzuna.co.uk/jobs/details/5122854708?utm_medium=api&utm_source=e1ad5111,IT Jobs,frontend
Frontend Developer,The Portfolio Group,"Rusholme, Manchester","Portfolio are proud to be representing our clients who are a Software provider based in the heart of Manchester, providing people solutions to over 100,000 clients worldwide and they're looking for a frontend developer. The role is paying up to £55,000 and is 5 days a week in the office. Essential: Client-side Javascript/Typescript Modern React Development (Hooks, Context, React Query) Unit & Component testing using React Testing Library Advanced version control using Git. Working with third pa…",50000,55000,,2025-04-01T17:13:12Z,https://www.adzuna.co.uk/jobs/details/5121779430?utm_medium=api&utm_source=e1ad5111,IT Jobs,frontend
Frontend Developer,Computer Futures,UK,"Frontend Developer - Exciting Opportunity in AI Product-Based Company Join the technical team dedicated to excellence at a forward-thinking AI product-based company that collaborates with clients across government, non-profit, and housing sectors. This is a permanent position offering the flexibility of fully remote work. The company is small and growing, so the right person will be friendly, flexible, hard-working and open to fast-paced environments Essential Skills: 4 years of experience Reac…",55000,65000,permanent,2025-04-04T21:08:52Z,https://www.adzuna.co.uk/jobs/details/5129881766?utm_medium=api&utm_source=e1ad5111,IT Jobs,frontend
Frontend Engineer,Simply Business,"London, UK","You will be working as part of our Front End Tooling team here at Simply Business, contributing to the smooth running of our business and improving our insurance app through the development and deployment of reusable frontend components. Our Frontend Tech stack is built with Typescript and React Our Backend Tech stack is built with Ruby on Rails, MongoDB and hosted on AWS As one of our Frontend Engineers you’ll: develop our products using best practices, appropriate tools and technologies work …",47490.99,47490.99,,2025-03-27T11:25:05Z,https://www.adzuna.co.uk/jobs/details/5113389752?utm_medium=api&utm_source=e1ad5111,IT Jobs,frontend
Frontend Engineer,Conduktor,"London, UK","About Conduktor Conduktor is an Enterprise Data Management (EDM) platform that specialises in streaming. We empower industry leaders to implement their Streaming Data Strategy with a comprehensive approach to data control, compliance, and security; unconstrained by their infrastructure providers. Our platform mitigates data security risks while enhancing communication, automation, and observability across data flows, enabling teams to collaborate effortlessly across the organisation. We have hu…",63002.58,63002.58,,2025-02-15T15:05:22Z,https://www.adzuna.co.uk/jobs/details/5051327946?utm_medium=api&utm_source=e1ad5111,IT Jobs,frontend
Frontend Developer,Quori,"Whitechapel, East London","Salary: 45,000 - 50,000 GBP per year Requirements: Eligible to work in the UK 3 years’ experience with Angular Node and Cordova experience Git experience Excellent written and verbal communication skills. The successful candidate must have the ability to present technical findings, methodologies, and recommendations in a concise and easily actionable manner Responsibilities: About us You will be working closely with a team of like-minded individuals to shape and improve the existing infrastruct…",45000,50000,contract,2025-04-20T02:12:24Z,https://www.adzuna.co.uk/jobs/details/5154036393?utm_medium=api&utm_source=e1ad5111,IT Jobs,frontend
Frontend Developer,DataAnnotation,"London, UK","DataAnnotation is committed to creating quality AI. Join our team to help train AI chatbots while gaining the flexibility of remote work and choosing your own schedule. We are looking for a proficient Frontend Developer to join our team to train our AI chatbots to code. You will work with the chatbots that we are building in order to measure their progress, as well as write and evaluate code. To apply to this role, you will need to be proficient in either Python and/or JavaScript. Your role wil…",49979.51,49979.51,,2025-04-12T16:48:49Z,https://www.adzuna.co.uk/jobs/details/5142141522?utm_medium=api&utm_source=e1ad5111,IT Jobs,frontend
Frontend Developer,Money Advice Trust,"Ladywood, Birmingham","1 year fixed term contract (maternity cover) This is a maternity cover position expected to last up to 12 months, with the possibility of an earlier end date depending on the return of the post-holder Closing Date: Thursday 1st May 2025 About the Role We&rsquo;re looking for a talented Frontend Developer to join our team If you love coding, designing great user experiences, and working on meaningful projects, this could be the perfect role for you As Frontend Developer you'll be helping to deve…",41773,41773,contract,2025-04-18T16:20:34Z,https://www.adzuna.co.uk/jobs/details/5151732249?utm_medium=api&utm_source=e1ad5111,IT Jobs,frontend
Frontend Developer,MACKENZIE JONES IT LIMITED,"Glasgow, Scotland",Frontend Developer. Circa £40k  Benefits Package. Fully Remote. Permanent. T6/MN/1151099. Innovative Data & Insights Research organization providing Insights for leading International Brands require a talented & experienced Front-End Developer. Role: Front End Development. Focus on superior User Experience Design/Development. Partner with a team of Software Engineers - developing exceptional Front-End Interfaces. User Interfaces - Design & Construct intuitive & responsive User Interfaces. Deplo…,40000,40000,permanent,2025-04-02T07:31:57Z,https://www.adzuna.co.uk/jobs/details/5123659007?utm_medium=api&utm_source=e1ad5111,IT Jobs,frontend
Frontend Developer,Mackenzie Jones IT,"Glasgow, Scotland",Frontend Developer. Circa £40k  Benefits Package. Fully Remote. Permanent. T6/MN/(phone number removed). Innovative Data & Insights Research organization providing Insights for leading International Brands require a talented & experienced Front-End Developer. Role: Front End Development. Focus on superior User Experience Design/Development. Partner with a team of Software Engineers - developing exceptional Front-End Interfaces. User Interfaces - Design & Construct intuitive & responsive User In…,40000,40000,permanent,2025-04-01T17:13:18Z,https://www.adzuna.co.uk/jobs/details/5121780346?utm_medium=api&utm_source=e1ad5111,IT Jobs,frontend
Frontend Engineer,Just Eat Holding Limited,"Bristol, South West England","Ready for a challenge? Then Just Eat Takeaway.com might be the place for you. We’re a leading global online food delivery platform, and our vision is to empower everyday convenience. Whether it’s a Friday-night feast, a post-gym poke bowl, or grabbing some groceries, our tech platform connects tens of millions of customers with hundreds of thousands of restaurant, grocery and convenience partners across the globe. About this role Just Eat Takeaway is looking to hire a Mid-level Frontend (Web) E…",38735.33,38735.33,,2025-02-14T14:40:39Z,https://www.adzuna.co.uk/jobs/details/5049814372?utm_medium=api&utm_source=e1ad5111,IT Jobs,frontend
Frontend Engineer,Checkout.com,"London, UK","We're currently looking for a Front-End Engineer who has a curious nature and is passionate about working in an Engineering environment which focuses on building products to achieve the company's strategic goals. You’ll get to work with teams from across Checkout.com’s portfolio of products and services who all have a real customer first philosophy. About the role: As a Front-End Software Engineer embedded within a multifunctional team, you will collaborate with Product and Design counterparts …",44298.99,44298.99,,2025-04-11T15:58:35Z,https://www.adzuna.co.uk/jobs/details/5140549501?utm_medium=api&utm_source=e1ad5111,IT Jobs,frontend
Frontend Lead,dentsu,UK,"Company Description Merkle , a dentsu company, is a leading data-driven customer experience management enterprise specializing in delivering unique, personalized customer experiences across platforms and devices. With over 30 years of experience, Merkle partners with Fortune 1000 companies and non-profit organizations to optimize their customer portfolios. Its expertise in data, technology, and analytics enables it to gain insights into consumer behavior, driving hyper-personalized marketing st…",55595.93,55595.93,,2023-11-21T16:33:39Z,https://www.adzuna.co.uk/jobs/details/4445062247?utm_medium=api&utm_source=e1ad5111,IT Jobs,frontend
Frontend Engineer,YunoJuno,"Oxford Circus, Central London","YunoJuno powers The Future of Work. What started as a platform to connect the best freelancers with forward-thinking companies has now redefined how businesses source and manage their entire contingent workforce. Whether it’s building a new department at a creative startup or building an enterprise solution for the world’s largest communications network, we use technology to power the freelance revolution. About the role: We’re looking for a delivery-focused React JavaScript engineer that would…",41696.68,41696.68,contract,2024-08-09T22:11:08Z,https://www.adzuna.co.uk/jobs/details/4819275161?utm_medium=api&utm_source=e1ad5111,IT Jobs,frontend
Frontend Engineer,Kitman Labs,"Manchester, Greater Manchester","Kitman Labs is a global human performance company, disrupting and transforming the way the sports industry uses data to increase the performance of the world's top athletes. Driven by a passion to innovate in the areas of sports performance, analytics and user experience, we have assembled a team of the industry’s top data scientists, sports performance scientists, product specialists and engineers. The company received recognition by Fast Company in 2019 as one of the most innovative companies…",34622.9,34622.9,,2024-09-13T13:26:55Z,https://www.adzuna.co.uk/jobs/details/4862473335?utm_medium=api&utm_source=e1ad5111,IT Jobs,frontend
Frontend Engineer,Stint,"London, UK","Department Engineering Employment Type Full Time Location London, UK Workplace type Onsite Compensation £50,000 - £80,000 / year What you will be doing This position might suit you, if you: What we can offer you About Stint Stint was founded to empower students to work flexibly around their university studies and life commitments. But today, it’s not just the lives of students we're revolutionising. We're on a mission to transform the whole hospitality industry - helping everyone from local pub…",50000,80000,,2024-10-10T13:19:08Z,https://www.adzuna.co.uk/jobs/details/4897344861?utm_medium=api&utm_source=e1ad5111,Hospitality & Catering Jobs,frontend
Frontend Engineer,Harnham - Data & Analytics Recruitment,"London, UK","Front-End Developer Salary: £120,000 (Flexible) Location: Hybrid 1-3 days a week (Central London) We're hiring on behalf of a fast-moving tech company building creative, AI-powered tools. They're looking for a Front-End Developer with strong React skills and experience in high-performance graphics rendering. Role Overview: You'll develop and optimize a web-based graphics tool focused on performance, interactivity, and clean UI. Ideal for someone with React, WebGL or Canvas experience, and a pas…",110000,120000,permanent,2025-04-08T00:19:07Z,https://www.adzuna.co.uk/jobs/details/5134397356?utm_medium=api&utm_source=e1ad5111,IT Jobs,frontend
Frontend Team Lead,Secondmind,"Trumpington, Cambridge","We are pleased to confirm that this position has been created as a result of company wide growth. Location: We offer a hybrid working environment, with a flexible work schedule to support a work life balance within the UK. The Secondmind office is based in Cambridge, a few minutes walk from the train station. About Secondmind Secondmind exists to help automotive innovators design better cars faster and achieve greater sustainability through machine learning. We are driven by a desire to achieve…",50327.33,50327.33,,2025-01-27T15:33:35Z,https://www.adzuna.co.uk/jobs/details/5025785097?utm_medium=api&utm_source=e1ad5111,IT Jobs,frontend
Senior Frontend Developer,Pearson Carter,"London, UK","Senior Frontend Developer Pearson Carter are currently working with a leading Law Firm in London. They are looking to grow their team as they are expanding their services. They are looking for someone who has at least 2 years commercial experience in Frontend Engineering and is ready to broaden their experience. They offer Competitive salary, Bonus, and Flexible Hybrid working Get in touch if you’re looking for your next opportunity Responsibilities: Lead the development and deployment of intui…",60000,75000,permanent,2025-03-31T12:37:31Z,https://www.adzuna.co.uk/jobs/details/5119770787?utm_medium=api&utm_source=e1ad5111,IT Jobs,frontend
Frontend Developer - Tebex,Overwolf,"Nottingham, Nottinghamshire","We're on the hunt for a brave Frontend Developer to join the Tebex team and take our ever-evolving platform to exciting new heights. As our Frontend Champion, you'll spearhead the development of innovative features with your epic coding skills, ensuring our products not only meet but exceed our high standards of user experience. So if you're renowned for your meticulous code craftsmanship, fueled by a drive to conquer new tech frontiers, and can clear entire dungeons with your Vue.js magic – co…",42278.05,42278.05,,2025-04-16T10:49:22Z,https://www.adzuna.co.uk/jobs/details/5147101580?utm_medium=api&utm_source=e1ad5111,IT Jobs,frontend
Senior Frontend Developer,OnBuy,UK,"Who are OnBuy? OnBuy are an online marketplace who are on a mission of being the best choice for every customer, everywhere. We have recently been named one of the UK's fastest-growing tech companies in the Sunday Times 100 Tech list. All achievements we are very proud of, but we don't let that go to our head. We are all laser focused on our mission and understand the huge joint effort ahead of us needed to succeed. Working at OnBuy: We are a team of driven and motivated people who thrive when …",50000,55000,,2025-04-03T15:33:12Z,https://www.adzuna.co.uk/jobs/details/5126448490?utm_medium=api&utm_source=e1ad5111,IT Jobs,frontend
Frontend Testing Engineer,CloudHire,"London, UK","Role - Frontend Testing Engineer We are seeking a skilled Frontend Testing Engineer with expertise in either Cypress or Playwright to join our dynamic team. As a crucial member of our QA team, you will be responsible for ensuring the quality and reliability of our front-end applications through rigorous testing methodologies. We are looking for an engineer that can lead front-end testing projects from inception to implementation and maintenance. Optional requirements include experience in AWS i…",65000,90000,,2024-08-13T17:51:56Z,https://www.adzuna.co.uk/jobs/details/4823876797?utm_medium=api&utm_source=e1ad5111,IT Jobs,frontend
Sr. Frontend Engineer,Reown,UK,"Welcome to Reown, the onchain UX platform. Reown, formerly known as WalletConnect Inc., is a leading provider of tools and technologies that enable seamless, secure, and intuitive digital ownership experiences. With a mission to make blockchain technology accessible and user-friendly, we have established a comprehensive network with 254M Total Connections, 37M Global Active Users, and 4.7M Unique Monthly Wallets, spanning 57k Connected dApps and 600 Wallets for users to choose to connect with. …",57795.34,57795.34,,2025-04-03T18:42:29Z,https://www.adzuna.co.uk/jobs/details/5127198100?utm_medium=api&utm_source=e1ad5111,IT Jobs,frontend
Principal Frontend Engineer,Matillion,"Manchester, Greater Manchester","Matillion is The Data Productivity Cloud. We are on a mission to power the data productivity of our customers and the world, by helping teams get data business ready, faster. Our technology allows customers to load, transform, sync and orchestrate their data. We are looking for passionate, high-integrity individuals to help us scale up our growing business. Together, we can make a dent in the universe bigger than ourselves. About the Role The Principal Frontend Engineer has responsibility for t…",93600,140400,,2025-02-16T14:42:10Z,https://www.adzuna.co.uk/jobs/details/5052478958?utm_medium=api&utm_source=e1ad5111,IT Jobs,frontend
Senior Frontend Engineer,AJ Bell,UK,"Job Description We're now recruiting a Senior Frontend Engineer to join our Investcentre team and help in enhancing our successful award-winning platform. You will be joining a team which has a philosophy of continuous improvement, and a strong focus on engineering excellence. What does the job involve? Agile methodologies and a passion for continuous improvement and working in a high-performance engineering team Work with the team to design and deliver high quality products At AJ Bell we pair,…",44425.74,44425.74,,2025-03-25T00:01:55Z,https://www.adzuna.co.uk/jobs/details/5109444479?utm_medium=api&utm_source=e1ad5111,IT Jobs,frontend
Frontend Testing Engineer,CloudHire,"London, UK","We are seeking a skilled Frontend Testing Engineer with expertise in either Cypress or Playwright to join our dynamic team. As a crucial member of our QA team, you will be responsible for ensuring the quality and reliability of our front-end applications through rigorous testing methodologies. We are looking for an engineer that can lead front-end testing projects from inception to implementation and maintenance. Experience in AWS infrastructure management, CI/CD pipelines, Chef scripting and p…",65000,90000,,2024-08-13T20:29:19Z,https://www.adzuna.co.uk/jobs/details/4824225546?utm_medium=api&utm_source=e1ad5111,IT Jobs,frontend
Frontend Software Engineer,Nuclera,"Cambridge, Cambridgeshire","We’re looking for a skilled Frontend Developer with expertise in TypeScript and React to build and enhance the cutting-edge design and analysis tools behind our revolutionary eProtein Discovery platform. Join us in shaping the future of protein prototyping technology Nuclera is a venture-backed, founder-driven biotech company headquartered in Cambridge, UK with significant operations in Boston, USA. The company’s mission is to improve human health by making proteins accessible. We are beginning…",62783,62783,,2025-02-18T11:09:03Z,https://www.adzuna.co.uk/jobs/details/5054780694?utm_medium=api&utm_source=e1ad5111,IT Jobs,frontend
Senior Frontend Developer,OneID Limited,UK,"At OneID®, we are empowering everyone to control their online identity. Our digital identity solution allows people in the UK to simply prove who they are online. We are building a diverse team to make a positive impact on society, by simplifying and securing people’s digital lives. We value our people and the unique perspectives they each bring. If you want to make a difference and use digital identity to improve society, we want to hear from you. We are looking for someone to join our develop…",85000,85000,,2025-01-07T05:18:27Z,https://www.adzuna.co.uk/jobs/details/5000355011?utm_medium=api&utm_source=e1ad5111,IT Jobs,frontend
Frontend Engineer (Drive),Proton,"London, UK","Join Proton and build a better internet where privacy is the default At Proton, we believe that privacy is a fundamental human right and the cornerstone of democracy. Since our inception in 2014, founded by a team of scientists from CERN, we have dedicated ourselves to providing free and open-source technology to millions worldwide, ensuring access to privacy, security, and freedom online. Our journey began with Proton Mail, the largest secure email service globally, and has since expanded to i…",70394.74,70394.74,,2025-03-05T17:04:39Z,https://www.adzuna.co.uk/jobs/details/5077536147?utm_medium=api&utm_source=e1ad5111,IT Jobs,frontend
Frontend Engineer (Account),Proton,"London, UK","Join Proton and build a better internet where privacy is the default At Proton, we believe that privacy is a fundamental human right and the cornerstone of democracy. Since our inception in 2014, founded by a team of scientists from CERN, we have dedicated ourselves to providing free and open-source technology to millions worldwide, ensuring access to privacy, security, and freedom online. Our journey began with Proton Mail, the largest secure email service globally, and has since expanded to i…",69981.95,69981.95,,2025-03-05T17:17:43Z,https://www.adzuna.co.uk/jobs/details/5077576466?utm_medium=api&utm_source=e1ad5111,IT Jobs,frontend
Fullstack Engineer - Frontend,Gattaca PBS,"London, UK","Founding Engineer (AI EdTech Scale-Up) Company Overview: An exciting AI-powered EdTech company, founded just over 2 years ago, is on a rapid growth trajectory. With over 1 million users and £4 million in total funding, this innovative startup is gearing up for Series A and is looking to expand its Engineering team. After an explosive year of growth, they are seeking two talented Founding Engineers to join their small but dynamic team of 7 (including 5 Engineers) to help scale the company furthe…",90000,120000,permanent,2025-03-24T17:44:24Z,https://www.adzuna.co.uk/jobs/details/5108979691?utm_medium=api&utm_source=e1ad5111,IT Jobs,frontend
