title,company,location,description,salary_min,salary_max,contract_type,created,redirect_url,category,specialty,source_country,query,query_type,remote_friendly,international
Pricing Analyst,Wesco,"Bracknell, Berkshire","Job Description As a Pricing Analyst you will be responsible for using advanced data mining and analysis skills to maximize margins through price setting. You will analyze new and existing pricing and implements updates in accordance with established pricing strategies. You will work with pricing management to ensure data accuracy, integrity, and consistency. Responsibilities Performs advanced analytics of margin opportunities and provides recommendations for improvement. Creates, implements, a…",41846.55,41846.55,,2025-04-11T00:34:37Z,https://www.adzuna.co.uk/jobs/details/5139756712?utm_medium=api&utm_source=e1ad5111,IT Jobs,data mining,gb,data mining,standard,False,False
Legal Entity Controller - Director,Morgan Stanley,"Glasgow, Scotland","The Legal Entity Controller team has responsibility for the financial management of selected entities, reporting to a Legal Entity Officer (LEO). The candidate will be responsible for a portfolio of entities in various jurisdictions, including regulated entities. They will be a key business partner for various stakeholders on a wide range of legal entity initiatives. About Morgan Stanley Morgan Stanley is a leading global financial services firm providing a wide range of investment banking, sec…",50359.16,50359.16,,2025-05-03T15:49:57Z,https://www.adzuna.co.uk/jobs/land/ad/5178673525?se=yPONM-8o8BGFil_oKXcHCQ&utm_medium=api&utm_source=e1ad5111&v=5883D0D81CB04EF42F4F11C6B0195BE6CCA87FBC,Accounting & Finance Jobs,data mining,gb,data mining,standard,False,True
Finance Analyst,Honeywell,UK,"Key Responsibilities Include only critical activities of the job Prepare and publish daily/ weekly/monthly financials (Sales, Orders, Functional Cost etc.) Refresh and maintain monthly financial dashboards Provide value-added service by contributing to the financial and operational insight and maintaining strong relationship with client Support any ad-hoc requests for data mining / analysis Identify opportunities for process improvement: transformation, automation, standardization and decommiss…",42477.45,42477.45,,2023-11-13T15:51:21Z,https://www.adzuna.co.uk/jobs/details/4429844907?utm_medium=api&utm_source=e1ad5111,IT Jobs,data mining,gb,data mining,standard,False,False
"Data Scientist, MSAT",Orchard Therapeutics,"London, UK","Location: London (Hybrid) Reporting to: Senior Director of MSAT Job Summary The Data Scientist will support the MSAT organisation at Orchard Therapeutics and will lead data-driven initiatives to support process and analytical control strategy development, trend monitoring, manufacturing investigations and lifecycle management of cell and gene therapy products. This role will be the primary point of contact for the development and implementation of a centralised manufacturing data repository, en…",50668.87,50668.87,,2025-04-17T15:52:26Z,https://www.adzuna.co.uk/jobs/details/5149756471?utm_medium=api&utm_source=e1ad5111,Scientific & QA Jobs,data mining,gb,data mining,standard,False,False
Engineer - Dare,Dare,"London, UK","City of London Permanent, Full-time - Onsite Who we are: We are an energy trading company generating liquidity across global commodities markets. We combine deep trading expertise with proprietary technology and the power of data science to be the best-in-class. Our understanding of volatile, data-intensive markets is a key part of our edge. At Dare, you will be joining a team of ambitious individuals who challenge themselves and each other. We have a culture of empowering exceptional people to…",50995.51,50995.51,permanent,2025-05-02T18:23:22Z,https://www.adzuna.co.uk/jobs/land/ad/5176639789?se=yPONM-8o8BGFil_oKXcHCQ&utm_medium=api&utm_source=e1ad5111&v=39538BAB0C03D4E3767893EF68FFF35A9330544E,IT Jobs,data mining,gb,data mining,standard,False,True
Senior Business Analyst - Citi,Citi,UK,"Organization & Department Overview The ISG, Information Services Group, Data Solutions organization aims to support Citi on its journey to adopt a data driven culture by delivering innovative technology solutions and simplifying access to quality data and business intelligence. The ISG organization works in partnership with data clients across Citi business lines deploying solutions to increase their competitiveness, through restructuring business processes, simplifying information access, and …",39912.82,39912.82,,2025-04-29T14:29:52Z,https://www.adzuna.co.uk/jobs/land/ad/5168658177?se=yPONM-8o8BGFil_oKXcHCQ&utm_medium=api&utm_source=e1ad5111&v=214A0E6490DD384327B53A57ECCDB3BB39B67BD9,IT Jobs,data mining,gb,data mining,standard,False,False
Delegate Marketing Manager,Tiger Recruitment,"London, UK","Our client, a leading charity paving the way for UK businesses, are looking to hire a Delegate Marketing Manager to join their team! Role: Delegate Marketing Manager Salary: £38,000 - £42,000 per annum Where: Tower Bridge, City of London When: Monday - Friday / 3 days in office / Every other Friday off  Benefits: Great holiday package with xmas and NY close down / flexi-working / wonderful team / enhanced parental leave packages  so much more What you'll do: Drive their mission to utilise stake…",39058.39,39058.39,,2025-04-18T09:11:52Z,https://www.adzuna.co.uk/jobs/land/ad/5151275327?se=yPONM-8o8BGFil_oKXcHCQ&utm_medium=api&utm_source=e1ad5111&v=E2DC6EC72D55CD7892976970504AD0A2F9E7D465,"PR, Advertising & Marketing Jobs",data mining,gb,data mining,standard,False,False
Store Manager,BlackBear,"London, UK",Description Position at Fortis Solutions Group  DO NOT APPLY! THIS IS A TEST JOB POSTING Data Analyst Job Summary Our growing technology firm is looking for an experienced Data Analyst who is able to turn project requirements into custom-formatted data reports. The ideal candidate for this position is able to do complete life cycle data generation and outline critical information for each Project Manager. We also need someone who is able to analyze business procedures and recommend specific typ…,41511.12,41511.12,,2025-03-13T15:16:51Z,https://www.adzuna.co.uk/jobs/details/5091592799?utm_medium=api&utm_source=e1ad5111,IT Jobs,data mining,gb,data mining,standard,False,False
Automotive Deal Clerk / Book Keeper,BlackBear,"London, UK",Description Position at Manatt Phelps & Phillips LLP  DO NOT APPLY! THIS IS A TEST JOB POSTING Data Analyst Job Summary Our growing technology firm is looking for an experienced Data Analyst who is able to turn project requirements into custom-formatted data reports. The ideal candidate for this position is able to do complete life cycle data generation and outline critical information for each Project Manager. We also need someone who is able to analyze business procedures and recommend specif…,35913.44,35913.44,,2025-03-12T15:38:55Z,https://www.adzuna.co.uk/jobs/details/5088964888?utm_medium=api&utm_source=e1ad5111,IT Jobs,data mining,gb,data mining,standard,False,False
"Director, IT Due Diligence & Technology Performance Improvement",BlackBear,"London, UK",Description Position at Manatt Phelps & Phillips LLP  DO NOT APPLY! THIS IS A TEST JOB POSTING Data Analyst Job Summary Our growing technology firm is looking for an experienced Data Analyst who is able to turn project requirements into custom-formatted data reports. The ideal candidate for this position is able to do complete life cycle data generation and outline critical information for each Project Manager. We also need someone who is able to analyze business procedures and recommend specif…,41328.66,41328.66,,2025-03-12T15:33:00Z,https://www.adzuna.co.uk/jobs/details/5088957779?utm_medium=api&utm_source=e1ad5111,IT Jobs,data mining,gb,data mining,standard,False,False
Senior Software Engineer II,BlackBear,"London, UK",Description Position at Ab Initio Data Analyst Job Summary Our growing technology firm is looking for an experienced Data Analyst who is able to turn project requirements into custom-formatted data reports. The ideal candidate for this position is able to do complete life cycle data generation and outline critical information for each Project Manager. We also need someone who is able to analyze business procedures and recommend specific types of data that can be used to improve upon them. Data …,41505.02,41505.02,,2025-03-13T15:14:04Z,https://www.adzuna.co.uk/jobs/details/5091588678?utm_medium=api&utm_source=e1ad5111,IT Jobs,data mining,gb,data mining,standard,False,False
Loss Prevention Investigator,Waterstones,"Leeds, West Yorkshire","Loss Prevention Investigator Permanent Based in Leeds, Bradford or York We are looking for a Loss Prevention Investigator to join our friendly and dynamic team here at Waterstones in Leeds. Looking after stores across Yorkshire including Leeds, Bradford, York and Hull your role will be to protect staff, customers, property, and the business by ensuring that all physical security equipment is in working condition, following up on all workplace incidents and advising teams how best to respond to …",40985.03,40985.03,permanent,2025-05-01T06:56:16Z,https://www.adzuna.co.uk/jobs/land/ad/5171939808?se=yPONM-8o8BGFil_oKXcHCQ&utm_medium=api&utm_source=e1ad5111&v=DA01BA6D5CD5EA5FB71A83BD731C308AE381445B,Retail Jobs,data mining,gb,data mining,standard,False,False
"Senior Financial Analyst, World-Wide Operations Sustainability Finance",Amazon,"London, UK",Description Are you interested in pioneering new products and programs to help Amazon become the industry leader in sustainable operations? Are you interested in the science of sustainability and passionate about innovating on behalf of our customers to solve this global problem? Amazon is seeking a high performing Senior Finance Analyst to partner with the World-Wide Sustainability Operations team supporting our carbon emissions reduction goals. As a Senior Financial Analyst of WW Operations S…,53460.77,53460.77,,2025-04-08T20:24:40Z,https://www.adzuna.co.uk/jobs/details/5135820240?utm_medium=api&utm_source=e1ad5111,Accounting & Finance Jobs,data mining,gb,data mining,standard,False,True
"Senior Financial Analyst, AWS Finance",Amazon,"London, UK",Description Are you looking for that next big Finance opportunity? Looking for a business partnering role and the ability to make an impact on one of the fastest growing divisions within Amazon? Want to directly influence the future of the EMEA AWS organization? Come join AWS EMEA AWS Finance seeks a world class Senior Financial Analyst to be a key member of its team supporting our fast-growing Commercial Sales Organization for EMEA Small to Medium Business segment. Read more about AWS here: ht…,59146.01,59146.01,,2025-04-03T20:20:27Z,https://www.adzuna.co.uk/jobs/details/5127697690?utm_medium=api&utm_source=e1ad5111,Accounting & Finance Jobs,data mining,gb,data mining,standard,False,False
Account Executive,ITP Media Group,"Farringdon, Central London","ITP Media Group, stands as a dynamic forward-thinking player in the media industry, dedicated to creating impactful content that resonates with audiences worldwide. We produce a range of business-to-business websites, magazines, and events focused on luxury fashion and jewellery, healthcare, hospitality, and catering for professionals. As part of an expansion strategy across the hospitality and catering equipment group of publications and events, we are looking for a highly motivated Account ex…",32325.93,32325.93,permanent,2025-04-24T08:54:32Z,https://www.adzuna.co.uk/jobs/details/5159717959?utm_medium=api&utm_source=e1ad5111,Hospitality & Catering Jobs,data mining,gb,data mining,standard,False,True
Big Data Analyst,Nexus Jobs Limited,"London, UK",Job Description Big Data Scientist - Docklands London Our Client an international organisation is looking to recruit a Big Data Expert with 2 to 5 years expertise as a Big Data Scientist. You will have Natural Language Processing (NLP) knowledge and experience and understand and analyse large data sets to discover new insights. Working in a multi-disciplinary team within a highly technical and complex environment. Well versed in scalable data mining and machine learning techniques (using comput…,300,450,permanent,2025-05-01T21:58:04Z,https://www.adzuna.co.uk/jobs/details/5174665629?utm_medium=api&utm_source=e1ad5111,IT Jobs,data mining,gb,data mining,standard,False,True
Stock Controller/Administrator - Rainham (RM13),A1 PERSONNEL EMPLOYMENT AGENCY LIMITED,"Rainham, Gillingham","Job description Job title: Stock Controller/Administrator Location: Rainham (RM13) Salary: £13 per hour Hours: Monday to Friday, 08:30 - 17:30, immediate start, temp to perm role Overview We are seeking a dedicated and detail-oriented Stock Controller to join one of our clients based in Rainham area. The ideal candidate will play a crucial role in maintaining the organisation and presentation of our inventory. This position involves ensuring that products are stocked efficiently and effectively…",27040,27040,contract,2025-03-29T12:17:37Z,https://www.adzuna.co.uk/jobs/details/5117838725?utm_medium=api&utm_source=e1ad5111,Logistics & Warehouse Jobs,data mining,gb,data mining,standard,False,False
UI Application Developer,Investigo,"Bermuda Park, Nuneaton","UI Application Developer Location: Coventry (4 Days a Week) Salary: up to £70,000  Benefits Investigo are working with a global technology business based in the Midlands in search of a UI Developer to come and join their new team. Our client are leaders in their industry with a global presence. They offer systems that are used by some of the largest brands in the Automobile sector. We are looking to assist them in growing out a new data focused team to ultimate service the pipeline of clients i…",60000,70000,,2025-04-09T17:43:00Z,https://www.adzuna.co.uk/jobs/land/ad/5137291952?se=yPONM-8o8BGFil_oKXcHCQ&utm_medium=api&utm_source=e1ad5111&v=1E83FC0E31B194A6EC62A46A90CD1395C9899CF3,IT Jobs,data mining,gb,data mining,standard,False,True
Lead Data Engineer,Cooper Lomaz Recruitment Ltd,"West Pottergate, Norwich","Lead Data Developer Norwich - Hybrid Lead Data Engineer required to play an integral role in this businesses data-driven journey for a large and exciting strategic project transforming raw data into actionable insights. Some of your duties will be to lead and implement ongoing management data strategy, analyse raw data to unearth valuable trends and patterns along with design, build and maintain robust data systems. Skills Required: Proven track record as a Lead Data Engineer ideally within a d…",48072.34,48072.34,,2025-04-24T18:03:08Z,https://www.adzuna.co.uk/jobs/land/ad/5160306612?se=yPONM-8o8BGFil_oKXcHCQ&utm_medium=api&utm_source=e1ad5111&v=1519859041225753EE3CC805F2AB8A68ADC821CB,IT Jobs,data mining,gb,data mining,standard,False,False
CRM Executive,ASOS,"London, UK","Job Description The CRM Team forms part of the Performance Marketing function in the Brand Experience (BX) department and is responsible for taking customer, campaign and channel insights and using them to devise a global strategy for engaging, converting and retaining customers via targeted messaging across all touchpoints. Central to the ASOS strategy is to give customers the confidence to be who they want to be and, as such, customer insight is at the heart of enabling that. This is used at …",36885.59,36885.59,,2025-04-10T02:02:14Z,https://www.adzuna.co.uk/jobs/details/5138012294?utm_medium=api&utm_source=e1ad5111,"PR, Advertising & Marketing Jobs",data mining,gb,data mining,standard,False,True
Customer Assurance Analyst,Micro IT Global,"London, UK","Primary role purpose: Reporting to the Head of Customer Performance Analysis and Improvement (CPAI) the Analyst will support business analysts and play a significant role in improving CSAT and making our client a low effort business to work with. Acting as the customers representative to flag and drive operational areas for improvement by identifying and removing operational bottlenecks. This will be achieved through identifying process, application or system improvements from CSAT survey feedb…",35830.99,35830.99,,2025-03-31T12:24:55Z,https://www.adzuna.co.uk/jobs/details/5119755516?utm_medium=api&utm_source=e1ad5111,IT Jobs,data mining,gb,data mining,standard,False,False
Junior C# Developer,Ascend Consulting,"Mytchett, Camberley","Junior C# .Net Developer, .Net, C#, SQL, Farnborough, Hampshire to £30,000 A leading engineering firm in Farnborough are requiring a Junior /Graduate .Net Developer to join their exciting team. The .Net Developer will be producing high-quality software to a required specification within timelines following the company Software Process. Position Responsibilities ·You will work within the Software Development Team reporting to the Software Manager ·Software Development primarily writing .NET comp…",25000,30000,,2025-03-23T23:11:55Z,https://www.adzuna.co.uk/jobs/land/ad/5108167276?se=yPONM-8o8BGFil_oKXcHCQ&utm_medium=api&utm_source=e1ad5111&v=6AAD6A4CFCB5B22D30249BC56CC326BD0833ABCC,IT Jobs,data mining,gb,data mining,standard,False,False
Data Warehouse Lead,Mackenzie Jones IT,"Bristol, South West England","Data Warehouse Lead - £Negotiable  Benefits. Hybrid - 2 Days onsite. Bristol, Permanent, T6/MN/(phone number removed). Role: Design & implementation of ETL/ELT processes. Centralise ERP data into Snowflake. Snowflake Data Warehouse - Architect & develop - support reporting, analytics & incorporate SQL Server. Translate business & technology requirements. System Architecture models. BI & Data - understand, qualify, design, build test & requirements. Transforming, storing & retrieving data. BI In…",60000,90000,permanent,2025-04-08T15:50:19Z,https://www.adzuna.co.uk/jobs/land/ad/5135500868?se=yPONM-8o8BGFil_oKXcHCQ&utm_medium=api&utm_source=e1ad5111&v=C2FE689FA8384E38C2CA01952D77F64617E9680D,IT Jobs,data mining,gb,data mining,standard,False,False
Data Engineer,idfc first bank,UK,"Role/ Job Title: Data Engineer Business : New Age Function/ Department: Data & Analytics Place of Work : Mumbai/Bangalore Roles & Responsibilities 'Minimum 2-3 years of Data Engineering experience Proven experience in in SQL, Spark, Hadoop ecosystem Have worked on multiple TBsof data volume from ingestion to consumption Work with business stakeholders to identify and document high impact business problems and potential solutions Good understanding of Data Lake/Lakehouse architecture and experie…",35284.06,35284.06,,2023-11-21T16:33:53Z,https://www.adzuna.co.uk/jobs/details/4445062506?utm_medium=api&utm_source=e1ad5111,IT Jobs,data mining,gb,data mining,standard,False,False
Internship: Sales Executive,Avocet Steel Strip Ltd,UK,We are a small but rapidly expanding company located in Alderley Edge supplying strategic metallic raw materials to the manufacturing industry (both domestic and international). We have a dynamic team with core values focusing on client satisfaction but also in creating a fun and friendly work environment for our team. We are looking to strengthen our team due to product and Market diversification resulting in an increase of sales and workload particularly in the area of renewable energies. The…,36231.82,36231.82,contract,2025-02-25T12:05:33Z,https://www.adzuna.co.uk/jobs/details/5062902679?utm_medium=api&utm_source=e1ad5111,Sales Jobs,data mining,gb,data mining,standard,False,True
Sales Executive,Avocet Steel Strip Ltd,"Alderley Edge, Cheshire",We are a small but rapidly expanding company located in Alderley Edge supplying strategic metallic raw materials to the manufacturing industry (both domestic and international). We have a dynamic team with core values focusing on client satisfaction but also in creating a fun and friendly work environment for our team. We are looking to strengthen our team due to product and Market diversification resulting in an increase of sales and workload particularly in the area of renewable energies. The…,36232.2,36232.2,,2023-12-28T17:21:12Z,https://www.adzuna.co.uk/jobs/details/4500004115?utm_medium=api&utm_source=e1ad5111,Sales Jobs,data mining,gb,data mining,standard,False,True
Quantitative Trader / Researcher - EMEA,Tower Research Capital,"London, UK","Tower Research Capital, a high-frequency proprietary trading firm founded in 1998, seeks talented and experienced quantitative traders and researchers. As a member of one of Tower’s trading teams, a Quantitative Trader will be using Tower’s in-house trading system—one of the fastest and most comprehensive in the world—to develop and deploy algorithmic trading strategies based on patterns in market behaviour. Responsibilities Designing, implementing, and deploying trading algorithms Exploring tr…",60861.41,60861.41,,2024-07-31T15:13:15Z,https://www.adzuna.co.uk/jobs/details/4802590771?utm_medium=api&utm_source=e1ad5111,Accounting & Finance Jobs,data mining,gb,data mining,standard,False,False
Finance Analyst,Reed,"Andover, Hampshire","Finance Analyst Annual Salary: £35,000 - £50,000 Location: Basingstoke Job Type: Full-time We are seeking a Finance Analyst to join our client's dynamic team. This role is ideal for someone who is analytical, detail-oriented, and enjoys working in a fast-paced environment. The Finance Analyst will be instrumental in providing accurate financial data and analysis to support strategic decision-making across the organisation. Day-to-day of the role: Analyse financial data and create financial mode…",35000,50000,permanent,2025-04-10T17:01:21Z,https://www.adzuna.co.uk/jobs/details/5138936218?utm_medium=api&utm_source=e1ad5111,Accounting & Finance Jobs,data mining,gb,data mining,standard,False,False
Junior Data Analyst,IT Career Switch,"Ireland, Shefford","Trainee Data Analyst - No Experience Required Are you looking to kick-start a new career as a Data Analyst?We are recruiting for companies who are looking to employ our Data Science Traineeship graduates to keep up with their growth. The best part is you will not need any previous experience as full training will be provided. You will also have the reassurance of a job guarantee (£25K-£45K) within 20 miles of your location upon completion. Whether you are working full time, part-time or unemplo…",25000,45000,permanent,2025-04-09T16:33:38Z,https://www.adzuna.co.uk/jobs/details/5137237177?utm_medium=api&utm_source=e1ad5111,IT Jobs,data mining,gb,data mining,standard,False,False
Associate Data Analyst,moodys,UK,"Role Responsibilities Support the team in BAU execution and delivering on Service level Agreement (SLA). Responsible for ensuring data’s quality and fitness for purpose of the organization's data assets, including working with Tech teams for storing the metadata for those data assets Monitoring and facilitating the improvement of data quality. Measure and report to management on the progress of data quality improvement. Monitor compliance of information flows and data stores against data qualit…",33375.77,33375.77,,2023-11-13T15:51:13Z,https://www.adzuna.co.uk/jobs/details/4429844021?utm_medium=api&utm_source=e1ad5111,IT Jobs,data mining,gb,data mining,standard,False,False
Sightline & CTC Tech Manager,PricewaterhouseCoopers,"London, UK","Line of Service Tax Industry/Sector Not Applicable Specialism General Tax Consulting Management Level Specialist Job Description & Summary This role plays a critical part in driving market growth and technology adoption by acting as a bridge between innovation and execution. By supporting the onboarding and upskilling of clients and internal teams on the Sightline platform, delivering compelling demos, and enabling impactful sales conversations, this individual ensures our technology solutions …",59375.18,59375.18,,2025-04-28T17:11:05Z,https://www.adzuna.co.uk/jobs/details/5166834374?utm_medium=api&utm_source=e1ad5111,IT Jobs,data mining,gb,data mining,standard,False,False
Data Analyst- Celonis Experience,Opus Recruitment Solutions,"Farringdon, Central London","Skills- Celonis SQL Experience extracting and modelling data Process mining Experience Order to Cash/ Procure to Pay Data Engineering/ Analyst background (preferable not essential) Numerous mining engagements PowerBI, Tableau, dashboarding (all preferable not essential) Details- 3 month contract Outside IR35 Possible ad hoc travel to UAE (all expensed) If interested, please send a copy of your most recent CV to (url removed) and I will reach out. Please note this role cannot offer sponsorship",104000,130000,contract,2025-04-22T23:39:09Z,https://www.adzuna.co.uk/jobs/land/ad/5157000924?se=xiuNNe8o8BGFil_oKXcHCQ&utm_medium=api&utm_source=e1ad5111&v=04E120F354FF4155D9F062ED43B3B1025C6435B8,IT Jobs,data mining,gb,data mining,standard,False,False
CRM Manager,ASOS,"London, UK","Job Description The CRM Team forms part of the Customer Growth department and is responsible for taking customer, campaign and channel insights and using them to devise a global strategy for engaging, converting and retaining customers via targeted messaging across all touchpoints. Always thinking data-first, the CRM Manager will help to develop and deliver the customer-centric strategy across our owned marketing channels. They will do so by leveraging CRM insights, technologies and best practi…",45329.7,45329.7,,2025-04-10T02:02:14Z,https://www.adzuna.co.uk/jobs/details/5138012288?utm_medium=api&utm_source=e1ad5111,"PR, Advertising & Marketing Jobs",data mining,gb,data mining,standard,False,True
