title,company,location,description,salary_min,salary_max,contract_type,created,redirect_url,category,specialty,source_country,query,query_type,remote_friendly,international
Frontend Engineer,La Fosse,"South East London, London","Frontend Engineer | Hybrid | React | TypeScript | £70k La Fosse has partnered with an innovative AI-powered company specialising in distribution and logistics optimisation. We are seeking a dynamic Frontend Engineer with strong expertise in JavaScript to join our team. Key Responsibilities: Develop modern web applications using TypeScript, JavaScript, and React.js. Utilise RESTful interfaces and possess a strong understanding of API design. Ensure client-side performance and cross-browser compa…",70000,70000,permanent,2025-04-26T02:27:36Z,https://www.adzuna.co.uk/jobs/land/ad/5163267293?se=OqXiYu0o8BGT4w9x5LWCew&utm_medium=api&utm_source=e1ad5111&v=C1A731798EE0F54ED02AE69C225273B390F94F7E,IT Jobs,frontend,gb,frontend,standard,False,False
Lead Frontend Engineer,Assa Abloy,"Blythe Valley Park, Shirley","Can you bring your experience to our team at ASSA ABLOY, Biosite? Join our team based in Solihull, UK and enjoy a collaborative culture that empowers you to build a career you can be proud of. This is a fully remote UK role. Biosite is a tried and trusted partner for the construction industry, specialising in biometric access control and workforce management software solutions since 2010. Additional, integrated solutions for fire safety, site management software and site surveillance technology…",52269.79,52269.79,permanent,2025-04-15T17:55:29Z,https://www.adzuna.co.uk/jobs/land/ad/5145908355?se=OqXiYu0o8BGT4w9x5LWCew&utm_medium=api&utm_source=e1ad5111&v=AA20BA966A5AF05E3D1897B6450DC490980E4BBC,IT Jobs,frontend,gb,frontend,standard,True,False
Frontend Developer - VueJS,VANRATH,"Belfast, Northern Ireland","An opportunity for a talented developer to join a well-known insurance company in Belfast. This is the chance to lead the frontend development of an award-winning product. You have 3 years of experience with JavaScript and Vue Can work independently, but also a team player You have excellent communication and collaboration skills Experience with AWS is a bonus Experience contributing to server-side deployment is a bonus What's on offer Salary up to £60k Hybrid working Company pension Private he…",60000,60000,,2025-04-30T06:03:23Z,https://www.adzuna.co.uk/jobs/land/ad/5169935891?se=OqXiYu0o8BGT4w9x5LWCew&utm_medium=api&utm_source=e1ad5111&v=0BE829531902035CFF3A945A757173688E98E85C,IT Jobs,frontend,gb,frontend,standard,False,False
Frontend Developer,GradBay,"London, UK","Job Title: Shopify Developer Location: North London The Business An innovative UK based bakery that has dominated the market in the South of England for many years through it’s exceptional digital service and continues to grow through it’s ecommerce approach. The Job Our client is currently seeking a talented front end developer with experience working with Shopify to join our team. The ideal candidate will have a strong understanding of front end technologies such as HTML, CSS, and JavaScript,…",40958.77,40958.77,contract,2025-05-01T06:55:26Z,https://www.adzuna.co.uk/jobs/land/ad/5171938457?se=OqXiYu0o8BGT4w9x5LWCew&utm_medium=api&utm_source=e1ad5111&v=81920BA69B9548B68FBE396E54517857E4ADA0D9,IT Jobs,frontend,gb,frontend,standard,False,False
Frontend Designer,Zachary Daniels,"Fareham, Hampshire","Frontend Designer | up to £45k | Hybrid | 10% Pension Contribution | 36 Days Holiday including BH) | Life Insurance |Southampton | Not For Profit Organisation | Outdoor Sports An established and respected national organisation in the outdoor sports and recreational sector is seeking a highly skilled Frontend Designer to join its dynamic Digital Team. This hybrid position is based near Southampton, and offers an opportunity to lead the design and user experience of one of the UK's leading online…",37157.35,37157.35,,2025-04-30T15:57:59Z,https://www.adzuna.co.uk/jobs/land/ad/5170693352?se=OqXiYu0o8BGT4w9x5LWCew&utm_medium=api&utm_source=e1ad5111&v=CAD403835D5D1B8A1150A0EDDD8E544DB72A685C,IT Jobs,frontend,gb,frontend,standard,False,False
Frontend Developer,Zealous Agency,"Leeds, West Yorkshire","Zealous are proud to partner with a global packaging and design agency who are looking for a talented JavaScript Developer to join their Leeds Studio. Are you a JavaScript developer with a passion for building exceptional digital experiences? Do you want to work with renowned global brands in a collaborative, creative, and supportive environment? We’ve got the perfect opportunity for you. The Client A fast-growing digital agency based in the heart of Leeds , working with some of the world’s mos…",36039.94,36039.94,,2025-04-30T15:57:09Z,https://www.adzuna.co.uk/jobs/land/ad/5170688040?se=OqXiYu0o8BGT4w9x5LWCew&utm_medium=api&utm_source=e1ad5111&v=9877DCFCCEB10BA10B098DFE2F0A7A32689E4984,IT Jobs,frontend,gb,frontend,standard,False,True
Frontend Developer,GOAT Interactive,"London, UK","GOAT Interactive is the online division of the Editec Group. The objective of GOAT Interactive is to use the vast knowledge of Africa, combined with digital excellence, to ensure that all of our brands occupy the podium positions in the countries we operate in. With a growing presence in 22 countries, GOAT represents the largest group of gaming brands on the continent. To help us continue on our already impressive growth trajectory, we’re on the lookout for a Senior Customer Insight Analyst. Th…",64345.57,64345.57,,2025-04-30T15:55:51Z,https://www.adzuna.co.uk/jobs/land/ad/5170679060?se=OqXiYu0o8BGT4w9x5LWCew&utm_medium=api&utm_source=e1ad5111&v=A81FBC8B43E36A2D57A248C82F3F990F219DB111,IT Jobs,frontend,gb,frontend,standard,False,True
Frontend Developer,ECOM,"Manchester, Greater Manchester","Frontend Developer opportunity – Manchester – Up to 45k (DOE) – SaaS Company Overview: Join a thriving Manchester based software company that specialises in delivering B2B software applications tailored to their clients. Known for a robust engineering culture, this organisation has a rich history of talent, including well known Manchester tech professionals who make up the senior leadership team. The company has adopted modern technologies such as React, Next.js and Typescript for all new front…",46098.82,46098.82,,2025-04-21T03:50:39Z,https://www.adzuna.co.uk/jobs/land/ad/5154918266?se=OqXiYu0o8BGT4w9x5LWCew&utm_medium=api&utm_source=e1ad5111&v=B463242DEBF7D91C3AB956C70AA1E714DCE8AC99,IT Jobs,frontend,gb,frontend,standard,False,False
Frontend Developer,Square One Resources,"London, UK",Job Title: Angular Developer - London/Hybrid Location: Paddington office - Once a week Salary/Rate: Up to £630 a day Inside IR35 Start Date: May 2025 Job Type: 6-Month Contract with likely extension Job Summary: A global telecoms and media company in London is looking for an experienced Angular Developer for a 6-month rolling contract . The position requires on-site work in Paddington once a week. Key Responsibilities: Develop and maintain web applications using the Angular framework . Collabor…,56506.18,56506.18,contract,2025-05-02T08:13:20Z,https://www.adzuna.co.uk/jobs/land/ad/5175660721?se=OqXiYu0o8BGT4w9x5LWCew&utm_medium=api&utm_source=e1ad5111&v=684BD5D05E5B1D8AFAB8DBBD55BC9272290EB5B7,IT Jobs,frontend,gb,frontend,standard,False,True
Frontend Developer,Phantom Hire,"Birmingham, West Midlands","We are looking for a Frontend Developer to lead the development of high-end, visually stunning, and high-performing websites. This role is ideal for someone who thrives on crafting pixel-perfect, fast-loading, SEO-optimised websites that deliver seamless user experiences. While some back-end experience is beneficial, this is a frontend-first role , focusing primarily on responsive website development, headless CMS integration (ButterCMS, Contentful, etc.), WordPress customisation, and performan…",35787.28,35787.28,permanent,2025-04-02T16:18:08Z,https://www.adzuna.co.uk/jobs/land/ad/5124373241?se=OqXiYu0o8BGT4w9x5LWCew&utm_medium=api&utm_source=e1ad5111&v=22ED2D9A54D9E23BA0164CF18B7CCF27D5857009,IT Jobs,frontend,gb,frontend,standard,False,False
Frontend Developer,Arrows,"London, UK","Frontend Developer - React & React Native – Up to £500/day (Outside IR35) – Hybrid (London Bridge) – 2 month contract We’re a mission-driven tech company that builds products to help people make confident decisions about their finances and everyday services. From switching energy providers to finding the right mortgage, we use data, design, and smart tech to make complex choices simpler and more transparent for millions of users. Essential Skills: Strong commercial experience with React and Rea…",72368.45,72368.45,contract,2025-04-11T04:27:27Z,https://www.adzuna.co.uk/jobs/land/ad/5139961620?se=OqXiYu0o8BGT4w9x5LWCew&utm_medium=api&utm_source=e1ad5111&v=5AD3DD719E4F96AB2BC7B91397A5E26ADCF4380D,IT Jobs,frontend,gb,frontend,standard,False,False
Frontend Developer,Gravitas Recruitment Group  Ltd,"London, UK","Role : Front end engineer Salary range: 60-70k Location : UK Remote or hybrid optional (office in central London) Tech stack includes : Typescript, React, Expo, React Native. Current team size : 3 engineers (1 Senior FE, 2 BE) Front end engineer required on a permanent basis for a startup company in the coaching/mentoring space, small team, lots of autonomy and ownership working across their mobile and web app! Essentials for this role: 2 years experience React experience (React Native is a plu…",79254.41,79254.41,permanent,2025-05-04T08:52:39Z,https://www.adzuna.co.uk/jobs/land/ad/5179916404?se=OqXiYu0o8BGT4w9x5LWCew&utm_medium=api&utm_source=e1ad5111&v=096D1EF011C2831A8C78D9690C73981E5996E086,IT Jobs,frontend,gb,frontend,standard,True,False
Frontend Developer,Few&Far,"London, UK",Frontend Developer - Fintech Startup   The company: An early stage fintech startup who are building a product that's shaking up an outdated industry and streamlining the process for their users are looking for their 4th Engineer hire!  The role: As an early hire into the team you'll have the opportunity to take ownership of building out the platform and working closely with the Frontend Team Lead to bring projects to life. This will be a good fit if you're keen to become part of a small talente…,53622.74,53622.74,,2025-04-28T03:36:39Z,https://www.adzuna.co.uk/jobs/land/ad/5166321933?se=OqXiYu0o8BGT4w9x5LWCew&utm_medium=api&utm_source=e1ad5111&v=B0C2DF75B2CB40024EAE19A3C3B72347F277258E,IT Jobs,frontend,gb,frontend,standard,False,False
Frontend Developer,Digital Waffle,"Newcastle Upon Tyne, Tyne & Wear","Role: Frontend Developer Salary: £30,000 - £40,000 Location: Newcastle Upon Tyne Job Type: Permanent Calling all Newcastle based Frontend Developers. This one might be for you!I have partnered with a fantastic business who provide Digital solutions and have been doing so for the last 10 years.They are looking to add a Frontend Developer to their team after a continued, successful period of growth! Job Description: You will be working closely with and supporting the design team. you will also de…",37163.09,37163.09,permanent,2025-04-30T06:40:31Z,https://www.adzuna.co.uk/jobs/land/ad/5169970447?se=OqXiYu0o8BGT4w9x5LWCew&utm_medium=api&utm_source=e1ad5111&v=8996AA7B7E3D9B6CE35D1A82A45A85C3B70B07D7,IT Jobs,frontend,gb,frontend,standard,False,False
Frontend Developer,Searchability®,"Manchester, Greater Manchester","Mid – Senior level Frontend Developer - 4 days a week on site in Central Manchester JavaScript / Typescript / React / CSS HYBRID WORKING – OFFICE IN MANCHESTER – SALARY UP TO £45,000 DOE Based in Manchester – Hybrid working 4 days onsite per week Salary up to £45,000 – 25 days holiday plus bank holiday, pension, and other benefits. WHO ARE WE? We create software which provides workplaces with software for people management. Anything that might need tracking in the workplace we can produce softw…",45176.67,45176.67,,2025-04-28T03:36:46Z,https://www.adzuna.co.uk/jobs/land/ad/5166322704?se=OqXiYu0o8BGT4w9x5LWCew&utm_medium=api&utm_source=e1ad5111&v=1548F654ED98043BF91B85979D969D9ABD41178A,IT Jobs,frontend,gb,frontend,standard,False,False
Frontend Developer,Noir,"Newcastle Upon Tyne, Tyne & Wear","Frontend Developer - FinTech – Newcastle (Tech stack: Frontend Developer, React, TypeScript, Websockets, SignalR) I’m recruiting on behalf of a leading FinTech company in Newcastle that is looking for an experienced Frontend Developer to join their dynamic team. This is a fantastic opportunity to work in a fast-paced, innovative environment where you’ll have real ownership over technical products and projects from day one. The Role: As a Frontend Developer , you’ll play a key role in building a…",62608.05,62608.05,,2025-05-04T08:59:43Z,https://www.adzuna.co.uk/jobs/land/ad/5179919130?se=OqXiYu0o8BGT4w9x5LWCew&utm_medium=api&utm_source=e1ad5111&v=9B02BB916AA6ED48D1D28BA05A953DB2213A74D6,IT Jobs,frontend,gb,frontend,standard,False,False
Frontend Developer,Bounteous,"London, UK","Role: Frontend Developer (Angular) Location: Hybrid Position Type: Contract We are looking for an Angular/JavaScript Developer, who have experience in developing complex web-based, Front End applications. • The primary duties will center on creating and executing intricate screens and dashboards utilizing Angular (15), with proficiency in working on corresponding APIs (Node JS) being a significant asset. • Advanced knowledge on HTML, CSS/SCSS, Typescript and JavaScript • Attention to detail in …",37088.77,37088.77,contract,2025-04-28T03:41:59Z,https://www.adzuna.co.uk/jobs/land/ad/5166326544?se=OqXiYu0o8BGT4w9x5LWCew&utm_medium=api&utm_source=e1ad5111&v=4C6FBD72C6CA59BB4C6ACA151581239EBF551BD9,IT Jobs,frontend,gb,frontend,standard,False,False
Frontend Developer,Protein Works,"Liverpool, Merseyside","Front-end Developer Our current Front-End tech stack: NextJS  ReactJS Strapi headless CMS HTML/SCSS/LESS/Javascript Docker What you will do: Design, develop, and deploy scalable, high-performing, and maintainable frontend solutions. Take a key role within a small, fast-paced, and highly collaborative team, contributing to impactful projects from concept to delivery. Help shape the technical vision and strategy of a strong, forward-thinking engineering team. Work closely with cross-functional te…",49284.62,49284.62,,2025-04-28T03:28:33Z,https://www.adzuna.co.uk/jobs/land/ad/5166315776?se=OqXiYu0o8BGT4w9x5LWCew&utm_medium=api&utm_source=e1ad5111&v=18460605252B72A346ACD768B4230AA4AD78C68D,IT Jobs,frontend,gb,frontend,standard,False,False
Frontend Developer,Opus Recruitment Solutions,UK,"Job title: Front-End Game Developer (Animation  WebGL  PixiJS) Location: Remote UK Salary: £65,000 Tech: JavaScript, TypeScript, HTML, CSS, PixiJS, WebGL Opus have partnered with a company on the hunt for a Front-End Game Developer with a passion for animation and interactive experiences. If you live and breathe gaming, know your way around WebGL and JavaScript, and have a knack for creating smooth, high-performance visuals — this might be your next big move. Day to Day, you’ll be building enga…",53480.1,53480.1,,2025-04-28T03:41:54Z,https://www.adzuna.co.uk/jobs/land/ad/5166325793?se=OqXiYu0o8BGT4w9x5LWCew&utm_medium=api&utm_source=e1ad5111&v=30C417AF202A8EB35469DC42D3164B1DF37ADC6B,IT Jobs,frontend,gb,frontend,standard,True,False
Frontend Developer,Rise Technical,"London, UK","Front End Engineer London (Hybrid) £75,000 - £85,000  Equity  Progression An excellent opportunity awaits a Front-End Engineer with strong Next.js experience to join an AI Driven startup in a role offering cutting edge projects, personal development and progression opportunities, and equity included. This company is an exciting startup developing an AI-driven solution for the renewable energy sector. In this role, you'll join an established core team based in London, working to influence techni…",66562.52,66562.52,contract,2025-05-02T08:15:02Z,https://www.adzuna.co.uk/jobs/land/ad/5175662216?se=OqXiYu0o8BGT4w9x5LWCew&utm_medium=api&utm_source=e1ad5111&v=77A82544D11C90978F57D7AAE5B7F47110F078F4,IT Jobs,frontend,gb,frontend,standard,False,False
Frontend Developer,Referment,"London, UK","Referment is partnering with a technology-driven hedge fund looking for a passionate front-end developer to join their team and help build data-driven web applications that enhance investment decisions. This is a unique opportunity to work with cutting-edge UX and AI technologies in a dynamic, collaborative environment. Developers will work closely with a small, highly skilled team to deliver innovative, high-quality user experiences. The fund places a strong emphasis on rewarding talent, ensur…",61129.16,61129.16,,2025-04-28T03:43:58Z,https://www.adzuna.co.uk/jobs/land/ad/5166328680?se=OqXiYu0o8BGT4w9x5LWCew&utm_medium=api&utm_source=e1ad5111&v=6D57113E64BC6B2CD95FE4E0DEC296A12528A13F,IT Jobs,frontend,gb,frontend,standard,False,False
Frontend Developer,Vertus Partners,"London, UK","Join a global investment bank as a React Developer in the front office FX eTrading team. This is a high-impact role on a greenfield program to modernise and scale a real-time trading platform. You'll work on cutting-edge technology, solving complex problems in a fast-paced trading environment alongside world-class engineers. React Developer – FX eTrading | Global Investment Bank We are currently hiring an experienced React Developer to join the FX eTrading technology team within the front offic…",61990.75,61990.75,,2025-04-28T03:36:47Z,https://www.adzuna.co.uk/jobs/land/ad/5166322805?se=OqXiYu0o8BGT4w9x5LWCew&utm_medium=api&utm_source=e1ad5111&v=EB44701F873B300000459FE320BBA545E1C1AF12,IT Jobs,frontend,gb,frontend,standard,False,True
Frontend Developer,Leader Tech Global,"Leeds, West Yorkshire","Role - Junior Front End Dev Location - Hybrid/Leeds Salary - £45K ish depending on experience My client is several versions into a usable AI chatbot and has a requirement for a junior Front End to assist the Full Stack/Team Lead as launch date approaches. It's really just as simple as that. If you've got a couple of years industry experience, have a solid background using: Flutter Java Kotlin Then I'd be interested in speaking to you. Additionally, ideally you'll have experience working in a st…",45313.24,45313.24,,2025-04-28T03:28:32Z,https://www.adzuna.co.uk/jobs/land/ad/5166315652?se=OqXiYu0o8BGT4w9x5LWCew&utm_medium=api&utm_source=e1ad5111&v=7D04107153E7C7E72C2976ECC41968BDA9855ED3,IT Jobs,frontend,gb,frontend,standard,False,False
Frontend Developer,Talent Connect Group,"London, UK",New Role UK - Senior Front End Engineer ( £90-£140k )  Equity   Candidate must already be based in UK Talent Connect Group (TCG) have just partnered with an exciting AI start-up working in the education space. They are looking for the best of the best when it comes to tech talent to build their team. They are looking hire high achievers with a entrepreneurial mind set! Hybrid - 3 days on site Central London Start - ASAP Salary - £90-140k  Equity Essentials - React - Typescript - Start-up expe…,62707.96,62707.96,,2025-05-01T06:53:19Z,https://www.adzuna.co.uk/jobs/land/ad/5171927343?se=OqXiYu0o8BGT4w9x5LWCew&utm_medium=api&utm_source=e1ad5111&v=A0161EACC5A424248B57D74C811D1C6BF23DDE65,IT Jobs,frontend,gb,frontend,standard,False,False
Frontend Developer,MRJ Recruitment,"Manchester, Greater Manchester","Front-End Developer £50,000 – £55,000 | Hybrid (2 days in Manchester office) | Flexi Start | Permanent We're working with a trailblazing tech company that's redefining digital experiences—and they’re on the lookout for a talented Front-End Developer to join their growing team. With a recent migration to a purpose-built platform, the foundations are in place for rapid innovation. If you’re driven by building performant, intuitive front-ends and want your work to influence millions, this is your …",63562.33,63562.33,permanent,2025-04-28T03:28:33Z,https://www.adzuna.co.uk/jobs/land/ad/5166315740?se=OqXiYu0o8BGT4w9x5LWCew&utm_medium=api&utm_source=e1ad5111&v=60BCDE213786B1A6B7F2571C75095B5DAF55381D,IT Jobs,frontend,gb,frontend,standard,False,False
Frontend Developer,Computappoint,"London, UK",React Developer - Career Growth Opportunity  Salary - Up to £70k Location - City of London Work Arrangement - 5 days onsite during probation – Hybrid (3 days in office) post-probation Exciting Opportunity for Front-End Specialists! Are you a React wizard looking to expand your skillset into full stack development? We have an incredible opportunity for talented Front-End Developers who want to grow their careers while making an impact! We're seeking a React Developer with strong front-end skills…,67597.64,67597.64,,2025-04-28T03:36:49Z,https://www.adzuna.co.uk/jobs/land/ad/5166322999?se=OqXiYu0o8BGT4w9x5LWCew&utm_medium=api&utm_source=e1ad5111&v=828F3BEAE7538448056722AB5E3B49FC2DFEB2FB,IT Jobs,frontend,gb,frontend,standard,False,False
Senior Frontend Developer,Burns Sheehan,"London, UK","Senior Frontend Engineer - Join a growing HealthTech  Up to £100,000 Hybrid working - 2 days a week onsite Vue.js or React.js & TypeScript experience We're partnered with a Series A HealthTech business in London who are currently looking for a Senior Frontend Engineer to join their team as they continue to build new products for their growing customer base. They have successfully supported their customers with their everyday health and well-being, which is continuing to have a positive impact a…",51383.71,51383.71,,2025-05-04T08:48:59Z,https://www.adzuna.co.uk/jobs/land/ad/5179915967?se=OqXiYu0o8BGT4w9x5LWCew&utm_medium=api&utm_source=e1ad5111&v=529AF27A18B2E52D7E44840A08251544175916E9,IT Jobs,frontend,gb,frontend,standard,False,False
Senior Frontend Developer,SAGE GROUP PLC,"Newcastle Upon Tyne, Tyne & Wear","The Senior Frontend Software Engineer is responsible for building, enhancing and maintaining products and/or systems to enable Sage’s business plans and long-term objectives using the identified architecture. This role is hybrid three days a week in the office in Newcastle. The Senior Frontend Software Engineer will contribute and help lead in the design, development and delivery of high-quality products and/or systems and services that exceed customers’ or business partners’ expectations and w…",48712.49,48712.49,,2025-03-18T13:24:24Z,https://www.adzuna.co.uk/jobs/land/ad/5098887498?se=OqXiYu0o8BGT4w9x5LWCew&utm_medium=api&utm_source=e1ad5111&v=5BCE5D7623B4C4A44B316A301491BA57C766D287,IT Jobs,frontend,gb,frontend,standard,False,False
Frontend Developer,Prism Digital,"London, UK","Front-End Engineer | React, Next.js, Tailwind | Web3/Crypto Innovation Hub Step into the engine room of one of London’s most exciting Web3 gaming ventures. This is a chance to build future-defining crypto gaming products, from live casinos to blockchain lotteries, backed by the financial firepower of a hedge fund but with all the energy of a creative startup. You’ll join a small (currently 8 people, growing to 20 over the next 12–18 months), highly technical team incubating blockchain-native en…",59224.35,59224.35,,2025-05-02T08:15:17Z,https://www.adzuna.co.uk/jobs/land/ad/5175662351?se=OqXiYu0o8BGT4w9x5LWCew&utm_medium=api&utm_source=e1ad5111&v=E6D0E5F932AF1E144912FEF6838F65C15827D4D8,IT Jobs,frontend,gb,frontend,standard,False,False
Frontend Developer,P Louise,"Stockport, Greater Manchester","Front End Developer Location: Stockport (in Office) Full time, permanent About Us: We are a growing eCommerce beauty business based in Manchester, expanding into the US. We are looking for a talented Front-End Developer with expertise in Shopify to join our team and enhance our online shopping experience. This is a fantastic opportunity to work on an established Shopify-based website and app, contributing to the growth of a dynamic brand. Role Overview: As a Front-End Developer, you will be res…",28912.85,28912.85,permanent,2025-05-04T08:48:58Z,https://www.adzuna.co.uk/jobs/land/ad/5179915945?se=OqXiYu0o8BGT4w9x5LWCew&utm_medium=api&utm_source=e1ad5111&v=2D9C76903BFCFAA2B509EC093DAFF569E6910761,IT Jobs,frontend,gb,frontend,standard,False,False
Senior Frontend Developer,Harvey Nash,"London, UK","Senior Frontend Developer - React, UI, Typescript - Sought by leading Financial Services - Permanent Job Requirements: Develop, test, and maintain components for the UI with React. Build your technical and communication skills so that you can mentor and teach others, talk with our customers, and report to stakeholders. Cooperate with our designer, stakeholders, and wider team to understand requirements. Participate in all aspects of the project life cycle, from idea generation to specification …",56846.48,56846.48,permanent,2025-04-24T16:31:29Z,https://www.adzuna.co.uk/jobs/land/ad/5160249245?se=OqXiYu0o8BGT4w9x5LWCew&utm_medium=api&utm_source=e1ad5111&v=5040D3FE753546CC6A532B938D9E722CCD5B6751,IT Jobs,frontend,gb,frontend,standard,False,False
